url,title,description,price,area,address,Mã tin,Hướng,Phòng ăn,Loại tin,Đường trước nhà,Nhà bếp,Loại BDS,Pháp lý,Sân thượng,Chiều ngang,Số lầu,Chổ để xe hơi,Chiều dài,Số phòng ngủ,Chính chủ
https://alonhadat.com.vn/ban-nha-pho-phan-van-tri-ngo-thong-rong-3m-30m-2pn-3-5-ty-13582830.html,"Bán nhà phố Phan Văn Trị, ngõ thông rộng 3m, 30m, 2PN, 3.5 tỷ","Tọa lạc tại vị trí đắc địa của phố Phan Văn Trị tiếp giáp các tuyến phố Đoàn Thị Điểm, Tôn Đức Thắng, An Trạch, Cát Linh,... ba bước sang Văn Miếu Quốc Tử Giám, khu vực trung tâm quận Đống Đa an sinh đỉnh tiện ích ngập tràn.
Diện tích rộng, mặt tiền lớn, chủ xây đã được 1 thời gian, vẫn có thể ở tạm, chủ xác định bán đất tặng nhà, chủ mới mua về xây căn 6 tầng vừa ở vừa kinh doanh giá trị tăng gấp bội.
Sổ đỏ đẹp - cất két - sẵn sàng giao dịch.
Giá: 3 tỷ 5 ( thương lượng mạnh)
Liên hệ ngay em Tùng chuyên nhà đẹp giá tốt quận Đống Đa.","3,5 tỷ",30 m2,"Phố Đoàn Thị Điểm, Phường Quốc Tử Giám, Quận Đống Đa, Hà Nội",13582830,_,True,Cần bán,1m,True,Nhà trong hẻm,Sổ hồng/ Sổ đỏ,True,4m,3,True,"7,25m",2,---
https://alonhadat.com.vn/ban-nha-chua-boc-o-to-gan-nha-dep-44m2x4t-chi-5-35-ty-13608843.html,"Bán nhà Chùa Bộc, ô tô gần, nhà đẹp, 44m2x4T chỉ 5.35 tỷ","- Vị trí nhà thuộc khu vực trung tâm quận Đống Đa, tiếp giáp các tuyến phố trọng điểm Thái Hà, Tây Sơn, Nguyễn Ngọc Doãn, Phạm Ngọc Thạch, Hồ Đắc Di, Nguyễn Lương Bằng...giao thông vô cùng thuận lợi. Trước nhà thoáng sáng, ô tô cách nhà 20m.
- Chủ nhà xây dựng tâm huyết 4 tầng 4 ngủ đầy đủ công năng sử dụng, nhà ở cực lộc, chủ đã sở hữu nhiều bất động sản từ khi ở.
- Sổ chính chủ không lỗi vuông vắn, giao dịch ngay
- giá: 5.35 tỷ có thương lượng
- Liên hệ ngay Mr Tùng chuyên nhà đẹp Đống Đa để xem nhà miễn phí
- Miễn TG-MG","5,35 tỷ",45 m2,"Phố Chùa Bộc, Phường Quang Trung, Quận Đống Đa, Hà Nội",13608843,_,---,Cần bán,2m,---,Nhà trong hẻm,Sổ hồng/ Sổ đỏ,---,"3,6m",4,---,12m,4,---
https://alonhadat.com.vn/ban-nha-hoang-cau-o-to-tranh-via-he-nha-dep-42m2x4t-chi-nhinh-8-ty-13602871.html,"Bán nhà Hoàng Cầu, ô tô tránh, vỉa hè, nhà đẹp, 42m2x4T chỉ nhỉnh 8 tỷ","- Tọa lạc trên con phố Hoàng Cầu, trung tâm nhất nhì quận Đống Đa, tiếp giáp các còn Phố VIP của Ô chợ Dừa: Trần Quang Diệu, Đông Các, Nguyễn Hy Quang, Nguyễn Phúc Lai, Nguyễn Lương Bằng, Tôn Đức Thắng, Hào Nam, Đê La Thành, Thái Hà...vị trí cực kì thuận tiện giao thông đi lại thoáng đãng. An sinh đỉnh cao, nhà gần hồ, trường, chợ, Công Viên, Vườn Hoa... tiện ích bạt ngàn.
Trước nhà ô tô tránh xe máy, vỉa hè rộng, nhà nhiều ánh sáng, thoáng đãng
- Thiết kế nhà 4 tầng, 4 ngủ đầy đủ công năng sử dụng.
- Sổ đỏ chính chủ, giao dịch ngay.
- Giá: 8.5 tỷ. có thương lượng
- Chủ nhà Chị Quỳnh ở cực phát lộc nay đã sở hữu nhiều BĐS nên bán bớt
- Liên hệ ngay Mr Tùng chuyên nhà đẹp Đống Đa để xem nhà miễn phí
- Miễn TG-MG","8,5 tỷ",42 m2,"Phố Hoàng Cầu, Phường Ô Chợ Dừa, Quận Đống Đa, Hà Nội",13602871,_,---,Cần bán,5m,---,Nhà trong hẻm,Sổ hồng/ Sổ đỏ,---,"3,5m",4,---,12m,4,---
https://alonhadat.com.vn/ban-nha-hoang-cau-oto-gan-gan-ho-hoang-cau-nha-dep-55m2x4t-chi-7ty-13602885.html,"Bán nhà Hoàng Cầu, ôtô gần, gần hồ Hoàng Cầu, nhà đẹp, 55m2x4T, chỉ 7tỷ","- Nhà thuộc vị trí đỉnh nhất nhì quận Đống Đa, ngay cạnh phố Nguyễn Phúc Lai, Mai Anh Tuấn, Thái hà, Nam Đồng, Hào Nam, Ô chợ Dừa, Nguyễn Hy Quang, Đông Các...vài phút lên phố cổ, giao thông thuận tiện đi khắp các ngả, nhà ra Hồ Đống Đa cực gần. Tiện ích quanh nhà đầy đủ, gần Trường, chợ, UBND Quận Đống Đa, vườn hoa Trần Quang Diệu...
- trước nhà thoáng, ngõ 3m, hàng xóm dân trí cao
- Nhà thiết kế đẹp, chắc chắn và cực rộng với 4 tầng, 4 ngủ đầy đủ công năng sử dụng.
- sổ đỏ chính chủ, sẵn sàng giao dịch ngay
- Chủ nhà Chú Long ở cực lộc đã sở hữu nhiều bất động sản nay bán đi để lên chung cử ở với con
- Giá: 7 tỷ có thương lượng
- Liên hệ ngay Mr Tùng chuyên nhà đẹp Đống Đa để xem nhà miễn phí
- Miễn TG-MG",7 tỷ,55 m2,"Phố Hoàng Cầu, Phường Ô Chợ Dừa, Quận Đống Đa, Hà Nội",13602885,_,---,Cần bán,3m,---,Nhà trong hẻm,Sổ hồng/ Sổ đỏ,---,"6,4m",4,---,"8,5m",4,---
https://alonhadat.com.vn/ban-nha-phuong-mai-via-he-oto-tranh-kinh-doanh-6pn-40m2x4t-6-7ty-13610036.html,"Bán nhà Phương Mai, vỉa hè, ôtô tránh, kinh doanh, 6PN, 40m2x4T, 6.7tỷ","- Vị trí nhà thuộc con phố VIP Phương Mai trung tâm quận Đống Đa, tiếp giáp Quận Hai Bà Trưng, ngay đại học Kinh Tế Quốc Dân, Đại học Bách Khoa, Đại Học Xây Dựng. Gần Công Viên Thống Nhất, Hồ Ba Mẫu, Bệnh viện Bạch Mai, tiếp giáp các con phố VIP Xã Đàn, Phạm Ngọc Thạch, Lương Đình Của, Lê Duẩn...đi đâu cũng thuận tiện, an sinh đỉnh cao. tiện ích không thiếu thứ gì.
- Trước nhà buôn bán sầm uất đủ mọi loại hình kinh doanh, ô tô tránh, vỉa hè
- Nhà thiết kế khung cột bê tông chắc chắn, 4 tầng, 6 ngủ đầy đủ công năng
- Sổ đỏ chính chủ giao dịch ngay
- Chị Kim chủ nhà ở cực lộc, đã mua biệt thự nên muốn bán bớt
- Giá: 6.7 tỷ (thương lượng mạnh)
- Liên hệ ngay mr Tùng chuyên nhà đẹp Thanh Xuân để xem nhà miễn phí
- Miễn TG-MG","6,7 tỷ",40 m2,"Phố Phương Mai, Phường Phương Mai, Quận Đống Đa, Hà Nội",13610036,_,---,Cần bán,4m,---,Nhà trong hẻm,Sổ hồng/ Sổ đỏ,---,"3,2m",4,---,13m,6,---
https://alonhadat.com.vn/ban-nha-pho-nguyen-luong-bang-mat-ngo-thong-rong-o-vip-kd-70m-4-pn-7-5-ty-13632156.html,"Bán nhà phố Nguyễn Lương Bằng, mặt ngõ thông, rộng, ở vip, Kd,  70m, 4 PN, 7.5 tỷ","Tọa lạc tại con ngõ đẹp nhất nhì phố Nguyễn Lương Bằng tiếp giáp các tuyến phố Khương Thượng, Trường Chinh, Chùa Bộc, Tây Sơn, Thái Hà,... gần nhà 3 trường đại học lớn nhất Thủ Đô Hà Nội: Công Đoàn, Thủy Lợi, Ngân Hàng.
Nằm ngay mặt ngõ, diện tích rộng, chủ tự xây khung cột chắc chắn, tổng 4 ngủ cực rộng, thoáng sáng, chủ mới chỉ việc xách vali về ở ngay. Nhà phù hợp vừa ở vừa kinh doanh, khu vực đất vượng khí làm ăn rất có lộc.
Chủ nhà chú Minh hiện muốn phát triển kinh doanh cần bán nhanh để chuyển ra mặt phố.
Sổ dỏ chính chủ - sẵn sàng giao dịch.
Giá: 7 tỷ 5 ( thương lượng mạnh)
Liên hệ ngay em Tùng chuyên nhà đẹp giá tốt quận Đống Đa","7,5 tỷ",70 m2,"Phố Tây Sơn, Phường Quang Trung, Quận Đống Đa, Hà Nội",13632156,_,True,Cần bán,3m,True,Nhà trong hẻm,Sổ hồng/ Sổ đỏ,True,7m,4,True,10m,4,---
https://alonhadat.com.vn/ban-nha-pho-tay-son-mat-ngo-thong-rong-o-vip-kd-70m-4-pn-7-5-ty-13632084.html,"Bán nhà phố Tây Sơn, mặt ngõ thông, rộng, ở vip, Kd,  70m, 4 PN, 7.5 tỷ","Tọa lạc tại con ngõ đẹp nhất nhì phố Tây Sơn tiếp giáp các tuyến phố Khương Thượng, Trường Chinh, Chùa Bộc, Nguyễn Lương Bằng, Thái Hà,... gần nhà 3 trường đại học lớn nhất Thủ Đô Hà Nội: Công Đoàn, Thủy Lợi, Ngân Hàng.
Nằm ngay mặt ngõ, diện tích rộng, chủ tự xây khung cột chắc chắn, tổng 4 ngủ cực rộng, thoáng sáng, chủ mới chỉ việc xách vali về ở ngay. Nhà phù hợp vừa ở vừa kinh doanh, khu vực đất vượng khí làm ăn rất có lộc.
Chủ nhà chú Minh hiện muốn phát triển kinh doanh cần bán nhanh để chuyển ra mặt phố.
Sổ dỏ chính chủ - sẵn sàng giao dịch.
Giá: 7 tỷ 5 ( thương lượng mạnh)
Liên hệ ngay em Tùng chuyên nhà đẹp giá tốt quận Đống Đa","7,5 tỷ",70 m2,"Phố Tây Sơn, Phường Quang Trung, Quận Đống Đa, Hà Nội",13632084,_,True,Cần bán,3m,True,Nhà trong hẻm,Sổ hồng/ Sổ đỏ,True,7m,4,True,10m,4,---
https://alonhadat.com.vn/ban-nha-dep-hoang-cau-o-to-cuc-gan-ngo-thong-45m2x4t-chi-6-9-ty-13643690.html,"Bán nhà đẹp Hoàng Cầu, Ô tô cực gần, ngõ thông, 45m2x4T chỉ 6.9 tỷ","- Vị trí quá đẹp, nằm trên con phố hiếm nhà bán và nhu cầu mua ở rất cao, là nhà dân xây KCBT chắc chắn, là lô góc 2 mặt thoáng vĩnh viễn. Trước nhà ô tô 4 chỗ lùi cửa, đúng 15m ra ô tô tránh và dừng đỗ ngày đêm, đi vài bước chân ra mặt phố, con phố vip an sinh đỉnh cao tiện ích ngập tràn.
- Nhà dân xây thiết kế khung cột bê tông vững chắc, trên nền diện tích rộng, chủ xây tâm huyết bố trí cực hợp lý 4 tầng 4 ngủ đầy đủ công năng sử dụng.
- Sổ đỏ chính chủ, giao dịch ngay
- Chủ nhà A Hiếu ở cực lộc, đã sở hữu Biệt thự Licogi
- Liên hệ ngay mr Tùng chuyên nhà đẹp Đống Đa xem nhà miễn phí
- Miễn TG-MG","6,9 tỷ",50 m2,"Phố Hoàng Cầu, Phường Ô Chợ Dừa, Quận Đống Đa, Hà Nội",13643690,_,---,Cần bán,3m,---,Nhà trong hẻm,Sổ hồng/ Sổ đỏ,---,"3,6m",4,---,"14,5m",4,---
https://alonhadat.com.vn/ban-nha-ho-ba-mau-o-to-tranh-via-he-an-sinh-dinh-90m2x7t-thang-may-25-ty-13625416.html,"Bán nhà Hồ Ba Mẫu, ô tô tránh, vỉa hè, an sinh đỉnh 90m2x7T thang máy, 25 tỷ","- vị trí nhà thuộc khu vực hiếm nhà bán, tọa lạc trên con phố trọng điểm giao thông tấp nập, giao cắt Đống Đa, Thanh Xuân, Hai Bà Trưng, Hoàn Kiếm. nhà ngay cạnh Hồ Ba Mẫu, an sinh đỉnh cao, tiện ích ngập tràn. Trước nhà thoáng đãng, không khí mát mẻ quanh năm. ô tô dừng đỗ ngày đêm, vỉa hè cực rộng.
- Phù hợp làm văn phòng công ty, kinh doanh, ở, nghỉ dưỡng.

- Sổ chính chủ giao dịch ngay

- Giá: 25 tỷ có thương lượng

- Chủ nhà anh Nam ở cực vượng, đã sở hữu nhiều Bất động sản.

- Liên hệ ngay mr Tùng chuyên nhà đẹp Đống Đa để xem nhà miễn phí

- Miễn TG-MG",25 tỷ,90 m2,"Đường Hồ Ba Mẫu, Phường Kim Liên, Quận Đống Đa, Hà Nội",13625416,_,---,Cần bán,9m,---,"Biệt thự, nhà liền kề",Sổ hồng/ Sổ đỏ,---,5m,7,---,18m,6,---
https://alonhadat.com.vn/mat-pho-pho-hue-cuc-hiem-kinh-doanh-dinh-via-he-o-to-tranh-44m2-22-ty-13625382.html,"Mặt phố Phố Huế, cực hiếm, kinh doanh đỉnh, vỉa hè, ô tô tránh, 44m2, 22 tỷ","- tọa lạc tại con phố cực Hiếm nhà bán, nhà nằm trên mặt phố Phố Huế, tuyến phố cực đẹp dẫn thẳng ra Hồ Gươm thơ mộng. phía đầu giao cắt Đại Cồ Việt - Trần Khát Chân, giao thông cực kì thuận tiện với làn 1 chiều to rộng, đẳng cấp giao thông thủ đô, cực kì đảm bảo. nhà thuộc mặt phố nên kinh doanh buôn bán loại hình nào cũng đẳng cấp.

- Nhà xác định bán đất và vị trí - khách mua nhà đem theo tiền để thích là cọc luôn

- Sổ vuông vắn, giao dịch ngay

- Liên hệ ngay mr Tùng xem nhà miễn phí

- Miễn TG-MG",22 tỷ,44 m2,"Phố Huế, Phường Phố Huế, Quận Hai Bà Trưng, Hà Nội",13625382,_,True,Cần bán,18m,True,Nhà mặt tiền,Sổ hồng/ Sổ đỏ,True,"3,6m",4,True,"12,5m",3,---
https://alonhadat.com.vn/ban-nha-quan-nhan-o-to-do-cua-gan-ho-105m2x5t-dan-xay-10-5-ty-13624824.html,"Bán nhà quan nhân, ô tô đỗ cửa, gần hồ, 105m2x5T, dân xây 10.5 tỷ","- vị trí nhà cực đẹp thuộc trung tâm quận Thanh Xuân, Quan Nhân, giáp Chính Kinh, Royal city, cự lộc, Vũ Trọng Phụng, Hoàng Đạo Thúy, Nhân Hòa...giao thông vô cùng thuận tiện, các tiện ích đỉnh cao xung quanh nhà rất nhiều. Trước nhà là hồ, view cực đẹp.

- nhà thiết kế 5 tầng phong cách cổ điển, chủ mới chỉ cần về ở

- Sổ đỏ chính chủ, giao dịch ngay.
- liên hệ ngay mr Tùng xem nhà miễn phí
- Miễn TG-MG","10,5 tỷ",105 m2,"Phố Quan Nhân, Phường Nhân Chính, Quận Thanh Xuân, Hà Nội",13624824,_,---,Cần bán,"3,5m",---,Nhà trong hẻm,Sổ hồng/ Sổ đỏ,---,5m,5,---,20m,8,---
https://alonhadat.com.vn/ban-toa-nha-van-phong-cuc-dep-hao-nam-o-to-60m2x7t-chi-17-ty-13619235.html,"Bán tòa nhà Văn Phòng cực đẹp Hào Nam, ô tô, 60m2x7T chỉ 17 tỷ","- vị trí nhà cực đẹp trên con Phố sầm uất bậc nhất Đống Đa, nhà ra phố cực gần, ô tô đỗ cửa, vào nhà, kinh doanh văn phòng tuyệt đẹp, vị trí giao thông đắc địa bậc nhất Hà Nội lên Cát Linh, Ô Chợ Dừa, Giảng võ rất thuận tiện, cực nhanh. Tiện ích an sinh quanh nhà rất nhiều, không thiếu gì.

- Nhà thiết kế chắc chắn, 7 tầng thang máy chạy vù vù, công năng đầy đủ, phù hợp làm văn phòng công ty, Kinh doanh văn phòng

- Sổ đỏ vuông vắn giao dịch ngay

- Chị Tâm chủ nhà ở cực vượng, con cái thành đạtm đã sở hữu biệt thự phố cổ.

- giá chào: 17 tỷ có thương lượng

- Liên hệ ngay Mr Tùng Chuyên nhà đẹp Đống Đa để xem nhà miễn phí

- Miễn TG-Mg",17 tỷ,60 m2,"Phố Hào Nam, Phường Cát Linh, Quận Đống Đa, Hà Nội",13619235,_,---,Cần bán,"4,5m",---,Nhà trong hẻm,Sổ hồng/ Sổ đỏ,---,6m,7,---,10m,6,---
https://alonhadat.com.vn/ban-nha-dep-nguyen-hy-quang-via-he-o-to-tranh-thang-may-80m2-31-ty-13619212.html,"Bán nhà đẹp Nguyễn Hy Quang, vỉa hè, ô tô tránh, thang máy, 80m2, 31 tỷ","- Vị trí nhà thuộc con phố VIP nhất nhì Quận Đống Đa, tiếp giáp các tuyến phố giao thông trọng điểm: Nguyễn Lương Bằng, Tôn Đức Thắng, Ô Chợ Dừa, Xã Đàn, Hoàng Cầu, Hào Nam... đi lại cực kì thuận tiện, hàng xóm quanh nhà toàn dân kinh doanh sở hữu các thương hiệu lớn, hàng xóm văn minh dân trí, cao cấp. an ninh cực kì đảm bảo. Tiện ích đầy đủ không thiếu thứ gì. Trước nhà ô tô tránh nhau, vỉa hè rộng sạch sẽ.
- Nhà xây khung cột bê tông, thang máy chạy vù vù, đảm bảo yếu tố kinh doanh vừa ở luôn cực kì thuận tiện. Phù hợp cho khách hàng làm thương hiệu lớn với mặt tiền rộng đảm bảo khách thích.
- Sổ đỏ vuông vắn giao dịch ngay
- Liên hệ ngay Mr Tùng chuyên nhà đẹp Đống Đa để xem nhà miễn phí
- Miễn TG-MG",31 tỷ,80 m2,"Phố Nguyễn Hy Quang, Phường Ô Chợ Dừa, Quận Đống Đa, Hà Nội",13619212,_,True,Cần bán,6m,True,Nhà mặt tiền,Sổ hồng/ Sổ đỏ,True,4m,5,True,20m,5,---
https://alonhadat.com.vn/ban-nha-dep-gan-le-trong-tan-oto-5m-noi-that-tien-ty-60m2x5t-7-5ty-13651539.html,"Bán nhà đẹp gần Lê Trọng Tấn, ôtô 5m, nội thất tiền tỷ, 60m2x5T, 7.5tỷ","- Vị trí nhà thuộc Trung tâm giao thông giao cắt Quận Thanh Xuân, Hoàng Mai, Hai Bà Trưng, tiếp giáp các tuyến phố quan trọng như Trường Chinh, Tôn Thất Tùng, Chùa Bộc, Tam Khương, Nguyễn Lân...đi đâu cũng tiện lợi, gần trường Đại Học Y Hà Nội, Vincom Phạm Ngọc Thạch, tiện ích đầy đủ, an sinh đỉnh cao.
- Nhà thiết kế cực đẹp trên nền diện tích cực rộng, mới xây chỉ ở được khoảng 2 năm. gồm 4 phòng ngủ đầy đủ công năng sử dụng
- Sổ đỏ vuông vắn cất két sẵn sàng giao dịch ngay
- Chủ nhà anh Kiên ở cực vượng, phát đã sở hữu liền kề Nguyễn Trãi.
- Giá: 7.5 tỷ có thương lượng
- Liên hệ ngay mr Tùng chuyên nhà đẹp Thanh Xuân, Đống Đa để xem nhà miễn phí
- Miễn TG-MG","7,5 tỷ",60 m2,"Phố Lê Trọng Tấn, Phường Khương Mai, Quận Thanh Xuân, Hà Nội",13651539,_,---,Cần bán,3m,---,Nhà trong hẻm,Sổ hồng/ Sổ đỏ,---,4m,5,---,15m,4,---
https://alonhadat.com.vn/ban-nha-dep-ho-ba-mau-o-to-tranh-23p-dong-tien-165tr-thang-100m2x7t-24-ty-13649304.html,"Bán nhà đẹp Hồ Ba Mẫu, ô tô tránh, 23P, dòng tiền 165tr/tháng, 100m2x7T, 24 tỷ","- Vị trí cực đỉnh, khu vực trung tâm giao cắt quận Đống Đa, Hai Bà Trưng, Hoàn Kiếm, cực hiếm nhà bán, nhà cách Hồ Ba Mẫu chỉ vài bước chân. an sinh đỉnh cao, tiện ích đầy đủ, nhu cầu cho thuê lúc nào cũng sẵn, nhà luôn trong trạng thái full phòng .
- Thiết kế vô cùng hiện đại, nhiều thoáng với 24 phòng cho thuê dòng tiền hàng tháng 165 tr chưa dịch vụ, 1 năm 2 tỷ, đầy đủ công năng tiện ích.
- Sổ đỏ đẹp, giao dịch ngay
- Anh Liêm chủ nhà ở cực lộc đã mua nhiều biệt thự.
- Giá: 24 tỷ có thương lượng
- Liên hệ ngay mr Tùng chuyên nhà đẹp Đống Đa xem nhà miễn phí
- Miễn TG-MG",24 tỷ,100 m2,"Đường Hồ Ba Mẫu, Phường Kim Liên, Quận Đống Đa, Hà Nội",13649304,_,---,Cần bán,8m,---,Nhà trong hẻm,Sổ hồng/ Sổ đỏ,---,6m,7,---,16m,24,---
https://alonhadat.com.vn/ban-nha-hoang-dao-thuy-cho-thue-ccmn-27p-dong-tien-200tr-thang-110m2x7t-21-5-ty-13649207.html,"Bán nhà Hoàng Đạo Thúy, cho thuê CCMN,  27P, Dòng tiền 200tr/tháng, 110m2x7T, 21.5 tỷ","- Vị trí nhà thuộc khu vực vip, trung tâm giao thông, giao cắt Cầu Giấy, Thanh Xuân, tiếp giáp nhiều tuyến phố giao thông quan trọng như Lê Văn Lương, Hoàng Đạo Thúy, Vũ Trọng Phụng, Quan Nhân...cạnh tổ hợp khu văn phòng bậc nhất Cầu giấy Thanh Xuân, hứa hẹn cực nhiều khách thuê nhà. Tiện ích không thiếu bất cứ thứ gì.
- Nhà thiết kế dạng căn hộ cho thuê, nhân viên Văn Phòng, gia đình cực VIP, tổng 27 phòng full đồ, dòng tiền 200tr/ tháng, 2.4 tỷ/năm lãi suất đã hơn ngân hàng. giữ tiền, giữ đất đỉnh cao
- Sổ phân lô vuông trước sau mặt tiền miên man cực khủng cất két giao dịch tíc tắc
- Chủ nhà Anh Hùng ở cực lộc sở hữu tổ hợp Chung cư mini cần bán bớt
- Liên hệ ngay mr Tùng chuyên nhà đẹp Thanh Xuân để xem nhà miễn phí
- Miễn TG-MG","21,5 tỷ",110 m2,"Đường Hoàng Đạo Thúy, Phường Trung Hòa, Quận Cầu Giấy, Hà Nội",13649207,_,---,Cần bán,"2,5m",---,Nhà trong hẻm,Sổ hồng/ Sổ đỏ,---,"7,8m",7,---,14m,27,---
https://alonhadat.com.vn/ban-nha-pho-hoang-ngan-2-mat-ngo-10m-o-to-tranh-nha-dep-dan-xay-75m-4pn-8-5-ty-13698458.html,"Bán nhà phố Hoàng Ngân, 2 mặt ngõ, 10m ô tô tránh, nhà đẹp, dân xây, 75m 4PN, 8.5 tỷ","Tọa lạc ngay con ngõ đẹp nhất phố Hoàng Ngân tiếp giáp các tuyến phố Lê Văn Lương, Nhân Hòa, Quan Nhân, Giáp Nhất, Nguyễn Khang, Trần Duy Hưng,… khu vực dân trí cao, an sinh đỉnh.
Diện tích rộng, mặt tiền lớn, chủ nhà nhờ em trai là kiến trúc sư tự tay thiết kế, xây dựng chắc chắn, tỉ mỉ, tâm huyết, tổng 4 ngủ rộng, Gothoáng sáng, chủ mới chỉ việc xách vali về ở ngay. Nhà cách mặt ngõ 21 Lê Văn Lương chưa đầy 10m, cạnh nhà là bãi gửi ô tô, chung cư Gold Palm tiện ích ngập tràn.
Chủ nhà là doanh nhân thành đạt quản lý chuỗi khách sạn trên Hồ Tây, muốn bán nhanh để chuyển về ở bên Ecopark.
Sổ đỏ đẹp – cất két – sẵn sàng giao dịch.
Giá: 8 tỷ 5 ( thương lượng mạnh)
Liên hệ ngay em Tùng chuyên nhà đẹp giá tốt quận Thanh Xuân.","8,5 tỷ",75 m2,"Đường Hoàng Ngân, Phường Nhân Chính, Quận Thanh Xuân, Hà Nội",13698458,_,True,Cần bán,3m,True,Nhà trong hẻm,Sổ hồng/ Sổ đỏ,True,"7,5m",4,True,10m,4,---
https://alonhadat.com.vn/ban-nha-pho-le-van-luong-2-mat-ngo-10m-o-to-tranh-nha-dep-dan-xay-75m-4pn-8-5-ty-13698414.html,"Bán nhà phố Lê Văn Lương, 2 mặt ngõ, 10m ô tô tránh, nhà đẹp, dân xây, 75m 4PN, 8.5 tỷ","Tọa lạc ngay con ngõ đẹp nhất phố Lê Văn Lương tiếp giáp các tuyến phố Hoàng Ngân, Nhân Hòa, Quan Nhân, Giáp Nhất, Nguyễn Khang, Trần Duy Hưng,… khu vực dân trí cao, an sinh đỉnh.
Diện tích rộng, mặt tiền lớn, chủ nhà nhờ em trai là kiến trúc sư tự tay thiết kế, xây dựng chắc chắn, tỉ mỉ, tâm huyết, tổng 4 ngủ rộng, Gothoáng sáng, chủ mới chỉ việc xách vali về ở ngay. Nhà cách mặt ngõ 21 Lê Văn Lương chưa đầy 10m, cạnh nhà là bãi gửi ô tô, chung cư Gold Palm tiện ích ngập tràn.
Chủ nhà là doanh nhân thành đạt quản lý chuỗi khách sạn trên Hồ Tây, muốn bán nhanh để chuyển về ở bên Ecopark.
Sổ đỏ đẹp – cất két – sẵn sàng giao dịch.
Giá: 8 tỷ 5 ( thương lượng mạnh)
Liên hệ ngay em  Tùng chuyên nhà đẹp giá tốt quận Thanh Xuân.","8,5 tỷ",75 m2,"Đường Lê Văn Lương, Phường Nhân Chính, Quận Thanh Xuân, Hà Nội",13698414,_,True,Cần bán,3m,True,Nhà trong hẻm,Sổ hồng/ Sổ đỏ,True,"7,5m",4,True,10m,4,---
https://alonhadat.com.vn/ban-nha-cat-linh-o-to-10m-ngo-nong-rong-74m2x4t-chi-8-2-ty-13694777.html,"Bán nhà Cát Linh, ô tô 10m, ngõ nông rộng, 74m2x4T, chỉ 8.2 tỷ","- Vị trí nhà thuộc con phố VIP Cát Linh
tiếp giáp: Hào Nam, Ô chợ Dừa, Nguyễn Thái Học, Quốc Tử Giám, Đoàn Thị Điểm, Tôn Đức Thắng...
Thuận tiện giao thông
Gần: Lăng Bác, Trường chợ, khu vui chơi...
an sinh đỉnh cao, tiện ích ngập tràn
từ nhà ra ô tô cực gần chỉ 10m, nhà vuông vắn, nhiều thoáng.
- Thiết kế khung cột gồm 5 ngủ đầy đủ công năng sử dụng
- Sổ đỏ nở hậu, giao dịch ngay
- Liên hệ ngay mr Tùng xem nhà
- Miễn TG-MG","8,2 tỷ",74 m2,"Phố Cát Linh, Phường Cát Linh, Quận Đống Đa, Hà Nội",13694777,_,---,Cần bán,"2,5m",---,Nhà trong hẻm,Sổ hồng/ Sổ đỏ,---,4m,4,---,18m,5,---
https://alonhadat.com.vn/ban-nha-pho-ton-duc-thang-ngo-rong-nha-dep-dan-xay-57m-4pn-5-9-ty-13701227.html,"Bán nhà phố Tôn Đức Thắng, ngõ rộng, nhà đẹp dân xây, 57m, 4PN, 5.9 tỷ","Tọa lạc tại con ngõ đẹp nhất nhì phố Tôn Đức Thắng tiếp giáp các tuyến phố Nguyễn Lương Bằng, Khâm Thiên, Ô Chợ Dừa, Xã Đàn, Cát Linh, … phút mốt sang Văn Miếu Quốc Tử Giám, khu vực trung tâm quận Đống Đa an sinh đỉnh tiện ích ngập tràn.
Diện tích rộng, chủ tự xây chắc chắn tỉ mỉ, nội thất xịn sò, tổng 4 ngủ đủ công năng cho 1 gia đình cơ bản nhiều thế hệ. Hàng xóm 2 bên đều là công chức nhà nước dân trí cao.
Chủ nhà cô Minh mong muốn bán nhanh để chuyển về chung cư ở với con trai bên Cầu Giấy.
Sổ đỏ đẹp – cất két – sẵn sàng giao dịch.
Giá:  5 tỷ 9 ( thương lượng mạnh)
Liên hệ ngay em Tùng chuyên nhà đẹp giá tốt quận Đống Đa.","5,9 tỷ",57 m2,"Phố Tôn Đức Thắng, Phường Hàng Bột, Quận Đống Đa, Hà Nội",13701227,_,True,Cần bán,3m,True,Nhà trong hẻm,Sổ hồng/ Sổ đỏ,True,"5,7m",4,True,10m,4,---
