url,title,description,price,area,address,Mã tin,Hướng,Phòng ăn,Loại tin,Đường trước nhà,Nhà bếp,Loại BDS,Pháp lý,Sân thượng,Chiều ngang,Số lầu,Chổ để xe hơi,Chiều dài,Số phòng ngủ,Chính chủ
https://alonhadat.com.vn/ban-nha-ngo-43-nguyen-hong-dong-da-dt45m-5t-mt3-8m-gia-12-5-ty-13501209.html,"BÁN NHÀ NGÕ 43 NGUYÊN HỒNG – ĐỐNG ĐA. DT45M, 5T, MT3.8M GIÁ 12.5 TỶ","Bán nhà Nguyên Hồng Đống Đa
Thông tin mô tả :	
+ Diện tích 45 m2, 5 tầng, mặt tiền 3.8 m. 
Thiết kế: 
+ Nhà 5 tầng cũ thiết kế cầu thang giữa, mỗi tầng 2 phòng ngủ..
+ Vị trí : ngõ thoáng Trước nhà ô tô tránh, có vỉa hè 2 bên
+ Sổ vuông vắn, pháp lý chuẩn, thủ tục nhanh gọn . 
+ Gía 12.5 tỷ. Có thương lượng.","12,5 tỷ",45 m2,"Phố Nguyên Hồng, Phường Láng Hạ, Quận Đống Đa, Hà Nội",13501209,Tây Bắc,---,Cần bán,5m,---,Nhà trong hẻm,Sổ hồng/ Sổ đỏ,---,"3,8m",5,---,---,4,---
https://alonhadat.com.vn/nha-dep-hiem-gia-sieu-re-o-to-tranh-ngo-thong-2-thoang-truoc-sau-1-nha-duy-nhat-12533280.html,"NHÀ ĐẸP, HIẾM, GIÁ SIÊU RẺ, Ô TÔ TRÁNH, NGÕ THÔNG, 2 THOÁNG TRƯỚC SAU, 1 NHÀ DUY NHẤT","+ Trung tâm Hà Đông QUận, nơi rất nhiều người tìm kiếm nhà mua. Nhà thuộc khu phân lô cán bộ BV Tỉnh, phố cổ Hà Đông, dân xây được vài năm chắc chắn, ô tô tránh ngõ thông thẳng ra hồ Đầm Khê. 60M, 5 tầng, mặt tiền 5m, một thông số đẹp, ô tô qua nhà, làm cầu xe vào nhà giá cực rẻ qua 8 tỷ.
+ Khu dân trí toàn cán bộ cấp cao, nhà thoáng trước sau, cách mặt phố 10m. Khu vực đông dân cư, gần chợ và bệnh viện, khách mua về để ở hay kinh doanh đều đc.
+ Sổ đẹp chính chủ.
+ Giá 8,7 tỷ.
+ Liên hệ xem nhà Mr Hòng nhà phố.","8,7 tỷ",60 m2,"Đường Nguyễn Thái Học, Phường Quang Trung, Quận Hà Đông, Hà Nội",12533280,_,True,Cần bán,4m,True,Nhà trong hẻm,Sổ hồng/ Sổ đỏ,True,5m,5,---,---,4,---
https://alonhadat.com.vn/mat-pho-kinh-doanh-vi-tri-dac-dia-kim-ma-ba-dinh-dt-73m2-4t-mt-3-8m-gia-29-5-ty-13500967.html,"MẶT PHỐ KINH DOANH! VỊ TRÍ ĐẮC ĐỊA KIM MÃ BA ĐÌNH – DT 73M2, 4T, MT 3.8M. GIÁ 29.5 TỶ","Bán nhà Kim Mã Ba Đình 
Thông tin mô tả :	
+ Diện tích 73 m2, 4 tầng, mặt tiền 3.8 m.
+ Nằm đầu phố đoạn đẹp nhất, đối diện là bến xe Kim Mã cũ, ngã ba giáo với Sơn Tây và Nguyễn Thái Học.
+ Vỉa hè rộng 4 m, rất tiện cho kinh doanh. Đang cho khách thuê .
- Nhà 3 tầng 1 tum , đã sửa thành 5 tầng, thiết kế thông sàn cầu thang vệ sinh cuối nhà.
+  sổ đỏ chính chủ, pháp lý chuẩn, thủ tục nhanh gọn . 
+ Gía 29.5 tỷ. Có thương lượng.","29,5 tỷ",73 m2,"Đường Kim Mã, Phường Kim Mã, Quận Ba Đình, Hà Nội",13500967,Nam,---,Cần bán,15m,---,Nhà mặt tiền,Sổ hồng/ Sổ đỏ,---,"3,8m",4,---,---,5,---
https://alonhadat.com.vn/mat-pho-vi-tri-dep-tt-thanh-xuan-kinh-doanh-nhieu-loai-hinh-doanh-thu-300tr-nam--12674728.html,"MẶT PHỐ, VỊ TRÍ ĐẸP, TT THANH XUÂN, KINH DOANH NHIỀU LOẠI MẶT HÀNG, CHO THUÊ 300TR/NĂM.","+ Nhà mặt phố Nguyễn Văn Trỗi, trung tâm quận Thanh Xuân, Vị trí đẹp, gần nhiều phố lớn Lê Trọng Tấn, Nguyễn Lân, Phan Đình Giót, Hà Kế Tấn, Trường Chinh.. giao thông rất thuận lợi, dân cư đông đúc, kinh doanh sầm uất. Hiện chủ đang cho thuê kinh doanh 300tr/năm. Diện tích sổ 45m, thực tế xây dựng từ tầng 1 là 55m, 4 tầng, mặt tiền 3,9 m, giá hơn 9 tỷ.
+ Nhà 4 tầng khung cột chắc chắn, chủ làm móng 6 tầng nên chủ mới có nhu cầu lên thêm tầng cũng rất dễ dàng. Khu vực phù hợp kinh doanh tất cả các mặt hàng. Giao thông thuận tiện, tiện ích quanh khu vực bán kính 100m chẳng thiếu thứ gì.
+ Sổ đỏ đẹp chính chủ.
+ Giá 9,9 tỷ. Còn thương lượng.
+ Liên hệ Mr Hồng nhà phố để được xem nhà.
+ Tôi cam đoan tư vấn chuẩn pháp lý và mua được giá đẹp.","9,9 tỷ",55 m2,"Đường Nguyễn Văn Trỗi, Phường Phương Mai, Quận Thanh Xuân, Hà Nội",12674728,_,True,Cần bán,5m,True,Nhà trong hẻm,Sổ hồng/ Sổ đỏ,True,"3,9m",4,---,---,4,---
https://alonhadat.com.vn/ban-nha-ngo-218-doi-can-ba-dinh-dt-48m2-4t-mt-11-7m-gia-9-ty-13523010.html,"BÁN NHÀ NGÕ 218  ĐỘI CẤN BA ĐÌNH. DT 48M2, 4T, MT 11.7M. GIÁ 9 TỶ","Bán nhà Đội Cấn Ba Đình 
Thông tin mô tả :	
+ Diện tích 48 m2, 4 tầng, mặt tiền 11.7 m.
+ Vị trí đẹp ngõ thông ra ngõ 65 Vạn Bảo - Đội Cấn.
+ Nhà đẹp như mới thiết kế mỗi tầng 1 phòng wc khép kín, cầu thang góc.
+  Hiện trạng nhà đẹp chủ đang kinh doanh.
+  Phù hợp ở kết hợp kinh doanh.
+ Sổ vuông vắn, pháp lý chuẩn, thủ tục nhanh gọn. Diện tích sổ 43m2, từ tầng 2 đua hơn 50m2.
+ Gía 9.0 tỷ. Có thương lượng.",9 tỷ,48 m2,"Phố Đội cấn, Phường Đội Cấn, Quận Ba Đình, Hà Nội",13523010,Tây,---,Cần bán,4m,---,Nhà trong hẻm,Sổ hồng/ Sổ đỏ,---,"11,7m",4,---,---,4,---
https://alonhadat.com.vn/toa-nha-8-tang-thang-may-o-to-tranh-thoang-2-mat-dien-tich-to-mat-tien-rong-cuc-hiem--13228972.html,"TÒA NHÀ 8 TẦNG THANG MÁY, Ô TÔ TRÁNH,THOÁNG 2 MẶT, DIỆN TÍCH TO, MẶT TIỀN RỘNG, CỰC HIẾM.","+ Tòa nhà Building 8 tầng thang máy cực đẹp, mới xây năm 2019 còn rất đẹp nằm trên phố Lê Trọng Tấn, trung tâm Thanh Xuân, phố to và kinh doanh sầm uất nhất quận Thanh Xuân.
+ Phố Lê Trọng Tấn là phố kinh doanh, sầm uất từ đầu đến cuối phố. Tòa nhà chủ đang cho một bên công ty của nước ngoài thuê làm việc tại đây, thiết kế theo mô hình vừa ở, vẫn khai thác kinh doanh cực kì hiệu quả. Mặt tiền lý tưởng khách mua ở, làm văn phòng, cho thuê giữ tiền gì cũng vip. 
+ DT 115M x 8T x MT 5.2M 
+ Giá 28,2 tỷ.
+ Sổ đẹp chính chủ, pháp lý rõ ràng, sẵn sàng sang tên.
+ Liên hệ Mr Hồng để xem nhà. Tôi cam đoan tư vấn chuẩn pháp lý và mua được giá đẹp.","28,2 tỷ",115 m2,"Phố Lê Trọng Tấn, Phường Khương Mai, Quận Thanh Xuân, Hà Nội",13228972,_,True,Cần bán,5m,True,Nhà trong hẻm,Sổ hồng/ Sổ đỏ,True,"5,2m",8,True,---,14,---
https://alonhadat.com.vn/cuc-hiem-khach-san-dong-tien-sieu-khung-8-tang-thang-may-day-du-gp-phong-chay-xem-ngay-13463436.html,"CỰC HIẾM, KHÁCH SẠN DÒNG TIỀN SIÊU KHỦNG, 8 TẦNG THANG MÁY, ĐẦY ĐỦ GP PHÒNG CHÁY, XEM NGAY","- Nhà nằm trên đường QUang Trung, trung tâm quận Hà Đông, chỉ vài bước là ra phố, nơi không có nhà bán, 1 nhà duy nhất, nhà 2 thoáng cực đẹp, đường trước nhà rộng, ô tô vào nhà.
- Nhà thiết kế làm khách sạn 8 Tầng, thang máy, cho thuê, dòng tiền cực khủng.  Khách sạn kinh doanh lâu năm, có thương hiệu trong khu vực nên không bao giờ vắng khách. Doanh thu ổn định trung bình 150tr/tháng. Có thể dễ dàng cho thuê căn hộ chung cư mini nếu muốn, Đằng sau nhà còn 1 khe thoáng 40cm, phòng nào cũng có cửa sổ thoáng. Cách phố Quang Trung vài bước chân, đối diện KĐT Văn Phú. Khu vực giao thông thuận lợi, đầy đủ tiện ích.
- Sổ đẹp chính chủ.
- Chủ thiện chí bán giá 11,9 tỷ. Còn thương lượng, khách nhiệt tình mua giá chốt bất ngờ.
- Liên hệ Mr Hồng để xem nhà. Tôi cam đoan tư vấn chuẩn pháp lý và mua được giá đẹp.
-","11,9 tỷ",75 m2,"Đường Quang Trung, Phường La Khê, Quận Hà Đông, Hà Nội",13463436,_,True,Cần bán,5m,True,Nhà trong hẻm,Sổ hồng/ Sổ đỏ,True,"4,7m",8,True,---,18,---
https://alonhadat.com.vn/mat-pho-thai-thinh-dong-da-dien-tich-90m2-mat-tien-7m-6-tang-thang-may-gia-38-ty--13522484.html,"vMẶT PHỐ THÁI THỊNH ĐỐNG ĐA. DIỆN TÍCH 90M2, MẠT TIỀN 2.5m/7M, 6 TẦNG THANG MÁY. GÍÁ 38 TỶ","Thông tin mô tả :
+ Diện tích 90 m2, 6 tầng, mặt tiền 7 m. Giá 38 tỷ . Có thương lượng.
+ nhà 5 tầng 1 Tum thiết kế hiện đại, có thang máy, nội thất xịn , khách mua ở ngay không chê được 
+ Tầng 1 cho thuê 15 triệu/ tháng
+ Tầng 2.3.4 mỗi tầng gồm 2 phòng 
+ Tầng Tum sân phơi, ban công đẹp
+ Sổ đỏ chính chủ.",38 tỷ,90 m2,"Phố Thái Thịnh, Phường Thịnh Quang, Quận Đống Đa, Hà Nội",13522484,Tây Nam,---,Cần bán,10m,---,Nhà mặt tiền,Sổ hồng/ Sổ đỏ,---,7m,6,---,---,6,---
https://alonhadat.com.vn/ban-toa-khach-san-11-tang-dep-nhat-pho-pham-hong-thai-210m-134-ty-ba-dinh-dong-tien-5-ty-11974708.html,"Bán tòa khách sạn 11 tầng đẹp nhất phố Phạm Hồng Thái 210m, 134 tỷ Ba Đình dòng tiền 5 tỷ","Khách sạn 57 phòng kinh doanh. 2 tháng máy đầy đủ các tiêu chuẩn 4*, trung tâm Ba Đình.
Giá cho thuê khoảng 5 tỷ/1 năm
Khu vực xung quanh hiếm có tòa nhà dòng tiền cao, khu phố đẹp nhiều khách thích.",134 tỷ,210 m2,"Phố Phạm Hồng Thái, Phường Trúc Bạch, Quận Ba Đình, Hà Nội",11974708,_,---,Cần bán,20m,---,"Nhà hàng, khách sạn",---,---,8m,11,---,28m,60,---
https://alonhadat.com.vn/mat-pho-quoc-tu-giam-dien-tich-30m2-3-tang-mat-tien-3-3m-gia-14-ty--13517208.html,"MẶT PHỐ QUỐC TỬ GIÁM. DIỆN TÍCH 30M2, 3 TẦNG, MẶT TIỀN 3.3M. GIÁ 14 TỶ.","Bán nhà-phố Quốc Tử Giám Đống Đa
Thông tin mô tả :	
+ Diện tích 30 m2, 3 tầng, mặt tiền 3.3 m.
+ Hiện trạng nhà xây thiết kế 3 tầng 1 tum .
+ Tầng 1 : Cho thuê kinh doanh .
+ Tầng 2 + 3 : Mỗi tầng 1 phòng ngủ và WC
+ Tum phơi đồ
+ Vị trí mặt phố đã quy hoạch xong, cách văn miếu Quốc Tử Giám 50m, phố 2 chiều có vỉa hè.
+ Sổ đỏ chính chủ, pháp lý chuẩn, thủ tục nhanh gọn 
+ Gía 14 tỷ. Có thương lượng.",14 tỷ,30 m2,"Phố Quốc Tử Giám, Phường Quốc Tử Giám, Quận Đống Đa, Hà Nội",13517208,Tây Nam,---,Cần bán,8m,---,Nhà mặt tiền,Sổ hồng/ Sổ đỏ,---,"3,3m",3,---,---,2,---
https://alonhadat.com.vn/dang-tien-dong-30m2-4t-mt4m-phan-lo-o-to-an-sinh-cuc-dinh-4-7-ty-13199343.html,"Đặng Tiến Đông 30m2*4T, MT4m Phân Lô, Ô Tô An Sinh cực đỉnh 4.7 tỷ","Vị trí quá đẹp gần ngay hồ Hoàng Cầu, nằm trong khu phân lô cách 10m ô tô dừng đỗ ngày đêm.
_ Nhà khung BTCT rất chắc chắn diện tích 30m2 xây 4 tầng đẹp, mặt tiền rộng nhà thoáng chủ nhà bố trí cửa sổ cầu thang, các phòng rất hợp lý ánh sáng tự nhiên không khí lưu thông.
_ Nhà gần ga Thái Hà, các điểm xe buýt, chợ, siêu thị, các trường học phổ thông... sáng chiều đi bộ thể dục quanh hồ Hoàng Cầu hoặc vườn hoa Trần Quang Diệu.
_ Khu dân trí cao toàn cán bộ, viên chức nên yên tĩnh văn minh ngõ phố sạch đẹp.
_ Sổ đỏ vuông đẹp, chủ nhà có gia lộc cho khách thiện chí. Liên hệ: Văn Dương  để được hỗ trợ.","4,7 tỷ",30 m2,"Phố Đặng Tiến Đông, Phường Trung Liệt, Quận Đống Đa, Hà Nội",13199343,_,True,Cần bán,3m,True,Nhà trong hẻm,Sổ hồng/ Sổ đỏ,True,4m,4,True,"7,5m",3,---
https://alonhadat.com.vn/ban-nha-5-tang-sieu-dep-pho-doi-can-chi-4-8-ty-ba-dinh-ngo-ba-gac-thong-tu-tung-12198059.html,"Bán nhà 5 tầng siêu đẹp phố Đội Cấn chỉ 4.8 tỷ Ba Đình , ngõ ba gác thông tứ tung","NHÀ ĐẸP ĐÓN TẾT - CÁCH Ô TÔ 50M - CHỦ VÔ CÙNG THIỆN CHÍ 
+ Vị trí nhà rất gần ô tô, khu vực dân trí cao, tiện ích vô vàn, giao thông thuận tiện qua Đội Cấn, Ngọc Hà…
+ Nhà xây 5 tầng mới đẹp, cầu thang cuối, tầng 1 phòng, tổng 3 phòng ngủ thoáng sáng.
+ Sổ đỏ chính chủ, giao dịch ngay.","4,8 tỷ",38 m2,"Phố Đội cấn, Phường Đội Cấn, Quận Ba Đình, Hà Nội",12198059,_,---,Cần bán,2m,---,Nhà trong hẻm,Sổ hồng/ Sổ đỏ,---,4m,5,---,10m,4,---
https://alonhadat.com.vn/ban-nha-mat-ngo-hoa-bang-cau-giay-dt28m2-5t-mt7-0m-gia-4-5-ty--13558292.html,"BÁN NHÀ MẶT NGÕ HOA BẰNG CẦU GIẤY. DT28M2, 5T, MT7.0M. GIÁ 4.5 TỶ.","Thông tin mô tả :
+ Diện tích 28 m2,, mặt tiền 7.0 m, 5 tầng. 
+ cách mặt phố Hoa Bằng 30m, nhà dễ tìm.. Ngõ thẳng và thoáng, 2 xe máy tránh nhau thỏa mái. Ngõ thông ra phố Dương Đình Nghệ 
+ Hiện đang là: nhà 5 tầng mới kính coong khách về ở ngay , nhà có 2 đồng hồ điện .
+ Kinh doanh Online cực phù hợp.
+ Sổ nở hậu, pháp lý chuẩn, thủ tục nhanh gọn.
+ Gía chỉ 4.5 tỷ. Có thể thương lượng chút..","4,5 tỷ",28 m2,"Phố Hoa Bằng, Phường Yên Hòa, Quận Cầu Giấy, Hà Nội",13558292,Tây Bắc,---,Cần bán,"2,2m",---,Nhà trong hẻm,Sổ hồng/ Sổ đỏ,---,7m,5,---,---,3,---
https://alonhadat.com.vn/ban-can-biet-thu-mini-mat-ngo-kd-pho-doi-can-73m-chi-10-5-ty-ba-dinh-o-to-7-cho-do-cua-12042184.html,Bán căn biệt thự MINI  mặt ngõ KD phố Đội Cấn 73m chỉ 10.5 Tỷ Ba Đình ô tô 7 chỗ đỗ cửa,"Khu vực hiếm nhà bán , nhà mặt ngõ kinh doanh ô tô 7 chỗ qua nhà thoải mái, ngõ thông tứ tung , diện tích rộng , mặt tiền lớn phù hợp với khách thích nhà rộng thoáng.
Nhà xây cực đẹp thiết kế tân cổ điển cực kì chắc chắn kiểu biệt thự Mini có ban công rộng , đẹp  đầy ánh sáng.
Nhà Cách mặt ngõ 173 Hoàng Hoa Thám khoảng 100m, thông sang ngõ 279 Đội Cấn, 158 Ngọc Hà.
+Tầng 1 là phòng khách, phòng ăn, bếp cầu thang và wc ở bên phải.
+Tầng 2, 3 mỗi tầng 2 phòng ngủ wc chung.
+Tầng 4 là phòng thờ sân phơi rộng.","10,5 tỷ",73 m2,"Phố Đội cấn, Phường Đội Cấn, Quận Ba Đình, Hà Nội",12042184,_,---,Cần bán,3m,---,Nhà trong hẻm,Sổ hồng/ Sổ đỏ,---,7m,5,---,10m,6,---
https://alonhadat.com.vn/nha-mat-pho-tt-dong-da-vi-tri-vang-gaza-o-to-via-he-to-mat-tien-quen-luc-kd-dinh--13463149.html,"NHÀ MẶT PHỐ, TT ĐỐNG ĐA, VỊ TRÍ VÀNG, GAZA Ô TÔ, VỈA HÈ TO, MẶT TIỀN QUỀN LỰC, KD ĐỈNH.","- Nhà mặt phố Tam Khương một trong những tuyến phố mới hót hít nhất nhì quận Đống Đa. Nhà nằm vị trí đẹp nhất phố, khu vực buôn bán, kinh doanh sầm uất ngày đêm, có vỉa hè rộng, ô tô dừng đỗ ngày, đêm, vào nhà. 
- Nhà chủ tự xây 5 tầng, thiết kế thông sàn để kinh doanh, là hàng xóm của ĐH y hay Bv ĐH Y, nơi hội tụ rất nhiều trường ĐH và Bv, vài bước là ra mặt phố Tôn Thất Tùng, thông sang Chùa Bộc, Khương Thượng, Giao thương với Phố Phạm Ngọc Thạch, Trường Chinh....Khách mua về mở Phòng Khám, Spa, Vp, hay đại lý kinh doanh thì quá hợp.
- Sổ đẹp chính chủ.
- Giá 11,8 tỷ. Còn thương lượng.
- Liên hệ Mr Hồng để xem nhà. Tôi cam đoan tư vấn chuẩn pháp lý và mua được giá đẹp.","11,8 tỷ",35 m2,"Đường Tam Khương, Phường Khương Thượng, Quận Đống Đa, Hà Nội",13463149,_,True,Cần bán,10m,True,Nhà mặt tiền,Sổ hồng/ Sổ đỏ,True,"5,2m",5,True,---,2,---
https://alonhadat.com.vn/ban-nha-5-tang-pho-vinh-phuc-65m-chi-7-8-ty-o-to-do-cong-kinh-doanh-cach-pho-chi-50m-13054133.html,"Bán nhà 5 tầng phố Vĩnh Phúc 65m chỉ 7.8 tỷ ô tô đỗ cổng, kinh doanh, cách phố chỉ 50m","NHÀ ĐẸP - THOÁNG TRƯỚC THOÁNG SAU - CÁCH MẶT PHỐ 20M - DIỆN TÍCH RỘNG - 6PN - NGÕ 3M - CHỦ THIỆN CHÍ BÁN

- Vị trí trung tâm Quận Ba Đình, cách mặt phố Hoàng Hoa Thám 20M, ngõ trước nhà rộng 3m, thoáng trước thoáng sau. 
- Nhà gần phố tiện ích xung quanh không thiếu gì. 
- Nhà mới xây được 3 năm, còn như mới, thiết kế hiện đại. 
+ Tầng 1: Phòng khách, bếp, wc. 
+ Tầng 2,3,4: Mỗi tầng 2pn, wc giữa. 
+ Tầng 5: Phòng thờ và sân phơi.","7,8 tỷ",65 m2,"Phố Vĩnh Phúc, Phường Vĩnh Phúc, Quận Ba Đình, Hà Nội",13054133,_,---,Cần bán,3m,---,Nhà trong hẻm,---,---,5m,5,---,13m,6,---
https://alonhadat.com.vn/ban-nha-pho-giang-van-minh-73m-chi-doi-can-7-2-ty-nha-dep-o-ngay-gan-o-to-so-no-hau-11760485.html,"Bán nhà phố Giang Văn Minh 73m chỉ  Đội Cấn 7.2 tỷ, nhà đẹp ở ngay gần ô tô, sổ nở hậu","NHÀ ĐẸP Ở NGAY - SỔ ĐỎ NỞ HẬU - NGÕ 3 GÁC - SẠCH - THOÁNG.
Thiết kế 4 tầng:
+ Tầng 1 : Sân để xe + phòng khách + bếp + wc.
+ Tầng 2 +3 : Mỗi tầng 2 phòng ngủ + wc.
+ Tầng 4 : Phòng thờ + sân phơi .
Sổ đỏ nở hậu, chủ đang cất két, sẵn sàng giao dịch.
-An Sinh Đỉnh,Hàng Xóm thân thiện,Văn Minh.Tiện ích Ngập Tràn.Trước Nhà Có Khoảng Sân rộng Để Xe máy và phương tiện thoải mái.
- Nhà cách Mặt ngõ ô tô ,
-Di chuyển ra Các tuyến Phố Đội Cấn,Ngọc Hà,Tây Hồ....rất gần và tiện di Chuyển","7,2 tỷ",73 m2,"Phố Giang Văn Minh, Phường Liễu Giai, Quận Ba Đình, Hà Nội",11760485,_,---,Cần bán,3m,---,Nhà trong hẻm,Sổ hồng/ Sổ đỏ,---,5m,5,---,14m,8,---
https://alonhadat.com.vn/cuc-hiem-nha-mat-pho-lang-ha-tt-dong-da-vi-tri-dep-nhat-pho-nha-dep-kd-cuc-khung-t-13214231.html,"CỰC HIẾM NHÀ MẶT PHỐ LÁNG HẠ, TT ĐỐNG ĐA, VỊ TRÍ ĐẸP NHẤT PHỐ, NHÀ ĐẸP, KD CỰC KHỦNG- T","- Vị trí Vip, mặt phố Láng Hạ, đoạn đường Láng giao cắt với Láng Hạ, kinh doanh đỉnh cao. Nhà 1 mặt phố, 1 mặt ngõ ô tô đều qua được. DT 60M x 4T x MT 3.9N Giá 18 tỷ.
- Cực hiếm nhà mặt phố Láng Hạ khu vực rất hiếm nhà bán, nhà được thiết kế 5 tầng,  có mặt tiền 3,9 rất rộng đầy quyền lực nên buôn bán mặt hàng gì cũng phù hợp. NHà tầng 1 hiện đang kinh doanh buôn bán ổn định rất nhiều khách, khách mua về tiếp tục kinh doanh thì quả thật là hốt bạc.
- Sổ đẹp cất két sẵn sàng giao dịch.
- Giá 18 tỷ. Còn thương lượng.
- Liên hệ Mr Hồng để xem nhà. Tôi cam đoan tư vấn chuẩn pháp lý và mua được giá đẹp.",18 tỷ,60 m2,"Đường Láng Hạ, Phường Láng Hạ, Quận Đống Đa, Hà Nội",13214231,_,True,Cần bán,36m,True,Nhà mặt tiền,Sổ hồng/ Sổ đỏ,True,"3,9m",4,True,---,2,---
https://alonhadat.com.vn/ban-nha-pho-doi-can-43m-5-tang-gia-chi-8-5-ty-ba-dinh-o-to-tranh-kinh-doanh-10610130.html,"Bán nhà phố Đội Cấn 43m, 5 tầng  giá chỉ  8.5 tỷ Ba Đình, ô tô tránh , kinh doanh","Nhà nằm mặt ngõ kinh doanh sầm uất, nhà chủ tự xây cực kỳ kiên cố chắc chắn tầm gần chục năm. Thiết kế thông sàn cầu thang cuối kinh doanh. Cách mặt phố 40m. 
Vị trí cực hiếm nhà bán, cách Viện Bảo Tàng Hồ Chí Minh 5 phút xe máy, khoảng 1km ra đến Lăng Bác, cách Hồ Gươm 2km. Tiện ích xung quanh bạt ngàn. 
Mô tả: 5 tầng.
Tầng 1+2+3+4: Thông sàn cầu thang cuối.
Tầng 5: Phòng thờ + sân phơi.
Sổ vuông phân lô.","8,5 tỷ",43 m2,"Phố Đội cấn, Phường Đội Cấn, Quận Ba Đình, Hà Nội",10610130,_,---,Cần bán,5m,---,Nhà trong hẻm,---,---,4m,5,---,10m,4,---
https://alonhadat.com.vn/nha-8-tang-2-thoang-thang-may-gara-tt-dong-da-be-boi-bon-mua-nang-luong-mat-troi-kd-13010915.html,"NHÀ 8 TẦNG, 2 THOÁNG, THANG MÁY, GARA, TT ĐỐNG ĐA, BỂ BƠI BỐN MÙA, NĂNG LƯỢNG  MẶT TRỜI,KD","- Trung tâm Đống Đa. Toà nhà 8 tầng mới, thang máy trong nhà...xây dựng chắc chắn, thiết kế đẳng cấp, hai mặt thoáng vĩnh viễn trước sau, vị trí cực đẹp, đường truớc nhà to, ô tô qua nhà vào nhà.
- Thang máy nhập khẩu trọng tải 450kg, chạy suốt 7 tầng, êm ru, dàn năng lượng mặt trời cấp nóng lạnh 4 mùa cho bể bơi và cả tòa nhà. Rát thích hợp cho khách mua về vừa ở vừa kinh doanh.
- Sổ đỏ vuông vắn, nở hậu 20cm, pháp lý sạch, sẵn sàng giao dịch.
- 13,9 tỷ. Còn thương lượng.
- Liên hệ Mr Hồng để xem nhà. Tôi caM đoan tư vấn chuẩn pháp lý và mua được giá đẹp.","13,9 tỷ",50 m2,"Phố Đặng Tiến Đông, Phường Trung Liệt, Quận Đống Đa, Hà Nội",13010915,_,True,Cần bán,5m,True,Nhà trong hẻm,Sổ hồng/ Sổ đỏ,True,"3,5m",8,True,---,2,---
