url,title,description,price,area,address,Mã tin,Hướng,Phòng ăn,Loại tin,Đường trước nhà,Nhà bếp,Loại BDS,Pháp lý,Sân thượng,Chiều ngang,Số lầu,Chổ để xe hơi,Chiều dài,Số phòng ngủ,Chính chủ,Thuộc dự án
https://alonhadat.com.vn/ban-can-ho-tang-37-ct11-kim-van-kim-lu-nghiem-xuan-yem-03-ngu-dt-77m-gia-2-15-ty-13486184.html,"Bán Căn Hộ Tầng 37 – CT11 Kim Văn Kim Lũ, Nghiêm Xuân Yêm, 03 Ngủ, DT: 77m/Giá: 2.15 Tỷ","Căn Hộ Nằm trên Tầng cao Khu CT11 Kim Văn – Kim Lũ, Đường Nghiêm Xuân Yêm, với hai thoáng, view đẹp, khu vực đầy đủ tiện ích, giá hợp lý. Căn hộ đẹp, nội thất cơ bản đầy đủ, sàn gỗ, đầy đủ nóng lạnh, điều hòa, phù hợp về an sinh lâu dài
-	Diện tích: 77m, vuông vắn
-	Thiết kế với 03 phong ngủ, 2wc, lô gia thoáng
-	Giá bán: 2.15 Tỷ, sổ đỏ sẵn giao dịch
-	Liên hệ: A.Chiến","2,15 tỷ",77 m2,"CT11 Đường Nghiêm Xuân Yêm, Phường Đại Kim, Quận Hoàng Mai, Hà Nội",13486184,_,---,Cần bán,---,---,Căn hộ chung cư,Sổ hồng/ Sổ đỏ,---,---,37,---,---,3,---,Khu đô thị mới Kim Văn - Kim Lũ (Golden Silk) (xem chi tiết dự án)
https://alonhadat.com.vn/ban-can-ho-tang-12-toa-ct1-bac-linh-dam-full-noi-that-nha-dep-dt-87m-3-ngu-2-9-ty-13477305.html,"Bán Căn Hộ Tầng 12, Tòa OCT1 – Bắc Linh Đàm, Full Nội Thất, Nhà Đẹp DT: 87m/3 Ngủ/2.9 Tỷ","Tòa OCT1 Bắc Linh Đàm, tòa nhà đẹp, ô tô vòng quanh, giao thông tiện lơị, ngay mặt Đường Nghiêm Xuân Yên, đối diện Đường Nguyễn Xiển, gần Công Viên, tiện ích đầy đủ, gần Trường Học các cấp. Nhà đẹp mới sửa, ban công thoáng rộng, thuộc tầng trung thoáng mát, view đẹp, nội thất đầy đủ, phù hợp về ở luôn
-	Diện tích: 87m, vuông vắn
-	Thiết kế phòng gồm 3 phòng ngủ, 2wc, full nội thất
-	Giá bán: 2.9 Tỷ, Sổ đỏ chính chủ
-	Liên hệ: A.Chiến","2,9 tỷ",87 m2,"Đường Nghiêm Xuân Yêm, Phường Đại Kim, Quận Hoàng Mai, Hà Nội",13477305,_,---,Cần bán,---,---,Căn hộ chung cư,Sổ hồng/ Sổ đỏ,---,---,12,---,---,2,---,Căn hộ chung cư OCT1 Bắc Linh Đàm (xem chi tiết dự án)
https://alonhadat.com.vn/ban-can-ho-ct11-tang-39-kim-van-kim-lu-full-noi-that-huong-mat-dt-69m-02-ngu-2-1ty-13537667.html,"Bán Căn hộ CT11 – Tầng 39, Kim Văn – Kim Lũ, Full Nội Thất, Hướng Mát DT: 69m/02 Ngủ/2.1Tỷ","Chung cư Kim Văn – Kim Lũ, Mặt Phố Nghiêm Xuân Yêm, đằng sau là Khu Đô Thị Đại Kim, đủ tiện ích, giao thông tiện lợi, gần các Trường Học, dân trí cao, an ninh tốt. Căn Hộ tầng cao, hướng ban công thoáng mát, full nội thất, tiện về ở luôn
-	Diện tích: 69m
-	Thiết kế 2 phòng ngủ + 2 wc, ban công thoáng mát
-	Giá bán: 2.1 Tỷ, Sổ đỏ chính chủ
-	Liên hệ: A.Chiến","2,1 tỷ",69 m2,"CT11 Đường Nghiêm Xuân Yêm, Phường Đại Kim, Quận Hoàng Mai, Hà Nội",13537667,_,---,Cần bán,20m,---,Nhà trong hẻm,Sổ hồng/ Sổ đỏ,---,---,2,---,---,2,---,
https://alonhadat.com.vn/ban-nha-ngo-34-thinh-quang-tay-son-5m-ra-o-to-do-ngo-thoang-dt-17m-5-tang-2-ty-13523945.html,"Bán Nhà ngõ 34 Thịnh Quang – Tây Sơn, 5m Ra Ô Tô Đỗ, Ngõ Thoáng, DT: 17m/5 Tầng/2 Tỷ","Nhà đẹp, Chủ tự xây dựng chắc chắn, ngõ rộng thoáng, dân trí cao, 5m ra đường ô tô, vài bước ra sân chơi Công Cộng thoáng mát, ngõ ngay đầu Phố Tây Sơn – Ngã Tư Sở, thông Phố Thái Thịnh, giao thông tiện, mợi tiện ích gần nhà. Nhà thiết kế hợp lý với cửa sổ thoáng các phòng, mỗi tầng đều khép kín, có cửa sổ thoáng sau nhà, phù hợp về an sinh lâu dài
-	Diện tích: 17m, vuông vắn, mặt tiền: 3.5m
-	Thiết kế 4 tầng với 2 phòng ngủ khép kín
-	Giá bán: 2 Tỷ, Sổ đỏ chính chủ
-	Liên hệ: A,Chiến",2 tỷ,17 m2,"34 Đường Thịnh Quang, Phường Thịnh Quang, Quận Đống Đa, Hà Nội",13523945,_,---,Cần bán,3m,---,Nhà trong hẻm,Sổ hồng/ Sổ đỏ,---,"3,4m",4,---,7m,2,---,
https://alonhadat.com.vn/ban-dat-2-ngo-154-cho-kham-thien-ngo-thong-xe-ba-gac-xay-ccmn-dt-56m-gia-5-ty-13520464.html,"Bán Đất 2 Ngõ 154 Chợ Khâm Thiên, Ngõ Thông Xe Ba Gác, Xây CCMN DT: 56m , Giá: 5 Tỷ","Mặt ngõ 154 Chợ Khâm Thiên, cách Phố Chợ 10m, ngõ rộng rãi, xe ba gác đỗ cửa, ngõ thông khắp nơi, thông sang Phố Đê La Thành Bé, thông sang Phố Xã Đàn, Chợ gần nhà, Trường Học các cấp 300m. Hiện trạng là nhà cấp 4 đang cho thuê, vuông vắn, phù hợp xây nhà mới hoặc xây tòa Chung cư Mini cho thuê
-	Diện tích: 56m, mặt tiền: 4.6m, nở hậu: 4.9m
-	Hiện trạng nhà cấp 4, dễ dàng phá dỡ để xây dựng
-	Giá bán: 5 Tỷ, Sổ đỏ chính chủ
-	Liên hệ: A,Chiến",5 tỷ,56 m2,"154 Phố Chợ Khâm Thiên, Phường Trung Phụng, Quận Đống Đa, Hà Nội",13520464,_,---,Cần bán,3m,---,Nhà trong hẻm,Sổ hồng/ Sổ đỏ,---,5m,1,---,11m,1,---,
https://alonhadat.com.vn/ban-nha-63-ngo-tien-bo-kham-thien-ngo-rong-gan-pho-thong-thoang-dt-17m-2-tang-1-68ty-13520393.html,"Bán Nhà 63 NGõ Tiến Bộ - Khâm Thiên, Ngõ Rộng, Gần Phố, Thông Thoáng DT: 17m/2 Tầng/1.68Tỷ","Vị trí gần Phố Khâm Thiên, ngõ nông, rộng, đi bộ phút ra ngay đường, gần Ngã Sáu Xã Đàn – Tôn Đức Thắng, khu vực yên tĩnh, dân trí cao, tiện ích đầy đủ. Nhà hiện trạng đang cho thuê, đầy đủ nội thất, trước sau đều thoáng, phù hợp ở ngay
-	Diện tích: 17m, mặt ngang: 3m, vuông vắn trước sau
-	Thiết kế 2 tầng với 2 phòng ngủ, vệ sinh riêng từng tầng
-	Giá bán: 1.68 Tỷ, Sổ đỏ chính chủ
-	Liên hệ: A,Chiến","1,68 tỷ",17 m2,"63 tiến bộ Phố Khâm Thiên, Phường Khâm Thiên, Quận Đống Đa, Hà Nội",13520393,_,---,Cần bán,3m,---,Nhà trong hẻm,Sổ hồng/ Sổ đỏ,---,3m,2,---,6m,2,---,
https://alonhadat.com.vn/ban-nha-tang-32-ct12-kim-van-kim-lu-nghiem-xuan-yem-full-noi-that-dt-57m-2-ngu-1-7-ty-13532184.html,"Bán Nhà Tầng 32 CT12 Kim Văn Kim Lũ, Nghiêm Xuân Yêm, Full Nội Thất, DT: 57m/2 Ngủ/1.7 TỶ","Bán Nhà Tầng 32 CT12 Kim Văn Kim Lũ, Nghiêm Xuân Yêm, Full Nội Thất, DT: 57m/2 Ngủ/1.7 TỶ
 Nằm trên tầng cao của Chung Chư CT12 Kim Văn – Kim Lũ, Trước sau đều ô tô đỗ, khu vực dân trí cao, tiện ích đầy đủ. Nhà hiện trạng gồm 1 lô gia rộng, thiết kế nội thất hoàn toàn mới, sàn gỗ, khóa vân tay, đầy đủ nóng lạnh, điều hòa các phòng ngủ, bếp xịn sò, phù hợp về ở ngay
-	Diện tích: 57m, lô gia rộng
-	Thiết kế 2 phòng ngủ + 2wc
-	Giá bán: 1.7 Tỷ, sổ đỏ chính chủ
-	Liên hệ: A,Chiến","1,7 tỷ",57 m2,"CT12A Đường Nghiêm Xuân Yêm, Phường Đại Kim, Quận Hoàng Mai, Hà Nội",13532184,_,---,Cần bán,20m,---,Nhà trong hẻm,Sổ hồng/ Sổ đỏ,---,---,37,---,---,2,---,
https://alonhadat.com.vn/ban-mat-pho-92-van-chuong-kham-thien-hai-mat-ngo-o-to-kdoanh-dt-44m-5-tang-7-9-ty-13535054.html,"Bán Mặt Phố 92 Văn Chương – Khâm Thiên, Hai Mặt Ngõ, Ô Tô, KDoanh DT: 44m/5 Tầng/7.9 Tỷ","Mặt phố nhỏ Văn Chương, vài bước ra Phố Tôn Đức Thắng, thông sang Hồ Linh Quang, Hồ Văn Chương, sang Phố Khâm Thiên, gần Văn Miếu, vài bước là Chợ, Trường học các cấp, tiện ích bao quanh, trước nhà đường rải nhựa, ô tô qua, sau nhà là mặt ngách, thông thoáng, có thể kinh doanh, cho thuê 7 triệu/tháng, hoặc làm văn phòng. Nhà đẹp xây dựng chắc chắn, thiết kế đẹp, đầy đủ nội thất, phù hợp về ở luôn
-	Diện tích: 44m, mặt tiền: 4m, vuông vắn
-	Thiết kế 5 tầng, gồm 5 ngủ, cầu thang và wc giữa
-	Giá bán: 7.9 tỷ, Sổ đỏ chuẩn chính chủ
-	Liên hệ: A.Chiến","7,9 tỷ",44 m2,"92 Đường Văn Chương, Phường Văn Chương, Quận Đống Đa, Hà Nội",13535054,_,---,Cần bán,5m,---,Nhà trong hẻm,Sổ hồng/ Sổ đỏ,---,4m,5,---,11m,5,---,
https://alonhadat.com.vn/ban-dat-ngo-104-trung-liet-thai-ha-o-to-kinh-doanh-xay-ccmn-dt-86m-gia-12-8-ty-13536650.html,"Bán Đất Ngõ 104 Trung Liệt – Thái Hà, Ô Tô, Kinh Doanh, Xây CCMN, DT: 86m – Giá: 12.8 Tỷ","Cách Phố Tầm 30m, ngõ rộng, ô tô vào nhà, tiện kinh doanh đa dạng, hoặc xây chung cư mini cho thuê rất tối ưu, ngõ thoáng thông sang Nguyễn Văn Tuyết, thông sang Phố Thái Hà, Thái Thịnh, tiện ích ngập tràn. Hiện trạng nhà cấp 4 đang cho thuê, phù hợp tháo dỡ để xây mới tòa văn phòng hoặc chung cư mini dòng tiền
-	Diện tích: 86m, mặt tiền: 5m, vuông vắn
-	Giá bán: 12.8 Tỷ, Sổ đỏ chính chủ
-	Liên hệ: A,Chiến","12,8 tỷ",86 m2,"104 Đường Trung Liệt, Phường Thịnh Quang, Quận Đống Đa, Hà Nội",13536650,_,---,Cần bán,5m,---,Mặt bằng,Sổ hồng/ Sổ đỏ,---,5m,1,---,16m,1,---,
https://alonhadat.com.vn/ban-can-ho-tang-35-toa-vinaconex-nghiem-xuan-yem-full-noi-that-dt-96m-3-ngu-3-9-ty-13560867.html,"Bán Căn Hộ Tầng 35 Tòa Vinaconex – Nghiêm Xuân Yêm, Full Nội Thất DT: 96m/3 Ngủ/3.9 Tỷ","Tầng 35 Tòa Vinaconex Thuộc tầng cao, View Hồ Định Công, nhà có hai ban công siêu thoáng, có thể thiết kế tiểu cảnh, không gian rộng với đầy đủ nội thất, chỉ việc về an sinh 
-	Diện tích: 96m, 2 ban công view Hồ Định Công
-	Thiết kế 3 Phòng ngủ + 1 Kho, 2wc, Full Nội Thất
-	Giá bán: 3.9 Tỷ, Sổ đỏ chính chủ
-	Liên hệ: A,Chiến","3,9 tỷ",96 m2,"vianconex B Đường Nghiêm Xuân Yêm, Phường Đại Kim, Quận Hoàng Mai, Hà Nội",13560867,_,---,Cần bán,20m,---,Nhà trong hẻm,Sổ hồng/ Sổ đỏ,---,5m,35,---,20m,3,---,
https://alonhadat.com.vn/ban-can-ho-tang-15-chung-cu-chelsea-park-tran-kim-xuyen-cau-giay-dt-230m-4-ngu-9-8-ty-13607147.html,"Bán Căn Hộ Tầng 15 Chung Cư ChelSea Park - Trần Kim Xuyến, Cầu Giấy DT: 230m/4 Ngủ/9.8 Tỷ","Căn hộ thuộc Tầng 15 Tòa E1, Chung Cư Chelsea Park, Phường yên Hòa, Cầu Giấy, nhà đẹp với diện tích rộng mênh mông, 2 ban công rộng rãi, mát mẻ, tòa nhà nằm ngay giao điểm Trần Kim Xuyến – Trung Hòa – Vũ Phạm Hàm, giao thông tiện lợi, tiện ích ngập tràn dưới chân Tòa nhà. Nhà đẹp với thiết kế riêng, sàn gỗ, nội thất chất lượng, full nội thất để lại cho Chủ mới, phù hợp về an sinh lâu dài
-	Diện tích: 230m, vuông vắn
-	Thiết kế với 2 ban công rộng làm tiểu cảnh, 4 phòng ngủ, 3 wc, Full nội thất
-	Giá bán: 43 Triệu/m2, Sổ đỏ chính chủ
-	Liên hệ: A.Chiến","9,8 tỷ",230 m2,"Phố Trung Kính, Phường Yên Hòa, Quận Cầu Giấy, Hà Nội",13607147,_,---,Cần bán,---,---,Căn hộ chung cư,Sổ hồng/ Sổ đỏ,---,---,15,---,---,4,---,Căn hộ chung cư Chelsea Park (xem chi tiết dự án)
https://alonhadat.com.vn/ban-nha-ngo-46-lenh-cu-kham-thien-ngo-rong-hai-mat-tien-dep-dt-32m-5-tang-4-2-ty-13621074.html,"Bán Nhà Ngõ 46 Lệnh Cư – Khâm Thiên, Ngõ Rộng, Hai Mặt Tiền Đẹp, DT: 32m/5 Tầng/4.2 Tỷ","Ngay gần Phố Trung Phụng, trước nhà rộng rãi, ngõ phân lô thông sang Phố Khâm Thiên, giao thông thuận tiện, khu vực an ninh tốt, dân trí cao. Nhà đẹp, tự xây dựng, chắc chắn, đủ các công năng, nhà có hai mặt ngõ, trước sau đều thoáng, cửa sổ thoáng các phòng, nội thất đủ cả, phù hợp về an sinh lâu dài
-	Diện tích: 32m, thực tế tầng 1: 35m, vuông vắn, mặt tiền: 4m
-	Thiết kế 5 tầng với 4 phong ngủ, 3wc, cầu thang cuối
-	Giá bán: 4.2 Tỷ, Sổ đỏ chính chủ
-	Liên hệ: A.Chiến","4,2 tỷ",35 m2,"46 Phố Trung Phụng, Phường Thổ Quan, Quận Đống Đa, Hà Nội",13621074,_,---,Cần bán,3m,---,Nhà trong hẻm,Sổ hồng/ Sổ đỏ,---,4m,5,---,8m,4,---,
https://alonhadat.com.vn/ban-nha-26-ngo-66-tu-lien-yen-phu-full-noi-that-10m-ra-o-to-dt-37m-5-tang-5-05-ty-13657214.html,"Bán Nhà 26 Ngõ 66 Tứ Liên – Yên Phụ, Full Nội Thất, 10m Ra Ô Tô, DT: 37m/5 Tầng/5.05 Tỷ","Nhà đẹp Ngõ 66 Phố Tứ Liên, trước nhà ngõ trải nhựa rộng thênh thang, 10 m đi bộ ra đường ô tô, vài bước ra Đường Yên Phụ, thông các ngả Phố vào Trung Tâm, các tiện ích đầy đủ. Nhà đẹp có thiết kế riêng, thoáng trước sau, khu vực yên tĩnh, dân trí cao, nội thất Full nhà và để lại toàn bộ cho Chủ mới, phù hợp về ở ngay
-	Diện tích: 37m, mặt tiền: 4.2m, vuông vắn
-	Thiết kế 5 tầng với 4 phòng ngủ, cầu thang và wc cuối nhà
-	Giá bán: 5.05 Tỷ
-	Liên hệ: A,Chiến","5,05 tỷ",37 m2,"66 Đường Tứ Liên, Phường Yên Phụ, Quận Tây Hồ, Hà Nội",13657214,_,---,Cần bán,3m,---,Nhà trong hẻm,Sổ hồng/ Sổ đỏ,---,"4,2m",5,---,9m,4,---,
https://alonhadat.com.vn/ban-nha-ngo-85-van-mieu-ton-duc-thang-20m-ra-o-to-dt-14m-2-tang-680-trieu-nha-chua-so-13656717.html,"Bán Nhà Ngõ 85 Văn Miếu – Tôn Đức Thắng, 20m Ra Ô Tô DT: 14m/2 Tầng/680 Triệu, Nhà Chưa Sổ","Nhà nằm trong Ngõ 85 Phố Tôn Đức Thắng, ngõ đẹp bê tông rộng rãi, 20m ra đường ô tô, ngõ hai xe máy tránh, 200m ra Văn Miếu – Cát Linh, tiện ích đủ đường. Nhà xây dựng chắc chắn với sàn gỗ, nóng lạnh, điều hòa, bếp sẵn, phù hợp về ở luôn
-	Diện tích: 14m, vuông vắn
-	Thiết kế 2 tầng và 1 tum bé để đồ với 01 phòng ngủ, 01 bếp, 01 wc, 01 phòng khách
-	Giá bán: 680 Triệu, Mua bán bi bằng, nhà chưa có sổ
-	Liên hệ: A.Chiến",680 triệu,14 m2,"85 Phố Tôn Đức Thắng, Phường Văn Miếu, Quận Đống Đa, Hà Nội",13656717,_,---,Cần bán,3m,---,Nhà trong hẻm,Sổ hồng/ Sổ đỏ,---,3m,3,---,5m,1,---,
https://alonhadat.com.vn/ban-can-ho-tang-3-oct1-bac-linh-dam-lo-goc-full-noi-that-dt-65m-2-ngu-gia-2-05-ty-13680636.html,"Bán Căn Hộ Tầng 3 – OCT1 Bắc Linh Đàm, Lô Góc, Full Nội Thất, DT: 65m, 2 NGủ, Giá: 2.05 Tỷ","Nhà nằm trên Tầng 3 X1 – OCT1 Bắc Linh Đàm – Nghiêm Xuân yêm, hướng nhà view đường, đối diện với Khách Sạn Mường Thanh, vài bước ra Công Viên Linh Đàm, ô tô đỗ chân cầu thang, Trường Học các cấp bao quanh, tiện ích đủ đường. Căn hộ mới sửa sang đẹp với nội thất đầy đủ giường tủ, bàn ghế, salon, sàn gỗ, cửa cách âm, nóng lạnh, điều hòa, bếp xịn, phù hợp về ở luôn
-	Diện tích: 65m, ban công thoáng mát
-	Thiết kế 2 phòng ngủ, 1wc, nội thất đủ cả
-	Giá bán: 2.05 tỷ, có thương lượng, Sổ đỏ chính chủ
-	Liên hệ: A,Chiến","2,05 tỷ",65 m2,"Đường Đặng Xuân Bảng, Phường Đại Kim, Quận Hoàng Mai, Hà Nội",13680636,_,---,Cần bán,---,---,Căn hộ chung cư,Sổ hồng/ Sổ đỏ,---,---,3,---,---,2,---,Khu đô thị mới Bắc Linh Đàm mở rộng (xem chi tiết dự án)
https://alonhadat.com.vn/ban-nha-32-mat-pho-cau-bay-vu-xuan-thieu-mat-tien-13m-2-mat-pho-dt-488m-4-tang-72-ty-13675394.html,"Bán Nhà 32 Mặt Phố Cầu Bây – Vũ Xuân Thiều, Mặt Tiền: 13m, 2 Mặt Phố DT: 488m/4 Tầng/72 Tỷ","Nhà Mặt Phố Cầu Bay – Phường Sài Đồng, Quận Long Biên, trước nhà mặt Phố Rộng hai xe Contener tránh nhau, vỉa hè hai bên rộng 5m, phía sau là Mặt Ngõ hai xe ô tô tránh, vỉa hè 1m, thông sang Phố Vũ Xuân Thiều, vài phút ra ngay Vinhomes Riverside, tiện ích ngập tràn. Nhà hiện trạng 4 tầng, trước nhà mặt tiền rộng 13m, xây ốt cho thuê ổn định, phù hợp về ở hoặc kinh doanh đa dạng
-	Diện tích: 488m, mặt tiền: 13m, vuông vắn trước sau
-	Thiết kế 4 tầng và khoảng sân rộng rãi, có hai kiot trước mặt nhà cho thuê
-	Giá bán: 72 Tỷ, Sổ đỏ chính chủ
-	Liên hệ: A,Chiến",72 tỷ,488 m2,"32 Đường Cầu Bây, Phường Sài Đồng, Quận Long Biên, Hà Nội",13675394,_,---,Cần bán,20m,---,Nhà mặt tiền,Sổ hồng/ Sổ đỏ,---,13m,4,---,---,4,---,
https://alonhadat.com.vn/ban-nha-20-ngo-70-pho-linh-quang-luong-su-c-nha-lo-goc-gan-pho-dt-20m-4-tang-2-48-ty-13696680.html,"Bán Nhà 20 Ngõ 70 Phố Linh Quang – Lương Sử C, Nhà Lô Góc, Gần Phố DT: 20m/4 Tầng/2.48 Tỷ","Nhà cách Hồ Linh Quang vài bước chân, ngõ thoáng, thông sang Phố Văn Chương, đi ra Lương Sử C, thông sang Phố Văn Miếu, 100m ra Chợ và Trường Học các cấp, gần Đường Ô Tô, tiện ích đầy đủ. Nhà xây dựng chắc chắn, lô góc thoáng các mặt, nội thất đầy đủ, phù hợp an sinh lâu dài
-	Diện tích: 20m, mặt tiền: 3.2m
-	Thiết kế 4 tầng, với 2 phòng ngủ + 3wc, cầu thang cuối
-	Giá bán: 2.48 Tỷ, Sổ đỏ chính chủ
-	Liên hệ: A,Chiến","2,48 tỷ",20 m2,"70 Đường Linh Quang, Phường Văn Chương, Quận Đống Đa, Hà Nội",13696680,_,---,Cần bán,3m,---,Nhà trong hẻm,Sổ hồng/ Sổ đỏ,---,"3,2m",4,---,7m,2,---,
https://alonhadat.com.vn/covid-can-ban-gap-nhanh-manh-dat-34m-o-dong-my-chi-voi-950-trieu-thoi--8899857.html,"CẦN Bán gấp mảnh đất ĐÔNG MỸ 46m vuông vắn tuyệt đẹp,ô tô cửa Chỉ với 1,550 tỷ.","MÔ TẢ:
+ Mảnh đất Nằm ở khu vực có vị trí đẹp,khu dân trí cao,yên tĩnh,giá rẻ 									
+ Cơ hội tốt cho các gia đình trẻ lên hà nội an cư lập nghiệp mua được đất ở thổ cư mà có tương lai tươi sáng.
+ Mảnh đất vuông đẹp thiết kế nhà rất đẹp và dễ bố trí công năng sử dụng tối đa nhu cầu sử dụng của cả gia đình									
+ Sổ đỏ và pháp lý chuẩn,đẹp sẵn sàng giao dich ngay khi đã YÊU EM.									
 Call ngay E.VINH HANH để xem và tư vấn miễn phí.","1,55 tỷ",46 m2,"i Xã Đông Mỹ, Huyện Thanh Trì, Hà Nội",8899857,_,True,Cần bán,3m,True,"Đất thổ cư, đất ở",Sổ hồng/ Sổ đỏ,True,4m,---,True,---,---,---,
https://alonhadat.com.vn/ban-gap-64m2-dat-pho-co-linh-gan-aeon-long-bien-nhinh-3-ty-o-to-vao-dat-13556648.html,"Bán gấp 64m2 đất phố Cổ Linh, gần Aeon Long Biên, nhỉnh 3 tỷ, ô tô vào đất","Bán gấp mảnh đất phố Cổ Linh, phường Thạch Bàn, quận Long Biên, gần Aeon Long Biên, cầu Vĩnh Tuy, cách mặt phố Bát Khối tầm 500m. Giao thông thuận tiện, qua trung tâm Hà Nội theo cầu Vĩnh Tuy hoặc Thanh Trì đều tiện.
. Diện tích 64m2, mặt tiền 4m vuông vắn, không lỗi phong thủy, ô tô nhỏ vào đất
. Sổ đỏ chính chủ, giao dịch ngay. Giá bán 3.7 tỷ (chỉ 58tr/m2)
. Miễn QC, TG làm phiền","3,7 tỷ",64 m2,"Đường Cổ Linh, Phường Thạch Bàn, Quận Long Biên, Hà Nội",13556648,_,---,Cần bán,1m,---,"Đất thổ cư, đất ở",Sổ hồng/ Sổ đỏ,---,4m,---,---,16m,---,---,
https://alonhadat.com.vn/nha-dep-lo-goc-kd-54m2-6t-12-ty-nguyen-khang-8792677.html,NHÀ ĐẸP - LÔ GÓC - KD 54M2 6T 12 TỶ - NGUYỄN KHANG,"Cần bán nhà NGUYỄN KHANG, Q. Cầu Giấy
+ DT 54m2 xây 6 Tầng, mặt tiền 5.5m, Nhà siêu đẹp.

Vị trí thích hợp làm văn phòng, vừa ở vừa kinh doanh bất chấp các thể loại.
Nhà xây 2019 vẫn còn mới nguyên, chủ tự xây có thiết kế đầy đủ. 
Nhà trong khu phân lô gần khu đô thị nhiều tiện ích
Tiện đường ra Vũ Phạm Hàm, Trung Kính, Trung Hòa, Duy Tân
Tầng 1 : Gara
Tầng 2 : khách + bếp
Tầng 3 : Ngủ
Tầng 4 : Thông phòng
Tầng 5 : 2 phòng ngủ lớn
Tầng 6 : 1 ngủ + kho + tum 

+ Sổ đỏ vuông đét, sẵn sàng giao dịch luôn.
+ GIÁ BÁN: 12 TỶ - Thương lượng - Gặp chủ giao dịch trực tiếp.
+ LH Ngay: A Xuân - để xem nhà ngay",12 tỷ,54 m2,"Đường Nguyễn Khang, Phường Yên Hòa, Quận Cầu Giấy, Hà Nội",8792677,_,True,Cần bán,20m,True,"Biệt thự, nhà liền kề",Sổ hồng/ Sổ đỏ,True,"5,5m",6,True,---,6,---,
