https://alonhadat.com.vn/toa-nha-dich-vu-dong-tien-pho-chua-lang-50m-7t-day-du-pccc-8-9-ty-13608007.html,"TOÀ NHÀ DỊCH VỤ DÒNG TIỀN PHỐ CHÙA LÁNG, 50M, 7T, ĐẦY ĐỦ PCCC, 8,9 TỶ","- Bán gấp toà nhà dịch vụ cho thuê, 50m, 7 tầng tháng máy, 11 phòng cho thuê, đã được trang bị đầy đủ hệ thống PCCC 
- Nằm ở phố Vip Chùa Láng, Láng Thượng, Đống Đa, nơi dân cư đông đúc nhộn nhịp lúc nào cho thuê cũng full phòng
- Gần rất nhiều trường đại học lớn, lượng sinh viên nhiều vô kể như : ĐH Luật, Ngoại Thương, Ngoại Giao, HV Thanh Thiếu Niên, ĐH Giao Thông VT
- Nhà nằm trên mặt ngõ thông cách phố 80m, với 11 phòng cho thuê, doanh thu 60tr/tháng
- Thiết kế 7 tầng với 11 căn hộ đã được trang bị full nội thất như : Điều hoà, nóng lạnh, giường tủ, bếp, tủ bếp..
- Sổ đỏ chính chủ, pháp lý rõ ràng
- Giá chào 8,9 tỷ có thương lượng","8,9 tỷ",50 m2,"Phố Chùa Láng, Phường Láng Thượng, Quận Đống Đa, Hà Nội",13608007,_,---,Cần bán,"2,5m",---,Nhà trong hẻm,---,---,---,7,---,---,11,---,
