url,title,description,price,area,address,Mã tin,Hướng,Phòng ăn,Loại tin,Đường trước nhà,Nhà bếp,Loại BDS,Pháp lý,Sân thượng,Chiều ngang,Số lầu,Chổ để xe hơi,Chiều dài,Số phòng ngủ,Chính chủ,Thuộc dự án
https://alonhadat.com.vn/kich-doc-dep-nhat-mat-pho-thai-ha-92m-mat-tien-5-2m-kinh-doanh-khung-gia-62-ty-9997427.html,"Kịch độc! Đẹp nhất mặt Phố Thái Hà, 92m, mặt tiền 5.2m, kinh doanh khủng, giá 62 tỷ","Hoa hậu mặt Phố Thái Hà, thông số vàng, kinh doanh khủng, thang máy, Trung tâm Đống Đa
S: 92m, mặt tiền 5.2m.

* Vị trí đắc địa: mặt phố Trung tâm Đống Đa, kinh doanh khỏi bàn.
Tiện ích các phố: Chùa Bộc, Tôn Đức Thắng, Nguyễn Lương Bằng, Tây Sơn, Thái Thịnh, Xã Đàn, Ngã Tư Sở,..,

* Thiết kế: thông sàn thang máy, nội thất đẳng cấp, nhiều phòng ngủ, tối ưu mọi công năng sử dụng,...
 
* Giá chào: 62 tỷ - mua bán nhà Thái Hà.
* Sổ đỏ chính chủ, sẵn sàng giao dịch.

* Lh: Nghệ sĩ bellydance & Hlv Yoga Hải Vân.
Nhà VIP giành cho khách VIP. Môi giới miễn làm phiền! Cảm ơn!",62 tỷ,92 m2,"Phố Thái Hà, Phường Cát Linh, Quận Đống Đa, Hà Nội",9997427,_,True,Cần bán,20m,True,Nhà mặt tiền,Sổ hồng/ Sổ đỏ,True,"5,2m",7,---,---,6,---,
https://alonhadat.com.vn/nha-hiem-4-tang-3-mat-thoang-3-buoc-ra-pho-bui-xuong-trach-45m2-gia-nhinh-5-ty-10693856.html,"NHÀ HIẾM 4 TẦNG, 3 MẶT THOÁNG, 3 BƯỚC RA PHỐ, BÙI XƯƠNG TRẠCH, 45M2, GIÁ NHỈNH 5 TỶ","NHÀ 3 MẶT THOÁNG - MẶT TIỀN RỘNG - 3 BƯỚC RA MẶT PHỐ
+ Diện tích: 45m2.
+ Mặt tiền: 4.5m.
Thiết kế 4 tầng Kiên Cố, mỗi tầng 2 phòng, tổng 5 phòng ngủ đầy đủ Công Năng, Phù Hợp cho gia đình 2, 3 thế hệ.
An sinh Tốt, Dân trí Cao, 3 Bước ra phố, Kinh Doanh, Buôn Bán ngày đêm, Khu vực Phát Triển từng ngày.
+ Sổ đỏ 3 vòng trước sau như 1, Vuông đét, sẵn sàng giao dịch.
+ Giá: nhỉnh 5 tỷ (Có thương lượng).
+ Liên hệ: Mr.Trí (24/7).
Miễn phí 100% phí dịch vụ kể từ lúc xem nhà đến khi mua được nhà. 
Hỗ trợ tư vấn phong thuỷ, pháp lý, kiến trúc, tài chính 24/24.",5 tỷ,45 m2,"Đường Bùi Xương Trạch, Phường Khương Đình, Quận Thanh Xuân, Hà Nội",10693856,_,True,Cần bán,3m,True,Nhà trong hẻm,---,True,"4,5m",4,True,---,5,---,
https://alonhadat.com.vn/can-tien-kinh-doanh-ban-gap-nha-truong-dinh-o-to-sat-pho-noi-that-xin-so-46m2-5-ty-11820429.html,"Cần tiền kinh doanh bán gấp nhà Trương Định, ô tô, sát phố, nội thất xịn sò, 46m2, 5 tỷ","Ô tô đỗ Cổng - Tương Lai mặt phố - Full nội thất...

- Vị trí ngay Sát mặt phố Trương Định, ô tô đỗ Cổng, cách Phố chỉ 10m.
- Tương lai Sau Quy Hoạch mặt phố Sáng Ngời.
- Tiện ích xung quanh đầy đủ với trường học các cấp, chợ Mơ, ra Time City cũng Rất Gần.
- Đường Trương Định, trục đường chính kết nối trung tâm với khu vực phía Nam thành phố. Cách Đại học Bách Kinh Xây, bệnh viện Bạch Mai 5 phút xe máy, thuận tiện giao thông đi lại.
- Nhà Đẹp như Tranh, nội thất Nhập Khẩu, chỉ việc xách vali vào ở.
- Thiết kế mỗi tầng 2 phòng (tổng 4 phòng ngủ rộng). Vệ sinh, cầu thang, giếng trời ở giữa.
- Sổ đỏ phân lô, Vuông Vắn cực đẹp, sẵn sàng giao dịch.
- Giá: 5 tỷ (Có thương lượng).

Liên hệ ngay tới em Trí (24/7) để xem nhà.
Miễn 100% phí dịch vụ kể từ lúc xem nhà đến khi mua được nhà.
Hỗ trợ tư vấn phong thuỷ, pháp lý, kiến trúc, tài chính 24/24.",5 tỷ,46 m2,"Đường Trương Định, Phường Trương Định, Quận Hai Bà Trưng, Hà Nội",11820429,_,True,Cần bán,4m,True,Nhà trong hẻm,Sổ hồng/ Sổ đỏ,True,"4,05m",4,True,---,4,---,
https://alonhadat.com.vn/cuc-hiem-nha-nam-dong-lo-goc-phan-lo-o-to-o-suong-43m2-x-4t-nhinh-6-ty-11847871.html,Cực Hiếm! Nhà Nam Đồng Lô góc - Phân lô - Ô tô - Ở sướng - 43m2 x 4T nhỉnh 6 tỷ,"Gia chủ cần bán GẤP, tìm khách thiện chí, liên hệ ngay Mr. Nhật Anh Thổ địa Đống Đa (0949***428) để xem nhà.

+ Vị trí nhà cách phố Ô tô tránh 20m, cách mặt Hồ Đắc Di 50m, nhiều hàng quán nổi tiếng cực hưởng thụ.

+ Nhà phân lô, lô góc, tự thiết kế tự xây, thiết kế tổng 3 phòng đều có ban công thoáng sáng, có sân để xe, trồng cây.

+ Khu vực an sinh tốt, hàng xóm trí thức, giao thông cực kỳ thuận tiện, gần trường học từ mẫu giáo đến đại học (Việt Triều, Đống Đa, Kim Liên, Lê Quý Đôn, Bách Khoa - Kinh tế - Xây dựng), chợ, bệnh viện, bến xe buýt.

+ Thông số: Diện tích: 43m² x 4 tầng x 4m mặt tiền

Sổ đỏ cất két, sẵn sàng giao dịch.
Giá bán: 6.15 tỷ (thương lượng mạnh).


Hội tụ nhà đẹp Hà Nội.
Nhiệt tình - uy tín - chuyên nghiệp, miễn trung gian - môi giới.","6,15 tỷ",43 m2,"Phố Hồ Đắc Di, Phường Nam Đồng, Quận Đống Đa, Hà Nội",11847871,_,True,Cần bán,4m,True,Nhà trong hẻm,Sổ hồng/ Sổ đỏ,True,4m,4,---,---,3,---,
https://alonhadat.com.vn/hiem-qua-nha-view-ho-ba-mau-43m2-x-5-tang-phan-lo-o-to-do-cua-full-noi-that-nhinh-4-ty-12127857.html,"Hiếm quá! Nhà view Hồ Ba Mẫu 43m2 x 5 tầng phân lô, ô tô đỗ cửa, full nội thất nhỉnh 4 tỷ","Nhà bán vị trí đắc địa, 2 mặt thoáng sáng, đi bộ ra Hồ Ba Mẫu, khu vực  quy hoạch ổn định, quần thể đẹp văn minh, không khí trong lành ở quá sướng!

+ Thông số nhà: 43m2 - 5 tầng  - 4m mặt tiền

+ An sinh đỉnh, gần công viên Thống Nhất Lê Duẩn Đại Cổ Việt, gần ngã tư Kim Liên Vincom Phạm Ngọc Thạch, gần ngã 6 ô Chợ Dừa, Đại Học Bách Khoa - KTQD - Công Đoàn - Ngân hàng.

+ Giao thông thuận tiện kết nối phố Đại Cồ Việt - Lê Duẩn - Ô Đồng Lầm - Xã Đàn - Kim Hoa - Phạm Ngọc Thạch - Khâm Thiên.

+ Nhà kiên cố chắc chắn, 2 mặt thoáng, 3 ngủ đủ công năng, nội thất đầy đủ khách chỉ việc xách vali vào ở.

+ Sổ đỏ chính chủ, khách thiện chí sang tên ngay.

Giá bán: nhỉnh 4 tỷ

***********************************
Liên hệ: Mr. Nhật Anh (gọi hoặc inbox 24/24h)
+ Hỗ trợ tài chính cho quý anh chị có nhu cầu.
+ Miễn phí 100% tất cả các dịch vụ từ lúc đi xem nhà đến lúc mua được nhà.
***Xem 100 căn nhà ảo trên mạng không bằng gặp 01 ông môi giới tử tế, cam kết hỗ trợ khách hàng nhà từ cuộc gọi đầu tiên đến khi mua được căn nhà ưng ý! ***",4 tỷ,47 m2,"Đường Hồ Ba Mẫu, Phường Phương Liên, Quận Đống Đa, Hà Nội",12127857,_,True,Cần bán,7m,True,Nhà trong hẻm,Sổ hồng/ Sổ đỏ,True,4m,5,---,---,6,---,
https://alonhadat.com.vn/ban-nha-nguyen-an-ninh-hoang-mai-56m2-5t-o-to-kinh-doanh-nhinh-5-ty--9215093.html,"Bán Nhà Nguyễn An Ninh, Hoàng Mai: 56m2*5T Ô tô, Kinh Doanh nhỉnh 5 tỷ.","Chính chủ cần bán phố Nguyễn An Ninh, Phường Tương Mai, Q. Hoàng Mai, Hà Nội.

+ Vị trí đẹp đắc địa trung tâm phân lô đáng sống nhất quận Hoàng Mai, giao thông thuận lợi di chuyển giữa các tuyến phố: Giải Phóng, Trần Đại Nghĩa, Phố Vọng, Đại La, Minh Khai, Trương Định, Đền Lừ, Tân Mai, Giáp Bát...

+ Tiện ích xung quanh nhiều vô kể như: Trường học các cấp từ Mầm Non, phổ thông, trung hoc đến Đại hoc: Kinh Tế Quốc Dân, Bách Khoa, Xây Dựng...gần nhiều Bệnh viện lớn như: Bạch Mai, Da Liễu, Tai Mũi Họng, Lão Khoa,...và nhiều TTTM, Chợ dân sinh, Hồ, Công viên, Bến xe...

+ Diện tích lớn 56m2 thiết kế xây dựng 5 tầng, vừa ở vừa kinh doanh hoặc văn phòng công ty. Nhà đẹp, các phòng rộng thoáng sáng, đầy đủ phòng ngủ và công năng sử dụng cho hộ gia đình nhiều người.

+ Pháp lý Sổ đỏ phân lô chính chủ, giao dịch luôn. Giá nhỉnh 5 tỷ có thương lượng.

+ Gọi ngay nhà đẹp Minh Giang: Luôn tận tâm, trách nhiệm, uy tín… Đến với tôi, quý khách và anh chị sẽ được:

* Được về thời gian, đảm bảo mua được nhà, không mất thời gian nhiều cho việc tìm và mua nhà như ý muốn.

* Được cung cấp thông tin, xem nhà và hỗ trợ đàm phán giá tốt nhất (hoàn toàn miễn phí).

* Được gặp chủ nhà thương lượng trực tiếp.","5,7 tỷ",56 m2,"Hoàng Mai Đường Nguyễn An Ninh, Phường Tương Mai, Quận Hoàng Mai, Hà Nội",9215093,_,---,Cần bán,4m,---,Nhà trong hẻm,---,---,"3,8m",5,---,---,4,---,
https://alonhadat.com.vn/thanh-nhan-36m2-nha-moi-o-vip-nhinh-3-ty-cach-pho-vai-buoc-chan--8079827.html,Thanh Nhàn 36m2 Nhà mới ở Vip nhỉnh 3 tỷ cách phố vài bước chân.,"+ Vị trí cách phố vài bước chân, ngõ to rộng, văn minh sạch đẹp.
 
+ Nhà khu trung tâm tiện ích trường học, Công viên Hồ...

+ Nhà đẹp ở sướng, chủ làm tâm huyết, xịn xò, khách chỉ việc xách vali về ở ngay.

+ Nhà thiết kế đầy đủ công năng: phòng khách, bếp 3 phòng ngủ, phòng thờ, sân phơi.

+ Sổ vuông đẹp, giá 3,25 tỷ có thương lượng.

+ Gọi ngay Nhà đẹp Minh Giang: Tận tâm, nhiệt tình, Hỗ trợ tư vấn miễn phí.","3,25 tỷ",36 m2,"Thanh Nhàn Đường Thanh Nhàn, Phường Thanh Nhàn, Quận Hai Bà Trưng, Hà Nội",8079827,_,True,Cần bán,3m,True,Nhà trong hẻm,Sổ hồng/ Sổ đỏ,True,"3,9m",4,True,---,3,---,
https://alonhadat.com.vn/ban-nha-nguyen-an-ninh-hoang-mai-56m2-5t-o-to-kinh-doanh-nhinh-5-ty--9215103.html,"Bán Nhà Nguyễn An Ninh, Hoàng Mai: 56m2*5T Ô tô, Kinh Doanh nhỉnh 5 tỷ.","Chính chủ cần bán phố Nguyễn An Ninh, Phường Tương Mai, Q. Hoàng Mai, Hà Nội.

+ Vị trí đẹp đắc địa trung tâm phân lô đáng sống nhất quận Hoàng Mai, giao thông thuận lợi di chuyển giữa các tuyến phố: Giải Phóng, Trần Đại Nghĩa, Phố Vọng, Đại La, Minh Khai, Trương Định, Đền Lừ, Tân Mai, Giáp Bát...

+ Tiện ích xung quanh nhiều vô kể như: Trường học các cấp từ Mầm Non, phổ thông, trung hoc đến Đại hoc: Kinh Tế Quốc Dân, Bách Khoa, Xây Dựng...gần nhiều Bệnh viện lớn như: Bạch Mai, Da Liễu, Tai Mũi Họng, Lão Khoa,...và nhiều TTTM, Chợ dân sinh, Hồ, Công viên, Bến xe...

+ Diện tích lớn 56m2 thiết kế xây dựng 5 tầng, vừa ở vừa kinh doanh hoặc văn phòng công ty. Nhà đẹp, các phòng rộng thoáng sáng, đầy đủ phòng ngủ và công năng sử dụng cho hộ gia đình nhiều người.

+ Pháp lý Sổ đỏ phân lô chính chủ, giao dịch luôn. Giá nhỉnh 5 tỷ có thương lượng.

+ Gọi ngay nhà đẹp Minh Giang: Luôn tận tâm, trách nhiệm, uy tín… Đến với tôi, quý khách và anh chị sẽ được:

* Được về thời gian, đảm bảo mua được nhà, không mất thời gian nhiều cho việc tìm và mua nhà như ý muốn.

* Được cung cấp thông tin, xem nhà và hỗ trợ đàm phán giá tốt nhất (hoàn toàn miễn phí).

* Được gặp chủ nhà thương lượng trực tiếp.","5,7 tỷ",56 m2,"Hoàng Mai Đường Nguyễn An Ninh, Phường Tương Mai, Quận Hoàng Mai, Hà Nội",9215103,_,---,Cần bán,4m,---,Nhà trong hẻm,Sổ hồng/ Sổ đỏ,---,"3,8m",5,---,---,4,---,
https://alonhadat.com.vn/-vip-ban-nha-quan-hai-ba-phan-lo-oto-tranh-do-2-mat-thoang-46m2-nhinh-5-ty--6407293.html,"*VÍP* Bán nhà Quận Hai Bà: Phân lô, Ôtô tránh đỗ, 2 mặt thoáng, 46m2, nhỉnh 5 tỷ.","+ Vị trí nằm trong phố phường Bạch Mai, dãy nhà phân lô của cán bộ Quận. Phía trước là cơ quan Quận, phía sau là sân khu tập thể TTXVN nên thoáng 2 mặt vĩnh viễn., không khí lưu thông thoáng mát.

+Ngõ rộng 6m, ô tô tránh, đỗ cả ngày trước nhà, di chuyển thuận tiện, xung quanh là các phố lớn Bạch Mai, Thanh Nhàn, Minh Khai… 

+Khu vực an sinh tốt, tiên ích xã hội đầy đủ, gần nhiều trường đại học lớn, công viên, bệnh viện,... cách Hồ Gươm 2km: Ở đỉnh, làm văn phòng, cho thuê…

+ Diện tích 46m2, nhà khung bê tông 4 tầng, mỗi tầng 2 phòng.

+ Chủ nhà là cán bộ Quận đã chuyển về nhà mới.

+ Sổ đỏ chính chủ, vuông đẹp, sẵn sàng giao dịch.

+ Giá 5.7 tỷ, có thương lượng.

+ Gọi ngay Mr Giang: Để được xem nhà, tư vấn và hỗ trợ thông tin hoàn toàn miễn phí…

Tin để cuộc sống tốt hơn, Tín để giá trị cuộc sống được nâng cao…","5,7 tỷ",46 m2,"Phố Bùi Ngọc Dương, Phường Bạch Mai, Quận Hai Bà Trưng, Hà Nội",6407293,_,---,Cần bán,6m,---,Nhà trong hẻm,Sổ hồng/ Sổ đỏ,---,"3,9m",4,---,---,4,---,
https://alonhadat.com.vn/ban-nha-biet-thu-xuan-phuong-nam-tu-liem-5tang-11-ty-13331674.html,"Bán nhà biệt thự xuân phương, nam từ Liêm, 5tầng 11 tỷ","LIỀN KỀ - 5 TẦNG LÔ GÓC 3 MẶT TIỀN - ĐƯỜNG 10M - VỈA HÈ 6M - Ô TÔ DỪNG ĐỖ - VĂN PHÒNG

+ Vị trí nhà liền kề Xuân Phương Viglacera 5 tầng lô góc 3 mặt thoáng. Mặt đường lớn 10m, có vỉa hè cực rộng 6m, ô tô dừng đỗ cửa, mặt ngõ cạnh và sau rộng 6m chạy vòng quang có mở cửa cạnh và cửa sau.

+ Vị trí phát triển nhiều tiện ích: Hồ điều hòa, sân chơi cho trẻ em, khu thể thao, bể bơi, nhà hàng và mua sắm. Nhà trẻ, trường tiểu học, trường THCS chất lượng cao được đầu tư kỹ lưỡng từ cơ sở vật chất đến chất lượng giáo dục.

+ Cạnh Xuân Phương Viglacera còn có quy hoạch Làng đại học Vân Canh, làng giáo dục Quốc tế, đáp ứng nhu cầu đào tạo của nhiều lứa tuổi đi học khác nhau.

+ Nằm trên trục đường 70, gần tuyến đường nối đường 70 với đường Lê Đức Thọ với thiết kế mặt cắt đường 50m, quy mô 8 làn xe. Giao thông đến Đại Lộ Thăng Long, đường 32 rất thuận lợi.

+ Nhà 5 tầng thiết kế nội thất đẹp.

- Tầng 1: 2 phòng + vệ sinh.
- Tầng 2: 3 phòng rộng.
- Tầng 3, 4: Mỗi tầng 2 phòng + vệ sinh từng tầng.
- Tầng 5: Phòng thờ.

+ Nhà có thế cải tạo lại lắp cầu thang máy, xây lại mới được.

+ Sổ đỏ chính chủ vuông vắn sắc nét nở hậu nhẹ cực lộc.",11 tỷ,120 m2,"Đường Xuân Phương, Phường Xuân Phương, Quận Nam Từ Liêm, Hà Nội",13331674,_,---,Cần bán,10m,---,"Biệt thự, nhà liền kề",---,---,---,5,---,---,8,---,Khu đô thị mới Xuân Phương Viglacera (xem chi tiết dự án)
https://alonhadat.com.vn/chu-binh-quan-ban-nha-giap-nhat-nga-tu-so-nha-dep-xach-vali-vao-o-chi-5-9-ty-12795458.html,"Chú Bình Quân Bán Nhà Giáp Nhất-Ngã Tư Sở, Nhà Đẹp, Xách Vali Vào Ở, Chỉ 5,9 Tỷ","mô tả:
Vị trí nhà mặt ngõ oto, thông tứ tung, nhà đẹp từ thiết kế đến nội thất, chỉ vài bước ra phố....
Nhà thiết kế đẹp, nội thất được chú chủ chọn lựa kĩ càng, xách đồ vào ở ngay.
Liên hệ em Quốc để xem nhà và tư vấn miễn phí.
Cam kết thông tin minh bạch - chính xác.","5,9 tỷ",45 m2,"Đường Giáp Nhất, Phường Nhân Chính, Quận Thanh Xuân, Hà Nội",12795458,_,True,Cần bán,3m,True,Nhà trong hẻm,Sổ hồng/ Sổ đỏ,True,6m,5,---,"7,5m",6,---,
https://alonhadat.com.vn/nha-dep-pho-vu-trong-phung-nha-dep-chu-xay-tam-huyet-chua-den-6-ty--13341472.html,"Nhà Đẹp Phố Vũ Trọng Phụng, Nhà Đẹp, Chủ Xây Tâm Huyết, Chưa Đến 6 Tỷ.","mô tả:
Vị trí cực hót trung tâm Quận Thanh Xuân, kinh doanh, oto gần, trường học cấp 1, 2, 3 gần kề, chợ nhân chính chỉ hơn 100m, gần trường đại học khoa học và tự nhiên, đại học quốc gia, ....
Nhà chủ xây dựng tâm huyết đầy đủ công năng sử dụng trên diện tích 45 m², tặng lại nội thất như ảnh.
Sổ đỏ chính chủ, pháp lý rõ ràng,thuận tiện giao dịch.
Liên hệ Mr Quốc để xem nhà và làm việc chính chủ.","5,9 tỷ",45 m2,"Đường Vũ Trọng Phụng, Phường Thanh Xuân Trung, Quận Thanh Xuân, Hà Nội",13341472,_,True,Cần bán,3m,True,Nhà trong hẻm,Sổ hồng/ Sổ đỏ,True,"4,5m",4,---,11m,3,---,
https://alonhadat.com.vn/nha-nguyen-trai-thanh-xuan-chi-nhinh-110tr-m-dt-38m-noi-that-xin-so-xach-do-o-luon--11888010.html,Nhà Nguyễn Trãi-Thanh Xuân_Chỉ Nhỉnh 110tr/m²_Dt 38m²_Nội Thất Xịn Sò_Xách Đồ Ở Luôn.,"Mô tả:
» Nhà nằm ở vị trí trung tâm Q Thanh Xuân, di chuyển ra các tuyến phố lớn nhanh, gần chợ kinh doanh sầm uất, bán kính 100 đầy đủ tiện ích.
» Nhà được chủ tân tâm thiết kế, lộc lá nên chuyển nhà to đẹp hơn, tặng lại nội thất hiện đại sang trọng, Nhà thông thoáng phòng nào cũng có cửa sổ.
» Chi tiết thiết kế : 
Tầng 1 : Phòng khách , bếp + WC.
Tầng 2 : Phòng ngủ Master + WC
Tầng 3 : 2 phòng ngủ + WC
Tầng 4 : Phòng thờ + Sân phơi + trồng cây cực rộng - Có thể làm thêm phòng nếu cần.
♥ Sổ đỏ pháp lý đầy đủ, giao dịch nhanh chóng.
Liên hệ Mr Quốc để xem nhà, kết nối chính chủ.
☼ Cam kết thông tin minh bạch, chính xác !","4,4 tỷ",38 m2,"Phố Chính Kinh, Phường Khương Đình, Quận Thanh Xuân, Hà Nội",11888010,_,True,Cần bán,"2,5m",True,Nhà trong hẻm,Sổ hồng/ Sổ đỏ,True,6m,4,---,"6,3m",3,---,
https://alonhadat.com.vn/-chua-den-6-ty-ban-nha-mat-ngo-quan-nhan-thanh-xuan-oto-vao-nha-ngo-thong-dt-42m--11922332.html,☼ CHƯA ĐẾN 6 TỶ ☼ Bán Nhà Mặt Ngõ Quan Nhân-Thanh Xuân_Oto Vào Nhà_Ngõ Thông_Dt 42m²,"Mô tả:
» Nhà có vị trí cực đẹp, trước nhà oto chạy vù vù, nhà mặt ngõ 4,3m, di chuyển cực tiện ra các tuyến phố lớn: Láng, Nguyễn Trãi....
» Tiện ích quanh nhà, chỉ trong bán kính 1km đầy đủ trạm ý tế, trường học các cấp 1, 2, 3 ...
» Nhà chủ xây tâm huyết, móng cột chắc chắn, với tổng 3 phòng ngủ.
» Sổ đỏ chính chủ pháp lý chuẩn
♥ Liên hệ Mr Quốc để xem nhà và kết nối chính chủ.
♥ Cam kết thông tin chính xác - minh bạch.","5,8 tỷ",42 m2,"Phố Quan Nhân, Phường Nhân Chính, Quận Thanh Xuân, Hà Nội",11922332,_,True,Cần bán,"4,3m",True,Nhà trong hẻm,---,True,4m,3,True,10m,3,---,
https://alonhadat.com.vn/ban-nha-viet-hung-long-bien-5-tang-32-m2-mt-3-9m-nha-dep-hon-3-ty-13336914.html,"Bán nhà Việt Hưng ,Long Biên 5 tầng ,32 m2 ,MT 3.9m nhà đẹp hơn 3 tỷ","+ Vị trí cực đẹp ngõ thông ô tô đỗ cửa, cách Vinhomes Riverside đúng 50m đường rộng 30m. 
+ Thiết kế hiện đại 5 tầng với 3 ngủ, vệ sinh khép kín có ban công cửa sổ thoáng sáng.
+ Khu vực phát triển cực mạnh giá hiện tại rất tốt .
+ Nhà đang cho thuê Fun 90% nội thất, khách mua xách va ly về là ở.
+ Sổ đỏ đẹp nở hậu nhẹ, sẵn sàng giao dịch.
- Gọi ngay để có cơ hội sở hữu: Phạm Bình –  để được tư vấn và giới thiệu gần 300 căn nhà các loại cùng khu vực với tài chính từ 3 tỷ đến 10 tỷ.","3,2 tỷ",32 m2,"Đường Việt Hưng, Phường Việt Hưng, Quận Long Biên, Hà Nội",13336914,_,---,Cần bán,"2,5m",---,Nhà trong hẻm,Sổ hồng/ Sổ đỏ,---,"3,9m",5,---,"8,2m",3,---,
https://alonhadat.com.vn/xuan-thuy-phan-lo-o-to-kinh-doanh-47m-6-tang-thang-may-13310388.html,XUÂN THỦY PHÂN LÔ Ô TÔ KINH DOANH 47M 6 TẦNG THANG  MÁY,"❤️ KHU VỰC VĂN MINH DÂN TRÍ CAO, NHIỀU SINH VIÊN, CHỢ DÂN SINH

❤️ PHÂN LÔ Ô TÔ, 2 MẶT NGÕ, NHÀ MỚI TUYỆT ĐẸP, THANG MÁY, KHÁCH CHỈ XÁCH VALI VỀ Ở

❤️ DT 47M, 6 TẦNG, NHỈNH 11 TỶ

❤️ SỔ ĐỎ CHÍNH CHỦ, GIAO DỊCH NGAY","11,2 tỷ",47 m2,"Đường Xuân Thủy, Phường Dịch Vọng, Quận Cầu Giấy, Hà Nội",13310388,_,True,Cần bán,4m,True,"Biệt thự, nhà liền kề",Sổ hồng/ Sổ đỏ,True,---,6,---,---,6,---,
https://alonhadat.com.vn/ban-toa-nha-7-tang-mat-pho-phung-hung-quan-ha-dong-thang-may-kinh-doanh-dinh-gia-35ty-12733072.html,"Bán Tòa nhà 7 tầng, Mặt phố Phùng Hưng, quận Hà Đông, Thang máy, Kinh doanh đỉnh, Giá 35tỷ","Cần bán Tòa nhà 7 tầng, Mặt phố Phùng Hưng, quận Hà Đông, Hà Nội:

+ Diện tích: 155m, 7 tầng, Mặt tiền 7m, Thang máy, 35 tỷ 

- Vị trí đắc địa, trục chính của quận Hà Đông. Đường rộng hai chiều, vỉa hè rộng. Gần ngay cầu Đen, đường 19/5, Văn Quán, Yên Phúc … Mặt đường Kinh doanh sầm uất mọi loại hình. 

+ Tòa nhà 7 tầng, Thang máy, đã xây lùi vào trong theo chỉ giới Qh mở đường, nên hoàn toàn yên tâm. Mai sau đường mở rộng ra thì giá trị nhà sẽ tăng vọt. Nhà đang cho thuê dòng tiền gần 100tr/tháng. 

+Phù hợp khách mua đầu tư, giữ tiền và sinh lời cao, lại có dòng tiền ổn định hàng tháng. Khách có thể mua làm Văn phòng Trụ sở Công ty, Kinh doanh Spa, thẩm mỹ viện … 

-Sổ vuông đẹp, phân lô, sẵn giao dịch

-Giá: 35 ỷ - Có thương lượng. 

Chi tiết xem tại: 

Liên hệ: Chị Thu Hiền – 
Chuyên gia nhà Mặt phố",35 tỷ,155 m2,"Đường Phùng Hưng, Phường Văn Quán, Quận Hà Đông, Hà Nội",12733072,_,True,Cần bán,20m,True,Nhà mặt tiền,Sổ hồng/ Sổ đỏ,True,7m,7,True,20m,7,---,
https://alonhadat.com.vn/ban-nha-mat-pho-nguyen-van-loc-ha-dong-155m-mat-tien-rong-9m-kinh-doanh-dinh-49-8-ty--12708053.html,"Bán nhà Mặt phố Nguyễn Văn Lộc, Hà Đông, 155m, Mặt tiền rộng 9m, Kinh doanh đỉnh, 49.8 tỷ.","Cần bán nhà Mặt phố Nguyễn Văn Lộc, quận Hà Đông, Hà Nội:

+ Diện tích: 155m, 4 tầng, Mặt tiền 9m, 49.8 tỷ 

- Vị trí đắc địa, mặt phố đẹp nhất khu vực, đường 2 chiều, vỉa hè mênh mông. Kinh doanh sầm uất. Liền kề với khu Làng việt Kiều Châu Âu, Gần Trần Phú, An Hòa, Tố Hữu, Nguyễn Khuyến và Văn Quán … 

+ Nhà 4 tầng, đang cho thuê Kinh doanh rất tốt. 

+Phù hợp khách mua đầu tư, giữ tiền, cho thuê có dòng tiền, Kinh doanh Nhà hàng, Café, Spa, Trụ sở Công ty … 

-Sổ vuông đẹp, phân lô, sẵn giao dịch

-Giá: 49.8 tỷ - Có thương lượng. 

Chi tiết xem tại:

Liên hệ: Chị Thu Hiền – 
Chuyên gia nhà Mặt phố","49,8 tỷ",155 m2,"Đường Nguyễn Văn Lộc, Phường Mộ Lao, Quận Hà Đông, Hà Nội",12708053,_,True,Cần bán,20m,True,Nhà mặt tiền,Sổ hồng/ Sổ đỏ,True,9m,4,True,17m,4,---,
https://alonhadat.com.vn/ban-cac-can-ho-chung-cu-green-park-tran-thu-do-hoang-mai-moi-tinh-9628437.html,"Bán các căn hộ chung cư Green Park Trần Thủ Độ, Hoàng Mai mới tinh","Bán các căn hộ chung cư Green Park Trần Thủ Độ, Hoàng Mai mới tinh

Bán các căn hộ chung cư Phương Đông Green Park số 1 Trần Thủ Độ, Hoàng Mai mới nhận nhà chưa ở. Dự án cách bến xe nước Ngầm 200m, cách công viên Yên Sở 1km, cách bến xe Giáp Bát - 1.5 Km

Thông tin căn hộ:
-Diện tích: từ 52m2 đến 100m2
-Phòng ngủ: 02 hoặc 03
-Phòng tắm: 02
-Phòng khách, bếp, 2 logia riêng biệt.

Phương Đông Green Park đầy đủ tiện ích như: Gym, bể bơi trong nhà, trung tâm thương mại, khu vui chơi trẻ em, Spa, phòng khám bệnh…

Giá bán thỏa thuận tùy theo diện tích, tầng, hướng và nội thất.","2,2 tỷ",75 m2,"1 Đường Trần Thủ Độ, Phường Hoàng Liệt, Quận Hoàng Mai, Hà Nội",9628437,_,True,Cần bán,---,True,Căn hộ chung cư,Sổ hồng/ Sổ đỏ,True,---,---,True,---,2,---,Căn hộ chung cư Green Park Trần Thủ Độ (xem chi tiết dự án)
