url,title,description,price,area,address,Mã tin,Hướng,Phòng ăn,Loại tin,Đường trước nhà,Nhà bếp,Loại BDS,Pháp lý,Sân thượng,Chiều ngang,Số lầu,Chổ để xe hơi,Chiều dài,Số phòng ngủ,Chính chủ
https://alonhadat.com.vn/9-9-ty-lo-goc-o-to-vao-nha-ban-nha-chua-lang-65m-5-tang-mt-6m--7927973.html,"9.9 tỷ! Lô Góc! Ô tô vào nhà! Bán nhà Chùa Láng 65m, 5 tầng, mt 6m.","Vị trí tuyệt đẹp! Ngõ thẳng tắp, rộng 5m, cách mặt phố Chùa Láng 30m.
Nhà Lô Góc! Cực kỳ thoáng mát. Tất cả các phòng đều mở cửa sổ.
Diện tích 65m2, mặt tiền 6m, xây 5 tầng. Thiết kế:
+ Tầng 1: Thông sàn
+ Tầng 2,3,4: Mỗi tầng 2 phòng và vệ sinh khép kín
+ Tầng 5: 1 phòng và sân phơi.
Gần ngay Đại học Ngoại Thương, Học viện Ngoại Giao.
Sổ đỏ chính chủ.
Giá: 9.9 tỷ (có thương lượng)
Liên hệ Ngô Văn Minh (Miễn MG, TG)","9,9 tỷ",65 m2,"Phố Chùa Láng, Phường Láng Thượng, Quận Đống Đa, Hà Nội",7927973,_,True,Cần bán,5m,True,Nhà trong hẻm,Sổ hồng/ Sổ đỏ,True,6m,5,True,11m,6,---
https://alonhadat.com.vn/10-8-ty-via-he-o-to-tranh-ban-nha-ngo-95-chua-boc-52m-5-tang-mt-4-2m-8499270.html,"10.8 tỷ! Vỉa hè! Ô tô tránh! Bán nhà ngõ 95 Chùa Bộc 52m, 5 tầng, mt 4.2m","Vị trí đắc địa! Ngõ 95 Chùa Bộc. Ngõ đẹp nhất của phố Chùa Bộc. Thông sang phố Tam Khương.
Đường trước nhà rộng 7m, vỉa hè rộng 1.2m, ô tô tránh nhau, đỗ cửa 24/24.
Khu vực tập trung nhiều văn phòng cty, sinh viên của trường Đại học Thủy Lợi, Hv Ngân Hàng,… Phù hợp để kinh doanh hàng ăn, Spa, Nail, Cắt tóc,…
Sổ đỏ chính chủ 52m2, mặt tiền 4.2m, xây 5 tầng.
Nhà 2 thoáng trước sau, các phòng đều mở cửa sổ. Cực kỳ thoáng mát.
Giá: 10.8 tỷ (có thương lượng)
Liên hệ Ngô Văn Minh (Miễn MG, TG)","10,8 tỷ",52 m2,"Phố Chùa Bộc, Phường Trung Liệt, Quận Đống Đa, Hà Nội",8499270,_,True,Cần bán,8m,True,Nhà trong hẻm,Sổ hồng/ Sổ đỏ,True,"4,2m",5,True,12m,5,---
https://alonhadat.com.vn/14-ty-lo-goc-o-to-tranh-kinh-doanh-ban-nha-mat-ngo-131-thai-ha-68m2-5-tang-mt4-2m-8548014.html,"14 tỷ! Lô Góc! Ô tô tránh! Kinh Doanh! Bán nhà Mặt ngõ 131 Thái Hà 68m2, 5 tầng, mt4.2m","Ngõ 131 Thái Hà là 1 trong 4 ngõ đẹp nhất Phố Thái Hà. Thông sang phố Nguyễn Văn Tuyết.
Trước nhà ô tô tránh, đỗ cửa 24/24. Nhà mình đỗ được 3 cái ô tô không ảnh hưởng tới ai.
Nhà Lô Góc! 1 Mặt ngõ, 1 mặt ngách. Mở cửa 2 bên cực kỳ thoáng mát.
Diện tích sổ đỏ 63m2, tầng 2 đua ra 1 ít là 68m2. Mặt tiền 4.2m, xây 5 tầng. Thiết kế:
+ Tầng 1: Kinh Doanh (Hoặc Gara ô tô), Bếp và vệ sinh
+ Tầng 2,3,4: Mỗi tầng 2 phòng vệ sinh khép kín
+ Tầng 5: Phòng thờ và sân phơi.
Nhà mặt ngõ! Phù hợp với mọi loại hình kinh doanh.  Đặc biệt là đồ điện tử, thời trang, spa, nail,…
Sổ đỏ chính chủ. Vuông vắn trước sau. Không lỗi phong thủy.
Giá: 14 tỷ (có thương lượng)
Liên hệ Ngô Văn Minh (Miễn MG, TG)",14 tỷ,68 m2,"Phố Thái Hà, Phường Trung Liệt, Quận Đống Đa, Hà Nội",8548014,_,---,Cần bán,7m,---,Nhà trong hẻm,Sổ hồng/ Sổ đỏ,---,"4,2m",5,---,15m,5,---
https://alonhadat.com.vn/14-9-ty-via-he-o-to-tranh-kinh-doanh-dinh-ban-nha-thai-ha-113m2-6-tang-mt-5-3m-8559347.html,"14.9 tỷ! Vỉa hè! Ô tô tránh! Kinh Doanh Đỉnh! Bán nhà Thái Hà 113m2, 6 tầng, mt 5.3m","Vị trí đắc địa! Ngõ Ô tô tránh! Thẳng tắp! Cách mặt phố Tây Sơn 50m2.
Đường trước nhà rộng 5m, vỉa hè rộng 2.5m. Kinh Doanh tốt. Đặc biệt là hàng ăn.
Gần ngay ngã tư Thái Hà – Tây Sơn
Diện tích 113m2, mặt tiền 5.4m, xây 6 tầng. Có sẵn ô chờ thang máy.
Nhà cực kỳ thoáng mát, ở cực thích, rất có lộc.
Sổ đỏ chính chủ.
Giá: 14.9 tỷ (có thương lượng)
Liên hệ Ngô Văn Minh (Miễn MG, TG)","14,9 tỷ",114 m2,"Phố Thái Hà, Phường Trung Liệt, Quận Đống Đa, Hà Nội",8559347,_,True,Cần bán,6m,True,Nhà trong hẻm,Sổ hồng/ Sổ đỏ,True,"5,3m",6,True,11m,10,---
https://alonhadat.com.vn/nhinh-9-ty-o-to-do-cua-ban-nha-ngo-104-nguyen-phuc-lai-68m2-5-tang-mt-4-7m-8574031.html,"Nhỉnh 9 tỷ! Ô tô đỗ cửa! Bán nhà ngõ 104 Nguyễn Phúc Lai 68m2, 5 tầng, mt 4.7m","Nhà Đẹp! Ở Luôn! Ảnh thật 100% của nhà.
Diện tích 68m2, mặt tiền 4.7m, xây 5 tầng. Thiết kế:
+ Tầng 1: Để xe, Khách, Bếp và vệ sinh
+ Tầng 2,3,4: Mỗi tầng 2 phòng ngủ, vệ sinh khép kín
+ Tầng 5: Phòng thờ và sân phơi
Vị trí đắc địa, cách Hồ Hoàng Cầu chưa tới 70m.
Khu vực phân lô, yên tĩnh, an sinh cực tốt. Rất phù hợp để ở.
Sổ đỏ chính chủ 68m2.
Giá: 9.35 tỷ (có thương lượng)
Liên hệ Ngô Văn Minh (Miễn MG, TG)","9,35 tỷ",68 m2,"Phố Mai Anh Tuấn, Phường Ô Chợ Dừa, Quận Đống Đa, Hà Nội",8574031,_,True,Cần bán,3m,True,Nhà trong hẻm,Sổ hồng/ Sổ đỏ,True,"4,7m",5,True,15m,6,---
https://alonhadat.com.vn/via-he-o-to-tranh-kinh-doanh-dinh-ban-nha-huynh-thuc-khang-99m2-4-tang-mt-7-5m--8754239.html,"Vỉa hè! Ô tô tránh! Kinh Doanh Đỉnh! Bán nhà Huỳnh Thúc Kháng 99m2, 4 tầng, mt 7.5m.","Vị trí đắc địa! Nhà mặt ngõ! Cách mặt phố Huỳnh Thúc Kháng kéo dài 25m2.
Đường rộng 6m, vỉa hè 1m, ngõ thẳng tắp, kinh doanh đỉnh.
Diện tích sổ đỏ 98.8m2, mặt tiền 7.5m, xây 4 tầng.
Nhà 2 mặt ngõ trước sau. Ngõ sau rộng 2m. Rất thoáng mát.
Vị trí đắc địa, trung tâm quận Đống Đa. Gần Chùa Láng, Nguyễn Chí Thanh, đại học Ngoại Thương, Ngoại Giao, Luật,….
Giá: 15.5 tỷ (có thương lượng)
Đường Huỳnh Thúc Kháng làm xong giá nhà mình ít nhất tăng gấp 1.5 lần. Đầu tư cho tương lai rất tốt.
Liên hệ Ngô Văn Minh (Miễn MG, TG)","15,5 tỷ",99 m2,"Phố Huỳnh Thúc Kháng, Phường Láng Hạ, Quận Đống Đa, Hà Nội",8754239,_,True,Cần bán,7m,True,Nhà trong hẻm,Sổ hồng/ Sổ đỏ,True,"7,5m",4,True,13m,4,---
https://alonhadat.com.vn/7-9-ty-o-to-vao-nha-ban-nha-ngo-80-chua-lang-56m-4-tang-mt4m-8826968.html,"7.9 tỷ! Ô tô vào nhà! Bán nhà ngõ 80 Chùa Láng 56m, 4 tầng, mt4m","Nhà ngay gần hồ Chùa Láng, không khí trong lành, dân trí tốt. Cực kỳ phù hợp để ở.
Ngõ trước nhà rộng hơn 5m, ô tô tránh nhau, đỗ cửa 24/24.
Gần Học viện Ngoại Giao, Đh Ngoại Thương, Vincom Nguyễn Chí Thanh,… Đầy đủ mọi tiện ích xung quanh.
Diện tích 56m2, mặt tiền 4.1m, xây 4 tầng. Thiết kế:
+ Tầng 1: Gara ô tô, Bếp và vệ sinh
+ Tầng 2,3: Mỗi tầng 2 phòng và 1 vệ sinh
+ Tầng 4: Phòng thờ và sân phơi.
Sổ đỏ chính chủ. Vuông vắn trước sau. Không lỗi phong thủy.
Giá: 7.9 tỷ (có thương lượng)
Liên hệ Ngô Văn Minh (Miễn MG, TG)","7,9 tỷ",56 m2,"Phố Chùa Láng, Phường Láng Thượng, Quận Đống Đa, Hà Nội",8826968,_,True,Cần bán,5m,True,Nhà trong hẻm,Sổ hồng/ Sổ đỏ,True,4m,4,True,16m,4,---
https://alonhadat.com.vn/11-4-ty-via-he-mat-ngo-o-to-tranh-pho-thai-ha-52m2-5-tang-mt4-2m-8912331.html,"11.4 TỶ! VỈA HÈ! MẶT NGÕ! Ô TÔ TRÁNH! PHỐ THÁI HÀ 52M2, 5 TẦNG, MT4.2M","Vị trí cực kỳ đắc địa! Nhà Mặt ngõ thẳng tắp! Cách mặt phố Thái Hà 65m.
Đường trước nhà ô tô tránh, vỉa hè rộng 1m. 
Diện tích 52m2, mặt tiền 4.2m, xây 5 tầng. Thiết kế:
+ Tầng 1: Thông sàn Kinh Doanh (Hiện tại đang kinh doanh máy tính)
+ Tầng 2,3,4: Mỗi tầng 2 phòng và vệ sinh giữa.
+ Tầng 5: Phòng thờ và sân phơi.
Nhà 2 thoáng trước sau. Các phòng đều mở cửa sổ rất thoáng mát.
Khu vực Phân Lô, đường xá cực kỳ sạch sẽ, thoáng mát. An ninh, dân trí cực tốt.
Rất phù hợp để ở và kinh doanh sạch sẽ.
Sổ đỏ chính chủ
Giá: 11.4 tỷ (có thương lượng)
Liên hệ Ngô Văn Minh (Miễn MG, TG)","11,4 tỷ",52 m2,"Phố Thái Hà, Phường Trung Liệt, Quận Đống Đa, Hà Nội",8912331,_,True,Cần bán,7m,True,Nhà trong hẻm,Sổ hồng/ Sổ đỏ,True,"4,2m",5,True,12m,4,---
https://alonhadat.com.vn/11-3-ty-lo-goc-o-to-vao-nha-kinh-doanh-pho-hao-nam-80m-5-tang-mt-7m-8874809.html,"11.3 tỷ! Lô Góc! Ô tô vào nhà! Kinh Doanh! Phố Hào Nam 80m, 5 tầng, mt 7m","Ngõ thông, rộng 6m, ô tô tránh nhau. Cách mặt phố 60m.
Nhà mặt ngõ! Kinh Doanh Đỉnh! Đặc biệt là Spa, thời trang, Nail,…..
Hiện tại đang cho thuê văn phòng để giữ nhà 25tr/tháng.
Gần ngay Học Viện Âm Nhạc Quốc Gia.
Diện tích 80m2, mặt tiền 7m, xây 5 tầng, Thiết kế kiểu biệt thự:
+ Tầng 1: Gara ô tô, Bếp và vệ sinh
+ Tầng 2: Phòng Khách, 1 phòng ngủ và 1 vệ sinh
+ Tầng 3,4: Mỗi tầng 2 phòng ngủ khép kín
+ Tầng 5: Phòng thờ và sân phơi.
Nhà Lô Góc, 2 mặt thoáng. Phòng nào cũng ban công và cửa sổ. Rất thoáng mát.
Dân trí cao, an ninh tốt.
Sổ đỏ chính chủ: 79m2
Giá: 11.3 tỷ (có thương lượng)
Liên hệ Ngô Văn Minh (Miễn MG, TG)","11,3 tỷ",80 m2,"Phố Hào Nam, Phường Cát Linh, Quận Đống Đa, Hà Nội",8874809,_,True,Cần bán,6m,True,Nhà trong hẻm,Sổ hồng/ Sổ đỏ,True,7m,5,True,11m,5,---
https://alonhadat.com.vn/cuc-hiem-7-ty-o-to-vao-nha-ban-nha-thai-ha-71m-4-tang-mt-4-1m-7286707.html,"Cực Hiếm! 7 tỷ! Ô tô vào nhà! Bán nhà Thái Hà 71m, 4 tầng, mt 4.1m","KHÔNG MUA NHANH SẼ MẤT! ĐẦU TƯ NGON LUÔN.
PHỐ THÁI HÀ! Ô TÔ VÀO NHÀ! CHỈ 100TR/M2
Diện tích 71m2, mặt tiền 4.1m, xây 4 tầng (Ảnh thật 100% của nhà). Thiết kế:
+ Tầng 1: Gara ô tô, Bếp và vệ sinh
+ Tầng 2: Phòng Khách, 1 ngủ và 1 vệ sinh
+ Tầng 3: 2 phòng ngủ và 1 vệ sinh
+ Tầng 4: Phòng thờ, 1 ngủ và sân phơi
Nhà 2 mặt thoáng trước sau, các phòng đều mở đc cửa sổ.
Nội thất đầy đủ, sàn gỗ, cầu thang gỗ thịt. Khách mua chỉ cần xách vali về là ở luôn.
Ngõ trước nhà rộng rãi, ô tô qua thoải mái.
Sổ đỏ chính chủ
Giá: 7 tỷ (có thương lượng)
Liên hệ Ngô Văn Minh (Minh Thái Hà)(Miễn MG, TG)",7 tỷ,71 m2,"Phố Thái Hà, Phường Trung Liệt, Quận Đống Đa, Hà Nội",7286707,_,True,Cần bán,5m,True,Nhà trong hẻm,Sổ hồng/ Sổ đỏ,True,"4,1m",4,True,17m,4,---
https://alonhadat.com.vn/phan-lo-o-to-tranh-ban-nha-huynh-thuc-khang-50m-mat-tien-4m-6262005.html,"Phân Lô! Ô tô tránh! Bán nhà Huỳnh Thúc Kháng 50m, mặt tiền 4m","Ngõ thông, trước nhà rộng 5m, vỉa hè 1.5m, thuộc khu phân lô Vip của phố Huỳnh Thúc Kháng.
Giao thông cực kỳ thuận lợi, gần các tuyến phố lớn Nguyên Hồng, Nguyễn Chí Thanh, Láng Hạ.
Gần trường tiểu học Nam Thành Công, Đh Luật Hà Nội, Rạp chiếu phim quốc gia, Vincom Nguyễn Chí Thanh,…
Nhà phù hợp để ở và kinh doanh văn phòng, online rất phù hợp
Nhà 2 mặt thoáng vĩnh viễn trước sau. Diện tích 50m2, mặt tiền 4m, vuông vắn trước sau.
Nhà thuộc khu phân lô, dân trí cao, an ninh cực tốt.
Sổ đỏ chính chủ 50m2
Giá: 8.6 tỷ (có thương lượng)
Liên hệ Ngô Văn Minh (Miễn MG, TG)","8,6 tỷ",50 m2,"Phố Huỳnh Thúc Kháng, Phường Láng Hạ, Quận Đống Đa, Hà Nội",6262005,_,True,Cần bán,6m,True,Nhà trong hẻm,Sổ hồng/ Sổ đỏ,True,4m,3,True,"12,5m",3,---
https://alonhadat.com.vn/doc-la-phan-lo-o-to-vao-nha-nguyen-hong-65m-6-tang-mt-5-5m-6044468.html,"Độc! Lạ! Phân lô! Ô tô vào nhà Nguyên Hồng 65m, 6 tầng, mt 5.5m","Nhà được thiết kế rất độc đáo! Cực kỳ hiếm có! Mang phong cách cổ xưa, mộc mạc nằm ở giữa chốn ồn ào tấp nập Hà Nội
Khu Phân Lô đẹp nhất phố Nguyên Hồng. Diện tích 65m2, mặt tiền 5.5m, xây 6 tầng. Thiết kế:
+ Tầng 1: Gara ô tô (3 chiếc)
+ Tầng 2: Khách và Bếp
+ Tầng 3,4,5: Mỗi tầng 1 phòng và 1 vệ sinh
+ Tầng 6: Phòng thờ và sân phơi
Toàn bộ sàn gỗ, cửa là Lim nguyên khối cực chất.
Nhà rất phù hợp để ở hoặc làm NHÀ HÀNG
Khu vực phân lô phố Nguyên Hồng, thông các hướng ra Huỳnh Thúc Kháng, Nguyễn Chí Thanh, Trúc Khê
Vị trí trung tâm, đầy đủ mọi tiện ích xung quanh
Khu vực dân trí cực cao, an ninh tốt. Đáng sống bậc nhất Hà Nội
Sổ đỏ chính chủ. vuông như tờ A4
Giá: 13 tỷ (có thương lượng)
Liên hệ Ngô Văn Minh (Miễn MG, TG)",13 tỷ,65 m2,"Phố Nguyên Hồng, Phường Láng Hạ, Quận Đống Đa, Hà Nội",6044468,_,True,Cần bán,5m,True,Nhà trong hẻm,Sổ hồng/ Sổ đỏ,True,"5,5m",6,True,12m,4,---
https://alonhadat.com.vn/via-he-lo-goc-hai-mat-ngo-o-to-tranh-pho-nguyen-hong-100m2-mt-12m-6215620.html,"Vỉa Hè! Lô Góc! Hai Mặt ngõ Ô tô tránh phố Nguyên Hồng 100m2, mt 12m","VỊ TRÍ KINH DOANH VÔ CÙNG ĐẮC ĐỊA! Đặc biệt là Café và Nhà Hàng Ẩm Thực.
Đường trước nhà rộng rãi, 3 ô tô tránh nhau, có vỉa hè.
Sổ đỏ chính chủ! Vuông vắn, mặt tiền rộng 12m
Hiện tại nhà 5 tầng. Đang được 1 thương hiệu Ẩm thực nổi tiếng thuê.
Giao thông cực kỳ thuận lợi. Thông ra Huỳnh Thúc Kháng, Trúc Khê, Nguyễn Chí Thanh.
Giá: 25 tỷ (có thương lượng)
Liên hệ Ngô Văn Minh (Miễn MG, TG)",25 tỷ,100 m2,"Phố Nguyên Hồng, Phường Láng Hạ, Quận Đống Đa, Hà Nội",6215620,_,True,Cần bán,8m,True,Nhà trong hẻm,Sổ hồng/ Sổ đỏ,True,12m,4,True,"8,5m",4,---
https://alonhadat.com.vn/gia-tot-mat-pho-chua-lang-76m2-4-tang-mat-tien-5m-kinh-doanh-dinh-6769619.html,"Giá Tốt! Mặt phố Chùa Láng 76m2, 4 tầng, mặt tiền 5m. Kinh Doanh Đỉnh","Phố Chùa Láng. Một trong những con phố tấp nập bậc nhất Hà Nội
Đại học Ngoại Thương, Học viện Ngoại Giao, Bệnh viện Nhi, Phụ sản Trung Ương, Vincom đều tọa lạc trên con phố này
Phố Chùa Láng là đường 2 chiều, vỉa hè rộng rãi, nên phù hợp với mọi loại hình kinh doanh. Đặc biệt là Nhà hàng, Thời trang, Spa,….
Thông số hoàn mỹ. Diện tích 76m2, mặt tiền 5m, xây 4 tầng.
Sổ đỏ chính chủ.
Giá: 23 tỷ (có thương lượng)
Liên hệ Ngô Văn Minh (Miễn MG, TG)",23 tỷ,76 m2,"Phố Chùa Láng, Phường Láng Thượng, Quận Đống Đa, Hà Nội",6769619,_,True,Cần bán,8m,True,Nhà mặt tiền,Sổ hồng/ Sổ đỏ,True,5m,4,True,15m,4,---
https://alonhadat.com.vn/lo-goc-kinh-doanh-o-to-vao-nha-chua-lang-60m-5-tang-mat-tien-4-5m-5807915.html,"Lô Góc! Kinh Doanh! Ô tô vào nhà Chùa Láng 60m, 5 tầng, mặt tiền 4.5m","Đường trước nhà rộng hơn 5m, ô tô đỗ cửa 24/24 hoặc vào nhà thoải mái.
Nhà đẹp, ở luôn. Diện tích 60m2, mặt tiền 4.5m, xây 5 tầng. Thiết kế:
+ Tầng 1: Gara ô tô (hoặc kinh doanh), Bếp và vệ sinh
+ Tầng 2: Phòng Khách, 1 phòng ngủ và vệ sinh
+ Tầng 3,4: Mỗi tầng 2 phòng ngủ và 1 vệ sinh
+ Tầng 5: Phòng thờ và sân phơi
Nhà Lô Góc nên phòng nào cũng có cửa sổ rất thoáng mát, tràn ngập gió trời và ánh sáng tự nhiên
Khu vực nhiều người qua lại, kinh doanh sầm uất. Phù hợp mọi mặt hàng như Spa, hàng ăn, văn phòng,..
Gần chợ, Đh Ngoại thương, Ngoại Giao, Giao thông vận tải,… Đầy đủ mọi tiện ích xung quanh
Khu vực dân trí cao, an ninh tốt. 
Sổ đỏ chính chủ, vuông vắn trước sau, không lỗi phong thủy.
Giá: 7.4 tỷ (có thương lượng)
Vui lòng liên hệ Ngô Văn Minh (Miễn MG, TG)
Xin cảm ơn!","7,4 tỷ",60 m2,"Phố Chùa Láng, Phường Láng Thượng, Quận Đống Đa, Hà Nội",5807915,_,True,Cần bán,6m,True,Nhà trong hẻm,Sổ hồng/ Sổ đỏ,True,"4,5m",5,True,14m,5,---
https://alonhadat.com.vn/cuc-hiem-8-ty-o-to-vao-nha-ban-nha-nguyen-chi-thanh-70m-4-tang-5347319.html,"Cực hiếm! 8 tỷ! Ô tô vào nhà! Bán nhà Nguyên Chí Thanh 70m, 4 tầng","Nhà đẹp, ở luôn giá còn rẻ hơn bán đất!
Diện tích sổ đỏ 71m2, mặt tiền 3.6m, để sân 21m2, xây dựng 50m2 x 4 tầng: Thiết kế:
+ Tầng 1: Sân để ô tô, trồng cây; Khách; Bếp và vệ sinh
+ Tầng 2,3: Mỗi tầng 2 phòng và 1 vệ sinh
+ Tầng 4: Phòng thờ và sân phơi.
Ngõ thông sang Pháo Đài Láng, Chùa Láng. trước nhà rộng hơn 4m, ô tô vào nhà thoải mái. Cách mặt phố Nguyễn Chí Thanh 150m
Gần các trường đại học lớn như Luật Hà Nội, Ngoại Thương, Ngoại Giao, bệnh viện Nhi, Phụ sản Trung Ương, Vincom Nguyễn Chí Thanh
Khu vực phân lô. Dân trí cao, an ninh tốt. Phù hợp vừa ở vừa kinh doanh online
Sổ đỏ chính chủ.
Giá: 8 tỷ (có thương lượng vs khách thiện trí)
Liên hệ Ngô Văn Minh: 0962382238 (Miễn MG, TG)",8 tỷ,71 m2,"Đường Nguyễn Chí Thanh, Phường Láng Thượng, Quận Đống Đa, Hà Nội",5347319,_,True,Cần bán,5m,True,Nhà trong hẻm,Sổ hồng/ Sổ đỏ,True,4m,4,True,18m,4,---
https://alonhadat.com.vn/o-to-vao-nha-o-to-do-cua-ban-nha-hoang-cau-50m-5-tang-10-5-ty-4952387.html,"Ô tô vào nhà! Ô tô đỗ cửa! Bán nhà Hoàng Cầu 50m, 5 tầng. 10,5 tỷ","Chính chủ cần Bán nhà Hoàng Cầu – Đống Đa.
Diện tích 48m2, mặt tiền 4m, xây 5 tầng kiên cố chắc chắn, có ô chờ thang máy. Thiết kế:
+ Tầng 1: Gara ô tô, Khách, Bếp và vệ sinh
+ Tầng 2,3: Mỗi tầng 2 phòng và 1 vệ sinh
+ Tầng 4: Phòng thờ và sân phơi
+ Tầng 5: Tum đã làm mái tôn 
Ngõ thông sang Trần Quang Diệu, phân lô ô bàn cờ. Trước nhà rộng 5m, vỉa hè 1 m. Ô tô tránh nhau thoải mái.
Nhà cách mặt phố Hoàng Cầu khoảng 50m, cách hồ Hoàng Cầu 100m.
Gần chợ Thái Hà, rạp chiếu phim quốc gia, trường học, giao thông thuận lợi,...
Khu vực Vip của quận Đống Đa, Dân trí cao, an ninh tốt. 
Sổ đỏ chính chủ. Nở hậu 1cm.
Giá: 10.5 tỷ (có thương lượng)
Liên hệ Ngô Văn Minh: 0962382238 (Miễn MG, TG)","10,5 tỷ",50 m2,"Phố Hoàng Cầu, Phường Ô Chợ Dừa, Quận Đống Đa, Hà Nội",4952387,_,True,Cần bán,6m,True,Nhà trong hẻm,Sổ hồng/ Sổ đỏ,True,---,5,True,---,4,---
https://alonhadat.com.vn/15-5-ty-phan-lo-2-thoang-vinh-vien-o-to-vao-nha-ban-nha-chua-lang-95m2-5-tang-mt5m-10417931.html,"15.5 tỷ! Phân Lô! 2 thoáng vĩnh viễn! Ô tô vào nhà! Bán nhà Chùa Láng 95m2, 5 tầng, mt5m","Khu phân Lô chỉ hơn 20 hộ! Có bảo vệ cả khu 24/24.
Trước nhà rộng 8m, 3 ô tô tránh, đỗ cửa 24/24 vào nhà thoải mái.
Diện tích 95m2, xây dựng 75m2, 5 tầng, mặt tiền 5m. Thiết kế:
+ Tầng 1: Khách, Bếp, vệ sinh
+ Tầng 2,3,4: Mỗi tầng 2 phòng và 1 vệ sinh
+ Tầng 5: Phòng thờ, sân phơi.
Ảnh thật 100% của nhà. Nội thất để lại toàn bộ. Khách mua chỉ cần xách vali là đến ở luôn. 
Nhà 2 thoáng trước sau vĩnh viễn.
Gần Học viện Ngoại Giao, Đh Ngoại Thương, Bệnh viện Nhi, Phụ Sản.
Nhà phù hợp để ở và làm Vp, phòng khám.
Sổ đỏ chính chủ, vuông vắn trước sau. Không 1 lỗi lầm.
Giá: 15.5 tỷ (có thương lượng)
Liên hệ Ngô Văn Minh (Miễn MG, TG)","15,5 tỷ",95 m2,"Phố Chùa Láng, Phường Láng Thượng, Quận Đống Đa, Hà Nội",10417931,_,True,Cần bán,8m,True,Nhà trong hẻm,Sổ hồng/ Sổ đỏ,True,5m,5,True,19m,5,---
https://alonhadat.com.vn/13-ty-lo-goc-3-thoang-vinh-vien-o-to-vao-nha-thai-thinh-108m2-3-tang-mt-8-1m-10712981.html,"13 tỷ! Lô Góc! 3 thoáng vĩnh viễn! Ô tô vào nhà! Thái Thịnh 108m2, 3 tầng, mt 8.1m","Nhà mặt ngõ, thông, trước nhà rộng 4m, ô tô vào nhà.
Nhà Lô Góc! 3 thoáng vĩnh viễn! Tràn ngập ánh sáng và gió trời.
Giá tốt để ĐẦU TƯ chia lô 2 căn hoặc 1 căn hộ dich vụ lớn cho thuê dòng tiền. 
Nhà mình Lô Góc nên từ tầng 2 đua thêm được gần 20m2 nữa, cực kỳ rộng rãi.
Diện tích sổ đỏ 98m2, mặt tiền 8.1m, xây 4 tầng. Thiết kế:
+ Tầng 1: Để xe, Khách, Bếp, Vệ sinh
+ Tầng 2,3: Mỗi tầng 2 phòng và 1 vệ sinh
Sổ đỏ chính chủ 98m2. Vuông vắn trước sau, không 1 lỗi lầm
Giá: 13 tỷ (có thương lượng). 
NHÀ ĐẦU TƯ ĐƯỢC! KHÔNG MUA NHANH SẼ MẤT.
Liên hệ Ngô Văn Minh (Miễn MG, TG)",13 tỷ,108 m2,"Phố Thái Thịnh, Phường Thịnh Quang, Quận Đống Đa, Hà Nội",10712981,_,True,Cần bán,4m,True,Nhà trong hẻm,Sổ hồng/ Sổ đỏ,True,"8,1m",3,True,12m,4,---
https://alonhadat.com.vn/20-ty-phan-lo-via-he-o-to-tranh-ban-nha-nguyen-hong-69m2-mt-5-5m-8-tang-thang-may-10713137.html,"20 tỷ! Phân Lô! Vỉa Hè! Ô tô tránh! Bán nhà Nguyên Hồng 69m2, mt 5.5m, 8 tầng. Thang Máy","Nhà tự xây giữa năm 2020 hoàn thành đầu năm 2021 cực kỳ tâm huyết. Nhưng do nhu cầu kinh doanh mới phải bán.
Nhà xây bề thế. Diện tích 69m2, mặt tiền 5.5m, xây 8 tầng thang máy. Thiết kế thông sàn toàn bộ.
Khu vực phân lô Nguyên Hồng – Huỳnh Thúc Kháng. Vỉa hè – ô tô tránh. Cực hiếm nhà bán.
Nhà phù hợp để ở, làm văn phòng kinh doanh.
Khu vực dân trí cực cao, an ninh tốt, hàng xóm thân thiện. Ai đã ở khu này gần như không muốn chuyển đi.
Sổ đỏ chính chủ. Vuông vắn trước sau. Không 1 lỗi lầm.
Giá: 20 tỷ (có thương lượng với khách thiện trí)
Liên hệ Ngô Văn Minh (Miễn MG, TG)",20 tỷ,69 m2,"Phố Nguyên Hồng, Phường Láng Hạ, Quận Đống Đa, Hà Nội",10713137,_,True,Cần bán,6m,True,Nhà trong hẻm,Sổ hồng/ Sổ đỏ,True,"5,5m",8,True,12m,5,---
