https://alonhadat.com.vn/ban-nha-5-tang-3pn-rong-ngo-thong-oto-quay-dau-500m-ra-kdt-geleximco-le-trong-tan--13462886.html,"Bán nhà 5 tầng 3PN rộng. Ngõ thông, ôtô quay đầu. 500m ra KĐT Geleximco Lê Trọng Tấn.","Sân trước nhà rất thoáng, xe máy để thoải mái.
Ngõ trước nhà rộng rãi, ô tô đỗ cửa, quay đầu thuận tiện.

DT 30m². Hướng Bắc Đông Nam.
Xây dựng 5 tầng. Thiết kế mỗi tầng 1 phòng.
T1: Sân để xe, phòng khách, bếp, NVS phụ.
T2 - T3 - T4: Mỗi tầng 1 phòng ngủ rộng + 1 WC khép kín.
T5: Gian thờ, sân giặt + sân phơi đồ.
Nhà trang bị đầy đủ nội thất gắn tường cơ bản.
Điện nước sang tên. Gia chủ chỉ dọn đồ về ở.

Xung quanh dân cư đông vui nhộn nhịp, sống hòa đồng thân thiện, an ninh rất tốt.
Nhà nằm ngay sát khu đô thị Geleximco nên được thừa hưởng các tiện ích thiết yếu như: Trường học các cấp cho các cháu đầy đủ, chợ dân sinh, quán xá tổng hợp, siêu thị, quán Gym, ủy ban, trạm y tế, công viên, hồ bơi... Tất cả chỉ trong bán kính 1km.
Giao thông thuận tiện, nằm sát trục Lê Trọng Tấn kết nối đại lộ Thăng Long, Tố Hữu kéo dài.

Pháp lý: Sổ đỏ chính chủ anh tôi.
* Cam kết: Nhà không có tranh chấp, kiện tụng hay dính quy hoạch NN.
- Đền cọc gấp đôi nếu không đúng cam kết.
Giá từ 2,4 tỷ có thương lượng và bao phí thuế.
Hỗ trợ vay Bank tới 75% giá trị với Lãi suất cực Ưu đãi.
Lh: Mr Dương để trao đổi thêm thông tin, xem nhà miễn phí.","2,4 tỷ",30 m2,"Đường Lê Trọng Tấn, Xã La Phù, Huyện Hoài Đức, Hà Nội",13462886,Đông Nam,True,Cần bán,3m,True,Nhà trong hẻm,Sổ hồng/ Sổ đỏ,True,---,5,True,---,3,---
https://alonhadat.com.vn/ban-nha-bt-nguyen-co-thach-134m2-3-tang-co-ham-lo-goc-2-mat-pho-gia-36-ty-12768032.html,"Bán nhà BT Nguyễn Cơ Thạch 134m2, 3 tầng có hầm, lô góc 2 mặt phố, giá 34 tỷ","- Vị trí đắc địa, lô góc 2 mặt phố, oto dừng đỗ thoải mái. Nhà có nhiều hướng đi như ngõ 44 Nguyễn Cơ Thạch, 43 Lưu Hữu Phước, 15 Hàm Nghi, 6 Trần Hữu Dực
- Diện tích sổ 134m2, xây dựng 3 tầng và 1 hầm để oto. Thiết kế :
+ Tầng hầm : để xe oto
+ Tầng 1 : Phòng khách, phòng ăn ,bếp
+ Tầng 2,3 : 4 phòng ngủ khép kín
+ Tầng áp mái
- Giao thông thuận tiện di chuyển, tiếp giáp ra nhiều tuyến đường lớn như : Nguyễn Cơ Thạch, Trần Hữu Dực, Lưu Hữu Phước, Hàm Nghi,..
- Pháp lí chuẩn, sẵn sàng giao dịch 
- Giá 34 Tỷ (có thương lượng)
Liên hệ trực tiếp em Ngọc để biết thêm chi tiết và xem nhà miễn phí ạ!!",34 tỷ,134 m2,"Đường Nguyễn Cơ Thạch, Phường Mỹ Đình 1, Quận Nam Từ Liêm, Hà Nội",12768032,_,True,Cần bán,20m,True,Nhà mặt tiền,Sổ hồng/ Sổ đỏ,True,10m,3,True,---,4,---
https://alonhadat.com.vn/nha-moi-nguyen-can-gia-1-95-ty-phuong-dong-mai-giap-yen-nghia-500m-ql6-12619762.html,"NHÀ MỚI NGUYÊN CĂN. GIÁ 1,95 TỶ. PHƯỜNG ĐỒNG MAI. GIÁP YÊN NGHĨA. 500M QL6","Cần bán nhà xây mới nguyên căn tại Đồng Mai - Hà Đông.
Giá chỉ 2 tỷ. Bao thuế phí. khách thiện chí gia lộc thêm.
- Sổ đỏ, GPXD đầy đủ.
- Hỗ trợ ngân hàng. Ls ưu đãi.

Nhà xây mới 4 tầng.
DT 30/32m2.
Hướng Tây tứ trạch.
TK 4 tầng :
T1 : Sân để xe, phòng khách, bếp.
T2 + T3 : Mỗi tầng 1 phòng ngủ rộng, 1 nvs
T4 : 1 phòng thờ, 1 phòng ngủ nhỏ, 1 sân phơi.

Nội thất lắp đặt cơ bản.
Hệ thống cửa chính, cửa toàn nhà.
Thiết bị điện đèn led + thạch cao trang trí.
Thiết bị vệ sinh : chậu rửa, bồn rửa. sen vòi.
Tủ bếp, bàn đá bếp...

Tiện ích :
Khu dân cư đông đúc. Hàng xóm tứ xứ hòa đồng.
Bán kính 500m đầy đủ tiện ích. chợ họp ngày đêm. trường học các cấp. hàng quán tấp nập.
Giao thông thuận tiện. 500m ra QL6 đi bx yên nghĩa. Kết nối vào nội thành.

Liên hệ trực tiếp em Dương để trao đổi thêm thông tin và xem nhà miễn phí 24/24 (zalo/call)","1,95 tỷ",32 m2,"Đường Nhân Huệ, Phường Đồng Mai, Quận Hà Đông, Hà Nội",12619762,Tây Nam,True,Cần bán,2m,True,Nhà trong hẻm,Sổ hồng/ Sổ đỏ,True,---,4,---,---,3,---
https://alonhadat.com.vn/ban-bt-my-dinh-1-nguyen-co-thach-136m2-4-tang-lo-goc-thoang-sang-yen-tinh-gia-37-ty-12536581.html,"Gấp. Bán BT Nguyễn Cơ Thạch 135m2, 4 tầng lô góc, thoáng sáng, yên tĩnh, giá chỉ 35 tỷ","- Gia chủ chuyển về Biệt thự diện tích lớn hơn, vô cùng thiện chí bán. Vị trí đắc địa, lô góc thoáng sáng, yên tĩnh, an ninh tốt, vỉa hè rộng rãi, oto dừng đỗ quanh nhà.
- Diện tích 135m2, xây dựng 4 tầng có hầm. Thiết kế vô cùng chắc chắn, cẩn thận, tỉ mỉ, cùng trang thiết bị xịn nhất
- Giao thông thuận tiện di chuyển, tiếp giáp ra nhiều tuyến đường lớn như: Nguyễn Cơ Thạch, Hàm Nghi, Trần Hữu Dực, Lưu Hữu Phước,..
- Sổ đỏ chính chủ, sẵn sàng giao dịch 
- Giá 35 Tỷ (có thương lượng)
(Anh/Chị hãy liên hệ em Hà Ngọc để biết thêm chi tiết và xem nhà miễn phí ạ). Trân trọng cảm ơn Anh/Chị đã xem qua tin đăng này!",35 tỷ,136 m2,"Đường Nguyễn Cơ Thạch, Phường Mỹ Đình 1, Quận Nam Từ Liêm, Hà Nội",12536581,_,True,Cần bán,15m,True,Nhà mặt tiền,Sổ hồng/ Sổ đỏ,True,10m,4,True,---,4,---
https://alonhadat.com.vn/ban-toa-ccmn-my-dinh-105m2-8-tang-moi-29pn-khep-kin-dong-tien-180tr-th-gia-chi-25-ty-13487193.html,"Bán Toà CCMN Mỹ Đình 105m2, 8 tầng mới, 29PN khép kín, dòng tiền 180tr/ th, giá chỉ 25 tỷ","- Vị trí đắc địa, ngõ thông, rộng rãi, thoáng sáng, kinh doanh buôn bán sầm uất.
- Diện tích 105m2, xây 8 tầng thang máy, mặt tiền rộng 6.5m
- Nhà xây mới, thiết kế tầng chia 4 phòng khép kín, các phòng đều được setup Full đồ dùng riêng 
- Hiện tại nhà đã cho thuê Full, dòng tiền 180tr/ tháng. Chủ mới mua về sẵn tiếp quản hợp đồng hoặc có thể cho thuê khoán
- Giao thông thuận tiện di chuyển, tiếp giáp ra các trục đường lớn như: Mỹ Đình, Nguyễn Hoàng, Lê Đức Thọ, Phạm Hùng,..
- Sổ đỏ chính chủ, sẵn sàng giao dịch 
- Giá 25 tỷ (có thương lượng)
A/c quan tâm, hãy liên hệ trực tiếp em Ngọc để biết thêm chi tiết và xem nhà miễn phí ạ!!",25 tỷ,105 m2,"Đường Mỹ Đình, Phường Mỹ Đình 2, Quận Nam Từ Liêm, Hà Nội",13487193,_,True,Cần bán,6m,True,"Phòng trọ, nhà trọ",Sổ hồng/ Sổ đỏ,True,"6,5m",8,True,---,29,---
https://alonhadat.com.vn/ban-toa-nha-ccmn-cau-giay-90m2-9-tang-xay-moi-28pn-doanh-thu-150tr-th-gia-24-ty-12722377.html,"Bán toà nhà CCMN Cầu Giấy 90m2, 9 tầng xây mới, 28PN, doanh thu 150tr/ th, giá 24 tỷ","- Vị trí đắc địa, lô góc mặt ngõ 255 Cầu Giấy. Ngõ rộng, thoáng sáng, đông đúc học sinh, sinh viên nhu cầu thuê nhà.
- Diện tích sử dụng 90m2, xây dựng 8 tầng 1 tum, lô góc mặt tiền 7m, và 8m
- Thiết kế tầng chia 4 phòng ngủ khép kín, các phòng đều setup Full đồ dùng như ảnh
- Chủ mới mua nhà về có thể trực tiếp vận hành cho thuê, hoặc cho bên thứ 3 vận hành. Dòng tiền 150tr/ tháng
- Giao thông thuận tiện di chuyển, tiếp giáp ra nhiều tuyến đường lớn như : Xuân Thuỷ, Hồ Tùng Mậu, Phạm Hùng, Phạm Văn Đồng, Trần Thái Tông, Trần Đăng Ninh,…
- Sổ đỏ chính chủ, đẹp, sẵn sàng giao dịch
- Giá 24 Tỷ (có thương lượng)
A/C quan tâm, hãy liên hệ tới em Ngọc để biết thêm chi tiết và xem nhà miễn phí ạ!!",24 tỷ,90 m2,"Đường Cầu Giấy, Phường Dịch Vọng, Quận Cầu Giấy, Hà Nội",12722377,_,True,Cần bán,5m,True,"Phòng trọ, nhà trọ",Sổ hồng/ Sổ đỏ,True,8m,9,True,---,28,---
