https://alonhadat.com.vn/ban-dat-phan-lo-mat-ngo-o-to-lo-goc-476m2-mat-tien-23m-45-ty-pho-tran-quoc-hoan-cau-8862098.html,"Bán đất phân lô, mặt ngõ ô tô, lô góc 476m2, mặt tiền 23m, 45 tỷ, phố Trần Quốc Hoàn, Cầu","* Trung tâm Cầu Giấy, khu đất phân lô mặt ngõ - vỉa hè ôtô tránh.
* DT sổ đỏ 476m2, mặt tiền chính rộng 23m, lô góc 2 mặt thoáng.

+ Vị trí: Cực hiếm, đất phân lô, mặt ngõ rộng có vỉa hè, xe ô tô tránh, kinh doanh sầm uất ngày đêm. Nhà gần chợ xanh, các trường ĐH lớn đại học Quốc Gia, Sư Phạm, học viện Báo Chí.

+ Mảnh đất vuông đẹp duy nhất còn sót lại trong khu vực, có mặt tiền gần 23m, rất phù hợp cho chủ đầu tư chia lô tách thửa xây bán hoặc chia toà văn phòng 7 -8 tầng thang máy, thông sàn, ở cho thuê, kinh doanh thời trang, thẩm mỹ, trung tâm đào tạo, văn phòng...

Liên hệ: Thái Bình: Môi giới thổ địa Cầu Giấy
Uy tín, tận tâm, pháp lý chuẩn chính chủ.
Tư vấn xem nhà miễn phí 24/7.",45 tỷ,476 m2,"Phố Trần Quốc Hoàn, Phường Nghĩa Tân, Quận Cầu Giấy, Hà Nội",8862098,_,---,Cần bán,5m,---,"Đất thổ cư, đất ở",Sổ hồng/ Sổ đỏ,---,23m,---,---,21m,---,---,
https://alonhadat.com.vn/ban-khach-san-11-tang-lo-goc-mp-nha-chung-hoan-kiem-dang-kd-cuc-tot-gia-130-ty-7152818.html,"Bán khách sạn 11 tầng lô góc MP Nhà Chung, Hoàn Kiếm, đang KD cực tốt, giá 130 tỷ","Cần bán khách sạn 11 tầng mặt phố Nhà Chung, Phường Hàng Trống, Quận Hoàn Kiếm.
- Toà nhà lô góc ba mặt thoáng, cực sang chảnh vì thuộc lõi Phố Cổ, cách Hồ Gươm 300m, hai mặt ngõ bên hông và sau nhà đều rộng 4m.
- Diện tích sổ 138m2, từ tầng 2 diện tích 160m2 do đua cả ba mặt, mặt tiền 7.5m.
- Thiết kế gồm 36 phòng, 1 tầng làm nhà hàng, 1 tầng làm spa và lễ tân.
- Hiện đang cho thuê 483,8 triệu/tháng.
Khách quan tâm liên hệ trực tiếp",130 tỷ,160 m2,"Phố Nhà Chung, Phường Hàng Trống, Quận Hoàn Kiếm, Hà Nội",7152818,_,---,Cần bán,15m,---,"Nhà hàng, khách sạn",Sổ hồng/ Sổ đỏ,---,"7,5m",11,---,21m,36,---,
https://alonhadat.com.vn/ban-toa-nha-8t-thang-may-mp-xa-dan-dt-68m2-mt-6-5m-cho-thue-90tr-th--7278102.html,"Bán tòa nhà 8T thang máy MP Xã Đàn. DT 68m2, MT 6,5m cho thuê 90tr/th.","Bán nhà 8 tầng có tầng có tầng bán hầm tại mặt phố Xã Đàn - Kim Liên hiện đang cho ngân hàng thuê thu nhập 80tr/th. DTXD 68m2, mặt tiền đẹp và lý tưởng rộng 6,5m nhà xây khung cột bê tông gia chủ có điều kiện nên đầu tư xây không tiếc tiền, móng khoan cọc nhồi bê tông chống động đất nên được 10 tầng, đổ bê tông nguyên khối từ đáy móng đến hết tầng 1, thiết kế và kiến trúc hiện đại kiểu Châu Âu, tầng 1,2,3,4,5,6 là 1PN, 1WC, tầng 7 phòng khách, tầng 8 là phòng thờ và bếp tập gym, sắp xếp rất hợp lý, cầu thang bộ, thang máy và vệ sinh cuối nên phòng rất rộng và thoáng sử dụng được đa năng trong công việc, trang bị toàn bộ nội thất xịn và nhập khẩu, thang máy nhập khẩu Mitsu 450kg, sàn gỗ, bếp tủ bếp, hệ thống cửa kính hút chân không cách nhiệt và cách âm chuyên nghiệp, hệ thống sen vòi bệt Toto, gạch ốp lát Bạch Mã, hệ thống camera an ninh toàn tòa nhà, vách tủ kệ âm tường, cửa cuốn Ausdoor, hệ thống đèn led siêu tiết kiệm điện, hệ thống hộp kỹ thuật thông minh tích hợp chế độ báo cháy tự động, dây điện đi ống rút chống cháy chập, điều hòa daikin 2 chiều âm trần. Phố Xã Đàn là phố trục chính, rất đẹp chính quy kiểu mẫu, thuộc tuyến phố có giá trị thương mại rất cao tập trung toàn công ty của các hãng thương hiệu lớn, hãng thời trang lớn và trung tâm giao dịch vàng và tài chính ngân hàng cho thuê rất được giá hiện đang cho thuê ngân hàng 80tr/th rất ổn định. Nay gia chủ cần gấp nên bán giá 33 tỷ có thương lượng sâu SĐCC Không kết hợp với trung gian và văn phòng.
- Liên Hệ: Nguyễn Văn Đạt.",33 tỷ,68 m2,"Phố Xã Đàn, Phường Kim Liên, Quận Đống Đa, Hà Nội",7278102,_,---,Cần bán,60m,---,Nhà mặt tiền,Sổ hồng/ Sổ đỏ,---,"6,5m",8,---,"10,5m",7,---,
