url,title,description,price,area,address,Mã tin,Hướng,Phòng ăn,Loại tin,Đường trước nhà,Nhà bếp,Loại BDS,Pháp lý,Sân thượng,Chiều ngang,Số lầu,Chổ để xe hơi,Chiều dài,Số phòng ngủ,Chính chủ,Thuộc dự án
https://alonhadat.com.vn/dinh-cua-dinh-mat-pho-lam-ha-ban-toa-nha-vip-360m-x-5t-2-via-he-thenh-thang-nhinh-70t-11392449.html,"Đỉnh Của Đỉnh – Mặt Phố Lâm Hạ Bán Tòa Nhà Vip 360m x 5T – 2 Vỉa Hè Thênh Thang, Nhỉnh 70t","+ Vị trí trung tâm Quận Long Biên, đoạn đầu phố to, rộng, đẹp nhất phố.

+ Hàng xóm Chủ tịch Quận cực Vip, vị trí đỉnh cao 2 vỉa hè, ô tô dừng đỗ ngày đêm kinh doanh đỉnh.

+ Kế hoạch mở đường sau lưng nhà thành 2 mặt trước sau  Lãi vốn đột phá.

+ Diện tích 360m2 với 5 tầng thông sàn, mặt tiền 10 giá trị.

+ Khách mua vừa ở vừa kinh doanh, làm văn phòng công ty thì quá tuyệt vời.

+ Sổ đỏ chính chủ, phân lô, pháp lý sạch, giao dịch ngay.

+ Liên hệ Viết Thu, để xem nhà 24/7 ( Miễn trung gian).
   Trân trọng!",70 tỷ,360 m2,"Đường Lâm Hạ, Phường Bồ Đề, Quận Long Biên, Hà Nội",11392449,_,---,Cần bán,25m,---,Nhà mặt tiền,Sổ hồng/ Sổ đỏ,---,10m,5,---,---,5,---,
https://alonhadat.com.vn/hiem-re-nha-mat-pho-nguyen-van-cu-gan-nga-tu-ng-son-215m-mt12m-nhinh-40-ty--11722594.html,"Hiếm! Rẻ! Nhà Mặt Phố Nguyễn Văn Cừ Gần Ngã Tư Ng Sơn 215m, Mt12m-Nhỉnh 40 tỷ.","Vị trí đắc địa gần ngã tư Nguyễn sơn, Nguyễn Văn Cừ, kinh doanh, văn phòng, tài chính ngân hàng.

 Hiện trạng nhà 3 tầng, kết cấu chắc chắn, mỗi tầng 3 phòng.

 Chủ xác định bán đất tặng nhà, chia tài sản cho con. 

 Khách mua về đầu tư xây toà nhà 10 tầng thang máy kinh doanh khách sạn, nhà hàng hay cho thuê văn phòng, ngân hàng, doanh thu dòng tiền khủng khiếp.

 * Liên hệ: Viết Thu ( best house) – Chuyên nhà đẹp giá tốt nhất Long Biên (miễn trung gian, qc).",40 tỷ,215 m2,"Đường Nguyễn Văn Cừ, Phường Bồ Đề, Quận Long Biên, Hà Nội",11722594,_,---,Cần bán,20m,---,Nhà mặt tiền,Sổ hồng/ Sổ đỏ,---,12m,4,---,---,4,---,
https://alonhadat.com.vn/nguyen-son-manh-dat-86m2-cach-mat-pho-30m-ngo-thong-via-he-o-to-tranh--10558216.html,"Nguyễn Sơn Mảnh Đất 86m2 - Cách Mặt Phố 30m – Ngõ Thông, Vỉa Hè Ô Tô Tránh.","SIÊU HIẾM - PHÂN LÔ - VỈA HÈ - KINH DOANH - 86M2 - NGUYỄN SƠN - BỒ ĐỀ - LONG BIÊN – GIÁ NHỈNH 14 TỶ.

+ Thửa đất có vị trí siêu đắc địa, khu phân lô cán bộ Hàng Không, cực hiếm nhà bán, đường Ô TÔ 7 chỗ chạy vòng quanh, khu Kinh doạnh sầm uất nhất phố Nguyễn Sơn, chỉ vài bước chân ra phố.

+ Gần khu Shophouse PHC, hàng xóm chung cư BERRIVER, cách 100m đến trường cấp 1,2 Ngọc Lâm, Siêu thị Vinmart...tiện ích bạt ngàn, An sinh tuyệt đỉnh.

+ Thửa đất vuông, đẹp, Sổ đỏ chính chủ, sẵn sàng giao dịch trong ngày. 

+ Giá bán chỉ nhỉnh 14 Tỷ ( thương lượng mạnh chỉ cần khách thích )

+ Sổ đỏ chính chủ, nở hậu.

- Thông tin chi tiết vui lòng liên hệ Viết Thu: Chuyên Tư vấn Nhà Đất - Thổ Cư quận Long Biên, ( thông tin chuẩn, thật 100%). Miễn Tg",14 tỷ,86 m2,"Đường Nguyễn Sơn, Phường Gia Thụy, Quận Long Biên, Hà Nội",10558216,_,---,Cần bán,8m,---,"Đất thổ cư, đất ở",Sổ hồng/ Sổ đỏ,---,"4,5m",---,---,---,---,---,
https://alonhadat.com.vn/ban-gap-nha-130m-tren-mp-dam-quang-trung-via-he-da-bong-kd-chi-nhinh-8-ty--11823594.html,"Bán GẤP Nhà 130m Trên Mp Đàm Quang Trung, Vỉa Hè Đá Bóng, Kd – Chỉ Nhỉnh 8 tỷ.","NHÀ MỘT MẶT PHỐ, MỘT MẶT NGÕ, VỈA HÈ THÊNH THANG, KINH DOANH, XÂY TÒA VĂN PHÒNG, CC MINI...TIỆN ÍCH NGẬP TRÀN.

+ Vị trí nhà một mặt phố, một mặt ngõ 2m, vỉa hè thênh thang, kinh doanh đỉnh.

+Chủ mới có thể đập đi xây tòa nhà Văn phòng 8 tầng thang máy hoặc xây chung cư mini, khách sạn, nhà hàng.. đầu tư giữ tiền tuyệt đỉnh.

+ Tiện ích ngập tràn, bán kính 500m là TTTM Aeon, Sân gold Long Biên, khu 918, trường học, chợ đầy đủ.

+ Sổ đỏ chính chủ, giao dịch luôn.

- Liên hệ: Viết Thu ( best house) – chuyên nhà đẹp giá tốt nhất Long Biên (miễn trung gian, Qc).","8,6 tỷ",130 m2,"Đường Đàm Quang Trung, Phường Long Biên, Quận Long Biên, Hà Nội",11823594,_,---,Cần bán,10m,---,Nhà mặt tiền,Sổ hồng/ Sổ đỏ,---,10m,3,---,---,3,---,
https://alonhadat.com.vn/mat-pho-hong-tien-toa-nha-230m2-lo-goc-vi-tri-dep-via-he-80m--10112165.html,"Mặt Phố Hồng Tiến – Tòa Nhà 230m2 – Lô Góc, Vị Trí Đẹp – Vỉa Hè 80m.","KHỦNG LONG BẠO CHÚA LONG BIÊN - VỊ TRÍ ĐẸP NHẤT QUẬN LONG BIÊN - ĐỈNH CAO LÔ  GÓC - VỈA HÈ ĐÁ BÓNG - KINH DOANH ĐA DẠNG LOẠI HÌNH  - GIÁ NHỈNH 100 TỶ.

+ Vị tri kim cương đẹp nhất Long Biên, mặt tiền siêu rộng kinh doanh vô địch mọi loại hình.

+ Chủ nhà đang cho các đơn vị thuê hợp đồng 5 năm dòng tiền mùa dịch hành tháng 150 triệu.

+ Vỉa hè siêu rộng lên tới 80m2, tổng diện tích sử dụng 300M2.

+ Tiện ích đầy đủ không thiếu thứ gì, gần trường học các cấp, trường quốc tế Wellspring. 

+ Vài phút tới TTTM AEON Long Biên, hàng xóm bệnh viện Tâm Anh, bệnh viện Bắc Hà. 

+ Khu vực dân trí cao, đáng sống nhất quận Long Biên.

THÔNG TIN NHÀ:

- T1 - T5 Thông sàn, thang máy, cầu thang bộ, wc.

+ Sổ đẹp, nở hậu đẹp.

- Thông tin chi tiết vui lòng liên hệ Viết Thu: Chuyên Tư vấn Nhà Đất – Tận Tâm, Minh Bạch, cam kết hình ảnh và thông số thật. Đỡ mất thời gian của khách. Miễn trung gian, quảng cáo. Trân trọng.",100 tỷ,230 m2,"Phố Hồng Tiến, Phường Bồ Đề, Quận Long Biên, Hà Nội",10112165,_,---,Cần bán,40m,---,Nhà mặt tiền,---,---,---,5,---,---,5,---,
https://alonhadat.com.vn/can-ban-gap-bt-don-lap-san-vuon-dt-168m2-3-tang-chu-huy-man-sai-dong--12375312.html,"Cần Bán Gấp BT Đơn Lập Sân Vườn Dt = 168m2, 3 tầng - Chu Huy Mân - Sài Đồng.","+ Đường trước nhà cực rộng, vỉa hè ô tô dừng đỗ ngày đêm, Nội thất xịn sò, sân vườn mênh mông, bể cá koi, vị trí thuận tiện di chuyển đi nội, ngoại thành.

+ Diện tích xây dựng 140m, 3 tầng 1 tum.

+ Sổ đỏ đẹp, nở hậu, sẵn sàng giao dịch.

- Lh: Viết Thu ( best home) – chuyên BT, nhà đẹp giá tốt nhất Long Biên, Miễn trung gian.",25 tỷ,268 m2,"Đường Chu Huy Mân, Phường Sài Đồng, Quận Long Biên, Hà Nội",12375312,_,---,Cần bán,10m,---,"Biệt thự, nhà liền kề",Sổ hồng/ Sổ đỏ,---,15m,4,---,---,4,---,
https://alonhadat.com.vn/pho-hoang-nhu-tiep-tt-phuong-bo-de-ban-79m-dat-sau-pho-1-nha-gia-11-ty--11652704.html,"Phố Hoàng Như Tiếp, TT Phường Bồ Đề - Bán 79m Đất Sau Phố 1 Nhà, Gía 11 tỷ.","1 NHÀ RA MẶT PHỐ - Ô TÔ THÔNG - ĐỐI DIỆN KHU MINH NHỰA - ĐÓN ĐẦU DỰ ÁN CẦU TRẦN HƯNG ĐẠO

+ Ngõ trước nhà ô tô 7 chỗ thông Lâm Hạ Hoàng Như Tiếp, nhà cách 1 nhà ra mặt phố Hoàng Như Tiếp đối diện khu Biệt thự Minh Nhựa.

+ Ngay gần bệnh viện Tâm Anh, trường Wellspring, xung quanh nhiều trường học các cấp. 

+ Sổ đỏ cất két, giao dịch ngay. 

Liên hệ* Viết Thu ( best house) – Chuyên nhà đẹp giá tốt nhất Long Biên (miễn trung gian, Qc).",11 tỷ,79 m2,"Đường Hoàng Như Tiếp, Phường Bồ Đề, Quận Long Biên, Hà Nội",11652704,_,---,Cần bán,6m,---,"Đất thổ cư, đất ở",Sổ hồng/ Sổ đỏ,---,---,---,---,---,---,---,
https://alonhadat.com.vn/biet-thu-kdt-dang-xa-vi-tri-dep-dt-rong-420m2-mat-tien-khung--10020592.html,Biệt Thự KĐT Đặng Xá – Vị Trí Đẹp - Dt Rộng 420m2 – Mặt Tiền Khủng.,"VỊ TRÍ ĐẸP NHẤT KHU, CHỦ THIỆN CHÍ BÁN, GIÁ TỐT NHẤT THỊ TRƯỜNG. Chỉ 90tr/m2.
+ Khuôn nhà vuông vắn, vị trí đẹp nhất khu.
+ Nhà 3 tầng khung cột chắc chắn.
+ View nhìn trực tiếp trước mặt là trung tâm thể thao thành tích cao Hà Nội.
+ Vị trí: thuận lợi giao thông.
+ Gần Trung tâm Hà Nội: khoảng 10 km.
+ Đường thông sang Vincity Gia Lâm: Khoảng 2 km.
+ Đường thông sang EcoPark: Khoảng 5km.
+ Đường thông sang Vinhomes Riversides: Khoảng 5 km; 
+ Tiện ích: Đầy đủ mọi dịch vụ trong Khu đô thị.
+ Đây là một khu đô thị xanh, dành được nhiều giải thưởng uy tín.
+ Đây là Căn biệt thự Nữ Hoàng, đẹp nhất của cả khu đô thị. Vị trí số 1 và Vị thế số 1.
+ Sổ đỏ chính chủ: sẵn sàng giao dịch.
- Thông tin chi tiết vui lòng liên hệ Viết Thu: Chuyên Tư vấn Nhà Đất - Thổ Cư quận Long Biên, ( thông tin chuẩn, thật 100%). Miễn Tg",38 tỷ,420 m2,"Đường DX 06, Xã Đặng Xá, Huyện Gia Lâm, Hà Nội",10020592,_,---,Cần bán,10m,---,"Biệt thự, nhà liền kề",Sổ hồng/ Sổ đỏ,---,20m,3,---,---,5,---,Khu đô thị mới Đặng Xá (xem chi tiết dự án)
https://alonhadat.com.vn/tu-dinh-nha-lo-goc-chu-tu-xay-gara-duong-o-to-tranh-kinh-doanh--10823538.html,"Tư Đình – Nhà Lô Góc, Chủ Tự Xây – Gara, Đường  Ô Tô Tránh, Kinh Doanh.","LÔ GÓC TƯ ĐÌNH - Ô TÔ TRÁNH - CHỦ TỰ XÂY - KD SẦM UẤT - GA RA Ô TÔ – NHỈNH 7 TỶ.

+ Mặt ngõ ô tô tránh, gara ô tô 7 chỗ vào nhà, kinh doanh sầm uất.

+ Nhà 5 tầng chủ xây tâm huyết cực đẹp. Lô góc phòng nào cũng thoáng sáng.

+ Thiết kế: 
- Tầng 1 Gara ô tô, bếp, wc.
- Tầng 2,3,4: Khách + 4 ngủ + thờ + wc. 
- Tầng 5: Sân thượng + sân phơi.

+ Sổ đỏ chính chủ, vuông vắn, chủ gửi ngân hàng, khách cọc chủ tự rút sổ.

- Thông tin chi tiết vui lòng liên hệ Viết Thu: Chuyên Tư vấn Nhà Đất – Tận Tâm, Minh Bạch, cam kết hình ảnh và thông số thật. Đỡ mất thời gian của khách. Miễn trung gian, quảng cáo, Trân trọng!",7 tỷ,50 m2,"Đường Tư Đình, Phường Long Biên, Quận Long Biên, Hà Nội",10823538,_,---,Cần bán,6m,---,Nhà trong hẻm,Sổ hồng/ Sổ đỏ,---,---,5,---,---,4,---,
https://alonhadat.com.vn/chi-con-sot-lai-duy-nhat-01-can-02-ngu-re-nhat-thi-truong-1-90-ty-chung-cu-icid-complex-13282716.html,"Chỉ còn sót lại duy nhất 01 căn 02 ngủ rẻ nhất thị trường 1.90 tỷ, chung cư ICID Complex","Vị trí: - Chung cư ICID Complex, mặt đường Lê Trọng Tấn, KĐT Geleximco C, Dương Nội, Hà Đông, Hà Nội.
Cách siêu thị Aeon Mall Hà Đông 500m.
Cách cổng Thiên Đường Bảo Sơn 1km.
Cách Vinhomes Smart City 1.5km.
Thuận tiện cho việc di chuyển vào các quận nội thành: Cách SVĐ Mỹ Đình chỉ 10 phút di chuyển, cách Trung tâm Hội Nghị Quốc Gia 10 phút di chuyển.
Diện tích: 66.2 m² thông thủy, bao gồm 02 phòng ngủ.
Tiện ích: - Tiện ích nội khu: Sảnh vui chơi trẻ em, phòng tập gym.
- Tiện ích xung quanh: Công viên, trường học, mầm non, chợ, siêu thị, spa.
Mô tả: Căn hộ full nội thất xịn xò, chủ nhà để lại toàn bộ. Khách mua nhận nhà về ở ngay, chỉ việc xách vali về ở.
Liên hệ: nhà có thể vay qua bank ls tốt nhất thị trường hoặc trả thẳng).","1,9 tỷ",66 m2,"Đường Lê Trọng Tấn, Phường Dương Nội, Quận Hà Đông, Hà Nội",13282716,Đông Nam,---,Cần bán,---,---,Căn hộ chung cư,Sổ hồng/ Sổ đỏ,---,"4,5m",1,---,---,2,---,Căn hộ chung cư ICID Complex (xem chi tiết dự án)
https://alonhadat.com.vn/hang-hiem-56m-trung-oai-tien-duong-ngo-thong-gia-chi-3x-trieu-tieu-hoc-13615235.html,Hàng Hiếm 56m Trung Oai Tiên Dương ngõ thông giá chỉ 3x triệu tiểu học,"Hàng Hiếm 56m Trung Oai Tiên Dương ngõ thông giá chỉ 3x triệu tiểu học 
- DT: 56,4m. MT=MH: 4m 
- Đường trước đất 2,5m. Ô tô nhỏ đỗ. Gần trục ngõ 3m đi vào. Đường thông
Giá rẻ giật mình chỉ 3x triệu tiểu học. Quá hợp lý để đầu tư và an cư lạc nghiệp 
Liên hệ ngay em Dung: để xem đất và làm việc","1,775 tỷ",55 m2,"Đường số 23B, Xã Tiên Dương, Huyện Đông Anh, Hà Nội",13615235,Đông,---,Cần bán,"2,5m",---,"Đất thổ cư, đất ở",Giấy tờ hợp lệ,---,4m,---,---,"13,82m",---,---,
https://alonhadat.com.vn/biet-thu-mat-pho-95-ty-lo-goc-4-mat-thoang-3-mat-duong-dang-cap-khu-trung-yen-13027627.html,BIỆT THƯ MẶT PHỐ 95 TỶ - LÔ GÓC 4 MẶT THOÁNG 3 MẶT ĐƯỜNG - ĐẲNG CẤP KHU TRUNG YÊN,"BIỆT THƯ MẶT PHỐ 95 TỶ - LÔ GÓC 4 MẶT THOÁNG 3 MẶT ĐƯỜNG - ĐẲNG CẤP KHU TRUNG YÊN 
 Mô tả: 
Diện tích  248.5 m2 Thực tế 280m2. Tk  4 Tầng giá  95 tỷ 
- Vị trí: Nhà mặt phố Trung Kính nằm trong tổng thể của khu đô thị Trung Yên, nhà lô góc 4 mặt thoáng 3 mặt đường cực kỳ đẳng cấp.
- Xung quanh nhà dừng đỗ xe 24/7, cây cối rợp bóng mát.
- Chủ nhà xây tâm huyết, nội thất sang trọng, nhà không lắp thang máy.
- Nhà thuộc khu biệt thự khu đô thị Trung Yên nên anh chị em lưu ý chỉ xây được 4 tầng có mật độ xây dựng 60%. Không xây cao tầng được nhé.
- Sổ đỏ cất két, chờ giao dịch.",95 tỷ,280 m2,"Phố Trung Kính, Phường Yên Hòa, Quận Cầu Giấy, Hà Nội",13027627,Đông Nam,---,Cần bán,8m,---,"Biệt thự, nhà liền kề",Sổ hồng/ Sổ đỏ,---,---,4,---,---,6,---,
https://alonhadat.com.vn/ban-nha-son-tay-mat-pho-loi-ba-dinh-2-mat-tien-truoc-sau-s-70m2-5-tang-mt-5m-g-12600877.html,BÁN NHÀ SƠN TÂY - MẶT PHỐ - 2 MẶT TIỀN TRƯỚC SAU - S 70M2 - 5 TẦNG - MT 5M - GIÁ 2X TỶ,"Mặt phố Sơn Tây, diện tích sổ 70 m2, nhà 5 tầng,  mặt tiền 5m Ba Đình 
 Mô tả: 
KHU NHÀ Ở SIÊU VIP CÁN BỘ CẤP  CAO CẤP
- Nhà mặt phố Sơn Tây đằng trước, mặt ngõ 80 Trần Phú ô tô tránh đằng sau nhà. Khu siêu vip xung quanh toàn nhà các VIP đang sinh sống.
- Nhà cách Lăng Bác vài bước chân, mặt sau bảo vệ 24/24, an ninh tuyệt đối.
- Nhà đang cho thuê cả nhà giá hữu nghị 40tr/ tháng. Khách mua cho thuê nối hay lấy nhà luôn đều có thể xử lý được.
- Nhà thiết kế 5 tầng cầu thang giữa, tầng 2 phòng, có thể thiết kế thang máy.
- Sổ 70m, thực tế xây dựng từ tầng 1 là 73m, từ tầng 2 lên tầng 5 chủ nhà xây đua ra mặt trước và cả mặt sau tổng thêm 10m2 nữa nên diện tích sử dụng là 83m2. 
- Sổ phân lô trước sau như 1, Sổ đỏ cất két chờ giao dịch.
(Liên hệ để được tư vấn, xem nhà hoàn toàn miễn phí, miến phí tư vấn vay vốn mua nhà và hỗ trợ kết nối bank cho vay lãi suất thấp nhất chỉ 7.99%/năm với thời gian cố định lãi suất ưu đãi 5 năm đầu khoản vay).",29 tỷ,70 m2,"Phố Sơn Tây, Phường Điện Biên, Quận Ba Đình, Hà Nội",12600877,_,---,Cần bán,10m,---,Nhà mặt tiền,---,---,5m,5,---,---,4,---,
https://alonhadat.com.vn/chi-con-sot-lai-duy-nhat-01-can-03-ngu-gia-re-nhat-thi-truong-2-4x-ty-chung-cu-gemek-i-12518724.html,CHỈ CÒN SÓT LẠI DUY NHẤT 01 CĂN 03 NGỦ RẺ NHẤT THỊ TRƯỜNG 2.4x TỶ !!! CHUNG CƯ GEMEK II,"VAY RẺ MUA LUÔN NHÀ ĐẸP GEMEK II !. 
( Lãi suất vay chỉ 7.99%/năm, thời gian cố định lãi suất ưu đãi cao nhất 5 năm đầu khoản vay)

CHỈ CÒN SÓT LẠI DUY NHẤT 01 CĂN 03 NGỦ GIÁ RẺ NHẤT THỊ TRƯỜNG 2.4x TỶ !!! CHUNG CƯ GEMEK II !!! 
Vị trí: - Chung cư GEMEK II, Mặt đường Lê Trọng Tấn KĐT Nam An Khánh, An Khánh, Hoài Đức.
Giáp cổng Thiên Đường Bảo Sơn.
Cách siêu thị Aeon Mall Hà Đông 1,5km.
Cách Vinhomes Smart City 1km.
Thuận tiện cho việc di chuyển vào các quận nội thành: Cách SVĐ Mỹ Đình chỉ 10 phút di chuyển, cách Trung tâm Hội Nghị Quốc Gia 10 phút di chuyển.
Diện tích: 98m², bao gồm 03 phòng ngủ, 02WC.
Tiện ích: - Tiện ích nội khu: Bể bơi chung cư, Sảnh vui chơi trẻ em, phòng tập Gym.
- Tiện ích xung quanh: Công viên, trường học, mầm non, chợ, siêu thị, Spa.
Mô tả: Căn hộ full nội thất xịn xò, chủ nhà để lại toàn bộ. Khách mua nhận nhà về ở ngay, chỉ việc xách vali về ở.
( Nhà có thể vay qua Bank LS tốt nhất thị trường hoặc trả thẳng)","2,49 tỷ",90 m2,"Đường Lê Trọng Tấn, Xã An Khánh, Huyện Hoài Đức, Hà Nội",12518724,_,---,Cần bán,---,---,Căn hộ chung cư,---,---,---,1,---,---,3,---,Căn hộ chung cư Gemek Premium (xem chi tiết dự án)
https://alonhadat.com.vn/ban-nha-ngoc-khanh-full-noi-that-ngo-to-thong-tu-phia-san-thoang-s30m2-12695853.html,Bán nhà Ngọc Khánh full nội thất – ngõ to thông tứ phía  - Sân thoáng - s30m2,"Bán nhà Ngọc Khánh full nội thất – ngõ to thông tứ phía  - Sân thoáng - s30m2  2 tầng  mặt tiền 3.7m giá  3.05 tỷ
*Mô tả:
+ Sổ nở hậu đẹp, cất két.
+ Ngõ trước nhà cực rộng, để bạt chục xe máy thoải mái khi cần. Khu dân cư yên tĩnh, dân trí cao, hàng xóm thân thiện.
+ Nhà 2 tầng đẹp long lanh, chủ xác định bán đất tặng luôn nhà nội thất cực xịn. Gia đình nhỏ chuyển về ở ngay và luôn.
(Liên hệ để được tư vấn, xem nhà hoàn toàn miễn phí, miến phí tư vấn vay vốn mua nhà và hỗ trợ kết nối bank cho vay lãi suất thấp nhất chỉ 7.99%/năm với thời gian cố định lãi suất ưu đãi 5 năm đầu khoản vay).","3,05 tỷ",30 m2,"Phố Ngọc Khánh, Phường Ngọc Khánh, Quận Ba Đình, Hà Nội",12695853,Tây Bắc,---,Cần bán,2m,---,Nhà trong hẻm,Sổ hồng/ Sổ đỏ,---,"3,7m",2,---,---,2,---,
https://alonhadat.com.vn/ban-dat-mat-tien-pho-bach-dang-50m2-mat-tien-4m-no-hau-gia-8-5-ty-12640886.html,"BÁN ĐẤT MẶT TIỀN PHỐ BẠCH ĐẰNG - 50M2 MẶT TIỀN - 4M NỞ HẬU - GIÁ 8,5 TỶ","Mặt tiền hướng đông
Vị trí cực đặc địa, khu vực dân trí tốt, giao thông đi lại thuận tiện, 5 phút đi ra Nhà Hát Lớn - Hồ Hoàn Kiếm, gần phố cổ 36 phố phường, gần chợ đầu mối Long Biên tấp nập ngày đêm.
Vị trí đẹp nên xây 7T thang máy thì quá lý tưởng, Mặt tiền thể hiện đẳng cấp gia chủ, khuôn đất nở hậu10cm(nói chung là tuyệt hết nước chấm)
Chủ là sếp lớn nhiều nhà, con cái làm việc bên nước ngoài hết nên bán bớt
Lô góc, 2 mặt thoáng sáng Vĩnh viễn, hiện chủ hiện chủ đang cho thuê đất mở cửa hàng 12tr/th
Sổ đỏ để két, nở hậu 10cm, giao dịch ngay
(Liên hệ để được tư vấn, xem nhà hoàn toàn miễn phí, miến phí tư vấn vay vốn mua nhà và hỗ trợ kết nối bank cho vay lãi suất thấp nhất chỉ 7.99%/năm với thời gian cố định lãi suất ưu đãi 5 năm đầu khoản vay).","8,5 tỷ",50 m2,"Đường Bạch Đằng, Phường Chương Dương, Quận Hoàn Kiếm, Hà Nội",12640886,Đông,---,Cần bán,15m,---,"Đất thổ cư, đất ở",Sổ hồng/ Sổ đỏ,---,4m,---,---,---,---,---,
https://alonhadat.com.vn/ban-gap-cc-hh2-bac-ha-dt-133m-3pn-2wc-tang-trung-view-thoang-nha-dep-day-du-nt-13526402.html,"Bán gấp CC HH2 Bắc Hà: DT 133m, 3PN + 2WC. Tầng trung, view thoáng. Nhà đẹp,  Đầy đủ NT","Cần bán gấp căn hộ tại chung cư HH2 – Bắc Hà
- Diện tích 133m2, thiết kế 3PN + 2WC
- Căn hộ tầng trung, thiết kế vuông vắn, thuộc căn góc nên nhà thoáng, sáng
- Nhà đã có đầy đủ các đồ nội thất cơ bản. Để lại toàn bộ cho chủ mới
- Tòa nhà nằm ngay mặt đường Tố Hữu. Thuận tiện di chuyển ra các tuyến phố chính như Lê Văn Lương, Vành đai 3,…
- Tiện ích nội & ngoại khu đầy đủ, không thiếu thứ gì
- Sổ đỏ chính chủ, giao dịch ngay
- Giá bán 3.7 tỷ có thương lượng","3,7 tỷ",133 m2,"Đường Tố Hữu, Phường Trung Văn, Quận Nam Từ Liêm, Hà Nội",13526402,Đông Nam,---,Cần bán,---,---,Căn hộ chung cư,Sổ hồng/ Sổ đỏ,---,---,---,---,---,3,---,Căn hộ chung cư HH2 - Bắc Hà (xem chi tiết dự án)
https://alonhadat.com.vn/ban-gap-can-ho-78m2-2pn-2wc-tang-cao-full-noi-that-nha-dep-o-ngay-gia-2-x-ty-13470590.html,"Bán gấp căn hộ 78m2, 2PN + 2WC. Tầng cao, Full nội thất. Nhà đẹp ở ngay/ Giá 2.x tỷ","Cần tiền, bán gấp căn hộ tại chung cư Imperial Plaza 360 Giải Phóng
- Diện tích 78m2, thiết kế 2PN + 2wc
- Căn hộ thiết kế vuông vắn. Phòng nào cũng có ánh sáng tự nhiên
- Nhà cực đẹp, đã trang bị đầy đủ nội thất. Khách mua chỉ mang valy đến ở được luôn
- Căn hộ ở tầng cao, thoáng, sáng. Ít bụi, không ồn ào
- Tiện ích nội & ngoại khu đầy đủ, không thiếu thứ gì
- Giá bán 2.93 tỷ","2,93 tỷ",78 m2,"Đường Giải Phóng, Phường Phương Liệt, Quận Thanh Xuân, Hà Nội",13470590,Đông Nam,---,Cần bán,---,---,Căn hộ chung cư,Sổ hồng/ Sổ đỏ,---,---,---,---,---,2,---,Căn hộ chung cư Imperial Plaza – Sky View Plaza (xem chi tiết dự án)
https://alonhadat.com.vn/chung-cu-nguyen-ngoc-vu-87m2-3pn-2wc-nha-dep-o-ngay-nt-co-ban-13460312.html,"Chung cư Nguyễn Ngọc Vũ: 87m2: 3PN + 2WC. Nhà đẹp, ở ngay. NT cơ bản","+ Cần bán căn hộ tại chung cư 137 Nguyễn Ngọc Vũ
+ Diện tích 87m2, thiết kế 3PN + 2WC
+ Tầng trung cực đẹp, View thoáng. Các phòng đều có ánh sáng tự nhiên
+ Vị trí tòa nhà nằm ngay mặt đường. Rất thuận tiện di chuyển ra các tuyến phố lớn như: Lê Văn Lương, Láng Hạ, Ngã tư sở,…
+ Tiện ích xung quanh: Trường học, siêu thị, chợ,… không thiếu thứ gì
+ Giá bán: 3.6 tỷ có thương lượng
+ Sổ đỏ cầm tay, sẵn sàng giao dịch","3,6 tỷ",87 m2,"Phố Nguyễn Ngọc Vũ, Phường Trung Hòa, Quận Cầu Giấy, Hà Nội",13460312,Tây Bắc,---,Cần bán,---,---,Căn hộ chung cư,Sổ hồng/ Sổ đỏ,---,---,---,---,---,3,---,Căn hộ chung cư 137 Nguyễn Ngọc Vũ (xem chi tiết dự án)
https://alonhadat.com.vn/nha-dep-gia-re-78m2-5t-mt-4-2m-o-to-vao-nha-gan-mp-gia-11-5-ty-13225175.html,"Nhà đẹp – Giá rẻ: 78m2*5T. MT 4.2m, ô tô vào nhà, gần MP. Giá 11.5 tỷ","CHÍNH CHỦ CẦN BÁN NHÀ QUAN NHÂN. GẦN MP, Ô TÔ 7 CHỖ VÀO NHÀ
- Diện tích 78m2, mặt tiền 4.15m, sổ vuông chính chủ
- Nhà xây 4 tầng + 1 tum chắc chắn. Nhà còn đẹp, sẵn về ở ngay
- Cách MP Quan Nhân 10m. Ngõ rộng, thoáng. Ô tô 7 chỗ vào nhà
- Vị trí thuận lợi gần chợ, trạm y tế, xung quanh nhà là các trường từ mẫu giáo đến THPT, an ninh tốt, hàng xóm thân thiện. 
- Nhà 4 tầng 1 tum, mỗi tầng đều có ban công. 
- Tầng 1: gara ô tô, bếp, vệ sinh 
- Tầng 2: phòng khách, 2 vệ sinh, phòng ngủ 
- Tầng 3: 2 phòng ngủ, 1 vệ sinh 
- Tầng 4: phòng thờ, phòng giặt
- Giá chào bán: 11.5 tỷ có thương lượng","11,5 tỷ",78 m2,"Phố Quan Nhân, Phường Nhân Chính, Quận Thanh Xuân, Hà Nội",13225175,_,---,Cần bán,5m,---,Nhà trong hẻm,Sổ hồng/ Sổ đỏ,---,"4,2m",5,---,---,4,---,
