url,title,description,price,area,address,Mã tin,Hướng,Phòng ăn,Loại tin,Đường trước nhà,Nhà bếp,Loại BDS,Pháp lý,Sân thượng,Chiều ngang,Số lầu,Chổ để xe hơi,Chiều dài,Số phòng ngủ,Chính chủ
https://alonhadat.com.vn/ban-nha-thoang-sang-dep-lung-linh-duong-mac-thi-buoi-33m2-gia-3-7-ty-xay-san-5-tang-13597596.html,"Bán nhà thoáng sáng đẹp lung linh đường Mạc Thị Bưởi 33m2 Giá 3,7 Tỷ xây sẵn 5 Tầng","Bán nhà thoáng sáng đẹp lung linh đường Mạc Thị Bưởi 33m2 Giá 3,7 Tỷ xây sẵn 5 Tầng  để lại nội thất cho khách chỉ việc đến ở 
+ Vị trí ngõ thông thoáng, hàng xóm Times City hưởng trọn tiện ích, ngõ văn minh lịch sự. Nhà gần các trường ĐH lớn Kinh Công,Kinh Kĩ, Bách Khoa, Xây Dựng,....
+ Nhà xây vuông vức chắc chắn khung cột bê tông, thiết kế các phòng ngủ đầy đủ ánh sáng
+ Sổ vuông như tờ A4 - cất két sẵn sàng giao dịch",4 tỷ,33 m2,"Phố Mạc Thị Bưởi, Phường Vĩnh Tuy, Quận Hai Bà Trưng, Hà Nội",13597596,_,---,Cần bán,3m,---,Nhà trong hẻm,---,---,"3,3m",5,---,10m,5,---
https://alonhadat.com.vn/ban-nha-pho-kim-nguu-dep-lung-linh-hang-xom-tri-thuc-ngo-van-minh-gia-chi-4-2-ty-13602846.html,"BÁN NHÀ PHỐ KIM NGƯU ĐẸP LUNG LINH HÀNG XÓM TRÍ THỨC NGÕ VĂN MINH GIÁ CHỈ 4,2 TỶ",nan,"4,2 tỷ",34 m2,"Phố Kim Ngưu, Phường Vĩnh Tuy, Quận Hai Bà Trưng, Hà Nội",13602846,_,---,Cần bán,4m,---,Nhà trong hẻm,---,---,"4,3m",4,---,"8,5m",4,---
https://alonhadat.com.vn/ban-nha-34m-6-tang-pho-lang-ha-gia-cuc-soc-13361253.html,Bán nhà 34m – 6 tầng phố Láng Hạ - giá cực sốc,"BÁN NHÀ 34M - 6 TẦNG PHỐ LÁNG HẠ - GIÁ CỰC SỐC

NGÕ RỘNG THÔNG THOÁNG KHU VỰC TRUNG TÂM QUẬN ĐỐNG ĐA

Xe ba gác đỗ cửa, dân trí cao, văn minh lịch sự, gần nhiều Ngân hàng, Trường học, Bệnh viện, khu vui chơi...

Thiết kế 2 mặt thoáng trước sau, 6 tầng cầu thang giữa, 5 phòng ngủ.

Sổ đỏ chính chủ, giao dịch nhanh","4,35 tỷ",34 m2,"Đường Láng Hạ, Phường Láng Hạ, Quận Đống Đa, Hà Nội",13361253,_,True,Cần bán,"2,5m",True,Nhà trong hẻm,Sổ hồng/ Sổ đỏ,True,"3,4m",6,---,10m,5,---
https://alonhadat.com.vn/7-tang-thang-may-mat-pho-dai-la-90m2-mt-4-5m-28-ty--10064275.html,"7 tầng thang máy, mặt phố Đại La, 90m2 mt 4,5m 28 tỷ.","Bán nhà mặt phố Đại La.
Diện tích 90m2. Mặt tiền 4,5m. Sổ đỏ chính chủ.
Giá 28 tỷ có thương lượng.
+ Nhà mặt phố Đại La, vỉa hè trước nhà rộng 5m, ô tô dừng đỗ, kinh doanh hay đặt văn phòng công ty, văn phòng đại diện rất tốt.
+ Phố Đại La quy hoạch ổn định.
+ Nhà xây 7 tầng, thiết kế thông sàn, thang máy.
+ Sau nhà có ngõ đi rộng 3m.
Liên hệ xem nhà 24/24 Mr Dương",28 tỷ,90 m2,"Phố Đại La, Phường Đồng Tâm, Quận Hai Bà Trưng, Hà Nội",10064275,_,True,Cần bán,50m,True,Nhà mặt tiền,Sổ hồng/ Sổ đỏ,True,"4,5m",7,True,---,7,---
https://alonhadat.com.vn/ban-nha-ngo-61-lac-trung-o-to-tranh-via-he-kinh-doanh-90m2x5t-mt5m-14-5-ty--9920080.html,"Bán nhà ngõ 61 Lạc Trung ô tô tránh, vỉa hè, kinh doanh 90m2x5T mt5m 14,5 tỷ.","Diện tích 90m2. Mặt tiền 5m. Sổ đỏ chính chủ.
Giá 14,5 tỷ có thương lượng.
+ Nhà nằm trong khu phân lô cán bộ thuộc ngõ 61 Lạc Trung, đường trước nhà rộng 5m, vỉa hè mỗi bên 2m, ngõ thông ô bàn cờ.
+ Vị trí nhà khá đẹp, phù hợp vừa ở vừa kinh doanh văn phòng.
+ Nhà xây 5 tầng chắc chắn, chia tầng 2 phòng.
+ Sau nhà có khe thoáng rộng 2m.
Liên hệ xem nhà (24/24) Mr Dương","14,5 tỷ",90 m2,"Phố Lạc Trung, Phường Vĩnh Tuy, Quận Hai Bà Trưng, Hà Nội",9920080,_,True,Cần bán,5m,True,Nhà trong hẻm,Sổ hồng/ Sổ đỏ,True,5m,5,True,---,5,---
https://alonhadat.com.vn/sieu-pham-pho-vong-thanh-xuan-mat-pho-kd-nha-dep-moi-xay-vi-he-rong-70m2-gia-14ty-8885467.html,Siêu Phẩm Phố Vọng – Thanh Xuân - Mặt Phố - KD- Nhà Đẹp Mới Xây - Vỉ Hè Rộng 70m2 giá 14tỷ,"-	Nhà mặt phố kinh doanh sầm uất, diện tích 70m2 mặt tiền rộng 5.3m giá 14 tỷ, có vỉ hè rộng rãi, để xe thoải mái, thông thương với các tuyến phố Nguyễn An Ninh, Giải Phóng, Trần Đại Nghĩa.
-	Khu vực trung tâm bậc nhất, gần các trường đại học lớn, Bách Khoa, Kinh Tế, Xây Dựng,tiện vừa ở vừa kết hợp kinh doanh, hoặc cho thuê.
-	  Nhà mới xây nên rất mới, nội thất xịn xò, kiên cố chắc chắn, khách mua về chỉ việc ở.
-	Sổ đỏ nở hậu đẹp chính chủ, sẵn sàng mua bán.
-	Giá 14 tỷ có thương lượng.
-	Tôi cam kết giúp anh chị mua được nhà giá tốt nhất thị trường. và tư vấn tận tâm. LH tôi Duẩn",14 tỷ,70 m2,"Phố Vọng, Phường Phương Liệt, Quận Thanh Xuân, Hà Nội",8885467,_,---,Cần bán,8m,---,Nhà mặt tiền,Sổ hồng/ Sổ đỏ,---,---,3,---,---,6,---
https://alonhadat.com.vn/nha-mat-pho-de-to-hoang-hai-ba-trung-nha-dep-thang-may-van-phong-kd-oto-80m2-gia-9-8ty-8787559.html,Nhà Mặt Phố Đê Tô Hoàng – Hai Bà Trưng Nhà Đẹp-Thang Máy- Văn Phòng KD-Ôtô 80m2 giá 9.8tỷ,"-	Nhà gần trục đường trung tâm Đại Cổ Việt, Phố Huế, Hàng Bài. Đi ngõ 27 Đại Cổ Việt hay đi Đê Tô Hoàng đều thuận tiện ngay, gần Bộ giáo dục, gần trường Tô Hoàng…Là ngõ sầm uất rất nhiều văn phòng TRụ sở Công ty hay nhà ở đều đẹp.
-	Nhà xây 5 tầng hiện đại, bố trí hợp lý, đầy đủ công năng.
-	An sinh tốt, nhiều cán bộ hưu trí, an ninh tuyệt vời.
-	Sổ đỏ đẹp chính chủ giao dịch 24/7.
-	Giá 9.8 tỷ có thương lượng.
-	Tôi cam kết giúp anh chị mua được nhà giá tốt nhất thị trường.LH tôi Duẩn","9,8 tỷ",80 m2,"Phố Đê Tô Hoàng, Phường Cầu Dền, Quận Hai Bà Trưng, Hà Nội",8787559,_,---,Cần bán,6m,---,Nhà trong hẻm,Sổ hồng/ Sổ đỏ,---,---,5,---,---,5,---
https://alonhadat.com.vn/ban-biet-thu-van-phu-ha-dong-khu-vuc-vip-phan-lo-vi-he-oto-tranh-225m-3tang-gia24-ty-10194147.html,Bán Biệt Thự Văn Phú - Hà Đông Khu vực Vip Phân Lô Vỉ Hè Ôtô Trảnh 225m-3Tầng Gía24 tỷ,"Siêu biệt thự nằm giữa trung tâm khu đô thị văn phú với diện tích 225n2 sổ nở hậu phù hợp với các doanh nhân thành đạt muốn trở về tận hưởng cuộc sống sau những giờ làm việc mệt mỏi 
- Vị trí siêu víp nằm trong khu đô thị văn phú căn biệt thự nằm ở dãy BT5 dãy phố đi thẳng từ văn khê vào, không có khúc ngoặt nào xung quanh toàn các đại gia về ở
- xung quanh biệt thự toàn cây trái cây cảnh ngồi trà đạo hái hoa trong vườn ngắm cá coi bơi lượn trong vườn thượng uyển
- Thiết kế biệt thự gồm có.
- Tầng 1 Gara phòng khách, bếp, phòng ăn ,WC
- Tầng 2 gồm 2 phòng ngủ 2WC và 1 phòng  Master siêu víp 
- tầng 3 gồm 2 ngủ phòng thờ  sân phơi 
- Công năng đầy đủ, sổ đỏ chính chủ, khách mua về chỉ việc ở sự lựa chọn hoàn hảo
- Giá bán 24 tỷ có thương lượng  
- Tôi Duẩn cam kết giúp a/c mua được nhà giá tốt nhất thị trường. LH. Tôi Duẩn",24 tỷ,225 m2,"Đường Văn Phú, Phường Phú La, Quận Hà Đông, Hà Nội",10194147,_,---,Cần bán,10m,---,"Biệt thự, nhà liền kề",Sổ hồng/ Sổ đỏ,---,---,3,---,---,4,---
https://alonhadat.com.vn/sieu-pham-pho-vong-hai-ba-trung-nha-phan-lo-gara-oto-kinh-doanh-80m2-gia-15-8-ty-8892163.html,Siêu Phẩm Phố Vọng – Hai Bà Trưng – Nhà Phân Lô – GARA ÔTÔ – Kinh Doanh – 80m2 giá 15.8 tỷ,"Vị trí cực đẹp của phố vọng, kinh doanh sầm uất, thông với Giải Phóng,và Đại La.
Nhà nằm trong khu phân lô Víp của quận Hai Bà Trưng. Xung quanh vô vàn tiện ích như Vinart,  trường học các cấp, bệnh viện, trường đại học, giao thông thuận lợi.
Nhà xây 6 tầng kiên cố chắc chắn thiết kế hiện đại với đầy đủ công năng sử dụng. Hiện nhà đang cho thuê làm trường mầm non với 40 triệu /tháng
Khu vực toàn cán bộ nên an ninh cực tốt, an sinh tuyệt vời.
Sổ đỏ đẹp chính chủ sẵn sàng mua bán 24/7
Giá 15.8 tỷ có thương lượng.
Tôi cam kết giúp anh chị mua được nhà giá tốt nhất thị trường và tư vấn tận tâm. LH. Duẩn.","15,8 tỷ",80 m2,"Phố Vọng, Phường Đồng Tâm, Quận Hai Bà Trưng, Hà Nội",8892163,_,---,Cần bán,8m,---,Nhà mặt tiền,---,---,---,6,---,---,8,---
https://alonhadat.com.vn/nha-mat-pho-trinh-cong-son-tay-ho-mat-pho-vip-view-ho-kd-van-phong-85m2-gia-34-ty-8851044.html,Nhà Mặt Phố Trịnh Công Sơn – Tây Hồ - Măt Phố Víp- View Hồ- KD- Văn Phòng 85m2 giá 34 tỷ,"-	Nhà mặt phố đi bộ trịnh công sơn view hồ trước nhà thoáng vĩnh viễn, view hồ tây miễn chê, vị trí đẹp nhất phố Trịnh Công Sơn.Dể ở hay cho thuê làm văn phòng , kinh doanh ,homestay , cho khách du lịch đều phù hợp.
-	Nhà thiết kế 5 tầng hiện đại, bố trí hợp lý, đầy đủ công năng sử dụng .
-	An sinh đỉnh cao, an ninh tuyệt vời, dân trí cao.
-	Sổ đỏ đẹp chính chủ sẵn sàng giao dịch 24/7
-	Giá 34 tỷ có thương lượng.
-	Tôi cam kết giúp anh chị mua được nhà giá tốt nhất thị trường. LHtôi Duẩn
-",34 tỷ,85 m2,"Phố Trịnh Công Sơn, Phường Nhật Tân, Quận Tây Hồ, Hà Nội",8851044,_,---,Cần bán,7m,---,Nhà mặt tiền,---,---,---,5,---,---,8,---
https://alonhadat.com.vn/biet-thu-san-vuon-tu-hiep-thanh-tri-duong-to-vi-he-rong-dt218m2-gia-21-5-ty-8845163.html,Biệt Thự Sân Vườn Tứ Hiệp – Thanh Trì – Đường To - Vỉ Hè Rộng – DT218m2 giá 21.5 tỷ,"-	Khu biệt thự đấu giá Tứ Hiệp mảnh đất phân lô vuông vắn, nằm ở trung tâm huyện thanh trì . Giao thông vô cùng thuận lợi, có các tuyến đường thông với quốc lộ 1A,đường 70 kéo dài và nhiều tuyến đường khác..
-	Biệt thự 3 tầng, thiết kế hiện đại ,bố trí hợp lý, hợp phong thủy, đầy đủ công năng.
-	An sinh đỉnh cao, an ninh tốt, dân trí cao.
-	Sổ đỏ vuông đẹp chính chủ sẵn sàng giao dịch 24/7
-	Giá 21.5 tỷ có thương lượng. 
-	-  Tôi cam kết giúp anh chị mua được nhà giá tốt nhất thị trường. LHtôi Duẩn","21,5 tỷ",218 m2,"Đường Tứ Hiệp, Xã Tứ Hiệp, Huyện Thanh Trì, Hà Nội",8845163,_,---,Cần bán,9m,---,"Biệt thự, nhà liền kề",Sổ hồng/ Sổ đỏ,---,---,3,---,---,6,---
https://alonhadat.com.vn/biet-thu-sieu-dep-kdt-moi-cau-buou-thanh-tri-sat-cong-vien-chu-van-an-239m2-gia-19-3-ty--8794082.html,Biệt Thự Siêu Đẹp KDT-Mới Cầu Bươu- Thanh TRí  Sát Công Viên Chu Văn An 239M2 giá 19.3 tỷ.,"Vị trí Nằm trong KDT mới Cầu Bươu ngay sát công viên Chu Văn An rộng 100 ha cách KĐT The Mannor Center Park rộng 90 ha.Cách đại lộ Chu Văn An 150m, gần KĐT Xa la, Nằm trong quần thể KĐT với hạ tầng đồng bộ,chung cư.
Biệt thự 4 tầng đẳng cấp, không lỗi phong thủy, nội thất xịn xò 
An sinh đỉnh cao, an ninh tốt, dành cho giới thượng lưu.
Sổ đỏ vuông đẹp chính chủ, sẵn sàng giao dịch 24/7
Giá 19.3 tỷ có thương lượng
Tôi cam kết giúp anh chị mua được nhà giá tốt nhất thị trường LH tôi Duẩn.","19,3 tỷ",239 m2,"Đường Cầu Bươu, Xã Tân Triều, Huyện Thanh Trì, Hà Nội",8794082,_,---,Cần bán,10m,---,"Biệt thự, nhà liền kề",Sổ hồng/ Sổ đỏ,---,---,4,---,---,8,---
https://alonhadat.com.vn/sieu-pham-kdt-van-khe-ha-dong-nha-moi-phong-cach-tan-co-dien-chau-au-50m2-gia-7-5-ty-8862894.html,"Siêu Phẩm KĐT Văn Khê – Hà Đông- Nhà Mới –Phong Cách Tân Cổ Điển Châu Âu-50m2 giá 7,5 tỷ","-	Nhà nằm trong khuôn viên của khu đô thị Văn Khê, tận hưởng đầy đủ các tiện ích của khu đô thị này như trường học, siêu thị, khu vui chơi và mua sắm.Cách đường Tố Hữu khoảng 200m ,cách A-ONE Hà Đông vài phút đi xe, giao thông thuận tiện .
-	Nhà mới xây 5 tầng , kiên cố chắc chắn , thiết kế kiểu tân cổ điển châu âu,sang trọng.
-	An sinh tuyệt vời, dân trí cao, an ninh tốt.
-	Sổ đỏ đẹp chính chủ, đầy đủ giấy phép xây dựng.
-	Giá 7.5 tỷ có thương lượng   
-	Tôi cam kết giúp anh chị mua được nhà giá tốt nhất thị trường. và tư vấn tận tâm. LH tôi Duẩn","7,5 tỷ",50 m2,"Đường Văn Khê, Phường La Khê, Quận Hà Đông, Hà Nội",8862894,_,---,Cần bán,6m,---,"Biệt thự, nhà liền kề",Sổ hồng/ Sổ đỏ,---,---,5,---,---,6,---
https://alonhadat.com.vn/sieu-pham-mat-pho-kim-giang-hoang-mai-vi-he-kinh-doanh-oto-do-74m2-gia-12-ty-9153452.html,Siêu Phẩm Mặt Phố Kim Giang – Hoàng Mai – Vỉ Hè – Kinh Doanh - ÔTô Đỗ - 74m2  giá 12 tỷ,"Nhà một mặt phố kinh doanh sầm uất vỉ hè rộng 8m ,1 mặt ngõ rộng 4,5 m ô tô  đỗ ngày đêm, giao thông thuận tiện đi các ngả 
-  An sinh tốt gần các trường học và bệnh viện siêu thị ngay bên cạnh .
- Hiện trạng nhà vẫn còn mới đẹp, thiết kế 5 tầng, đầy đủ công năng sử dụng , nhà thoáng trước sau, một mặt phố một mặt ngõ
- Sổ đỏ đẹp chính chủ sẵn sàng giao dịch .
- Giá 12 tỷ có thương lượng
Tôi Duẩn cam kết giúp AC mua được nhà giá tốt nhất thị trường và tư vấn tận tâm LH tôi Duẩn",12 tỷ,74 m2,"Đường Kim Giang, Phường Đại Kim, Quận Hoàng Mai, Hà Nội",9153452,_,---,Cần bán,10m,---,Nhà mặt tiền,Sổ hồng/ Sổ đỏ,---,---,5,---,---,8,---
https://alonhadat.com.vn/ban-nha-pho-an-trach-dong-da-thang-may-via-he-kinh-doanh-cuc-dinh-gia-32ty-13455828.html,Bán nhà Phố An Trạch Đống Đa – Thang Máy – Vỉa Hè – Kinh Doanh Cực Đỉnh . Giá 32tỷ,"-	Căn nhà có vị trí đẹp bậc nhất tại trung tâm quận Đống Đa , khu phố kinh doanh sầm uất mọi mặt hàng và có nhiều văn phòng trụ  sở giao dịch , siêu thị , trường học . Giao thông thuận tiện ngay nút giao với  các quận Ba Đình , Hoàn Kiếm !!!
-	Tòa nhà được thiết kế hiện đại với 8 tầng , tầng 1 được sử dụng làm hầm để xe ô tô , các tầng trên đc thiết kế thông sàn thang máy 
-	Diện tích 78m2 – Mặt Tiền 5.2m , vỉa hè thênh thang , cung đường ô tô tránh đỗ ngày đêm 
-	Giá : 32tỷ có thương lượng 
-	Thửa đất vuông vắn , k lỗi phong thủy sẵn sàng giao dịch ngay 
-	Liên hệ : e Đại O TÁM SÁU 2221386 để được tư vấn và hỗ trợ",32 tỷ,78 m2,"Phố An Trạch, Phường Ô Chợ Dừa, Quận Đống Đa, Hà Nội",13455828,_,---,Cần bán,20m,---,Nhà mặt tiền,Sổ hồng/ Sổ đỏ,---,"5,2m",8,---,15m,8,---
https://alonhadat.com.vn/ban-nha-o-cho-dua-dong-da-mat-tien-5-5m-thang-may-dong-tien-85tr-thang-gia-34-5ty-13457511.html,Bán nhà Ô Chợ Dừa Đống Đa – Mặt Tiền 5.5m – Thang Máy – Dòng tiền 85tr/tháng .Giá 34.5tỷ,"-	Diện tích 65m2  , vỉa hè ,  mặt tiền 5.5m siêu khủng . Thiết kế 5 tầng thông sàn có thang máy mạ vàng , tầng 5 đc làm phòng thờ + sân phơi 
-	Nằm tại khu đắc địa kinh doanh buôn bán sầm uất nhiều loại mặt hàng , văn phòng , trụ sở giao dịch , trường học , …. Tại Trung Tâm Quận Đống Đa
-	Giao nhau với các tuyến đường Nguyễn Trãi , Láng Hạ , Tây Hồ … 
-	Nhà được thiết kế kiểu dáng hiện đại theo phong cách Châu Âu , đang cho thuê các tầng với dòng tiền 85tr/tháng 
-	Thửa đất vuông vắn k lỗi phong thủy, , pháp lý sạch sẽ sẵn sàng giao dịch 
-	Hiện tại gia chủ đang chào bán với giá 34.5tỷ có thương lượng 
-	Liên hệ : e Đại O tám sáu 2221386 để được tư vấn và hỗ trợ","34,5 tỷ",65 m2,"Đường Ô Chợ Dừa, Phường Ô Chợ Dừa, Quận Đống Đa, Hà Nội",13457511,_,---,Cần bán,30m,---,Nhà mặt tiền,Sổ hồng/ Sổ đỏ,---,"5,5m",5,---,12m,6,---
https://alonhadat.com.vn/ban-nha-sieu-hiem-ngo-gieng-dong-da-phan-lo-o-to-tranh-dt-58m2-gia-11ty-13461780.html,Bán nhà SIÊU HIẾM Ngõ Giếng  Đống Đa Phân Lô – Ô TÔ TRÁNH – DT 58M2 .Giá 11tỷ,"-	Vị trí đắc địa tại trung tâm quận Đống Đa rất ít nhà bán . Nhà được nằm tại con ngõ rộng , ô tô vào tận cửa . Đầy đủ các tiện ích như chợ , siêu thị , trụ sợ giao dịch , trường học , … rất phù hợp làm nơi an sinh nghỉ dưỡng 
-	Nhà được thiết kế kiểu dáng cơ bản với 4 tầng khách mua về có thể ở được ngay 
-	Tầng 1 :  sân để xe , phòng khách + bếp 
-	Tầng 2,3 : mỗi phòng 2 phòng ngủ + wc
-	Tầng 4 : phòng thờ + sân phơi 
-	Tất cả các phòng đều thoáng , sáng  nhiều ô cửa sổ vì  gia chủ rất tâm huyết khi xây dựng lên 
-	Diện tích 58m2 , Mặt Tiền 4m 
-	Pháp lý sạch sẽ  , sẵn sàng giao dịch 
-	Giá 11tỷ - có thương lượng 
-	Liên Hệ : e Đại 0 tám sáu 2221386 để được tư vấn và hỗ trợ",11 tỷ,58 m2,"Phố Đông Các, Phường Ô Chợ Dừa, Quận Đống Đa, Hà Nội",13461780,_,---,Cần bán,8m,---,Nhà trong hẻm,Sổ hồng/ Sổ đỏ,---,4m,4,---,"14,5m",4,---
https://alonhadat.com.vn/ban-nha-huynh-thuc-khang-dong-da-phan-lo-o-to-tranh-o-kinh-doanh-dt40m2-gia-10ty-13462108.html,"Bán nhà Huỳnh Thúc Kháng Đống Đa Phân Lô – Ô Tô Tránh – Ở, Kinh Doanh  – DT40M2 .Giá 10tỷ","-	Nhà có diện tích 40m2 , mặt tiền 3.8m và được xây 4 tầng kiểu dáng thiết kế cơ bản BTCT 
-	Gia chủ đang cho thuê lại với dòng tiền 25tr/tháng , AC mua về vôi ve có thể ở được luôn hoặc đập đi xây lại 6 tầng thông sàn lắp thang máy 
-	Vị trí đẹp , ô tô tránh  , khu phân lô bàn cờ vừa kinh doanh hoặc  ở đều cực kì phù hợp 
- Xung quanh đầy đủ tiên ích cafe , văn phòng , trụ sở giao dịch , ...
-	Thửa đất cực kì đẹp vuông vắn , sẵn sàng giao dịch ngay 
-	Giá : 10tỷ có thương lượng 
-	Liên hệ : e Đại o tám sáu 2221386 để được tư vấn và hỗ trợ",10 tỷ,40 m2,"Phố Huỳnh Thúc Kháng, Phường Láng Thượng, Quận Đống Đa, Hà Nội",13462108,_,True,Cần bán,15m,True,Nhà trong hẻm,Sổ hồng/ Sổ đỏ,True,"3,8m",4,True,"10,5m",4,---
https://alonhadat.com.vn/ban-dat-tang-nha-pho-huynh-thuc-khang-phan-lo-via-he-mat-tien-sieu-khung-dt134m2-13462139.html,Bán đất tặng nhà phố Huỳnh Thúc Kháng  Phân Lô – Vỉa Hè  – Mặt Tiền Siêu Khủng  - DT134M2,"-	Ngôi nhà có diện tích 134m2 ,vỉa hè , mặt tiền 11m và được thiết kế 4 tầng kiểu dáng cơ bản BTCT , gia chủ mua về vôi ve hoặc đập đi xây lại với thiết kế hiện đại thông sàn thang máy, vừa làm văn phòng hoặc làm nơi an sinh nghỉ dưỡng đều được .
-	Vị trí nằm tại khu phân lô đẹp nhất phố Huỳnh Thúc Kháng , cách rạp chiếu phim Quốc Gia , hồ Thành Công và ngập tràn tiện ích xung quanh , ….
-	Thửa đất vuông vắn , k lỗi phong thủy sẵn sàng giao dịch ngay 
-	Giá : 45.5tỷ có thương lượng 
-	Liên hệ : e Đại 0 tám sáu 2221386 để được tư vấn và hỗ trợ","45,5 tỷ",134 m2,"Phố Huỳnh Thúc Kháng, Phường Láng Thượng, Quận Đống Đa, Hà Nội",13462139,_,---,Cần bán,25m,---,"Đất thổ cư, đất ở",Sổ hồng/ Sổ đỏ,---,11m,4,---,12m,4,---
https://alonhadat.com.vn/ban-nha-pho-tran-quang-dieu-dong-da-60m2-phan-lo-gara-view-ho-ve-o-ngay-gia-17-5ty-13466884.html,Bán nhà phố Trần Quang Diệu Đống Đa 60m2 – Phân Lô – Gara - View Hồ về ở ngay. Giá 17.5tỷ,"-	Vị trí nằm tại khu phân lô Trần Quang Diệu , cách công viên , hồ Hoàng Cầu , chợ , trụ sở giao dịch ,… mấy bước chân 
-	Là nơi an sinh của rất nhiều quan chức cấp cao lên việc an ninh cực kì tốt 
-	Đường trước nhà ô tô tránh đỗ , ngõ rộng thênh thanh thông mọi cung đường 
-	Nhà thiết kế 5 tầng – diện tích 60m2 – mặt tiền 6m được TKHĐ gia chủ dọn về có thể ở đc luôn 
-	Tầng 1 : bếp + gara + wc
-	Tầng 2 : khách + ngủ + wc
-	Tầng 3,4 : mỗi tầng 2 ngủ + wc
-	Tầng 5 : phòng thờ + sân phơi 
-	Thửa đấy vuông đẹp , k lỗi phong thủy sẵn sàng giao dịch 
-	Giá : 17.tỷ có thương lượng 
-	Liên hệ : e Đại 0 tám sáu 2221386 để được tư vấn và hỗ trợ","17,5 tỷ",60 m2,"Phố Trần Quang Diệu, Phường Quang Trung, Quận Đống Đa, Hà Nội",13466884,_,True,Cần bán,10m,True,Nhà trong hẻm,Sổ hồng/ Sổ đỏ,True,5m,5,True,10m,5,---
