url,title,description,price,area,address,Mã tin,Hướng,Phòng ăn,Loại tin,Đường trước nhà,Nhà bếp,Loại BDS,Pháp lý,Sân thượng,Chiều ngang,Số lầu,Chổ để xe hơi,Chiều dài,Số phòng ngủ,Chính chủ,Thuộc dự án
https://alonhadat.com.vn/trung-tam-dong-da-5-tang-long-lay-cach-o-to-tranh-may-buoc-chan-12046662.html,TRUNG TÂM ĐỐNG ĐA - 5 TẦNG LỘNG LẪY - CÁCH Ô TÔ TRÁNH MẤY BƯỚC CHÂN,"Vị trí căn nhà cách ô tô tránh 20m, ngõ ngắn, thẳng tắp, khu vực trung tâm, đi lại vô cùng thuận tiện.
- Nhà 5 tầng còn đẹp, thiết kế mỗi tầng 1 phòng, cầu thang cuối.

- Sổ riêng, nở hậu chút xíu cực đẹp.","3,1 tỷ",21 m2,"Phố Pháo Đài Láng, Phường Láng Thượng, Quận Đống Đa, Hà Nội",12046662,_,True,Cần bán,3m,True,Nhà trong hẻm,Sổ hồng/ Sổ đỏ,True,7m,5,---,"3,1m",3,---,
https://alonhadat.com.vn/nha-tan-khai-tuong-lai-mat-pho-lon-245m2-mat-tien-11m-gia-32-5-ty-12281605.html,"Nhà Tân Khai, tương lai mặt phố lớn, 245m2, mặt tiền 11m, giá 32.5 tỷ","Bán nhà Tân Khai, quận Hoàng Mai, sổ đỏ chính chủ, 245m2, mặt tiền 11m, sổ vuông đẹp, giá 32.5 tỷ.
- Nhà hiện nằm trong ngõ rộng rãi, thoáng sáng, ô tô có thể vào nhà. Sau quy hoạch mở tuyến đường Vĩnh Tuy - Yên Duyên, nhà sẽ ra mặt phố lớn, giá trị tăng lên gấp nhiều lần.
- Nhà gần KĐT Times City với đầy đủ tiện ích cao cấp, trường mầm non, cấp 1, cấp 2 Vĩnh Tuy, chợ đêm Lĩnh Nam, chợ đầu mối phía Nam, xung quanh đầy đủ tiện ích, đáp ứng tốt nhu cầu an sinh.
- Nhà xây 4 tầng chắc chắn, có sân rộng để xe, thiết kế hợp lý và đầy đủ công năng.
  + Tầng 1: phòng khách, WC, 1 phòng ngủ.
  + Tầng 2: 1 phòng ngủ Master khép kín, 2 phòng ngủ nhỏ và 1 WC ngoài.
  + Tầng 3: bếp & phòng ăn, WC, 1 phòng ngủ, phòng thờ, sân phơi.
  + Tầng 4: kho để đồ.
- Sổ đỏ chính chủ, vuông đẹp, pháp lý rõ ràng, sẵn sàng giao dịch.
Giá bán: 32,5 tỷ (có thương lượng cho khách mua có thiện chí).","32,5 tỷ",245 m2,"Đường Tân Khai, Phường Vĩnh Hưng, Quận Hoàng Mai, Hà Nội",12281605,_,True,Cần bán,5m,True,Nhà trong hẻm,Sổ hồng/ Sổ đỏ,True,11m,4,True,---,5,---,
https://alonhadat.com.vn/nha-mat-pho-le-gia-dinh-kinh-doanh-phu-tung-o-to-40m2-mt-4m-gia-12-3-ty-13353831.html,"Nhà mặt phố Lê Gia Định kinh doanh phụ tùng ô tô, 40m2, MT 4m, giá 12.3 tỷ","Bán nhà mặt phố Lê Gia Định, sổ đỏ chính chủ, kinh doanh tốt, 40m2, mặt tiền 4m, giá 12.3 tỷ.
- Nhà mặt phố Lê Gia Định (Lê Gia Đỉnh) - phố chuyên kinh doanh phụ tùng ô tô, thuộc khu Chợ Trời kinh doanh sầm uất.
- Nhà gần hồ Hai Bà Trưng, trường Mầm Non Việt - Bun, Tiểu học Trưng Trắc, THCS Trưng Nhị, THPT Trần Nhân Tông, UBND phường Đồng Nhân. Giao thông thuận lợi đi tới các phố lớn như Trần Khát Chân, Phố Huế, sang địa phận quận Hoàn Kiếm vô cùng dễ dàng.
- Nhà xây 4 tầng, các tầng đều thông sàn rộng rãi, đầy đủ công năng sử dụng.
- Sổ đỏ chính chủ, pháp lý rõ ràng, sẵn sàng giao dịch.
Giá bán: 12,3 tỷ (có thương lượng cho khách mua có thiện chí).","12,3 tỷ",40 m2,"Phố Lê Gia Định, Phường Đồng Nhân, Quận Hai Bà Trưng, Hà Nội",13353831,_,---,Cần bán,8m,---,Nhà mặt tiền,Sổ hồng/ Sổ đỏ,---,4m,4,---,---,3,---,
https://alonhadat.com.vn/ban-chung-cu-cao-cap-n04-udic-hoang-dao-thuy-130m2-gia-6-2-ty-13103854.html,"Bán chung cư Cao Cấp N04 UDic Hoàng Đạo Thúy 130m2, Giá 5.4 tỷ","CHUNG CƯ CAO CẤP - PHONG CÁCH CHÂU ÂU

+ Vị trí : Chung cư UDic nằm trong khu đô thị đông nam đường Trần Duy Hưng, toạ lạc ở đường Hoàng Đạo Thuý, 1 trong những khu đô thị mới hiện đại, cơ sở hạ tầng hiện đại, quy hoạch đồng bộ đầy đủ công trình công cộng.
+ Nhà mình bán thuộc toà B, tầng cao với thiết kế ban đâù 3 phòng ngủ, tuy nhiên do nhu cầu sử dụng nên chủ đã sửa lại thành 2 ngủ
Sổ đỏ lâu dài, sẵn sàng giao dịch","5,4 tỷ",130 m2,"Đường Hoàng Đạo Thúy, Phường Trung Hòa, Quận Cầu Giấy, Hà Nội",13103854,_,---,Cần bán,20m,---,Căn hộ chung cư,Sổ hồng/ Sổ đỏ,---,12m,20,---,11m,3,---,Căn hộ chung cư N04 Hoàng Đạo Thúy (xem chi tiết dự án)
https://alonhadat.com.vn/can-ban-nha-mat-pho-tran-quoc-hoan-kinh-doanh-cau-giay-dt-110m2x2-mt-10m-gia-28-ty-5577636.html,"Bán nhà mặt phố Trần Quốc Hoàn, Kinh Doanh, Cầu Giấy diện tích 200 m2, MT 11m. Giá 71 tỷ","+ Hướng: Bắc và Nam.
+ MỘT MẶT PHỐ - MỘT MẶT NGÕ - KINH DOANH ĐẲNG CẤP. 
+ Nhà tọa lạc giữa phố Trần Quốc Hoàn kinh doanh sầm uất ngày đêm. Ngõ sau nhà ô tô tránh.
+ Nhà 2 tầng với mặt tiền 11m, lô góc 3 mặt thoáng, chủ xác định bán đất, khách mua đầu tư xây 10 tầng thang máy thì không có gì để nói.
+ Chủ nhà bán đi đầu tư hạng mục khác. Hiện nhà chủ đang cho thuê kinh doanh.
+ Thửa đất vuông vắn, pháp lý minh bạch.
+  Liên hệ: Mr. Dương. ( Chuyên nghiệp, Đẳng cấp)
+ Chuyên bán nhà mặt phố, nhà đẹp, pháp lý chuẩn rõ ràng, khách tin cậy tuyệt đối.
+ Sống chính nhân quân tử - giúp khách mua được nhà là Niềm vui. (Zalo, Viber)",71 tỷ,200 m2,"Phố Trần Quốc Hoàn, Phường Dịch Vọng Hậu, Quận Cầu Giấy, Hà Nội",5577636,Bắc,---,Cần bán,35m,---,"Đất thổ cư, đất ở",Sổ hồng/ Sổ đỏ,---,11m,2,---,18m,2,---,
https://alonhadat.com.vn/ban-dat-dien-tich-445m2-mat-tien-16m-mat-pho-lac-long-quan-tay-ho-11538617.html,"Bán đất diện tích 445m2 mặt tiền 22m mặt phố Lạc Long Quân, Tây Hồ","Bán đất thổ cư sổ đỏ chính chủ nằm trên mặt phố kinh doanh thương mại đông đúc.
Lô đất nằm trên mặt phố Lạc Long Quân, Tây Hồ, Hà Nội.
Diện tích 445m2 mặt tiền 22m hướng Đông Nam.
Lô đất vuông vắn và mặt tiền rộng cho nên rất đẹp.
Khu vực đông dân cư và nhiều người qua lại, vì vậy rất thuận lợi cho ai mua đầu tư xây toà nhà cao tầng kinh doanh về thương mại.
Khu an ninh tốt, dân trí cao, giao thông thuận lợi.
Giá bán 150 tỷ.",150 tỷ,445 m2,"Đường Lạc Long Quân, Phường Bưởi, Quận Tây Hồ, Hà Nội",11538617,_,---,Cần bán,25m,---,"Đất thổ cư, đất ở",Sổ hồng/ Sổ đỏ,---,20m,---,---,22m,---,---,
https://alonhadat.com.vn/ban-can-shophouse-starcity-center-119-duong-tran-duy-hung-90m1-mt12m-gia-16-8-ty-12333362.html,"Bán căn Shophouse Starcity Center 119 Đường Trần Duy Hưng 90m2, MT12m, Giá 16.8 tỷ","Mô tả:
- Vị trí đẹp, đắc địa. Khu vực tập trung đông khối VP cơ quan, chung cư, nhà hàng khách sạn. KD đông sầm uất.
- Shophouse tầng 1, có gác lửng, Mặt tiền rộng 12m, view bể bơi, sân sau của shop rộng 15m.
Phía sau mình là trường mầm non Cầu Giấy 4 tầng, vậy là căn này sát hông 2 trường học to.
- Nhiều ng muốn thuê KD nhưng chủ chưa cho thuê. Nếu hết tháng 12 ko bán đc chủ nhà sẽ cho thuê tầm 60tr/th.
- Sổ đỏ ply đầy đủ, sẵn giao dịch.
- Chủ cần tiền đóng tiền cho con du học, nên rất thiện chí.
+ Liên hệ ngay: Mr Vượng xem nhà ngay. Miễn phí 100% toàn bộ dịch vụ. Khách gặp trực tiếp chủ nhà để thương lượng giá cả. Hỗ trợ tư vấn tài chính pháp lý - hoàn thiện sổ đỏ.
Tôi Phạm Tiến Vượng chuyên nhà mặt phố - quản lý rất nhiều căn nhà mặt phố, khách sạn, biệt thự với giá cả hợp lý, có tính thanh khoản cao. Tôi rất hi vọng sẽ tạo ra giá trị cho quý vị.","16,6 tỷ",90 m2,"Đường Trần Duy Hưng, Phường Trung Hòa, Quận Cầu Giấy, Hà Nội",12333362,_,---,Cần bán,20m,---,Nhà mặt tiền,Sổ hồng/ Sổ đỏ,---,12m,1,---,"7,5m",1,---,Căn hộ chung cư Eurowindow Multi Complex (xem chi tiết dự án)
https://alonhadat.com.vn/nha-minh-khai-o-to-tranh-thoang-sau-121m2-mat-tien-6-5m-gia-11-ty-11385867.html,"Nhà Minh Khai, ô tô tránh, thoáng sau, 121m2, mặt tiền 6.5m, giá 11 tỷ","Bán nhà Minh Khai, sổ đỏ chính chủ, 121m2, mặt tiền 6.5m, giá 11 tỷ.
- Nhà thoáng trước và sau - phía trước là đường ô tô tránh, phía sau là ngõ ba gác. Đường trước nhà thông nhiều nơi, đi lại thuận tiện, xung quanh đầy đủ tiện ích.
- Nhà xây thấp tầng, có 4 phòng ngủ, chủ xác định bán đất tặng nhà, phù hợp xây mới.
- Sổ đỏ chính chủ, pháp lý rõ ràng, sẵn sàng giao dịch.
Giá bán: 11 tỷ (có thương lượng cho khách mua có thiện chí).",11 tỷ,121 m2,"Đường Minh Khai, Phường Minh Khai, Quận Hai Bà Trưng, Hà Nội",11385867,_,---,Cần bán,6m,---,Nhà trong hẻm,Sổ hồng/ Sổ đỏ,---,"6,5m",2,---,---,4,---,
https://alonhadat.com.vn/nha-luong-khanh-thien-o-to-do-cua-75m2-x-5-tang-6-phong-khep-kin-9-2-ty-11332108.html,"Nhà Lương Khánh Thiện, ô tô đỗ cửa, 75m2 x 5 tầng, 6 phòng khép kín, 9.2 tỷ","Bán nhà Lương Khánh Thiện, sổ đỏ chính chủ, 75m2 x 5 tầng mới, mặt tiền 4.5m, 6 phòng khép kín, giá 9.2 tỷ.
- Nhà ngõ 12 Lương Khánh Thiện, đường trước nhà thông nhiều nơi, ô tô có thể đỗ cửa, môi trường an sinh yên tĩnh, dân trí cao.
- Nhà gần trường tiểu học Tân Mai, THCS Tân Mai, chợ đầu mối phía Nam, KĐT Đền Lừ, Louis City Hoàng Mai.
- Nhà xây 5 tầng mới, thiết kế mỗi tầng gồm 2 phòng - tổng có 6 phòng khép kín, có thể cho thuê căn hộ dịch vụ.
- Sổ đỏ chính chủ, pháp lý rõ ràng, sẵn sàng giao dịch.
Giá bán: 9,2 tỷ (có thương lượng cho khách mua có thiện chí).","9,2 tỷ",75 m2,"Đường Lương Khánh Thiện, Phường Tương Mai, Quận Hoàng Mai, Hà Nội",11332108,_,---,Cần bán,5m,---,Nhà trong hẻm,Sổ hồng/ Sổ đỏ,---,"4,5m",5,---,---,6,---,
https://alonhadat.com.vn/mat-pho-via-he-rong-o-to-2-chieu-dung-do-kinh-doanh-khach-san-cho-tay-thue-chuyen-v-7099203.html,"Bán nhà mặt Phố Yên Ninh, kinh doanh, Ba Đình, DT: 160m2 x MT 8m, Giá 46 tỷ","Mô tả:
+ Vị trí nhà rất đẹp gần ngã tư Yên Ninh - Nguyễn Trường Tộ, vỉa hè rất rộng. Ô tô 2 chiều dừng đỗ. Kinh doanh cực tốt.
+ Nhà 2 tầng cũ chủ để không không ở, nhà cũ chủ xác đinh bán ĐẤT, khách xác định mua ĐẤT về đập đi xây 1 toà nhà 9 tầng kinh doanh khách sạn cho TÂY thuê quá tốt hoặc xây theo kiểu phòng homestay cho TÂY thuê quá giá trị tiềm năng lớn.
+ Khách xem vị trí thích tìm hiểu kỹ về nhà, đã thật sự thích ôm tiền gặp chủ để đàm phán đặt cọc vì chủ rất bận không thể tiếp khách nhiều được.
+ Sổ đỏ chính chủ vuông vắn chủ để trong két sắt. Pháp lý cực sạch.
+ Chủ rất thiện chí bán nhanh để chia tài sản, rất cần bán gấp rất hợp tác với Môi giới.
+ Liên hệ: Nguyễn Hùng Anh 
- Chuyên nhận ký gửi và Môi giới nhà Mặt phố, Khách sạn, Biệt thự và Tòa nhà.
+ Khách đi xem nhà không phải trả phí 
– Gặp trực tiếp chủ nhà để thương lượng giá cả.
+ Cam kết hình ảnh và thông số chính xác 100%",46 tỷ,160 m2,"Phố Yên Ninh, Phường Trúc Bạch, Quận Ba Đình, Hà Nội",7099203,_,---,Cần bán,15m,---,Nhà mặt tiền,Sổ hồng/ Sổ đỏ,---,8m,2,---,20m,4,---,
https://alonhadat.com.vn/ban-nha-pho-hang-duong-144m2x5-tang-86-ty-vi-tri-dep-sam-uat-kinh-doanh-dinh-cao-7054091.html,"Bán nhà phố Hàng Đường 144m2 x 5 tầng, 86 tỷ. Vị trí đẹp, sầm uất, kinh doanh đỉnh cao","Vị trí hot nhất mặt Phố Cổ - nằm giữa và gần 2 ngã tư - ba bước tới chợ Đồng Xuân - kinh doanh khỏi bàn.
Bán nhà phố Hàng Đường diện tích 144m2, xây 5 tầng, mặt tiền 7.05m, giá 86 tỷ.
+ Tầng 1 đang cho thuê phía ngoài để kinh doanh, có lối đi riêng vào nhà, phía mặt đường 3 tầng, giật cấp phía trong là 5 tầng.
+ Đất nở hậu, khoảng giữa có sân và giếng trời cực sáng thoáng.
+ Nhà có 2 sổ nhưng một hộ đứng tên, sổ chính chủ.
+ Miễn môi giới trung gian. Liên hệ Hùng Anh.",86 tỷ,145 m2,"Phố Hàng Đường, Phường Hàng Đào, Quận Hoàn Kiếm, Hà Nội",7054091,_,---,Cần bán,15m,---,Nhà mặt tiền,Sổ hồng/ Sổ đỏ,---,7m,5,---,21m,8,---,
https://alonhadat.com.vn/can-ban-gap-nha-mat-pho-nghi-tam-kinh-doanh-tay-ho-dt-120m2x7-mt-10m-gia-27-ty--4359098.html,"Bán nhà Mặt Phố Nghi Tàm, Tây Hồ. DT: 245m2, 7 tầng, MT: 11m. Kinh Doanh KS, Giá: 75 tỷ.","+ NHÀ SIÊU CHẮC - BÊN HÔNG LÀ NGÕ - MẶT TIỀN LỚN - HÌNH THỬA ĐẸP - VỊ TRÍ ĐẮC ĐỊA.
+ Vị trí: Nhà mặt phố cực đẹp cách Đường Thanh Niên khoảng 200 mét. Nằm đoạn đẹp nhất phố Nghi Tàm không vướng cầu che khuất tầm nhìn, phía bên số lẻ giáp với Hồ Tây, di chuyển về phía Bờ Hồ rất thuận tiện.
+ Thiết kế: Nhà thừa điều kiện nên xây móng 20 tầng thoải mái, 3 mặt thoáng( bên hông là ngõ), hình thửa đẹp nở hậu chút. Chủ làm salon nên thiết kế thông sàn, có thang máy đưa ô tô lên tầng 2 di chuyển ầm ầm.
+ Sổ đỏ chính chủ, vuông vắn, pháp lý sạch.
+ Liên hệ: Lê Tiến thổ cư 
Chỉ tiếp ai thiện chí, có sẵn tài chính.
(Các bạn VP, MG. QC) miễn làm phiền, xin cảm ơn.",75 tỷ,245 m2,"Đường Nghi Tàm, Phường Quảng An, Quận Tây Hồ, Hà Nội",4359098,_,---,Cần bán,20m,---,Nhà mặt tiền,Sổ hồng/ Sổ đỏ,---,11m,7,---,23m,16,---,
https://alonhadat.com.vn/ban-khach-san-8-tang-mat-pho-ma-may-hoan-kiem-dt-89m2-mt-5-5m-gia-65-ty-6949809.html,"Bán khách sạn 8 tầng mặt phố Mã Mây, Hoàn Kiếm,  DT 100m2, MT 5.5m, Giá 67 tỷ","Bán khách sạn 8 tầng sổ đỏ chính chủ, nằm ở vị trung tâm thành Phố Hà Nội.
Khách sạn nằm trên mặt phố Mã Mây, Hoàn Kiếm, Hà Nội.
Khu phố có nhiều du khách du lịch người nước ngoài lưu trú để tham quan phố cổ và là dãy phố có nhiều nhà hàng và quán bar, khách sạn kinh doanh đông đúc, vì vậy rất thuận lợi cho ai đầu tư kinh doanh về khách sạn, nhà hàng.
Diện tích 100m2, mặt tiền 5.5m, vuông đẹp.
Tổng của khách sạn có 18 phòng, nội thất đầy đủ và sang trọng, hiện đại.
Khách sạn đã thiết kế hiện đại theo phong cách châu âu và rất đẹp.
Từ vị trí khách sạn đi bộ ra hồ Hoàn Kiếm khoảng 3 phút.
Khu an ninh tốt, dân trí cao, giao thông thuận tiện.
+ Liên hệ: Lê Tiến thổ cư:
- khách xem nhà miễn phí từ A đến Z.
- Khách gặp chủ nhà thương lượng giá cả. 
- Ưu tiên khách có nhu cầu thực và thật sự am hiểu thị trường.",67 tỷ,100 m2,"Phố Mã Mây, Phường Hàng Bạc, Quận Hoàn Kiếm, Hà Nội",6949809,_,---,Cần bán,20m,---,"Nhà hàng, khách sạn",Sổ hồng/ Sổ đỏ,---,"5,5m",8,---,19m,18,---,
https://alonhadat.com.vn/vi-tri-dep-mat-tien-lon-lo-goc-gia-tot-thong-tin-mo-ta-vi-tri-dep-nhat-pho-ngu-6025299.html,"Nhà mặt phố Quan Hoa, Cầu Giấy, DT 316m2, MT 15m, Kinh Doanh, chỉ 62 tỷ. Giá tốt","+ VỊ TRÍ ĐẸP - MẶT TIỀN LỚN - LÔ GÓC - GIÁ TỐT.
+ Nhà mặt phố Quan Hoa, Cầu Giấy, DT: 316m2, MT: 15m, Kinh Doanh, chỉ: 62 tỷ. Giá quá tốt.
Thông tin mô tả:
+ Vị trí: Đẹp nhất phố Quan Hoa, vỉa hè rộng lại không gần đình chùa quá tốt để kinh doanh mọi thứ.
+ Lô đất đẹp, mặt tiền đẹp, giá đẹp.
+ Mặt tiền lớn, vỉa hè rộng thoáng.
+ Thửa đất thích hợp cho mọi loại hình xây văn phòng, khách sạn, showroom.
+ Nhà chia thành hai khối, bên ngoài đang cho thuê, bên trong gia chủ ở, nhà với 4 phòng ngủ.
+ Chủ thiện chí, cần bán gấp để chia tài sản.
+ Hỗ trợ khách xin GPXD nếu khách có nhu cầu.
Nguyễn Quang - Thổ cư: Chuyên nhà mặt phố - tư vấn tận tâm, chuyên nghiệp. Hân hạnh gia tăng giá trị đến bạn.
Hãy gọi cho chúng tôi 24/7 để được tư vấn chuyên sâu, hỗ trợ pháp lý, nắm bắt thông tin, hoàn toàn miễn phí.
Chúc quý khách phát tài phát lộc, mua nhà như ý.",62 tỷ,316 m2,"Phố Quan Hoa, Phường Quan Hoa, Quận Cầu Giấy, Hà Nội",6025299,_,---,Cần bán,20m,---,Nhà mặt tiền,Sổ hồng/ Sổ đỏ,---,15m,3,---,21m,4,---,
https://alonhadat.com.vn/ban-nha-mat-duong-my-dinh-kinh-doanh-nam-tu-liem-140m2-mt-7m-gia-22-ty--7088060.html,"Bán nhà mặt Đường Mỹ Đình, Kinh Doanh, Nam Từ Liêm, 140m2, MT 7m, Giá 22 tỷ.","VỊ TRÍ CỰC ĐỈNH – PHỐ VÍP -  MẶT TIỀN RỘNG - SỔ VUÔNG.
MẶT PHỐ LỚN - VỈA HÈ - KINH DOANH SẦM UẤT - MẶT TIỀN ĐẸP 
+ Khu vực trung tâm, gần các trường Đại học lớn, 3 bước ra bến xe Mỹ Đình về các tỉnh, gần rất nhiều tòa nhà cao tầng, tiện ích đầy đủ.
+ Nhà 3 tầng, mỗi tầng 2 phòng. Nhà cũ xác định bán đất. Chủ mới thích đập đi xây 7 tầng kinh doanh gì cũng hái ra tiền.
+ Sổ đỏ 138.7m2, vuông vắn, chính chủ. Sẵn sàng giao dịch. GIÁ CHÀO RA LỘC.
- Nguyễn Quang - Thổ cư: Chuyên nhà mặt phố - tư vấn tận tâm, chuyên nghiệp.
- Hân hạnh gia tăng giá trị đến bạn.
- Hãy gọi cho tôi 24/7 để được tư vấn chuyên sâu, hỗ trợ pháp lý, nắm bắt thông tin, hoàn toàn miễn phí.
- Chúc quý khách phát tài phát lộc, mua nhà như ý.",22 tỷ,135 m2,"Đường Mỹ Đình, Phường Mỹ Đình 1, Quận Nam Từ Liêm, Hà Nội",7088060,_,---,Cần bán,15m,---,"Đất thổ cư, đất ở",Sổ hồng/ Sổ đỏ,---,7m,2,---,20m,4,---,
https://alonhadat.com.vn/vi-tri-vang-mat-pho-trang-tien-200m2-mat-tien-8-4m-gia-175-ty-7823992.html,"Vị trí vàng mặt phố Tràng Tiền 200m2, mặt tiền 8.4m, giá 175 tỷ","Vị trí đắc địa - mặt phố Tràng Tiền, Hoàn Kiếm - 200m2 - 8.4m mặt tiền - 03 tầng - 175 tỷ.

- Siêu phẩm Tràng Tiền - con phố vip nhất nhì Hoàn Kiếm - đầu tư đẳng cấp.

- Vị trí đất vàng, đắc địa bậc nhất phố cổ không cần bàn cãi.

- Đất sạch, 1 sổ. Thửa đất vuông đét.

- Đầu tư kinh doanh siêu đỉnh.

- Rất hiếm có, một căn duy nhất.

+ Liên hệ: Mạnh Hùng (Không tiếp MG)",175 tỷ,200 m2,"Phố Tràng Tiền, Phường Tràng Tiền, Quận Hoàn Kiếm, Hà Nội",7823992,_,---,Cần bán,20m,---,Nhà mặt tiền,Sổ hồng/ Sổ đỏ,---,"8,4m",3,---,24m,5,---,
https://alonhadat.com.vn/ban-toa-nha-9-tang-mat-pho-le-duc-tho-my-dinh-dien-tich-125m-mt-8-5m-gia-32-9-ty-11707573.html,"Bán tòa nhà 9 tầng mặt phố Lê Đức Thọ Mỹ Đình, Diện tích 125m, MT 8,5m, Giá 34.9 tỷ","+ Diện tích 125m2 x 9 tầng - mặt tiền 8.5m - giá 34,9 tỷ.
+ Kinh doanh, hầm gara, đường 3 ôtô tải tránh, gara, thang máy. 
+ Toà văn phòng gồm 9 tầng thoáng trước sau các tầng thiết kế thông sàn và hầm gửi xe - trước nhà đường 3 ôtô tránh đỗ thoải mái - xung quanh toàn công ty, khách sạn - kinh doanh mọi hình thức.
Mô tả:
+ Nhà 9 tầng văn phòng thông sàn cầu thang cuối, thang máy nhập khẩu cả tầng hầm để xe.
+ Nhà ổn định ko quy hoạch, khách kiểm tra càng thấy được giá trị tòa văn phòng.
+ Cách mặt Lê Đức Thọ, rất gần. Cách sân vận động quốc gia Mỹ Đình 400m, bến xe Mỹ Đình 600m, đi đâu cũng tiện
+ Sổ đỏ chính chủ, sổ đang nằm két 
Thông số chuẩn 100%.
+ Giá trên có thương lượng
+ Liên hệ: Mạnh Hùng (Không tiếp MG)","34,9 tỷ",125 m2,"Đường Lê Đức Thọ, Phường Mỹ Đình 2, Quận Nam Từ Liêm, Hà Nội",11707573,_,---,Cần bán,20m,---,Văn phòng,Sổ hồng/ Sổ đỏ,---,"8,5m",9,---,"14,5m",8,---,
https://alonhadat.com.vn/ban-lo-dat-kcn-nam-thang-long-mat-duong-hqv-keo-dai-7000m2-mt-100m-gia-120-ty-12485221.html,"Bán lô đất KCN Nam Thăng Long, Mặt Đường HQV kéo dài 7000m2, MT 100m, Giá 120 tỷ","Khu đất cực đẹp nằm trong khu đô thị Nam Thăng Long- Bắc Từ Liêm. Cách cầu chèm 1.5km. 
- Nằm tại mặt đường Hoàng Quốc Việt Kéo Dài rộng 70m. Hiện tại đường trước nhà 4 làn Container
- Hiện chủ đang cho thuê 4000m giá 5.5usd/m/tháng. 
- 2500m còn lại chủ làm xưởng sản xuất. 
- Đất nộp thuế 1 lần, đã có sổ riêng. Thế chấp bank vay mượn bình thường. 
- Sổ 50 năm, chủ đã sử dụng gần 20 còn hơn 30 năm. Khi hết hạn 50 năm đất có tính kế thừa. 
- Theo quy hoạch Bắc Từ Liêm, khu đất nằm trong khu quy hoạch đất hỗn hợp. Có thể làm xưởng sản xuất, khách sạn...
+ Liên hệ: Nguyễn Đức, miễn phí hoàn toàn phí giao dịch, trực tiếp thương lượng giá cả với chủ nhà.
- Hỗ trợ khách hàng hết mình, về pháp lý, sang tên, công chứng, thiết kế, xây dựng, phong thủy.",120 tỷ,700 m2,"Đường Hoàng Quốc Việt, Phường Thụy Phương, Quận Bắc Từ Liêm, Hà Nội",12485221,_,---,Cần bán,20m,---,"Kho, xưởng",Sổ hồng/ Sổ đỏ,---,80m,---,---,90m,---,---,
https://alonhadat.com.vn/ban-toa-nha-van-phong-mat-pho-hai-ba-trung-dt-600m2-14-tang-noi-5-tang-ham-12798415.html,Bán Tòa Nhà Văn Phòng Mặt Phố Hai Bà Trưng DT 600m2 *14 Tầng Nổi + 3 Tầng Hầm,"- Tọa lạc tại Vị trí đắc địa, ngay ngã tư Hai Bà Trưng. Từ vị trí tòa nhà, kết nối nhanh chóng tới các quận trung tâm lân cận thông qua các trục đường chính: Quang Trung, Hai Bà Trưng, Lý Thường Kiệt, Bà Triệu.
- Với lợi thế 2 mặt tiền và Chỉ với thời gian là 5 phút đi bộ tới Hồ Gươm, 10 phút đi đến ga Hà Nội, là 1 vị trí đắc địa nằm tại trung tâm trong lòng TP Hà Nội, khu vực xung quanh là các tòa nhà văn phòng đẳng cấp và chuyên nghiệp.
- Gần các trụ sở hành chính quan trọng của thủ đô như: Viện Kiểm Sát Nhân Dân Tối Cao, Viện Kiểm nghiệm Thuốc Trung ương, Thư Viện Quốc Gia Việt Nam, Bộ Công Thương, Bệnh viện Việt Nam Cuba…
+ Là tòa nhà văn phòng hạng B có thiết kế hiện đại, gồm 14 tầng nổi và 3 tầng hầm. Diện tích tổng thể 600m2. Diện tích sàn văn phòng cho thuê mỗi tầng là 550 m2. Trang thiết bị hiện đại và đồng bộ.
+ Nội thất bên trong tòa nhà gồm có: Thang máy, điều hòa, máy phát điện, phòng cháy chữa cháy, hệ thống an ninh bảo vệ 24/24.
+ Hệ thống thang máy: 03 thang máy tốc độ cao.
+ Điều hòa: Điều hòa trung tâm Hitachi VRV.
+ Máy phát điện: Có máy điện dự phòng, đáp ứng 100% công suất. 
+ Phòng cháy chữa cháy theo tiêu chuẩn.
+ Liên hệ: Mr Đức để gặp chính chủ ( Các bạn MG tránh làm phiền)",500 tỷ,600 m2,"Phố Hai Bà Trưng, Phường Tràng Tiền, Quận Hoàn Kiếm, Hà Nội",12798415,_,---,Cần bán,25m,---,Văn phòng,Sổ hồng/ Sổ đỏ,---,20m,19,---,30m,5,---,
https://alonhadat.com.vn/ban-nha-10-tang-mat-pho-hang-gai-150m2-mt-9m-gia-115-ty-7825490.html,"Bán nhà 10 tầng mặt phố Hàng Gai 150m2, mt 9m, giá 115 tỷ","Cần bán nhanh nhà mới xây 10 tầng mặt phố Hàng Gai, quận Hoàn Kiếm gần Hồ Cụ Rùa.
Diện tích sổ đỏ 150m2, tổng DTSD 1400m2. Có 36 phòng cho thuê kinh doanh khách sạn.
Nhà mới xây, đồ đạc nội thất đầy đủ, giá thuê thu nhập bình quân trên dưới 1 tỷ.
Trước có khách trả 135 tỷ không bán, giờ cần tiền gấp nên chủ nhà cần bán giá hấp dẫn nhất thị trường 115 tỷ.
Sổ đỏ chính chủ, pháp lý rõ ràng, giấy phép xây dựng đầy đủ.

* Thông tin là quan trọng, khách hàng có nhu cầu thực hãy gọi cho Mr Tuấn. 
* Nội dung và hình ảnh là có thật.
* Miễn phí dịch vụ. Khách và Chủ tự thương lượng giá cả, Hỗ trợ 24/7 về pháp lý, quy hoạch, đàm phán.
* Hy vọng sẽ tạo ra giá trị cho bạn.",115 tỷ,150 m2,"Phố Hàng Gai, Phường Hàng Gai, Quận Hoàn Kiếm, Hà Nội",7825490,_,---,Cần bán,25m,---,"Nhà hàng, khách sạn",Sổ hồng/ Sổ đỏ,---,8m,10,---,19m,36,---,
