url,title,description,price,area,address,Mã tin,Hướng,Phòng ăn,Loại tin,Đường trước nhà,Nhà bếp,Loại BDS,Pháp lý,Sân thượng,Chiều ngang,Số lầu,Chổ để xe hơi,Chiều dài,Số phòng ngủ,Chính chủ
https://alonhadat.com.vn/ban-nha-phu-dien-cau-dien-80m2-mt-gan-8m-o-hoac-chia-2-lo-xay-ccmn-het-y-gia-hon-3-ty-13223563.html,"Bán nhà Phú Diễn, Cầu Diễn 80m2, Mt gần 8m, ở hoạc chia 2 lô, xây ccmn hết ý, giá hơn 3 tỷ","BÁN NHÀ PHÚ DIỄN  DT 80M2,  MẶT TIỀN GẦN 8 CHIA 2 LÔ HOẶC XÂY CCMN CHO THUÊ HẾT Ý . 
+ Chủ nhà người quen tin tưởng gửi bán căn nhà tâm huyết nhiều năm cả gia đình ở để chuyển ra mặt phố cho tiện công việc kinh doanh .Hiện trạng nhà gần 80m2 đầy đủ công năng  với 4 phòng ngủ  + Khu vực phát triển cực mạnh, giao thông thuận tiện, gần chợ, trường mầm non, trường học các cấp 1,2. trường ĐH Tài Nguyên và Môi Trường
+ Giao thông Cầu Diễn, Phúc Diễn, Hoàng Công Chất, Hồ Tùng Mậu, Mai Dịch, Lê Đức Thọ, Hàm Nghi, Nguyễn Hoàng, Mỹ Đình, Xuân Thủy, Cầu Giấy.
+ Xung quanh hàng xóm thân thiên vui vẻ, môi trường sống xanh, sạch đẹp, an ninh tốt..

+ Sổ đỏ chính chủ, vuông đẹp 
+ Gía chỉ 3.x tỷ nhỏ (  vẫn còn thương lượng )
 Anh/Chị Liên Hệ Em Trường để biết thêm thông tin chi tiết và xem nhà  miễn phí. (Em Trường chuyên bán nhà Phú Diễn, Cầu Diễn, Hồ Tùng Mậu).","3,4 tỷ",80 m2,"Đường Phú Diễn, Phường Phú Diễn, Quận Bắc Từ Liêm, Hà Nội",13223563,_,---,Cần bán,3m,---,Nhà trong hẻm,Sổ hồng/ Sổ đỏ,---,---,3,---,---,4,---
https://alonhadat.com.vn/ban-nha-xuan-phuong-35m2-x-5t-thiet-ke-hien-dai-gia-hiem-trong-khu-vuc-gia-3-x-ty-nho--13216518.html,"Bán nhà Xuân Phương 35m2 x 5T, thiết kế hiện đại, giá hiếm trong khu vực, giá 3.x tỷ nhỏ.","-SIÊU PHẨM BÁN NHÀ XUÂN PHƯƠNG 35M2X5T , NHÀ MỚI ĐẸP - VÀI MÉT RA PHỐ - GẦN Ô TÔ - NGÕ THÔNG - CHỦ ĐỂ LẠI HẾT NỘI THẤT.
+ Chính chủ tin tưởng gửi bán căn nhà Xuân Phương,trong tháng. Giá chốt bất ngờ. Nhà cực hiếm về vị trí và thông số. Ngõ  rất nông, gần đường ô tô và ô tô tránh.
+ Xung quanh nhà mình tiện ích bạt ngàn : siêu thị mini, chợ dân sinh, trường mầm non, C1,2,3 chi cách 500 - 700m đổ lại.
+ Nhà thiết kế 5T đẹp khung cột bê tông cốt thép chắc chắn.Thiết kế hiện đại, nội thất xin xò

+ Sổ đỏ đẹp, sẵn giao dịch nhanh. 
+ Giá chỉ 3,X tỷ (x sơ sinh ) Vẫn còn thương lượng.
Anh/Chị Lh E Trường để biết thêm thông tin chi tiết và xem nhà miễn phí.","3,15 tỷ",35 m2,"Đường Xuân Phương, Phường Xuân Phương, Quận Nam Từ Liêm, Hà Nội",13216518,_,True,Cần bán,3m,True,Nhà trong hẻm,Sổ hồng/ Sổ đỏ,True,---,5,---,---,4,---
https://alonhadat.com.vn/ban-nha-ho-tung-mau-mai-dich-35m2-x5t-ngo-nong-gan-pho-nha-dan-xay-kcbt-gia-3-6-ty-12915288.html,"Bán nhà Hồ Tùng Mậu, Mai Dịch 35m2 x5T , ngõ nông gần phố, nhà dân xây KCBT .Gía 3.6 tỷ","+ Vị trí trung tâm nằm đầu phố Hồ Tùng Mậu, khu vực tập trung nhiều trường Đại Học lớn như ĐHQG Hà Nội , Đh Ngoại Ngữ, ĐH Sư Phạm, ĐH Thương Mại, HV Múa, Du Lịch, Sân Khấu Điện Ảnh.... bệnh viện 198, bến xe Mỹ Đình 
+ Thiết kế 5 tầng đầy đủ công năng 
- Tầng 1 : Phòng khách + bếp  + Wc
- Tầng 2,3,4 : Phòng ngủ rộng + Wc 
- Tầng 5 : Phòng thờ + sân phơi 

+ Sổ đỏ chính chủ, pháp lý chuẩn
+ Giá : 3.6  tỷ (có thương lượng).
+ Liên hệ: Mr Trường  ( Đi xem nhà thực tế - Nhanh chóng - Uy tín Hiệu quả).
* P/s: Hỗ trợ tìm nhà theo tiêu chí khách hàng.
Miễn trung gian, miễn môi giới, Hỗ trợ vay vốn Ngân hàng.","3,6 tỷ",35 m2,"Đường Hồ Tùng Mậu, Phường Mai Dịch, Quận Cầu Giấy, Hà Nội",12915288,_,True,Cần bán,"2,5m",True,Nhà trong hẻm,Sổ hồng/ Sổ đỏ,True,---,5,---,---,4,---
https://alonhadat.com.vn/ban-dat-trinh-van-bo-keo-dai-41m2-phan-lo-via-he-kinh-doanh-chi-1-lo-duy-nhat-hon-3-ty-13494287.html,"Bán đất Trịnh Văn Bô kéo dài 41m2 phân lô vỉa hè kinh doanh, chỉ 1 lô duy nhất hơn 3 tỷ","HIẾM ! Duy nhất chỉ có 1 lô  đất Trịnh Văn Bô kéo dài - 41m2 phân lô vỉa hè - kinh doanh - đường 2 xe tải tránh nhau - cam kết ko lỗi lầm - xem là kết

+ Chính chủ a Khiết người nhà gửi bán lô đất Trịnh Văn Bô, hàng cực hiếm.
+ Vị trí thì vô cùng đẹp sát khu đô thị , không khí trong lành, vỉa hè rộng đẳng cấp an sinh - xây nhà ở thì vô cùng tuyệt vời.

+ Sổ đỏ phân lô, vuông đẹp, không lỗi gì 
+ Liên hệ ngay E Trường để biết thông tin và đi xem đất thực tế ( chuyên nhà đất Trịnh Văn bộ- Hòe Thị - Phương Canh - Xuân Phương)","3,7 tỷ",41 m2,"Đường Trịnh Văn Bô, Phường Phương Canh, Quận Nam Từ Liêm, Hà Nội",13494287,_,---,Cần bán,10m,---,"Đất thổ cư, đất ở",Sổ hồng/ Sổ đỏ,---,---,---,---,---,---,---
https://alonhadat.com.vn/ban-dat-tdc-xuan-phuong-40m2-2-mat-duong-lon-via-he-rong-truoc-sau-2-xe-tai-tranh-nhau-13494308.html,"Bán đất TDC Xuân Phương 40m2 - 2 mặt đường lớn vỉa hè rộng trước sau, 2 xe tải tránh nhau","BÁN ĐẤT TĐC XUÂN PHƯƠNG 40M2 - MẶT TIỀN RỘNG HƠN 4M - ĐẤT 2 MẶT ĐƯỜNG LỚN ĐỀU CÓ VỈA HÈ RỘNG TRƯỚC SAU - 2 XE TẢI TRÁNH NHAU THOẢI MÁI . 

+ Chính chủ A Hải nhờ bán lô đất 2 mặt tiền lớn tại khu TĐC Xuân Phương - Nam Từ Liêm , duy nhất chỉ có 1 lô đẹp nhất khu vực 
+ Vị trí vô cùng thuận lợi hượng trọn tiện ích  Khu đô thị Foresa Xuân Phương ,  2 phút di chuyển lên trung tâm Mỹ Đình
+ Tiện ích xung quanh đầy đủ, gần trường chuẩn quốc gia cấp 1, cấp 2, cấp 3 Nam từ Liêm gần các trường ĐH - CĐ như: Fpt, Đông Á, ĐH Công Nghiệp HN, Bệnh Viện Hồng Ngọc...
+ Lô đất rất đẹp , khu vực xung quanh các tuyến đường lớn đang quy hoạc mở rộng rất nhiều phù hợp mua xây ở hoặc đầu tư cho tương lai

+Sổ đỏ phân lô, chính chủ  pháp lý chuẩn
+ Liên hệ ngay  E Trường để biết thông tin và xem đất thục tế ( chuyên nhà đất Nam từ Liêm - Trịnh Văn Bô- Phương Canh )","5,8 tỷ",40 m2,"Đường Trịnh Văn Bô, Phường Xuân Phương, Quận Nam Từ Liêm, Hà Nội",13494308,_,---,Cần bán,10m,---,"Đất thổ cư, đất ở",Sổ hồng/ Sổ đỏ,---,---,---,---,---,---,---
https://alonhadat.com.vn/tin-duoc-khong-ban-nha-phuong-canh-trinh-van-bo-5-tang-o-to-do-cong-gia-chi-hon-3-ty-13216744.html,"Tin được không- bán nhà Phương Canh, Trịnh Văn Bô 5 tầng ô tô đỗ cổng, giá chỉ hơn 3 tỷ","BÁN NHÀ PHƯƠNG CANH - TRỊNH VĂN BÔ , Ô TÔ ĐỖ CỔNG , GIÁ CHỈ HƠN 3 TỶ  CHÚT 
+  Chính chủ tin tưởng gửi bán căn nhà Phương Canh . Nhà cực hiếm về vị trí và thông số. ô tô đỗ ngay cổng.
+ Vị trí ngay sát  trường Tiểu Học và THCS Phương Canh, Trường Cao đẳng FPT,  ĐH Công nghiệp HN. Khu vực dân trí cao, dân cư hiền hòa, an ninh cực tốt
 Nhà còn như mới , thiết kế 5 tầng cực kỳ đẹp và hợp lí, phòng nào cũng thoáng sáng. Chủ nhà kinh doanh , hiền lành làm ăn có lộc  thiện chí bán. để chuyển ra mặt phố để tiện cho công việc.

+ Sổ đỏ chính chủ, pháp lý chuẩn 
+ Giá chỉ 3,X tỷ (x nhỏ nhỏ) Vẫn còn thương lượng.
+ Anh/Chị Lh E Trường để biết thêm thông tin chi tiết và xem nhà miễn phí.","3,28 tỷ",33 m2,"Đường Phương Canh, Phường Phương Canh, Quận Nam Từ Liêm, Hà Nội",13216744,_,---,Cần bán,5m,---,Nhà trong hẻm,Sổ hồng/ Sổ đỏ,---,---,5,---,---,4,---
https://alonhadat.com.vn/cc-ban-gap-dat-phuong-canh-trinh-van-bo-68m2-ngo-thong-kd-xe-tai-tranh-nhau-gia-5-3-ty-13164724.html,"CC bán gấp đất Phương Canh, Trịnh Văn Bô 68m2, ngõ thông KD, xe tải tránh nhau, giá 5.3 tỷ","+CẦN BÁN GẤP LÔ ĐẤT PHƯƠNG CANH, TRỊNH VĂN BÔ DT 68M2 , NGÕ THÔNG ĐƯỜNG RỘNG XE TẢI TRÁNH NHAU

+ Thửa đất hiếm còn sót lại khu Phương Canh mặt tiền cực đẹp  thông số vàng khách mua xây nhà ở hoặc CCMN quá đẹp.
+ Vị trí vô cùng đẹp cách mặt phố tầm 20m sau quy hoạch ra gần đường lớn . Khu vực giá đất tăng từng ngày, mua ở hoặc đầu tư cũng vô cùng hợp lý.

+ Sổ đỏ chính chủ, vuông đẹp.
+ Gía chào 5.3 tỷ (có thương lượng với khách thiện chí).
+ A/c quan tâm liên hệ: E Trường  (được tư vấn và xem thực tế).
* Chỉ tiếp khách hàng thực sự có nhu cầu, nghiêm túc. Chúc quý khách hàng sớm mua được nhà ưng ý.","5,3 tỷ",68 m2,"Đường Phương Canh, Phường Phương Canh, Quận Nam Từ Liêm, Hà Nội",13164724,_,---,Cần bán,8m,---,"Đất thổ cư, đất ở",Sổ hồng/ Sổ đỏ,---,---,---,---,---,---,---
https://alonhadat.com.vn/ban-dat-trinh-van-bo-60m2-x-mt-5m-via-he-rong-duong-2-xe-tai-tranh-gia-dau-tu-ngon-13501794.html,"Bán đất Trịnh Văn Bô, 60m2 x Mt 5m, vỉa hè rộng,  đường 2 xe tải tránh, giá đầu tư ngon","Bán đất Trịnh Văn Bô vỉa hè ô tô tránh - thông số vàng - 60m MT 5m xây dựng nhà ở hoặc cho thuê thì quá tuyệt vời.
+ Chính chủ cần bán mảnh đất Trịnh Văn Bô ""cực hiếm"". Thuộc Trịnh Văn Bô kéo dài.
+ Xung quanh là các khu đô thị HUD, đường Vành Đai 3.5, trường ĐH Công Nghệ Đông Á, CĐ FPT. Di chuyển thẳng tắp vài phút là tới Mỹ Đình. chợ dân sinh trường mầm non, cấp 1,2 ngay gần...
+ Vị trí tốt, tiềm năng. Giá trị tăng trưởng phi mã mỗi ngày.
+ Sổ đỏ chính chủ, pháp lý chuẩn, đất sạch sẽ không lỗi.
+ Giá bán 5.1 tỷ có thương lượng.
Anh/chị liên hệ ngay:E Trường để biết thêm thông tin chi tiết, vị trí thực tế và đi xem vị trí miễn phí. (Em Trường chuyên bán nhà đất Trịnh Văn Bô, Hòe Thị, Phương Canh, Xuân Phương).","5,1 tỷ",60 m2,"Đường Trịnh Văn Bô, Phường Phương Canh, Quận Nam Từ Liêm, Hà Nội",13501794,_,---,Cần bán,12m,---,"Đất thổ cư, đất ở",Sổ hồng/ Sổ đỏ,---,5m,---,---,12m,---,---
https://alonhadat.com.vn/ban-dat-trinh-van-bo-128m2-sat-khu-do-thi-lon-can-tien-ban-nhanh-dau-tu-qua-ngon-13502010.html,"Bán đất Trịnh Văn Bô 128m2, sát khu đô thị lớn, cần tiền bán nhanh đầu tư quá ngon","Bán đất Trịnh Văn Bô - Phương Canh, 128m đầu tư xây chung cư mini hái ra tiền - ngõ nông rộng thoáng - gần phố - hàng hiếm - hơn 6 tỷ có thương lượng mạnh.

+ Vị trí rất đẹp Xung quanh là các trường đại học, cao đẳng lớn trong khu vực như: Cao đẳng FPT, Đại học Công Nghệ Đông Á, ĐH Thương Mại, ĐH Công Nghiệp HN. chỉ mất 5p di chuyển lên trung tâm Mỹ Dìnhd
+ Nhà mình gần phố, gần chợ dân sinh. Cực kỳ thích hợp cho thuê ở sinh viên, người đi làm. Tiện ích xung quanh đầy đủ.
+ Sổ đỏ chính chủ, sẵn giao dịch.
+ Giá bán 6.65 tỷ có thương lượng.
Anh/Chị vui lòng Liên Hệ để biết thêm thông tin chi tiết và xem nhà miễn phí. (Em Trường chuyên bán nhà đất Trịnh Văn Bô, chuyên bán nhà đất Xuân Phương, nhà đất Hòe Thị, nhà đất P","6,65 tỷ",128 m2,"Đường Trịnh Văn Bô, Phường Phương Canh, Quận Nam Từ Liêm, Hà Nội",13502010,_,---,Cần bán,3m,---,"Đất thổ cư, đất ở",Sổ hồng/ Sổ đỏ,---,---,---,---,---,---,---
https://alonhadat.com.vn/ban-nha-phu-dien-cau-dien-42m2-x5t-gara-o-to-gan-pho-gia-cuc-hiem-trong-khu-vuc-13502379.html,"Bán nhà Phú Diễn - Cầu Diễn 42m2 x5T, gara ô tô, gần phố, giá cực hiếm  trong khu vực","Bán nhà Phú Diễn - hơn 5 tỷ có nhà gara ô tô 5t chủ xây chất như nước cất - gần phố ở sướng - tiềm năng - kinh doanh online hay văn phòng cực phẩm - không có căn thứ 2 tại khu vực.
+ Nhà mình thiết kế 5T có Gara ô tô tầng 1, các tầng còn lại ở thoái mái, mỗi tầng 1 phòng rộng WC khép kín
+ Thích hợp vừa ở vừa cho thuê giữ tiền. Nhà mình rất gần phố, tiện kinh doanh.
+ Xung quanh là các trường đại học và cao đẳng như: Đh Công Nghiệp, ĐH Tài Nguyên và Môi Trường, ĐH Thương Mại, CĐ Múa... Chợ dân sinh nhà, trường mầm non cấp 1, cấp 2 khoảng 300m
+ Sổ đỏ vuông vắn, chính chủ, sãn giao dịch.
Anh/Chị vui lòng Liên Hệ  để biết thêm thông tin chi tiết và xem nhà miễn phí. (Em Trường chuyên bán nhà Phú Diễn, nhà Cầu Diễn, nhà Hồ Tùng Mậu. Nhà dòng tiền cho thuê chung cư mini, văn phòng... ).","5,2 tỷ",42 m2,"Đường Phú Diễn, Phường Phú Diễn, Quận Bắc Từ Liêm, Hà Nội",13502379,_,---,Cần bán,4m,---,Nhà trong hẻm,Sổ hồng/ Sổ đỏ,---,---,5,---,---,4,---
https://alonhadat.com.vn/ban-dat-cau-dien-btl-66m2-mt-5-9m-ngo-thong-o-to-tranh-kd-sam-uat-gia-chao-6-1-ty-13513353.html,"Bán đất Cầu Diễn - BTL 66m2, MT 5.9M ngõ thông ô tô tránh, KD sầm uất , giá chào 6.1 tỷ","Bán đất Cầu Diễn - Bắc Từ Liêm 66m², mặt tiền 5.9m - ngõ thông kinh doanh đa dạng đủ loại hình - hàng hiếm - vừa ở kinh doanh hoặc xây ccmn 7T cho thuê

+ Vị trí rất đẹp Xung quanh là các trường đại học, cao đẳng lớn trong khu vực như: ĐH Công Nghiệp HN , ĐH Tài Nguyên Môi Trường , Cao đẳng FPT, Đại học Công Nghệ Đông Á, ĐH Thương Mại, . chỉ mất 5p di chuyển lên trung tâm Mỹ Đình....
+ Nhà mình gần phố, gần chợ dân sinh. Cực kỳ thích hợp vừa ở vừa cho thuê ở sinh viên, người đi làm. Tiện ích xung quanh đầy đủ, không thiếu gì
+ Sổ đỏ chính chủ, sẵn giao dịch.
+ Giá bán 6.1 tỷ có thương lượng.
Anh/Chị vui lòng Liên Hệ  để biết thêm thông tin chi tiết và xem nhà miễn phí. (Em Trường chuyên bán nhà đất Cầu Diễn, Phú Diễn , Minh Khai ....)","6,1 tỷ",66 m2,"Đường Cầu Diễn, Phường Minh Khai, Quận Bắc Từ Liêm, Hà Nội",13513353,_,---,Cần bán,6m,---,"Đất thổ cư, đất ở",Sổ hồng/ Sổ đỏ,---,---,---,---,---,---,---
https://alonhadat.com.vn/ban-gan-90m2-dat-cau-dien-bac-tu-liem-ngo-thong-o-to-vao-gan-quan-uy-gia-dau-tu--13260778.html,"Bán gần 90m2 đất Cầu Diễn - Bắc Từ Liêm, ngõ thông ô tô vào, gần quận ủy, giá đầu tư.","Bán đất Cầu Diễn- Minh Khai - Bắc Từ Liêm gần quận ủy - ô tô vào đất - tặng nhà c4 giữ tiền đầu tư - vị trí càng ngày càng đẹp - giá đầu tư - xây CCMN hái ra tiền.
+ Chính chủ người quen nhờ bán lô đất gần 90m² , đường ô tô vào nhà thoải mái. Cực gần phố. Gần ngay trường Đại học Công Nghiệp HN
+ Thích hợp: Đầu tư giữ tiền cho thuê, hoặc xây nhà ở, chung cư mini cho thuê dòng tiền cực hot.

+ Sổ đỏ chính chủ, nở hậu
+ Gía chào 5 tỷ ( còn thương lượng)
Anh/Chị vui lòng Liên Hệ E Trường để biết thêm thông tin chi tiết và xem nhà miễn phí. (Em Trường - chuyên bán nhà đất Cầu Diễn - Minh Khai... Bắc Từ Liêm).",5 tỷ,86 m2,"Đường Cầu Diễn, Phường Minh Khai, Quận Bắc Từ Liêm, Hà Nội",13260778,_,---,Cần bán,3m,---,"Đất thổ cư, đất ở",Sổ hồng/ Sổ đỏ,---,---,---,---,---,---,---
https://alonhadat.com.vn/cc-can-ban-70m2-dat-cau-dien-phu-dien-ngo-thong-o-to-tranh-kd-tap-nap-gia-hon-3-ty-13260859.html,"CC cần bán 70m2 đất Cầu Diễn - Phú Diễn, ngõ thông ô tô tránh, kd tấp nập, giá hơn 3 tỷ","Bán đất Cầu Diễn- Phú Diễn - Bắc Từ Liêm - ô tô vào đất - tặng nhà c4 giữ tiền đầu tư - ngõ thông ô tô tránh, kd tấp nập , giá tốt hơn 3 tỷ
+ Chính chủ người quen nhờ bán lô đất 70m² , đường vào ô tô tránh kinh doanh tấp nập ngày đêm
+ Thích hợp: Đầu tư giữ tiền cho thuê, hoặc xây nhà ở, chung cư mini cho thuê dòng tiền cực hot.

+ Sổ đỏ chính chủ, nở hậu
+ Gía chào 3.9 tỷ ( còn thương lượng)
Anh/Chị vui lòng Liên Hệ  để biết thêm thông tin chi tiết và xem nhà miễn phí. (Em Trường - chuyên bán nhà đất Cầu Diễn - Minh Khai... Bắc Từ Liêm).","3,9 tỷ",70 m2,"Đường Phú Diễn, Phường Phú Diễn, Quận Bắc Từ Liêm, Hà Nội",13260859,_,---,Cần bán,7m,---,"Đất thổ cư, đất ở",Sổ hồng/ Sổ đỏ,---,---,---,---,---,---,---
https://alonhadat.com.vn/hiem-nguyen-lan-dan-tri-cao-tien-ich-43m-x-5-tang-mt-4m-gia-4-5-ty-13549660.html,"HIẾM! NGUYỄN LÂN- DÂN TRÍ CAO - TIỆN ÍCH 
43m x 5 tầng, mt 4m, giá 4,5 tỷ","HIẾM! NGUYỄN LÂN- DÂN TRÍ CAO - TIỆN ÍCH 

43m x 5 tầng, mt 4m, giá 4,5 tỷ

Phố mới, nhà mới và cũng cần chủ mới

Mô tả:

+ Thiết kế: Nhà xây 5 tầng khung cột chắc chắn.

- Tầng 1: Khách, bếp, Wc và sân để xe.

- Tầng 2,3,4: Mỗi tầng 1 ngủ, Wc.

- Tầng 5: Phòng thờ, sân phơi.

Sổ đỏ phân lô, đẹp không tỳ vết, sẵn giao dịch ngay.

Liên hệ : Nguyễn Lương : .Miễn phí xem nhà - 
Nguồn hàng phong phú- Nhiệt tình tận tâm- Hỗ trợ 24h.","4,5 tỷ",43 m2,"Đường Nguyễn Lân, Phường Phương Liệt, Quận Thanh Xuân, Hà Nội",13549660,_,True,Cần bán,"3,5m",True,Nhà trong hẻm,Sổ hồng/ Sổ đỏ,True,4m,5,True,11m,3,---
https://alonhadat.com.vn/ban-nha-93-phan-dinh-giot-130m2-4-tang-13549793.html,Bán Nhà 93 Phan Đình Giót 130m2 4 Tầng,"Căn Nhà mình vị trí Trung Tâm quận Thanh Xuân
- Mặt Tiền 10m
- Vị Trí view sông
-Gần Chợ
-Bệnh Viện
-An Sinh Xã Hội Tốt
-Hiện Trạng đang cho thuê hợp đồng dài hạn có sẵn
-Phù Hợp Kinh Doanh Đồ Gia dụng, Tạp Hoá 
Gia Đình định cư nước ngoài không có nhu cầu để ở cần bán",15 tỷ,130 m2,"93 Phố Phan Đình Giót, Phường Phương Liệt, Quận Thanh Xuân, Hà Nội",13549793,_,True,Cần bán,10m,True,Nhà mặt tiền,Sổ hồng/ Sổ đỏ,True,10m,4,True,13m,5,---
https://alonhadat.com.vn/em-ban-50-5m2-dat-bac-thuong-quang-tien-soc-son-ha-noi-13144478.html,"em bán 50,5m2 đất bắc thượng quang tiến sóc sơn hà nội","EM BÁN 50,5M2 TẠI BẮC THƯỢNG QUANG TIẾN SÓC SƠN 
ĐƯỜNG 5,5M Ô TÔ TRÁNH NHAU
Thực tế trên sổ 52m2 lý do bị cắt đường mở rộng thêm lên bị thiếu bên em báo theo diện tích thực tế nhé 
Đất cách kcn nội bài chỉ 2km
Cách sân bay chỉ 3km
vị trí đông dân cư và có nhiều công nhân ở 
ace quan tâm liên hệ cho em nhé",868 triệu,50 m2,"Đường Tỉnh Lộ 131, Xã Quang Tiến, Huyện Sóc Sơn, Hà Nội",13144478,_,---,Cần bán,5m,---,"Đất thổ cư, đất ở",Sổ hồng/ Sổ đỏ,---,"3,9m",---,---,14m,---,---
https://alonhadat.com.vn/em-ban-66-2m2-dat-nguyen-khe-dong-anh-ha-noi-duong-o-to-ngo-thong-13139464.html,"em bán 66,2m2 đất nguyên khê đông anh hà nội đường ô tô ngõ thông","em không sử dụng cần bán, 66.2m² xóm Ngõ - Nguyên Khê - Đông Anh - Hà Nội.
Đường rộng ngõ thông ô tô đỗ cửa. 
Mặt tiền: 4m.
Mặt hậu: 4.2m.
Sâu 15m.
Vị trí cách bìa làng chỉ 30m đường rộng 3.5m ngõ thông ô tô vào tận đất.
Cách đường Lê Hữu Tựu 500m.
Cách Đường Võ Nguyên Giáp 500m.
Khu vực đông dân cư có nhiều tiện ích và dự án lớn.",32 triệu / m2,66 m2,"Đường Võ Nguyên Giáp, Xã Nguyên Khê, Huyện Đông Anh, Hà Nội",13139464,Tây,---,Cần bán,"3,5m",---,"Đất thổ cư, đất ở",---,---,"4,5m",---,---,15m,---,---
https://alonhadat.com.vn/chinh-chu-can-ban-116-6m2-tai-cong-hoa-phu-linh-soc-son-ha-noi-13507179.html,"chính chủ cần bán 116,6m2 tại cộng hoà phù linh sóc sơn hà nội","Em bán 116.6m² đất đường ô tô đỗ cửa. có 100m² thổ cư hàng giá rẻ nhất thị trường
địa chỉ : cộng hoà-phù linh - sóc sơn - hà nội
đường rộng 4,5m
mặt tiền 5,2m
hậu 5,2m
chiều sâu 22,12m
đất cách sân golf chỉ 1km
cách đường ql 3 chỉ 2km
cách đền gióng sóc sơn chỉ 1km
di chuyển từ hà nội lên rất nhanh",820 triệu,116 m2,"Đường Quốc Lộ 3, Xã Phù Linh, Huyện Sóc Sơn, Hà Nội",13507179,_,---,Cần bán,"4,5m",---,"Đất thổ cư, đất ở",Sổ hồng/ Sổ đỏ,---,"5,2m",---,---,22m,---,---
https://alonhadat.com.vn/em-ban-dat-dinh-trung-xuan-non-dong-anh-ha-noi-duong-o-to-vao-dat-13139422.html,em bán đất đình trung xuân nộn đông anh hà nội đường ô tô vào đất,"m có mảnh 46,5 m² đất tại đường Nhạn Xuân Nộn đường 3m ô tô đỗ cửa.
Mặt tiền đất rộng 4m.
Mặt hậu 4m.
Sâu 12m.
Vị trí đông dân cư và có nhiều dự án mở rộng.
Gần trường học, uỷ ban xã, chợ chỉ bán kính 1km.
Cách bệnh viện bắc thăng long 3km.
Cách quốc lộ 3 2km.","1,15 tỷ",47 m2,"Đường Quốc Lộ 3, Xã Xuân Nộn, Huyện Đông Anh, Hà Nội",13139422,Đông,---,Cần bán,"3,5m",---,"Đất thổ cư, đất ở",Sổ hồng/ Sổ đỏ,---,4m,---,---,11m,---,---
https://alonhadat.com.vn/em-ban-46-5m2-dat-dinh-trung-xuan-non-dong-anh-ha-noi-13078705.html,"em bán 46,5m2 đất đình trung xuân nộn đông anh hà nội","Em có mảnh 46,5 m² đất tại đường Nhạn Xuân Nộn đường 3m ô tô đỗ cửa.
Mặt tiền đất rộng 4m.
Mặt hậu 4m.
Sâu 12m.
Vị trí đông dân cư và có nhiều dự án mở rộng.
Gần trường học, uỷ ban xã, chợ chỉ bán kính 1km.
Cách bệnh viện bắc thăng long 3km.
Cách quốc lộ 3 2km.
Giá em bán 1.150 tỷ.","24,7 triệu / m2",47 m2,"Đường Quốc Lộ 3, Xã Xuân Nộn, Huyện Đông Anh, Hà Nội",13078705,_,---,Cần bán,3m,---,"Đất thổ cư, đất ở",---,---,4m,---,---,12m,---,---
