url,title,description,price,area,address,Mã tin,Hướng,Phòng ăn,Loại tin,Đường trước nhà,Nhà bếp,Loại BDS,Pháp lý,Sân thượng,Chiều ngang,Số lầu,Chổ để xe hơi,Chiều dài,Số phòng ngủ,Chính chủ,Thuộc dự án
https://alonhadat.com.vn/ban-nha-cau-giay-phan-lo-quan-doi-lo-goc-nha-dep--5674101.html,"Bán nhà, KHUẤT DUY TIẾN, hai thoáng, 60m2 GIÁ TỐT NHẤT","Khu Phân lô,oto đỗ cửa, đường thông tứ tung, khu vực .dân trí cao. hàng xóm thân thiện.
+ Nhà xây 5 tầng, mỗi tầng 2 phòng,  Tổng 6 phòng ngủ.
+ Vị trí cực đẹp, 2 mặt thoáng vĩnh viễn, khu vực dân trí cao,
+ giao thông vô cùng thuận tiện, bởi trục chính của Thanh xuân, thích hợp để ở và cho thuê bởi giá hiện tại là tốt nhất khu vực. 
+ Sổ đỏ chính chủ, vuông đẹp.
+ liên hệ xem nhà. THÁI.","11,5 tỷ",60 m2,"Đường Khuất Duy Tiến, Phường Thanh Xuân Bắc, Quận Thanh Xuân, Hà Nội",5674101,_,True,Cần bán,6m,True,Nhà mặt tiền,Sổ hồng/ Sổ đỏ,True,5m,5,True,12m,4,---,
https://alonhadat.com.vn/ban-nha-trung-tam-cau-giay-60m-x5-tang-x-4-5mt-2-thoang-10-ti-8948186.html,"Bán nhà, Phân lô,tự xây. ĐỖ QUANG  55 x5 Tâng x 4.5mt, 2 thoáng.giá tốt nhất","+ KHU PHÂN LÔ - Ô TÔ TRÁNH - ĐƯỜNG THÔNG - 2THOÁNG
+ Khu vực, tập trung,rất nhiều các trường ĐẠI HỌC lớn của cả nước,
 + Giao thông thuận lợi,phân lô bàn cờ .hướng đi nào cũng tiện.
+ Khu vực VIP nhất quận CẦU GIẤY ,DÂN TRÍ CAO. .
+ Đường rộng thông các ngả, Tiện đi lại vào khu vực trung tâm.TIỆN ÍCH 
  ĐỦ ĐẦY.  
+ Miễn phí giao dịch kể cả khi khách hàng mua bán công chứng xong  
+ Sổ đỏ chính chủ, pháp lý rõ ràng sẵn sàng giao dịch
+ Giá: 16,7tỷ ( có thương lượng với khách thiện chí và sẵn tài chính)
+ Liên hệ, Thái:","16,7 tỷ",55 m2,"Đường Đỗ Quang, Phường Trung Hòa, Quận Cầu Giấy, Hà Nội",8948186,_,True,Cần bán,6m,True,Nhà mặt tiền,Sổ hồng/ Sổ đỏ,True,"4,5m",5,True,12m,5,---,
https://alonhadat.com.vn/ban-toa-nha-can-ho-cho-thue-duong-thien-hien-my-dinh-nam-tu-liem-115m2-7-tang-thang-may--9919571.html,"Bán tòa nhà căn hộ cho thuê đường Thiên Hiền, Mỹ Đình, Nam Từ Liêm,115m2,7 tầng,thang máy.","Bán tòa nhà Apartment đường Thiên Hiền, Mỹ Đình, Nam Từ Liêm, 115m2, 7 tầng, thang máy.
- Tòa nhà 26 phòng khép kín, doanh thu 135tr/ tháng.
Nội thất các phòng: Tivi, giường, chăn ga gối đệm, tủ quần áo, bàn trang điểm, bàn ăn, bếp từ + nồi nấu, tủ lạnh, máy hút mùi, bình nóng lạnh, điều hòa, thảm trải sàn.
Thiết bị chung: 2máy giặt, 2 máy sấy, hệ thống PCCC, khóa từ vân tay, cameda từng tầng.... mới đét. 
Không gian xanh, sạch, đẹp thiết bị đẳng cấp 3 sao, phòng nào cũng có giếng trời, cửa sổ, cây xanh tiểu cảnh…
Cách mặt phố Phạm Hùng 600m, gần các trường ĐH : Thương Mại, Sư Phạm I, Quốc Gia….., các sở, bộ ban ngày mới chuyển về, cạnh KĐT sông đà, khu hàn nhật, Kangnam 72 tầng..
Thông thương với các đường Mỹ Đình, đường Phạm Hùng, đường  Nguyễn Hoàng, đường Mễ Trì,…. Gần khu ở của người Hàn Quốc ( KĐT Mỹ Đình – Sông Đà, Kangnam..)","23,9 tỷ",115 m2,"Đường Thiên Hiền, Phường Mỹ Đình 2, Quận Nam Từ Liêm, Hà Nội",9919571,_,---,Cần bán,11m,---,Nhà trong hẻm,---,---,---,7,---,---,26,---,
https://alonhadat.com.vn/ban-toa-nha-cho-thue-duong-dinh-thon-100m2-8-tang-mt-6-8m-lo-goc-o-to-tranh--9893689.html,"Bán tòa nhà cho thuê đường Đình Thôn, 100m2, 8 tầng, MT 6.8m, lô góc, ô tô tránh.","Bán tòa nhà cho thuê đường Đình Thôn, 100m2, 8 tầng, MT 6.8m, lô góc, ô tô tránh.
Thiết kế :
+ Tầng 1: Lễ tân, để xe và 1 phòng bảo vệ. 
+ Tầng 2-8: Mỗi tầng 3 căn hộ dịch vụ, tổng 21 căn. 
+ Tầng 9: Tum, sân phơi.
+ Hiện tại chủ đang cho một đơn vị thuê 72 triệu/tháng.
- Vị trí đẹp cách mặt đường Đình Thôn chỉ vài bước chân, đường Đình Thôn sầm uất cả ngày lẫn đêm, gần KĐT Mỹ Đình Sông Đà, The Manor, trường Marie Curie, gần TTTM The Garden, Kangnam, vài bước chân là đến Vinmart, Kmart...
- Liên thông với các trục đường : Phạm Hùng, Mễ trì, Lê Quang Đạo, Dương Đình Nghê, Đình Thôn. Là KĐT có nhiều người Hàn Quốc sinh sống và làm việc nhất với đầy đủ các dịch vụ TTTM, Trường học, vui chơi giải trí …. đáng sống.
Sổ đỏ chính chủ, sẵn sang giao dịch.",24 tỷ,100 m2,"Đường Đình Thôn, Phường Mỹ Đình 2, Quận Nam Từ Liêm, Hà Nội",9893689,_,---,Cần bán,7m,---,Nhà trong hẻm,---,---,---,8,---,---,21,---,
https://alonhadat.com.vn/ban-nha-nguyen-khanh-toan-lo-goc-thang-may-6-5ti--5708144.html,"Bán nhà,  TRUNG KÍNH, 2 THOÁNG thang máy, Vew vườn hoa.","+   VỊ TRÍ CỰC ĐẸP,CÁCH ĐƯỜNG ÔTÔ, 10M.THÍCH HỢP GIA ĐÌNH NHIỀU THẾ HỆ.
+ Nhà xây phong cách châu âu,hiện đại thông sàn.
Thang máy + Hầm là 1 lợi thế.
+ Tầng 1 2 3 4 5 Thông sàn kinh doanh 
+ Tầng 6 làm phòng ăn + ngắm phố phường. Tầng 7 phòng thờ và sân chơi,tiểu cảnh
+ Thích hợp cho GĐ ở tiện đi làm, khu vực giao thông thuận lợi.
+ Miễn phí giao dịch kể cả khi khách hàng mua bán công chứng xong  
+ liên hệ xem nhà Thái",30 tỷ,115 m2,"Phố Trung Kính, Phường Trung Hòa, Quận Cầu Giấy, Hà Nội",5708144,_,True,Cần bán,8m,True,Nhà mặt tiền,Sổ hồng/ Sổ đỏ,True,6m,7,True,12m,5,---,
https://alonhadat.com.vn/ban-biet-thu-song-lap-789-my-dinh-nam-tu-liem--9860970.html,"Bán biệt thự song lập dự án 789 Bộ Tổng Tham Mưu – BQP, Mỹ Đình, Nam Từ Liêm.","Bán biệt thự song lập dự án 789 Bộ Tổng Tham Mưu – BQP, diện tích 90m2, xây 4 tầng, mặt tiền 6m.
+ Khu nhà Biệt thự của Chung cư 789 Bộ Quốc Phòng, an ninh tuyệt đối, hàng xóm toàn quan chức Tướng - Tá.
+ Nằm vị trí trung tâm Mỹ Đình, thừa hưởng tất cả các tiện ích như SVĐ Mỹ Đình, BV Hồng Ngọc, đường đua F1, các TTTM xung quanh,...
+ Thiết kế hiện đại, cao cấp, hiện đang cho thuê. Mỗi tầng 2 phòng. Ô tô dừng đỗ. 
Nhà liên thông với các trục đường : Đình thôn, Thiên Hiền, Mỹ Đình, Lê Đức Thọ, Phạm Hùng. Gần KĐT Mỹ Đình Sông Đà, Ký túc xá sinh viên, khu Phân lô quân đội, sân vận động Mỹ Đình, KĐT Mỹ Đình 1,2….. Với đầy đủ các tiện ích phục vụ cuộc sống, công việc, sức khỏe, học tập, giải trí …. đều nằm trong bán kính 1km.
Sổ đỏ chính chủ, vuông vắn sẵn sàng giao dịch.","14,5 tỷ",90 m2,"Đường Nhân Mỹ, Phường Mỹ Đình 1, Quận Nam Từ Liêm, Hà Nội",9860970,_,---,Cần bán,15m,---,"Biệt thự, nhà liền kề",---,---,---,4,---,---,6,---,Căn hộ chung cư 789 Mỹ Đình (Chung cư Bộ Tổng Tham Mưu) (xem chi tiết dự án)
https://alonhadat.com.vn/ban-nha-phan-lo-tdc-cau-dien-duong-phu-dien-bac-tu-liem-7-tang-thang-may--9843516.html,"Bán nhà phân lô TĐC Cầu Diễn, đường Phú Diễn, Bắc Từ Liêm , 7 tầng, thang máy.","Bán nhà Bán nhà phân lô TĐC Cầu Diễn, đường Phú Diễn diện tích 75m2, xây 7 tầng, đường ôtô tránh, vỉa hè rộng 2,5m, ngõ ô tô dừng đỗ thoải mái, khu dân trí cao cực đáng sống. 
- Nhà thiết kế 7 tầng thang máy :
+ T 1 : Gara, PK , WC. 
+ T2-3-4-5: Tầng 2 phòng, wc giữa.
+ T6: 2 phòng, wc khép kín.
+ T7: sân phơi khu giặt vườn cây cảnh 
Nhà gần Đại học Tài Nguyên Môi Trường, gần Cao đẳng y dược Tuệ Tĩnh, nhà máy BQP – Z199. 
Tương lai nhà ra gần đường Hoàng Quốc Việt kéo dài.
Nhà chủ tự tay xây dựng được gần 3 năm, còn mới nguyên, đẹp không tì vết. Tặng lại 100% nội thất sịn sò cho khách mua. 
Các tiện ích đầy đủ xung quanh : trường học cấp 1,2,3 cho đến ĐH ngay cạnh nhà, siêu thị cách 100m, chợ ngay đầu đường Phú Diễn…..
Sổ đỏ vuông vắn, sẵn sang giao dịch.",15 tỷ,75 m2,"Đường Phú Diễn, Phường Phú Diễn, Quận Bắc Từ Liêm, Hà Nội",9843516,_,---,Cần bán,15m,---,Nhà trong hẻm,---,---,---,7,---,---,10,---,
https://alonhadat.com.vn/ban-nha-duong-my-dinh-70m2-5-tang-duong-o-to-tranh-kinh-doanh-cuc-dinh--9810700.html,"Bán nhà đường Mỹ Đình, 70m2, 5 tầng, đường ô tô tránh, kinh doanh cực đỉnh.","Bán nhà đường Mỹ Đình, 70m2, 5 tầng, đường ô tô tránh, kinh doanh cực đỉnh.
Nhà mặt phố Mỹ Đình, vị trí sầm uất nhất, cách ngã tư Trần Bình - Mỹ Đình vài chục mét. Sau lưng bến xe Mỹ Đình.
+ Thiết kế : Thiết kế cầu thang giữa, mỗi tầng 2PN. Tổng 6PN.
Nhà cũ, KCBT chắc chắn, chủ mới mua về cải tạo, sơn sửa lại. Hàng xóm 7-8 tầng kinh doanh tốt
+ Vị trí : siêu đẹp, miễn bàn, kinh doanh sầm uất ngày đêm.
Nhà liên thông với các trục đường : Đình thôn, Thiên Hiền, Mỹ Đình, Lê Đức Thọ, Phạm Hùng. Gần KĐT Mỹ Đình Sông Đà, Ký túc xá sinh viên, khu Phân lô quân đội, sân vận động Mỹ Đình, KĐT Mỹ Đình 1,2….. Với đầy đủ các tiện ích phục vụ cuộc sống, công việc, sức khỏe, học tập, giải trí …. đều nằm trong bán kính 1km.
Sổ đỏ chính chủ, vuông vắn sẵn sàng giao dịch.","13,5 tỷ",70 m2,"Đường Mỹ Đình, Phường Mỹ Đình 2, Quận Nam Từ Liêm, Hà Nội",9810700,_,---,Cần bán,22m,---,Nhà mặt tiền,---,---,---,5,---,---,6,---,
https://alonhadat.com.vn/ban-nha-mat-duong-my-dinh-75m2-6-tang-duong-o-to-tranh-kinh-doanh-dinh--9852623.html,"Bán nhà mặt đường Mỹ Đình, 75m2, 6 tầng, đường ô tô tránh, kinh doanh đỉnh.","Bán nhà mặt đường Mỹ Đình, 75m2, 6 tầng, đường ô tô tránh, kinh doanh đỉnh.
+ Thiết kế 6 tầng, thang máy cuối. 
- Tầng 1: Kinh doanh. 
- Tầng lửng: Phòng khách, bếp.
- Tầng 2,3,4 mỗi tầng 1 phòng ngủ khép kín siêu rộng. 
- Tầng 5: Để máy móc thiết bị sản xuất. 
- Tầng 6: Tum, sân phơi. 
+ Nhà mới xây được hơn 1 năm còn rất mới. 
+ Thang máy nhập, chạy vù vù. 
+ Ngay gần cổng trường C1,2,3 Mỹ Đình, kinh doanh gì cũng tốt. 
+ Vị trí : siêu đẹp, miễn bàn, kinh doanh sầm uất ngày đêm.
Nhà liên thông với các trục đường : Đình thôn, Thiên Hiền, Mỹ Đình, Lê Đức Thọ, Phạm Hùng. Gần KĐT Mỹ Đình Sông Đà, Ký túc xá sinh viên, khu Phân lô quân đội, sân vận động Mỹ Đình, KĐT Mỹ Đình 1,2….. Với đầy đủ các tiện ích phục vụ cuộc sống, công việc, sức khỏe, học tập, giải trí …. đều nằm trong bán kính 1km.
Sổ đỏ chính chủ, vuông vắn sẵn sàng giao dịch.","19,5 tỷ",75 m2,"Đường Mỹ Đình, Phường Mỹ Đình 2, Quận Nam Từ Liêm, Hà Nội",9852623,_,---,Cần bán,15m,---,Nhà mặt tiền,---,---,---,6,---,---,3,---,
https://alonhadat.com.vn/phan-lo-phu-dien-bac-tu-liem-nha-dep-64m2-7-tang-thang-may-o-to-kinh-doanh-gia-12-ty-13725332.html,PHÂN LÔ PHÚ DIỄN BẮC TỪ LIÊM NHÀ ĐẸP 64M2 7 TẦNG THANG MÁY Ô TÔ KINH DOANH GIÁ 12 TỶ,"PHÂN LÔ - Ô TÔ TRÁNH - VỈA HÈ RỘNG MÊNH MÔNG - KINH DOANH - KHU VÍP PHÚ DIỄN . 7 TẦNG THANG MÁY, NHÀ MỚI ĐẸP. FULL NỘI THẤT.
- Đường bàn cờ thông vòng quanh. Gần trường Đại học Tài nguyên Môi trường, cho thuê dòng tiền cao, ở sướng đẳng cấp.
Thang máy xịn xò chạy êm ru
- Chủ làm xây dựng nên có mắt thẩm mỹ, định xây để ở, nhưng tư duy đầu tư có chỗ khác ngon hơn lại bán.
- Nhà thiết kế rất đẹp, tận dụng tối đa không gian. Có đủ ánh sáng tự nhiên.
- Thiết kế 6 tầng 1 tum.
+ Tầng 1: Văn phòng, 1 phòng trong tiếp khách, vệ sinh.
+ Tầng 2,3,4,5 Mỗi tầng 2 phòng. Vệ sinh cầu thang giữa.
+ Tầng 6: Bếp, phòng khách, vệ sinh, ban công trồng hoa.
+ Tầng 7: Tum rộng.
- Sổ đỏ sẵn giao dịch ngay
- Giá bán 12 tỷ
- Liên hệ: Mr Trường - Chuyên nhà Ô TÔ",12 tỷ,64 m2,"Đường Phú Diễn, Phường Phú Diễn, Quận Bắc Từ Liêm, Hà Nội",13725332,_,True,Cần bán,15m,True,Nhà mặt tiền,Sổ hồng/ Sổ đỏ,True,---,7,True,---,10,---,
https://alonhadat.com.vn/ban-can-goc-3pn-du-an-hc-golden-city-nhan-nha-o-ngay-ban-giao-full-noi-that-cao-cap--12942748.html,"Bán căn góc 3PN dự án HC Golden City. Nhận nhà ở ngay, bàn giao full nội thất cao cấp.",nan,4 tỷ,87 m2,"50 Đường Hoàng Như Tiếp, Phường Bồ Đề, Quận Long Biên, Hà Nội",12942748,_,---,Cần bán,---,---,Căn hộ chung cư,---,---,---,8,---,---,3,---,Khu biệt thự 319 Bồ Đề (HC Golden City) (xem chi tiết dự án)
https://alonhadat.com.vn/ban-suat-ngoai-giao-du-an-hud-me-linh-nha-vuon-chi-tu-5-6-ty-can-12917067.html,BÁN SUẤT NGOẠI GIAO DỰ ÁN HUD MÊ LINH. NHÀ VƯỜN CHỈ TỪ 6 TỶ/CĂN,nan,6 tỷ,125 m2,"60 Đường Vành Đai 4, Xã Thanh Lâm, Huyện Mê Linh, Hà Nội",12917067,_,---,Cần bán,20m,---,"Biệt thự, nhà liền kề",Sổ hồng/ Sổ đỏ,---,---,4,---,---,4,---,Khu đô thị mới Thanh Lâm – Đại Thịnh II (xem chi tiết dự án)
https://alonhadat.com.vn/ban-nha-ngo-378-thuy-khue-thong-vong-thi-tay-ho-dien-tich-34m2-gia-3-4-ty--13725316.html,Bán nhà ngõ 378 Thụy Khuê thông Võng Thị – Tây Hồ. Diện tích 34m2. Giá 3.4 tỷ.,"Bán nhà ngõ 378 Thụy Khuê thông Võng Thị – Tây Hồ. Diện tích 34m2. Giá 3.4 tỷ.
-	Khu vực gần Hồ, sát trường Phạm Hồng Thái, Chu Văn An.
-	Gần các tuyến đường Thụy Khuê, Võng Thị, Trích Sài.
-	Nhà dân xây dựng chắc chắc, mặt tiền rộng lý tưởng. Khách mua về có thể thêm tầng hoặc xây mới.
-	Sổ đỏ chính chủ, sẵn sàng sang tên.","3,4 tỷ",34 m2,"Đường Thụy Khuê, Phường Thụy Khuê, Quận Tây Hồ, Hà Nội",13725316,_,True,Cần bán,"2,5m",True,Nhà trong hẻm,Sổ hồng/ Sổ đỏ,True,5m,3,---,---,3,---,
https://alonhadat.com.vn/62m2-mat-pho-7-tang-thang-may-kinh-doanh-via-he-trinh-van-bo-xuan-phuong-nam-tu-liem-13-6-13725311.html,62M2 MẶT PHỐ 7 TẦNG THANG MÁY KINH DOANH VỈA HÈ TRỊNH VĂN BÔ XUÂN PHƯƠNG NAM TỪ LIÊM 13.6,"Ô TÔ TRÁNH VỈA HÈ 5M - KINH DOANH - VĂN PHÒNG - Ở SƯỚNG TIỆN ÍCH NGẬP TRÀN - GIÁ ĐẸP TIỀM NĂNG TĂNG TỐT - X2 TÀI SẢN DỄ HƠN TRUNG TÂM MỸ ĐÌNH
- Nhà mặt phố không có gì mô tả, khách mua không phải lo về ngõ ngách, kinh doanh hái ra tiền, ở cũng sướng, đẳng cấp nhà mặt phố.
- Khu vực tương lai sáng bởi dự án xung quanh ngập tràn quỹ đất chờ sẵn cho Doanh nghiệp chỉ chờ ngày lành tháng tốt khởi công, tài sản sẽ tăng phi mã.
- Thiết kế 7 tầng thang máy nhiều công năng:
+ Tầng 1,2,3: Thông sàn, thang máy và vệ sinh cuối.
+ Tầng 4,5: 2 phòng ngủ và vệ sinh.
+ Tầng 6: Phòng khách và bếp.
+ Tầng 7: Sân phơi.
- Sổ đỏ chính chủ cất két sẵn giao dịch
- Giá bán 13,6 tỷ - Thương lượng
- Liên hệ: Mr Trường - Chuyên nhà phố Ô TÔ","13,6 tỷ",62 m2,"Đường Trịnh Văn Bô, Phường Xuân Phương, Quận Nam Từ Liêm, Hà Nội",13725311,_,True,Cần bán,15m,True,Nhà mặt tiền,Sổ hồng/ Sổ đỏ,True,---,7,True,---,6,---,
https://alonhadat.com.vn/ban-nha-minh-khai-quan-hai-ba-trung-30m2-5-tang-nhinh-3-ty-13489662.html,Bán nhà Minh Khai quận Hai Bà Trưng 30m2 - 5 tầng nhỉnh 3 tỷ,"Gia đình chuyển khu vực sinh sống muốn bán căn nhà thuộc phố Minh Khai. 
Nhà tự xây kiên cố, chắc chắn, ngõ thông nhiều hướng, khu vực an ninh đảm bảo, dân cư văn minh.
Nhà cách ô tô dừng đỗ chừng 20m. 
Nhà cải tạo thêm tầng thoải mái, vị trí góc 2 mặt thoáng. 
Sổ đẹp, chính chủ, giá mong muốn 3 tỷ 25.
Lh trực tiếp sdt hoặc ib zalo","3,25 tỷ",30 m2,"Đường Minh Khai, Phường Minh Khai, Quận Hai Bà Trưng, Hà Nội",13489662,Đông Nam,---,Cần bán,3m,---,Nhà trong hẻm,Sổ hồng/ Sổ đỏ,---,---,5,---,---,3,---,
https://alonhadat.com.vn/ban-nha-pho-do-quang-quan-cau-giay-55m-5-tang-gia-nhinh-15-ty--13710240.html,Bán nhà phố Đỗ Quang quận Cầu Giấy 55m 5 tấng giá nhỉnh 15 tỷ.,"Nhà thuộc khu phân lô, có thể đi từ nhiều hướng vào, thông sang phố Nguyễn Thị Định,
Vị trí đắc địa giáp danh giữa các quận Cầu Giấy, Đống Đa, Thanh Xuân, Nam Từ Liêm, xung quanh tiện ích không thiếu gì, khu vực kinh doanh nhiều người Hàn ở và làm việc.
Đường trước nhà ô tô tránh , vỉa hè, phù hơp kinh doanh mọi mô hình, siêu thị, spa, văn phòng…..
Nhà thiết kế khung cột 5 tầng. Sơn lại là như mới. 
Sổ vuông đẹp, 
- Gia thương lượng.
Liên hệ trực tiếp   (zalo),","15,2 tỷ",55 m2,"Đường Đỗ Quang, Phường Trung Hòa, Quận Cầu Giấy, Hà Nội",13710240,_,---,Cần bán,10m,---,Nhà mặt tiền,Sổ hồng/ Sổ đỏ,---,---,5,---,---,5,---,
https://alonhadat.com.vn/ban-nha-pho-nguyen-thi-dinh-81m-9-tang-gia-23-ty-13720634.html,Bán nhà phố Nguyễn Thị Định  81m - 9 tầng giá 23 tỷ,"Nhà phân lô phố vip, khu vực ít nhà bán, kinh doanh đỉnh. Khu phố chuyên cho khách Hàn Quốc thuê, xung quanh toàn nhà hàng Hàn Quốc kinh doanh sầm uốt.
Hiện là đang kinh doanh dong tiền ổn định.
Sổ vuông đẹp.",23 tỷ,81 m2,"Phố Nguyễn Thị Định, Phường Trung Hòa, Quận Cầu Giấy, Hà Nội",13720634,_,True,Cần bán,10m,True,Nhà mặt tiền,Sổ hồng/ Sổ đỏ,True,---,9,True,---,15,---,
https://alonhadat.com.vn/ban-nha-pho-lac-long-quan-6-tang-gia-5-ty-5--13697238.html,Bán nhà phố Lạc Long Quân 6 tầng giá 5 tỷ 5.,"Vị trí nhà ngõ đẹp, rộng, thông ra phố Trịnh Công Sơn là phố đi bộ và khu ẩm thực Sen Tây Hồ.  Xung quanh nhiều tiện ích. Gần Lotte Tây Hồ. 
Nhà đẹp như mới. Ở hoặc cho khách nước ngoài thuê đều được.
Ngõ trước nhà trải nhựa sạch sẽ.
Nhà thiết kế thông sàn mỗi tầng 1 phòng.
Sổ vuông đẹp","5,5 tỷ",35 m2,"Đường Lạc Long Quân, Phường Nhật Tân, Quận Tây Hồ, Hà Nội",13697238,_,---,Cần bán,2m,---,Nhà trong hẻm,Sổ hồng/ Sổ đỏ,---,---,6,---,---,5,---,
https://alonhadat.com.vn/nha-mat-pho-vinh-quynh-thanh-tri-dt130m-mt7m-2-tang-gia-16-ty-lo-goc-kd-sam-uat--10375839.html,"NHÀ MẶT PHỐ VĨNH QUỲNH-THANH TRÌ DT230M, MT9M, 3 TẦNG, GIÁ 15TỶ.  KD SẦM UẤT.","Mô tả:
Vị trí gần chợ Quỳnh Đô, gần trường mầm non, trường cấp 1, cấp 2 Vĩnh Quỳnh...Kết nối giao thông Vĩnh Quỳnh - Ngọc Hồi - Đại Áng...
Mặt phố khu vực tiềm năng tương lai phát triển cực tốt, vỉa hè rộng, ô tô dừng đỗ, quay đầu thoải mái.
Vị trí vàng kinh doanh lưu lượng người qua lại đông đúc, miếng đất lô góc, mặt tiền đẹp, diện tích rộng, khách mua đầu tư xây cho thuê văn phòng hoặc kinh doanh tuyệt đỉnh...
+ Sổ đỏ chình chủ.",15 tỷ,130 m2,"Đường Vĩnh Quỳnh, Xã Vĩnh Quỳnh, Huyện Thanh Trì, Hà Nội",10375839,_,---,Cần bán,10m,---,Nhà mặt tiền,---,---,---,3,---,---,5,---,
https://alonhadat.com.vn/lien-ke-iec-tu-hiep-thanh-tri-dt58m-4-tang-mt-5m-gia-9-9-ty-ve-he-kd-sieu-dinh--10650478.html,"LIỀN KỀ IEC TỨ HIỆP-THANH TRÌ DT60M, 4 TẦNG, MT 5M. OTO DỪNG ĐỖ VẺ HÈ KD SIÊU ĐỈNH.","+ Vị trí: Nhà nằm trong khu liền kề vip nhất nhì Thanh Trì, nằm ngay đối diện sân vận động Thanh Trì nơi đang diễn ra Seagames 31. Đối diện là 2 toà chung cư hàng Vạn dân đang sinh sống. Kinh doanh sầm uất.

+ Hiện trạng nhà 4 tầng thô, khách về tự hoàn thiện theo sở thích của mình. Mỗi tầng 1 tầng thông sàn.  

+ Pháp lý: sổ đỏ đẹp, đang trong quá trình bàn giao trong tháng.","9,5 tỷ",60 m2,"Đường Tứ Hiệp, Xã Tứ Hiệp, Huyện Thanh Trì, Hà Nội",10650478,_,True,Cần bán,10m,True,Nhà mặt tiền,---,True,5m,4,True,---,5,---,
