https://alonhadat.com.vn/can-ban-nha-pho-to-vinh-dien-thanh-xuan-dt-60m2-ngo-phan-lo-gia-8-9-ty-13517339.html,Cấn bán Nhà phố Tô Vĩnh Diện - Thanh Xuân. Dt 60m2. Ngõ Phân Lô. Giá 8.9 tỷ,"Cấn bán Nhà phố Tô Vĩnh Diện - Thanh Xuân. Dt 60m2. Ngõ Phân Lô. Giá 8.9 tỷ - Có thương lượng giá.
- Vị trí: Nhà nằm trong ngõ phân lô thông bàn cờ, giao thông đi lại vô cùng thuận lợi, thông Nguyễn Ngọc Nại, Vương Thừa Vũ, hoàng Văn Thái, Khương Trung. Khu vực kinh doanh sầm uất, tập trung nhiều văn phòng đại điện công ty, Khu vực toàn cán bộ ở, dân trí cao.
- Tiện ích nhiều vô kể, không thiếu gì. Bán kính 2km là bệnh viện Y, Bệnh viện Bưu Điện, các trường đại học lớn Đại học Y, Khoa Học Tự Nhiên, Đại học Xã Hội và Nhân Văn, trung tâm thương mại Royal City, Vincom Phạm Ngọc Thạch. 
- Nhà chủ tự xây, khung cột chắc chắn, mảnh đất vượng lộc, chủ rất thiện chí bán.
- Sổ đỏ chính chủ, Pháp lý chuẩn.
- Liên hệ em Chung(1982) để được hỗ trợ xem nhà và làm việc trực tiếp chủ nhà hoàn toàn miễn phí. Bán trực tiếp không qua trung gian.","8,9 tỷ",60 m2,"Phố Tô Vĩnh Diện, Phường Khương Trung, Quận Thanh Xuân, Hà Nội",13517339,_,---,Cần bán,"2,5m",---,Nhà trong hẻm,Sổ hồng/ Sổ đỏ,---,---,4,---,---,4,---
