url,title,description,price,area,address,Mã tin,Hướng,Phòng ăn,Loại tin,Đường trước nhà,Nhà bếp,Loại BDS,Pháp lý,Sân thượng,Chiều ngang,Số lầu,Chổ để xe hơi,Chiều dài,Số phòng ngủ,Chính chủ
https://alonhadat.com.vn/ban-nha-mp-van-tri-o-to-tranh-kd-sam-uat-52m2-4-tang-gia-4-85-ty-12805696.html,"Bán nhà mp Văn Trì,  ô tô tránh,  kd sầm uất,  52m2, 4 tầng,  giá 4,85 tỷ","Nhà mp Văn Trì dân xây chắc chắn,  kd sầm uất,  ngõ thông,  ô tô tránh nhau,  

Nhà thông khắp ngả,  sang Đình Quán,  Ngọa Long,  Phú Minh,  Cầu Diễn,  đường 32, Văn Tiên Dũng

Nhà gần các trường mầm non,  đh,  cấp 1,2,3, sv tập trung đông đúc,  ở hoặc cho thuê hái ra tiền

Nhà dân xây chắc chắn,  có thể chồng thêm 3,4 tầng,  ở hoặc cho thuê,  kd hái ra tiền

Sổ đỏ chính chủ,  nở hậu,  sẵn sàng giao dịch","4,85 tỷ",52 m2,"Đường Vân Trì, Phường Minh Khai, Quận Bắc Từ Liêm, Hà Nội",12805696,_,True,Cần bán,7m,True,Nhà trong hẻm,Sổ hồng/ Sổ đỏ,True,5m,4,True,"10,2m",5,---
https://alonhadat.com.vn/ban-nha-tay-mo-32m2-5-tang-2-thoang-gia-2-65-ty-12794814.html,"Bán nhà Tây Mỗ,  32m2, 5 tầng,  2 thoáng giá 2,65 tỷ","Nhà đẹp ngõ 180 Tây Mỗ,  hàng xóm Vinsmartcity

+ Nhà thiết kế 5 tầng,  mỗi tầng 1 phong khep kín

+ Nhà gần chợ,  gần các trường mầm non,  cấp 1,2,3, gần các siêu thị lớn nhu Aonmall Hà Đông,  đại đô thị Vinsmartcity tiện ích ngập tràn,  

+ Khu vực dân trí cao,  an sinh đỉnh, ở sướng

+ Sổ đỏ Cc,  sẵn sàng giao dịch","2,65 tỷ",32 m2,"Đường Tây Mỗ, Phường Tây Mỗ, Quận Nam Từ Liêm, Hà Nội",12794814,_,True,Cần bán,"2,5m",True,Nhà trong hẻm,Sổ hồng/ Sổ đỏ,True,4m,5,True,8m,3,---
https://alonhadat.com.vn/hiem-nha-phu-dien-o-to-vao-nha-ngo-thong-40m2-5-tang-gia-3-8-ty-12512290.html,"Hiếm,  nhà Phú Diễn,  ô tô vào nhà,  ngõ thông,  40m2, 5 tầng,  giá 3,8 tỷ","Nhà đẹp Phú Diễn,  ngõ thông,  gara,  ô tô vào nhà,  giá quá hiếm

Nhà mới kinh coong,  thiết kế hiện đại trẻ trung,  mỗi tầng 1 phòng rộng rãi thỏa mái

Nhà gần chợ,  gần các trường mầm non,  cấp 1,2,3 HV Cảnh Sát,  Đh Tài Nguyên Môi Trường

Nhà gần các đường lớn như Hồ Tùng Mậu,  Phú Diễn,  Văn Tiến Dũng,  Đức Diễn.... 

Sổ đỏ CC,  sẵn sàng giao dịch","3,8 tỷ",40 m2,"Đường Phú Diễn, Phường Phú Diễn, Quận Bắc Từ Liêm, Hà Nội",12512290,_,---,Cần bán,"3,5m",---,Nhà trong hẻm,Sổ hồng/ Sổ đỏ,---,4m,5,---,10m,4,---
https://alonhadat.com.vn/ban-nha-my-dinh-o-to-tai-qua-nha-ngo-thong-50m2-5-tang-gia-6-35-ty--12847890.html,"Bán nhà Mỹ Đình,  ô tô tải qua nhà, ngõ thông 50m2, 5 tầng, giá 6,35 tỷ,","Nhà Mỹ Đình nơi tập trung đông đuc sinh viên,  dân văn phòng làm việc, ở hoặc cho thuê hái ra tiền

Nhà đẹp,  mới kinh coong,  ngõ thông,  ô tô tải qua nhà,  vừa ở,  vừa cho thuê hái ra tiền

Nhà gần chợ,  gần các trường đh như Đh Thương Mại,  Đh Quốc Gia Hà Nội,  Đh Sư Phạm.. 

Nhà thiết kế 5 tầng,  mới kinh coong,  đầy đủ công năng sử dụng,  mỗi tầng 2 ngủ khép kín

Sổ đỏ chính chủ,  nở hậu,  sẵn sàng giao dịch","6,35 tỷ",50 m2,"Đường Mỹ Đình, Phường Mỹ Đình 1, Quận Nam Từ Liêm, Hà Nội",12847890,_,True,Cần bán,4m,True,Nhà trong hẻm,Sổ hồng/ Sổ đỏ,True,4m,5,True,"12,5m",6,---
https://alonhadat.com.vn/ban-dat-phu-dien-lo-goc-o-to-tranh-cach-100m-35m2-gia-1-75-ty-12012989.html,"Bán đất Phú Diễn,  lô góc, ô tô tránh cách 100m, 35m2, giá 1,75 tỷ","+ Đất đẹp Phú Diễn,  3 gác tránh xe máy thỏa mái,  lô góc,  xây lên rất đẹp
+ Chủ nhà tặng bản thiết kế xây dựng cực kỳ đẹp,  
+ Đất cách ô tô tránh 100m, ngõ thông,  view đẹp,  ngõ rộng thông thoáng
+ Đất gần Văn Tiến Dũng,  Hồ Tùng Mậu,  Phú Diễn
+ Đất gần chợ,  gần trường mầm non,  cấp 1,2,3, gần Đh Tài Nguyên Môi Trường
+ Sđcc,  sẵn sàng giao dịch","1,75 tỷ",35 m2,"Đường Phú Diễn, Phường Phú Diễn, Quận Bắc Từ Liêm, Hà Nội",12012989,_,---,Cần bán,"2,5m",---,"Đất thổ cư, đất ở",Sổ hồng/ Sổ đỏ,---,5m,---,---,7m,---,---
https://alonhadat.com.vn/mat-ngo-phu-dien-o-to-tranh-kinh-doanh-dinh-44m2-3-tang-gia-3-9-ty-12847836.html,"Mặt ngõ Phú Diễn,  ô tô tránh,  kinh doanh đỉnh,  44m2, 3 tầng,  giá 3,9 tỷ","Hiếm,  mặt ngõ Phu Diễn,  kinh doanh đỉnh,  sầm uất,  sổ đẹp,  nở hậu

Nhà 3 tầng cũ,  cho thuê 12 tr/1 tháng,  chủ mới về đập đi xây lại hái ra tiền

Nhà gần chợ,  gần các trường đh như Đh Tài Nguyên Môi Trường,  Đh Công Nghiệp,  Hv Cảnh Sát,  gần các trường cấp 1,2,3, 

Sổ đỏ chính chủ,  nở hậu,  sẵn sàng giao dịch","3,9 tỷ",44 m2,"Đường Phú Diễn, Phường Phú Diễn, Quận Bắc Từ Liêm, Hà Nội",12847836,_,True,Cần bán,6m,True,Nhà trong hẻm,Sổ hồng/ Sổ đỏ,True,"4,3m",3,True,"10,5m",2,---
https://alonhadat.com.vn/ban-nha-nga-tu-canh-o-to-do-gan-lo-goc-38m2-4-tang-gia-2-7-ty-11615862.html,"Bán nhà ngã tư Canh, ô tô đỗ gần, lô góc 38m2, 4 tầng, giá 2,7 tỷ","+Nhà ngay ngã tư Canh,  gần chợ,  gần các trường cấp 1,2,3
+ Gần các đường lớn như Trịnh Văn Bô,  Xuân Phương,  Hòe Thị
+ Ngõ thông tứ tung khắp khả,  lô góc 2 thoáng,  nhà dân xây cực kỳ chắc chắn và tỉ mỉ
+ sổ đỏ chính chủ,  sẵn sàng giao dịch","2,7 tỷ",38 m2,"Đường An Trai, Xã Vân Canh, Huyện Hoài Đức, Hà Nội",11615862,_,---,Cần bán,3m,---,Nhà trong hẻm,Sổ hồng/ Sổ đỏ,---,---,4,---,---,4,---
https://alonhadat.com.vn/ban-dat-phu-minh-sat-quan-uy-bac-tu-liem-o-to-vao-dat-42m2-gia-2-05-ty-11696635.html,"Bán đất Phú Minh,  sát Quận Ủy Bắc Từ Liêm,  ô tô vào đất,  42m2, giá 2,05 tỷ","+ Quận ủy Bắc Từ Liêm đang phát triển từng ngày,  tương lai là Mỹ Đình 2 của Bắc Từ Liêm
+ Nhà gần các đường lớn như Văn Tiến Dũng,  đường 8 làn xe thông lên Đan Phượng,  đường Phú Minh
 + Nhà gần chợ,  gần các trường mầm non,  cấp 1,2,3, trường đh CôNg Nghiệp,  Hv CSND,... 
+ đầu tư,  giữ tiền hoặc xây nhà đều quá tốt,  gia lên từng ngày
+ Sổ đỏ chính chủ,  sẵn sàng giao dịch","2,05 tỷ",42 m2,"Đường Phú Minh, Phường Minh Khai, Quận Bắc Từ Liêm, Hà Nội",11696635,_,---,Cần bán,5m,---,"Đất thổ cư, đất ở",Sổ hồng/ Sổ đỏ,---,---,---,---,---,---,---
https://alonhadat.com.vn/ban-dat-phu-minh-sat-quan-uy-moi-o-to-do-gan-42m2-gia-2-2-ty-12656151.html,"Bán đất Phú Minh, sát Quận Ủy mới,   ô tô đỗ gần,  42m2, giá 2,2 tỷ","Đất Phú Minh,  sát Quận Ủy Bắc Từ Liêm mới,  42m2, mặt tiền 4,5 mét

Khu vực phát triển từng ngày,  2,3 năm nữa như Mỹ Đình 2,

Đất đẹp,  không lỗi lầm,  mặt tiền rộng,  thoáng,  

Gần chợ,  gần các trường mầm non,  cấp 1,2,cấp 3 Minh Khai,  gần Hv Cảnh Sát,  Đh Công Nghiệp

Gần các đường lớn như Văn Tiên Dũng,  vành đai 3.5, Phú Minh,  

Sổ đẹp,  vuông vắn,  sẵn sàng giao dịch","2,2 tỷ",42 m2,"Đường Phú Minh, Phường Minh Khai, Quận Bắc Từ Liêm, Hà Nội",12656151,_,---,Cần bán,3m,---,"Đất thổ cư, đất ở",Sổ hồng/ Sổ đỏ,---,"4,5m",---,---,"9,5m",---,---
https://alonhadat.com.vn/ban-nha-lien-mac-32m2-5-tang-gia-1-6-ty-11638325.html,"Bán nhà Liên Mạc,  32m2, 5 tầng,  giá 1,6 tỷ","Nhà gần chợ,  gần các trường mầm non,  cấp 1,2,3 
Cách Học Viện Cảnh Sat 3km, cách Quận Ủy Băc Tư Liêm mới 2km, 
Nhà dân xây 5 tầng kiên cố,  ô tô đỗ gần,  đầy đủ công năng sử dụng
Sđcc,  sẵn sàng giao dịch","1,6 tỷ",32 m2,"Đường Liên Mạc, Phường Liên Mạc, Quận Bắc Từ Liêm, Hà Nội",11638325,_,---,Cần bán,3m,---,Nhà trong hẻm,Sổ hồng/ Sổ đỏ,---,---,5,---,---,3,---
https://alonhadat.com.vn/ban-nha-huu-hung-43-m2-4-tang-gia-2-8-ty-11223505.html,"Bán nhà Hữu Hưng,  43 m2, 4 tầng,  giá 2,8 tỷ","NGO thông,  ô tô đỗ cửa, hàng xóm Vinsmart,  
Nhà xây 4 tầng mới kinh coong,  giao thông thuận lợi,
Phố Hữu Hưng là. Nơi giao thoa giữa Nam Từ Liêm và Hà Đông,  đi đâu cũng thuận lợi
Gần Aonmall Hà Đông,  gần chợ,  các trường câp 1,2,3
Thiết kế hiện đại phong cách Châu Âu,  mỗi tầng 1 phòng ngủ,  
Sổ đỏ cất két,  sẵn sàng giao dịch","2,8 tỷ",43 m2,"Đường Hữu Hưng, Phường Tây Mỗ, Quận Nam Từ Liêm, Hà Nội",11223505,_,---,Cần bán,"3,5m",---,Nhà trong hẻm,Sổ hồng/ Sổ đỏ,---,---,---,---,---,5,---
https://alonhadat.com.vn/ban-dat-lien-mac-o-to-tranh-view-ho-32m2-gia-1-9-ty-12656036.html,"Bán đất Liên Mạc,  ô tô tránh,  view hồ,  32m2, giá 1,9 tỷ","Đất đẹp vjew hồ,  ô tô tránh nhau,  giá cực hiếm

Đất Liên Mạc gần Ủy Ban ND phường Liên Mạc,  gần chợ,  gần các trường mầm non,  cấp 1,2

Cách Đh Công Nghiệp 3km, HV cảnh sát nhân dân 3km, gần các đường lớn Văn Tiến Dũng,  đường 70, đường Liên Mạc

Sổ CC,  nở hậu,  sẵn sàng giao dịch","1,9 tỷ",32 m2,"Đường Liên Mạc, Phường Liên Mạc, Quận Bắc Từ Liêm, Hà Nội",12656036,_,---,Cần bán,5m,---,"Đất thổ cư, đất ở",Sổ hồng/ Sổ đỏ,---,"3,8m",---,---,"8,5m",---,---
https://alonhadat.com.vn/ban-dat-cau-coc-hang-xom-vinsmart-35m2-gia-1-5-ty-12682437.html,"Bán đất Cầu Cốc,  hàng xóm Vinsmart,    35m2, giá 1,5 tỷ","Đất Cầu Cốc sat Vinsmart City,  khu vực tăng giá hàng ngày

Khu vực có nhiều dự án lớn như Aonmal Hà Đông,  Vinsmart City,  Gleximco Lê Trọng Tấn

Gần chợ,  gần trường học,  thông khắp ngả,  lên Mỹ Đình 10 phút chạy xe,  về Hà Đông 5 phút

Sổ đỏ chính chủ,  sẵn sàng giao dịch","1,5 tỷ",35 m2,"Đường Cầu Cốc, Phường Tây Mỗ, Quận Nam Từ Liêm, Hà Nội",12682437,_,---,Cần bán,3m,---,"Đất thổ cư, đất ở",Sổ hồng/ Sổ đỏ,---,7m,---,---,5m,---,---
https://alonhadat.com.vn/ban-nha-cau-coc-hang-xom-vinsmart-35m2-5-tang-2-6-ty-11261772.html,"Bán nhà Cầu Cốc, hàng xóm Vinsmart,   35m2,5 tầng,  2,6 tỷ","Nhà Cầu Cốc mới xây 5 tầng, hàng xóm Vinsmart,  gần chợ,  gần các trường cấp 1,2,3
Gần Aonmall Hà Đông,  đi lên Mỹ Đình 7 phút
Nhà dân xây 5 tầng,  tầng 1 bếp+ khách,  tầng 2 mỗi tầng 1 phòng ngủ+ Wc,  tầng 5 phòng thờ,  sân phơi
Sổ đỏ cất két,  sẵn sàng giao dịch","2,6 tỷ",35 m2,"Đường Cầu Cốc, Phường Tây Mỗ, Quận Nam Từ Liêm, Hà Nội",11261772,_,---,Cần bán,3m,---,Nhà trong hẻm,Sổ hồng/ Sổ đỏ,---,---,---,---,---,3,---
https://alonhadat.com.vn/dat-dep-pho-tu-hoang-o-to-7-cho-qua-50m2-mt-5m-gia-3-75-ty-12953336.html,"Đất đẹp Phố Tu Hoàng,  ô tô 7 chỗ qua,  50m2, mt 5m, giá 3,75 tỷ","Hiện trạng là nhà cấp 4, chủ xác định bán đất tặng nhà

Nhà ô tô 7 chỗ qua,  sat Đại Học Công Nghiệp,  cách mp Xuân Phương 60m, 

Đất đẹp,  khu vực hiếm nhà bán,  phù hợp xây chung cư mini hoặc nhà đều hợp lý, 

Sv tập trung đông đuc, mặt tiền rộng,  

Sổ đỏ cc,  sẵn sàng giao dịch","3,75 tỷ",50 m2,"Đường Xuân Phương, Phường Phương Canh, Quận Nam Từ Liêm, Hà Nội",12953336,_,---,Cần bán,"3,5m",---,"Đất thổ cư, đất ở",Sổ hồng/ Sổ đỏ,---,5m,---,---,10m,---,---
https://alonhadat.com.vn/ban-nha-tay-mo-2-thoang-35m2-5-tang-o-to-tranh-cach-nha-150m-gia-2-65-ty-12733990.html,"Bán nhà Tây Mỗ, 2 thoáng,   35m2, 5 tầng,  ô tô tránh cách nhà 150m, giá 2,65 tỷ","Nhà trong ngõ 180 Tây Mỗ, hàng xóm Vinsmart City

Nhà thiết kế 5 tầng,  đầy đủ công năng sử dụng,  hợp lý,  an sinh đỉnh,  dân trí cao,  tiện ích ngập tràn

Nha gần chợ,  gần trường học các cấp,  gần siêu thị Aonmall Hà Đông

Sổ đỏ Cc,  sẵn sàng giao dịch","2,65 tỷ",35 m2,"Đường Tây Mỗ, Phường Tây Mỗ, Quận Nam Từ Liêm, Hà Nội",12733990,_,True,Cần bán,"2,5m",True,Nhà trong hẻm,Sổ hồng/ Sổ đỏ,True,4m,5,---,"8,8m",3,---
https://alonhadat.com.vn/ban-nha-tu-hoang-o-to-do-gan-35m2-5-tang-gia-2-8-ty-12728028.html,"Bán nhà Tu Hoàng,  ô tô đỗ gần,  35m2, 5 tầng,  giá 2,8 tỷ","Nhà phố Tu Hoàng,  ô tô đỗ gần,  ngõ thông,  bãi đỗ ô tô cách nhà 100m

Khu vực sinh viên tập trung đông đúc,  3 bước chân ra trường quốc tế Phanika,  2 phút ra đh Công Nghiệp,  

Nhà thiết kế 5 tầng,  đầy đủ công năng sử dụng,  phòng ngủ Master, Wc khép kín rất hợp lý sử dụng

Gần quốc lộ 32, khu tái định cư Tu Hoàng,  ở hoặc cho thuê đều hợp lý

Sổ đẹp,  nở hậu,  sẵn sàng giao dịch","2,8 tỷ",35 m2,"Đường Tu Hoàng, Phường Phương Canh, Quận Nam Từ Liêm, Hà Nội",12728028,_,True,Cần bán,"2,5m",True,Nhà trong hẻm,Sổ hồng/ Sổ đỏ,True,4m,5,---,"8,5m",3,---
https://alonhadat.com.vn/ban-nha-sat-truong-phenika-lo-goc-o-to-do-cua-50m2-5-tang-gia-5-2-ty--12367042.html,"Bán Nhà sát trường Phenika, lô góc,  ô tô đỗ cửa,   50m2, 5 tầng, giá 4,8 tỷ,","Nhà đẹp mới xây, lô góc,  ô tô vào tận nhà,  
+ Nhà sát trường Quốc Tế Phenika, gần trường đh Công Nghiệp Hà Nội
+ Nhà gần chợ,  gần các khu công Nghiệp,  ở hoặc làm việc đều thuận lợi
+ Nhà thiêt kê 5 tầng,  lô góc,  mỗi tầng 2 ngủ,  thiết kế đầy đủ công năng sử dụng theo phong Cách Châu Âu,  
+ Sổ đỏ chính chủ,  sẵn sàng giao dịch","4,8 tỷ",50 m2,"Đường Tu Hoàng, Phường Phương Canh, Quận Nam Từ Liêm, Hà Nội",12367042,_,---,Cần bán,5m,---,Nhà trong hẻm,Sổ hồng/ Sổ đỏ,---,6m,5,---,"8,5m",6,---
https://alonhadat.com.vn/ban-nha-tu-hoang-o-to-do-cua-35m2-5-tang-gia-3-5-ty-12730784.html,"Bán nhà Tu Hoàng,  ô tô đỗ cửa,  35m2, 5 tầng,  giá 3,5 tỷ","Nhà phố Tu Hoàng xây mới kinh coong,  xây 5 tầng,  đầy đủ công năng sử dụng,  mỗi tầng 1 phòng to,  wc khép kín

Tu Hoàng nơi tập trung của nhiều trường đh như Đh Công Nghiệp,  đh Đông á,  Cđ FPT,  trường quốc tế Phanikka

Nhà gần chợ,  gần trường học,  gần trung tâm anh văn,  quốc tế

Nhà gần các đường lớn như 32, Tu Hoàng,  Xuân Phương

Sổ đỏ cc,  sẵn sàng giao dịch","3,5 tỷ",35 m2,"Đường Tu Hoàng, Phường Phương Canh, Quận Nam Từ Liêm, Hà Nội",12730784,_,True,Cần bán,4m,True,Nhà trong hẻm,Sổ hồng/ Sổ đỏ,True,"3,8m",5,True,9m,3,---
https://alonhadat.com.vn/ban-dat-yen-noi-ngo-thong-o-to-vao-tan-dat-30m2-gia-1-53-ty-11840263.html,"Bán đất Yên Nội,  ngõ thông,  ô tô vào tận đất,  30m2, giá 1,53 tỷ","Đất Liên Mạc đang lên từng ngày,  lô đất đẹp,  nở hậu,  ngõ thông,  ô tô để trong nhà
+ Khu vực là trung tâm phường Liên Mạc,  kd sầm uât
+ Gần các đường lớn như Văn Tiến Dũng,  Sùng Khang,  Liên Mạc
+ Gần chợ,  trường mầm non,  cấp 1,2,3, Đh Công Nghiệp,  Hv Cảnh Sát Nhân Dân
+ Sổ nở hậu,  sẵn sàng giao dịch","1,53 tỷ",30 m2,"Đường Yên Nội, Phường Liên Mạc, Quận Bắc Từ Liêm, Hà Nội",11840263,_,---,Cần bán,3m,---,"Đất thổ cư, đất ở",Sổ hồng/ Sổ đỏ,---,---,---,---,---,---,---
