https://alonhadat.com.vn/sieu-pham-hoang-hoa-tham-gan-pho-ngo-nong-noi-that-xin-so-vuong-35m-5t-mt-5-3m-chi-5ty-13642333.html,"SIÊU PHẨM Hoàng Hoa Thám,GẦN PHỐ,NGÕ NÔNG,NỘI THẤT XỊN,SỔ VUÔNG 35m 5T MT 5,3m chỉ 5tỷ","Bán nhà Hoàng Hoa Thám,Ba Đình.
+ Vị trí rất đẹp, trung tâm Ba Đình, chỉ 50m ra Phố, ngõ rộng, sạch thoáng, nhà thuộc khu dân trí cao, an ninh tốt.
+ Nhà dân xây rất tâm huyết cẩn thận, tỉ mỉ, thoáng trước sau, thiết kế hiện đại, thẩm mỹ.
+ Diện tích 35m2, 5 tầng, MẶT TIỀN 5.3M, các phòng ngủ đủ công năng.
+ Gía bán chỉ 5 tỷ.
+ Sổ đỏ chính chủ,vuông đẹp, pháp lý chuẩn sẵn sàng giao dịch ngay.
☎️Lh Mrs Huyền",5 tỷ,35 m2,"Đường Hoàng Hoa Thám, Phường Vĩnh Phúc, Quận Ba Đình, Hà Nội",13642333,_,---,Cần bán,"2,5m",---,Nhà trong hẻm,Sổ hồng/ Sổ đỏ,---,"5,3m",5,---,---,4,---,
https://alonhadat.com.vn/nha-dep-dan-xay-thuy-khue-10m-ra-pho-noi-that-xin-so-vuong-40m-5t-mt-3-8m-nhinh-5ty-13646964.html,"NHÀ ĐẸP dân xây Thụy Khuê,10m ra phố,NỘI THẤT XỊN,SỔ VUÔNG 40m 5T MT 3.8m nhỉnh 5tỷ","Bán nhà Thụy khuê, Tây Hồ
+ Vị trí rất đẹp, cách mặt phố Thụy Khuê chỉ 10m, khu vực vô vàn tiện ích, rất gần Chu Văn An, Công viên Bách Thảo, vài phút đi bộ ra thể dục Hồ Tây. 
+ Khu vực trung tâm nội thành, rất gần Lăng Bác, Phố Cổ, Hồ Gươm Bán kính chỉ tầm 1km.
+ Hàng xóm rất thân thiện không khí trong lành, dân trí cao, chất lượng cuộc sống tốt.
+ Nhà dân xây rất tâm huyết tỉ mỉ, thiết kế hợp lý. Diện tích 40m2, 5 tầng, MT 3.8m các phòng ngủ đủ công năng.
+ Gía bán nhỉnh 5 tỷ.
+ Sổ đỏ chính chủ,vuông đẹp, pháp lý chuẩn sẵn sàng giao dịch ngay.
☎️Lh Mrs Huyền","5,9 tỷ",40 m2,"Đường Thụy Khuê, Phường Thụy Khuê, Quận Tây Hồ, Hà Nội",13646964,_,---,Cần bán,"2,5m",---,Nhà trong hẻm,Sổ hồng/ Sổ đỏ,---,"3,8m",5,---,---,4,---,
https://alonhadat.com.vn/sieu-pham-hoang-doi-can-10m-ra-pho-noi-that-xin-so-vuong-38m-5t-mt-3-8m-nhinh-5ty-13648145.html,"SIÊU PHẨM Đội Cấn,10m ra phố,NỘI THẤT XỊN,SỔ VUÔNG 38m 5T MT 3.8m nhỉnh 5tỷ","Bán nhà Đội Cấn, Ba Đình.
+ Vị trí rất đẹp, cách mặt phố chỉ 10m, khu vực vô vàn tiện ích, gần nhiều Trường học các cấp, Công viên,....
+ Khu vực trung tâm nội thành, rất gần Lăng Bác, Phố Cổ, Hồ Gươm Bán kính chỉ tầm 1km.
+ Hàng xóm rất thân thiện không khí trong lành, dân trí cao, chất lượng cuộc sống tốt.
+ Nhà dân xây rất tâm huyết tỉ mỉ, thiết kế hợp lý. Diện tích 38m2, 5 tầng, MT 3.8m các phòng ngủ đủ công năng.
+ Gía bán nhỉnh 5 tỷ.
+ Sổ đỏ chính chủ,vuông đẹp, pháp lý chuẩn sẵn sàng giao dịch ngay.
☎️Lh Mrs Huyền","5,8 tỷ",38 m2,"Phố Đội cấn, Phường Đội Cấn, Quận Ba Đình, Hà Nội",13648145,_,---,Cần bán,"2,5m",---,Nhà trong hẻm,Sổ hồng/ Sổ đỏ,---,"3,8m",5,---,---,4,---,
