url,title,description,price,area,address,Mã tin,Hướng,Phòng ăn,Loại tin,Đường trước nhà,Nhà bếp,Loại BDS,Pháp lý,Sân thượng,Chiều ngang,Số lầu,Chổ để xe hơi,Chiều dài,Số phòng ngủ,Chính chủ
https://alonhadat.com.vn/ban-nha-pho-nguyen-ngoc-nai-42m2-8-tang-thang-may-gara-o-to-kinh-doanh-vp-o-13487752.html,"BÁN NHÀ PHỐ NGUYỄN NGỌC NẠI, 42M2, 8 TẦNG THANG MÁY-GARA Ô TÔ-KINH DOANH-VP-Ở","+ Vị trí: Nhà nằm vị trí đẹp và trung tâm của quận Thanh Xuân, trong khu phân lô toàn quan chức Quân đội, ngõ thông tứ ngả Trường Chinh, Hoàng Văn Thái, Ngã Tư Sở, Lê Trọng Tấn, gara ô tô, ô tô dừng đỗ.
+ Thiết kế: Nhà chủ mới xây, thiết kế hiện đại, 8 tầng thang máy + thang bộ,thông sàn,thông thoáng tiện lợi kinh doanh,văn phòng. Nội thất nhập khẩu cao cấp.
* T1: Gara ô tô, kinh doanh, vệ sinh.
* T2: Khách, bếp, Vệ sinh.
* T3,4,5, 6: Mỗi tầng 1 phòng khép kín.
* T7: Phòng thờ, phòng sinh hoạt chung.
* T8: Phòng kỹ thuật thang máy, sân thượng.
+ Sổ đỏ: Vuông vức, chính chủ, sẵn sàng giao dịch.
- Liên hệ: Em Mạnh Hà để xem nhà.","10,5 tỷ",42 m2,"Phố Nguyễn Ngọc Nại, Phường Khương Mai, Quận Thanh Xuân, Hà Nội",13487752,_,True,Cần bán,7m,True,Nhà trong hẻm,Sổ hồng/ Sổ đỏ,True,---,8,True,---,4,---
https://alonhadat.com.vn/ban-manh-dat-duong-doi-19-to-huu-van-phong-quoc-hoi-40m-chi-6-9-ty-13662062.html,Bán Mảnh Đất Đường Đôi 19 Tố Hữu - Văn Phòng Quốc Hội 40M-Chỉ 6.9 Tỷ,"Bán Mảnh Đất Đường Đôi 19 Tố Hữu - Văn Phòng Quốc Hội 40M-Chỉ 6.9 Tỷ
+ Nằm trong văn phòng quốc hội ngõ 258 Lương Thế Vinh thông trục đường đôi ngõ 19 Tố Hữu chung cư Bắc Hà
+ Sổ đỏ 40m đường trước nhà rộng 10m vỉa hẻ 3m
+ Xây ở văn phòng tuyệt đẹp
+ Sổ đỏ chính chủ vuông vắn","6,9 tỷ",40 m2,"Đường Tố Hữu, Phường Trung Văn, Quận Nam Từ Liêm, Hà Nội",13662062,_,---,Cần bán,10m,---,"Đất thổ cư, đất ở",Sổ hồng/ Sổ đỏ,---,4m,1,---,10m,1,---
https://alonhadat.com.vn/ban-toa-nha-van-phong-9-tang-mat-pho-kham-thien-dt-310m2-mt-11m-gia-170-ty-13736395.html,Bán toà nhà Văn Phòng 9 tầng mặt phố Khâm Thiên Dt 310m2 Mt 11m. Giá 170 tỷ,"Tôi cần bán gấp toà nhà văn phòng vip 9 tầng xây mới mặt phố Khâm Thiên, vị trí đắc địa….
Diện tích 310m2, Mặt tiền 11m.
Tòa nhà xây mới 8 tầng nổi, 1 tum và 1 tầng hầm
Nội thất hiện đại, sang trọng. Thang máy nhập khẩu nguyên bộ Mitsubishi, hệ thống điều hoà Daikin, Thiết bị vệ sinh Toto, vách kính mặt tiền 2 lớp cách âm cách nhiệt, hệ thống phòng cháy hiện đại đúng tiêu chuẩn.
Vị Trí đắc địa tại mặt phố Khâm Thiên, giao thông cực thuận tiện ra ngã 6 Ô chợ Dừa, Lê Duẩn, Giải Phóng… Phù hợp xây tòa nhà Văn phòng 8 tầng thang máy
Khu phố kinh doanh sầm uất, đa dạng, phù hợp mọi loại hình: Ngân hàng, công ty, phòng khám, trung tâm ngoại ngữ, thẩm mỹ viện, spa....
Giá Bán 170 tỷ. Sổ đỏ chính chủ
Liên Hệ: Phùng Tình
( Anh/Chị liên hệ để được tư vấn và xem nhà hoàn toàn miễn phí).
Trân trọng cảm ơn Anh/Chị đã xem qua tin đăng này!",170 tỷ,310 m2,"Phố Khâm Thiên, Phường Khâm Thiên, Quận Đống Đa, Hà Nội",13736395,_,---,Cần bán,20m,---,Văn phòng,Sổ hồng/ Sổ đỏ,---,11m,9,---,"28,2m",---,---
https://alonhadat.com.vn/ban-dat-pho-cu-chinh-lan-65m2-thoang-truoc-sau-o-to-tranh-khu-p-lo-quan-doi-an-ninh-dan-13588662.html,"BÁN ĐẤT PHỐ CÙ CHÍNH LAN 65M2, THOÁNG TRƯỚC SAU, Ô TÔ TRÁNH, KHU P.LÔ QUÂN ĐỘI-AN NINH DÂN","- Hiện trạng trên đất là nhà cấp 4, đất ở vị trí vàng của phố, phía trước nhà là tường của cơ quan thoáng vĩnh viễn, sau nhà có khe thoáng rộng 60cm, đường thông tứ phía, đi lại thuận tiện, thông ra Phố Hoàng Văn Thái, Vương Thừa Vũ, Lê Trọng Tấn, Trường Chinh, Khương Trung....
- Khu vực phân lô quân đội, an ninh dân trí cao, xung quanh là các nhà cao tầng mới xây, gần nhiều tiện ích như: Bệnh viện Đại học Y, Bạch Mai, các trường đại học Thủy Lợi, Công Đoàn, Ngân Hàng, Kinh Tế, Xây Dựng, Bách Khoa... Khách mua về có thể xây lên 7 tầng thang máy cho thuê làm văn phòng, kinh doanh hoặc ở đều rất tuyệt.
- Sổ đỏ vuông vắn, thông số đẹp, sẵn sàng sang tên.
- Liên hệ: Mạnh Hà để làm việc chính chủ (không tiếp MG, TG).","10,5 tỷ",65 m2,"Phố Cù Chính Lan, Phường Khương Trung, Quận Thanh Xuân, Hà Nội",13588662,_,---,Cần bán,7m,---,"Đất thổ cư, đất ở",---,---,---,---,---,---,---,---
https://alonhadat.com.vn/ban-dat-mat-pho-dai-linh-trung-van-140m-3-mat-tien-dai-25m-gia-chi-24-5-ty-xay-buildin-13687162.html,Bán Đất Mặt Phố Đại Linh - Trung Văn 140M-3 Mặt Tiền Dài 25M Giá Chỉ 24.5 Tỷ - Xây Buildin,"Lô Góc 3 Mặt Thoáng - Đường Oto Tránh Nhau. Một mặt phố 2 mặt phân lô
+ Mua xây Văn Phòng, giữ tiền đua 3 mặt gần 200M2
+ Sổ Đẹp -2 Sổ Của 2. Lô Góc
Liên Hệ: Em Thiệp
Lô Góc 3 Mặt Thoáng - Đường Oto Tránh Nhau. Một mặt phố 2 mặt phân lô
+ Mua xây Văn Phòng, giữ tiền đua 3 mặt gần 200M2
+ Sổ Đẹp -2 Sổ Của 2. Lô Góc
Liên Hệ: Em Thiệp","24,5 tỷ",140 m2,"Đường Trung Văn, Phường Trung Văn, Quận Nam Từ Liêm, Hà Nội",13687162,_,---,Cần bán,15m,---,Nhà mặt tiền,Sổ hồng/ Sổ đỏ,---,23m,1,---,10m,1,---
https://alonhadat.com.vn/ban-dat-pho-bui-xuong-trach-42m2-mt3-5m-gia-re-nhat-thi-truong-nhinh-3-ty-13601350.html,"BÁN ĐẤT PHỐ BÙI XƯƠNG TRẠCH 42M2, MT3,5M; GIÁ RẺ NHẤT THỊ TRƯỜNG NHỈNH 3 TỶ","- Hiện trạng trên đất là nhà cấp 4 đang cho thuê, cách hồ Đầm Hồng chỉ 100m, vị trí đi lại thuận tiện gần các trường mầm non, tiểu học, trung học cơ sở, rất tốt cho con cái học tập sau này, ra Phố Hoàng Văn Thái, Vương Thừa Vũ, Lê Trọng Tấn, Trường Chinh, Khương Trung....
- Giá rẻ nhất thị trường hiện nay chưa đến 80 triệu/m2; Có thể đầu tư giữ tiền hoặc xây nhà ở, cho thuê.
- Sổ đỏ chính chủ vuông vắn, nở hậu, thông số đẹp, sẵn sàng sang tên.
- Liên hệ: Mạnh Hà để làm việc chính chủ (không tiếp MG, TG).","3,25 tỷ",42 m2,"Đường Bùi Xương Trạch, Phường Khương Đình, Quận Thanh Xuân, Hà Nội",13601350,_,---,Cần bán,2m,---,"Đất thổ cư, đất ở",Sổ hồng/ Sổ đỏ,---,---,---,---,---,---,---
https://alonhadat.com.vn/ban-nha-mat-pho-vong-56-64m-5t-mt4-4m-gia-chi-con-20-ty-gia-cua-nam-2020-ngay-dh-ktqd-13685534.html,Bán Nhà Mặt Phố Vọng 56/64M-5T-MT4.4M Giá Chỉ Còn 20 Tỷ- Giá Của Năm 2020. - Ngay ĐH KTQD,"Bác Chủ Đã Cần Bán Nhà Mặt Phố Vọng Đoạn Đẹp Nhất Phố Giáp ĐH Kinh Tế Quốc Dân.
+ Vỉa Hè Rộng Kinh Doanh Tốt
+ Giá Rao Bán Chỉ Còn 20 Tỷ - Giá Của Năm 2020 Khi Bác Có Ý Định Bán.
+ Sổ Đỏ Nở Hậu Đẹp
Liên Hệ: E Thiệp:",20 tỷ,64 m2,"Phố Vọng, Phường Đồng Tâm, Quận Hai Bà Trưng, Hà Nội",13685534,_,---,Cần bán,20m,---,Nhà mặt tiền,Sổ hồng/ Sổ đỏ,---,"4,4m",5,---,18m,4,---
https://alonhadat.com.vn/ban-can-ho-90m2-3-phong-ngu-full-noi-that-chung-cu-283-khuong-trung-13275400.html,"BÁN CĂN HỘ 90M2, 3 PHÒNG NGỦ, FULL NỘI THẤT, CHUNG CƯ 283 KHƯƠNG TRUNG","Gia đình cần bán gấp căn hộ 90m2, 3 phòng ngủ, 2WC,full nội thất hiện đại và mới; điều hòa mutil 2 chiều của Daikin; Có slot ô tô:
- Vị trí trung tâm gần ngã tư Sở, rất thuận tiện đi lại và gần các tiện ích như: Bệnh viện Đại học Y, BV Bạch Ma; trường đại học Thủy lợi, Ngân hàng, Xây dựng, Kinh tế quốc dân, Bách Khoa; trường mầm non, trường tiểu học và trung học Nguyễn Trãi.....
- Khu chung cư của Viện Khoa học hình sự - Bộ Công An nên an ninh rất tốt, dân trí cao, hàng xóm là công an, ngân hàng, về hưu.
- Sổ đỏ sẵn két.
- Gía bán: 3,XXX tỷ.
- Liên hệ: Mr. Mạnh Hà","3,6 tỷ",90 m2,"283 Đường Khương Trung, Phường Khương Trung, Quận Thanh Xuân, Hà Nội",13275400,_,---,Cần bán,---,---,Căn hộ chung cư,Sổ hồng/ Sổ đỏ,---,---,---,---,---,3,---
https://alonhadat.com.vn/ban-dat-dv-mau-luong-50m-mt4m-kinh-doanh-gia-5-6-ty-khong-loi-13675477.html,Bán Đất DV Mậu Lương 50M-MT4M Kinh Doanh Giá 5.6 Tỷ - Không Lỗi,"Bán Đất DV Mậu Lương 50M-MT4M Kinh Doanh Giá 5.6 Tỷ - Không Lỗi 
+ Đường rộng 7M- Vỉa Hè 3m hai bên. 
+ Kinh doanh, ở làm văn phòng tuyệt đẹp
+ Ngay chung cư Mipec quân đội an ninh tốt, dân trí cáo
+ Sổ đỏ vuông vắn - chủ thiện chí bán","5,6 tỷ",50 m2,"Đường Mậu Lương, Phường Kiến Hưng, Quận Hà Đông, Hà Nội",13675477,_,---,Cần bán,7m,---,"Đất thổ cư, đất ở",Sổ hồng/ Sổ đỏ,---,4m,1,---,"12,5m",1,---
https://alonhadat.com.vn/ban-nha-sieu-mp-xa-la-nguyen-khuyen-ha-dong-120m-4t-mt8m-2-mat-tien-gia-26-5-ty-kd-sam-u-12821591.html,"Bán Nhà Siêu MP Xa La Nguyễn Khuyến Hà Đông 120M,4T,MT8M, 2 Mặt Tiền Giá 26.5 Tỷ- KD Sầm U","Bán Nhà Siêu MP Xa La Nguyễn Khuyến Hà Đông 120M,4T,MT8M, 2 Mặt Tiền Giá 26.5 Tỷ- KD Sầm Uuất

Nhà Mặt Phố Đường Đôi Rộng 60M, Ngay cạnh 3 Ngân Hàng lớn- Vỉa Hè rộng 8M, Sau nhà vườn hoa rộng mênh mông.
Sổ đỏ vuông vắn- đã hoàn công
Chủ nhà làm quan chức tự xây dựng rất chắc chắn và nhiều lộc.
Liên hệ: Mr Thiệp","26,5 tỷ",120 m2,"9 Đường Nguyễn Khuyến, Phường Văn Quán, Quận Hà Đông, Hà Nội",12821591,_,True,Cần bán,60m,True,Nhà mặt tiền,Sổ hồng/ Sổ đỏ,True,8m,4,True,15m,6,---
https://alonhadat.com.vn/ban-toa-nha-vp-9-tang-nguyen-thi-dinh-hoang-ngan-dt-120m2-mt-11m-gia-120-ty-13736378.html,Bán tòa nhà VP 9 tầng Nguyễn Thị Định- Hoàng Ngân Dt 120m2 Mt 11m. GIÁ = 120 tỷ,"Bán nhanh tòa văn phòng mặt phố Hoàng Ngân- Nguyễn Thị Định quận CẦU GIẤY -HÀ NỘI
Thiết kế xây dựng tầng nổi và hầm, vỉa hè oto, đường thông hè thoáng, xung quanh đều là các tòa văn phòng, vị trí nằm ngay ngã tư giữa hai phố chính
Diện tích 178m, mặt tiên 11m với thiết kế các tầng thông sàn cho thuê, tầng thiết kế căn hộ phòng ngủ tầng làm bếp và phòng khách
Toàn bộ thiết bị nhâp chính hãng, hệ thống PCCC đầy đủ.
Gía bán = 120tỷ (bao phí sang tên). Sổ đỏ chính chủ
Liên hệ làm việc chính chủ : Phùng Tình",120 tỷ,178 m2,"Phố Hoàng Ngân, Phường Trung Hòa, Quận Cầu Giấy, Hà Nội",13736378,_,---,Cần bán,20m,---,Văn phòng,Sổ hồng/ Sổ đỏ,---,11m,9,---,"16,2m",2,---
https://alonhadat.com.vn/ban-dat-pho-quan-nhan-66m2-gara-o-to-tranh-vp-kinh-doanh-o-13534997.html,"BÁN ĐẤT PHỐ QUAN NHÂN 66M2, GARA  - Ô TÔ TRÁNH - VP - KINH DOANH - Ở","- Đất ở vị trí đắc địa, ít người bán, trung tâm quận Thanh Xuân, gần nhiều tuyến phố lớn, giao thông đi lại thuận tiện và rất nhiều tiện ích, an ninh tốt: Đường Vũ Trọng Phụng, Chính Kinh, Ngụy Như Kontum, Nguyễn Trãi, Lê Văn Lương, Hoàng Đạo Thúy gần nhiều trường học, công an quận Thanh Xuân.. hiếm có trong khu vực.
- Đất sạch, ngõ rộng và thoáng, ô tô vào trong đất thoải mái, làm văn phòng - kinh doanh - ở đều rất tuyệt.
- Sổ đỏ chính chủ vuông vắn, thông số rất đẹp, pháp lý chuẩn.
- Liên hệ: Mạnh Hà để xem đất và làm việc chính chủ (không tiếp trung gian, MG).","8,5 tỷ",66 m2,"Phố Nhân Hòa, Phường Thanh Xuân Trung, Quận Thanh Xuân, Hà Nội",13534997,_,---,Cần bán,7m,---,"Đất thổ cư, đất ở",Sổ hồng/ Sổ đỏ,---,---,---,---,---,---,---
https://alonhadat.com.vn/chinh-chu-ban-nha-mp-thinh-quang-104m-9-tang-mt5-5m-thang-may-gia-hon-20-ty-kd-sam-uat-13629756.html,"Bán Nhà MP Thịnh Quang 104M, 9 Tầng,MT5.5M Thang Máy, Giá Hơn 20 Tỷ, KD Sầm Uất","Bán Nhà MP Thịnh Quang 104M, 9 Tầng Thang Máy, Giá Hơn 20 Tỷ, KD Sầm Uất
Gia chủ xây 9 tầng quận Đống Đa đủ uy tín. Nhà xây chắc chắn hiện đại
Phù hợp làm văn phòng công ty, Oto Tránh, dừng đỗ thoải mái.
Giá mặt phố chưa bằng giá phân lô các khu Hoàng Cầu, Nguyên Hồng Nhưng đây là Mặt Phố ạ.
Sổ đỏ đẹp thiết kế thông minh
T 1 thông sàn
T 2 - 8 mỗi tầng 2 phòng
T 9 : 1p sân trước + sau cây cảnh view royal city toàn cảnh
Liên hệ: Mr Thiệp:",25 tỷ,104 m2,"Đường Thịnh Quang, Phường Thịnh Quang, Quận Đống Đa, Hà Nội",13629756,_,True,Cần bán,15m,True,Nhà mặt tiền,Sổ hồng/ Sổ đỏ,True,6m,9,True,21m,9,---
https://alonhadat.com.vn/ban-nha-pho-cu-chinh-lan-45m2-8-tang-thang-may-phan-lo-quan-doi-o-to-tranh-kinh-doanh-13641754.html,"BÁN NHÀ PHỐ CÙ CHÍNH LAN 45M2, 8 TẦNG THANG MÁY, PHÂN LÔ QUÂN ĐỘI, Ô TÔ TRÁNH - KINH DOANH","-	Nhà nằm ở vị trí đẹp nhất phố, khu phân lô quân đội, khu phố sầm uất có thể ở hoặc kinh doanh, giao thông thuận tiện kết nối và thông với các phố Hoàng Văn Thái, Nguyễn Ngọc Nại, Khương Trung, Trường Chinh, Lê Trọng tấn.  Khu vực dân trí cao, an ninh tốt và gần nhiều tiện ích: Gần các bệnh viện lớn và các trường: Bệnh viện Đại học Y, BV Bạch Mai; Trường Tiểu học Nguyễn Trãi, Khương Mai, Trung học Nguyễn Trãi, Đại học Y, Thủy lợi, Kinh tế quốc dân, Xây dựng, Bách Khoa, Ngân hàng…
-	Thiết kế nhà 8 tầng thang máy rất mới, nội thất nhập khẩu, Khung bê tông CT chắc chắn, công năng đầy đủ, thoáng trước sau vĩnh viễn:
+ Tầng 1:  Gara để xe + Khách + Vệ sinh.
+ Tầng 2,3,4,5,6: Mỗi tầng 1 phòng ngủ lớn + Vệ sinh.
+ Tầng 7: Phòng bếp.
+ Tầng 8: Phòng thờ + Sân phơi sáng thoáng.
-	Sổ đỏ chính chủ, nở hậu, sẵn sàng sang tên.
-	Liên hệ: Mạnh Hà để làm việc chính chủ (không tiếp MG, TG).","13,8 tỷ",45 m2,"Phố Cù Chính Lan, Phường Khương Trung, Quận Thanh Xuân, Hà Nội",13641754,_,True,Cần bán,7m,True,Nhà mặt tiền,Sổ hồng/ Sổ đỏ,True,---,8,True,---,5,---
https://alonhadat.com.vn/ban-nha-mat-pho-nguyen-xien-90m-5-tang-lo-goc-kinh-doanh-chi-23-ty-sieu-dep-13629924.html,"Bán Nhà Mặt Phố Nguyễn Xiển 90M,5 Tầng, Lô Góc, Kinh Doanh Chỉ 23 Tỷ - Siêu Đẹp","Bán Nhà Mặt Phố Nguyễn Xiển 90M,5 Tầng, Lô Góc, Kinh Doanh Chỉ 23 Tỷ - Siêu Đẹp
+ Lô góc chính - 2 mặt tiền kinh doanh : Cafe, nhà hàng, văn  phòng...
+ Vỉa hè rộng 5m chạy dài xung quanh mặt tiền là lợi thế kinh doanh
+ Mua đầu tu, giữ tiền cũng rất hợp lý
+ Sổ đỏ chính chủ vuông đẹp
Liên hệ: Mr Thiệp:",23 tỷ,90 m2,"Đường Nguyễn Xiển, Phường Hạ Đình, Quận Thanh Xuân, Hà Nội",13629924,_,True,Cần bán,21m,True,Nhà trong hẻm,Sổ hồng/ Sổ đỏ,True,15m,5,True,15m,5,---
https://alonhadat.com.vn/ban-nha-pho-nguyen-xien-moi-dep-85m2-7-tang-thang-may-xe-bus-tranh-vp-kinh-doanh-o-13479585.html,"BÁN NHÀ PHỐ NGUYỄN XIỂN MỚI ĐẸP 85M2, 7 TẦNG, THANG MÁY, XE BUS TRÁNH-VP-KINH DOANH-Ở","- Nhà ở vị trí rất đẹp xe bus tránh,đường phân lô thông các ngả, thuận tiện giao thông đi lại: Gần đường vành đai 3, Nguyễn Trãi, tập trung nhiều Công ty, Văn phòng, trường học, dân trí cao....           
- Nhà mới, thiết kế hiện đại, chắc chắn, thang máy, 10 phòng, có thể làm văn phòng cho thuê, kinh doanh, ở đều rất tuyệt:
 + Tầng 1: Raga ô tô + xe máy + Vệ sinh.
 + Tầng 2: Khách + Bếp + Vệ sinh.
 + Tầng 3,4,5,6: Mỗi tầng 2 phòng rộng + vệ sinh.
 + Tầng 7: Thờ + Sân phơi thoáng sáng.        
- Sổ đỏ nở hậu, giao dịch ngay.  
- Liên hệ: Mạnh Hà để làm việc chính chủ (không tiếp môi giới, trung gian).",14 tỷ,85 m2,"Đường Nguyễn Xiển, Phường Thanh Xuân Nam, Quận Thanh Xuân, Hà Nội",13479585,_,True,Cần bán,9m,True,Nhà mặt tiền,Sổ hồng/ Sổ đỏ,True,---,7,True,---,8,---
https://alonhadat.com.vn/ban-nha-mat-pho-ha-dinh-71m-5t-gia-chi-14-ty-kinh-doanh-sam-uat-13625115.html,"Bán Nhà Mặt Phố Hạ Đình 71M,5T Giá Chỉ 14 Tỷ Kinh Doanh Sầm Uất","Bán Nhà Mặt Phố Hạ Đình 71M,5T Giá Chỉ 14 Tỷ Kinh Doanh Sầm Uất
+ Nhà Vị Trí Đẹp Nhất Phố - Kinh Doanh Sâm Uất - Vỉa Hè 2 Bên Rộng Rãi
+ Dối diện khu phích nước rạng đông
Nhà thiết kế hợp lý cầu thang ở giữa có thể thiết kế thang máy tầng chia 2 phòng
Sổ đỏ chính chủ nở hậu
Liên hệ: Mr Thiệp:",14 tỷ,71 m2,"Phố Hạ Đình, Phường Hạ Đình, Quận Thanh Xuân, Hà Nội",13625115,_,---,Cần bán,15m,---,Nhà mặt tiền,Sổ hồng/ Sổ đỏ,---,4m,5,---,18m,4,---
https://alonhadat.com.vn/mat-pho-hang-vai-136m2-mat-tien-6-6m-vuong-dep-no-hau-kinh-doanh-sam-uat-ngay-dem-13331486.html,MẶT PHỐ HÀNG VẢI - 136M2 - MẶT TIỀN 6.6M - VUÔNG ĐẸP NỞ HẬU - KINH DOANH SẦM UẤT NGÀY ĐÊM,"MẶT PHỐ HÀNG VẢI - 136M2 - MẶT TIỀN 6.6M - VUÔNG ĐẸP NỞ HẬU - KINH DOANH ĐỈNH CAO - SẦM UẤT NGÀY ĐÊM 

- Diện tích sổ đỏ 136m2
- Nhà 2 tầng đang cho thuê cực kỳ phát đạt
- Mặt tiền rộng 6.6m
- Giá: 70 tỷ (có thương lượng)

+ Nhà mặt phố cổ kinh doanh sầm uất, giáp Phùng Hưng, gần hàng Gà, đi bộ ra bờ Hồ Hoàn Kiếm. 

+ Khu vực tấc đất tấc vàng, phù hợp xây tòa nhà cho thuê hoặc khách sạn thì hái ra tiền.

+ Nhà hai tầng cũ xác định bán đất nên không có gì miêu tả nhiều, nhà mặt tiền rộng, sổ vuông đẹp phù hợp xây tòa nhà, khách sạn. 

+ Pháp lý: Sổ đỏ đứng tên chính chủ sang tên luôn trong ngày. 

Chủ là người quen rất hợp tác và tôn trọng khách hàng và môi giới. Chủ ở xa nên khi nào khách xem ưng và thiện chí mua chủ sẽ bay ra HN làm việc. 

+ Căn nhà giá tốt để Quý anh chị đầu tư khai thác, vị trí quá đẹp, sổ đỏ hoa hậu, hiếm có trên phố cổ. 

Liên hệ: Mr Tấn để được dẫn xem cụ thể và thương lượng trực tiếp chủ nhà! 

TRUNG TÂM GIAO DỊCH BĐS HÀ NỘI PHỐ - CHUYÊN NHẬN KÝ GỬI MUA - BÁN - CHO THUÊ CÁC LOẠI BIỆT THỰ - LIỀN KỀ - NHÀ PHỐ - THỔ CƯ - CHUNG CƯ NỘI NGOẠI THÀNH HÀ NỘI
***** UY TÍN TẠO NIỀM TIN *****",70 tỷ,136 m2,"Phố Hàng Vải, Phường Hàng Bồ, Quận Hoàn Kiếm, Hà Nội",13331486,_,True,Cần bán,30m,True,Nhà mặt tiền,Sổ hồng/ Sổ đỏ,True,"6,6m",2,True,---,5,---
https://alonhadat.com.vn/lien-ke-van-quan-60m-7t-thang-may-kinh-doanh-gia-chi-12-9-ty-13655409.html,Liền Kề Văn Quán 60M-7T Thang Máy -Kinh Doanh Giá Chỉ 12.9 Tỷ,"Khu VIP Văn Quán - Kinh Doanh Sầm Uất
7 Tầng Thang Máy Xịn
Vỉa Hè 4M- Oto Dừng đỗ thoải mái
Nhà thiết kế 7 tầng thang máy phù hợp vừa ở vừa làm văn phòng hoặc dành cho gia đình nhiều thế hệ, ông bà hay bố mẹ cần đi thang máy.
+ Có thể kinh doanh nhiều mặt hàng
+ Sổ đỏ chính chủ vuông vắn
Liên hệ:Mr Thiệp:","12,9 tỷ",60 m2,"Đường Nguyễn Khuyến, Phường Văn Quán, Quận Hà Đông, Hà Nội",13655409,_,---,Cần bán,10m,---,Nhà trong hẻm,Sổ hồng/ Sổ đỏ,---,"4,1m",7,---,15m,7,---
https://alonhadat.com.vn/ban-nha-mat-pho-tay-son-54m2-trung-tam-dong-da-via-he-kinh-doanh-ngay-dem-13653559.html,BÁN NHÀ MẶT PHỐ TÂY SƠN 54M2 - TRUNG TÂM ĐỐNG ĐA - VỈA HÈ - KINH DOANH NGÀY ĐÊM,"-	Nhà nằm tại mặt phố Tây Sơn, hiện trạng có nhà cấp 4 cũ, xác định bán đất, khách mua về có thể xây lên 9 tầng thang máy để kinh doanh, cho thuê hoặc làm văn phòng, thuộc khu phố buôn bán kinh doanh sầm uất trung tâm của Quận Đống Đa, giao thông thuận tiện kết nối và thông với các phố lớn Tôn Đức Thắng, Xã Đàn, Thái Hà, Chùa Bộc, Tôn Thất Tùng, Trường Chinh.
-	Sổ đỏ chính chủ, vuông vắn, sẵn sàng sang tên.
-	Liên hệ: Mạnh Hà để làm việc chính chủ (không tiếp MG, TG).",12 tỷ,54 m2,"Phố Tây Sơn, Phường Quang Trung, Quận Đống Đa, Hà Nội",13653559,_,---,Cần bán,20m,---,Nhà mặt tiền,Sổ hồng/ Sổ đỏ,---,---,---,---,---,---,---
