url,title,description,price,area,address,Mã tin,Hướng,Phòng ăn,Loại tin,Đường trước nhà,Nhà bếp,Loại BDS,Pháp lý,Sân thượng,Chiều ngang,Số lầu,Chổ để xe hơi,Chiều dài,Số phòng ngủ,Chính chủ
https://alonhadat.com.vn/can-ban-gap-chung-cu-mini-8-tang-thang-may-full-do-duong-le-duc-tho-72m2-12ty--13323106.html,"CẦN BÁN GẤP CHUNG CƯ MINI, 8 TẦNG THANG MÁY, FULL  ĐỒ, ĐƯỜNG LÊ ĐỨC THỌ: 72M2, 12TỶ.","- CẦN BÁN GẤP CHUNG CƯ MINI, DÒNG TIỀN LỚN, 8 TẦNG THANG MÁY, FULL ĐỒ, ĐƯỜNG LÊ ĐỨC THỌ: 72M2, 12 TỶ.
- Vị trí đẹp, đường rộng thông thoáng, ô tô cách nhà 30m, gần trường Đại học Sư Phạm, Đại học Ngoại Ngữ, Đại học Quốc Gia, Đại học Thương Mại...
- Tiếp giáp đường Lê Đức Thọ, Nguyễn Hoàng, Hồ Tùng Mậu, Thiên Hiền, Đình Thôn...
- Thiết kế 8 tầng, Thang máy, tổng 14 phòng khép kín, nội thất cao cấp, doanh thu mỗi tháng 70 triệu, chủ mới mua về khai thác luôn.
- Khu vực tập trung đông sinh viên và người lao động, nhu cầu thuê phòng trọ lớn, hở ra là kín phòng.
- Sổ đỏ đẹp, pháp lý sạch, sang tên ngay.
- Liên hệ tôi Dự để xem nhà 24/7.",12 tỷ,72 m2,"Đường Lê Đức Thọ, Phường Mỹ Đình 2, Quận Nam Từ Liêm, Hà Nội",13323106,_,True,Cần bán,3m,True,"Phòng trọ, nhà trọ",---,True,---,8,True,---,13,---
https://alonhadat.com.vn/can-ban-gap-nha-tro-dong-tien-7-tang-thang-may-duong-me-tri-55m2-chi-9-8-ty--13313224.html,"CẦN BÁN GẤP NHÀ TRỌ, DÒNG TIỀN, 7 TẦNG THANG MÁY, ĐƯỜNG MỄ TRÌ: 55M2, CHỈ 9.8 TỶ.","- CẦN BÁN GẤP NHÀ TRỌ, DÒNG TIỀN, 7 TẦNG THANG MÁY, ĐƯỜNG MỄ TRÌ: 55M2, CHỈ 9.8 TỶ.
- Vị trí cách ô tô tránh 30m, gần phố Miếu Đầm, Đỗ Đức Dục, Đại Lộ Thăng Long, Mễ Trì Hạ, Mễ Trì Thượng, Đình Thôn, Mỹ Đình, Phú Đô, Lê Đức Thọ.
- Bán kính 1km là các trường Đại học Sư Phạm, Đại học Quốc Ngoại Ngữ, Đại học Quốc Gia, Đại học Phương Đông, Cao Đẳng Cộng Đồng, Cao Đẳng Bách Khoa...
- Nhà đẹp long lanh, thiết kế 7 tầng Thang máy, full nội thất, tổng 12 phòng khép kín, doanh thu 50tr/ tháng.
- Hiện chủ đã cho thuê full phòng, khách mua về chỉ việc vận hành.
- Sổ đỏ chính chủ, pháp lý chuẩn, giao dịch nhanh.
- Liên hệ tôi Dự để xem nhà.","9,8 tỷ",55 m2,"Đường Mễ Trì Thượng, Phường Mễ Trì, Quận Nam Từ Liêm, Hà Nội",13313224,_,True,Cần bán,3m,True,"Phòng trọ, nhà trọ",---,True,---,7,True,---,12,---
https://alonhadat.com.vn/can-ban-gap-nha-tro-dong-tien-7-tang-thang-may-pho-mieu-dam-52m2-chi-9-5-ty--13313266.html,"CẦN BÁN GẤP NHÀ TRỌ, DÒNG TIỀN, 7 TẦNG THANG MÁY, PHỐ MIẾU ĐẦM: 52M2, CHỈ 9.5 TỶ.","- CẦN BÁN GẤP NHÀ TRỌ, DÒNG TIỀN, 7 TẦNG THANG MÁY, PHỐ MIẾU ĐẦM: 52M2, CHỈ 9.5 TỶ.
- Vị trí cách ô tô 30m, trước nhà ba gác phi ầm ầm, gần các trường Đại học Sư Phạm, Đại học Quốc Ngoại Ngữ, Đại học Quốc Gia, Đại học Phương Đông...
- Phố Miếu Đầm tiếp giáp đường Đỗ Đức Dục, Đại Lộ Thăng Long, Mễ Trì Hạ, Mễ Trì Thượng, Đình Thôn, Mỹ Đình, Phú Đô, Lê Đức Thọ.
- Thiết kế 7 tầng Thang máy, full nội thất, tổng 12 phòng khép kín, doanh thu 50tr/ tháng.
- Hiện chủ đã cho thuê full phòng, khách mua về chỉ việc vận hành, và thu tiền.
- Sổ đỏ chính chủ, pháp lý chuẩn, giao dịch nhanh.
- Liên hệ tôi Dự để xem nhà.","9,5 tỷ",52 m2,"Đường Miếu Đầm, Phường Mễ Trì, Quận Nam Từ Liêm, Hà Nội",13313266,_,True,Cần bán,3m,True,"Phòng trọ, nhà trọ",---,True,---,7,True,---,12,---
https://alonhadat.com.vn/chinh-chu-can-ban-nha-duong-duc-dien-kinh-doanh-tranh-82m2-mt-4-6m-chi-7-9ty--13298189.html,"CHÍNH CHỦ CẦN BÁN NHÀ ĐƯỜNG ĐỨC DIỄN, KINH DOANH, TRÁNH 82M2* MT: 4,6M, CHỈ 7.9TỶ.","- CHÍNH CHỦ CẦN BÁN NHÀ ĐƯỜNG ĐỨC DIỄN, KINH DOANH, Ô TÔ TRÁNH, 82M2* MT:4,6M, CHỈ 7.9TỶ.
Vị trí gần công an phường, trung tâm văn hoá quận, nhà thi đấu, bể bơi, trường Mần non, cấp 1+ 2 Phúc Diễn, tiện ích đầy đủ, dân trí cao, an ninh tốt.
- Tiếp giáp đường Văn Tiến Dũng, Vành đai 3.5, QL 32, Phú Diễn, Kiều Mai, Phúc Diễn...
- Nhà dân xây, khung cột chắc chắn, chủ xác định bán đất tặng nhà, khách mua về đập đi, xây toà văn phòng 8 tầng, thang máy, hay chung cư mini hái ra tiền.
- Trước nhà đường rộng thông thoáng, ô tô dừng đỗ thoả mái, view sáng thoáng vĩnh viễn, đi đâu cũng tiện.
- Sổ đỏ chính chủ, pháp lý sạch, giao dịch nhanh.
- Liên hệ tôi: Trần Dự nhà đất thổ cư, để xem nhà 24/7.","7,9 tỷ",82 m2,"Đường Đức Diễn, Phường Phúc Diễn, Quận Bắc Từ Liêm, Hà Nội",13298189,_,True,Cần bán,5m,True,Nhà trong hẻm,---,True,---,2,True,---,2,---
https://alonhadat.com.vn/ban-gap-nha-phan-lo-o-to-tranh-kinh-doanh-sam-uat-duong-lai-xa-45m2-chi-4-9-ty--13465420.html,"BÁN GẤP NHÀ PHÂN LÔ, Ô TÔ TRÁNH, KINH DOANH SẦM UẤT, ĐƯỜNG LAI XÁ: 45M2, CHỈ 4.9 TỶ.","-BÁN GẤP NHÀ PHÂN LÔ, Ô TÔ TRÁNH, KINH DOANH SẦM UẤT, ĐƯỜNG LAI XÁ: 45M2, CHỈ 4.9 TỶ.
-Vị trí Vip khu phân lô, vỉa hè, ô tô tránh, dừng đỗ ngày đêm, gần Đại học Thành Đô, kđt Royal Par, đường Hoàng Quốc Việt kéo dài, Ql 32, đường Cầu Diễn.
-Nhà đẹp, ở sướng, thiết kế hiện đại, các phòng sáng thoáng, công năng đầy đủ.
-Đường trước nhà 8m, vỉa hè 3m, ở kết hợp làm văn phòng, kinh doanh đa dạng.
-Khu dân trí cao, hàng xóm toàn doanh nhân thành đạt, con cái học hành giỏi giang, an sinh tốt, tiện ích bạt ngàn.
-Sổ đẹp phân lô, cất két chờ giao dịch.
-Liên hệ tôi Dự để xem nhà 24/7.","4,9 tỷ",45 m2,"Đường Lai Xá, Xã Kim Chung, Huyện Hoài Đức, Hà Nội",13465420,_,True,Cần bán,8m,True,Nhà mặt tiền,---,True,---,4,True,---,4,---
https://alonhadat.com.vn/can-ban-gap-toa-van-phong-2-thoang-mat-pho-tran-vy-145m2-9-tang-thang-may-61-ty--13457730.html,"CẦN BÁN GẤP TOÀ VĂN PHÒNG,2 THOÁNG,MẶT PHỐ TRẦN VỸ: 145M2*9 TẦNG, THANG MÁY, 61 TỶ.","-CẦN BÁN GẤP TOÀ VĂN PHÒNG,2 THOÁNG,MẶT PHỐ TRẦN VỸ: 145M2*9 TẦNG,THANG MÁY, 61 TỶ.
-Vị trí đẹp,2 mặt thoáng trước sau,vỉa hè 7m,giao thông thuận tiện,gần ngã tư Trần Vỹ,Lê Đức Thọ,Hồ Tùng Mậu.
-Toà văn phòng đẹp lung linh, thiết kế hiện đại, 9 tầng thông sàn, 2 mặt trước sau, sáng thoáng tự nhiên, nội thất điện thông minh, PCCC đầy đủ.
-Trước nhà đường đôi, 6 làn ô tô tránh, vỉa hè 7m, để được nhiều ô tô, xe máy, rất thuận tiện cho công ty, văn phòng, kinh doanh, phòng khám, thẩm mỹ...
-Sổ đỏ đẹp, pháp lý sạch, giao dịch nhanh.
-Liên hệ tôi Dự để xem nhà 24/7.",61 tỷ,145 m2,"Đường Trần Vỹ, Phường Mai Dịch, Quận Cầu Giấy, Hà Nội",13457730,_,True,Cần bán,24m,True,Văn phòng,---,True,---,9,True,---,8,---
https://alonhadat.com.vn/can-ban-gap-nha-mat-duong-di-trach-2-thoang-via-he-kinh-doanh-60m2-5-2-ty--13462197.html,"CẦN BÁN GẤP NHÀ MẶT ĐƯỜNG DI TRẠCH, 2 THOÁNG, VỈA HÈ, KINH DOANH, 60M2, 5.2 TỶ.","-CẦN BÁN GẤP NHÀ MẶT ĐƯỜNG DI TRẠCH, 2 THOÁNG, VỈA HÈ, KINH DOANH, 60M2, 5.2 TỶ.
-Vị trí đẹp, vỉa hè rộng, gần chợ, nhà văn hoá, trường cấp 1, cấp 2, khu đô thị Kim Chung- Di trạch, đường rộng thông thoáng, giao thông thuận lợi, đi đâu cũng tiện.
-Nhà chủ tự xây, khung cột chắc chắn, 2 mặt thoáng, lên phòng nào cũng có cửa sổ, sáng thoáng mát mẻ.
-Đường trước nhà 2 ô tô tải tránh, vỉa hè rộng, phù hợp ở, kết hợp làm văn phòng, công ty, quầy thuốc, thẩm mỹ, thời trang...
-Nhà gần khu đô thị Kim Chung- Di Trạch, lên hưởng mọi tiện ích xung quanh, dân trí cao, an ninh tốt.
-Sổ đẹp chính chủ, pháp lý sạch, giao dịch nhanh.
-Liên hệ tôi Dự để xem nhà 24/7.","5,2 tỷ",60 m2,"Đường Văn Minh, Xã Kim Chung, Huyện Hoài Đức, Hà Nội",13462197,_,True,Cần bán,9m,True,Nhà mặt tiền,---,True,---,4,True,---,4,---
https://alonhadat.com.vn/can-ban-gap-nha-mat-pho-lai-xa-via-he-kinh-doanh-o-to-tranh-59m2-chi-5-3-ty--13462248.html,"CẦN BÁN GẤP NHÀ MẶT PHỐ LAI XÁ, VỈA HÈ, KINH DOANH, Ô TÔ TRÁNH, 59M2, CHỈ 5.3 TỶ.","-CẦN BÁN GẤP NHÀ MẶT PHỐ LAI XÁ, VỈA HÈ, KINH DOANH, Ô TÔ TRÁNH, 59M2, CHỈ 5.3 TỶ.
-Vị trí đẹp trung tâm phố, gần chợ, trường mầm non, trường cấp1, cấp 2 Lai Xá, đường rộng thông thoáng, kinh doanh sầm uất.
-Kết nối các trục đường 32, đường Cầu Diễn, Xuân Phương, Di Trạch, Mỹ Đình...
-Nhà đẹp ở ngay, thiết kế hợp lý, nội thất sang trọng, công năng hoàn hảo.
-Đường trước nhà 2 ô tránh, vỉa hè rộng, phù hợp làm văn phòng, trụ sở công ty, kinh doanh, tạp hoá, spa, thẩm mỹ, quầy thuốc, thời trang...
-Sổ đỏ chính chủ,pháp lý sạch,giao dịch nhanh.
-Liên hệ tôi Dự để xem nhà 24/7.","5,3 tỷ",59 m2,"Đường Lai Xá, Xã Kim Chung, Huyện Hoài Đức, Hà Nội",13462248,_,True,Cần bán,7m,True,Nhà mặt tiền,---,True,---,4,True,---,4,---
https://alonhadat.com.vn/ban-gap-toa-van-phong-lo-goc-7-tang-thong-san-pho-duong-khue-68m2-chi-21-5-ty--13409880.html,"BÁN GẤP TOÀ VĂN PHÒNG, LÔ GÓC 7 TẦNG, THÔNG SÀN, PHỐ DƯƠNG KHUÊ: 72M2, CHỈ 21.5 TỶ.","-BÁN GẤP TOÀ VĂN PHÒNG, LÔ GÓC 7 TẦNG, THÔNG SÀN, PHỐ DƯƠNG KHUÊ: 72M2, CHỈ 21.5 TỶ.
-Vị trí lô góc thoáng sáng tự nhiên,đường rộng thông thoáng, ô tô dừng đỗ nhiều cái, giao thông thuận lợi,đi đâu cũng tiện.
-Thông thương các tuyến đường Hồ Tùng Mậu,Lê Đức Thọ,Nguyễn Hoàng,Hàm Nghi,Mỹ Đình,Trần Vỹ...
-Nhà đẹp long lanh,lô góc sáng thoáng,thiết kế thông sàn,thang máy nhập khẩu chạy êm ru.
-Đường trước nhà rộng,ô tô dừng tránh thoả mái,phù hợp làm văn phòng,công ty,phòng khám,thời trang,trưng bày sản phẩm,thẩm mỹ spa...
-Sổ đỏ chính chủ,pháp lý rõ ràng,sẵn sàng giao dịch.
-Liên hệ tôi Dự để xem nhà 24/7.","21,5 tỷ",72 m2,"Đường Dương Khuê, Phường Mai Dịch, Quận Cầu Giấy, Hà Nội",13409880,_,True,Cần bán,7m,True,Văn phòng,---,True,---,7,True,---,6,---
https://alonhadat.com.vn/can-ban-gap-toa-van-phong-7-tang-thang-may-duong-phu-dien-via-he-82m2-chi-17-5-ty--13409694.html,"CẦN BÁN GẤP TOÀ VĂN PHÒNG,7 TẦNG,THANG MÁY,ĐƯỜNG PHÚ DIỄN,VỈA HÈ, 82M2, CHỈ 17.5 TỶ.","-CẦN BÁN GẤP TOÀ VĂN PHÒNG,7 TẦNG,THANG MÁY,ĐƯỜNG PHÚ DIỄN,VỈA HÈ, 82M2, CHỈ 17.5 TỶ.
-Vị trí đẹp,đường rộng thông thoáng,ô tô tránh dừng đỗ ngày đêm,gần vườn hoa,siêu thị,trường Đại học Tài Nguyên Môi Trường.
-Kết nối các tuyến đường Cầu Diễn,Hồ Tùng Mậu,Mỹ Đình,Văn Tiến Dũng,Hoàng Quốc Việt kéo dài...
-Nhà đẹp long lanh,thiết kế 7 tầng thang máy,xung quanh cây cối mát mẻ, phù hợp ở kết hợp làm văn phòng,công ty,thẩm mỹ,spa,phòng khám...
-Đường trước nhà rộng thông thoáng,vỉa hè 3m,xe cộ để thoả mái,rất thuận lợi cho công việc,đi đâu cũng tiện.
-Sổ đỏ đẹp phân lô,pháp lý sạch,giao dịch nhanh.
-Liên hệ tôi Dự để xem nhà 24/7.","17,5 tỷ",82 m2,"Đường Phú Diễn, Phường Phú Diễn, Quận Bắc Từ Liêm, Hà Nội",13409694,_,True,Cần bán,9m,True,Văn phòng,---,True,---,7,True,---,6,---
https://alonhadat.com.vn/ban-gap-toa-van-phong-lo-goc-3-thoang-via-he-kinh-doanh-pho-mai-dich-75m2-21-ty--13409220.html,"BÁN GẤP TOÀ VĂN PHÒNG LÔ GÓC, 3 THOÁNG, VỈA HÈ, KINH DOANH, PHỐ MAI DỊCH: 75M2, 21 TỶ.","-BÁN GẤP TOÀ VĂN PHÒNG LÔ GÓC, 3 THOÁNG, VỈA HÈ, KINH DOANH, PHỐ MAI DỊCH: 75M2, 21 TỶ.
-Vị trí lô góc, 2 mặt đường ô tô tránh, vỉa hè 2m, đường thông rộng thoáng, gần đường Hồ Tùng Mậu, Lê Đức Thọ, Trần Vỹ, Mai Dịch, Doãn Kế Thiện...
-Thiết kế 7 tầng thông sàn, Thang máy chạy êm ru, nhà lô góc sáng thoáng mát mẻ.
-Đường trước nhà ô tô tránh, dừng đỗ ngày đêm, phù hợp làm công ty, văn phòng, trưng bày sản phẩm, phòng khám, thẩm mỹ spa...
-Khu vực dân trí cao, hàng xóm toàn giới văn nghệ sỹ, an ninh tốt, tiện ích đầy đủ.
-Sổ đỏ vuông đẹp, pháp lý rõ ràng, sẵn sàng giao dịch.
-Liên hệ tôi Dự để xem nhà 24/7.",21 tỷ,75 m2,"Đường Mai Dịch, Phường Mai Dịch, Quận Cầu Giấy, Hà Nội",13409220,_,True,Cần bán,9m,True,Văn phòng,---,True,---,7,True,---,6,---
https://alonhadat.com.vn/can-ban-gap-nha-phan-lo-o-to-do-cua-kinh-doanh-duong-ho-tung-mau-40m2-chi-6-ty--13414420.html,"CẦN BÁN GẤP NHÀ PHÂN LÔ, Ô TÔ ĐỖ CỬA,KINH DOANH,ĐƯỜNG HỒ TÙNG MẬU: 40M2, CHỈ 6 TỶ.","-CẦN BÁN GẤP NHÀ PHÂN LÔ, Ô TÔ ĐỖ CỬA,KINH DOANH,ĐƯỜNG HỒ TÙNG MẬU: 40M2, CHỈ 6 TỶ.
-Vị trí đẹp,ô tô đỗ cửa,đường rộng thông thoáng,kinh doanh sầm uất,gần chợ,trường Mầm non, siêu thị,trường Đại học Tài Nguyên Môi Trường,Đại học Thương Mại...
-Giao cắt đường Cầu Diễn,Hồ Tùng Mậu,Phú Diễn,Phúc Diễn,Hàm Nghi,Lê Đức Thọ...
-Nhà đẹp ở sướng,thiết kế hiện đại,phòng khách,phòng ngủ,sáng thoáng,mát mẻ.
-Sổ đỏ vuông đẹp,pháp lý rõ ràng,sẵn sàng giao dịch.
-Liên hệ tôi Dự để xem nhà 24/7.",6 tỷ,40 m2,"Đường Hồ Tùng Mậu, Phường Cầu Diễn, Quận Nam Từ Liêm, Hà Nội",13414420,_,True,Cần bán,3m,True,Nhà trong hẻm,---,True,---,5,True,---,4,---
https://alonhadat.com.vn/ban-gap-nha-duong-phu-dien-lo-goc-3-thoang-kinh-doanh-oto-tranh-50m2-7-2-ty--13395324.html,"BÁN GẤP NHÀ ĐƯỜNG PHÚ DIỄN, LÔ GÓC 3 THOÁNG,KINH DOANH,ÔTÔ TRÁNH, 50M2, 7.2 TỶ.","-BÁN GẤP NHÀ ĐƯỜNG PHÚ DIỄN, LÔ GÓC 3 THOÁNG,KINH DOANH,ÔTÔ TRÁNH, 50M2, 7.2 TỶ.
-Vị trí lô góc 3 mặt thoáng, kinh doanh sầm uất, gần đường Cầu Diễn, Hồ Tùng Mậu, Mỹ Đình, Hàm Nghi.
-Nhà đẹp, lô góc thoáng sáng mát mẻ,thiết kế hiện đại, công năng hoàn hảo.
-Đường trước nhà 2 ô tô tránh, dừng đỗ ngày đêm, phù hợp ở kết hợp kinh doanh đa dạng như, tạp hoá, quầy thuốc, thời trang, phòng khám, thẩm mỹ, spa...
-Sổ đẹp chính chủ,pháp lý rõ ràng, sẵn sàng giao dịch.
-Liên hệ tôi Dự để xem nhà 24/7.","7,2 tỷ",50 m2,"Đường Phú Diễn, Phường Phú Diễn, Quận Bắc Từ Liêm, Hà Nội",13395324,_,True,Cần bán,6m,True,Nhà trong hẻm,---,True,---,5,True,---,4,---
https://alonhadat.com.vn/can-ban-gap-toa-van-phong-7-tang-via-he-kinh-doanh-quan-cau-giay-80m2-21-2-ty--13428552.html,"CẦN BÁN GẤP TOÀ VĂN PHÒNG, 7 TẦNG, VỈA HÈ, KINH DOANH, QUẬN CẦU GIẤY: 80M2, 21.2 TỶ.","-CẦN BÁN GẤP TOÀ VĂN PHÒNG, 7 TẦNG, VỈA HÈ, KINH DOANH, QUẬN CẦU GIẤY: 80M2, 21.2 TỶ.
-Vị trí đẹp,trước nhà view thoáng vĩnh viễn,ô tô dừng đỗ ngày đêm,giao thông thuận lợi,đi đâu cũng tiện.
-Kết nối các tuyến đường Hoàng Quốc Việt,Phạm Văn Đồng,Trần Cung,Nguyễn Phong Sắc,Nguyễn Văn Huyên,Xuân Tảo,Nghĩa Tân,Tô Hiệu,Võ Chí Công...
-Nhà đẹp,2 mặt trước sau sáng thoáng,mát mẻ,thiết kế 7 tầng,thông sàn,kinh doanh.
-Trước nhà đường rộng 9m,sử dụng vỉa hè 2 bên,xe cộ để thoả mái,phù hợp làm công ty,văn phòng,trung tâm gia sư,thẩm mỹ spa,phòng khám...
-Khu vực tập trung nhiều văn phòng,công sở,dân trí cao,an ninh tốt.
-Sổ đỏ đẹp chính chủ,pháp lý sạch,giao dịch nhanh.
-Liên hệ tôi Dự để xem nhà 24/7.","21,2 tỷ",80 m2,"Đường Hoàng Quốc Việt, Phường Nghĩa Đô, Quận Cầu Giấy, Hà Nội",13428552,_,---,Cần bán,9m,---,Văn phòng,---,---,---,7,---,---,6,---
https://alonhadat.com.vn/can-ban-gap-can-ho-dong-tien-thang-may-o-to-duong-mai-dich-50m2-7t-chi-9-8-ty--13429215.html,"CẦN BÁN GẤP CĂN HỘ,DÒNG TIỀN,THANG MÁY,Ô TÔ,ĐƯỜNG MAI DỊCH: 50M2* 7T, CHỈ 9.8 TỶ.","-CẦN BÁN GẤP CĂN HỘ,DÒNG TIỀN,THANG MÁY,Ô TÔ,ĐƯỜNG MAI DỊCH: 50M2* 7T, CHỈ 9.8 TỶ.
-Vị trí đẹp,2 mặt thoáng trước sau,đường rộng thông thoáng, đi đâu cũng tiện,10m ra ô tô tránh, kinh doanh sầm uất.
-Gần trường Đại học Sân Khấu Điện Ảnh, Đại học Thương Mại, Đại học Sư Phạm, Đại học Quốc Gia,thông đường Hồ Tùng Mậu,Doãn Kế Thiện,Lê Đức Thọ,Trần Vỹ...
-Nhà đẹp long lanh, thiết kế hiện đại,tổng 12 phòng, đã cho thuê kín, doanh thu mỗi tháng hơn 70 triệu.
-Sổ đỏ chính chủ,pháp lý sạch,giao dịch nhanh.
-Liên hệ tôi Dự để xem nhà 24/7.","9,8 tỷ",50 m2,"Đường Mai Dịch, Phường Mai Dịch, Quận Cầu Giấy, Hà Nội",13429215,_,True,Cần bán,3m,True,Nhà trong hẻm,---,True,---,7,True,---,12,---
https://alonhadat.com.vn/can-ban-gap-nha-pho-kieu-mai-phan-lo-o-to-tranh-kinh-doanh-58m2-chi-7-5-ty--13438686.html,"CẦN BÁN GẤP NHÀ PHỐ KIỀU MAI, PHÂN LÔ, Ô TÔ TRÁNH, KINH DOANH, 58M2, CHỈ 7.5 TỶ.","-CẦN BÁN GẤP NHÀ PHỐ KIỀU MAI, PHÂN LÔ, Ô TÔ TRÁNH, KINH DOANH, 58M2, CHỈ 7.5 TỶ.
-Vị trí đắc địa, đường rộng thông thoáng, ô tô dừng tránh, gần đường QL 32, Cầu Diễn, Hồ Tùng Mậu, Văn Tiến Dũng, Hoàng Quốc Việt, Trịnh Văn Bô.
-Nhà đẹp ở sướng, thiết kế hiện đại, nội thất sang trọng, công năng đầy đủ.
-Đất lành vượng khí, làm ăn phát tài, chủ nhà công chức, nhiều Bđs lên bán bớt, mong hữu duyên gặp khách thiện chí, bán căn nhà tâm huyết bao năm.
-Sổ đẹp phân lô, sẵn sàng giao dịch.
-Liên hệ tôi Dự để xem nhà 24/7.","7,5 tỷ",58 m2,"Đường Kiều Mai, Phường Phúc Diễn, Quận Bắc Từ Liêm, Hà Nội",13438686,_,True,Cần bán,8m,True,Nhà trong hẻm,---,True,---,5,True,---,6,---
https://alonhadat.com.vn/can-ban-gap-nha-lo-goc-kinh-doanh-o-to-tranh-duong-my-dinh-45m2-chi-6-8-ty--13433131.html,"CẦN BÁN GẤP NHÀ LÔ GÓC, KINH DOANH, Ô TÔ TRÁNH, ĐƯỜNG MỸ ĐÌNH: 45M2, CHỈ 6.8 TỶ.","-CẦN BÁN GẤP NHÀ LÔ GÓC, KINH DOANH, Ô TÔ TRÁNH, ĐƯỜNG MỸ ĐÌNH: 45M2, CHỈ 6.8 TỶ.
-Vị trí lô góc, ô tô tránh, kinh doanh sầm uất, gần chợ, sân vận động, trường cấp 1,2 Mỹ Đình, thông đường Lê Đức Thọ, Nguyễn Hoàng, Đình Thôn, Thiên Hiền...
-Nhà lô góc sáng thoáng mát mẻ, thiết kế 1 cửa hàng kinh doanh, và 6 phòng ngủ, đầy đủ công năng.
-Khu dân cư đông đúc, phù hợp ở kinh doanh, văn phòng, cửa hàng tạp hoá, thời trang, thẩm mỹ, spa...
-Sổ đỏ đẹp nở hậu, sẵn sàng giao dịch.
-Liên hệ tôi Dự để xem nhà 24/7.","6,8 tỷ",45 m2,"Đường Mỹ Đình, Phường Mỹ Đình 1, Quận Nam Từ Liêm, Hà Nội",13433131,_,True,Cần bán,5m,True,Nhà trong hẻm,---,True,---,5,True,---,6,---
https://alonhadat.com.vn/can-ban-gap-nha-kinh-doanh-o-to-tranh-duong-le-duc-tho-46m2-5-tang-6-9-ty--13433188.html,"CẦN BÁN GẤP NHÀ KINH DOANH, Ô TÔ TRÁNH, ĐƯỜNG LÊ ĐỨC THỌ: 46M2*5 TẦNG, 6.9 TỶ.","-CẦN BÁN GẤP NHÀ KINH DOANH, Ô TÔ TRÁNH, ĐƯỜNG LÊ ĐỨC THỌ: 46M2*5 TẦNG, 6.5 TỶ.
-Vị trí đẹp, ngõ thông kinh doanh sầm uất, ô tô tránh, gần hồ điều hoà, trường Trí Đức, nhà sách Vạn Hoa, siêu thị...
-Kết nối các trục đường Lê Đức Thọ, Mỹ Đình, Lê Quang Đạo, Nguyễn Hoàng, Hàm Nghi, Hồ Tùng Mậu, Trần Vỹ...
-Nhà đẹp sáng thoáng, mát mẻ, khung cột chắc chắn, công năng hoàn hảo.
-Đường trước nhà rộng 5m, phù hợp ở làm văn phòng Đại diện, Thẩm mỹ, spa, ăn uống, cafe, thời trang...
-Sổ đẹp chính chủ, pháp lý sạch, giao dịch nhanh.
-Liên hệ tôi Dự để xem nhà 24/7.","6,9 tỷ",46 m2,"Đường Lê Đức Thọ, Phường Mỹ Đình 2, Quận Nam Từ Liêm, Hà Nội",13433188,_,True,Cần bán,5m,True,Nhà trong hẻm,---,True,---,5,True,---,6,---
https://alonhadat.com.vn/can-ban-gap-can-ho-dong-tien-full-noi-that-duong-cau-giay-98m2-chi-12-5-ty--13444117.html,"CẦN BÁN GẤP CĂN HỘ DÒNG TIỀN, FULL NỘI THẤT, ĐƯỜNG CẦU GIẤY: 98M2, CHỈ 12.5 TỶ.","-CẦN BÁN GẤP CĂN HỘ DÒNG TIỀN, FULL NỘI THẤT, ĐƯỜNG CẦU GIẤY: 98M2, CHỈ 12.5 TỶ.
-Vị trí gần trường Đại học Thủ Đô,Đại học Ngoại Ngữ,Đại học Quốc Gia,Đại học Giao Thông Vận Tải,Học viện Báo Chí và Tuyên Truyền...
-Thông thương các tuyến đường Cầu Giấy,Xuân Thuỷ,Nguyễn Văn Huyên,Trần Thái Tông,Nguyễn Khang,Kim Mã...
-Nhà thiết kế hợp lý,tổng 16 phòng đang cho thuê,dòng tiền mỗi tháng hơn 80 triệu.
-Khu vực đông sinh viên và người lao động,nhu cầu thuê trọ lớn,an ninh tốt.
-Sổ đỏ chính chủ,pháp lý sạch,giao dịch nhanh.
-Liên hệ tôi Dự để xem nhà 24/7.","12,5 tỷ",98 m2,"Đường Cầu Giấy, Phường Dịch Vọng, Quận Cầu Giấy, Hà Nội",13444117,_,True,Cần bán,3m,True,"Phòng trọ, nhà trọ",---,True,---,5,True,---,16,---
https://alonhadat.com.vn/ban-gap-nha-lo-goc-kinh-doanh-sam-uat-o-to-tranh-duong-phu-dien-45m2-gia-7-5-ty--13456521.html,"BÁN GẤP NHÀ LÔ GÓC, KINH DOANH SẦM UẤT, Ô TÔ TRÁNH, ĐƯỜNG PHÚ DIỄN: 45M2, GIÁ 7.5 TỶ.","-BÁN GẤP NHÀ LÔ GÓC, KINH DOANH SẦM UẤT, Ô TÔ TRÁNH, ĐƯỜNG PHÚ DIỄN: 45M2, GIÁ 7.5 TỶ.
-Vị trí mặt ngõ, đường thông rộng rãi, kinh doanh sầm uất, gần chợ, hồ điều hoà, trường Mầm Non, cấp 1, cấp 2 Phú Diễn.
-Thông thương các tuyến đường, Phú Diễn, Đức Diễn, Văn Tiến Dũng, Cầu Diễn, QL32, Hồ Tùng Mậu, Mỹ Đình...
-Nhà đẹp lô góc sáng thoáng tự nhiên, vừa ở vừa kinh doanh đa dạng như: Tạp hoá, Spa, Thẩm mỹ, Thời trang, quầy thuốc...
-Khu vực dân cư đông đúc, kinh doanh buôn bán sầm uất, dân trí cao, an ninh tốt.
-Sổ đỏ đẹp, pháp lý chuẩn, giao dịch nhanh.
-Liên hệ tôi Dự để xem nhà 24/7.","7,5 tỷ",45 m2,"Đường Phú Diễn, Phường Phú Diễn, Quận Bắc Từ Liêm, Hà Nội",13456521,_,True,Cần bán,7m,True,Nhà trong hẻm,---,True,---,5,True,---,4,---
