url,title,description,price,area,address,Mã tin,Hướng,Phòng ăn,Loại tin,Đường trước nhà,Nhà bếp,Loại BDS,Pháp lý,Sân thượng,Chiều ngang,Số lầu,Chổ để xe hơi,Chiều dài,Số phòng ngủ,Chính chủ
https://alonhadat.com.vn/ban-gap-nha-pho-kim-nguu-hai-ba-trung-2-mat-ngo-75m2x4t-mt-6m-gara-oto-phan-lo-7-7-ty-6934810.html,"Bán Gấp Nhà Phố Kim Ngưu, Hai Bà Trưng 2 Mặt Ngõ 75m2x4T, MT 6m GARA Ôtô Phân Lô 7.7 tỷ","Bán Gấp Nhà Phố Kim Ngưu, Hai Bà Trưng 2 Mặt Ngõ, 75m2x4T, MT 6m GARA Ôtô, Phân Lô, Giá 7.7 tỷ.

   Nhà nằm ở vị trí cực đẹp con phố Kim Ngưu, quận Hai Bà Trưng gia đình có công việc nên cần bán gấp.
+ Nhà nằm ở khu vực Phân Lô đẹp, yên tĩnh, an ninh tuyệt vời.
+ Vị trí nhà cực đẹp 2 mặt ngõ, thông thoáng tuyệt vời, đường trước nhà Ôtô tránh, trong nhà để Ôtô thoải mái. 
+ Nhà xây 4 tầng chủ tự xây cực cẩn thận, công năng đầy đủ, gia đình chủ làm cán bộ về hưu hiền lành, dễ mến.

+ Pháp lý chuẩn, Sổ đỏ chính chủ, sẵn sàng giao dịch.
+ Giá bán 7.7 tỷ, có thương lượng.

    Hãy gọi cho chúng tôi 24/7 để được tư vấn, giải đáp thắc mắc về pháp lý, tìm kiếm, lựa chọn…(hoàn toàn miễn phí). 
    Chúng tôi tự hào mang lại giá trị đích thực cho quý khách hàng.   
    Liên hệ Mr Mạnh Nhà Phố","7,7 tỷ",75 m2,"Phố Kim Ngưu, Phường Thanh Lương, Quận Hai Bà Trưng, Hà Nội",6934810,_,---,Cần bán,5m,---,Nhà trong hẻm,Sổ hồng/ Sổ đỏ,---,---,4,---,---,4,---
https://alonhadat.com.vn/ban-nha-pho-tran-khat-chan-hai-ba-trung-oto-kinh-doanh-thang-may-80m2x7t-15-6-ty-12160265.html,"Bán Nhà Phố Trần Khát Chân, Hai Bà Trưng Ôtô, Kinh Doanh THANG MÁY 80m2x7T, 15.6 tỷ","Bán Nhà Phố Trần Khát Chân, Hai Bà Trưng Ôtô, Kinh Doanh THANG MÁY 80m2x7T, 15.6 tỷ

   Vị trí nhà đỉnh Phố Trần Khát Chân – Kinh Doanh – Ô tô – Thang Máy !!!

+ Chủ xây tâm huyết, thiết kế THANG MÁY – Ôtô gần, bố trí đồ đạc đẹp mắt, khách xem nhà là ưng ngay.
+ Tiện nghi khu vực đầy đủ gần Công viên Tuổi Trẻ, bệnh viện Thanh Nhàn, các trường Đại học lớn: Bách Khoa, Kinh Tế Quốc Dân, Xây Dựng…

+ Pháp lý chuẩn, Sổ đỏ chính chủ sẵn sàng giao dịch.
+ Giá bán 15.6 tỷ, có thương lượng, sở hữu ngay 1 ngôi nhà đẹp.

    Hãy gọi cho chúng tôi 24/7 để được tư vấn, giải đáp thắc mắc về pháp lý, tìm kiếm, lựa chọn…(hoàn toàn miễn phí). 
    Tự hào mang lại giá trị đích thực cho quý khách hàng.   

    Liên hệ Mr Mạnh Nhà Phố","15,6 tỷ",80 m2,"Đường Trần Khát Chân, Phường Đống Mác, Quận Hai Bà Trưng, Hà Nội",12160265,_,---,Cần bán,5m,---,Nhà trong hẻm,Sổ hồng/ Sổ đỏ,---,---,7,---,---,7,---
https://alonhadat.com.vn/ban-gap-nha-pho-yesxanh-hai-ba-trung-55m2x4t-oto-20m-lo-goc-gia-6-ty-7278349.html,"Bán Gấp Nhà Phố Hương Viên, Hai Bà Trưng Gần Hồ 42m2x5T, Ôtô 5M, Phân Lô, Giá 6 tỷ 6","Bán Gấp Nhà Phố Hương Viên, Hai Bà Trưng Gần Hồ 42m2x5T, Ôtô 5M, Phân Lô, Giá 6 tỷ 6

   Gia chủ cần bán cực gấp căn nhà đẹp Phố Hương Viên, quận Hai Bà Trưng vị nhà khu Phân Lô thoáng sáng, ánh nắng ngập tràn.

+ Nhà nằm trong khu vực dân trí cao, tiện nghi đầy đủ, cực gần phố vài bước chân là ra Hồ Hai Bà Trưng trong lành mát mẻ.
+ Tiện nghi khu vực đầy đủ gần Bệnh viên Quân Đội 108, Công viên, trường học, chợ đủ cả.
+ Hương Viên con phố đẹp cực hiếm nhà bán, lên Hồ Gươm vài phút đi xe, tiện nghi dân trí quá tuyệt vời…

+ Pháp lý: Sổ đỏ chính chủ, sẵn sàng giao dịch.
+ Giá bán 6 tỷ 6 trăm triệu, có thương lượng.

    Hãy gọi cho chúng tôi 24/7 để được tư vấn, giải đáp thắc mắc về pháp lý, tìm kiếm, lựa chọn…(hoàn toàn miễn phí). 
    Chúng tôi tự hào mang lại giá trị đích thực cho quý khách hàng.   
    Liên hệ Mr Mạnh Nhà Phố","6,6 tỷ",42 m2,"Phố Hương Viên, Phường Đồng Nhân, Quận Hai Bà Trưng, Hà Nội",7278349,_,---,Cần bán,5m,---,Nhà trong hẻm,Sổ hồng/ Sổ đỏ,---,---,5,---,---,5,---
https://alonhadat.com.vn/ban-nha-pho-mac-thi-buoi-hai-ba-trung-phan-lo-gara-oto-95m2x5t-mt-6m-gia-11-5-ty--7346809.html,"Bán Nhà Phố Mạc Thị Bưởi, Hai Bà Trưng, Phân Lô, Gara Ôtô, 95m2x5T, MT 6m, Giá 11.5 tỷ.","Bán Nhà Phố Mạc Thị Bưởi, Hai Bà Trưng, Phân Lô, Gara Ôtô, 95m2x5T, MT 6m, Giá 11.5 tỷ.

   Nhà thiết kế cực kỳ đẹp, gia chủ thuê kiến trúc sư hàng đầu, nội thất nhìn là mê.

+ Nhà xây 5 tầng, GARA Ôtô, hoành tráng tiện nghi đẳng cấp, xứng tầm gia chủ.
+ Mạc Thị Bưởi con phố xa hoa, đẳng cấp, gần TimeCity, Bệnh viện VinMec hưởng trọn vẹn tiện nghi đẳng cấp, hàng đầu, an ninh cuộc đời, môi trường sinh sống hoàn hảo.

+ Pháp lý chuẩn, Sổ đỏ vuông đẹp.
+ Giá bán 11.5 tỷ, có thương lượng.

    Hãy gọi cho chúng tôi 24/7 để được tư vấn, giải đáp thắc mắc về pháp lý, tìm kiếm, lựa chọn…(hoàn toàn miễn phí). 
    Chúng tôi tự hào mang lại giá trị đích thực cho quý khách hàng.   

    Liên hệ Mr Mạnh Nhà Phố","11,5 tỷ",95 m2,"Phố Mạc Thị Bưởi, Phường Vĩnh Tuy, Quận Hai Bà Trưng, Hà Nội",7346809,_,---,Cần bán,5m,---,Nhà trong hẻm,Sổ hồng/ Sổ đỏ,---,---,5,---,---,5,---
https://alonhadat.com.vn/ban-gap-nha-pho-nguyen-an-ninh-hai-ba-trung-kinh-doanh-oto-60m2x4t-gia-8-4-ty-7018370.html,"Bán Gấp Nhà Phố Nguyễn An Ninh, Hai Bà Trưng, Kinh Doanh, Ôtô 60m2x4T, Giá 8.4 tỷ","Bán Gấp Nhà Phố Nguyễn An Ninh, Hai Bà Trưng, Kinh Doanh, Ôtô 60m2x4T, Giá 8.4 tỷ

   Gia chủ cần bán cực gấp nhà phố Nguyễn An Ninh Ôtô đỗ cửa, KINH DOANH ngày đêm.

+ Vị trí nhà đẹp gần phố vài bước chân là ra Mặt phố Nguyễn An Ninh tiện nghi đẳng cấp tuyệt vời.
+ Tiện nghi khu vực đầy đủ, ngõ thông sang Trương Định, gần Phố Vọng, Trần Đại Nghĩa, Đại La, Minh Khai, Tương Mai… các trường Đại học lớn: Kinh Tế Quốc Dân, Bách Khoa, Xây Dựng…
+ Khu vực đang phát triển từng ngày, hiệu suất kinh doanh cao.

+ Pháp lý chuẩn, sẵn sàng giao dịch.
+ Giá bán 8.4 tỷ, có thương lượng (đơn giản là quá rẻ)

    Hãy gọi cho chúng tôi 24/7 để được tư vấn, giải đáp thắc mắc về pháp lý, tìm kiếm, lựa chọn…(hoàn toàn miễn phí). 
    Chúng tôi tự hào mang lại giá trị đích thực cho quý khách hàng.   
    Liên hệ Mr Mạnh Nhà Phố","8,4 tỷ",60 m2,"Đường Nguyễn An Ninh, Phường Đồng Tâm, Quận Hai Bà Trưng, Hà Nội",7018370,_,---,Cần bán,5m,---,Nhà trong hẻm,Sổ hồng/ Sổ đỏ,---,---,4,---,---,4,---
https://alonhadat.com.vn/ban-nha-pho-8-3-hai-ba-trung-phan-lo-oto-thang-may-45m2x6t-mt-3-9m-gia-8-1-ty-12131554.html,"Bán Nhà Phố 8/3, Hai Bà Trưng, Phân Lô, Ôtô, THANG MÁY 45m2x6T, MT 3.9m, Giá 8.1 tỷ","Bán Nhà Phố 8/3, Hai Bà Trưng, Phân Lô, Ôtô, THANG MÁY 45m2x6T, MT 3.9m, Giá 8.1 tỷ

   Nhà nằm ở vị trí đẹp tuyệt vời con Phố 8/3, quận Hai Bà Trưng gia đình có công việc nên cần bán nhanh.

+ Nhà nằm ở khu vực Phân Lô, Ôtô dân trí cao, an ninh, dân sinh đỉnh, Ôtô tránh, tiện nghi đẳng cấp.
+ Gia chủ có nhu cầu bán đi chuyển sang nhà to hơn, thiện chí vô cùng tặng lại toàn bộ nội thất cho khách mua.
+ Tiện nghi khu vực đầy đủ, đường thông hè thoáng, gần Bệnh viện Thanh Nhàn, Công viên Tuổi Trẻ, Bệnh viện VinMec, TimeCity, Trường học Vinshool, khu TTTM lớn…

+ Pháp lý chuẩn, Sổ đỏ chính chủ, sẵn sàng giao dịch.
+ Giá bán 8.5 tỷ, có thương lượng.

    Hãy gọi cho chúng tôi 24/7 để được tư vấn, giải đáp thắc mắc về pháp lý, tìm kiếm, lựa chọn…(hoàn toàn miễn phí). 
    Tự hào mang lại giá trị đích thực cho quý khách hàng.   

    Liên hệ Mr Mạnh Nhà Phố","8,1 tỷ",45 m2,"Phố 8/3, Phường Quỳnh Mai, Quận Hai Bà Trưng, Hà Nội",12131554,_,---,Cần bán,4m,---,Nhà trong hẻm,Sổ hồng/ Sổ đỏ,---,---,6,---,---,5,---
https://alonhadat.com.vn/ban-nha-pho-vo-thi-sau-hai-ba-trung-mat-ho-oto-phan-lo-66m2x5t-11-5-ty-7662420.html,"Bán Nhà Phố Võ Thị Sáu, Hai Bà Trưng, Mặt Hồ, Ôtô, Phân Lô 66m2x5T, 11.5 tỷ","Bán Nhà Phố Võ Thị Sáu, Hai Bà Trưng, Mặt Hồ, Ôtô, Phân Lô 66m2x5T, 11.5 tỷ

   Gia đình cần bán gấp căn nhà Mặt hồ Quỳnh, Võ Thị Sáu, quận Hai Bà Trưng.

+ Nhà xây 5 tầng chủ tự xây, thiết kế rất hợp lý, công năng đầy đủ.
+ Võ Thị Sáu con phố trung tâm đẹp nhất quận Hai Bà Trưng Mặt Hồ điều hòa không khí thư thái con người, cách Công viên Tuổi Trẻ thể dục thể thao nâng cao sức khỏe…
+ Nhà gần nhiều trường đại học lớn: Bách Khoa, Kinh Tế Quốc Dân, Xây Dựng… cực thuận tiện.

+ Pháp lý: Sổ đỏ vuông đẹp, sẵn sàng giao dịch.
+ Giá bán 11.5 tỷ, có thương lượng.

     Hãy gọi cho chúng tôi 24/7 để được tư vấn, giải đáp thắc mắc về pháp lý, tìm kiếm, lựa chọn…(hoàn toàn miễn phí). 
    Chúng tôi tự hào mang lại giá trị đích thực cho quý khách hàng.   

    Liên hệ Mr Mạnh Nhà Phố","11,5 tỷ",66 m2,"Phố Võ Thị Sáu, Phường Thanh Nhàn, Quận Hai Bà Trưng, Hà Nội",7662420,_,---,Cần bán,5m,---,Nhà trong hẻm,Sổ hồng/ Sổ đỏ,---,---,5,---,---,5,---
https://alonhadat.com.vn/ban-nha-phan-lo-dang-cap-oto-tranh-pho-vong-hai-ba-trung-68m2x5t-mt-5m-gia-9-9-ty--6896575.html,"Bán Nhà Phân Lô Đẳng Cấp, Ôtô Tránh Phố Vọng, Hai Bà Trưng 68m2x5T, MT 5m, Giá 9.9 tỷ.","Bán Nhà Phân Lô Đẳng Cấp, Ôtô Tránh Phố Vọng, Hai Bà Trưng 68m2x5T, MT 5m, Giá 9.9 tỷ.

   Phố Vọng con phố đẹp nhà nằm trong khu Phân Lô đẳng cấp văn phòng quốc hội, đẳng cấp bậc nhất.
+ Nhà xây 5 tầng, thiết kế đẹp, công năng hoàn hảo, khu vực Phân lô bàn cờ, dân trí đẳng cấp.
+ Môi trường sống thanh lịch, hàng xóm toàn cán bộ cấp cao.

+ Pháp lý chuẩn, Sổ đỏ chính chủ.
+ Giá bán 9.9 tỷ, có thương lượng.

    Hãy gọi cho chúng tôi 24/7 để được tư vấn, giải đáp thắc mắc về pháp lý, tìm kiếm, lựa chọn…(hoàn toàn miễn phí). 
    Chúng tôi tự hào mang lại giá trị đích thực cho quý khách hàng.   
    Liên hệ Mr Mạnh Nhà Phố","9,9 tỷ",68 m2,"Phố Vọng, Phường Đồng Tâm, Quận Hai Bà Trưng, Hà Nội",6896575,_,---,Cần bán,5m,---,Nhà trong hẻm,Sổ hồng/ Sổ đỏ,---,---,5,---,---,5,---
https://alonhadat.com.vn/ban-gap-nha-pho-lo-duc-hai-ba-trung-oto-phan-lo-thang-may-59m2x5t-mt-5m-gia-9-ty--7112062.html,"Bán Gấp Nhà Phố Lò Đúc, Hai Bà Trưng Ôtô, Phân Lô Thang Máy 59m2x5T, MT 5m, Giá 9 tỷ.","Bán Gấp Nhà Phố Lò Đúc, Hai Bà Trưng Ôtô, Phân Lô Thang Máy 59m2x5T, MT 5m, Giá 9 tỷ.

   Gia chủ cần bán gấp nhà Phố Lò Đúc quận Hai Bà Trưng.
+ Vị trí nhà đẹp gần phố vài bước chân là ra Mặt phố Lò Đúc nhà trong ngõ nhưng cực kỳ gần phố.
+ Nhà chủ tự xây cẩn thận chắc chắn vô cùng, chủ nhà tâm huyết làm ăn rất có lộc nay bán đi mua Biệt thự bên Long Biên thiện chí tặng lại toàn bộ nội thất cho khách mua.
+ Lò Đúc con phố đẹp trung tâm cốt lõi của quận Hai Bà Trưng lên Hồ Gươm vài phút đi xe, dân trí cao, an ninh tốt, hàng xóm toàn cán bộ nhà nước thân thiện.

+ Pháp lý chuẩn, Sổ đỏ chính chủ, sẵn sàng giao dịch.
+ Giá bán 9 tỷ, có thương lượng.

Hãy gọi cho chúng tôi 24/7 để được tư vấn, giải đáp thắc mắc về pháp lý, tìm kiếm, lựa chọn…(hoàn toàn miễn phí). 
    Chúng tôi tự hào mang lại giá trị đích thực cho quý khách hàng.   
    Liên hệ Mr Mạnh Nhà Phố",5 tỷ,59 m2,"Phố Lò Đúc, Phường Đống Mác, Quận Hai Bà Trưng, Hà Nội",7112062,_,---,Cần bán,5m,---,Nhà trong hẻm,Sổ hồng/ Sổ đỏ,---,---,5,---,---,4,---
https://alonhadat.com.vn/ban-gap-nha-sieu-hot-pho-trieu-viet-vuong-hai-ba-trung-phan-lo-oto-45m2x5t-gia-13-1-ty-6753658.html,"Bán Gấp Nhà Siêu Hot Phố Triệu Việt Vương, Hai Bà Trưng, Phân Lô, Ôtô 45m2x5T, Giá 13.1 tỷ","Bán Gấp Nhà Siêu Hot Phố Triệu Việt Vương, Hai Bà Trưng, Phân Lô, Ôtô 45m2x5T, Giá 13.1 tỷ.

   Triệu Việt Vương con phố cực đẹp nhà nằm ở vị trí đắc địa, phố hàng hiệu khu trung tâm của các trung tâm, mang đậm phong cách của con phố cũ với điểm nhấn đặc biệt là các quán café tao nhã.
+ Nhà xây 5 tầng đẹp vị trí đỉnh 1 bước chân là ra mặt phố Triệu Việt Vương oai hùng y như cái tên của vị vua đã đánh đuổi quân xâm lược là Lương, giữ nền độc lập cho nước Vạn Xuân.
+ Tiện nghi khu vực thì khỏi phải bàn lõi của trung tâm lên Hồ Gươm vài bước chân, nếp sống Hà Thành văn minh, thanh lịch, đẳng cấp.

+ Pháp lý: Sổ đỏ chính chủ, chủ hiền lành thiện chí.
+ Giá bán 13.1 tỷ, có thương lượng.

    Hãy gọi cho chúng tôi 24/7 để được tư vấn, giải đáp thắc mắc về pháp lý, tìm kiếm, lựa chọn…(hoàn toàn miễn phí). 
    Chúng tôi tự hào mang lại giá trị đích thực cho quý khách hàng.   
    Liên hệ Mr Mạnh Nhà Phố","13,1 tỷ",45 m2,"Phố Triệu Việt Vương, Phường Bùi Thị Xuân, Quận Hai Bà Trưng, Hà Nội",6753658,_,---,Cần bán,5m,---,Nhà trong hẻm,Sổ hồng/ Sổ đỏ,---,---,5,---,---,6,---
https://alonhadat.com.vn/ban-gap-nha-pho-yen-lac-hai-ba-trung-lo-goc-gara-oto-5t-91m-mt-8m-gia-10-4-ty--7518085.html,"Bán Gấp Nhà Phố Yên Lạc, Hai Bà Trưng, Lô Góc, Gara Ôtô, 5T, 91m, MT 8m, Giá 10.4 tỷ.","Bán Gấp Nhà Phố Yên Lạc, Hai Bà Trưng, Lô Góc, Gara Ôtô, 5T, 91m, MT 8m, Giá 10.4 tỷ.

   Nhà nằm ở khu phân lô đẳng cấp nhất phố Yên Lạc, quận Hai Bà Trưng, nhà xây 5 tầng hoành tráng nhất khu, Mặt tiền khủng 8m quá chi là đẹp.
+ Gara Ôtô cực kỳ thuận tiện để được 2 xe 7 chỗ, còn gì tuyệt vời hơn.
+ Gia chủ thiết kế nhà cực kỳ tâm huyết, thuê Kiến trúc sư thiết kế từng ly từng tý của căn nhà mang lại 1 nội thất hoàn hoàn cho căn nhà.
+ Tiện nghi khu vực đầy đủ, cái gì cũng có: TTTM, Bệnh viện, Trường Học, đủ cả.

+ Pháp lý chuẩn, Sổ vuông đẹp, sẵn sàng giao dịch.
+ Giá bán 10.4 tỷ, có thương lượng.

    Hãy gọi cho chúng tôi 24/7 để được tư vấn, giải đáp thắc mắc về pháp lý, tìm kiếm, lựa chọn…(hoàn toàn miễn phí). 
    Chúng tôi tự hào mang lại giá trị đích thực cho quý khách hàng.   

    Liên hệ Mr Mạnh Nhà Phố","10,4 tỷ",91 m2,"Phố Yên Lạc, Phường Vĩnh Tuy, Quận Hai Bà Trưng, Hà Nội",7518085,_,---,Cần bán,5m,---,Nhà trong hẻm,Sổ hồng/ Sổ đỏ,---,---,5,---,---,6,---
https://alonhadat.com.vn/ban-gap-nha-pho-tran-khat-chan-hai-ba-trung-oto-van-phong-64m2x5t-mt-5m-gia-9-1-ty-7120379.html,"Bán Gấp Nhà Phố Trần Khát Chân, Hai Bà Trưng Ôtô, Văn Phòng 64m2x5T, MT 5m, Giá 9.1 tỷ","Bán Gấp Nhà Phố Trần Khát Chân, Hai Bà Trưng Ôtô, Văn Phòng 64m2x5T, MT 5m, Giá 9.1 tỷ

    TRẦN KHÁT CHÂN con phố đẹp trung tâm giao thông đi lại thuận tiện của quận Hai Bà Trưng gia đình có công việc nên cần bán cực gấp.

+ Nhà xây 5 tầng thiết kế cơ bản, công năng đầy đủ, gia chủ tự xây nên rất tâm huyết.
+ Nhà đường Ôtô, khu phân lô làm văn phòng cực đỉnh đường đi lối lại thuận tiện.
+ Khu vực yên tĩnh, hàng xóm thân thiện, tiện nghi đầy đủ gần Bệnh viện Bưu Điện, Trường học các cấp, Công viên Thống Nhất, Hồ Bảy Mẫu, lên Hồ Gươm vài phút đi xe.

+ Pháp lý: Sổ đỏ chính chủ, cất két.
+ Giá bán 9.1 tỷ, có thương lượng.

    Hãy gọi cho chúng tôi 24/7 để được tư vấn, giải đáp thắc mắc về pháp lý, tìm kiếm, lựa chọn…(hoàn toàn miễn phí). 
    Chúng tôi tự hào mang lại giá trị đích thực cho quý khách hàng.   
    Liên hệ Mr Mạnh Nhà Phố","9,1 tỷ",64 m2,"Đường Trần Khát Chân, Phường Đống Mác, Quận Hai Bà Trưng, Hà Nội",7120379,_,---,Cần bán,5m,---,Nhà trong hẻm,Sổ hồng/ Sổ đỏ,---,---,5,---,---,5,---
https://alonhadat.com.vn/ban-gap-nha-pho-tran-khat-chan-hai-ba-trung-65m2x6t-mt-5m-phan-lo-oto-gia-8-65-ty--6917733.html,"Bán Gấp Nhà Phố Trần Khát Chân, Hai Bà Trưng 65m2x6T, MT 5m, Phân Lô, Ôtô, Giá 8.65 tỷ.","Bán Gấp Nhà Phố Trần Khát Chân, Hai Bà Trưng 65m2x6T, MT 5m, Phân Lô, Ôtô, Giá 8.65 tỷ.

    Gia chủ cần bán cực gấp căn nhà đẹp phố Trần Khát Chân, quận Hai Bà Trưng nằm trong khu vực Phân Lô, dân trí cao đẳng cấp tuyệt vời.

+ Nhà thiết kế 6 tầng, có thang máy gia chủ thuê thiết kế xây cực kỳ tâm huyết, thuê thiết kế kiến trúc sư hàng đầu.
+ Ôtô phóng thoải mái kết hợp làm văn phòng kinh doanh thì đỉnh của đỉnh.
+ Tiện nghi tuyệt vời trường học, bệnh viện đủ cả, lên Hồ Gươm vài phút đi xe.

+ Pháp lý: Sổ đỏ chính chủ, sẵn sàng giao dịch.
+ Giá bán 8.65 tỷ, có thương lượng.

    Hãy gọi cho chúng tôi 24/7 để được tư vấn, giải đáp thắc mắc về pháp lý, tìm kiếm, lựa chọn…(hoàn toàn miễn phí). 
    Chúng tôi tự hào mang lại giá trị đích thực cho quý khách hàng.   
    Liên hệ Mr Mạnh Nhà Phố","8,65 tỷ",65 m2,"Đường Trần Khát Chân, Phường Đống Mác, Quận Hai Bà Trưng, Hà Nội",6917733,_,---,Cần bán,5m,---,Nhà trong hẻm,Sổ hồng/ Sổ đỏ,---,---,6,---,---,6,---
https://alonhadat.com.vn/ban-nha-hiem-pho-hang-chuoi-hai-ba-trung-lo-goc-thang-may-80m2x7t-gia-17-ty-12154119.html,"Bán Nhà HIẾM Phố Hàng Chuối, Hai Bà Trưng Lô Góc, Thang Máy 80m2x7T, Giá 17 tỷ","Bán Nhà HIẾM Phố Hàng Chuối, Hai Bà Trưng Lô Góc, Thang Máy 80m2x7T, Giá 17 tỷ

      Gia chủ cần bán cực gấp căn nhà đẹp Phố Hàng Chuối, quận Hai Bà Trưng phân lô đẳng cấp tiện nghi tuyệt vời.

+ Nhà xây 7 cẩn thận chủ thiết kế tâm huyết nội thất hàng hiệu đầu tư nhiều tiền, thiện chí tặng lại toàn bộ cho khách mua.
+ Hàng Chuối con phố đẹp, an yên gần giao cắt nhiều tuyến phố lớn: Hàn Thuyên, Lò Đúc, Phan Chu Trinh, Hàm Long, Lê Văn Hưu, Tăng Bạt Hổ, Phan Huy Chú, Trần Hưng Đạo, Lê Thánh Tông, Phạm Đình Hổ, Nguyễn Công Trứ…

+ Pháp lý: Sổ đỏ chính chủ nở hậu, sẵn sàng giao dịch.
+ Giá bán 17 tỷ, có thương lượng.

      Hãy gọi cho chúng tôi 24/7 để được tư vấn, giải đáp thắc mắc về pháp lý, tìm kiếm, lựa chọn…(hoàn toàn miễn phí). 
      Tự hào mang lại giá trị đích thực cho quý khách hàng.   

      Liên hệ Mr Mạnh Nhà Phố",17 tỷ,80 m2,"Phố Hàng Chuối, Phường Phạm Đình Hổ, Quận Hai Bà Trưng, Hà Nội",12154119,_,---,Cần bán,4m,---,Nhà trong hẻm,Sổ hồng/ Sổ đỏ,---,---,7,---,---,7,---
https://alonhadat.com.vn/ban-92m2-dat-o-to-tranh-cach-pho-30m-thi-tran-quang-minh-huyen-me-linh-chi-1ty-930-tr-12737626.html,"Bán 92m2 Đất , Ô Tô tránh, cách phố 30m Thị Trấn Quang Minh, Huyện Mê Linh Chỉ 1Tỷ 930 tr","Bán 92m2 Đất , Ô Tô tránh, cách phố 30m, Tổ 10 Thị Trấn Quang Minh, Huyện Mê Linh, TP Hà Nội Chỉ 1Tỷ 930tr
+ Gần KCN Quang Minh, Mê Linh Plaza, thuộc tổ 10 Thị trấn Quang Minh. Ô TÔ  tránh, vào nhà, 30m ra tới trục chính.
+ Đất đẹp, khu dân trí tốt, tiện ích đủ đầy.
+ Ngay gần khu đô thị Hà Phong, cenco 5, KĐT Long Việt và nhiều dự án khác khu vực đang phát triển mạnh từng ngày.
+ Sổ đỏ chuẩn chỉ, cất két, sẵn sàng giao dịch ngay.
Phù hợp để đầu tư hoặc để xây nhà ở. Để kinh doanh
Giá chỉ 1 tỷ 930 triệu
Cần mua đất Thị Trấn Quang Minh Huyện Mê Linh Liên hệ Tuấn Chỉnh",21 triệu / m2,92 m2,"Thị trấn Quang Minh, Huyện Mê Linh, Hà Nội",12737626,_,---,Cần bán,5m,---,"Đất thổ cư, đất ở",Sổ hồng/ Sổ đỏ,---,5m,---,True,"18,4m",---,---
https://alonhadat.com.vn/ban-dat-lo-goc-46m2-full-tho-cu-mt-4m-thi-tran-chi-dong-ngo-o-to-o-xuong-chi-1-3-ty-13586485.html,"Bán đất lô góc 46m2 full thổ cư MT 4M thị trấn Chi Đông, ngõ ô tô ở xướng chỉ 1,3 tỷ","Bán đất lô góc 46m2 full thổ cư thị trấn Chi Đông, ngõ ô tô ở xướng chỉ 1,3 tỷ
Bác nào nhanh tay thì còn chậm tay thì hết ạ.
Lô góc 2 mặt tiền đất nở hậu Full thổ cư
Gần chợ Chi Đông Mê Linh Hà Nội
Đường to ngõ thông tứ phía.
Tràn viền tiện ích xung quanh. Ko thiếu thứ gì.
Gần chợ, Trường học từ mầm non đến THPT.
Giá chỉ 1,3 tỷ Giá cho các bạn công nhân an cư lập nghiệp. 
Liên hệ Tuấn Chỉnh","1,3 tỷ",46 m2,"Đường Quang Minh, Thị trấn Chi Đông, Huyện Mê Linh, Hà Nội",13586485,_,---,Cần bán,5m,---,"Đất thổ cư, đất ở",Sổ hồng/ Sổ đỏ,---,4m,---,True,11m,---,---
https://alonhadat.com.vn/ban-nha-phan-lo-oto-do-cua-pho-ta-quang-buu-hai-ba-trung-62m-ngo-thong-chi-9-ty-10147412.html,"Bán Nhà Phân Lô, Ôtô Đỗ Cửa – Phố Tạ Quang Bửu, Hai Bà Trưng 62m, Ngõ Thông, chỉ 9 tỷ","Bán Nhà Phân Lô, Ôtô – Phố Tạ Quang Bửu, Hai Bà Trưng 62m, Ngõ Thông, chỉ 9 tỷ

     Gia đình có công việc nên cần bán nhanh căn nhà cực hiếm thuộc KHU BÁCH KHOA, quận HAI BÀ TRƯNG.

+ Vị trí nhà đỉnh, Phân Lô, Ôtô đỗ cửa, ngõ thông đẹp tuyệt vời.
+ Nhà có thể kinh doanh, hiện đang cho thuê, hiệu suất cực tốt.
+ An ninh, dân trí hàng đầu.

+ Pháp lý: Sổ đỏ chính chủ, sẵn sàng giao dịch.
+ Giá bán chỉ 9 tỷ, RẺ nhất khu vực.

    Hãy gọi cho chúng tôi 24/7 để được tư vấn, giải đáp thắc mắc về pháp lý, tìm kiếm, lựa chọn…(hoàn toàn miễn phí). 
    Tự hào mang lại giá trị đích thực cho quý khách hàng.   

    Liên hệ Mr Mạnh Nhà Phố",9 tỷ,62 m2,"Phố Tạ Quang Bửu, Phường Bách Khoa, Quận Hai Bà Trưng, Hà Nội",10147412,_,---,Cần bán,4m,---,Nhà trong hẻm,Sổ hồng/ Sổ đỏ,---,---,3,---,---,4,---
https://alonhadat.com.vn/ban-nha-dep-pho-vo-thi-sau-hai-ba-trung-phan-lo-oto-75m2-5t-mat-tien-6-6m-gia-11-6-ty-7225648.html,"Bán Nhà Đẹp Phố Võ Thị Sáu, Hai Bà Trưng Phân Lô, Ôtô 75m2, 5T, Mặt tiền 6.6m, Giá 11.6 tỷ","Bán Nhà Đẹp Phố Võ Thị Sáu, Hai Bà Trưng Phân Lô, Ôtô 75m2, 5T, Mặt tiền 6.6m, Giá 11.6 tỷ.

   Võ Thị Sáu con phố tuyệt đẹp mang tên người nữ Anh hùng lực lượng vũ trang nhân dân nghe thôi đã thấy hào hùng biết bao, tự hào biết mấy.

+ Vị trí nhà rất đẹp gần Hồ Quỳnh điều hòa không khí, không gian trong lành mát mẻ, yên tĩnh, đẳng cấp.
+ Nhà gần Công viên Tuổi Trẻ cái tên Tuổi Trẻ như cộng hưởng cho sự hy sinh hào hùng của Chị vì quê hương đất nước đời đời mãi ghi.
+ Gia chủ thiết kế nhà tâm huyết, nhà đẹp, mặt tiện rộng 6.6m rất đẹp, tiện nghi xung quanh tuyệt vời gần Bệnh viện Thanh Nhàn, lên Hồ Gươm vài phút đi xe.

+ Pháp lý: Sổ đỏ chính chủ, vuông vắn.
+ Giá bán 11.6 tỷ, chủ thiện chí.

    Hãy gọi cho chúng tôi 24/7 để được tư vấn, giải đáp thắc mắc về pháp lý, tìm kiếm, lựa chọn…(hoàn toàn miễn phí). 
    Chúng tôi tự hào mang lại giá trị đích thực cho quý khách hàng.   
    Liên hệ Mr Mạnh Nhà Phố","11,6 tỷ",75 m2,"Phố Võ Thị Sáu, Phường Thanh Nhàn, Quận Hai Bà Trưng, Hà Nội",7225648,_,---,Cần bán,5m,---,Nhà trong hẻm,Sổ hồng/ Sổ đỏ,---,---,5,---,---,5,---
