url,title,description,price,area,address,Mã tin,Hướng,Phòng ăn,Loại tin,Đường trước nhà,Nhà bếp,Loại BDS,Pháp lý,Sân thượng,Chiều ngang,Số lầu,Chổ để xe hơi,Chiều dài,Số phòng ngủ,Chính chủ
https://alonhadat.com.vn/ban-nha-5-tang-ngo-hoa-binh-7-dien-tich-45m2-mat-tien-4m-gia-4-8-ty-9824939.html,"Bán nhà 5 tầng ngõ Hòa Bình 7 diện tích 45m2 mặt tiền 4m Giá 4,8 tỷ","Cần bán nhà ngõ Hoà Bình 7 Phố Minh Khai. Quận Hai Bà Trưng
Từ phố vào 1 rẽ, ngõ thẳng, đều 2,5m trở lên.
- Diện tích 45m2
Mặt tiền 4m
Nhà xây 5 tầng thiết kế cầu thang giữa mỗi tầng 2 phòng ngủ
Gồm 5 phòng rộng, 4WC.
- Nội thất Toàn bộ cửa và cầu thang gỗ Lim 100%. Bộ tủ bếp sồi Nga cao cấp, trang trí tủ rượu, vách kệ tivi, đầy đủ tiện nghi trong nhà.
- Nhà Thuộc khu phân lô hạ tầng đồng bộ, toàn sạch sẽ, dân trí cao.
 Giao thông thuận lợi. Gần phố, chợ, trường học THCS Hà Huy Tập, cấp 3 Đoàn Kết HBT. Nhà cách ngã tư chợ Mơ bạch Mai 400m
- Sổ đỏ vuông vắn
 Giá bán: 4 tỷ 800tr có thương lượng
Quý khách có nhu cầu xin liên hệ A LONG để được tư vấn miễn phí 100%","4,8 tỷ",45 m2,"Đường Minh Khai, Phường Minh Khai, Quận Hai Bà Trưng, Hà Nội",9824939,_,---,Cần bán,3m,---,Nhà trong hẻm,---,---,4m,5,---,11m,5,---
https://alonhadat.com.vn/ban-nha-5-tang-mat-ngo-thong-pho-kim-giang-dt-32m2-mt-4m-gia-3-5-ty-day-du-noi-that-8432829.html,"Bán nhà 5 tầng Mặt ngõ thông phố Kim Giang, Dt 32m2 Mt 4m, giá 3,5 tỷ, Đầy đủ nội thất","Bán nhà mặt ngõ phố Kim Giang gần Khương Đình
+ Diện tích: 32m2 
Nhà 5 tầng.
+ Mặt tiền 4m.
Nhà thiết kế hiện đại với 3 phòng ngủ rộng rãi, phòng nào cũng có cửa sổ
Nội thất toàn bộ Gỗ thịt chủ nhà để lại toàn bộ nội thất cho chủ nhà tương lai. Tổn Vị trí đẹp Ngõ thông, Gần trường học Chợ, Giao thông thuận tiện
Chủ nhà thiện chí, hàng xóm thân thiện.
+ Sổ đỏ vuông đẹp, pháp lý sạch.
+ Giá: 3.5 tỷ (Có thương lượng).
Quý khách quan tâm Lh A LONG ACB để xem nhà miễn phí và gặp trực tiếp chủ nhà thương lượng giá","3,5 tỷ",32 m2,"Đường Kim Giang, Phường Kim Giang, Quận Thanh Xuân, Hà Nội",8432829,_,---,Cần bán,3m,---,Nhà trong hẻm,Sổ hồng/ Sổ đỏ,---,4m,5,---,8m,4,---
https://alonhadat.com.vn/ban-nha-duong-de-la-thanh-gan-dh-gtvt-45m2-x4-tang-gia-4-2-ty-6834012.html,"Bán nhà đường Đê La Thành, Gần ĐH GTVT 45m2 x4 tầng giá 4,2 tỷ","Cần bán Gấp Nhà phố Đê La Thành, quận Đống Đa
Diện tích 45m2
Nhà 4 tầng
mặt tiền 4,5m
Nhà mới xây 2015 còn rất mới, thiết kế hiện đại, Cầu thang  giữa mỗi tầng 2 phòng 2 vệ sinh khép kín
Nhà nằm trong khu dân trí cao giao thông thuận lợi, Gần Công viên Thủ Lệ, gần ĐH GTVT
Sổ đỏ pháp lý rõ ràng
Giá bán 4,2 tỷ có thương lượng","4,2 tỷ",45 m2,"Đường Đê La Thành, Phường Láng Hạ, Quận Đống Đa, Hà Nội",6834012,_,---,Cần bán,3m,---,Nhà trong hẻm,Sổ hồng/ Sổ đỏ,---,"4,5m",4,---,10m,4,---
https://alonhadat.com.vn/ban-nha-phan-lo-o-to-vao-nha-duong-giai-phong-56m2-x4-tang-gia-9-ty-6863750.html,"Bán nhà phân lô Ô tô vào nhà đường Giải Phóng, 56m2 x4 tầng giá 9 tỷ","Cần bán Nhà phân lô liền kề Ô tô vào nhà 
Đường trước nhà 2 làn xe ô tô có vỉa hè, 
Thích hợp làm phòng Khám, Vp công ty
Địa chỉ khu Biệt tự liền kề Tracomeco tổ 7 Phương Mai
Giao thông thuận tiện đi từ ngõ 102 Trường Chinh hoặc đi Lương Định của vào hoặc đi từ Giải Phóng vào đều được
Nhà ngay cạnh Bệnh Viện Bạch Mai, Da liễu TW, Tai Mũi Họng TW, BV Nhiệt Đới, BV ĐH Y Hà Nội
Và các trường ĐH Bách Khoa, Xây Dựng, KT Quốc Dân
Sổ đỏ Nở Hậu 5cm
Giá bán 9 tỷ có thương lượng
Quý khách quan tâm xin LH Cty BĐS Hoàng Long ACB để gặp trực tiếp chủ nhà để thương lượng giá",9 tỷ,56 m2,"Đường Giải Phóng, Phường Phương Mai, Quận Đống Đa, Hà Nội",6863750,_,---,Cần bán,9m,---,Nhà trong hẻm,Sổ hồng/ Sổ đỏ,---,5m,4,---,12m,4,---
https://alonhadat.com.vn/ban-nha-pho-tay-son-quan-dong-da-dien-tich-47m2-x4-tang-gia-3-6-ty-6856238.html,"Bán nhà phố Tây Sơn Quận Đống Đa ,diện tích 47m2 x4 tầng giá 3,6 tỷ","Cần bán Gấp nhà phố Tây Sơn, Quận Đống Đa
DIện tích 47m2 Nhà 4 tầng 1 tum
Vị trí đẹp Gần Ngã tư Sở, Ngõ thông sang phố Thái Hà
Nhà đẹp mới xây được vài năm, Đầy đủ nội thất, chủ nhà tặng lại toàn bộ cho khách mua
Tổng có 4 phòng ngủ 3 Vệ Sinh
Sổ đỏ Nở Hậu, đầy đủ pháp lý
Giá bán 3,6 tỷ có thương lương
Quý khách quan tâm xin LH Cty BĐS Hoàng Long ACB để gặp trực tiếp chủ nhà để thương lượng giá","3,6 tỷ",47 m2,"Phố Tây Sơn, Phường Thịnh Quang, Quận Đống Đa, Hà Nội",6856238,_,---,Cần bán,3m,---,Nhà trong hẻm,Sổ hồng/ Sổ đỏ,---,4m,4,---,12m,4,---
https://alonhadat.com.vn/lo-goc-thanh-xuan-sieu-dep-kinh-doanh-khung-o-cho-thang-may120mx8m-13259598.html,"Lô góc Thanh Xuân siêu đẹp, kinh doanh khủng, ô chờ thang máy120mx8m","+ Nhà nằm vị trí đẹp nhất Thanh Xuân, 1 mặt phố 2 mặt ngõ, 3 mặt thoáng vĩnh viễn. Lợi thế sử dụng 2 vỉa hè. Kinh doanh sầm uất ngày đêm. Một vị trí vàng, tiện ích đầy đủ, giao thông thuận lợi gần chợ, bệnh viện, TTTM, Vũ Tông Phan, Nguyễn Trãi, Vũ Trọng Phụng, Khương Đình, Kim Giang, Trường Chinh, ROYAL CITY, Đại học Hà Nội, Kiến Trúc, Khoa học xã hội và Nhân Văn…
+ Nhà thiết kế 5 tầng siêu đẹp có ô chờ thang máy, thông sàn, cửa sổ thoáng sáng, tràn ngập sinh khí.
+ Sổ đỏ chính chủ. 
+ Miễn phí xem nhà và tư vấn pháp lý, liên hệ Ms Hồng chuyên thổ cư Hà Nội.",46 tỷ,120 m2,"Phố Vũ Tông Phan, Phường Khương Đình, Quận Thanh Xuân, Hà Nội",13259598,_,---,Cần bán,60m,---,Nhà mặt tiền,Sổ hồng/ Sổ đỏ,---,8m,5,---,---,4,---
https://alonhadat.com.vn/cuc-dep-7t-thang-may-thai-ha-noi-that-sin-so-tam-tien-sieu-hiem-11801134.html,Cực đẹp 7T thang máy Thái Hà nội thất sịn sò tầm tiền siêu hiếm,"+ Siêu phẩm mặt phố mặt tiền khủng, vị trí cực đẹp, đường rộng ô tô tránh, có vỉa hè xe cộ dừng đỗ. Xung quanh tiện ích nhiều vô kể, giao thông cực kỳ thuận tiện Thái Hà, Hoàng Cầu, Huỳnh Thúc Kháng, chợ, Đại học Thuỷ Lợi, Công Đoàn…
+ Siêu hiếm toà nhà tầm tiền đáp ứng nhiều công năng sử dụng, vừa để ở vừa kinh doanh hoặc bất chấp các loại hình, chủ cần tiền mới bán.
+ Nhà 7 tầng thang máy 2 thoáng thiết kế cực hiện đại, nhập ngoại nội thất sịn sò, điều hoà âm trần… thiết bị vệ sinh cao cấp. 
+ Sổ đỏ vuông đẹp. 
+ miễn phí xem nhà và tư vấn pháp lý, liên hệ Ms Hồng chuyên thổ cư Hà Nội","24,4 tỷ",80 m2,"Phố Thái Hà, Phường Quang Trung, Quận Đống Đa, Hà Nội",11801134,_,---,Cần bán,40m,---,Nhà trong hẻm,Sổ hồng/ Sổ đỏ,---,6m,7,---,---,4,---
https://alonhadat.com.vn/nha-dep-nhat-ba-dinh-kinh-doanh-sam-uat-gia-hap-dan-bat-ngo-110mx6m-13224193.html,Nhà đẹp nhất Ba Đình kinh doanh sầm uất giá hấp dẫn bất ngờ 110mx6m,"+ Vị trí rất đẹp, đẹp nhất Ba Đình, vỉa hè, đường hai chiều, kinh doanh sầm uất, thông tứ tung Tây Hồ, Đống Đa, Hoàn Kiếm, vài phút ra Lăng Bác, Hồ Tây, Hồ Gươm gần chợ, bệnh viện, công viên, Kim Mã, Giảng Võ, Nguyễn Thái Học, Đội Cấn, Liễu Giai, Giang Văn Minh…
+ Nhà cũ xác định bán đất, tổng 5 ngủ, 2 vs. 
+ Khách mua xây toà 8 tầng thang máy, kinh doanh mọi loại hình.
+ Sổ đỏ chính chủ cất két.
+ Miễn phí xem nhà và tư vấn pháp lý, liên hệ Ms Hồng chuyên thổ cư Hà Nội.",22 tỷ,110 m2,"Đường Ngọc Hà, Phường Ngọc Hà, Quận Ba Đình, Hà Nội",13224193,_,---,Cần bán,60m,---,Nhà mặt tiền,Sổ hồng/ Sổ đỏ,---,---,2,---,---,5,---
https://alonhadat.com.vn/hoa-hau-hai-ba-trung-thang-may-cuc-thoang-150mx5-tang-nhinh-50-ty-13219952.html,Hoa hậu Hai Bà Trưng thang máy cực thoáng 150mx5 tầng nhỉnh 50 tỷ,"+ Nhà có vị trí đẹp nhất phố, hoa hậu Hai Bà Trưng  thoáng trước sau, vỉa hè rộng để xe thoải mái, mặt tiền quyền lực kinh doanh đa dạng mọi loại hình, giao thông thuận tiện đi lại gần chợ, Đại học Bách Khoa, Kinh Tế, Xây Dựng, phố Huế, Bạch Mai, Thanh Nhàn, Kim Ngưu, Lạc Trung, Đại Cồ Việt, Minh Khai, Đại La…
+ Nhà 5 tầng đẹp long lanh, chủ thiết kế xây 10 tầng, khách mua về lên tầng thoải mái.
+ Hiện chủ cho thuê 100 triệu/tháng, khách mua có thể cho thuê tiếp hoặc lấy nhà luôn. 
+ Sổ hoa hậu cực đẹp.
+ Miễn phí xem nhà và tư vấn pháp lý, liên hệ Ms Hồng chuyên thổ cư Hà Nội.",55 tỷ,150 m2,"Đường Thanh Nhàn, Phường Bạch Mai, Quận Hai Bà Trưng, Hà Nội",13219952,_,---,Cần bán,60m,---,Nhà mặt tiền,Sổ hồng/ Sổ đỏ,---,9m,5,---,---,4,---
https://alonhadat.com.vn/duy-nhat-1-can-le-trong-tan-thanh-xuan-160mx6m-duoi-60-ty-13254865.html,Duy nhất 1 căn Lê Trọng Tấn Thanh Xuân 160mx6m dưới 60 tỷ,"+ Vị trí siêu độc, siêu hiếm, duy nhất 1 căn Lê Trọng Tấn đường đẹp nhất Hà Nội, Vip nhất Quận Thanh Xuân thoáng 2 mặt, mặt tiền rộng siêu tài lộc, vỉa hè siêu rộng gần Trường Chinh, Hoàng Văn Thái, Nguyễn Ngọc Nại, Vương Thừa Vũ, Tô Vĩnh Diện… 
+ Khu vực kinh doanh sầm uất. Dòng tiền cực kỳ ổn định, khai thác tối đa mọi nhu cầu, bất chấp đủ lại mặt hàng.
+ Nhà 4 tầng xác định bán đất tặng nhà, chủ mới về xây tòa nhà văn phòng, căn hộ dịch vụ, và tất cả các loại hình kinh doanh thì đẳng cấp, lợi nhuận càng cao.
+ Sổ đỏ pháp lý cực chuẩn.  
+ Miễn phí xem nhà và tư vấn pháp lý, liên hệ Ms Hồng chuyên thổ cư Hà Nội.",60 tỷ,160 m2,"Phố Lê Trọng Tấn, Phường Khương Mai, Quận Thanh Xuân, Hà Nội",13254865,_,---,Cần bán,60m,---,Nhà mặt tiền,Sổ hồng/ Sổ đỏ,---,6m,4,---,---,4,---
https://alonhadat.com.vn/toa-building-300m-mt-12m-sieu-dang-cap-sieu-dep-vip-nhat-tay-ho-12958504.html,"Toà Building 300m, MT 12m siêu đẳng cấp, siêu đẹp, VIP nhất Tây Hồ","+ Vị trí tuyệt đẹp, siêu đẳng cấp, VIP nhất Tây Hồ, viên kim cương đường ven hồ view Hồ Tây, thông số cực đẹp, khu vực cho thuê cực tốt gần Yên Hoa, Tô Ngọc Vân, Xuân Diệu, Quảng An, Đặng Thai Mai, các chung cư, chợ, TTTM, tiện ích quá đỉnh, giao thông cực thuận lợi gần Ba Đình, Long Biên, Từ Liêm, Hoàn Kiếm…
+ Toà Building căn hộ đẳng cấp nhất phố, 1 Hầm 8 nổi cầu thang, thang máy giữa. 
+ Sổ vuông đẹp.  
+ Miễn phí xem nhà và tư vấn pháp lý, liên hệ Ms Hồng chuyên thổ cư Hà Nội.",202 tỷ,300 m2,"Đường Quảng An, Phường Quảng An, Quận Tây Hồ, Hà Nội",12958504,_,True,Cần bán,60m,True,Văn phòng,Sổ hồng/ Sổ đỏ,True,12m,9,True,---,3,---
https://alonhadat.com.vn/ban-nha-van-quan-ha-dong-35m-3-4-ty--13484107.html,"Bán Nhà Văn Quán Hà Đông, 35m, 3.4 Tỷ.","NGÕ NÔNG RỘNG  - SÂN ĐỂ XE  - CÁCH Ô TÔ 5M  - GẦN KĐT VĂN QUÁN
+ Nhà nằm trong ngõ 146 đường 19/5, đi được ngõ 217 Trần Phú, gần KĐT Văn Quán, Sở Tư Pháp Hà Nội, tiện ích đầy đủ.
+ Sổ đỏ 33m diện tích sử dụng chung 31m, nở hậu, hai mặt ngõ , 3 thoáng, hiện trạng đang là nhà C4 có gác xép, 2 phòng ngủ, 1 phòng bếp , 1 phòng vệ sinh. trước nhà để được 10 chiếc SH. chủ mới mua về chưa có điều kiện xây vãn ở tốt.
+ Sổ đỏ nở hậu giao dịch ngay.","3,4 tỷ",35 m2,"Đường 19 tháng 5, Phường Văn Quán, Quận Hà Đông, Hà Nội",13484107,_,---,Cần bán,5m,True,Nhà trong hẻm,Sổ hồng/ Sổ đỏ,True,---,1,---,---,2,---
https://alonhadat.com.vn/ban-nha-tap-the-tang-1-vinh-tuy-hai-ba-trung-50m-so-do-1-55-ty-12661690.html,"Bán nhà tập thể tầng 1 Vĩnh Tuy, Hai Bà Trưng,50m , sổ đỏ,1,55 tỷ","Tôi cần bán nhà tập thể tầng 1 của Vĩnh Tuy,quận Hai Bà Trưng,Hà nội, diện tích sổ là 18m thực tế là 50m 
Sổ đỏ riêng
Nhà mình bán ngay cạnh trường học cấp 1 vĩnh tuy, gần chợ vài bước ra tới nơi,tiện ích xung quanh ngập tràn
Nhà đẹp như hình
LH Thái Bình tôi để được xem nhà
Mọi thông tin chuẩn","1,55 tỷ",50 m2,"Đường Dương Văn Bé, Phường Vĩnh Tuy, Quận Hai Bà Trưng, Hà Nội",12661690,_,---,Cần bán,"2,7m",---,Nhà trong hẻm,---,---,---,1,---,---,2,---
https://alonhadat.com.vn/ban-nha-tap-the-tang-1-tan-mai-hoang-mai-60m-1-55-ty-12660100.html,"Bán nhà tập thể tầng 1 Tân Mai,Hoàng Mai, 60m, 1,55 tỷ","Bán nhà tập thể tầng 1 phố tân mai,phường Tân Mai,hoàng mai
Nhà mình bán là tập thể 2 tầng ,nhà mình bán tầng 1 ,diện tích sổ 17m ,diện tích thực tế 60m
Nhà hiện đang gồm 3 ngủ,1 khách,1 bếp, 1 vs
Nhà mình bán cách 1 nhà là ra mặt ngõ ô tô đỗ ngày đêm
Gần trường cấp tân mai
LH Thái Bình tôi để được xem nhà miễn phí","1,55 tỷ",60 m2,"Phố Tân Mai, Phường Tân Mai, Quận Hoàng Mai, Hà Nội",12660100,_,---,Cần bán,4mm,---,Nhà trong hẻm,Sổ hồng/ Sổ đỏ,---,---,1,---,---,3,---
https://alonhadat.com.vn/ban-nha-hong-mai-20m-4-tang-so-do-gia-1-78-ty-12670367.html,"Bán Nhà Hồng Mai,20m, 4 tầng, sổ đỏ, giá 1,78 tỷ","Bán nhà hồng mai ngay trường cấp 1, cạnh cây xăng
Diện tích 20m X 4 tầng giá 1,78 tỷ sổ đỏ chung
Khu vực nhiều tiện ích, ngay đầu bạch mai
Phố hồng mai được nằm trên đường bạch mai đoạn trung tâm thương mại chợ mơ
Phố hồng mai được kéo dài từ bạch mai đến ngõ quỳnh, chùa quỳnh, bùi ngọc dương 
Tiện ích nhiều vô kể
LH Thái Bình tôi để được xem nhà","1,78 tỷ",20 m2,"Phố Hồng Mai, Phường Bạch Mai, Quận Hai Bà Trưng, Hà Nội",12670367,_,---,Cần bán,2m,---,Nhà trong hẻm,Sổ hồng/ Sổ đỏ,---,---,4,---,---,2,---
https://alonhadat.com.vn/ban-nha-minh-khai-ngo-nong-thoang-gan-trung-tam-24m-4-tang-gia-2-6-ty-so-do--12768115.html,"Bán Nhà Minh Khai, ngõ nông thoáng,gần trung tâm ,24m, 4 tầng, giá 2,6 tỷ sổ đỏ,","Bán Nhà Minh Khai,quận hoàng mai, nhà đẹp ở luôn,vị trí đẹp cách đường lớn chỉ 60m

MÔ TẢ:
+ Nhà nằm vị trí cách ô tô tránh chỉ 68m, ngõ xe ba gác tránh, trước nhà ngõ xe ba gác.
+ Nhà được gia chủ kỳ công tâm huyết thiết kế, sửa chữa như mới. Toàn bộ hệ thống điện nước, cầu thang, bể chứa nước inox làm mới 100%. Khách ở 30 năm nữa thoải mái.
+ Nội thất sang sịn mới như: Tủ bếp, thiết bị wc, tủ tivi, ghế sofa, bếp từ của Đức, sàn gỗ mới 100% hàng đặt thiết kế.
+ Nhà được thiết kế có gác lửng nên nhà rất cao, sáng, thoáng, hệ thống cửa cuốn tự động cao 4.2m không khí trong phòng lưu thoáng, sáng.
+ Diện tích thực tế xây dựng từ tầng 1 là 24m. Từ tầng 2 đua ra thành 26m sử dụng.


THIẾT KẾ:
+ Tầng 1: Phòng khách, bếp, wc.
+ Tầng 2: Tầng lửng có thể ngủ, thờ hoặc phòng làm việc.
+ Tầng 3: Phòng ngủ và vệ sinh.
+ Tầng 4: Phòng ngủ, sân phơi và vệ sinh.

PHÁP LÝ: 
+ Sổ đỏ A4 vuông vắn, nở hậu xíu.","2,6 tỷ",24 m2,"Phố Minh Khai, Phường Mai Động, Quận Hoàng Mai, Hà Nội",12768115,_,---,Cần bán,2m,---,Nhà trong hẻm,Sổ hồng/ Sổ đỏ,---,---,4,---,---,3,---
https://alonhadat.com.vn/ban-nha-thanh-nhan-ngo-nong-gan-pho-21m-5-tang-gia-2-6-ty-so-do-vuong-12784622.html,"Bán Nhà Thanh Nhàn, ngõ nông, gần phố, 21m, 5 tầng, giá 2,6 tỷ sổ đỏ vuông","Nhà đẹp, đủ công năng, tầm tiền nhiều khách
Cần bán nhà Thanh Nhàn, ô tô đỗ gần nhà, cách mặt phố Thanh Nhàn 30m, diện tích 21m, 5 tầng ,giá 2,6 tỷ,có thương lượng, sổ đỏ vuông đẹp 
+ Vị trí trung tâm quận Hai Bà Trưng, 30m ra mặt phố Thanh Nhàn, ngách trước nhà thông sang ngõ 112 Thanh Nhàn. Ngõ, ngách thông vòng quanh sang Trại Găng

+ Xây dựng đủ công năng, gồm:
- Tầng 1: Phòng khách + bếp vs.
- Tầng 2,3,4: Phòng ngủ + vs khép kín.
- Tầng 5: Phòng thờ, sân phơi.

+ Sổ đỏ riêng, chính chủ cất két, sẵn sàng giao dịch.","2,6 tỷ",21 m2,"Đường Thanh Nhàn, Phường Thanh Nhàn, Quận Hai Bà Trưng, Hà Nội",12784622,_,---,Cần bán,"1,5m",---,Nhà trong hẻm,Sổ hồng/ Sổ đỏ,---,---,5,---,---,3,---
https://alonhadat.com.vn/ban-nha-truong-dinh-hai-ba-trung-mua-o-nha-dan-xay-28m-4-tang-so-do-12862421.html,"Bán Nhà trương định, hai bà trưng, 28m , 4 tầng , 2,35 tỷ","QUÁ RẺ 2,38 TỶ TRUNG TÂM THỦ ĐÔ - NHÀ ĐẸP- LÔ GÓC 3 MẶT THOÁNG - THÔNG SỐ LÝ TƯỞNG- TẦM TIỀN - dễ mua
Mô tả.
+ Khu Trung tâm đi đâu cũng thuận tiện. Nhà lô góc 3 mặt thoáng sáng, các phòng đều có cửa sổ thoáng sáng.
+ Xung quanh tiện ích ko thiếu thứ gì vài phút ra chợ Trương Định, chợ Mơ. Gần các trường học từ Cấp 1 đến Cấp 3 và các trường Đại học lớn Bách - Kinh - Xây. 
+ Nhà thiết kế đầy đủ công năng.
Tầng 1: Phòng khách và bếp.
Tầng 2,3: Mỗi tầng 1 phòng ngủ khép kín.
Tầng 4: Sân phơi và phòng thờ rộng, có thể chuyển đổi thành phòng ngủ nếu muốn.
  
Sổ đỏ cc","2,35 tỷ",28 m2,"Đường Trương Định, Phường Trương Định, Quận Hai Bà Trưng, Hà Nội",12862421,_,---,Cần bán,2m,---,Nhà trong hẻm,Sổ hồng/ Sổ đỏ,---,---,4,---,---,3,---
https://alonhadat.com.vn/ban-nha-hoang-mai-giap-hai-ba-trung-25m-4-tang-gia-1-5-ty-so-do-12867915.html,"Bán Nhà Hoàng Mai,giáp Hai Bà Trưng, 25m, 4 tàng,giá 1,5 tỷ, số đỏ","Bác Tôi cần bán nhà ngõ 255 lĩnh Nam  .25mx4 tầng nhỉnh 1 tỷ , có sổ đỏ. Gần phố, sát chợ ,Giao thông thuận tiện
Do tuổi cao bác tôi muốn bán nhanh để về sống cùng con. Nhà nằm ở ngõ 255, ngõ sầm uất nhất phố, thuận tiện giao thông đi lại,  25mx4 tầng. 3 ngủ , đầy đủ công năng, chu tự xây rất chắc chắn về sửa qua phần ngoài là ở đẹp. Giá 1.5 tỷ ( có thương lượng). Liên hệ tôi ngay để xem nhà","1,5 tỷ",25 m2,"Đường Lĩnh Nam, Phường Lĩnh Nam, Quận Hoàng Mai, Hà Nội",12867915,_,---,Cần bán,2m,---,Nhà trong hẻm,Sổ hồng/ Sổ đỏ,---,---,4,---,---,3,---
https://alonhadat.com.vn/ban-nha-lo-goc-den-lu-hoang-mai-32m-5-tang-gia-3-8-ty-so-do-vuong-co-thuong-luong-12942104.html,"Bán nhà lô góc, đền lừ,hoàng mai, 45m, 5 tầng, giá 3,25 tỷ, sổ đỏ vuông,có thương lượng","Lô góc 2 mặt thoáng, nhà mình bán thuộc đền lừ Hoàng Mai
Diện tích 45m, 5 tầng, giá 3,25 tỷ , số đỏ vuông như tờ A4 ,giá có thương lượng
Tiện ích khi vực đền lừ miễn bàn,dân trí cao, đầy đủ các tiện ích, trung tâm thể dục thể thao, sàn pa, thâm mỹ, cafe , ăn uống bạt ngàn
Trường học ,cấp 1, 2 ,nầm non,các con tự đi học vì ngay gần nhà
Các trung cư siêu thị nhiều như nấm
Thiết kế nhà
Tầng 1:khách, bếp, vs
Tầng 2:3:4 mỗi tầng 1ngủ +vs
Tầng 5: phòng thờ sân phơi
LH Thái Bình tôi gặp chủ","3,25 tỷ",45 m2,"Đường  Hồ Đền Lừ, Phường Hoàng Văn Thụ, Quận Hoàng Mai, Hà Nội",12942104,_,---,Cần bán,"2,5m",---,Nhà trong hẻm,Sổ hồng/ Sổ đỏ,---,---,5,---,---,3,---
