url,title,description,price,area,address,Mã tin,Hướng,Phòng ăn,Loại tin,Đường trước nhà,Nhà bếp,Loại BDS,Pháp lý,Sân thượng,Chiều ngang,Số lầu,Chổ để xe hơi,Chiều dài,Số phòng ngủ,Chính chủ,Thuộc dự án
https://alonhadat.com.vn/ban-gap-nha-pho-yen-lac-hai-ba-trung-lo-goc-gara-oto-5t-91m-mt-8m-gia-10-4-ty--7518085.html,"Bán Gấp Nhà Phố Yên Lạc, Hai Bà Trưng, Lô Góc, Gara Ôtô, 5T, 91m, MT 8m, Giá 10.4 tỷ.","Bán Gấp Nhà Phố Yên Lạc, Hai Bà Trưng, Lô Góc, Gara Ôtô, 5T, 91m, MT 8m, Giá 10.4 tỷ.

   Nhà nằm ở khu phân lô đẳng cấp nhất phố Yên Lạc, quận Hai Bà Trưng, nhà xây 5 tầng hoành tráng nhất khu, Mặt tiền khủng 8m quá chi là đẹp.
+ Gara Ôtô cực kỳ thuận tiện để được 2 xe 7 chỗ, còn gì tuyệt vời hơn.
+ Gia chủ thiết kế nhà cực kỳ tâm huyết, thuê Kiến trúc sư thiết kế từng ly từng tý của căn nhà mang lại 1 nội thất hoàn hoàn cho căn nhà.
+ Tiện nghi khu vực đầy đủ, cái gì cũng có: TTTM, Bệnh viện, Trường Học, đủ cả.

+ Pháp lý chuẩn, Sổ vuông đẹp, sẵn sàng giao dịch.
+ Giá bán 10.4 tỷ, có thương lượng.

    Hãy gọi cho chúng tôi 24/7 để được tư vấn, giải đáp thắc mắc về pháp lý, tìm kiếm, lựa chọn…(hoàn toàn miễn phí). 
    Chúng tôi tự hào mang lại giá trị đích thực cho quý khách hàng.   

    Liên hệ Mr Mạnh Nhà Phố","10,4 tỷ",91 m2,"Phố Yên Lạc, Phường Vĩnh Tuy, Quận Hai Bà Trưng, Hà Nội",7518085,_,---,Cần bán,5m,---,Nhà trong hẻm,Sổ hồng/ Sổ đỏ,---,---,5,---,---,6,---,
https://alonhadat.com.vn/ban-gap-nha-pho-tran-khat-chan-hai-ba-trung-oto-van-phong-64m2x5t-mt-5m-gia-9-1-ty-7120379.html,"Bán Gấp Nhà Phố Trần Khát Chân, Hai Bà Trưng Ôtô, Văn Phòng 64m2x5T, MT 5m, Giá 9.1 tỷ","Bán Gấp Nhà Phố Trần Khát Chân, Hai Bà Trưng Ôtô, Văn Phòng 64m2x5T, MT 5m, Giá 9.1 tỷ

    TRẦN KHÁT CHÂN con phố đẹp trung tâm giao thông đi lại thuận tiện của quận Hai Bà Trưng gia đình có công việc nên cần bán cực gấp.

+ Nhà xây 5 tầng thiết kế cơ bản, công năng đầy đủ, gia chủ tự xây nên rất tâm huyết.
+ Nhà đường Ôtô, khu phân lô làm văn phòng cực đỉnh đường đi lối lại thuận tiện.
+ Khu vực yên tĩnh, hàng xóm thân thiện, tiện nghi đầy đủ gần Bệnh viện Bưu Điện, Trường học các cấp, Công viên Thống Nhất, Hồ Bảy Mẫu, lên Hồ Gươm vài phút đi xe.

+ Pháp lý: Sổ đỏ chính chủ, cất két.
+ Giá bán 9.1 tỷ, có thương lượng.

    Hãy gọi cho chúng tôi 24/7 để được tư vấn, giải đáp thắc mắc về pháp lý, tìm kiếm, lựa chọn…(hoàn toàn miễn phí). 
    Chúng tôi tự hào mang lại giá trị đích thực cho quý khách hàng.   
    Liên hệ Mr Mạnh Nhà Phố","9,1 tỷ",64 m2,"Đường Trần Khát Chân, Phường Đống Mác, Quận Hai Bà Trưng, Hà Nội",7120379,_,---,Cần bán,5m,---,Nhà trong hẻm,Sổ hồng/ Sổ đỏ,---,---,5,---,---,5,---,
https://alonhadat.com.vn/ban-gap-nha-pho-tran-khat-chan-hai-ba-trung-65m2x6t-mt-5m-phan-lo-oto-gia-8-65-ty--6917733.html,"Bán Gấp Nhà Phố Trần Khát Chân, Hai Bà Trưng 65m2x6T, MT 5m, Phân Lô, Ôtô, Giá 8.65 tỷ.","Bán Gấp Nhà Phố Trần Khát Chân, Hai Bà Trưng 65m2x6T, MT 5m, Phân Lô, Ôtô, Giá 8.65 tỷ.

    Gia chủ cần bán cực gấp căn nhà đẹp phố Trần Khát Chân, quận Hai Bà Trưng nằm trong khu vực Phân Lô, dân trí cao đẳng cấp tuyệt vời.

+ Nhà thiết kế 6 tầng, có thang máy gia chủ thuê thiết kế xây cực kỳ tâm huyết, thuê thiết kế kiến trúc sư hàng đầu.
+ Ôtô phóng thoải mái kết hợp làm văn phòng kinh doanh thì đỉnh của đỉnh.
+ Tiện nghi tuyệt vời trường học, bệnh viện đủ cả, lên Hồ Gươm vài phút đi xe.

+ Pháp lý: Sổ đỏ chính chủ, sẵn sàng giao dịch.
+ Giá bán 8.65 tỷ, có thương lượng.

    Hãy gọi cho chúng tôi 24/7 để được tư vấn, giải đáp thắc mắc về pháp lý, tìm kiếm, lựa chọn…(hoàn toàn miễn phí). 
    Chúng tôi tự hào mang lại giá trị đích thực cho quý khách hàng.   
    Liên hệ Mr Mạnh Nhà Phố","8,65 tỷ",65 m2,"Đường Trần Khát Chân, Phường Đống Mác, Quận Hai Bà Trưng, Hà Nội",6917733,_,---,Cần bán,5m,---,Nhà trong hẻm,Sổ hồng/ Sổ đỏ,---,---,6,---,---,6,---,
https://alonhadat.com.vn/ban-nha-hiem-pho-hang-chuoi-hai-ba-trung-lo-goc-thang-may-80m2x7t-gia-17-ty-12154119.html,"Bán Nhà HIẾM Phố Hàng Chuối, Hai Bà Trưng Lô Góc, Thang Máy 80m2x7T, Giá 17 tỷ","Bán Nhà HIẾM Phố Hàng Chuối, Hai Bà Trưng Lô Góc, Thang Máy 80m2x7T, Giá 17 tỷ

      Gia chủ cần bán cực gấp căn nhà đẹp Phố Hàng Chuối, quận Hai Bà Trưng phân lô đẳng cấp tiện nghi tuyệt vời.

+ Nhà xây 7 cẩn thận chủ thiết kế tâm huyết nội thất hàng hiệu đầu tư nhiều tiền, thiện chí tặng lại toàn bộ cho khách mua.
+ Hàng Chuối con phố đẹp, an yên gần giao cắt nhiều tuyến phố lớn: Hàn Thuyên, Lò Đúc, Phan Chu Trinh, Hàm Long, Lê Văn Hưu, Tăng Bạt Hổ, Phan Huy Chú, Trần Hưng Đạo, Lê Thánh Tông, Phạm Đình Hổ, Nguyễn Công Trứ…

+ Pháp lý: Sổ đỏ chính chủ nở hậu, sẵn sàng giao dịch.
+ Giá bán 17 tỷ, có thương lượng.

      Hãy gọi cho chúng tôi 24/7 để được tư vấn, giải đáp thắc mắc về pháp lý, tìm kiếm, lựa chọn…(hoàn toàn miễn phí). 
      Tự hào mang lại giá trị đích thực cho quý khách hàng.   

      Liên hệ Mr Mạnh Nhà Phố",17 tỷ,80 m2,"Phố Hàng Chuối, Phường Phạm Đình Hổ, Quận Hai Bà Trưng, Hà Nội",12154119,_,---,Cần bán,4m,---,Nhà trong hẻm,Sổ hồng/ Sổ đỏ,---,---,7,---,---,7,---,
https://alonhadat.com.vn/ban-92m2-dat-o-to-tranh-cach-pho-30m-thi-tran-quang-minh-huyen-me-linh-chi-1ty-930-tr-12737626.html,"Bán 92m2 Đất , Ô Tô tránh, cách phố 30m Thị Trấn Quang Minh, Huyện Mê Linh Chỉ 1Tỷ 930 tr","Bán 92m2 Đất , Ô Tô tránh, cách phố 30m, Tổ 10 Thị Trấn Quang Minh, Huyện Mê Linh, TP Hà Nội Chỉ 1Tỷ 930tr
+ Gần KCN Quang Minh, Mê Linh Plaza, thuộc tổ 10 Thị trấn Quang Minh. Ô TÔ  tránh, vào nhà, 30m ra tới trục chính.
+ Đất đẹp, khu dân trí tốt, tiện ích đủ đầy.
+ Ngay gần khu đô thị Hà Phong, cenco 5, KĐT Long Việt và nhiều dự án khác khu vực đang phát triển mạnh từng ngày.
+ Sổ đỏ chuẩn chỉ, cất két, sẵn sàng giao dịch ngay.
Phù hợp để đầu tư hoặc để xây nhà ở. Để kinh doanh
Giá chỉ 1 tỷ 930 triệu
Cần mua đất Thị Trấn Quang Minh Huyện Mê Linh Liên hệ Tuấn Chỉnh",21 triệu / m2,92 m2,"Thị trấn Quang Minh, Huyện Mê Linh, Hà Nội",12737626,_,---,Cần bán,5m,---,"Đất thổ cư, đất ở",Sổ hồng/ Sổ đỏ,---,5m,---,True,"18,4m",---,---,
https://alonhadat.com.vn/ban-dat-lo-goc-46m2-full-tho-cu-mt-4m-thi-tran-chi-dong-ngo-o-to-o-xuong-chi-1-3-ty-13586485.html,"Bán đất lô góc 46m2 full thổ cư MT 4M thị trấn Chi Đông, ngõ ô tô ở xướng chỉ 1,3 tỷ","Bán đất lô góc 46m2 full thổ cư thị trấn Chi Đông, ngõ ô tô ở xướng chỉ 1,3 tỷ
Bác nào nhanh tay thì còn chậm tay thì hết ạ.
Lô góc 2 mặt tiền đất nở hậu Full thổ cư
Gần chợ Chi Đông Mê Linh Hà Nội
Đường to ngõ thông tứ phía.
Tràn viền tiện ích xung quanh. Ko thiếu thứ gì.
Gần chợ, Trường học từ mầm non đến THPT.
Giá chỉ 1,3 tỷ Giá cho các bạn công nhân an cư lập nghiệp. 
Liên hệ Tuấn Chỉnh","1,3 tỷ",46 m2,"Đường Quang Minh, Thị trấn Chi Đông, Huyện Mê Linh, Hà Nội",13586485,_,---,Cần bán,5m,---,"Đất thổ cư, đất ở",Sổ hồng/ Sổ đỏ,---,4m,---,True,11m,---,---,
https://alonhadat.com.vn/ban-nha-phan-lo-oto-do-cua-pho-ta-quang-buu-hai-ba-trung-62m-ngo-thong-chi-9-ty-10147412.html,"Bán Nhà Phân Lô, Ôtô Đỗ Cửa – Phố Tạ Quang Bửu, Hai Bà Trưng 62m, Ngõ Thông, chỉ 9 tỷ","Bán Nhà Phân Lô, Ôtô – Phố Tạ Quang Bửu, Hai Bà Trưng 62m, Ngõ Thông, chỉ 9 tỷ

     Gia đình có công việc nên cần bán nhanh căn nhà cực hiếm thuộc KHU BÁCH KHOA, quận HAI BÀ TRƯNG.

+ Vị trí nhà đỉnh, Phân Lô, Ôtô đỗ cửa, ngõ thông đẹp tuyệt vời.
+ Nhà có thể kinh doanh, hiện đang cho thuê, hiệu suất cực tốt.
+ An ninh, dân trí hàng đầu.

+ Pháp lý: Sổ đỏ chính chủ, sẵn sàng giao dịch.
+ Giá bán chỉ 9 tỷ, RẺ nhất khu vực.

    Hãy gọi cho chúng tôi 24/7 để được tư vấn, giải đáp thắc mắc về pháp lý, tìm kiếm, lựa chọn…(hoàn toàn miễn phí). 
    Tự hào mang lại giá trị đích thực cho quý khách hàng.   

    Liên hệ Mr Mạnh Nhà Phố",9 tỷ,62 m2,"Phố Tạ Quang Bửu, Phường Bách Khoa, Quận Hai Bà Trưng, Hà Nội",10147412,_,---,Cần bán,4m,---,Nhà trong hẻm,Sổ hồng/ Sổ đỏ,---,---,3,---,---,4,---,
https://alonhadat.com.vn/ban-nha-dep-pho-vo-thi-sau-hai-ba-trung-phan-lo-oto-75m2-5t-mat-tien-6-6m-gia-11-6-ty-7225648.html,"Bán Nhà Đẹp Phố Võ Thị Sáu, Hai Bà Trưng Phân Lô, Ôtô 75m2, 5T, Mặt tiền 6.6m, Giá 11.6 tỷ","Bán Nhà Đẹp Phố Võ Thị Sáu, Hai Bà Trưng Phân Lô, Ôtô 75m2, 5T, Mặt tiền 6.6m, Giá 11.6 tỷ.

   Võ Thị Sáu con phố tuyệt đẹp mang tên người nữ Anh hùng lực lượng vũ trang nhân dân nghe thôi đã thấy hào hùng biết bao, tự hào biết mấy.

+ Vị trí nhà rất đẹp gần Hồ Quỳnh điều hòa không khí, không gian trong lành mát mẻ, yên tĩnh, đẳng cấp.
+ Nhà gần Công viên Tuổi Trẻ cái tên Tuổi Trẻ như cộng hưởng cho sự hy sinh hào hùng của Chị vì quê hương đất nước đời đời mãi ghi.
+ Gia chủ thiết kế nhà tâm huyết, nhà đẹp, mặt tiện rộng 6.6m rất đẹp, tiện nghi xung quanh tuyệt vời gần Bệnh viện Thanh Nhàn, lên Hồ Gươm vài phút đi xe.

+ Pháp lý: Sổ đỏ chính chủ, vuông vắn.
+ Giá bán 11.6 tỷ, chủ thiện chí.

    Hãy gọi cho chúng tôi 24/7 để được tư vấn, giải đáp thắc mắc về pháp lý, tìm kiếm, lựa chọn…(hoàn toàn miễn phí). 
    Chúng tôi tự hào mang lại giá trị đích thực cho quý khách hàng.   
    Liên hệ Mr Mạnh Nhà Phố","11,6 tỷ",75 m2,"Phố Võ Thị Sáu, Phường Thanh Nhàn, Quận Hai Bà Trưng, Hà Nội",7225648,_,---,Cần bán,5m,---,Nhà trong hẻm,Sổ hồng/ Sổ đỏ,---,---,5,---,---,5,---,
https://alonhadat.com.vn/ban-nha-pho-dong-quan-102m2-x-7-tang-mt-5-1m-kinh-doanh-o-to-tranh-chi-22-5-ty-13662916.html,"Bán nhà Phố Đông Quan 102m2 X 7 Tầng, MT 5.1m Kinh Doanh Ô Tô Tránh Chỉ 22.5 Tỷ","7 TẦNG THANG MÁY, PHÂN LÔ VỈA HÈ Ô TÔ DỪNG ĐỖ, THOÁNG TRƯỚC SAU - KINH DOANH VĂN PHÒNG 
- Nhà thuộc khu phân lô đẹp nhất Đông Quan View trường học FPT phía sau nhà là View chung cư thoáng trước sau cực đẹp.
- Thiết kế: 
+ Tầng 1: Gara Ô tô
+ Tầng 2: Phòng khách, bếp, WC
+ Tầng 3,4,5: Mỗi tầng 2 phòng ngủ khép kín 
+ Tầng 6: Phòng thờ, sân phơi
+ Tầng 7: Tum.
- Sổ đỏ chính chủ vuông đẹp. 
Cần mua nhà Phố Đông Quan Liên Hệ Tuấn Chỉnh","22,5 tỷ",102 m2,"Đường Đông Quan, Phường Nghĩa Đô, Quận Cầu Giấy, Hà Nội",13662916,_,True,Cần bán,20m,True,Nhà mặt tiền,Sổ hồng/ Sổ đỏ,True,"5,1m",7,True,20m,6,---,
https://alonhadat.com.vn/ban-nha-phan-lo-van-phong-quoc-hoi-pho-vong-hai-ba-trung-oto-80m2-6t-mt-5m-16-ty-7598719.html,"Bán Nhà Phân Lô Văn Phòng Quốc Hội - Phố Vọng, Hai Bà Trưng, Ôtô 80m2, 6T, MT 5m, 16 tỷ","Bán Nhà Phân Lô Văn Phòng Quốc Hội - Phố Vọng, Hai Bà Trưng, Ôtô 80m2, 6T, MT 5m, 16 tỷ

   Nhà nằm ở vị trí đỉnh con Phố Vọng, Hai Bà Trưng, ngõ Phân Lô bàn cờ, kinh doanh, văn phòng thuận tiện.

+ Hiện tại đang cho người quen thuê kinh doanh 35tr/tháng.
+ Khu vực dân trí cao, ngõ thông quá chi là thuận tiện.
+ Phố Vọng khu phân lô văn phòng quốc hội đẳng cấp tiện nghi hàng đầu.

+ Pháp lý chuẩn, Sổ vuông phân lô.
+ Giá bán 16 tỷ, có thương lượng.

    Hãy gọi cho chúng tôi 24/7 để được tư vấn, giải đáp thắc mắc về pháp lý, tìm kiếm, lựa chọn…(hoàn toàn miễn phí). 
    Chúng tôi tự hào mang lại giá trị đích thực cho quý khách hàng.   

    Liên hệ Mr Mạnh Nhà Phố",16 tỷ,80 m2,"Phố Vọng, Phường Đồng Tâm, Quận Hai Bà Trưng, Hà Nội",7598719,_,---,Cần bán,5m,---,Nhà trong hẻm,Sổ hồng/ Sổ đỏ,---,---,6,---,---,6,---,
https://alonhadat.com.vn/ban-nha-69m2-full-tho-cu-lo-goc-o-to-tranh-kinh-doanh-to-8-chi-dong-chi-2-ty240tr-13693231.html,"Bán nhà 69m2 Full thổ cư, Lô Góc, ô Tô tránh, Kinh Doanh Tổ 8 chi Đông chỉ 2 tỷ240tr","Bán nhà 69m2 Full thổ cư, Lô Góc, ô Tô tránh, Kinh Doanh Tổ 8 chi Đông chỉ 2 tỷ240tr 
+ Vị trí cực đẹp, Ngõ thông thoáng, Đông Dân, Cách Phố Quang Minh 50m.
+ Khu vực dân cư đông đúc, kinh doanh sầm uất, Ngay cạnh KĐT Chi Đông. 
+ Nằm cạnh đường Quang Minh (15m), Cách 100m Đường 35m, KĐT Chi Đông. 
+ Cách khu công nghiệp Quang Minh 500m. 
+ Cách sân bay Nội Bài 3.5km; Cầu thăng long 7km. 
+ Cách đường Võ Văn Kiệt và Mê Linh Plaza, BigC 2km,... 
+ Hạ tầng quy hoạch đồng bộ.
 + Tiện ích xung quanh đầy đủ không thiếu thứ gì.
Cần Mua đất Huyện Mê Linh Liên Hệ Tuấn Chỉnh","2,24 tỷ",69 m2,"Đường Quang Minh, Thị trấn Chi Đông, Huyện Mê Linh, Hà Nội",13693231,_,---,Cần bán,10m,---,"Đất thổ cư, đất ở",Sổ hồng/ Sổ đỏ,---,"4,8m",---,True,15m,---,---,
https://alonhadat.com.vn/ban-nha-mat-pho-lac-nghiep-hai-ba-trung-kinh-doanh-via-he-45m2-7t-gia-13-2-ty--8887484.html,"Bán Nhà MẶT PHỐ Lạc Nghiệp, Hai Bà Trưng, Kinh Doanh, Vỉa hè 45m2, 7T, Giá 13.2 tỷ.","Bán Nhà MẶT PHỐ Lạc Nghiệp, Hai Bà Trưng, Kinh Doanh, Vỉa hè 45m2, 7T, Giá 13.2 tỷ.

   LẠC NGHIỆP con phố đẹp KINH DOANH PHỤ TÙNG – SẦM UẤT NGÀY ĐÊM.

+ Nhà xây 7 tầng, thiết kế hợp lý, vừa ở vừa Kinh Doanh Phụ Tùng, văn phòng quá đỉnh.
+ Lạc Nghiệp con phố đẹp, có vỉa hè thoáng, tương lai quy hoạch, giá trị tăng cao rạng ngời.


+ Pháp lý chuẩn, Sổ đỏ chính chủ, vuông vắn.
+ Giá bán 13.2 tỷ, có thương lượng, chủ thiện chí.

    Hãy gọi cho chúng tôi 24/7 để được tư vấn, giải đáp thắc mắc về pháp lý, tìm kiếm, lựa chọn…(hoàn toàn miễn phí). 
    Chúng tôi tự hào mang lại giá trị đích thực cho quý khách hàng.   

    Liên hệ Mr Mạnh Nhà Phố","13,2 tỷ",45 m2,"Đường Lạc Nghiệp, Phường Thanh Nhàn, Quận Hai Bà Trưng, Hà Nội",8887484,_,---,Cần bán,6m,---,Nhà mặt tiền,Sổ hồng/ Sổ đỏ,---,---,7,---,---,14,---,
https://alonhadat.com.vn/ban-gap-nha-pho-tran-khat-chan-hai-ba-trung-kinh-doanh-oto-tranh-91m2-mt-7-5m-9-8-ty--6956900.html,"Bán Gấp Nhà Phố Trần Khát Chân, Hai Bà Trưng, Kinh Doanh, Ôtô tránh 91m2, MT 7.5m, 9.8 tỷ.","Bán Cực Gấp Nhà Phố Trần Khát Chân, Hai Bà Trưng, Kinh Doanh, Ôtô tránh 91m2, MT 7.5m, Giá 9.8 tỷ.

    Nhà nằm ở vị trí quá tuyệt vời con Phố Trần Khát Chân, quận Hai Bà Trưng mảnh đất hiếm hoi con sót lại xây tòa nhà văn phòng phục vụ mọi loại hình kinh doanh.
+ Vị trí đẹp, kinh doanh đỉnh, Ôtô tránh không có mảnh đất đẹp thứ 2.
+ Nhà nằm trong ngõ nhưng to như phố vị trí đắc địa có 102 gần nhiều các tuyến phố lớn: Lò Đúc, Bạch Mai, Kim Ngưu, Võ Thị Sáu, Lãng Yên, Đại Cồ Việt…

+ Pháp lý: Sổ đỏ chính chủ, sẵn sàng giao dịch.
+ Giá bán 10 tỷ, có thương lượng.

    Hãy gọi cho chúng tôi 24/7 để được tư vấn, giải đáp thắc mắc về pháp lý, tìm kiếm, lựa chọn…(hoàn toàn miễn phí). 
    Chúng tôi tự hào mang lại giá trị đích thực cho quý khách hàng.   
    Liên hệ Mr Mạnh Nhà Phố","9,8 tỷ",91 m2,"Đường Trần Khát Chân, Phường Đống Mác, Quận Hai Bà Trưng, Hà Nội",6956900,_,---,Cần bán,5m,---,Nhà trong hẻm,Sổ hồng/ Sổ đỏ,---,---,1,---,---,1,---,
https://alonhadat.com.vn/ban-gap-nha-mat-pho-hong-mai-hai-ba-trung-kinh-doanh-dinh-55m2x4t-10-95-ty-tl-7296918.html,"Bán Gấp Nhà MẶT PHỐ Hồng Mai, Hai Bà Trưng Kinh Doanh Đỉnh 55m2x4T, 10.95 tỷ TL","Bán Gấp Nhà MẶT PHỐ Hồng Mai, Hai Bà Trưng Kinh Doanh Đỉnh 55m2x4T, 10.95 tỷ TL

    MẶT PHỐ HỒNG MAI con phố đẹp Kinh Doanh sầm uất quận HAI BÀ TRƯNG.

+ Nhà nằm ở vị trí đẹp nhất trên con Phố Hồng Mai, kinh doanh bất chấp tất cả các loại mặt hàng: Thời trang, Spa, Mỹ Phẩm, Ảnh viện áo cưới, Nail, Ẩm thực,…
+ Vỉa hè đẹp, gần nhiều trường học lưu lượng lưu thông lớn, đường thông thoáng, hiệu suất tuyệt vời.
+ Hồng Mai con phố ngày càng phát triển, đẹp lên từng ngày.

+ Pháp lý chuẩn, Sổ đỏ chính chủ.
+ Giá bán 10.95 tỷ, có thương lượng.

Hãy gọi cho chúng tôi 24/7 để được tư vấn, giải đáp thắc mắc về pháp lý, tìm kiếm, lựa chọn…(hoàn toàn miễn phí). 
    Chúng tôi tự hào mang lại giá trị đích thực cho quý khách hàng.   
    Liên hệ Mr Mạnh Nhà Phố","10,95 tỷ",55 m2,"Phố Hồng Mai, Phường Bạch Mai, Quận Hai Bà Trưng, Hà Nội",7296918,_,---,Cần bán,6m,---,Nhà mặt tiền,Sổ hồng/ Sổ đỏ,---,---,4,---,---,4,---,
https://alonhadat.com.vn/ban-nha-dong-tien-dinh-pho-thanh-nhan-hai-ba-trung-90m2-17-phong-gia-11-ty-9145558.html,"Bán Nhà DÒNG TIỀN ĐỈNH – Phố Thanh Nhàn, Hai Bà Trưng 90m2, 17 phòng, Giá 11 tỷ","Bán Nhà DÒNG TIỀN ĐỈNH – Phố Thanh Nhàn, Hai Bà Trưng 90m2, 17 phòng, Giá 11 tỷ

    Gia chủ có công việc nên cần bán nhanh căn nhà DÒNG TIỀN ĐỈNH – Phố Thanh Nhàn, quận Hai Bà Trưng.

+ Vị trí nhà đỉnh cách MẶT PHỐ THANH NHÀN 10m, đi bộ từ nhà ra phố chưa đến 10 giây, quá đỉnh.
+ 17 phòng cho thuế khép kín hiệu suất 40-50 tháng 1 phương án dữ tiền an toàn trong mùa cô vy này.
+ Thanh Nhàn con phố đẹp gần nhiều trường Đại học lớn: BÁCH KHOA – KINH TẾ - XÂY DỰNG, hiệu suất lấp đầy tối đa nhu cầu cực lớn.

+ Pháp lý: Sổ đỏ chính chủ, sẵn sàng giao dịch.
+ Giá bán 11 tỷ, gia đình thiện chí.

    (Hỗ trợ MIỄN PHÍ hoàn toàn cho khách hàng khi đi xem nhà, mua bán, làm việc trực tiếp với chủ nhà, hỗ trợ thủ tục pháp lý, sang tên, công chứng.)

    Liên hệ Anh Mạnh",11 tỷ,90 m2,"Đường Thanh Nhàn, Phường Thanh Nhàn, Quận Hai Bà Trưng, Hà Nội",9145558,_,---,Cần bán,3m,---,Nhà trong hẻm,Sổ hồng/ Sổ đỏ,---,---,5,---,---,17,---,
https://alonhadat.com.vn/ban-295m2-dat-lo-goc-mt-hon-11m-ngo-to-to-tranh-kinh-doanh-to-8-tt-chi-dong-h-me-linh-13640491.html,"Bán 295m2 Đất, Lô góc, MT hơn 11m, Ngõ tô tô tránh, kinh doanh,Tổ 8 TT Chi Đông, H Mê Linh","Bán 295m2 Đất, Lô góc,  mặt tiền hơn 11m, Ngõ tô tô tránh, kinh doanh, tổ 8 TT Chi Đông, H Mê Linh chỉ 32tr/m
 có Thương lượng.
+  Thửa đất đẹp như tờ A4. 
+ Khu vực dân cư đông đúc, kinh doanh sầm uất, Ngay gần KĐT Chi Đông. 
+ Nằm cạnh đường Quang Minh (150m), Cách 500m Đường 35m, KĐT Chi Đông. 
+ Cách khu công nghiệp Quang Minh 500m. 
+ Cách sân bay Nội Bài 3.5km; Cầu thăng long 7km. 
+ Cách đường Võ Văn Kiệt và Mê Linh Plaza, BigC 2km,...
 + Hạ tầng quy hoạch đồng bộ. 
+ Giá cả hợp lý chỉ 32tr/m có thương lượng. 
Phù hợp cho các nhà đầu tư lâu dài, xây Biệt Thự, Phân Lô, Làm Kho, Xưởng...
+ Tiện ích xung quanh Cần Mua đất Huyện Mê Linh Liên Hệ Tuấn Chỉnh",32 triệu / m2,295 m2,"Đường Quang Minh, Thị trấn Chi Đông, Huyện Mê Linh, Hà Nội",13640491,_,---,Cần bán,8m,---,"Đất thổ cư, đất ở",Sổ hồng/ Sổ đỏ,---,11m,1,True,27m,1,---,
https://alonhadat.com.vn/ban-nha-phan-lo-pho-dai-co-viet-hai-ba-trung-kinh-doanh-oto-58m2x5t-mt-5m-12-8-ty-6738132.html,"Bán Nhà Phân Lô – Phố Đại Cồ Việt, Hai Bà Trưng, Kinh Doanh, Ôtô 58m2x5T, MT 5m, 12.8 tỷ","Bán Nhà Phân Lô – Phố Đại Cồ Việt, Hai Bà Trưng, Kinh Doanh, Ôtô 58m2x5T, MT 5m, Giá 12.8 tỷ

   Gia chủ cần bán cực gấp căn nhà tuyệt đẹp Phố Đại Cồ Việt, quận Hai Bà Trưng, ví trí nhà đẹp cần tiền bán gấp.

+ Vị trí nhà cực đẹp, KINH DOANH tấp nập, có vỉa hè rộng thoáng, Ôtô dừng đỗ ngày đêm.
+ Đại Cồ Việt con phố đẹp trục dọc huyết mạch lên Hồ Gươm vài phút đi xe giao thông đi lại thuận tiện.
+ Gia chủ mới mua ở hay kinh doanh đều phù hợp, khu vực dân trí cao tiện nghi đầy đủ.

+ Pháp lý chuẩn, Sổ đỏ chính chủ chờ người hữu duyên.
+ Giá bán 12.8 tỷ, có thương lượng.

    Hãy gọi cho chúng tôi 24/7 để được tư vấn, giải đáp thắc mắc về pháp lý, tìm kiếm, lựa chọn…(hoàn toàn miễn phí). 
    Chúng tôi tự hào mang lại giá trị đích thực cho quý khách hàng.   
    Liên hệ Mr Mạnh Nhà Phố","12,8 tỷ",58 m2,"Đường Đại Cồ Việt, Phường Lê Đại Hành, Quận Hai Bà Trưng, Hà Nội",6738132,_,---,Cần bán,6m,---,Nhà trong hẻm,Sổ hồng/ Sổ đỏ,---,---,5,---,---,6,---,
https://alonhadat.com.vn/ban-nha-pho-xom-kdg-phu-luong-50-8t-thang-may-chi-hon-10ty-kinh-doanh-13717989.html,Bán nhà phố Xốm KĐG Phú Lương 50 8t thang máy chỉ hơn 10tỷ kinh doanh,"Cần bán gấp giảm 2 tỷ nhà TRỤC CHÍNH KĐG PHÚ LƯƠNG - Phố Xốm Phú Lãm Hà Đông 
50m2 8tầng THANG MÁY mặt tiền 5m chỉ 10,6 tỷ
+ Nhà Đẹp Thiết kế đẳng cấp nhất khu vực 
+ Vỉa hè 20m, đường rộng 24m, ô tô tránh, ô tô dừng đỗ thoải mái, ô tô ngủ trong nhà 
+ Mặt Phố kinh doanh tấp nập cả ngày lẫn đêm
+ Khu tiềm năng phát triển, gần vành đai 4, gần trường ĐH Đại Nam University, Cao đẳng Kinh Tế Kỹ Thuật Thương Mại, trường học các cấp, chợ Xốm…
+ Thiết kế hiện đại đầy đủ công năng sử dụng tầng thông sàn kinh doanh, 4pn
+ Sổ đỏ vuông đẹp chính chủ 
+ Gọi ngay Bà Địa Hương Hà Đông chuyên biệt thự, liền kề, mặt phố, thổ cư.","10,6 tỷ",50 m2,"Đường Nguyễn Trực, Phường Phú Lãm, Quận Hà Đông, Hà Nội",13717989,_,True,Cần bán,24m,True,Nhà mặt tiền,Sổ hồng/ Sổ đỏ,True,5m,8,True,10m,4,---,
https://alonhadat.com.vn/ban-biet-thu-sieu-vip-khu-ban-dao-linh-dam-quan-hoang-mai-khu-bt-vip-13717988.html,Bán Biệt Thự Siêu Vip khu Bán đảo Linh Đàm quận Hoàng Mai. Khu Bt vip,"✅ Bán căn biệt thự khu bán đảo linh đàm phường Hoàng Liệt quận Hoàng Mai thành phố Hà Nội.
• Diện tích sổ đỏ 254M2 Xây dựng bốn tầng Với thiết kế theo kiểu tân cổ điển hiện đại sang trọng với bố trí như sau: 
+ Tầng hầm: để xe ô tô xe máy
+ Tầng 1:  phòng khách bếp siêu rộng
+ Tầng 2,3,43 :tổng số phòng ngủ một phòng thờ sân phơi.
• Vị trí nhà đẹp vô cùng xung quanh hàng xóm toàn quan chức cán bộ cấp cao, Khu vực dân trí cao tiện ích xung quanh không thiếu gì khu biệt thự đáng sống nhất thành phố Hà Nội. 
• Chủ nhà là quan chức, nên nội thất trong nhà hầu hết là các thiết bị nhập khẩu đắt tiền tiện ích sử dụng, Bước rồi à nhìn như cung điện hoàng gia, Ô tô có thể về số nhà vài xe, không gian sân vườn trang hoàng lộng lẫy đẹp 
• Sổ đỏ phân lô biệt thự sẵn sàng cho đón chú mới 
✅ Giá bán 88 tỷ có thương lượng.",88 tỷ,254 m2,"Đường Linh Đàm, Phường Hoàng Liệt, Quận Hoàng Mai, Hà Nội",13717988,_,True,Cần bán,3m,True,"Biệt thự, nhà liền kề",Sổ hồng/ Sổ đỏ,True,"12,5m",4,True,21m,6,---,Khu đô thị mới Linh Đàm (xem chi tiết dự án)
