url,title,description,price,area,address,Mã tin,Hướng,Phòng ăn,Loại tin,Đường trước nhà,Nhà bếp,Loại BDS,Pháp lý,Sân thượng,Chiều ngang,Số lầu,Chổ để xe hơi,Chiều dài,Số phòng ngủ,Chính chủ,Thuộc dự án
https://alonhadat.com.vn/ban-can-goc-mat-pho-le-trong-tan-va-quang-trung-200m2-mat-tien-11-gia-36-ty-13485443.html,"BÁN CĂN GÓC MẶT PHỐ LÊ TRỌNG TẤN VÀ QUANG TRUNG 200m2 , Mặt tiền 11 giá 36 tỷ","+ Vị trí tuyệt đẹp, nằm trên trục chính đường đôi phố Quang Trung và Lê trọng Tấn , đoạn kinh doanh sầm uất nhất. 
+ Vỉa hè rộng thênh thang, kinh doanh cả ngày lẫn đêm. 
+ Nhà thiết kế kiểu biệt thự 4 tầng, đầy đủ công năng, hiện đang cho thuê kinh doanh rất tốt, rất đông khách ra vào.
+ Sổ đỏ đẹp, cất két, sẵn sàng giao dịch
Liên hệ số 962255658 để mở cửa xem nhà 24/24",36 tỷ,200 m2,"Đường Lê Trọng Tấn, Phường La Khê, Quận Hà Đông, Hà Nội",13485443,_,True,Cần bán,50m,True,Nhà mặt tiền,Sổ hồng/ Sổ đỏ,True,11m,4,True,---,9,---,
https://alonhadat.com.vn/ban-nha-doi-dien-cong-benh-vien-da-khoa-ha-dong-4t-mt-5m2-gia-9-8-ty-13492119.html,"BÁN NHÀ ĐỐI DIỆN CỔNG BỆNH VIỆN ĐA KHOA HÀ ĐÔNG 4T, Mt 5m2 giá 9,8 tỷ","MẶT PHỐ HIẾM NHÀ BÁN - ĐỐI DIỆN BỆNH VIỆN ĐA KHOA LỚN NHẤT HÀ ĐÔNG - ÔTÔ TRÁNH, ĐỖ, NGÀY VÀ ĐÊM -  KINH DOANH SẦM UẤT 
 + nhà 4 tầng nằm ở vị trí quá đẹp, kinh doanh đỉnh, mở cửa ra là có tiền, kinh doanh gì cũng ra tiền, đối diện bệnh viện đa khoa hà đông, cách chợ vài bước chân,  200m là các trường học cấp 1,2,3, trường cao đẳng y dược Hà Đông, đầy đủ tiện ích xung quanh . 
Liên hệ ngay số 962255658 để mở cửa xem nhà 24/24","9,8 tỷ",40 m2,"Đường Bế Văn Đàn, Phường Quang Trung, Quận Hà Đông, Hà Nội",13492119,_,True,Cần bán,10m,True,Nhà mặt tiền,Sổ hồng/ Sổ đỏ,True,5m,4,True,---,5,---,
https://alonhadat.com.vn/ban-toa-nha-phung-hung-ha-dong-160m2-7-tang-mt-7m-gia-34-5-ty-13497027.html,"BÁN TOÀ NHÀ PHÙNG HƯNG HÀ ĐÔNG  160m2 , 7 Tầng, MT 7m giá 34,5 Tỷ","CỰC PHẨM HÀ ĐÔNG - TÒA NHÀ MẶT PHỐ 7 TẦNG THANG MÁY - KINH DOANH TẤP NẬP - DÒNG TIỀN ỔN ĐỊNH.

Mô tả: 
+ Vị trí Kim Cương đẹp nhất phố Phùng Hưng, Giao thông cực kỳ thuận tiện gần nhiều bệnh viện lớn như BV Quân Y 103, Viện K Tân Triều bên trái là KĐT Xa La, đằng sau là KĐT Văn Quán, kinh doanh tấp ngày đêm, đường trước nhà 40m vỉa hè đá bóng.
Thiết Kế:
+ Nhà thiết kế 7 tầng thang máy thông sàn kinh doanh,  Thang máy và cầu thang bộ ở giữa , hiện tại đang cho thuê, dòng tiền ổn định gần 1 tỷ/ năm.

Pháp lý chuẩn 
Sổ đỏ cất két sẵn sàng giao dịch.
Liên hệ ngay số 962255658 để là người may mắn sở hữu Toà nhà đắc địa có 102 này.","34,5 tỷ",160 m2,"Đường Phùng Hưng, Phường Văn Quán, Quận Hà Đông, Hà Nội",13497027,_,True,Cần bán,40m,True,Nhà mặt tiền,Sổ hồng/ Sổ đỏ,True,7m,7,True,---,7,---,
https://alonhadat.com.vn/ban-nha-mat-pho-van-phu-lo-goc-via-he-khung-kinh-doanh-dinh-83m2-5-tang-gia-22-8-ty-13502051.html,"BÁN NHÀ  MẶT PHỐ VĂN PHÚ LÔ GÓC, VỈA HÈ KHỦNG, KINH DOANH ĐỈNH 83m2, 5 Tầng , giá 22,8 tỷ","Vị trí đắc địa Nhà mặt phố kinh doanh đỉnh mặt tiền + vỉa hè + lòng đường đều thuộc hàng khủng, chỉ 1 căn duy nhất đang bán. 
+ Thuộc KĐT Văn Phú nên hưởng chọn tiện ích, đầy đủ các loại hình dịch vụ, kinh doanh sầm uất đêm ngày. ngay trục đường lớn Quang Trung - Trần Phú - Nguyễn Trãi tiến thẳng trung tâm, cùng với trục Lê Trọng Tấn - Văn Khê ngả đi tứ phía. 
Liên hệ ngay số 962255658 để mở cửa xem nhà","22,8 tỷ",83 m2,"Đường Văn La, Phường Phú La, Quận Hà Đông, Hà Nội",13502051,_,True,Cần bán,20m,True,Nhà mặt tiền,Sổ hồng/ Sổ đỏ,True,6m,5,True,---,8,---,
https://alonhadat.com.vn/ban-nha-phan-lo-mat-pho-le-trong-tan-ha-dong-6-tang-thang-may-mt5-6m-gia-9-ty-13532276.html,BÁN NHÀ PHÂN LÔ MẶT PHỐ LÊ TRỌNG TẤN HÀ ĐÔNG 6 TẦNG THANG MÁY MT5.6m giá 9 tỷ,"PHÂN LÔ - 6 TẦNG THANG MÁY - Ô TÔ TRÁNH - VỈA HÈ ĐÁ BÓNG - KINH DOANH SẦM UẤT - VIEW CHỢ -  SIÊU HIẾM DUY NHẤT KHU VỰC 

+ Vị trí cực đắc địa nhà xây 6 tầng khung cột bê tông kiên cố phòng nào cũng có ánh sáng và nắng gió tự nhiên vào Nhà .
+ Vỉa Hè đá bóng, 14m
+ Đường rộng ô tô 45 chỗ tránh
+ Kinh doanh sầm uất các thể loại mặt hàng 
+ Tiềm năng phát triển trong từng ngày 
+ Sổ đỏ vuông đẹp chính chủ .
Liên hệ số 962255658 để mở cửa xem nhà",9 tỷ,40 m2,"Đường Lê Trọng Tấn, Phường La Khê, Quận Hà Đông, Hà Nội",13532276,_,True,Cần bán,30m,True,Nhà mặt tiền,Sổ hồng/ Sổ đỏ,True,"5,6m",6,True,---,6,---,
https://alonhadat.com.vn/ban-nha-mat-pho-dai-an-ha-dong-kinh-doanh-5tang-gia-8-3-ty-13579616.html,BÁN NHÀ MẶT PHỐ ĐẠI AN HÀ ĐÔNG KINH DOANH  5Tầng  giá 8.3 tỷ,"MẶT PHỐ KINH DOANH - 2 THOÁNG - PHỐ SINH VIÊN - SẴN DÒNG TIỀN  đang cho thuê 30triệu /tháng. 
Nhà dân xây khung cột bê tông kiên cố phòng nào cũng có ánh sáng và nắng gió tự nhiên vào phòng làm cho ngôi nhà luôn sạch sẽ thoáng sáng.
- Nhà nằm đoạn đầu phố kinh doanh tấp nập, xung quanh nhiều trường đại học lớn, thiết kế Vị trí đắc địa, gần trường đại học Kiến Trúc Hà Nội, Học Viện An Ninh... Khu vực đông dân cư, kinh doanh buôn bán sầm uất. Hiện tại chủ đang cho thuê trọ sinh viên, tổng 7 phòng cho thuê, mặt trước tầng 1 cho thuê mặt bằng kinh doanh.  
Sổ đỏ cất két sẵn sàng giao dịch ngay .
Liên hệ số ngay số 962255658 để mở cửa xem nhà 24/24","8,3 tỷ",45 m2,"Đường Đại An, Phường Văn Quán, Quận Hà Đông, Hà Nội",13579616,_,True,Cần bán,10m,True,Nhà mặt tiền,Sổ hồng/ Sổ đỏ,True,4m,5,True,---,7,---,
https://alonhadat.com.vn/ban-gap-manh-dat-lk-phan-lo-ngay-cho-bong-do-ngo-thi-nham-50m2-gia-6-ty-13599632.html,BÁN GẤP MẢNH ĐẤT LK PHÂN LÔ NGAY CHỢ BÔNG ĐỎ NGÔ THỊ NHẬM 50m2 giá 6 tỷ,"Vị trí đắc địa đối diện Trường THCS Văn Khê , vị trí lô Đất nằm trong quần thể KĐT Ngô thị Nhậm tiện ích xung quanh không thiếu gì gần chợ ,trường học THCS Văn Khê, siêu thị…
Giá siêu rẻ chỉ 6 tỷ có thương lượng thêm 
Sổ đỏ vuông đẹp cất két sẵn sàng giao dịch. 
Liên hệ gọi ngay số 962255658 để mở gặp chủ nhà đàm phán giá tốt 24/24",6 tỷ,50 m2,"Đường Ngô Thì Nhậm, Phường La Khê, Quận Hà Đông, Hà Nội",13599632,_,---,Cần bán,6m,---,"Đất thổ cư, đất ở",Sổ hồng/ Sổ đỏ,---,4m,---,---,---,---,---,
https://alonhadat.com.vn/ban-gap-manh-dat-lk-phan-lo-ngay-cho-bong-do-ngo-thi-nham-40m2-gia-5-ty-13597465.html,BÁN GẤP MẢNH ĐẤT LK PHÂN LÔ NGAY CHỢ BÔNG ĐỎ NGÔ THỊ NHẬM 40m2 giá 5 tỷ,"Vị trí đắc địa đối diện Trường THCS Văn Khê , vị trí lô Đất nằm trong quần thể KĐT Ngô thị Nhậm tiện ích xung quanh không thiếu gì gần chợ ,trường, siêu thị…
Giá siêu rẻ chỉ 5 tỷ có thương lượng thêm 
Sổ đỏ vuông đẹp cất két sẵn sàng giao dịch. 
Liên hệ gọi ngay số 962255658 để mở gặp chủ nhà đàm phán giá tốt 24/24",5 tỷ,40 m2,"Đường Ngô Thì Nhậm, Phường Hà Cầu, Quận Hà Đông, Hà Nội",13597465,_,---,Cần bán,6m,---,"Đất nền, liền kề, đất dự án",Sổ hồng/ Sổ đỏ,---,4m,---,---,10m,---,---,Khu đô thị mới Ngô Thì Nhậm (xem chi tiết dự án)
https://alonhadat.com.vn/ban-nha-mat-pho-ba-trieu-ha-dong-130m2-4t-mt10m-gia-16-ty-13589551.html,"BÁN NHÀ MẶT PHỐ BÀ TRIỆU HÀ ĐÔNG 130m2 ,4T,MT10m giá 16 tỷ","LÔ GÓC  - GARA Ô TÔ - THIẾT KẾ BIỆT THỰ - Ở CỰC SƯỚNG - KINH DOANH. 

Vị trí đắc địa nằm trên phố Bà Triệu, trung tâm Q. Hà Đông, kinh doanh cực sầm uất.
Nhà dân xây khung cột bê tông kiên cố phòng nào cũng có ánh sáng và nắng gió tự nhiên vào phòng luôn sạch sẽ thoáng sáng.
Nhà mặt tiền rộng 10m ở rất sướng 
Sổ đỏ chính chủ sẵn sàng giao dịch.
Liên hệ gọi ngay số 962255658 để mở cửa xem nhà 24/24",16 tỷ,130 m2,"Đường Bà Triệu, Phường Hà Cầu, Quận Hà Đông, Hà Nội",13589551,_,True,Cần bán,10m,True,Nhà mặt tiền,Sổ hồng/ Sổ đỏ,True,10m,4,True,---,6,---,
https://alonhadat.com.vn/ban-shophouse-mat-pho-nguyen-xien-nga-tu-kdt-duong-lon-via-he-to-kd-ngay-dem-95m2--13633582.html,"BÁN  SHOPHOUSE MẶT PHỐ NGUYỂN XIỂN - NGÃ TƯ KDT - ĐƯỜNG LỚN VỈA HÈ TO - KD NGÀY ĐÊM 95m2,","- Nút giao lộ của những tuyến đường được xem như đại lộ Nguyễn Trãi Khuất - Duy Tiến- Nguyễn Xiển. Đồng thời, đây là nút giao thông 4 tầng đầu tiên ở Việt Nam, đó là giao lộ của hầm chui, đường trên cao, đường mặt đất và đường tàu điện trên cao với vị trí tạo nên giá trị cực lớn, Phù hợp với tất cả các loại hình kinh doanh

- Nhà 2 mặt thoáng trước sau, Vỉa hè mặt tiền rộng 10m, đường nội bộ mặt sau rộng 6,5m Ô TÔ ĐỖ

- Hiện tại là 7 tầng có cầu thang máy và cầu thang bộ giữa, mỗi tầng 2 phòng. 
Diện tích: 95m2/1 sàn x 6 tầng, tầng 7 diện tích: 45m2 còn lại là sân thượng 

- Nội thất hoàn thiện bên trong tỉ mỉ, cực sịn.  
Sổ vuông thế đất đẹp sẵn sàng giao dịch ( có thương lượng)
Liên hệ ngay số 962255658 để mở cửa xem nhà",42 tỷ,95 m2,"Đường Nguyễn Xiển, Phường Thanh Xuân Nam, Quận Thanh Xuân, Hà Nội",13633582,_,True,Cần bán,30m,True,Nhà mặt tiền,Sổ hồng/ Sổ đỏ,True,"5,22m",7,True,---,10,---,
https://alonhadat.com.vn/ban-nha-to-hieu-ha-dong-5t-x-mt-6-5m-kinh-doanh-gia-7-9-ty-13631462.html,"BÁN NHÀ TÔ HIỆU HÀ ĐÔNG 5T x MT 6,5m Kinh doanh giá 7,9 tỷ","Nhà xây khung cột bê tông kiên cố phòng nào cũng có ánh sáng và nắng gió tự nhiên vào phòng luôn sạch sẽ thoáng sáng . 
Sổ đỏ vuông vức, vị trí trung tâm của Hà Đông, xung quanh bán kính 400m là chợ hà đông, trường học, trung tâm quận hà đông…
Đường thông hè thoáng, oto đỗ cửa thoải mái, đỗ trong nhà cũng thoải mái. 
Liên hệ gọi ngay số 962255658 để mở cửa xem nhà 24/24","7,9 tỷ",40 m2,"Đường Tô Hiệu, Phường Hà Cầu, Quận Hà Đông, Hà Nội",13631462,_,True,Cần bán,6m,True,Nhà mặt tiền,Sổ hồng/ Sổ đỏ,True,"6,5m",5,True,---,5,---,
https://alonhadat.com.vn/ban-nha-phan-lo-o-to-tranh-via-he-kinh-doanh-yen-phuc-ha-dong-6t-mt8m-gia-9-8-ty-13642383.html,"BÁN NHÀ PHÂN LÔ Ô TÔ TRÁNH VỈA HÈ KINH DOANH YÊN PHÚC HÀ ĐÔNG 6T , MT8m giá 9,8 tỷ","+ Nhà nằm ngay ngã tư, khu vực kinh doanh sầm uất ngày đêm, trước nhà ô tô tránh, vỉa hè. Đường thông sang KĐT Văn Quán.
+ Mặt tiền siêu rộng 8m rất phù hợp vừa ở vừa kinh doanh.
+ Thiết kế: 6 tầng
- Tầng 1-2: Thông sàn.
- Tầng 3-4: Mỗi tầng 2 phòng ngủ.
- Tầng 5: Khách, bếp.
- Tầng 6: Tum, sân phơi.
+ Sổ đỏ chính chủ, sẵn sàng giao dịch.
Liên hệ gọi ngay số 962255658 để mở cửa xem nhà 24/24","9,8 tỷ",45 m2,"Đường Yên Phúc, Phường Văn Quán, Quận Hà Đông, Hà Nội",13642383,_,True,Cần bán,15m,True,Nhà mặt tiền,Sổ hồng/ Sổ đỏ,True,8m,6,True,---,5,---,
https://alonhadat.com.vn/ban-nha-mat-pho-ngo-dinh-man-ha-dong-58m2-6t-gia-nhinh-12-ty-13641670.html,"BÁN NHÀ MẶT PHỐ NGÔ ĐÌNH MẪN HÀ ĐÔNG 58m2, 6T , giá nhỉnh 12 tỷ","Vị trí đẹp có 102  toà nhà mặt phố ,căn góc , vỉa hè 5m, ngay ngã 4 Lê Trọng Tấn , đối diện Park city .
Nhà xây khung cột bê tông chắc chắn, phòng nào cũng có ánh sáng và nắng gió tự nhiên vào phòng, mỗi tầng 3 phòng khép kín, tổng 15 phòng  đang kinh doanh 50 triệu/ tháng.
Tầng 1 cho thuê mặt bằng  kinh doanh 10 triệu/tháng.
Nhà nằm vị trí rất đẹp của tuyến phố, khu vực đang rất phát triển, dân trí cao, vị trí kinh doanh đa dạng mặt hàng, nhà hàng, spa, khách sạn, văn phòng, siêu thị, mầm non …..
Chủ thiết kế vừa cho thuê kinh doanh tầng 1 và các tầng trên cho thuê căn hộ mini rất phù hợp cho khách có nhu cầu đầu tư tăng lãi vốn và có dòng tiền hàng tháng là 60 triệu 
Sổ đỏ chính chủ, vuông đẹp sẵn sàng giao dịch.  
Liên hệ gọi ngay số 962255658 để mở cửa xem nhà 24/24",12 tỷ,58 m2,"Đường Ngô Đình Mẫn, Phường La Khê, Quận Hà Đông, Hà Nội",13641670,_,True,Cần bán,20m,True,Nhà mặt tiền,Sổ hồng/ Sổ đỏ,True,5m,6,True,---,15,---,
https://alonhadat.com.vn/ban-nha-kinh-doanh-mat-ngo-to-hieu-ha-dong-35m2-gia-nhinh-4-ty-13628183.html,BÁN NHÀ KINH DOANH MẶT NGÕ TÔ HIỆU HÀ ĐÔNG 35m2 giá nhỉnh 4 tỷ,"Nhà dân 3 tầng khung cột bê tông kiên cố phòng nào cũng có ánh sáng và nắng gió tự nhiên vào phòng . Nhà đang kinh spa 
Mô tả chi tiết
T1 kinh doanh + 1 phòng khép kín
T2 có 2 ngủ + wc giữa
T3,ngủ bếp
Ngõ rộng ô tô đỗ cửa cách 20 m ô tô đỗ ngày đêm
+ vị trí
Gần chợ Hà Đông, trường mầm non tiểu học chuyên các cấp 1,2,3 Lê …
Gần báo Thanh Tra, Văn phòng tiếp dân Thành phố
Metro, chi cục Thuế, Quận uỷ … bán kính 300 m tiện ích không thiếu gì khu vực hiếm nhà bán . 
Liên hệ gọi ngay số 962255658 để mở cửa xem nhà 24/24","4,45 tỷ",35 m2,"Đường Tô Hiệu, Phường Hà Cầu, Quận Hà Đông, Hà Nội",13628183,_,---,Cần bán,3m,---,Nhà trong hẻm,Sổ hồng/ Sổ đỏ,---,"3,5m",3,---,---,5,---,
https://alonhadat.com.vn/ban-gap-nha-2-mat-tien-pho-xala-135m2-x-mt8m-gia-23-9-ty-13623356.html,"BÁN GẮP NHÀ 2 MẶT TIỀN PHỐ XALA 135m2 x MT8m giá 23,9 Tỷ","MẶT PHỐ 2 MẶT TIỀN, KINH DOANH CỰC TỐT.
MẶT TIỀN SIÊU RỘNG - 18 PHÒNG CHO THUÊ - DÒNG TIỀN 60tr/th- NHÀ NGAY VIỆN 103, HỌC VIỆN QUÂN Y, NÊN LUÔN KÍN PHÒNG.

* VỊ TRÍ: Rất đẹp, ngay đoạn gần đầu phố, cạnh Bệnh viện 103, Học viện Quân y, nên kinh doanh cực tốt, bán gì cũng đắt hàng. 

+ Nhà 2 mặt tiền, 1 mặt phố, 1 mặt sau là mặt đường Khu đô thị Xa La, gần hồ, dân cư sầm uất.

* THIẾT KẾ: Nhà xây đẹp, chắc chắn, móng tốt lên thêm tầng thoải mái.

+ Tầng 1: Thông sàn cho thuê làm siêu thị vinmart 30 triệu/1 th.
+ Tầng 2,3,4 mỗi tầng 6 phòng trọ (tổng 18 phòng) cho thuê 30/ tháng đi cửa sau.

* Sổ đỏ vuông vắn, không lỗi phong thủy, pháp lý chuẩn, sang tên nhanh.
Liên hệ gọi luôn số 962255658 để mở cửa xem nhà 24/24","23,9 tỷ",135 m2,"Phố Xa La, Phường Kiến Hưng, Quận Hà Đông, Hà Nội",13623356,_,True,Cần bán,10m,True,Nhà mặt tiền,Sổ hồng/ Sổ đỏ,True,8m,4,True,---,18,---,
https://alonhadat.com.vn/ban-lo-dat-co-the-dat-cao-giao-dep-phan-chu-trinh-ha-dong-mt5m-gia-5-ty-13618706.html,"BÁN LÔ ĐẤT CÓ THẾ ĐẤT CAO GIÁO ĐẸP PHAN CHU TRINH HÀ ĐÔNG Mt5m , giá 5 tỷ","Lô đất mặt nhìn sang  chung cư cực đẹp, phân lô vỉa hè tại trung tâm phố cổ Hà đông
Phù hợp đầu tư xây dựng quán karaoke, neo, cắt tóc, quán ăn…
Vài bước chân là ra chợ, ra siêu thị.
Khu vực kinh doanh nhộn nhịp cả ngày lẫn đêm. 
Thế đất đẹp sổ vuông vắn sẵn sàng giao dịch. Giá rẻ nhất khu vực có thương lượng thêm.
Liên hệ ngay số 962255658 để xem đất và gặp chủ nhà đàm phán giá 24/24",5 tỷ,30 m2,"Đường Phan Chu Trinh, Phường Yết Kiêu, Quận Hà Đông, Hà Nội",13618706,_,---,Cần bán,6m,---,"Đất thổ cư, đất ở",Sổ hồng/ Sổ đỏ,---,"5,1m",---,---,---,6,---,
https://alonhadat.com.vn/ban-gap-toa-building-vi-tri-kim-cuong-trung-tam-quan-ba-dinh-650m2-13t-mt30m-gia-275-t-13613097.html,"BÁN GẤP TOÀ BUILDING VỊ TRÍ KIM CƯƠNG TRUNG TÂM  QUẬN BA ĐÌNH 650m2 , 13T ,MT30m giá 275 t","NHÀ CÓ  VỊ TRÍ KIM CƯƠNG TẠI QUẬN TRUNG TÂM BA ĐÌNH
TÒA 12 TẦNG PHONG CÁCH CHÂU ÂU HIỆN ĐẠI , KIẾN TRÚC ĐỘC ĐÁO 
TÒA VP ĐA CHỨC NĂNG ĐỐI DIỆN LOTTE, DEAWOO…

Vị trí: 
Tòa nhà thiết kế khung cột bê tông kiên cố phòng nào cũng có ánh sáng và nắng gió tự nhiên vào phòng nên rất thoáng sáng sạch sẽ.
Tọa lạc tại vị trí vàng ,đắc địa mặt phố phồn hoa, trung tâm quận Ba Đình ngã tư huyết mạch giao thông nhộn nhịp.
Toà nhà thiết kế 9 tầng nổi và 3 tầng hầm và 1 tầng tum  trên diện tích đất là 650m2
Thiết kế:
Tổng diện tích sàn xây dựng tầng nổi 3.391m2
Tổng diện tích sàn xây dựng tầng hầm 1.683m2
Số tầng: 9 tầng nổi + 3 tầng hầm + 1 Tum Chỗ để xe: 3 tầng hầm
 Thang máy: 2 thang máy Mitsubishi
Điều hòa: Hệ thống điều hòa trung tâm VRV – Daikin
Máy phát điện dự phòng: 100% công suất. 
Liên hệ gọi ngay số 962255658 để gặp Chủ nhà 24/24",275 tỷ,650 m2,"Đường Kim Mã, Phường Kim Mã, Quận Ba Đình, Hà Nội",13613097,_,True,Cần bán,30m,True,Nhà mặt tiền,Sổ hồng/ Sổ đỏ,True,30m,13,True,---,30,---,
https://alonhadat.com.vn/ban-can-goc-mat-cho-bong-do-ngo-thi-nham-mt-7-5m-gia-18-ty-13666424.html,"BÁN CĂN GÓC MẶT CHỢ BÔNG ĐỎ NGÔ THỊ NHẬM Mt 7,5m giá 18 tỷ","Nhà lô góc 2 mặt phố Phan Đình Giót và Ngô Thì Nhậm, đối diện Chợ Bông đỏ , nhà văn hóa. Khu vực nhiều tiện ích  Trường Học các cấp Văn khê, thông sang khu liền kề Ngô Thì Nhậm, khu Đô thị Văn Khê - Lê Văn Lương.
+ Nhà lô góc xây 4 tầng khung cột bê tông kiên cố phòng nào cũng có ánh sáng và nắng gió tự nhiên vào phòng luôn sạch sẽ thoáng sáng .
- Hiện chủ đang cho thuê
Sổ có thế đất đẹp cao giáo giá thương lượng có gia Lộc 
Liện hệ gọi ngay số để mở cửa xem nhà 24/24",18 tỷ,68 m2,"Đường Ngô Thì Nhậm, Phường La Khê, Quận Hà Đông, Hà Nội",13666424,_,True,Cần bán,20m,True,Nhà mặt tiền,Sổ hồng/ Sổ đỏ,True,"7,5m",4,True,---,6,---,
https://alonhadat.com.vn/ban-nha-lo-goc-mat-cho-van-la-kinh-doanh-sam-uat-ngay-dem-5t-mt15-gia-15-ty-13682424.html,"BÁN NHÀ LÔ GÓC MẶT CHỢ VĂN LA KINH DOANH SẦM UẤT NGÀY ĐÊM 5T , MT15 giá 15 tỷ","Nhà lô góc vị trí quá đẹp Có 102 , ôtô tải tránh đỗ ngày đêm, đối diện chợ văn la kinh doanh gì cũng ra tiền,  hai mặt tiền thoáng kinh doanh vĩnh viễn. Hiện đang cho thuê đi chơi cũng có 70 triệu / tháng.
Nhà xây khung cột bê tông kiên cố phòng nào cũng có ánh sáng và nắng gió tự nhiên vào phòng . 
Sổ lô góc có thế đất đẹp cao giáo ( giá có gia Lộc)
Liên hệ gọi ngay số 962255658 để mở cửa xem nhà 24/24",15 tỷ,70 m2,"Đường Văn La, Phường Phú La, Quận Hà Đông, Hà Nội",13682424,_,True,Cần bán,20m,True,Nhà mặt tiền,Sổ hồng/ Sổ đỏ,True,15m,5,True,---,6,---,
https://alonhadat.com.vn/ban-nha-phan-lo-2-mat-tien-kinh-doanh-sam-uat-pho-ao-sen-80m2-gia-15-ty-13679292.html,BÁN NHÀ PHÂN LÔ 2 MẶT TIỀN KINH DOANH SẦM UẤT PHỐ AO SEN 80m2 giá 15 tỷ,"MÔ TẢ:
+ Phố Ao Sen kinh doanh sầm uất ngày đêm hiếm có căn nào 2 mặt tiền đều ô tô tránh và kinh doanh đỉnh như vậy. Nhà vị trí cực đỉnh 2 mặt tiền. Cả 2 mặt đều kinh doanh đỉnh, cả 2 mặt đều ô tô tránh dừng đỗ thoải mái. Nằm cách mặt đường Trần Phú vài bước chân, khách mua vừa ở vừa kinh doanh hoặc xây lại tòa nhà 7 tầng thì đỉnh cao. 
+ Nhà nằm cạnh HV Bưu chính viễn thông, đối diện ĐH Kiến Trúc, HV An Ninh. Khu vực trung tâm sầm uất nhất quận Hà Đông giáp Thanh Xuân, cả khu nhà ai cũng kinh doanh hoặc cho thuê, siêu thị, chợ, trường học, bệnh viện, giao thông cực thuận tiện...
Sổ đỏ vuông đẹp, thế đất cao giáo kinh doanh đỉnh cao ( có thương lượng) 
Liên hệ gọi cho số để mở cửa xem nhà 24/24",15 tỷ,80 m2,"Đường Ao Sen, Phường Mộ Lao, Quận Hà Đông, Hà Nội",13679292,_,True,Cần bán,8m,True,Nhà mặt tiền,Sổ hồng/ Sổ đỏ,True,---,5,True,---,9,---,
