url,title,description,price,area,address,Mã tin,Hướng,Phòng ăn,Loại tin,Đường trước nhà,Nhà bếp,Loại BDS,Pháp lý,Sân thượng,Chiều ngang,Số lầu,Chổ để xe hơi,Chiều dài,Số phòng ngủ,Chính chủ,Thuộc dự án
https://alonhadat.com.vn/toa-nha-ccmn-nguyen-xa-bac-tu-liem-dt-150m2-gia-chi-13-ty-lh--11175606.html,"Tòa Nhà CCMN, Nguyên Xá, Bắc Từ Liêm, DT 150m2, Giá Chỉ 15 Tỷ. Lh: .","7 TẦNG THANG MÁY - DÒNG TIỀN GẦN 100 TR/THÁNG - GIÁ RẺ NHẤT KHU VỰC.
+ VỊ trí đắc địa, ngõ 136 Cầu Diễn, gần ĐH Công nghiệp HN, ĐH Thành Đô, Cụm CN Từ Liêm, đuổi không hết khách thuê.
+ Khu vực phát triển mạnh mẽ, tương lại tăng giá mạnh.
+ Gần các tuyến đường: Cầu Diễn, Xuân Phương, Hồ Tùng Mậu, Văn Tiến Dũng...
+  DT 150 m2.
+ Giá chỉ 15 Tỷ.
+ Pháp lý: Sổ đỏ chính chủ. sẵn sàng giao dịch.
+ LH : Em Tuân .",15 tỷ,150 m2,"Đường Cầu Diễn, Phường Minh Khai, Quận Bắc Từ Liêm, Hà Nội",11175606,_,True,Cần bán,"3,5m",True,Căn hộ chung cư,Sổ hồng/ Sổ đỏ,True,"6,5m",7,True,18m,31,---,
https://alonhadat.com.vn/nha-mat-pho-cau-dien-bac-tu-liem-dt-400m2-13-tang-gia-189-ty--11149653.html,"Bán Gấp Toà Nhà Mặt Phố Cầu Diễn,Bắc Từ Liêm, DT 400m2, 13 Tầng, Giá 180 Tỷ.","1 TẦNG HẦM 12 TẦNG NỔI + 2 THANG MÁY - MẶT TIỀN KHỦNG, DOANH THU 800 TRIỆU/ THÁNG.
+ Vị Trí đẹp nhất đường Cầu Diễn, vỉa hè 7m. Tương lại là vị trí đắc địa, view ngã tư Hoàng Quốc Việt kéo dài - Đường Cầu Diễn. 
+ Thông các tuyến đường: Văn Tiến Dũng, Hồ Tùng Mậu, Hoàng Quốc Việt kéo dài…
+ Thiết kế thông sàn, 2 thang máy, nội thất 100% nhập khẩu cao cấp, sang chảnh.
+ Giấy phép xây dựng, PCCC, Bản vẽ thiết kế đầy đủ.
+ DT 400M2.
+ Giá bán: 180 tỷ.
+ Pháp lý: Sổ đỏ chính chủ, sẵn sàng giao dịch.
+ LH : Em Tuân .",180 tỷ,400 m2,"Đường Cầu Diễn, Phường Phúc Diễn, Quận Bắc Từ Liêm, Hà Nội",11149653,_,True,Cần bán,30m,True,Nhà mặt tiền,Sổ hồng/ Sổ đỏ,True,11m,13,True,"36,4m",13,---,
https://alonhadat.com.vn/nha-mat-pho-cau-dien-kinh-doanh-sam-uat-via-he-rong-dt-75m2-gia-nhinh-13-y-11905590.html,"BÁN GẤP NHÀ MP CẦU DIỄN, KD SẦM UẤT, VỈA HÈ RỘNG,DT 75M2, GIÁ 13 TỶ","HÀNG NÓNG - MẶT PHỐ - KINH DOANH BẤT CHẤP - VỈA HÈ ĐÁ BÓNG.
+ Vị trí đắc địa, kinh doanh mọi loại hình, mặt phố vỉa hè đỗ được nhiều oto. 
+ Giao thông thuận tiện: Cầu Diễn,Hồ Tùng Mậu, Nhổn…
+ Khu vực dân cư đông đúc, gần các ĐH Công Nghiệp, ĐH Tài Nguyên Môi Trường, ĐH Đông Á...
+ DT: 75m2.
+ Giá  13 tỷ. (Thương lượng với chính chủ)
+ Pháp lý: Sổ đỏ chính chủ, sẵn sàng giao dịch.
+ Lh: Mr Tuân( Xem nhà miễn phí)
Bạn có nhu cầu, tôi có giải pháp. 
Hãy gọi cho tôi, sẽ đáp ứng được nhu cầu của bạn.",13 tỷ,75 m2,"Đường Cầu Diễn, Phường Cầu Diễn, Quận Nam Từ Liêm, Hà Nội",11905590,_,True,Cần bán,30m,True,Nhà mặt tiền,Sổ hồng/ Sổ đỏ,True,6m,6,True,12m,4,---,
https://alonhadat.com.vn/ban-nha-6-tang-phu-do-kinh-doanh-o-to-vao-nha-thang-may-dt-60m2-gia-nhinh-12-ty--11828900.html,"Bán Nhà 6 Tầng Phú Đô, Kinh Doanh, Ô Tô Vào Nhà, Thang Máy, Dt 60m2, Giá Nhỉnh 12 tỷ.","MẶT NGÕ TO NHƯ PHỐ - Ô TÔ TRÁNH - KINH DOANH SẦM UẤT NGÀY ĐÊM.
+ Vị trí cực đẹp khu vực nhiều trường học, siêu thị, chợ vòng quanh nhà, kinh doanh sầm uất ngày đêm.
+ Giao thông thuận tiện khắp ngả: Phú Đô, Châu Văn Liêm, Lê Quang Đạo...
+ Nhà thiết kế 6 tầng, thang máy, tầng 1 làm gara oto hoặc kinh doanh 
+ DT: 60 m2.
+ Giá nhỉnh 12 Tỷ.
+ Pháp lý: sổ đỏ chính chủ, sẵn sàng giao dịch. 
+ Liên hệ: Mr Tuân ( Xem nhà miễn phí, tư vấn pháp lý)",12 tỷ,60 m2,"Đường Phú Đô, Phường Phú Đô, Quận Nam Từ Liêm, Hà Nội",11828900,_,True,Cần bán,8m,True,Nhà trong hẻm,Sổ hồng/ Sổ đỏ,True,"4,1m",6,True,15m,6,---,
https://alonhadat.com.vn/ban-nha-nguyen-co-thach-oto-tranh-do-ngay-dem-kinh-doanh-dt-55m2-gia-nhinh-12-ty--11839302.html,"Bán Nhà Nguyễn Cơ Thạch, Oto Tránh Đỗ Ngày Đêm, Kinh Doanh, Dt 55m2, Giá 12 tỷ.","PHÂN LÔ - 2 MẶT TIỀN - Ô TÔ TRÁNH - DỪNG ĐỖ NGÀY ĐÊM CẢ 2 MẶT - KINH DOANH TỐT.
+ Vị trí cực đẹp, 2 mặt tiền, gần hồ điều hòa, gần công an quận Nam Từ Liêm. 
+ Giao thông thuận tiện khắp ngả: Nguyễn Cơ Thạch, Hồ Tùng Mậu, Hàm Nghi...
+ Nhà thiết kế 4 tầng, nhà khung cột bê tông chắc chắn, chủ mới về sơn lại là đẹp long lanh ngay. 
+ DT: 55 m2.
+ Giá : 12 Tỷ.
+ Pháp lý: sổ đỏ chính chủ, sẵn sàng giao dịch. 
+ Liên hệ: Mr Tuân ( Xem nhà miễn phí, tư vấn pháp lý)",12 tỷ,55 m2,"Đường Nguyễn Cơ Thạch, Phường Mỹ Đình 1, Quận Nam Từ Liêm, Hà Nội",11839302,_,True,Cần bán,7m,True,Nhà trong hẻm,Sổ hồng/ Sổ đỏ,True,4m,4,True,15m,4,---,
https://alonhadat.com.vn/toa-nha-van-phong-tran-vy-8-tang-thang-may-lo-goc-oto-tranh-dt-80m2-gia-nhinh-20-ty--11839314.html,"Tòa Nhà Văn Phòng, Trần Vỹ, 8 Tầng Thang Máy, Lô Góc, Oto Tránh, Dt 80m2, Giá 20 tỷ.","TOÀ NHÀ VĂN PHÒNG - THANG MÁY - NGÕ TO NHƯ PHỐ - VỈA HÈ -  Ô TÔ CONTAINER TRÁNH NHAU - HIẾM.
+ Vị trí cực đẹp, vài bước chân ra mặt phố Trần Vỹ, Khu vực rất nhiều công ty, văn phòng hoạt động. 
+ Giao thông thuận tiện khắp ngả: Trần Vỹ, Hồ Tùng Mậu, Mai Dịch, Xuân Thủy...
+ Nhà thiết kế 8 tầng thông sàn, 1 tầng hầm để xe, cầu thang cuối. 
+ DT: 80 m2.
+ Giá  20 Tỷ.
+ Pháp lý: sổ đỏ chính chủ, sẵn sàng giao dịch. 
+ Liên hệ: Mr Tuân ( Xem nhà miễn phí, tư vấn pháp lý)",20 tỷ,80 m2,"Đường Trần Vỹ, Phường Mai Dịch, Quận Cầu Giấy, Hà Nội",11839314,_,True,Cần bán,8m,True,Văn phòng,Sổ hồng/ Sổ đỏ,True,"5,2m",8,True,15m,8,---,
https://alonhadat.com.vn/nha-mat-pho-my-dinh-oto-via-he-kinh-doanh-dt-68m2-gia-16-ty-lh--11628460.html,"Nhà Mặt Phố Mỹ Đình, Oto, Vỉa Hè, Kinh Doanh, Dt 68m2, Giá 15 tỷ. Lh: .","MẶT PHỐ MỸ ĐÌNH - VỈA HÈ - OTO TRÁNH - KINH DOANH SẦM UẤT.
+ Vị trí đắc địa gần bến xe Mỹ Đình, kinh doanh sầm uất mọi hình thức. 
+ Giao thông thuận tiện các tuyến đường: Nguyễn Hoàng, Trần Bình, Thiên Hiền…
+ Hiện trạng nhà 4 tầng, đầy đủ công năng, có thể cải tạo thành 7 tầng thang máy. 
+ DT: 68 m2.
+ Giá 15 Tỷ.
+ Pháp lý: sổ đỏ vuông vắn, sẵn sàng giao dịch. 
+ Liên hệ: Em Tuân để làm việc chính chủ.
BẠN CÓ NHU CẦU, TÔI CÓ GIẢI PHÁP.
HÃY GỌI CHO TÔI, TÔI SẼ ĐÁP ỨNG NHU CẦU CỦA BẠN.",15 tỷ,68 m2,"Đường Mỹ Đình, Phường Mỹ Đình 1, Quận Nam Từ Liêm, Hà Nội",11628460,_,True,Cần bán,10m,True,Nhà mặt tiền,Sổ hồng/ Sổ đỏ,True,0m,4,True,0m,6,---,
https://alonhadat.com.vn/nha-tran-vy-7-tang-thang-may-oto-kinh-doanh-dong-tien-60tr-thang-dt50m2-mt5m-9-8-ty--11770688.html,"Nhà Trần Vỹ, 7 Tầng Thang Máy, Oto, Kinh Doanh Dòng Tiền 60tr tháng. DT50m2, MT5m, 9.8 tỷ.","PHÂN LÔ- 2 THOÁNG- NỘI THẤT XỊN- NHÀ MỚI - ĐẸP - HĐ THUÊ 60 TRIỆU/THÁNG
+ Vị trí cực đẹp gần trường Đại học Thương Mại, Múa, Công nghiệp, Sư Phạm, nhiều văn phòng hở ra là hết phòng; 
+ Nhà mới hoàn thiện, 11 phòng full đồ, chủ nhà tự kinh doanh đã phủ kín lấp đầy phòng. 
+ Ngõ to rộng ô tô vào nhà, 15m ra oto tránh, Khu phân lô quân đội dân trí cao.
+ Mt: 5m.
+ DT: 50m2.
+ Giá: 9.8 Tỷ.
+ Pháp lý: sổ đỏ vuông vắn, sẵn sàng giao dịch. 
+ Liên hệ: Mr Tuân( Xem đất miễn phí, tư vấn pháp lý)","9,8 tỷ",50 m2,"Đường Trần Vỹ, Phường Mai Dịch, Quận Cầu Giấy, Hà Nội",11770688,_,True,Cần bán,4m,True,Nhà trong hẻm,Sổ hồng/ Sổ đỏ,True,5m,7,True,10m,11,---,
https://alonhadat.com.vn/nha-mat-pho-ho-tung-mau-mat-tien-rong-kinh-doanh-sam-uat-dt-42m2-gia-chi-9-ty--11323634.html,"Nhà Mặt Phố Hồ Tùng Mậu, Mặt Tiền Rộng, Kinh Doanh Sầm Uất. DT 42m2, Giá Chỉ 9 tỷ.","MẶT PHỐ - MẶT TIỀN RỘNG - KINH DOANH SẦM UẤT
+ Vị trí đắc địa, gần ga tàu điện trên cao, Quận ủy Nam Từ Liêm. 
+ Thiết kế 4 tầng, 4PN - vừa ở vừa kinh doanh. 
+  DT  42m2.
+ Giá hơn 9Tỷ.
+ Pháp lý: Đảm bảo sẵn sàng giao dịch.
+ LH : Em Tuân .",9 tỷ,42 m2,"Đường Hồ Tùng Mậu, Phường Mai Dịch, Quận Cầu Giấy, Hà Nội",11323634,_,True,Cần bán,30m,True,Nhà mặt tiền,Sổ hồng/ Sổ đỏ,True,"4,2m",4,True,10m,4,---,
https://alonhadat.com.vn/dat-kdt-xuan-phuong-nam-tu-liem-ha-tang-hoan-thien-dt-3500m2-gia-250-ty-lh--11518915.html,"Đất KĐT Xuân Phương, Nam Từ Liêm, Hạ Tầng Hoàn Thiện, DT 3500m2, Giá 250 tỷ. Lh: .","KHU ĐÔ THỊ XUÂN PHƯƠNG - TRUNG TÂM PHÁT TRIỂN PHÍA TÂY HÀ NỘI. 
+ Vị trí đắc địa trong khu đô thị Xuân Phương, trường học, bệnh viện, siêu thị vòng quanh. 
+ Thông các tuyến đường Trịnh Văn Bô, Đường 70, Đại Lô Thăng Long, Mỹ Đình…
+ DT: 3500m2 
+ Giá 250 Tỷ
+ Pháp lý đảm bảo, sẵn sàng giao dịch. 
+ Liên hệ: Em Tuân",250 tỷ,3.500 m2,"Đường Trịnh Văn Bô, Phường Xuân Phương, Quận Nam Từ Liêm, Hà Nội",11518915,_,---,Cần bán,15m,---,"Đất thổ cư, đất ở",Sổ hồng/ Sổ đỏ,---,0m,---,---,0m,---,---,
https://alonhadat.com.vn/biet-thu-xuan-phuong-nam-tu-liem-lo-goc-oto-via-he-dt-110m2-gia-chi-12-ty--11505047.html,"Biệt Thự Xuân Phương, Nam Từ Liêm, Lô Góc, Oto, Vỉa Hè, DT 110m2, Giá chỉ 12 tỷ.","Ô TÔ TRÁNH VỈA HÈ, LÔ GÓC, KINH DOANH, TIỀM NĂNG TĂNG GIÁ MẠNH.
+ Vị trí đắc địa trường học, siêu thị, tiện ích ngập tràn. 
+ Thông các tuyến đường Xuân Phương, Đại Lô Thăng Long, Trịnh Văn Bô...
+ Thiết kế nhà 4 tầng, 3 PN.
+ DT 110m2. 
+ Giá chỉ 12 tỷ. 
+ Pháp lý đảm bảo, sẵn sàng giao dịch. 
+ Liên hệ: Em Tuân",12 tỷ,110 m2,"Đường 70, Phường Xuân Phương, Quận Nam Từ Liêm, Hà Nội",11505047,_,True,Cần bán,6m,True,"Biệt thự, nhà liền kề",Sổ hồng/ Sổ đỏ,True,0m,4,True,0m,3,---,
https://alonhadat.com.vn/nha-pho-doan-ke-thien-cau-giay-via-he-kinh-doanh-oto-dt-118m2-gia-chi-18-ty-lh--11486578.html,"Nhà Phố Doãn Kế Thiện, Cầu Giấy, Vỉa Hè, Kinh Doanh, Oto, DT 118m2, Giá chỉ 18 tỷ. Lh: .","MẶT PHỐ - VỈA HÈ - KINH DOANH SẦM UẤT NGÀY ĐÊM - GIÁ TỐT NHẤT KHU VỰC.
+ Vị trí đắc địa mặt phố, kinh doanh ngày đêm.
+ Thông các tuyến đường Phạm Văn Đồng, Hồ Tùng Mậu, Trần Vỹ, Mai Dịch...
+ Hiện trạng nhà 2 tầng, 20m lưu không phía trước đang cho thuê. 
+ DT trên sổ 46m2, DT đóng thuế 98m2, DT sử dụng 118m2.  
+ Giá chỉ 18 tỷ. 
+ Pháp lý đảm bảo, sẵn sàng giao dịch. 
+ Liên hệ: Em Tuân",18 tỷ,118 m2,"Phố Doãn Kế Thiện, Phường Mai Dịch, Quận Cầu Giấy, Hà Nội",11486578,_,True,Cần bán,7m,True,Nhà mặt tiền,Sổ hồng/ Sổ đỏ,True,0m,2,True,0m,2,---,
https://alonhadat.com.vn/nha-ho-tung-mau-cau-giay-o-to-kinh-doanh-dt-85m2-gia-chi-12-5-ty-lh-11491499.html,"Nhà Hồ Tùng Mậu, Cầu Giấy, Ô Tô, Kinh Doanh, DT 85m2, Giá chỉ 12,5 tỷ, Lh","Ô TÔ - VỈA HÈ - KINH DOANH SẦM UẤT NGÀY ĐÊM - GIÁ TỐT NHẤT KHU VỰC.
+ Vị trí đắc địa nhiều trường đại học vòng quanh : Đại học Thương Mại, Đại học Quốc Gia, Cao Đẳng Nghệ Thuật...
+ Thông các tuyến đường Cầu Diễn, Hồ Tùng Mậu, Lê Đức Thọ, Nguyễn Cơ Thạch...
+ Thiết kế nhà 4 tầng, 4 PN. Thích hợp vừa ở vừa kinh doanh. 
+ DT 85m2. 
+ Giá chỉ 12.5 tỷ. 
+ Pháp lý đảm bảo, sẵn sàng giao dịch. 
+ Liên hệ: Em Tuân","12,5 tỷ",85 m2,"Đường Hồ Tùng Mậu, Phường Mai Dịch, Quận Cầu Giấy, Hà Nội",11491499,_,True,Cần bán,6m,True,Nhà trong hẻm,Sổ hồng/ Sổ đỏ,True,0m,4,True,0m,4,---,
https://alonhadat.com.vn/can-ho-dich-vu-phu-dien-bac-tu-liem-ngo-thong-oto-dt-100m2-gia-14-ty-lh--11500581.html,"Căn Hộ Dịch Vụ Phú Diễn, Bắc Từ Liêm, Ngõ Thông, Oto. DT 100m2, Giá 14 tỷ. Lh: .","DÒNG TIỀN 1.4 TỶ/NĂM - LỢI NHUẬN GẦN 10% - CHƯA TÍNH GIÁ ĐẤT TĂNG  Ô TÔ - LÔ GÓC - THÔNG SỐ VÀNG.
+ Vị trí đắc địa, khu vực trung tâm của các trường đại học: ĐH Tài Nguyên Môi Trường, ĐH Công Nghệp Hà Nội, ĐH Thương Mại, ĐH Mỏ Địa Chất…
+ Khu vực đuổi không hết khách thuê phòng. 
+ Thiết kế 6 tầng, thang máy, tổng 20 phòng full nội thất. 
+ DT 100m2. 
+ Giá chỉ 14 tỷ. 
+ Pháp lý đảm bảo, sẵn sàng giao dịch. 
+ Liên hệ: Em Tuân",14 tỷ,100 m2,"Đường Phú Diễn, Phường Phú Diễn, Quận Bắc Từ Liêm, Hà Nội",11500581,_,True,Cần bán,4m,True,Căn hộ chung cư,Sổ hồng/ Sổ đỏ,True,0m,6,True,0m,20,---,
https://alonhadat.com.vn/nha-phu-dien-oto-tranh-via-he-7-tang-thang-may-dt-87m2-gia-chi-15-ty-lh--11619933.html,"Nhà Phú Diễn, Oto Tránh, Vỉa Hè, 7 Tầng Thang Máy, DT 87m2, Giá chỉ 15 tỷ. Lh: .","7 TẦNG THANG MÁY - Ô TÔ TRÁNH VỈA HÈ - KINH DOANH VĂN PHÒNG.
+ Vị trí đắc địa nhà, trường học, siêu thị vòng quanh nhà, tiện ích ngập tràn.
+ Giao thông thuận tiện: Phú Diễn, Cầu Diễn, Hồ Tùng Mậu...
+ Hiện trạng nhà 7 tầng, Gara oto, cửa hàng kinh doanh. 
+ DT: 87 m2.
+ Giá 15 Tỷ.
+ Pháp lý: sổ đỏ vuông vắn, sẵn sàng giao dịch. 
+ Liên hệ: Em Tuân",15 tỷ,87 m2,"Đường Phú Diễn, Phường Phú Diễn, Quận Bắc Từ Liêm, Hà Nội",11619933,_,True,Cần bán,8m,True,Nhà trong hẻm,Sổ hồng/ Sổ đỏ,True,5m,7,True,0m,---,---,
https://alonhadat.com.vn/ban-dat-kieu-mai-btl-phan-lo-oto-tranh-via-he-rong-dt-70m2-gia-chi-8-ty--12034861.html,"Bán Đất Kiều Mai, BTL, Phân Lô, Oto Tránh, Vỉa Hè Rộng, DT 70m2, Giá chỉ 8 tỷ.","KHU TÁI ĐỊNH CƯ KIỀU MAI - PHÂN LÔ - Ô TÔ TRÁNH - 2 THOÁNG TRƯỚC SAU - VỈA HÈ RỘNG.
+ Vị trí đắc địa đường rộng, kinh doanh mọi loại hình, tiềm năng tăng giá mạnh. 
+ Giao thông thuận tiện: Kiều Mai, Cầu Diễn, Hồ Tùng Mậu, Văn Tiến Dũng...
+ Khu vực dân trí cao, tiện ích sống ngập tràn.  
+ DT: 70m2.
+ Giá chỉ 8tỷ. Mua bán chính chủ, không qua chung gian. 
+ Pháp lý: Sổ đỏ nở hậu 5cm, sẵn sàng giao dịch.
+ Lh: Mr Tuân (Để làm việc chính chủ).",8 tỷ,70 m2,"Đường Kiều Mai, Phường Phúc Diễn, Quận Bắc Từ Liêm, Hà Nội",12034861,_,---,Cần bán,10m,---,"Đất thổ cư, đất ở",Sổ hồng/ Sổ đỏ,---,"5,5m",---,True,13m,---,---,
https://alonhadat.com.vn/biet-thu-song-lap-dai-mo-oto-kinh-doanh-via-he-rong-dt-127m2-gia-chi-10-ty--12034841.html,"BT Song Lập Đại Mỗ, Oto, Kinh Doanh, Vỉa Hè, Dt 127m2, Giá 9.7 tỷ.","BIỆT THỰ ĐẲNG CẤP - OTO TRÁNH- VỈA HÈ RỘNG - GIÁ RẺ NHẤT KHU VỰC.

+ Vị trí đắc địa đường rộng, kinh doanh mọi loại hình, tiềm năng tăng giá mạnh. 
+ Giao thông thuận tiện: Đại Mỗ, Đại Lô Thăng Long, Vinsmart City, Aeon Maill Hà Đông...
+ Khu vực dân trí cao, tiện ích sống ngập tràn. 
+ Hiện trạng nhà xây 4 tầng, đang cho thuê giá hữu nghị.
+ DT: 127m2.
+ Giá chỉ 9.7 tỷ. Mua bán chính chủ, không qua chung gian. 
+ Pháp lý: Sổ đỏ vuông vắn, sẵn sàng giao dịch.
+ Lh: Mr Tuân (Để làm việc chính chủ).
Ngoài ra em còn rất nhiều nhà phố, nhà dòng tiền, BT, BTLK, đất xây văn phòng, đất xây CCMN... đẹp. 
Anh chị gọi ngay cho em sẽ giúp anh chị tìm được sản phẩm phù hợp.","9,7 tỷ",127 m2,"Đường Đại Mỗ, Phường Đại Mỗ, Quận Nam Từ Liêm, Hà Nội",12034841,_,True,Cần bán,7m,True,"Biệt thự, nhà liền kề",Sổ hồng/ Sổ đỏ,True,7m,4,True,18m,4,---,Khu đô thị mới Đại Mỗ (xem chi tiết dự án)
https://alonhadat.com.vn/ban-dat-phu-dien-phan-lo-oto-vao-nha-2-mat-tien-dt-90m2-gia-9-ty--12236905.html,"Bán Đất Phú Diễn, Phân Lô, Oto Vào Nhà, 2 Mặt Tiền. DT 90m2, Giá 9 tỷ.","PHÂN LÔ - OTO VÀO NHÀ - 2 MẶT TIỀN THOÁNG SÁNG VÔ CÙNG - XÂY CĂN HỘ DỊCH VỤ.
+ Vị trí đắc địa, gần phố, tiện ích sống ngập tràn, khu vực cư dân đông đúc, luôn thiếu phòng thuê.
+ Giao thông thuận tiện các tuyến phố: Phú Diễn, Cầu Diễn, Hồ Tùng Mậu…
+ Phù hợp xây căn hộ dịch vụ 7 tầng thang máy. 
+ DT 90m2. 
+ Giá 9 tỷ. Mua bán chính chủ, không qua trung gian. 
+ Pháp lý: Sổ đỏ sẵn sàng giao dịch.
+ Lh: Mr Tuân  (Để làm việc chính chủ).",9 tỷ,90 m2,"Đường Phú Diễn, Phường Phú Diễn, Quận Bắc Từ Liêm, Hà Nội",12236905,_,---,Cần bán,1m,---,"Đất thổ cư, đất ở",Sổ hồng/ Sổ đỏ,---,9m,---,---,010m,---,---,
https://alonhadat.com.vn/ban-nha-mat-pho-phu-do-8-tang-thang-may-kinh-doanh-khung-dt-70m2-gia-15-ty--12254926.html,"BÁN NHÀ MẶT PHỐ PHÚ ĐÔ, 8 TẦNG THANG MÁY, KINH DOANH KHỦNG. DT 70M2, GIÁ 15 TỶ.","CỰC HIẾM - SIÊU PHẨM PHÚ ĐÔ - KINH DOANH -  VĂN PHÒNG.
+ Vị trí đắc địa, mặt phố Phú Đô nơi có dân số đông đúc,kinh doanh mọi loại hình. 
+ Nhà thiết kế 7 tầng nổi + 1 tầng hầm, thang máy. Phù hợp vừa ở vừa kinh doanh. 
+ Giao thông thuận tiện các tuyến đường: Phú Đô, Lê Quang Đạo, Đại Lô Thăng Long, Châu Văn Liêm...
+ DT 70m2. 
+ Giá nhỉnh 15 tỷ. Mua bán chính chủ, không qua trung gian. 
+ Pháp lý: Sổ đỏ sẵn sàng giao dịch.
+ Lh: Mr Tuân  (Để làm việc chính chủ).",15 tỷ,70 m2,"Đường Phú Đô, Phường Phú Đô, Quận Nam Từ Liêm, Hà Nội",12254926,_,True,Cần bán,10m,True,Nhà mặt tiền,Sổ hồng/ Sổ đỏ,True,5m,8,True,14m,6,---,
https://alonhadat.com.vn/ban-toa-nha-van-phong-hang-a-le-duc-tho-dong-tien-2-5-ty-nam-dt-105m2-gia-12289385.html,"Bán Tòa Nhà VP Hạng A, Lê Đức Thọ, Dòng Tiền 2,5 Tỷ.Năm, Dt 105m2, Giá 30 tỷ.","TOÀ NHÀ VP HIỆN ĐẠI CHUẨN HẠNG A - KINH DOANH SẦM UẤT - DÒNG TIỀN 240 TR/THÁNG.
+ Vị trí đắc địa, mặt ngõ to hơn phố, vỉa hè, oto tránh. Khu vực tập trung nhiều tòa nhà văn phòng. 
+ Giao thông thuận tiện, 50m ra đến mặt phố Lê Đức Thọ, thông các tuyến: Nguyễn Hoàng, Lê Quang Đạo, Hồ Tùng Mậu, Mỹ Đình...
+ Thiết kế 7 tầng thang máy + 1 hầm để xe, các tầng thông sàn, thang máy nhập, điều hòa âm trần. 
+ Phù hợp đầu tư giữ tiền, có dòng tiền khủng. 
+  DT 105m2.
+ Pháp lý: sổ đỏ chính chủ, giao dịch ngay.
+ Giá nhỉnh 30 tỷ. Mua bán chính chủ, không qua trung gian. 
+ Lh: Mr Tuân  (Để làm việc chính chủ).",30 tỷ,105 m2,"Đường Lê Đức Thọ, Phường Mỹ Đình 1, Quận Nam Từ Liêm, Hà Nội",12289385,_,True,Cần bán,10m,True,Văn phòng,Sổ hồng/ Sổ đỏ,True,7m,7,True,15m,7,---,
