https://alonhadat.com.vn/ban-gap-biet-thu-kdt-moi-dich-vong-70-ty-310m2-mt-16m-5-tang-lo-goc-via-he-o-to-tranh-ki-13081876.html,BÁN BIỆT THỰ KĐT MỚI DỊCH VỌNG 55 TỶ 310m2 MT 16m  5  TẦNG LÔ GÓC VỈA HÈ Ô TÔ TRÁNH KI,"BÁN BIỆT THỰ KĐT MỚI DỊCH VỌNG 60 TỶ 310m2 MT 16m  5  TẦNG LÔ GÓC VỈA HÈ Ô TÔ TRÁNH KINH DOANH AN SINH ĐỈNH 

 
+ Biệt thự lô góc, phù hợp mọi nhu cầu của khách hàng: ở, kinh doanh, văn phòng ….
+  Khu đô thị mới Dịch Vọng được bao bọc xung quanh bởi 4,5 toà chung cư.
+ Khu đô thị mới Dịch Vọng là khu đô thị đáng sống bậc nhất của quận Cầu Giấy, hạ tầng đồng bộ, kết nối với các tuyến phố trung tâm một cách nhanh chóng : Phố Thành Thái, Cầu Giấy, Dịch Vọng, Khúc Thừa Dụ, Nguyễn Văn Huyên, Dịch Vọng, Nguyễn Phong Sắc, Trần Thái Tông, Trần Quốc Vượng, Xuân Thủy, Công Viên Thủ Lệ, Khúc Thừa Dụ, Chùa Hà, Nguyễn Văn Huyên , Nguyễn Phong Sắc, Trần Quốc Hoàn, Nghĩa Tân, Phạm Văn Đồng, Đặng Thùy Trâm, Phạm Tuấn Tài, Nghĩa Đô, Hoàng Quốc Việt, vv…..
+ Nhà thiết kế kiểu biệt thự nhà vườn, 3 tầng một tum, diện tích xây dựng khoảng 35% tổng diện tích, phần diện tích còn lại là sân vườn…
+ Sổ đỏ vuông đẹp nở hậu cất két sẵn sàng giao dịch.
+ Lh em Thúy:  chuyên đất thổ cư, nhà mặt phố, biệt thự, dự án  khắp khu vực hà nội.
+ Được Tư vấn hỗ trợ pháp lý, hợp đồng, sổ đỏ 24/24h  xem nhà miễn phí, tư vấn tận tâm. ( uy tín, chất lượng, bền vững, lâu dài ) đến với em Thúy được mua nhà đất theo nhu cầu.
( Lưu chủ tự thương lượng giá. )",60 tỷ,310 m2,"Đường Dịch Vọng, Phường Dịch Vọng, Quận Cầu Giấy, Hà Nội",13081876,_,True,Cần bán,10m,True,"Biệt thự, nhà liền kề",Sổ hồng/ Sổ đỏ,True,16m,5,True,---,4,---,Khu đô thị mới Dịch Vọng (xem chi tiết dự án)
https://alonhadat.com.vn/can-ban-gap-nha-pho-tran-thai-tong-55-ty-150m2-mt-8m-7-tang-van-phong-thang-may-co-ham-k-13082019.html,CẦN BÁN GẤP NHÀ PHỐ  TRẦN THÁI TÔNG  55 TỶ 150m2 MT 8m 7 TẦNG VĂN PHÒNG THANG MÁY CÓ HẦM K,"CẦN BÁN GẤP NHÀ PHỐ  TRẦN THÁI TÔNG  55 TỶ 150m2 MT 8m 7 TẦNG VĂN PHÒNG THANG MÁY CÓ HẦM KINH DOANH VỈA HÈ Ô TÔ TRÁNH

+ Ngõ  to và đẹp nhất phố Trần Thái Tông, xung quanh toàn các toà văn phòng đẳng cấp. 
+ Phố Trần Thái Tông, Dịch Vọng Hậu, Cầu Giấy, hạ tầng đồng bộ, kết nối với các tuyến phố trung tâm một cách nhanh chóng : Phố Thành Thái, Cầu Giấy, Dịch Vọng, Khúc Thừa Dụ, Nguyễn Văn Huyên, Dịch Vọng, Nguyễn Phong Sắc, Trần Quốc Vượng, Xuân Thủy, Công Viên Thủ Lệ, Khúc Thừa Dụ, Chùa Hà, Nguyễn Văn Huyên , Nguyễn Phong Sắc, Trần Quốc Hoàn, Nghĩa Tân, Phạm Văn Đồng, Đặng Thùy Trâm, Phạm Tuấn Tài, Nghĩa Đô, Hoàng Quốc Việt, vv…..
+ Nhà thiết 6 tầng nổi 1 tầng hầm có thang máy.
+ Pháp lý sạch, sổ đỏ vuông vắn, khu được phép xây dựng 9 - 12 tầng.
+ Được Tư vấn hỗ trợ pháp lý, hợp đồng, sổ đỏ 24/24h  xem nhà miễn phí, tư vấn tận tâm. ( uy tín, chất lượng, bền vững, lâu dài ) đến với em Thúy được mua nhà đất theo nhu cầu.
( Lưu ý chủ, khách tự thương lượng giá. )",55 tỷ,150 m2,"Phố Trần Thái Tông, Phường Dịch Vọng Hậu, Quận Cầu Giấy, Hà Nội",13082019,_,True,Cần bán,15m,True,Nhà mặt tiền,Sổ hồng/ Sổ đỏ,True,8m,7,True,---,4,---,
https://alonhadat.com.vn/sieu-pham-dat-mat-pho-dich-vong-hau-55-ty-150m2-mat-tien-12m-kinh-doanh-dinh-xay-toa-buil-13081964.html,SIÊU PHẨM ĐẤT MẶT PHỐ DỊCH VỌNG HẬU 55 TỶ 150m2  MẶT TIỀN 12m KINH DOANH ĐỈNH XÂY TÒA BUIL,"SIÊU PHẨM ĐẤT MẶT PHỐ DỊCH VỌNG HẬU 55 TỶ 150m2  MẶT TIỀN 12m KINH DOANH ĐỈNH XÂY TÒA BUILDING 9 TẦNG  HIỆN  CHO THUÊ  80TR/THÁNG.

+ Vị trí quyền lực, ngay ngã 3 dịch vọng hậu, xung quanh là các tòa nhà văn phòng tuyệt đỉnh. Khu vực trung tâm quận cầu giấy, gần công viên cầu giấy, công viên viettel, tòa đại sứ quán mỹ,... Giao thông thuận tiện, phố thông các ngả đường.
+ Phố Dịch Vọng Hậu, Cầu Giấy, hạ tầng đồng bộ, kết nối với các tuyến phố trung tâm một cách nhanh chóng : Phố Thành Thái, Cầu Giấy, Dịch Vọng, Khúc Thừa Dụ, Nguyễn Văn Huyên, Dịch Vọng, Nguyễn Phong Sắc, Trần Thái Tông, Trần Quốc Vượng, Xuân Thủy, Công Viên Thủ Lệ, Khúc Thừa Dụ, Chùa Hà, Nguyễn Văn Huyên , Nguyễn Phong Sắc, Trần Quốc Hoàn, Nghĩa Tân, Phạm Văn Đồng, Đặng Thùy Trâm, Phạm Tuấn Tài, Nghĩa Đô, Hoàng Quốc Việt, vv…..
+ Phù hợp khách mua xây tòa Building, khách sạn, homstay, tòa căn hộ,....
+ Sổ đỏ chính chủ sẵn sàng giao dịch.
+ Được Tư vấn hỗ trợ pháp lý, hợp đồng, sổ đỏ 24/24h  xem nhà miễn phí, tư vấn tận tâm. ( uy tín, chất lượng, bền vững, lâu dài ) đến với em Thúy được mua nhà đất theo nhu cầu.
( Lưu ý chủ, khách tự thương lượng giá. )",55 tỷ,150 m2,"Phố Dịch Vọng Hậu, Phường Dịch Vọng Hậu, Quận Cầu Giấy, Hà Nội",13081964,_,---,Cần bán,20m,---,"Đất thổ cư, đất ở",Sổ hồng/ Sổ đỏ,---,12m,---,---,---,---,---,
https://alonhadat.com.vn/sieu-biet-thu-kdt-dich-vong-cau-giay-60-ty-300m2-mt-20m-5-tang-via-he-o-to-tranh-kinh-doan-13081846.html,SIÊU BIỆT THỰ KĐT DỊCH VỌNG CẦU GIẤY 45 TỶ 300m2 MT 20m 5 TẦNG VỈA HÈ Ô TÔ TRÁNH KINH DOAN,"SIÊU BIỆT THỰ THÔ KĐT DỊCH VỌNG CẦU GIẤY 45 TỶ 300m2 MT 20m 5 TẦNG LÔ GÓC VỈA HÈ Ô TÔ TRÁNH KINH DOANH AN SINH ĐỈNH CAO

 + Vị trí nằm trong khu phân lô cao cấp, LÔ GÓC, ngõ rộng ô tô tránh, có vỉa hè.
 + Cách mặt phố Cầu Giấy vài trăm mét.
+ Phố Cầu Giấy, Dịch Vọng, Khúc Thừa Dụ, Nguyễn Văn Huyên, Dịch Vọng, Nguyễn Phong Sắc, Trần Thái Tông, Trần Quốc Vượng, Xuân Thủy, Công Viên Thủ Lệ, Khúc Thừa Dụ, Chùa Hà, Nguyễn Văn Huyên , Nguyễn Phong Sắc, Trần Quốc Hoàn, Nghĩa Tân, Phạm Văn Đồng, Đặng Thùy Trâm, Phạm Tuấn Tài, Nghĩa Đô, Hoàng Quốc Việt, vv…..
 + Biệt thự thiết kế 1 tầng hầm, 4 tầng nổi. Tầng 1 là phòng ăn và phòng khách, tầng 2,3 mỗi tầng 3 phòng ngủ. Tầng 4 là phòng thờ, sân phơi.
+ Sổ đỏ vuông đẹp nở hậu cất két sẵn sàng giao dịch.
+ Lh em Thúy:  chuyên đất thổ cư, nhà mặt phố, biệt thự, dự án  khắp khu vực hà nội.
+ Được Tư vấn hỗ trợ pháp lý, hợp đồng, sổ đỏ 24/24h  xem nhà miễn phí, tư vấn tận tâm. ( uy tín, chất lượng, bền vững, lâu dài ) đến với em Thúy được mua nhà đất theo nhu cầu.
( Lưu chủ tự thương lượng giá. )",45 tỷ,300 m2,"Đường Dịch Vọng, Phường Dịch Vọng, Quận Cầu Giấy, Hà Nội",13081846,_,True,Cần bán,10m,True,"Biệt thự, nhà liền kề",Sổ hồng/ Sổ đỏ,True,20m,5,True,---,4,---,Khu đô thị mới Dịch Vọng (xem chi tiết dự án)
https://alonhadat.com.vn/can-ban-gap-mat-pho-khuc-thua-du-cau-giay-70-ty-200m2-5-tang-mt-10m-san-mong-9-tang-co-ha-13082262.html,CẦN BÁN GẤP MẶT PHỐ KHÚC THỪA DỤ CẦU GIẤY 70 TỶ  200m2 5 TẦNG MT 10m SẴN MÓNG 9 TẦNG CÓ HẦ,"CẦN BÁN GẤP MẶT PHỐ KHÚC THỪA DỤ CẦU GIẤY 70 TỶ  200m2 5 TẦNG MT 10m SẴN MÓNG 9 TẦNG CÓ HẦM  KINH DOANH VỈA HÈ Ô TÔ ĐUA

- Vị trí toà nhà gần ngã tư Khúc Thừa Dụ - Thọ Tháp, Phố Thành Thái, Cầu Giấy, Dịch Vọng, Dịch Vọng, Trần Quốc Vượng, Xuân Thủy, Công Viên Thủ Lệ, Chùa Hà, Nguyễn Văn Huyên , Nguyễn Phong Sắc, Trần Quốc Hoàn, Nghĩa Tân, Phạm Văn Đồng, Đặng Thùy Trâm, Phạm Tuấn Tài, Nghĩa Đô, Hoàng Quốc Việt, vv…..
- Toà nhà hiện tại 4 tầng nổi, 1 tầng hầm, thiết kế thông sàn thời thượng, móng 9 tầng. Khách mua về chồng thêm 4 tầng nữa thì cực nguy nga.
- Hiện tại đang cho thuê 200 Triệu/Tháng. Hợp đồng còn hơn 1 năm, vì thế rất dễ cho việc khách mua lựa chọn cho thuê tiếp hoặc lấy lại Nhà.
+ Sổ đỏ chính chủ, cất két, pháp lý rõ ràng.
+ Lh em Thúy:  chuyên đất thổ cư, nhà mặt phố, biệt thự, dự án  khắp khu vực hà nội.
+ Được Tư vấn hỗ trợ pháp lý, hợp đồng, sổ đỏ 24/24h  xem nhà miễn phí, tư vấn tận tâm. ( uy tín, chất lượng, bền vững, lâu dài ) đến với em Thúy được mua nhà đất theo nhu cầu.
( Lưu ý chủ tự thương lượng giá. )",70 tỷ,200 m2,"Phố Khúc Thừa Dụ, Phường Dịch Vọng Hậu, Quận Cầu Giấy, Hà Nội",13082262,_,True,Cần bán,25m,True,Nhà mặt tiền,Sổ hồng/ Sổ đỏ,True,10m,5,True,---,4,---,
https://alonhadat.com.vn/ban-toa-nha-mat-pho-nguyen-van-huyen-cau-giay-25-ty-50m-7-tang-mt-5m-kinh-doanh-o-to-tranh-13082126.html,BÁN TÒA NHÀ MẶT PHỐ NGUYỄN VĂN HUYÊN CẦU GIẤY 25 TỶ 50m 7 TẦNG MT 5m KINH DOANH Ô TÔ TRÁNH,"BÁN TÒA NHÀ MẶT PHỐ NGUYỄN VĂN HUYÊN CẦU GIẤY 25 TỶ 50m 7 TẦNG MT 5m KINH DOANH Ô TÔ TRÁNH 

Mặt phố Nguyễn Văn Huyên, Khúc Thừa Dụ, Nguyễn Phong Sắc, chạy song song với đường Xuân Thuỷ khu có mật độ dân số và sinh viên đông nhất quận Cầu Giấy giao cắt với đường Phạm Hùng và thông tứ tung ra Duy Tân, Trần Thái Tông, Dịch Vọng Hậu, Cầu Giấy, hạ tầng đồng bộ, kết nối với các tuyến phố trung tâm một cách nhanh chóng : Phố Thành Thái, Cầu Giấy, Dịch Vọng, Dịch Vọng, Trần Quốc Vượng, Xuân Thủy, Công Viên Thủ Lệ, Khúc Thừa Dụ, Chùa Hà, Nguyễn Văn Huyên , Nguyễn Phong Sắc, Trần Quốc Hoàn, Nghĩa Tân, Phạm Văn Đồng, Đặng Thùy Trâm, Phạm Tuấn Tài, Nghĩa Đô, Hoàng Quốc Việt, vv…..
+ Nhà 7 tầng thang máy, thông sàn từ tầng 1 đến tầng 4, tầng 5 khách, bếp, tầng 6 phòng thờ, tầng 7 sân thượng.
+ Nhà 2 mặt thoáng, một mặt phố và một mặt ngõ sau 2m, nên từ tầng 2 trở lên là 60m rất rộng,
+ Sổ đỏ chính chủ, cất két, pháp lý rõ ràng.
+ Lh em Thúy:  chuyên đất thổ cư, nhà mặt phố, biệt thự, dự án  khắp khu vực hà nội.
+ Được Tư vấn hỗ trợ pháp lý, hợp đồng, sổ đỏ 24/24h  xem nhà miễn phí, tư vấn tận tâm. ( uy tín, chất lượng, bền vững, lâu dài ) đến với em Thúy được mua nhà đất theo nhu cầu.
( Lưu ý chủ tự thương lượng giá. )",25 tỷ,50 m2,"Đường Nguyễn Văn Huyên, Phường Nghĩa Đô, Quận Cầu Giấy, Hà Nội",13082126,_,True,Cần bán,40m,True,Nhà mặt tiền,Sổ hồng/ Sổ đỏ,True,5m,7,True,---,4,---,
https://alonhadat.com.vn/ban-nha-pho-duy-tan-cau-giay-25-ty-50m-6-tang-mt-5m-kinh-doanh-o-to-tranh-13082179.html,BÁN NHÀ  PHỐ DUY TÂN CẦU GIẤY 25 TỶ 50m 6  TẦNG MT 5m KINH DOANH Ô TÔ TRÁNH,"BÁN NHÀ  PHỐ DUY TÂN CẦU GIẤY 25 TỶ 50m 6  TẦNG MT 5m KINH DOANH Ô TÔ TRÁNH 

Mặt phố Duy Tân, Nguyễn Văn Huyên, Khúc Thừa Dụ, Nguyễn Phong Sắc, chạy song song với đường Xuân Thuỷ khu có mật độ dân số và sinh viên đông nhất quận Cầu Giấy giao cắt với đường Phạm Hùng và thông tứ tung ra Trần Thái Tông, Dịch Vọng Hậu, Cầu Giấy, hạ tầng đồng bộ, kết nối với các tuyến phố trung tâm một cách nhanh chóng : Phố Thành Thái, Cầu Giấy, Dịch Vọng, Dịch Vọng, Trần Quốc Vượng, Xuân Thủy, Công Viên Thủ Lệ, Khúc Thừa Dụ, Chùa Hà, Nguyễn Văn Huyên , Nguyễn Phong Sắc, Trần Quốc Hoàn, Nghĩa Tân, Phạm Văn Đồng, Đặng Thùy Trâm, Phạm Tuấn Tài, Nghĩa Đô, Hoàng Quốc Việt, vv…..
+ Nhà 6 tầng thang máy, thông sàn từ tầng 1 đến tầng 2, tầng 3 khách, Tầng 4, 5, 4 ngủ, tầng 6  phòng thờ, sân thượng.
+ Nhà 2 mặt thoáng, một mặt phố và một mặt ngõ sau 2m, nên từ tầng 2 trở lên là 60m rất rộng,
+ Sổ đỏ chính chủ, cất két, pháp lý rõ ràng.
+ Lh em Thúy:  chuyên đất thổ cư, nhà mặt phố, biệt thự, dự án  khắp khu vực hà nội.
+ Được Tư vấn hỗ trợ pháp lý, hợp đồng, sổ đỏ 24/24h  xem nhà miễn phí, tư vấn tận tâm. ( uy tín, chất lượng, bền vững, lâu dài ) đến với em Thúy được mua nhà đất theo nhu cầu.
( Lưu ý chủ tự thương lượng giá. )",25 tỷ,50 m2,"Phố Duy Tân, Phường Dịch Vọng Hậu, Quận Cầu Giấy, Hà Nội",13082179,_,True,Cần bán,10m,True,Nhà trong hẻm,Sổ hồng/ Sổ đỏ,True,5m,6,True,---,4,---,
