url,title,description,price,area,address,Mã tin,Hướng,Phòng ăn,Loại tin,Đường trước nhà,Nhà bếp,Loại BDS,Pháp lý,Sân thượng,Chiều ngang,Số lầu,Chổ để xe hơi,Chiều dài,Số phòng ngủ,Chính chủ,Thuộc dự án
https://alonhadat.com.vn/nha-tran-vy-cau-giay-phan-lo-oto-tranh-thang-may-dt-50m2-gia-9-ty-lh--11518786.html,"Nhà Trần Vỹ, Cầu Giấy, Phân Lô, Oto tránh, Thang máy, DT 50m2, Giá hơn 9 tỷ.","7 TẦNG THANG MÁY, PHÂN LÔ, Ô TÔ TRÁNH, KINH DOANH, TIỀM NĂNG TĂNG GIÁ MẠNH.
+ Vị trí đắc địa trường học, siêu thị, tiện ích ngập tràn. 
+ Thông các tuyến đường  Trần Vỹ, Mai Dịch, Hồ Tùng Mậu, Lê Đức Thọ...
+ Thiết kế 7 tầng, thang máy, gara oto, Full công năng sử dụng. 
+ DT 50m2. 
+ Giá hơn 9 tỷ. 
+ Pháp lý đảm bảo, sẵn sàng giao dịch. 
+ Liên hệ: Em Tuân Thổ địa Từ Liêm
Ngoài ra em còn rất nhiều nhà phố, nhà dòng tiền, đất xây văn phòng, đất xây CCMN... đẹp. 
Anh chị gọi ngay cho em sẽ giúp anh chị tìm được sản phẩm ưng ý.","9,05 tỷ",50 m2,"Đường Trần Vỹ, Phường Mai Dịch, Quận Cầu Giấy, Hà Nội",11518786,_,True,Cần bán,5m,True,Nhà trong hẻm,Sổ hồng/ Sổ đỏ,True,0m,7,True,0m,12,---,
https://alonhadat.com.vn/nha-mai-dich-cau-giay-phan-lo-quan-doi-via-he-oto-dt-60m2-gia-12-ty-lh--11344596.html,"Nhà Mai Dịch, Cầu Giấy, Phân Lô Quân Đội, Vỉa Hè, Oto, DT 60m2, Giá 12 tỷ. Lh:","PHÂN LÔ  QUÂN KHU THỦ ĐÔ - LÔ GÓC - VỈA HÈ ĐÁ BÓNG - Ô TÔ TRÁNH - Ở ĐẲNG CẤP. 
+ Vị trí đắc địa, khu vực hiếm nhà bán, chợ, trường học, siêu thị vòng quanh nhà. 
+ Khu dân trí cao, toàn cán bộ lão thành bên Quân đội, một bước chân ngàn tiện ích, ở quá V.I.P , kinh doanh tốt. 
+ Thiết kế nhà 4 tầng full công năng, lô góc cực thoáng sáng, trước cửa là trường học, thoáng vĩnh viễn. 
+ DT  60m2.
+ Giá chỉ 12 Tỷ.
+ Pháp lý: Đảm bảo sẵn sàng giao dịch.
+ LH : Em Tuân .",12 tỷ,60 m2,"Đường Cầu vượt Mai Dịch, Phường Mai Dịch, Quận Cầu Giấy, Hà Nội",11344596,_,True,Cần bán,6m,True,Nhà trong hẻm,Sổ hồng/ Sổ đỏ,True,---,4,True,0m,4,---,
https://alonhadat.com.vn/biet-thu-my-dinh-nam-tu-liem-khu-vuc-song-dang-cap-dt-162m2-gia-40-ty-lh--11337384.html,"Biệt Thự Mỹ Đình, Nam Từ Liêm, Khu Vực Sống Đẳng Cấp, DT 162m2, Giá 40 tỷ. Lh:","SIÊU BIỆT THỰ KĐT MỸ ĐÌNH TOÀN TƯỚNG TÁ Ở - LÔ GÓC HAI MẶT THOÁNG - Ô TÔ TRÁNH - VỈA HÈ - Ở SƯỚNG.
+ Vị trí đắc địa, khu vực toàn Quan chức cấp cao, gần nhà Đại tướng Tô Lâm, đường to ô tô tránh và dừng đỗ ngày đêm, vỉa hè, view công viên. 
+ Thông Nguyễn Cơ Thạch - Hàm Nghi - Lưu Hữu Phước - Đỗ Đức Dục…
+ Khu vực dân trí cao, an sinh tuyệt vời, tiện ích miễn bàn, cực hiếm nhà bán.
+ Thiết kế 4 tầng, gara oto, đầy đủ công năng, full nội thất về ở ngay. 
+  DT  162m2.
+ Giá chỉ 40Tỷ.
+ Pháp lý: Đảm bảo sẵn sàng giao dịch.
+ LH : Em Tuân .",40 tỷ,162 m2,"Đường Nguyễn Cơ Thạch, Phường Mỹ Đình 2, Quận Nam Từ Liêm, Hà Nội",11337384,_,True,Cần bán,9m,True,"Biệt thự, nhà liền kề",Sổ hồng/ Sổ đỏ,True,9m,4,True,18m,6,---,Khu đô thị mới Mỹ Đình II (xem chi tiết dự án)
https://alonhadat.com.vn/nha-duong-khue-cau-giay-via-he-rong-kinh-doanh-sam-uat-mt-9m-dt-75m2-gia-16-ty--11757370.html,"Nhà Dương Khuê, Cầu Giấy, Vỉa Hè Rộng, Kinh Doanh Sầm Uất, MT 9m, DT 75m2, Giá 15.5 tỷ.","NGÕ TO HƠN PHỐ, VỈA HÈ RỘNG, KINH DOANH SẦM UẤT NGÀY ĐÊM, MẶT TIỀN KHỦNG. 
+ Vị trí đắc địa tuyến phố phát triển mạnh mẽ, nhiều trường đại học, công ty, văn phòng xung quanh.
+ Giao thông thuận tiện khắp ngả: Dương Khuê, Nguyễn Hoàng, Hồ Tùng Mậu...
+ Thiết kế 5 tầng, phù hợp vừa ở vừa kinh doanh, cho thuê kinh doanh hoặc đập đi xây tòa nhà văn phòng.
+ Mt: 9m.
+ DT: 75m2.
+ Giá nhỉnh 15.5 Tỷ.
+ Pháp lý: sổ đỏ chính chủ, sẵn sàng giao dịch. 
+ Liên hệ: Mr Tuân ( Xem đất miễn phí, tư vấn pháp lý)","15,5 tỷ",75 m2,"Đường Dương Khuê, Phường Mai Dịch, Quận Cầu Giấy, Hà Nội",11757370,_,True,Cần bán,10m,True,Nhà trong hẻm,Sổ hồng/ Sổ đỏ,True,9m,5,True,"8,5m",4,---,
https://alonhadat.com.vn/nha-mat-pho-xuan-phuong-oto-tranh-kinh-doanh-sam-uat-dt-120m2-gia-chi-12-ty-lh--11692362.html,"Nhà Mặt Phố Xuân Phương, Oto Tránh, Kinh Doanh Sầm Uất, DT 120m2, Giá Chỉ: 12 tỷ. LH: .","MẶT PHỐ KINH DOANH - Ô TÔ TRÁNH - GIÁ ĐẦU TƯ SINH LỜI CỰC LỚN.
+ Vị trí đắc địa tuyến phố đông sinh viên ĐH Công Nghiệp Hà Nội, canh CC Hateco Applo. 
+ Giao thông thuận tiện:  5' đến Mỹ Đình, 10' đến Cầu Giấy, gần Nhổn, Xuân Phương, Cầu Diễn, Trịnh Văn Bô...
+ Hiện trạng nhà cấp 4, chủ xác định bán đất tặng nhà.
+ DT: 120 m2.
+ Giá: 12 Tỷ.
+ Pháp lý: sổ đỏ chính chủ, sẵn sàng giao dịch. 
+ Liên hệ: Em Tuân  (Để gặp chủ nhà)",12 tỷ,120 m2,"Đường Xuân Phương, Phường Phương Canh, Quận Nam Từ Liêm, Hà Nội",11692362,_,True,Cần bán,15m,True,Nhà mặt tiền,Sổ hồng/ Sổ đỏ,True,"4,5m",1,True,0m,2,---,
https://alonhadat.com.vn/nha-pho-doan-ke-thien-oto-tranh-kinh-doanh-sam-uat-lo-goc-dt-195m2-gia-20-ty--11701421.html,"Nhà Phố Doãn Kế Thiện, Oto Tránh, Kinh Doanh Sầm Uất, Lô Góc, DT 195m2, Giá 20 tỷ.","TUYẾN PHỐ KINH DOANH - Ô TÔ TRÁNH - XÂY TÒA NHÀ CHO THUÊ.
+ Vị trí đắc địa tuyến phố kinh doanh, nhiều trường đại học, công ty, văn phòng xung quanh.
+ Giao thông thuận tiện khắp ngả: Doãn Kế Thiện, Phạm Văn Đồng, Phạm Hùng, Hồ Tùng Mậu...
+ Hiện trạng nhà 5 tầng và 1 dãy trọ. Khu vực không hết khách thuê nhà.
+ DT: 195 m2.
+ Giá: 20 Tỷ.
+ Pháp lý: sổ đỏ chính chủ, sẵn sàng giao dịch. 
+ Liên hệ: Mr Tuân Để gặp chủ nhà.",20 tỷ,195 m2,"Phố Doãn Kế Thiện, Phường Mai Dịch, Quận Cầu Giấy, Hà Nội",11701421,_,True,Cần bán,7m,True,Nhà mặt tiền,Sổ hồng/ Sổ đỏ,True,10m,5,True,"19,5m",4,---,
https://alonhadat.com.vn/nha-mat-pho-nguyen-hoang-kinh-doanh-sam-uat-dong-tien-70-trieu-55m2x6tx15-ty--11853625.html,"Nhà Mặt Phố Nguyễn Hoàng, Kinh Doanh Sầm Uất, Dòng Tiền 70 Triệu, 55m2x6Tx15 tỷ.","MẶT PHỐ KINH DOANH SẦM UẤT - VỈA HÈ - DÒNG TIỀN 70 TRIỆU/ THÁNG.
+ Vị trí cực đẹp, mặt phố kinh doanh sầm uất. Khu vực nhiều văn phòng, công ty, kinh doanh gì cũng thắng.
+ Giao thông thuận tiện khắp ngả: Đồng Bát, Trần Bình, Nguyễn Hoàng, Mỹ Đình...
+ Nhà thiết kế 6 tầng, Tầng 1 kinh doanh, tổng 13 phòng khép kín, full đồ, đang cho thuê full phòng. 
+ DT: 55 m2.
+ Giá nhỉnh 15 Tỷ.
+ Pháp lý: sổ đỏ chính chủ, sẵn sàng giao dịch. 
+ Liên hệ: Mr Tuân ( Xem nhà miễn phí, tư vấn pháp lý) 
Ngoài ra em còn rất nhiều nhà phố, nhà dòng tiền, BT, BTLK, đất xây văn phòng, đất xây CCMN... đẹp. 
Anh chị gọi ngay cho em sẽ giúp anh chị tìm được sản phẩm phù hợp.",15 tỷ,55 m2,"Đường Nguyễn Hoàng, Phường Mỹ Đình 1, Quận Nam Từ Liêm, Hà Nội",11853625,_,True,Cần bán,20m,True,Nhà mặt tiền,Sổ hồng/ Sổ đỏ,True,4m,6,True,15m,13,---,
https://alonhadat.com.vn/ban-dat-mat-pho-vo-chi-cong-cau-giay-dt-1000m2-gia-300-ty--12396136.html,"BÁN ĐẤT MẶT PHỐ VÕ CHÍ CÔNG, CẦU GIẤY, DT 1000M2, GIÁ 300 TỶ.","MẶT PHỐ LỚN - VỈA HÈ SIÊU RỘNG - MẶT TIỀN KHỦNG - 2 MẶT THOÁNG. 
+ Vị trí đẹp nhất mặt phố Võ Chí Công. Duy nhất đất hiếm còn sót lại mặt phố Võ Chí Công, mặt tiền siêu khủng 30m.
+ Với lợi thế 2 mặt thoáng, mặt tiền rộng. Xây tòa nhà Văn Phòng thì đẳng cấp nhất dãy phố. 
+ Giao thông thuận tiện: Võ Chí Công, Cầu Giấy, Hoàng Quốc Việt, Tây Hồ...
+  DT 1000m2.
+ MT 30m.
+ Giá 310 tỷ. Mua bán chính chủ, không qua trung gian. 
+ Pháp lý: sổ đỏ chính chủ, giao dịch ngay.
+ Lh: Mr Tuân (Để làm việc chính chủ).
(Hình ảnh chỉ mang tính chất minh họa)",310 tỷ,1.000 m2,"Đường Võ Chí Công, Phường Nghĩa Tân, Quận Cầu Giấy, Hà Nội",12396136,_,---,Cần bán,30m,---,"Đất thổ cư, đất ở",Sổ hồng/ Sổ đỏ,---,30m,---,---,---,---,---,
https://alonhadat.com.vn/ban-nha-mat-pho-nguyen-dong-chi-nam-tu-liem-dt-75m2-gia-16-ty--12490170.html,"Bán Nhà Mặt Phố Nguyễn Đổng Chi, Nam Từ Liêm, Dt 75m2, Giá 16 tỷ.","SIÊU HÓT NHÀ MẶT PHỐ - LÔ GÓC - VỈA HÈ - Ô TÔ DỪNG ĐỖ NGÀY ĐÊM - KINH DOANH ĐỈNH
+ Vị trí đắc địa, lô góc, mặt phố kinh doanh sầm uất. Khu vực tập trung nhiều người có dân trí cao. 
+ Thiết kế 5 tầng, tầng 1 cho thuê 2 cửa hàng kinh doanh. 
+ Dãy phố hiếm nhà bán,phù hợp vừa ở vừa kinh doanh hoặc đầu tư giữ tiền. 
+ Giá: 16 Tỷ  Mua bán chính chủ, không qua trung gian. 
+ Pháp lý: sổ đỏ chính chủ, giao dịch ngay.
+ Lh: Mr Tuân  (Để làm việc chính chủ).",16 tỷ,75 m2,"Đường Nguyễn Đổng Chi, Phường Cầu Diễn, Quận Nam Từ Liêm, Hà Nội",12490170,_,True,Cần bán,15m,True,Nhà mặt tiền,Sổ hồng/ Sổ đỏ,True,5m,5,True,---,5,---,
https://alonhadat.com.vn/ban-nha-pho-cau-dien-kd-sam-uat-oto-tranh-dt70m2x11-ty--12318860.html,"BÁN NHÀ PHỐ CẦU DIỄN, KD SẦM UẤT, OTO TRÁNH. DT70M2X11 TỶ.","MẶT CHỢ KINH DOANH, VỈA HÈ, Ô TÔ TRÁNH, KINH DOANH MỌI LOẠI HÌNH.
+ Vị trí đắc địa, mặt chợ Cầu Diễn, Gần chung cư Utral com. Dân cư qua lại đông đúc. 
+ Nhà phù hợp vừa ở vừa kinh doanh hoặc đầu tư giữ tiền và cho thuê hàng tháng. 
+ Giao thông thuận tiện: Cầu Diễn, Phúc Diễn, Hồ Tùng Mậu, Nguyễn Cơ Thạch, Lê Đức Thọ...
+ Nhà thiết kế 4 tầng, chủ tự xây cực kỳ chắc chắn, full công năng sử dụng. 
+  DT 70m2.
+ Pháp lý: sổ đỏ chính chủ, giao dịch ngay.
+ Giá 11 tỷ. Mua bán chính chủ, không qua trung gian. 
+ Lh: Mr Tuân  (Để làm việc chính chủ).",11 tỷ,70 m2,"Đường Cầu Diễn, Phường Cầu Diễn, Quận Nam Từ Liêm, Hà Nội",12318860,_,True,Cần bán,10m,True,Nhà trong hẻm,Sổ hồng/ Sổ đỏ,True,5m,4,True,0m,4,---,
https://alonhadat.com.vn/ban-nha-mat-pho-hoe-thi-7-tang-thang-may-kd-via-he-dt-60m2-gia-13-ty--12258048.html,"BÁN NHÀ MẶT PHỐ HÒE THỊ, 7 TẦNG THANG MÁY, KD, VỈA HÈ. DT 60M2, GIÁ 13 TỶ.","MẶT PHỐ SẦM UẤT - VỈA HÈ ĐÁ BÓNG - 7 TẦNG THANG MÁY.
+ Vị trí đắc địa, mặt phố vỉa hè rộng kinh doanh sầm uất, 2 mặt thoáng trước sau vĩnh viễn.
+ Nhà 7 tầng thang máy, phù hợp vừa ở vừa kinh doanh hoặc làm văn phòng thì quá đẹp.
+ Giao thông thuận tiện các tuyến đường Trịnh Văn Bô, Hòe Thị, Xuân Phương, Cầu Diễn...
+ DT 60m2. 
+ Giá nhỉnh 13 tỷ. Mua bán chính chủ, không qua trung gian. 
+ Pháp lý: Sổ đỏ sẵn sàng giao dịch.
+ Lh: Mr Tuân  (Để làm việc chính chủ).",13 tỷ,60 m2,"Phố Hòe Thị, Phường Phương Canh, Quận Nam Từ Liêm, Hà Nội",12258048,_,True,Cần bán,15m,True,Nhà mặt tiền,Sổ hồng/ Sổ đỏ,True,4m,7,True,15m,6,---,
https://alonhadat.com.vn/ban-nha-mp-pham-than-duat-oto-kd-sam-uat-dt-82m2-x-14-ty--12701434.html,"Bán Nhà MP Phạm Thận Duật, Oto, KD Sầm Uất. DT 82m2 x 14 tỷ.","NHÀ ĐẸP Ở NGAY -  2 MẶT THOÁNG - KINH DOANH SẦM UẤT.
+ Vị trí đắc địa phố Phạm Thận Duật, cư dân đông đúc dân trí cao, hộ khẩu Cầu Giấy.  
+ Giao thông thuận tiện: Mai Dịch, Hồ Tùng Mậu, Doãn Kế Thiện, Trần Vỹ...
+ Xung quanh nhà, tiện ích sống ngập tràn, bãi gửi xe oto, công viên, chợ, trung tâm thương mại... 
+ Nhà thiết kế 4 tầng, 4PN, cửa hàng.  Full công năng sử dụng. 
+ DT 82m2.
+ Pháp lý: sổ đỏ chính chủ, giao dịch ngay.
+ Giá  14 tỷ. Mua bán chính chủ, không qua trung gian. 
+ Lh: Mr Tuân(Chuyên khu vực Cầu Giấy, Từ Liêm).
BẠN CÓ NHU CẦU, TÔI CÓ GIẢI PHÁP.
HÃY GỌI CHO TÔI, TÔI SẼ ĐÁP ỨNG MỌI NHU CẦU CỦA BẠN.",14 tỷ,82 m2,"Đường Phạm Thận Duật, Phường Mai Dịch, Quận Cầu Giấy, Hà Nội",12701434,_,---,Cần bán,15m,---,Nhà mặt tiền,Sổ hồng/ Sổ đỏ,---,5m,4,---,---,4,---,
https://alonhadat.com.vn/ban-gap-dat-xuan-phuong-dh-cong-nghiep-dt-150m2-gia-9-ty--12987394.html,"Bán Gấp Đất Xuân Phương, ĐH Công Nghiệp, OTO Đỗ Cửa, DT 150m2, Giá 9 tỷ.","XÂY TÒA NHÀ CCMN CHO THUÊ - GIÁ TỐT NHẤT KHU VỰC. 
+ Vị trí đắc địa gần phố Xuân Phương, ĐH Công Nghiệp Hà Nội. Xung quanh nhiều trường đại học, nhu cầu thuê nhà cao. 
+ Đường trước nhà rộng rãi, oto vào tận cửa, thửa đất vuông vắn. 
+ Giao thông thuận tiện các tuyến phố Xuân Phương, Trịnh Văn Bô, Cầu Diễn...
+  DT 150m2.
+ Giá  9 tỷ. (CTL)
+ Pháp lý sổ đỏ vuông vắn, giao dịch ngay.
+ Lh: Mr. Tuân  Chuyên khu vực Từ Liêm, Cầu Giấy. 
BẠN CÓ NHU CẦU TÔI CÓ GIẢI PHÁP.
HÃY GỌI CHO TÔI, TÔI SẼ ĐÁP ỨNG MỌI NHU CẦU CỦA BẠN.",9 tỷ,150 m2,"Đường 70, Phường Phương Canh, Quận Nam Từ Liêm, Hà Nội",12987394,_,---,Cần bán,4m,---,"Đất thổ cư, đất ở",Sổ hồng/ Sổ đỏ,---,8m,---,---,17m,---,---,
https://alonhadat.com.vn/ban-gap-dat-me-tri-xay-ccmn-cho-thue-vi-tri-dep-dt-140m2-x-14-ty--12987768.html,"Bán Gấp Đất Mễ Trì, Xây CCMN Cho Thuê, Vị Trí Đẹp. DT 140m2 x 14 tỷ.","DIỆN TÍCH RỘNG - XÂY TÒA NHÀ CCMN CHO THUÊ. 
+ Vị trí đắc địa gần mặt phố, ngõ 14 Mễ Trì Hạ oto tránh đỗ chạy vòng quanh nhà. 
+ Thửa đất vuông vắn, phù hợp xây tòa nhà văn phòng hoặc căn hộ cho thuê, hái ra tiền. 
+ Giao thông thuận tiện các tuyến phố Đồng Me, Đỗ Đức Dục, Mễ Trì, Đại Lô Thăng Long...
+  DT 140m2.
+ Giá  14 tỷ. (CTL)
+ Pháp lý sổ đỏ vuông vắn, giao dịch ngay.
+ Lh: Mr. Tuân Chuyên khu vực Từ Liêm, Cầu Giấy. 
BẠN CÓ NHU CẦU TÔI CÓ GIẢI PHÁP.
HÃY GỌI CHO TÔI, TÔI SẼ ĐÁP ỨNG MỌI NHU CẦU CỦA BẠN.",14 tỷ,140 m2,"Đường Mễ Trì Hạ, Phường Mễ Trì, Quận Nam Từ Liêm, Hà Nội",12987768,_,---,Cần bán,4m,---,"Đất thổ cư, đất ở",Sổ hồng/ Sổ đỏ,---,11m,---,---,---,---,---,
https://alonhadat.com.vn/ban-gap-nha-ho-tung-mau-oto-tranh-via-he-kd-dt-80m2-x-11-ty--13012421.html,"BÁN GẤP NHÀ HỒ TÙNG MẬU, OTO TRÁNH, VỈA HÈ, KD. DT 80M2 X 11 TỶ.","VỈA HÈ Ô TÔ TRÁNH - SÂN TRƯỚC SAU - KHU VỰC TIỀM NĂNG TĂNG GIÁ.
+ Vị trí nhà nằm trong khu nhà ở phân lô vỉa hè, thiết kế hiện tại, tiện ích sống ngập tràn. 
+ Giao thông thuận tiện: Hồ Tùng Mậu, Cầu Diễn, Nguyễn Cơ Thạch, Lê Đức Thọ...
+ Nhà thiết kế 5 tầng, nội thất xịn chủ tặng lại, full công năng sử dụng. 
+ DT 80m2
+ Giá  11 tỷ. (CTL)
+ Pháp lý sổ đỏ vuông vắn, giao dịch ngay.
+ Lh: Mr. Tuân Chuyên khu vực Từ Liêm, Cầu Giấy. 
BẠN CÓ NHU CẦU TÔI CÓ GIẢI PHÁP.
HÃY GỌI CHO TÔI, TÔI SẼ ĐÁP ỨNG MỌI NHU CẦU CỦA BẠN.",11 tỷ,80 m2,"Đường Hồ Tùng Mậu, Phường Phú Diễn, Quận Bắc Từ Liêm, Hà Nội",13012421,_,---,Cần bán,10m,---,Nhà mặt tiền,Sổ hồng/ Sổ đỏ,---,5m,5,---,---,4,---,
https://alonhadat.com.vn/ban-gap-nha-cau-dien-nguyen-xa-dh-cong-nghiep-oto-kd-thang-may-dt-65m2x8-ty-13007886.html,"Bán Gấp Nhà Cầu Diễn, Nguyên Xá, ĐH Công Nghiệp. Oto, KD, Thang máy. DT 65m2x8 tỷ","VIEW HỒ Ô TÔ TRÁNH DỪNG ĐỖ KINH DOANH ĐA DẠNG,  6 TẦNG THANG MÁY.
+ Vị trí cực đẹp, phía trước nhà có sân rộng đỗ được cả chục xe oto. 
+ Khu vực gần cụm công nghiệp Nam Từ Liêm, ĐH Công Nghiệp HN, rất đông sinh viên và người đi làm. 
+ Vị trí đẹp kinh doanh mọi loại hình đều được. 
+ Nhà 6 tầng bao gồm 1 cửa hàng và 8 căn hộ khép kín. 
+ DT 65m2
+ Giá  8 tỷ. (CTL)
+ Pháp lý sổ đỏ vuông vắn, giao dịch ngay.
+ Lh: Mr. Tuân Chuyên khu vực Từ Liêm, Cầu Giấy. 
BẠN CÓ NHU CẦU TÔI CÓ GIẢI PHÁP.
HÃY GỌI CHO TÔI, TÔI SẼ ĐÁP ỨNG MỌI NHU CẦU CỦA BẠN.",8 tỷ,65 m2,"Đường Cầu Diễn, Phường Minh Khai, Quận Bắc Từ Liêm, Hà Nội",13007886,_,---,Cần bán,10m,---,Nhà mặt tiền,Sổ hồng/ Sổ đỏ,---,5m,6,---,---,6,---,
https://alonhadat.com.vn/ban-dat-xuan-phuong-xay-ccmn-tiem-nang-tang-gia-manh-dt-105m2-gia-5-9-ty--12962381.html,"Bán Đất Xuân Phương, Xây CCMN, Tiềm Năng Tăng Giá Mạnh, DT 105m2, Giá 5.9 tỷ.","THỬA ĐẤT VUÔNG A4 - ĐẦU TƯ XÂY CCMN HÁI RA TIỀN - TIỀM NĂNG TĂNG GIÁ. 
+ Vị trí nằm trong khu vực đông dân cư, luôn thiếu phòng cho thuê. 
+ Gần trường FPT, Đh Công Nghiệp, ĐH Thành Đô, Vinsmart City... Giao thông cực kỳ thuận tiện. 
+ Thửa đất vuông vắn, trước sau như 1, đầu tư xây nhà ở hoặc xây CCMN cho thuê đều đẹp. 
+  DT 105m2.
 + Giá  5.9 tỷ. (CTL)
+ Pháp lý sổ đỏ vuông vắn, giao dịch ngay.
+ Lh: Mr. Tuân Chuyên khu vực Từ Liêm, Cầu Giấy. 
BẠN CÓ NHU CẦU TÔI CÓ GIẢI PHÁP.
HÃY GỌI CHO TÔI, TÔI SẼ ĐÁP ỨNG MỌI NHU CẦU CỦA BẠN.","5,9 tỷ",105 m2,"Đường 70, Phường Xuân Phương, Quận Nam Từ Liêm, Hà Nội",12962381,_,---,Cần bán,4m,---,"Đất thổ cư, đất ở",Sổ hồng/ Sổ đỏ,---,8m,---,---,---,---,---,
https://alonhadat.com.vn/hiem-ban-dat-tang-nha-3-tang-ho-tung-mau-cau-giay-dt-65m2-x-11-ty--13077636.html,"Hiếm! Bán Gấp Nhà 3 Tầng, Oto, KD. Hồ Tùng Mậu, Cầu Giấy. DT 65m2 x 11 tỷ.","PHÂN LÔ - Ô TÔ TRÁNH - VỈA HÈ 2 BÊN - KINH DOANH - GIÁ TỐT NHẤT KHU VỰC.
+Vị trí đắc địa nằm gần nhiều trường đại học, khu vực dân trí cao. ĐH Thương Mại, Sân Khấu Điện Ảnh, Sư Phạm, Quốc Gia. 
+ Nhà 3 tầng đã cũ, khách mua về có thể sửa lại để ở hoặc đập đi xây toàn nhà 7 tầng thang máy. 
+ Cùng vị trí phân lô, vỉa hè nhưng giá ở đây đang rẻ hơn nhiều so với khu vực Dương Khuê - Cầu Giấy.
+ DT 65m2.
+ Giá  11 tỷ (Thương lượng chính chủ).
+ Pháp lý: Sổ đỏ chính chủ, sẵn sàng giao dịch.
Ngoài ra em còn rất nhiều nhà đẹp trong khu vực.
Hãy liên hệ vào SĐT em sẽ giúp anh chị tìm được căn nhà phù hợp",11 tỷ,65 m2,"Đường Hồ Tùng Mậu, Phường Mai Dịch, Quận Cầu Giấy, Hà Nội",13077636,_,---,Cần bán,12m,---,Nhà mặt tiền,Sổ hồng/ Sổ đỏ,---,4m,3,---,---,2,---,
https://alonhadat.com.vn/ban-gap-can-ccmn-pho-trinh-van-bo-dong-tien-9-nam-dt-120m2-x-18-ty--13047380.html,Bán Gấp Căn CCMN  Phố Trịnh Văn Bô. Dòng Tiền 9% năm. Dt 120m2 x 18 tỷ.,"CĂN CCMN DÀNH CHO NHỮNG NHÀ ĐẦU TƯ THÔNG THÁI. HIỆU SUẤT 9% / NĂM. 
+ Vị trí đắc địa gần ngã tư Trịnh Văn Bô - Xuân Phương, Oto 7 chỗ đỗ cửa, vào nhà.  
+ Full nội thất xịn từng phòng, người thuê chỉ việc xách vali đến ở. 
+ Nhà thiết kế 7 tầng thang máy, tầng để xe, tổng 30 phòng khép kín, Dòng tiền 120tr/tháng.
+ Lãi xuất kép khi có dòng tiền hàng tháng và giá trị đất tăng gấp bội sau khi đường 70 hoàn thành. 
+ Xung quanh: ĐH Công Nghiệp, ĐH Thành Đô, CĐ FPT, ĐH Đông Á....
+ DT 120m2. 
+ Giá: 18 tỷ. (CTL)
+ Pháp lý: Sổ đỏ chính chủ, giao dịch ngay.
+ Lh: Mr. Tuân Để làm việc chính chủ. 
Ngoài ra em còn rất nhiều căn nhà khác trong khu vực. 
Hãy gọi vào SĐT trên, em sẽ giúp Anh Chị tìm được căn nhà ưng ý.",18 tỷ,120 m2,"Đường Trịnh Văn Bô, Phường Xuân Phương, Quận Nam Từ Liêm, Hà Nội",13047380,_,---,Cần bán,7m,---,"Phòng trọ, nhà trọ",Sổ hồng/ Sổ đỏ,---,10m,7,---,---,30,---,
https://alonhadat.com.vn/giam-2-ty-ban-nha-trinh-van-bo-3-oto-tranh-dt-85m2-gia-nhinh-11-ty--13123598.html,"GIẢM 2 TỶ! Bán Nhà Trịnh Văn Bô, 3 Oto Tránh. Dt 85m2, Giá nhỉnh 11 Tỷ.","TOÀ CHUNG CƯ MINI 12 PHÒNG CHO THUÊ 70/ THÁNG - 8 TẦNG THANG MÁY.
+ Vị trí đắc địa nằm mặt ngõ rộng 3 oto tránh, trước nhà đỗ được 5 oto. 
+ Khu vực tập trung rất nhiều sinh viên CĐ FPT, ĐH Công Nghiệp, ĐH Đông Á...
+ Dọc đường Trịnh Văn Bô đang phát triển từng ngày, tiềm năng tăng giá mạnh mẽ.
+ Gia đình đang cần tiền xử lý công việc nên bán rẻ hơn giá thị trường. Cần bán gấp trong tháng. 
+ Nhà thiết kế 8 tầng, 12 phòng khép kín, full nội thất. Đã cho thuê full phòng. 
+ DT 85m2.
+ Giá  nhỉnh 11 tỷ (Thương lượng chính chủ).
+ Pháp lý: Sổ đỏ chính chủ, sẵn sàng giao dịch.
Ngoài ra em còn rất nhiều nhà đẹp trong khu vực.
Hãy liên hệ vào SĐT em sẽ giúp anh chị tìm được căn nhà phù hợp",11 tỷ,85 m2,"Đường Trịnh Văn Bô, Phường Xuân Phương, Quận Nam Từ Liêm, Hà Nội",13123598,_,---,Cần bán,20m,---,Nhà mặt tiền,Sổ hồng/ Sổ đỏ,---,"4,5m",8,---,---,12,---,
