https://alonhadat.com.vn/ban-dat-mat-pho-tan-thuy-long-bien-110m-x-mat-tien-khung-7m-hang-xom-kdt-the-harmony--13704190.html,"Bán ĐẤT mặt phố Tân Thuỵ, Long Biên 110m x mặt tiền khủng 7m - hàng xóm KĐT the harmony.","MẶT PHỐ TÂN THỤY - NỞ HẬU - LONG BIÊN - VỊ TRÍ TRUNG TÂM - KINH DOANH TỐT.
* Hàng xóm khu đô thị vin the harmony

+ Nhà ngay trên mặt phố Tân Thụy đẹp hàng xóm Vinhomes, ra mặt phố Nguyễn Lam chỉ vài bước chân.
Phù hợp xây ở, xây tòa văn phòng Hoặc xây ccmn... Cho thuê dòng tiền tốt.
- Bãi đậu xe thoải mái đêm ngày, 30m ra sân nhà văn hóa.
- Bán kính 500m, Xung quanh trường chợ, BigC, Aeon, Trường Vinschool.
- Phố Thông 2 đầu , 1 đường Cách mặt phố Nguyễn Lam chưa đến 100m, mặt phố Tân Thụy thông ra đường 5 (Nguyễn Văn Linh), Giao thông thuận tiện vô cùng, gần xe bus

- Pháp lý chuẩn, sổ nở hậu cất két, sẵn sàng giao dịch.
+ Giá chỉ với 12.5 tỷ. ( Còn thương lượng)
* Liên hệ: Mr Chung 085522995NĂM (Chuyên tư vấn nhà đất/Thổ cư khu vực Long Biên) để được hỗ trợ tốt nhất.","12,5 tỷ",110 m2,"Đường Tân Thụy, Phường Phúc Đồng, Quận Long Biên, Hà Nội",13704190,_,True,Cần bán,10m,True,Nhà mặt tiền,Sổ hồng/ Sổ đỏ,True,7m,1,True,---,4,---
