https://alonhadat.com.vn/vi-tri-cuc-hiem-manh-dat-hiem-trung-tam-dong-da-460m2-x-4-tang-6-5m-mat-tien-84-ty--11077788.html,"Vị trí cực hiếm - Mảnh đất hiếm Trung Tâm Đống Đa - 460m2 x 4 tầng, 6.5m mặt tiền - 84 tỷ.","- Mảnh đất hiếm hoi còn sót lại ở trung tâm Q. Đống Đa. Tọa lạc trên Phố Vũ Ngọc Phan nối từ Nguyên Hồng sang Láng Hạ. 
-Khu vực quỹ đất rất ít. Nhà mình bán cách mặt phố đúng 20m , ngõ ô tô tránh, dừng đỗ ngày đêm.

- Với tổng diện tích 460m2, mặt tiền rất lớn 6.5 , nhà trước đây cho bên Trường Mầm Non thuê giá 80 tr/tháng. Sau dịch covid gia chủ muốn bán về định cư với con nên hủy HĐ thuê. Gia chủ là Giảng viên Đại học, đức độ, có hậu rất thiện chí bán.
-Gia chủ mới về tiếp tục vận hành hoặc xây chung cư dòng tiền, building văn phòng hoặc xây Biệt thự để ở đều hợp lý.

- Sổ đỏ chính chủ, đẹp, nét, giao dịch ngay
- Giá 84  tỷ + Thương lượng tốt.
- Tôi, Lê Tài: (Làm việc trực tiếp chủ nhà). 
- Tôi sẵn sàng tư vấn tận tâm và giúp khách hàng mua được giá tốt nhất.",84 tỷ,460 m2,"Phố Vũ Ngọc Phan, Phường Láng Hạ, Quận Đống Đa, Hà Nội",11077788,_,True,Cần bán,16m,True,"Đất thổ cư, đất ở",---,---,7m,4,True,60m,16,---,
https://alonhadat.com.vn/vi-tri-cuc-hiem-nha-pho-trung-tam-q-cau-giay-212m2x2-tang-mat-tien-cuc-lon-8m-72-ty-12100806.html,"Vị trí cực hiếm - Nhà phố trung tâm Q.Cầu Giấy - 212m2x2 Tầng, mặt tiền cực lớn 8m -72 tỷ","- Vị trí đẹp xuất sắc, mặt bằng hiếm hoi còn sót lại ở Quận Cầu Giấy. Nhà thuộc phố Nguyễn Khánh Toàn, lô góc, mặt tiền rất lớn 8m, trước nhà vỉa hè rộng, ô tô dừng đỗ ngày đêm. 
Đường trước nhà là đường 2 chiều vô cùng rộng rãi, giao thông thuận tiện các tuyến phố lớn: Trần Đăn Ninh, Nguyễn Phong Sắc, Cầu Giấy, Quan Hoa, Láng, Bưởi.... vỉa vè siêu rộng kinh doanh mọi mặt hàng tuyệt đỉnh.

- Vị trí trung tâm Cầu Giấy, xung quanh rất nhiều tiện ích từ Giáo Dục ( Nhiều trường từ Tiểu học đến THPT, trường liên cấp, trường quốc tế), Y tế , ẩm thực , giải trí, văn phòng .... Khu vực dân trí cao, an ninh tốt. 
Hiện trạng là nhà 2 tầng, gia chủ đang cho 1 đơn vị nhà hàng thuê, rất đông khách. Gia chủ mới về có thể tiếp tục HĐ thuê hoặc chuyển đổi mục đích ( chủ cũ sẽ hỗ trợ phương án kết thúc HĐ với bên thuê ). Đặc biệt, phương án xây dựng building cho văn phòng vận hành rất hợp lí, dòng tiền rất lớn, GPXD có thể xây 9 tầng, 1 hầm, đã có xác nhận từ  UBND Quận. 

- Sổ đỏ đẹp, nét, nở hậu, pháp lý chuẩn, sẵn sàng giao dịch. 
- Gía 72 tỷ + có thương lượng.
- Tôi, Lê Tài (Làm việc trực tiếp chủ nhà). 
- Tôi sẵn sàng tư vấn tận tâm và giúp khách hàng mua được giá tốt nhất.",72 tỷ,212 m2,"Đường Nguyễn Khánh Toàn, Phường Dịch Vọng Hậu, Quận Cầu Giấy, Hà Nội",12100806,_,True,Cần bán,16m,True,Nhà mặt tiền,Sổ hồng/ Sổ đỏ,True,8m,2,True,"26,5m",3,---,
https://alonhadat.com.vn/vi-tri-cuc-dinh-nha-mat-pho-q-cau-giay-127m2x4tang-6m-mat-tien-62-ty-12100555.html,"Vị trí cực đỉnh - Nhà mặt phố Q.Cầu Giấy -127m2x4T, Mặt tiền 6m, kinh doanh sàm uất- 62 tỷ","- Vị trí nhà đẹp vô cùng xuất sắc, trung tâm Quận Cầu Giấy, thuộc phố Vũ Phạm Hàm, mặt phố kinh doanh vô cùng nhộn nhịp, sầm uất. 

- Mặt phố chính rộng 30m, hè rộng 5m, ô tô đỗ dừng thoải mái, giao thông tấp nập, kinh doanh sầm uất đa dạng các loại mặt hàng.. Giao thông vô cùng thuận tiện, thông các tuyến phố lớn: Trung Kính, Trần Duy Hưng, Láng, Nguyễn Chính, Dương Đình Nghệ.... khu phố tập trung nhiều văn phòng, cơ quan lớn, khách nước ngoài sinh sống và làm việc. 

- Nhà thiết kế và xây dựng vô cùng tâm huyết, quy mô 4 tầng mặt tiền rộng 6m,tiền thân gia chủ định cư đây nên thiết kế cơ bản là một Biệt thự phân lô, mặt phố. Mặt sàn 2 phòng lớn, cầu thang giữa phục vụ cho văn phòng hay ở đều phù hợp, điều hòa âm trần, VS ToTo loại 1. Chủ nhà để lại toàn bộ nội thất cho khách thiện chí.
- Hiện tại đang cho 1 đơn vị spa có tiếng thuê, rất rất đông khách, dòng tiền ổn định ( Gia chủ có thể nối tiếp HĐ thuê hoặc cắt HĐ ).

- Sổ đỏ vuông vắn , đẹp nét, pháp lý chuẩn rõ ràng, sẵn sàng giao dịch.
- Giá 62tỷ - Thương lượng tốt.
- Liên hệ tôi, Lê Tài:Tư vấn tận tâm và giúp khách hàng mua được giá tốt nhất.",62 tỷ,127 m2,"Đường Vũ Phạm Hàm, Phường Trung Hòa, Quận Cầu Giấy, Hà Nội",12100555,_,True,Cần bán,30m,True,Nhà mặt tiền,Sổ hồng/ Sổ đỏ,True,6m,4,True,"21,16m",6,---,
