https://alonhadat.com.vn/603-lac-long-quan-tay-ho-canh-toa-lien-co-oto-tranh-kinh-doanh-van-phong-115m-mt-6m-28-ty-13214467.html,603 LẠC LONG QUÂN TÂY HỒ CẠNH TÒA LIÊN CƠ OTO TRÁNH KINH DOANH VĂN PHÒNG 115M MT 6M 28 TỶ,"+ Người quen gửi bán căn nhà ngõ 603 phố Lạc Long Quân, quận Tây hồ.
+ Diện tích 115m, mặt tiền 6m, chủ xây tâm huyết 6 tầng long lanh, sẵn ô chờ thang máy, thiết kế các phòng đều tối ưu cửa sổ lớn, thoáng sáng, đón ánh sáng tự nhiên.
+ Nhà mới đẹp, 2 thoáng trước sau, ngõ thông đường 8m vỉa hè oto tránh, phù hợp khách mua để ở và kinh doanh hay cho thuê văn phòng cực lý tưởng.
+ Khẳng định nhà đẹp nhất ngõ, ngõ to đẹp nhất phố thông thẳng sang Võ Chí Công, ngay cạnh tòa nhà Liên Cơ 7 ban ngành, 200m ra quảng trường 2 con rồng, rảo bước hồ Tây lộng gió, quần thể trung tâm thương mại Lotte Tây Hồ lớn nhất Đông Nam Á, tiện ích bạt ngàn.
+ Giao thông thuận tiện kết nối các tuyến phố lớn như Võ Chí Công, Lạc Long Quân, Trịnh Công Sơn, Nguyễn Hoàng Tôn, Nhật Chiêu, Xuân La.
+ Sổ đỏ chính chủ, vuông vắn, pháp lý rõ ràng, sẵn sàng giao dịch.
+ Giá tốt nhất thị trường: 28 Tỷ (thương lượng thiện chí)
+ Vui lòng gọi trực tiếp Phạm Hân để xem nhà.
+ Trân trọng cảm ơn!",28 tỷ,115 m2,"Đường Lạc Long Quân, Phường Nhật Tân, Quận Tây Hồ, Hà Nội",13214467,_,True,Cần bán,8m,True,Nhà trong hẻm,Sổ hồng/ Sổ đỏ,True,6m,6,True,---,4,---
https://alonhadat.com.vn/phan-lo-nguyen-van-huyen-cau-giay-duong-8m-he-2m-gara-van-phong-85m-mt-5-8m-21-5-ty-13214432.html,PHÂN LÔ NGUYỄN VĂN HUYÊN CẦU GIẤY ĐƯỜNG 8M HÈ 2M GARA VĂN PHÒNG 85M MT 5.8M 20 TỶ,"+ Người quen gửi bán nhà phân lô phố Nguyễn Văn Huyên, quận Cầu Giấy.
+ Diện tích 85m, mặt tiền 5.8m, chủ xây tâm huyết 5 tầng long lanh, chắc chắn, sẵn ô chờ thang máy, các phòng đều cực kỳ sáng thoáng, đón ánh sáng tự nhiên.
+ Nhà mới đẹp, đường rộng 8m, vỉa hè 2m oto tránh và dừng đỗ ngày đêm, nhà có gara oto để được 2 oto, view trường học thoáng vĩnh viễn, nội thất sàn gỗ cực đẹp.
+ Nhà thuộc ngõ đẹp nhất phố, ngõ to như phố, nằm ngay ngã 3 Nguyễn Văn Huyên – Cầu Giấy, gần công viên Nghĩa Đô. 
+ Giao thông thuận tiện kết nối các tuyến phố lớn như Cầu Giấy, Nguyễn Khánh Toàn, Trương Công Giai, Trần Đăng Ninh.
+ Sổ đỏ chính chủ, vuông vắn, pháp lý rõ ràng, sẵn sàng giao dịch.
+ Giá tốt nhất thị trường: 20 Tỷ (thương lượng thiện chí)
+ Vui lòng gọi trực tiếp Phạm Hân để xem nhà.
+ Trân trọng cảm ơn!",20 tỷ,85 m2,"Đường Nguyễn Văn Huyên, Phường Quan Hoa, Quận Cầu Giấy, Hà Nội",13214432,_,True,Cần bán,8m,True,Nhà trong hẻm,Sổ hồng/ Sổ đỏ,True,"5,8m",5,True,---,4,---
https://alonhadat.com.vn/ban-nha-pho-van-cao-ba-dinh-14-5-ty-62m-mat-tien-4-2m-oto-tranh-2-thoang-via-he-kinh-doanh-13230720.html,BÁN NHÀ PHỐ VĂN CAO BA ĐÌNH 14.5 TỶ 62M MẶT TIỀN 4.2M OTO TRÁNH 2 THOÁNG VỈA HÈ KINH DOANH,"+ Diện tích 62m, mặt tiền 4.2m. Chủ xây tâm huyết 4 tầng long lanh, thiết kế các phòng đều sáng thoáng đón ánh sáng tự nhiên.
+ Nhà mới đẹp, 2 thoáng trước sau, ngõ thông rông, oto tránh dừng đỗ, kinh doanh văn phòng.
+ 50m ra mặt phố, gần Đại sứ quán Nhật, Quận uỷ Ba Đình, vài phút ra Hồ Tây, lên lăng Bác, hàng xóm Lotte, xung quanh toàn quan chức dân trí cao, an sinh tiện ích bạt ngàn.
+ Giao thông thuận tiện kết nối các tuyến phố sầm uất như Liễu Giai, Trích Sài, Linh Lang, Đào Tấn, Nguyễn Đình Thi, Hoàng Hoa Thám.
+ Sổ đỏ chính chủ, vuông vắn, pháp lý rõ ràng, sẵn sàng giao dịch.
+ Giá tốt nhất thị trường nhỉnh 14.5 tỷ (Chủ thiện chí, thương lượng tốt)
+ Vui lòng gọi trực tiếp Mr. Phạm Hân để xem nhà.","14,5 tỷ",62 m2,"Phố Văn Cao, Phường Liễu Giai, Quận Ba Đình, Hà Nội",13230720,_,True,Cần bán,6m,True,Nhà trong hẻm,Sổ hồng/ Sổ đỏ,True,62m,4,True,---,4,---
