url,title,description,price,area,address,Mã tin,Hướng,Phòng ăn,Loại tin,Đường trước nhà,Nhà bếp,Loại BDS,Pháp lý,Sân thượng,Chiều ngang,Số lầu,Chổ để xe hơi,Chiều dài,Số phòng ngủ,Chính chủ
https://alonhadat.com.vn/ban-dat-xuan-la-ngoai-giao-doan-duong-8m-he-3m-2-mat-ngo-kinh-doanh-130m-mt-5-5m-24-ty-13274385.html,BÁN ĐẤT XUÂN LA NGOẠI GIAO ĐOÀN ĐƯỜNG 8M HÈ 3M 2 MẶT NGÕ KINH DOANH 130M MT 5.5M 24 TỶ,"+ Người quen gửi bán lô đất Xuân La, gần Ngoại Giao Đoàn, quận Tây Hồ.
+ Diện tích 130m, mặt tiền 5.5m, thửa đất vuông đẹp, đường nhựa trước nhà 8m oto tránh dừng đỗ ngày đêm. Phù hợp khách mua xây tòa nhà 8 tầng lộng lẫy để ở & kinh doanh mọi loại hình.
+ Nằm trong khu quy hoạch đô thị, đường phố cây xanh thoáng mát, vỉa hè rộng, tập trung nhiều văn phòng công sở, trường học, các hàng quán kinh doanh tấp nập. Xung quanh là khu đô thị Tây Hồ Tây, Ngoại Giao Đoàn, đại sứ quán Hàn Quốc, 500m là hồ Tây lộng gió.
+ Giao thông thuận tiện đi sân bay Nội Bài, kết nối các tuyến phố lớn như Lạc Long Quân, Võ Chí Công, Xuân Đỉnh, Trích Sài, Vệ Hồ.
+ Sổ đỏ chính chủ, vuông vắn, pháp lý rõ ràng, sẵn sàng giao dịch.
+ Giá tốt nhất thị trường: 24 Tỷ (Chủ gấp, thương lượng cực thiện chí)
+ Vui lòng liên hệ Phạm Hân để xem nhà.
+ Trân trọng cảm ơn!",24 tỷ,130 m2,"Đường Xuân La, Phường Xuân La, Quận Tây Hồ, Hà Nội",13274385,_,---,Cần bán,8m,---,"Đất thổ cư, đất ở",Sổ hồng/ Sổ đỏ,---,"5,5m",---,True,---,---,---
https://alonhadat.com.vn/ban-dat-lieu-giai-ba-dinh-gan-quan-uy-oto-tranh-ngo-thong-sat-pho-120m-mt-6-2m-24-5-ty-13279432.html,Bán Đất Liễu Giai Ba Đình Gần Quận Ủy Oto Tránh Ngõ Thông Sát Phố 120m Mt 6.2m 24.5 Tỷ,"+ Người quen gửi bán lô đất phố Liễu Giai, quận Ba Đình.
+ Diện tích 120 m, mặt tiền 6.2m, thửa đất phân lô vuông đẹp.
+ 30m ra mặt phố, đường nhựa trước nhà oto tránh dừng đỗ, phù hợp khách mua xây tòa nhà 8 tầng lộng lẫy vừa ở & vừa cho thuê căn hộ hay văn phòng.                                              
+ Khu vực nhiều nước nước ngoài sinh sống và làm việc, gần Đại sứ quán Nhật, quận uỷ Ba Đình, Lotte Đào Tấn, vài phút ra Hồ Tây, lên lăng Bác, xung quanh toàn quan chức dân trí cực cao, an sinh tiện ích bạt ngàn.
+ Giao thông kết nối các tuyến phố sầm uất như Văn Cao, Đội Cấn, Kim Mã, Đào Tấn, Linh Lang, Trích Sài, Võ Chí Công thẳng tiến cầu Nhật Tân ra sân bay Nội Bài.
+ An ninh tuyệt đối, hàng xóm thân thiện, phong thủy cực kỳ vượng.
+ Sổ đỏ chính chủ, vuông vắn, pháp lý rõ ràng, sẵn sàng giao dịch.
+ Giá tốt nhất thị trường: 24.5 Tỷ (Thương lượng thiện chí)
+ Vui lòng gọi trực tiếp Mr. Phạm Hân để xem nhà.","24,5 tỷ",120 m2,"Phố Liễu Giai, Phường Liễu Giai, Quận Ba Đình, Hà Nội",13279432,_,---,Cần bán,8m,---,"Đất thổ cư, đất ở",Sổ hồng/ Sổ đỏ,---,"6,2m",---,True,---,---,---
https://alonhadat.com.vn/phan-lo-tran-quoc-hoan-cau-giay-oto-ngo-thong-via-he-o-cho-thang-may-55m-mt-5-6m-12-8-ty-13279412.html,PHÂN LÔ TRẦN QUỐC HOÀN CẦU GIẤY OTO NGÕ THÔNG VỈA HÈ Ô CHỜ THANG MÁY 55M MT 5.6M 12.8 TỶ,"+ Người quen gửi bán nhà đẹp phân lô phố Trần Quốc Hoàn, quận Cầu Giấy.
+ Diện tích 55m, mặt tiền 5m, gia chủ xây tâm huyết 5 tầng long lanh, chắc chắn, sẵn ô chờ thang máy, nội thất sang xịn, ngõ thông rộng, oto dừng đỗ ngày đêm, khu phân lô văn phòng tuyệt đẹp.
+ Trung tâm kinh tế quận Cầu Giấy, gần các trường đại học lớn như Sư Phạm, Quốc Gia, Ngoại Ngữ, Điện Lực, Thương Mại, các văn phòng cơ quan công sở, trung tâm thương mại tài chính, chợ dân sinh, hàng quán kinh doanh tấp nập.
+ Giao thông thuận tiện kết nối các tuyến phố sầm uất như Cầu Giấy, Hoàng Quốc Việt, Phạm Tuấn Tài, Đặng Thùy Trâm, Xuân Thủy.
+ An ninh tuyệt đối, hàng xóm thân thiện, phong thủy cực vượng.
+ Sổ đỏ chính chủ, vuông đẹp, pháp lý rõ ràng, sẵn sàng giao dịch.
+ Giá tốt nhất thị trường: 12.8 tỷ (thương lượng cực thiện chí)
+ Vui lòng gọi Phạm Hân để xem nhà trực tiếp.
+ Trân trọng cảm ơn!","12,8 tỷ",55 m2,"Phố Trần Quốc Hoàn, Phường Dịch Vọng Hậu, Quận Cầu Giấy, Hà Nội",13279412,_,True,Cần bán,8m,True,Nhà trong hẻm,Sổ hồng/ Sổ đỏ,True,"5,6m",5,True,---,4,---
https://alonhadat.com.vn/phan-lo-hoang-quoc-viet-cau-giay-ngo-thong-rong-sat-pho-oto-vao-nha-50m-mat-tien-4m-9-2ty-13280408.html,PHÂN LÔ HOÀNG QUỐC VIỆT CẦU GIẤY GARA OTO NGÕ THÔNG SÁT PHỐ 50m MẶT TIỀN 4m 9.2 Tỷ,"+ Người quen gửi bán căn nhà phân lô phố Hoàng Quốc Việt, quận Cầu Giấy.
+ Diện tích 50m, mặt tiền 4m, chủ xây tâm huyết 5 tầng long lanh, các phòng đều cực kỳ sáng thoáng đón ánh sáng tự nhiên, móng và khung cột chắc chắn, có thể lên thêm 2, 3 tầng nữa. 
+ Nhà thuộc khu phân lô cán bộ cấp cao, oto tránh chạy vòng quanh, gần các trường đại học lớn như Điện Lực, Sư Phạm, Ngoại Ngữ, Quốc Gia, Thương Mại, Du Lịch, 200m ra tới hồ điều hòa công viên cây xanh An Bình, tương lai sau quy hoạch nhà sát đường 8 làn xe, giá trị và tiện ích tăng nhiều.
+ Giao thông kết nối các tuyến phố lớn như Phạm Văn Đồng, Phạm Tuấn Tài, Nguyễn Phong Sắc, Nghĩa Đô, Nghĩa Tân.
+ Sổ đỏ chính chủ, pháp lý rõ ràng, sẵn sàng giao dịch.
+ Giá tốt nhất thị trường: 9.2 tỷ (thương lượng thiện chí)
+ Vui lòng liên hệ Phạm Hân để xem nhà.
+ Trân trọng cảm ơn!","9,2 tỷ",50 m2,"Đường Hoàng Quốc Việt, Phường Nghĩa Đô, Quận Cầu Giấy, Hà Nội",13280408,_,True,Cần bán,6m,True,Nhà trong hẻm,Sổ hồng/ Sổ đỏ,True,4m,5,True,---,4,---
https://alonhadat.com.vn/phan-lo-152-vo-chi-cong-tay-ho-oto-tranh-via-he-view-vuon-hoa-cay-xanh-70m-mt-6-9m-16-9-ty-13264921.html,Phân Lô 152 Võ Chí Công Tây Hồ Oto Tránh Vỉa Hè View Vườn Hoa Cây Xanh 70m Mt 6.9m 16.9 Tỷ,"+ Người quen gửi bán căn nhà tại ngõ 152 Võ Chí Công, quận Tây Hồ.
+ Diện tích 70m, mặt tiền 6.9m, chủ xây tâm huyết 5 tầng long lanh, chắc chắn, các phòng đều cực kỳ thoáng sáng đón ánh sáng tự nhiên.
+ Căn nhà phân lô mới đẹp, đường oto tránh, vỉa hè, trước nhà view vườn hoa, cây xanh rợp bóng, không gian sống lý tưởng.
+ Giao thông thuận tiện đi các tuyến phố sầm uất như Lạc Long Quân, Hoàng Quốc Việt, Trích Sài, Xuân La, Xuân Đỉnh, khu Ngoại Giao Đoàn.
+ An ninh tuyệt đối, hàng xóm thân thiện, phong thủy cực kỳ vượng.
+ Sổ đỏ chính chủ, vuông vắn, pháp lý rõ ràng, sẵn sàng giao dịch.
+ Giá tốt nhất thị trường 16.9 Tỷ (Chủ thiện chí, thương lượng tốt).	
+ Liên hệ Mr. Phạm Hân để xem nhà.
+ Trân trọng cảm ơn!","16,9 tỷ",70 m2,"Đường Võ Chí Công, Phường Xuân La, Quận Tây Hồ, Hà Nội",13264921,_,True,Cần bán,8m,True,Nhà trong hẻm,Sổ hồng/ Sổ đỏ,True,"6,9m",5,True,---,4,---
https://alonhadat.com.vn/phan-lo-nguyen-khanh-toan-gan-cv-nghia-do-duong-nhua-8m-via-he-3m-70m-mat-tien-5m-13-8-ty-13265027.html,PHÂN LÔ NGUYỄN KHÁNH TOÀN GẦN CV NGHĨA ĐÔ ĐƯỜNG NHỰA 8m VỈA HÈ 3m 70m MẶT TIỀN 5m 13.8 Tỷ,"+ Người quen gửi bán căn nhà phân lô phố Nguyễn Khánh Toàn, quận Cầu Giấy.
+ Diện tích 70 m, mặt tiền 5m, chủ xây tâm huyết 5 tầng long lanh, chắc chắn, các phòng đều cực kỳ thoáng sáng.
+ Nhà đẹp khu phân lô cán bộ, đường trải nhựa, vỉa hè, cây xanh rợp bóng mát. Tương lai sau quy hoạch nhà ra mặt đường lớn, xung quanh công viên vườn hoa, giá trị tăng cao gấp nhiều.
+ Vị trí: Trung tâm kinh tế quận Cầu Giấy, giáp ranh giữa các quận Ba Đình, Từ Liêm, Cầu Giấy, gần công viên Nghĩa Đô, các trường đại học, trường liên cấp lớn, các cơ quan công sở quận, an ninh tuyệt đối, tiện ích vô vàn.
+ Giao thông thuận lợi các tuyến đường lớn: Nguyễn Văn Huyên, Hoàng Quốc Việt, Cầu Giấy, Quan Hoa, Nguyễn Đình Hoàn.
+ Sổ đỏ chính chủ, vuông vắn, pháp lý rõ ràng, sẵn sàng giao dịch.
+ Giá tốt nhất thị trường: 13.8 tỷ (Thương lượng thiện chí).
+ Liên hệ Phạm Hân để xem nhà.
+ Trân trọng cảm ơn","13,8 tỷ",70 m2,"Đường Nguyễn Khánh Toàn, Phường Quan Hoa, Quận Cầu Giấy, Hà Nội",13265027,_,True,Cần bán,8m,True,Nhà trong hẻm,Sổ hồng/ Sổ đỏ,True,5m,5,True,---,6,---
https://alonhadat.com.vn/ban-dat-lo-goc-cau-dien-gan-dh-cong-nghiep-110m-mt-6-5m-8-4-ty-oto-tranh-canh-ho-dieu-hoa-13264990.html,BÁN ĐẤT LÔ GÓC CẦU DIỄN GẦN ĐH CÔNG NGHIỆP 110m MT 6.5m 8.4 TỶ OTO TRÁNH CẠNH HỒ ĐIỀU HÒA,"+ Người quen gửi bán lô đất tại Cầu Diễn, quận Bắc Từ Liêm.
+ Diện tích 110m², mặt tiền 6.3m, thửa đất vuông đẹp.
+ Mảnh đất lô góc cực đẹp, ngõ thông rộng, đường nhựa oto tránh, ngay cạnh hồ điều hòa cực thoáng mát, 100m ra mặt phố, 500m rảo bộ đến Đại học Công Nghiệp với hơn 30.000 sinh viên, phù hợp khách mua xây tòa căn hộ vừa ở vừa cho thuê.
+ Giao thông thuận tiện đi các tuyến phố sầm uất như Hồ Tùng Mậu, Nguyên Xá, Nhổn, Xuân Phương, Tu Hoàng, Phú Diễn.
+ An ninh tuyệt đối, hàng xóm thân thiện, phong thủy cực kỳ vượng.
+ Sổ đỏ chính chủ, vuông vắn, pháp lý rõ ràng, sẵn sàng giao dịch.
+ Giá tốt nhất thị trường 8.4 Tỷ (Chủ thiện chí, thương lượng tốt).
+ Liên hệ Mr. Phạm Hân để xem nhà.
+ Trân trọng cảm ơn!","8,4 tỷ",110 m2,"Đường Cầu Diễn, Phường Phúc Diễn, Quận Bắc Từ Liêm, Hà Nội",13264990,_,---,Cần bán,6m,---,"Đất thổ cư, đất ở",Sổ hồng/ Sổ đỏ,---,"6,3m",---,---,---,---,---
https://alonhadat.com.vn/phan-lo-lac-long-quan-tay-ho-oto-ngo-thong-sat-pho-85m-mat-tien-6-6m-4-tang-12-6-ty-13265106.html,PHÂN LÔ LẠC LONG QUÂN TÂY HỒ OTO NGÕ THÔNG SÁT PHỐ 85M MẶT TIỀN 6.6M 4 TẦNG 12.6 TỶ,"+ Người quen gửi bán căn nhà phố Lạc Long Quân, quận Tây Hồ.
+ Diện tích 85m, mặt tiền 6.6m, chủ xây tâm huyết 4 tầng, móng và khung cột chắc chắn, thiết kế các phòng đều thoáng sáng, phù hợp khách mua để ở hoặc xây tòa căn hộ cho thuê.
+ Nhà phân lô, ngõ thông rộng oto vào nhà, 50m ra oto tránh, 500m ra hồ Tây lộng gió, xung quanh tiện ích bạt ngàn.
+ Giao thông thuận tiện kết nối các tuyến phố lớn như Trích Sài, Võng Thị, Thụy Khuê, Hoàng Hoa Thám, Võ Chí Công thẳng tiến cầu Nhật Tân ra sân bay Nội Bài.
+ Sổ đỏ chính chủ, vuông vắn, pháp lý rõ ràng, sẵn sàng giao dịch.
+ Giá tốt nhất thị trường: 12.6 Tỷ (thương lượng thiện chí)
+ Vui lòng gọi trực tiếp Phạm Hân để xem nhà.
+ Trân trọng cảm ơn!","12,6 tỷ",85 m2,"Đường Lạc Long Quân, Phường Bưởi, Quận Tây Hồ, Hà Nội",13265106,_,True,Cần bán,5m,True,Nhà trong hẻm,Sổ hồng/ Sổ đỏ,True,"6,6m",4,True,---,4,---
https://alonhadat.com.vn/phan-lo-tran-kim-xuyen-cau-giay-gan-vuon-hoa-oto-tranh-ngo-thong-75m-mat-tien-4-5m-15-5-ty-13264806.html,PHÂN LÔ TRẦN KIM XUYẾN CẦU GIẤY GẦN VƯỜN HOA OTO TRÁNH NGÕ THÔNG 75m MẶT TIỀN 4.5m 15.5 TỶ,"+ Người quen gửi bán căn nhà phân lô phố Trần Kim Xuyến, quận Cầu Giấy.
+ Diện tích 75m, mặt tiền 4.5m, chủ xây 4 tầng long lanh, móng và khung cột chắc chắn có thể lên thêm 2, 3 tầng, lắp thang máy, nhà có khe thoáng giếng trời phía sau, các phòng đều sáng thoáng đón ánh sáng tự nhiên.
+ Nhà xây mới đẹp, đường oto tránh, oto vào nhà, ngõ thẳng thông thoáng kinh doanh & văn phòng, 100m ra vườn hoa Trần Kim Xuyến, hàng xóm khu đô thị Trung Yên, hưởng trọn tiện ích.
+ Vị trí nhà đẹp nằm trung tâm quận Cầu Giấy, giao thông thuận lợi đi Cầu Giấy, Đường Láng, Yên Hòa, Trần Thái Tông, Kim Mã, xung quanh tiện ích vô vàn, gần các trường đại học lớn, khu vực tập trung nhiều tòa nhà văn phòng, cơ quan công sở, hồ điều hòa.
+ Sổ đỏ chính chủ, vuông vắn, pháp lý rõ ràng.
+ Giá tốt nhất thị trường: 15.5 tỷ (thương lượng thiện chí)
+ Liên hệ Phạm Hân để xem nhà.
+ Trân trọng cảm ơn!","15,5 tỷ",75 m2,"Đường Trần Kim Xuyến, Phường Trung Hòa, Quận Cầu Giấy, Hà Nội",13264806,_,True,Cần bán,6m,True,Nhà trong hẻm,Sổ hồng/ Sổ đỏ,True,"4,5m",4,True,---,4,---
https://alonhadat.com.vn/phan-lo-nghia-do-cau-giay-duong-8m-he-3m-kinh-doanh-van-phong-45m-mat-tien-4-5m-11-5-ty-13264855.html,PHÂN LÔ NGHĨA ĐÔ CẦU GIẤY ĐƯỜNG 8M HÈ 3M KINH DOANH VĂN PHÒNG 45m MẶT TIỀN 4.5m 11.5 Tỷ,"+ Chính chủ gửi bán căn nhà phân lô phố Nghĩa Đô, KĐT mới Nghĩa Đô, quận Cầu Giấy.
+ Diện tích 45m, mặt tiền 4.5m, chủ xây cực tâm huyết 4 tầng thông sàn, móng và khung cột chắc chắn, thiết kế các phòng đều cực kỳ sáng thoáng, khách mua có thể lên thêm tầng lắp thang máy.
+ Trước nhà đường 3 oto tránh dừng đỗ ngày đêm, vỉa hè cây xanh rợp bóng mát, nằm ngay cạnh là trường tiểu học Nghĩa Đô, hàng xóm KĐT Starlake, KĐT Nghĩa Đô mới, khu vực kinh doanh cực kỳ sầm uất mọi loại hình.
+ Giao thông thuận tiện kết nối các tuyến phố Hoàng Quốc Việt, Nguyễn Văn Huyên, Cầu Giấy, Nghĩa Tân, Phạm Tuấn Tài, Nguyễn Phong Sắc, Trần Quốc Hoàn, thẳng tiến ra cầu Nhật Tân đi sân bay Nội Bài.
+ Sổ đỏ chính chủ, vuông vắn, pháp lý rõ ràng, sẵn sàng giao dịch.
+ Giá tốt nhất thị trường: 11.5 Tỷ (thương lượng thiện chí)
+ Vui lòng liên hệ Phạm Hân để xem nhà.
+ Trân trọng cảm ơn!","11,5 tỷ",45 m2,"Phố Nghĩa Đô, Phường Nghĩa Đô, Quận Cầu Giấy, Hà Nội",13264855,_,True,Cần bán,8m,True,Nhà trong hẻm,Sổ hồng/ Sổ đỏ,True,"4,5m",4,True,---,4,---
https://alonhadat.com.vn/ban-dat-lac-long-quan-tay-ho-oto-ngo-thong-rong-sat-pho-65m-mat-tien-5m-9-5-ty-13265166.html,BÁN ĐẤT LẠC LONG QUÂN TÂY HỒ OTO NGÕ THÔNG RỘNG SÁT PHỐ 65M MẶT TIỀN 5M 9.5 TỶ,"+ Người quen gửi bán lô đất phố Lạc Long Quân, quận Tây Hồ.
+ Diện tích 65m, mặt tiền 5m, thửa đất vuông đẹp. 
+ 50m ra mặt phố, 500m ra hồ Tây lộng gió, ngõ thông rộng oto qua nhà, phù hợp khách mua xây tòa nhà để ở & cho thuê căn hộ, khu vực tập trung đông đảo khách nước ngoài và người đi làm, nhu cầu thuê nhà luôn rất cao.
+ Giao thông thuận tiện kết nối các tuyến phố lớn như Trích Sài, Võng Thị, Vệ Hồ, Xuân La, Võ Chí Công thẳng tiến cầu Nhật Tân ra sân bay Nội Bài.
+ Sổ đỏ chính chủ, vuông vắn, pháp lý rõ ràng, sẵn sàng giao dịch.
+ Giá tốt nhất thị trường: 9.5 Tỷ (thương lượng thiện chí)
+ Vui lòng gọi trực tiếp Phạm Hân để xem nhà.
+ Trân trọng cảm ơn!","9,5 tỷ",65 m2,"Đường Lạc Long Quân, Phường Xuân La, Quận Tây Hồ, Hà Nội",13265166,_,True,Cần bán,5m,True,"Đất thổ cư, đất ở",Sổ hồng/ Sổ đỏ,True,5m,---,True,---,---,---
https://alonhadat.com.vn/ban-dat-xuan-dinh-ngoai-giao-doan-95m-mat-tien-4-8m-9-ty-ngo-thong-oto-tranh-13175643.html,BÁN ĐẤT XUÂN ĐỈNH NGOẠI GIAO ĐOÀN 95M MẶT TIỀN 4.8M 9 TỶ NGÕ THÔNG OTO TRÁNH,"+ Người quen gửi bán lô đất tại Xuân Đỉnh, quận Bắc Từ Liêm.
+ Diện tích 95m, mặt tiền 4.8m. thửa đất vuông đẹp, phù hợp khách mua xây tòa nhà 8 tầng lộng lẫy vừa ở & vừa cho thuê căn hộ.
+ Ngõ thông oto tránh dừng đỗ, 50m ra mặt phố, ba bước chân ra tới hồ điều hòa sân vui chơi, gần trường học kinh doanh cực kỳ sầm uất, hàng xóm khu Ngoại Giao Đoàn, đại sứ quán Hàn Quốc, Kosmo Xuân La.
+ Mảnh đất nằm ngay ngã 3 Xuân Đỉnh – Xuân La – Ngoại Giao Đoàn, giao thông thuận tiện đi sân bay Nội Bài, kết nối các tuyến phố lớn như Võ Chí Công, Xuân La, Nguyễn Xuân Khoát, Phạm Văn Đồng, Đỗ Nhuận.
+ Sổ đỏ chính chủ, vuông vắn, pháp lý rõ ràng, sẵn sàng giao dịch.
+ Giá tốt nhất thị trường: 9 Tỷ (thương lượng cực thiện chí)
+ Vui lòng liên hệ Phạm Hân để xem nhà.
+ Trân trọng cảm ơn!",9 tỷ,95 m2,"Đường Xuân Đỉnh, Phường Xuân Đỉnh, Quận Bắc Từ Liêm, Hà Nội",13175643,_,True,Cần bán,6m,True,"Đất thổ cư, đất ở",Sổ hồng/ Sổ đỏ,True,"4,8m",---,True,---,---,---
https://alonhadat.com.vn/ban-dat-vong-thi-tay-ho-85m-mat-tien-5-3m-10-8-ty-2-thoang-oto-ngo-thong-sat-pho-gan-ho-13174680.html,BÁN ĐẤT VÕNG THỊ TÂY HỒ 85M MẶT TIỀN 5.3M 10.8 TỶ 2 THOÁNG OTO NGÕ THÔNG SÁT PHỐ GẦN HỒ,"+ Người quen gửi bán lô đất phân lô phố Võng Thị, quận Tây Hồ.
+ Diện tích 85m, mặt tiền 5.3m, thửa đất vuông vắn, phù hợp khách mua xây tòa nhà 8 tầng lộng lẫy, vừa ở & vừa cho thuê căn hộ.
+ Mảnh đất đẹp nhất phố Võng Thị còn sót lại, 2 mặt thoáng trước sau, ngõ thông rộng, 50m ra mặt phố, 300m rảo bước hồ Tây lộng gió.
+ Giao thông thuận tiện đi sân bay Nội Bài, kết nối các tuyến phố lớn như Võ Chí Công, Trích Sài, Xuân La, Võng Thị, Thụy Khuê, Lạc Long Quân
+ Sổ đỏ chính chủ, vuông vắn, pháp lý rõ ràng, sẵn sàng giao dịch.
+ Giá tốt nhất thị trường: 10.8 Tỷ (Chủ gấp, thương lượng cực thiện chí)
+ Vui lòng liên hệ Phạm Hân để xem nhà.
+ Trân trọng cảm ơn!","10,8 tỷ",85 m2,"Phố Võng Thị, Phường Bưởi, Quận Tây Hồ, Hà Nội",13174680,_,---,Cần bán,4m,---,"Đất thổ cư, đất ở",Sổ hồng/ Sổ đỏ,---,"5,3m",---,---,---,---,---
https://alonhadat.com.vn/phan-lo-xuan-la-tay-ho-duong-nhua-8m-he-2m-moi-2-thoang-45m-mat-tien-8m-7-tang-tm-12-9-ty-13174718.html,PHÂN LÔ 105 XUÂN LA 2 THOÁNG 3 OTO TRÁNH VỈA HÈ CÂY XANH 50m MT 8m 7 TẦNG TM 12.9 Tỷ,"+ Người quen gửi bán căn nhà phân lô phố Xuân La, Tây Hồ.
+ Diện tích 50m, mặt tiền 8m, 7 tầng thang máy nhập Nhật long lanh, chắc chắn, các phòng thiết kế cực kỳ sáng thoáng, đón ánh sáng tự nhiên.
+ Nhà mới đẹp, 2 thoáng có ngách nhỏ hông nhà, ngõ thông rộng oto tránh dừng đỗ ngày đêm, 100m ra mặt phố, mặt tiền rộng, phù hợp khách mua để ở & kết hợp kinh doanh.
+ Nhà nằm ngay ngã 3 Xuân La – Ngoại Giao Đoàn, gần ngay khu Kosmo Xuân La, đại sứ quán Hàn Quốc, giao thông thuận tiện đi sân bay Nội Bài, kết nối các tuyến phố lớn như Lạc Long Quân, Nguyễn Xuân Khoát, Minh Tảo, Võ Chí Công, + Sổ đỏ chính chủ, vuông vắn, pháp lý rõ ràng, sẵn sàng giao dịch.
+ Giá tốt nhất thị trường: 12.9 tỷ (thương lượng cực thiện chí)
+ Vui lòng liên hệ Phạm Hân để xem nhà.
+ Trân trọng cảm ơn!","12,9 tỷ",50 m2,"Đường Xuân La, Phường Xuân La, Quận Tây Hồ, Hà Nội",13174718,_,True,Cần bán,8m,True,"Biệt thự, nhà liền kề",Sổ hồng/ Sổ đỏ,True,8m,7,True,---,6,---
https://alonhadat.com.vn/ban-nha-cau-giay-toa-9-tang-4-thoang-o-cho-thue-60-trieu-65m-mat-tien-4-8m-14-9-ty-13214608.html,BÁN NHÀ CẦU GIẤY TÒA 9 TẦNG 4 THOÁNG Ở & CHO THUÊ 60 TRIỆU 65M MẶT TIỀN 4.8M 14.9 TỶ,"+ Người quen gửi bán tòa nhà căn hộ phố Cầu Giấy, quận Cầu Giấy, nhà xây mới 2022, chủ xây tâm huyết vừa để ở và cho thuê dòng tiền, 4 mặt đều sáng thoáng.
+ Diện tích 65m², mặt tiền 4.8m, 9 tầng thang máy nhập Nhật Mitsubishi, full nội thất, thiết kế tầng 2 phòng khép kín, hiện tại chủ ở 3 tầng 7, 8, 9 và cho 1 đơn vị thuê khoán 60 Triệu/ tháng.
+ 50m ra mặt phố, ngã ba Nguyễn Văn Huyên giao Cầu Giấy, gần các trường đại học lớn như Sư Phạm, Ngoại Ngữ, Quốc Gia, Giao Thông Vận Tải, các văn phòng, các hàng quán kinh doanh tấp nập, chợ dân sinh, hồ điều hòa, đi bộ ra công viên Nghĩa Đô.
+ Giao thông thuận tiện đi các tuyến phố sầm uất như Cầu Giấy, Khúc Thừa Dụ, Trần Thái Tông, Dịch Vọng, Trương Công Giai, Nguyễn Văn Huyên.
+ An ninh tuyệt đối, hàng xóm thân thiện, phong thủy cực kỳ vượng.
+ Sổ đỏ chính chủ, vuông vắn, pháp lý rõ ràng, sẵn sàng giao dịch.
+ Giá tốt nhất thị trường 14.9 Tỷ (Chủ thiện trí, thương lượng tốt).
+ Liên hệ Mr. Phạm Hân để xem nhà.
+ Trân trọng cảm ơn!","14,9 tỷ",65 m2,"Đường Cầu Giấy, Phường Dịch Vọng, Quận Cầu Giấy, Hà Nội",13214608,_,True,Cần bán,"3,5m",True,Nhà trong hẻm,Sổ hồng/ Sổ đỏ,True,"4,8m",9,---,---,15,---
https://alonhadat.com.vn/603-lac-long-quan-tay-ho-canh-toa-lien-co-oto-tranh-via-he-kinh-doanh-48m-mt-4-7m-13-7-ty-13214698.html,603 LẠC LONG QUÂN TÂY HỒ CẠNH TÒA LIÊN CƠ OTO TRÁNH VỈA HÈ KINH DOANH 48M MT 4.7M 12.9 TỶ,"+ Người quen gửi bán căn nhà ngõ 603 phố Lạc Long Quân, quận Tây hồ.
+ Diện tích 48m, mặt tiền 4.7m, chủ xây tâm huyết 5 tầng long lanh, thiết kế các phòng đều tối ưu cửa sổ lớn, thoáng sáng, đón ánh sáng tự nhiên.
+ Nhà mới đẹp, 2 thoáng trước sau, ngõ thông đường 8m vỉa hè oto tránh, phù hợp khách mua để ở và kinh doanh hay cho thuê văn phòng cực lý tưởng.
+ Khẳng định nhà đẹp nhất ngõ, ngõ to đẹp nhất phố thông thẳng sang Võ Chí Công, ngay cạnh tòa nhà Liên Cơ 7 ban ngành, 200m ra quảng trường 2 con rồng, rảo bước hồ Tây lộng gió, quần thể trung tâm thương mại Lotte Tây Hồ lớn nhất Đông Nam Á, tiện ích bạt ngàn.
+ Giao thông thuận tiện kết nối các tuyến phố lớn như Võ Chí Công, Lạc Long Quân, Trịnh Công Sơn, Nguyễn Hoàng Tôn, Nhật Chiêu, Xuân La.
+ Sổ đỏ chính chủ, vuông vắn, pháp lý rõ ràng, sẵn sàng giao dịch.
+ Giá tốt nhất thị trường: 12.9 Tỷ (thương lượng thiện chí)
+ Vui lòng gọi trực tiếp Phạm Hân để xem nhà.
+ Trân trọng cảm ơn!","12,9 tỷ",48 m2,"Đường Lạc Long Quân, Phường Nhật Tân, Quận Tây Hồ, Hà Nội",13214698,_,True,Cần bán,8m,True,Nhà trong hẻm,Sổ hồng/ Sổ đỏ,True,"4,7m",5,True,---,5,---
https://alonhadat.com.vn/mat-pho-nguyen-khang-cau-giay-65m-mat-tien-4-5m-6-tang-24-9-ty-via-he-kinh-doanh-van-phong-13214503.html,MẶT PHỐ NGUYỄN KHANG CẦU GIẤY 65M MẶT TIỀN 4.5M 6 TẦNG 24.9 TỶ VỈA HÈ KINH DOANH VĂN PHÒNG,"+ Người quen gửi bán căn nhà mặt phố Nguyễn Khang, quận Cầu Giấy.
+ Diện tích 65m, mặt tiền 4.5m, chủ xây tâm huyết 6 tầng long lanh, thiết kế các phòng đều tối ưu cửa sổ lớn, thoáng sáng, đón ánh sáng tự nhiên, móng khung cột chắc chắc có thể thêm tầng và lắp thang máy.
+ Nhà mới đẹp, đường xe 2 chiều, vỉa hè rộng, oto tránh và dừng đỗ ngày đêm, sau quy hoạch nhà mình sẽ cạnh mặt phố mới đường 50m, nối từ Nguyễn Văn Huyên kéo dài đến đường Láng, tương lai giá trị tăng cao.
+ Giao thông thuận tiện kết nối các tuyến phố lớn như Cầu Giấy, Nguyễn Khang, đường Láng, Nguyễn Văn Huyên, Lê Văn Lương, Trần Duy Hưng.
+ Sổ đỏ chính chủ, vuông vắn, pháp lý rõ ràng, sẵn sàng giao dịch.
+ Giá tốt nhất thị trường: 24.9 Tỷ (chủ gấp, thương lượng thiện chí)
+ Vui lòng gọi trực tiếp Phạm Hân để xem nhà.
+ Trân trọng cảm ơn!","24,9 tỷ",65 m2,"Đường Nguyễn Khang, Phường Yên Hòa, Quận Cầu Giấy, Hà Nội",13214503,_,True,Cần bán,8m,True,Nhà mặt tiền,Sổ hồng/ Sổ đỏ,True,"4,5m",6,True,---,6,---
