url,title,description,price,area,address,Mã tin,Hướng,Phòng ăn,Loại tin,Đường trước nhà,Nhà bếp,Loại BDS,Pháp lý,Sân thượng,Chiều ngang,Số lầu,Chổ để xe hơi,Chiều dài,Số phòng ngủ,Chính chủ
https://alonhadat.com.vn/ban-nha-mat-pho-trieu-viet-vuong-quan-hai-ba-trung-68m-7-tang-40-2-ty-hiem-nha-ban-12681654.html,"Bán nhà mặt phố Triệu Việt Vương, quận Hai Bà Trưng 68m 7 tầng 40,2 tỷ, hiếm nhà bán","HIẾM CỦA HIẾM - 7 TẦNG THANG MÁY - MẶT PHỐ VIP HAI BÀ TRƯNG - CHỈ BÁN TRONG TUẦN 
Bán nhà mặt phố Triệu Việt Vương, quận Hai Bà Trưng 68m 7 tầng, giá 40,2 tỷ
+ Triệu Việt Vương là phố trung tâm Hai Bà Trưng chỉ vài trăm mét ra Hồ Hoàn Kiếm, khu vực kinh doanh sầm uất, chưa từng thấy tắc đường. Hàng loạt loại hình kinh doanh cho khách mua tha hồ lựa chọn.
+ Nhà hiện cho thuê được 6 năm nhưng chủ chưa từng 1 lần tăng giá, khách mới có thể tiếp quản hợp đồng hoặc cắt ngang nếu muốn.
- Tầng 1 hầm để xe.
- Tầng 2 phòng khách.
- Tầng 3,4 thiết kế thông sàn kinh doanh.
- Tầng 5 thông sàn nhưng chia vách ngăn làm 2 phòng vip.
- Tầng 6 thông sàn khu bếp chuẩn 4*.
- Tầng 7 văn phòng hành chính, điều hành.
+ Sổ đỏ cất két, giao dịch ngay.","40,2 tỷ",68 m2,"Phố Triệu Việt Vương, Phường Bùi Thị Xuân, Quận Hai Bà Trưng, Hà Nội",12681654,_,True,Cần bán,8m,True,Nhà mặt tiền,---,True,"5,2m",7,True,---,5,---
https://alonhadat.com.vn/ban-nha-pho-co-linh-96m-6-tang-31-ty-dep-long-lanh-via-he-thenh-thang-gara-6-o-to-12693769.html,"Bán nhà phố Cổ Linh 96m 6 tầng,31 tỷ, đẹp long lanh, vỉa hè thênh thang, gara 6 ô tô","Bán nhà phố Cổ Linh, quận Long Biên 96m 6 tầng, giá 31 tỷ 

NHÀ ĐẸP ĐẲNG CẤP NHẤT LONG BIÊN - 6 TẦNG THANG MÁY ĐẸP - GARA ĐỂ 6 Ô TÔ - THIẾT KẾ ĐẸP LONG LANH - VỈA HÈ THÊNH THANG - NỘI THẤT SỊN SÒ 
+ Vị trí: Thoáng đãng, sinh khí, không khí trong lành. Vỉa hè 5m để xe thoải mái. Đường trước nhà rộng 20m ô tô tránh nhau thoải mái. 
+ Chủ nhà tự tay thiết kế xây dựng. Chủ nhà là kiến trúc sư có tiếng, thiết kế tối ưu, công năng hết ý. 
- Tầng 1+2: Chủ để thông sàn, tầng 1 có thể làm Gara để được 5-6 xe thoải mái, Tầng 2 làm văn phòng, kinh doanh… 
- Tầng 3 : 1 phòng ngủ Luxury đẳng cấp 5 Sao, gồm bồn tắm, phòng xông hơi, phòng ngủ rất rộng, tiểu cảnh ban công trước nhà. 
- Tầng 4: 2 phòng ngủ khép kín rất đẹp thư giãn. 
- Tầng 5: Không gian Phòng khách và bếp. Thiết bị bếp, phòng khách rất đẹp, sịn sò. Đẳng cấp. 
- Tầng 6: Khu thờ tự, sân phơi, sân chơi, sân nướng BBQ, ngắm hồ, thưởng trà, cafe thì hết ý. 
+ Sổ đỏ phân lô, vuông đẹp, sẵn sàng giao dịch.",31 tỷ,96 m2,"Đường Cổ Linh, Phường Long Biên, Quận Long Biên, Hà Nội",12693769,_,True,Cần bán,20m,True,Nhà trong hẻm,Sổ hồng/ Sổ đỏ,True,5m,6,True,---,4,---
https://alonhadat.com.vn/ban-nha-mat-pho-xa-dan-85-m-6-tang-48-ty-sieu-hiem-2-mat-pho-kd-sam-uat-12743436.html,"Bán nhà mặt phố  Xã Đàn  85 m 6 tầng 48 tỷ, siêu hiếm 2 mặt phố, KD sầm uất","SIÊU HIẾM - 2 MẶT PHỐ - NHÀ MỚI - THANG MÁY- KINH DOANH SẦM UẤT - THUÊ 90TR/ THÁNG. 
Bán nhà mặt phố  Xã Đàn, quận Đống Đa  85 m 6 tầng, giá 48 tỷ 
- Tọa lạc tại vị trung tâm của quận Đống Đa phố Xã Đàn là con phố vip nhất của quận kinh doanh sầm uất với bất kể các loại hình kinh doanh .
- Vị trí siêu đắc địa nhất khu phố
- Nhà gần ĐH Bách Khoa, Bv Bạch Mai, TTTM lên quá thuận tiện cho các nhu cầu thiết yếu của gia đình. 
- Tầng 1 : Kinh doanh thông sàn, WC. 
- Tầng 2 ,3,4,5,: mỗi tầng 2 phòng, WC. 
- Tầng 6: Phòng thờ, sân phơi. 
- Hiện nhà đang cho thuê 90tr/ tháng hợp đồng 5 năm.
- Khách mua về chỉ việc khai thác.
- Nhà mới giá lại hợp lý lên tính thanh khoản rất cao.",48 tỷ,85 m2,"Phố Xã Đàn, Phường Ô Chợ Dừa, Quận Đống Đa, Hà Nội",12743436,_,True,Cần bán,30m,True,Nhà mặt tiền,Sổ hồng/ Sổ đỏ,True,6m,6,True,---,8,---
https://alonhadat.com.vn/ban-nha-mat-pho-nguyen-xien-quan-thanh-xuan-120m-9-tang-58-ty-cho-thue-gan-2-ty-nam-12758155.html,"Bán toà nhà văn phòng mặt phố Nguyễn Xiển 120m 9 tầng 58 tỷ, CHO THUÊ GẦN 2 TỶ/NĂM","Bán toà nhà văn phòng mặt phố Nguyễn Xiển, quận Thanh Xuân 120m 9 tầng, giá 58 tỷ 
TOÀ NHÀ HOA HẬU TUYẾN PHỐ - CHO THUÊ CAO NHẤT GẦN 2 TỶ/NĂM - NGON NHẤT TRONG KHU VỰC 
- Cả tuyến phố có duy nhất toà nhà đẹp nhất trong tầm giá 
- Toà nhà thông sàn tất cả các tầng trừ tầng 7 chia 2 phòng. 
- Giá cho thuê chủ mới ký đồng là gần 2 tỷ/năm, khách mới nên tiếp nối hợp đồng.
Sổ đỏ chính chủ, giao dịch ngay.",58 tỷ,120 m2,"Đường Nguyễn Xiển, Phường Thanh Xuân Bắc, Quận Thanh Xuân, Hà Nội",12758155,_,True,Cần bán,30m,True,Văn phòng,Sổ hồng/ Sổ đỏ,True,9m,9,True,---,9,---
https://alonhadat.com.vn/ban-toa-nha-mat-pho-hoang-quoc-viet-quan-cau-giay-300m-9-tang-171-ty--12752029.html,"Bán toà nhà mặt phố Hoàng Quốc Việt, quận Cầu Giấy 300m, 9 tầng 171 tỷ .","Bán toà nhà mặt phố Hoàng Quốc Việt, quận Cầu Giấy 300m, 9 tầng, giá 171 tỷ .
- Các tầng đều thông sàn, riêng tầng 9 thiết kế phòng ăn, phòng ngủ, phòng khách, phòng thờ.
- Toà nhà Văn Phòng mặt Phố Hoàng Quốc Việt , vị trí đẹp nhất phố , mặt tiền rộng , vỉa hè đá bóng 
Toà nhà phù hợp Ngân Hàng, SPa , Bệnh Viện, văn phòng..
- Toà nhà mới đi vào hoạt động, hiện đang cho thuê chọn gói 300 triệu/ tháng 
- Sổ chính chủ nở hậu 
.",171 tỷ,300 m2,"Đường Hoàng Quốc Việt, Phường Nghĩa Đô, Quận Cầu Giấy, Hà Nội",12752029,_,True,Cần bán,40m,True,Văn phòng,Sổ hồng/ Sổ đỏ,True,8m,9,---,---,6,---
https://alonhadat.com.vn/ban-nha-mat-pho-tran-khat-chan-60m-5-tang-20-ty-via-he-kinh-doanh-sam-uat-thang-may-12713787.html,"Bán nhà mặt phố Trần Khát Chân 60m, 5 tầng 20 tỷ, vỉa hè, kinh doanh sầm uất, thang máy","Giảm chào 1.5 tỷ - giá chào mới 20 tỷ
Bán nhà mặt phố Trần Khát Chân, quận Hai Bà Trưng 60m, 5 tầng, giá 20 tỷ 
 MẶT PHỐ - VỈA HÈ RỘNG - KINH DOANH SẦM UẤT - THANG MÁY 
 Thiết kế: 
1 thang bộ + THANG MÁY
- Sổ đỏ 45m. + 15 M chủ mua vi bằng hàng xóm. Nhà xây đủ 60m.
- Tầng 1: 2 phòng + wc
- Tầng 2 : 2 phòng + Wc 
- Tầng 3: 2 phòng + wc
- Tầng 4: 2 phòng + wc
- Tầng 5: 1 phòng + sân phơi
- Sổ đỏ chính chủ.",20 tỷ,60 m2,"Đường Trần Khát Chân, Phường Thanh Lương, Quận Hai Bà Trưng, Hà Nội",12713787,_,True,Cần bán,40m,True,Nhà mặt tiền,Sổ hồng/ Sổ đỏ,True,"6,5m",5,True,---,10,---
https://alonhadat.com.vn/ban-khach-san-mat-pho-ma-may-320-m-7-tang-260-ty-38-phong-khep-kin-doanh-thu-15-ty-nam-12714874.html,"Bán khách sạn mặt phố Mã Mây 320 m, 7 tầng 260 tỷ, 38 phòng khép kín, doanh thu 15 tỷ/năm","BÁN KHÁCH SẠN 5* PHỐ CỔ - DÒNG TIỀN 15TỶ/ NĂM - SỔ ĐỎ CHÍNH CHỦ - PHONG THUỶ PHÁT LỘC. 
Bán khách sạn mặt phố Mã Mây, quận Hoàn Kiếm 320 m, 7 tầng, giá 260 tỷ 
Khách sạn 5 sao, xây dựng được 5 năm,  đủ thiết kế, giấy phép xây dựng, 38 phòng khép kín VIP, doanh thu ổn định full phòng, 15tỷ/năm, sổ đỏ nở hậu, phát lộc!
 *Thiết kế: Thiết kế 38 phòng VIP Khép kín, thang máy xịn, nội thất cao cấp, sổ đỏ chính chủ,",260 tỷ,320 m2,"Phố Mã Mây, Phường Hàng Mã, Quận Hoàn Kiếm, Hà Nội",12714874,_,True,Cần bán,8m,True,"Nhà hàng, khách sạn",Sổ hồng/ Sổ đỏ,True,10m,7,True,---,38,---
https://alonhadat.com.vn/ban-toa-nha-apartment-moi-dep-10-noi-2-ham-vi-tri-dep-cho-thue-san--12736165.html,"BÁN TOÀ NHÀ APARTMENT MỚI ĐẸP, 10 NỔI 2 HẦM, VỊ TRÍ ĐẸP, CHO THUÊ SẴN.","BÁN TOÀ NHÀ APARTMENT MỚI ĐẸP, 10 NỔI 2 HẦM, VỊ TRÍ ĐẸP, CHO THUÊ SẴN.
  Tô Ngọc Vân, Tây Hồ 148 M 11 tầng , mặt tiền  7, giá  51 tỷ 
+ Phố VIP Tây Hồ quận, chuyên dùng để kinh doanh homestay cho khách Tây.
+ Vị trí đẹp, ngay sát mặt phố, thuận tiện di chuyển cho khách, yên tĩnh, an ninh.
+ Toà nhà bao gồm 10 tầng nổi thiết kế căn hộ cho thuê, mỗi tầng thiết kế là 1 căn hộ 2 ngủ, 1 khách, 1 bếp đầy đủ. 
- Hiện chủ đang cho 1 đơn vị thuê, giá thu nét về là 160 triệu/ tháng, thuế phí bên thuê tự chịu. Hợp đồng cho thuê 3 năm 1 lần. Khách mua tiếp quản tiếp hợp đồng.
- Giấy phép xây dựng 7 tầng 1 tum.
- Nhà full đồ..
- Sổ siêu nét.",51 tỷ,150.150 m2,"Đường Tô Ngọc Vân, Phường Quảng An, Quận Tây Hồ, Hà Nội",12736165,_,True,Cần bán,4m,True,"Nhà hàng, khách sạn",Sổ hồng/ Sổ đỏ,True,"7,5m",12,---,---,14,---
https://alonhadat.com.vn/ban-toa-nha-khach-san-pho-dam-quang-trung-125m-7-tang-19-ty-dt-150-den-200-trieu-thang-12727937.html,"Bán toà nhà khách sạn phố Đàm Quang Trung 125m 7 tầng 19 tỷ, DT 150 đến 200 triệu/tháng","Bán toà nhà khách sạn phố Đàm Quang Trung, quận Long Biên 125m 7 tầng, giá 19 tỷ
CHỦ CẦN TIỀN GẤP HẠ CHÀO 1 tỷ TRIỆU. GIÁ CHÀO MỚI 19 TỶ.
KHÁCH SẠN 7 TẦNG THANG MÁY - GARA 4 Ô TÔ - KINH DOANH KHỦNG - GIÁ RẺ GIẬT MÌNH
Mô tả: 
+ Khách sạn tọa lạc vị trí đắc địa, gần mặt phố Đàm Quang Trung, ngõ rộng ô tô tránh nhau. Vị trí ngay ngã tư trung tâm thương mại Aeon mall,  xung quanh tiện ích đầy đủ.
+ Khách sạn 7 tầng thang máy mới xây được khoảng hơn 2 năm. Tổng 12 phòng khép kín, nội thất xịn, thiết kế hiện đại, doanh thu mỗi tháng 150-200 triệu. 
- Tầng 1: Sảnh Lễ tân để được 4 ô tô và nhiều xe máy.
- Tầng 2, 3,4,5: mỗi tầng 3 phòng khép kín hiện đại 
- Tầng 6: phòng ở cho nhân viên
- Tầng 7: Tum, sân phơi, buồng kỹ thuật 
+ Sổ đỏ vuông vắn, sẵn sàng giao dịch",19 tỷ,125 m2,"Đường Đàm Quang Trung, Phường Long Biên, Quận Long Biên, Hà Nội",12727937,_,True,Cần bán,5m,True,"Nhà hàng, khách sạn",Sổ hồng/ Sổ đỏ,True,7m,7,True,---,12,---
https://alonhadat.com.vn/ban-nha-mat-pho-ngoc-thuy-quan-long-bien-380-mat-tien-14m-gia-24-7-ty-12728501.html,"Bán nhà mặt phố  Ngọc Thuỵ, quận Long Biên 380, mặt tiền 14m, giá 24,7 tỷ","Bán nhà mặt phố  Ngọc Thuỵ, quận Long Biên 380, mặt tiền 14m, giá 24,7 tỷ 
MẶT PHỐ NGỌC THUỴ - LONG BIÊN - DT SIÊU RỘNG 380m2, LÔ GÓC 2 MẶT THOÁNG - MT 14m QUYỀN LỰC
SỔ ĐẸP NÉT CĂNG, GIAO DỊCH NGAY.
+ CHỦ CẦN BÁN GẤP 
+ NHÀ CẤP 4 CHỦ XÁC ĐỊNH BÁN ĐẤT
+ Mảnh đất VÀNG địa phận Long Biên với diện tích 380m2 đủ sổ full thổ cư, với mật độ dân số dân còn nhiều tiềm năng phát triển theo định hướng quy hoạch của TP Hà Nội.
+ Với mặt tiền quyền lực 14m, phù hợp mọi loại hình nhu cầu từ: Kho, bến bãi, Kinh doanh, xây toà nhà, chia lô,... 
+ Sổ đỏ đep, sẵn sàng giao dịch.","24,7 tỷ",380 m2,"Đường Ngọc Thụy, Phường Long Biên, Quận Long Biên, Hà Nội",12728501,_,True,Cần bán,10m,True,"Đất thổ cư, đất ở",---,---,"3,85m",1,True,---,1,---
https://alonhadat.com.vn/-ban-toa-nha-van-phong-mat-pho-hoang-cau-245m-9-tang-108-ty-mat-duong-lon-cuc-hiem-12726903.html,"Bán toà nhà văn phòng mặt phố Hoàng Cầu 245m 9 tầng 108 tỷ, mặt đường lớn, cực hiếm","Bán toà nhà văn phòng phố Hoàng Cầu, quận Đống Đa 245m 9 tầng, giá 108 tỷ, toà nhà quá Víp
CHỦ NHÀ RẤT CẦN BÁN - GIẢM CHÀO MẠNH 
+ Vị trí cực hiếm, view hồ Hoàng Cầu, mặt đường lớn, vỉa hè rộng mênh mông. 
+ Toà nhà 8 tầng nổi và 1 tầng hầm, thang máy xịn, diện tích xây dựng thực tế 245m2, GPXD và giấy phép PCCC đầy đủ, mới hoàn thiện được hơn 1 năm. 
+ Thiết kế:
Tầng hầm để xe. 
Tầng 1: Sảnh, lễ tân và 1 phòng họp lớn. 
Tầng 2-3-4-5: Thông sàn. 
Tầng 6-7-8: Khu vực để ở gồm phòng thờ, bếp, phòng khách, phòng ăn và 3 phòng ngủ khép kín. 
+ Hiện chủ đã ký hợp đồng cho thuê toàn bộ nhà là 4 tỷ/năm, hợp đồng 4 năm.",108 tỷ,245 m2,"Phố Hoàng Cầu, Phường Ô Chợ Dừa, Quận Đống Đa, Hà Nội",12726903,_,True,Cần bán,25m,True,Văn phòng,Sổ hồng/ Sổ đỏ,True,10m,9,True,---,6,---
https://alonhadat.com.vn/ban-nha-pho-vong-86-m-6-tang-mt-5m-15-8-ty-phan-lo-o-to-tranh-kinh-doanh-dinh-12830876.html,"Bán nhà Phố Vọng 86 m 6 tầng, MT 5m 15.8 tỷ, phân lô, ô tô tránh, kinh doanh đỉnh","PHÂN LÔ - Ô TÔ TRÁNH - NGÕ THÔNG, KINH DOANH ĐỈNH 
Bán nhà Phố Vọng, quận Hai Bà Trưng 86m 6 tầng, mặt tiền 5m, giá 15.8 tỷ 
Vị trí cực đẹp, cực hiếm, nhà nằm trong khu phân lô VÍP trung tâm Quận Hai Bà Trưng, an ninh tốt, dân trí cao, an sinh tuyệt đỉnh. Xung quanh vô vàn tiện ích như: Vimart, trường học các cấp, bệnh viện...Giao thông đi lại thuận tiện. 
Nhà xây 6 tầng, kiên cố chắc chắn, thiết kế hiện đại với đầy đủ công năng sử dụng. Nhà đang cho thuê để giữ nhà với giá 30 triệu/tháng
Nhà thiết kế cơ bản mỗi tầng 2 phòng + WC
Sổ đỏ chính chủ, vuông vắn sẵn sàng giao dịch","15,8 tỷ",86 m2,"Phố Vọng, Phường Đồng Tâm, Quận Hai Bà Trưng, Hà Nội",12830876,_,True,Cần bán,5m,True,Nhà trong hẻm,Sổ hồng/ Sổ đỏ,True,"3,85m",6,True,---,8,---
https://alonhadat.com.vn/ban-toa-nha-van-phong-thai-ha-93m-6-tang-mt-13m-23-ty-kinh-doanh-sieu-hiem-o-to-tai-12828443.html,"Bán toà nhà văn phòng Thái Hà 93m 6 tầng, MT 13m 23 Tỷ, kinh doanh , siêu hiếm, ô tô tải","Bán toà nhà văn phòng Thái Hà, quận Đống Đa 93m 6 tầng, mặt tiền 13m, giá 23 Tỷ 
NGÕ Ô TÔ TẢI - TÒA NHÀ LỪNG LỮNG - MẶT TIỀN SIÊU RỘNG - 6 TẦNG - THANG MÁY -  THOÁNG VĨNH VIỄN - CỰC GẦN MẶT PHỐ 
CHO THUÊ VP - DÒNG TIỀN,...
ô tô tải vi vu,trong ngõ toàn tòa nhà VP và Tòa nhà cho thuê căn hộ cao cấp.
Nhà diện tích rộng, mặt tiền siêu khủng, chủ xây 5 tầng, 1 tum, móng chắc chắn có thể lên 2 tầng nữa thoải mái. Các phòng đều thoáng sáng
Thang máy chạy vèo vèo.
Các tầng đều có thể đập thông vô tư hoặc set up lại theo nhu cầu thoải mái. Phù hợp với khách mua về ở hoặc cải tạo thêm, cho thuê VP lấy dòng tiền ổn định
Sổ đỏ đẹp",23 tỷ,93 m2,"Phố Thái Hà, Phường Trung Liệt, Quận Đống Đa, Hà Nội",12828443,_,True,Cần bán,5m,True,Văn phòng,Sổ hồng/ Sổ đỏ,True,13m,6,True,---,6,---
https://alonhadat.com.vn/ban-chung-cu-mini-phung-khoang-110-m-8-tang-23-7-ty-39-phong-doanh-thu-220-trieu-thang-12816169.html,"Bán chung cư mini Phùng Khoang 110 m, 8 tầng 23.7 tỷ, 39 phòng, doanh thu 220 triệu/ tháng","Bán chung cư mini Phùng Khoang, quận Nam Từ Liêm 110 m 8 tầng, giá   23.7 tỷ 
HẠ HẲN 3.1 TỶ GIÁ CHÀO MỚI 23.7 TỶ
CCMN DÒNG TIỀN 220TR/ THÁNG 39 PHÒNG - NGÕ RỘNG THOÁNG - GẦN TRƯỜNG CHỢ!
Bán chung cư mini Phùng Khoang, quận Nam Từ Liêm 110 m, 8 tầng, giá   23.7 tỷ 
HẠ HẲN 3.1 TỶ GIÁ CHÀO MỚI 23.7 TỶ
+ CCMN hoàn thiện 39 Phòng - đã lấp full phòng giá thuê từ 3.5 tr - 5.2 tr. 
+ Hiện trạng mới 100% full nội thất: giường, tủ quần áo, sofa, mỗi phòng 1 máy giặt riêng. 
+ Doanh thu full phòng 220 tr/ tháng có bảng doanh thu","23,7 tỷ",110 m2,"Đường Phùng Khoang, Phường Trung Văn, Quận Nam Từ Liêm, Hà Nội",12816169,_,True,Cần bán,4m,True,"Phòng trọ, nhà trọ",Sổ hồng/ Sổ đỏ,True,6m,8,---,---,39,---
https://alonhadat.com.vn/ban-toa-nha-khach-san-lac-long-quan-118m-10-tang-39-ty-30-phong-khep-kin-dt-gan-3-ty-nam-12863579.html,"Bán toà nhà khách sạn Lạc Long Quân 125m 10 tầng 39 tỷ, 30 phòng khép kín, DT gần 3 tỷ/năm","Bán toà nhà khách sạn Lạc Long Quân, Tây Hồ 125 m 10 tầng, giá  39 tỷ, siêu hiếm
TÒA NHÀ MỚI TINH - NỞ HẬU - CÁCH HỒ TÂY 40M - NGÕ THÔNG TỨ TUNG - 09 TẦNG 1 TUM - 30 PHÒNG KHÉP KÍN HIỆN ĐẠI - DÒNG TIỀN TỰ KHAI THÁC GẦN 3 TỶ/NĂM - VIOS VÀO NHÀ - THIẾT KẾ HIỆN ĐẠI 
Vị trí : Gần Nhật Chiêu - Hồ Tây, gần Công viên nước Hồ Tây, Lotte Võ Chí Công - Lạc Long Quân.
- Tòa nhà chủ xây cực kỳ hiện đại chắc chắn, nội thất long lanh, dòng tiền tuyệt đỉnh.
- Nhà thiết kế 11 tầng MỚI TINH VỪA ĐƯA VÀO KHAI THÁC SỬ DỤNG (đã xong 9 tầng 1 tum hiện đã đưa vào khai thác). 
- Nhà làm móng khoan cộc nhồi có thể lên 15 tầng.
Nếu chủ tự khai thác dòng tiền đạt 240tr/tháng (tức gần 3 tỷ/năm). 
- Nhà full nội thất : gồm 04 máy giặt, 30 điều hòa, nóng lạnh, tivi, bếp từ, giường, tủ, tranh nghệ thuật trong phòng cũng như ngoài sảnh.
- Hệ thống chiếu sáng tự động toàn bộ tòa nhà.
- Hệ thông điện thông minh, bảng điện điện tử cao cấp nhất.
- Hệ thống mở cửa vân tay cao cấp từng phòng.
- Hệ thống phòng cháy chữa cháy đầy đủ, có kiểm định, có hệ thống báo cháy có cảm biến từ tầng 01 tới tầng 9.
Sổ đỏ nở hậu, cất két, sẵn sàng giao dịch.
GPXD, HỒ SƠ THIẾT KẾ, GP PCCC ĐÃ CÓ.",39 tỷ,125 m2,"Đường Lạc Long Quân, Phường Nhật Tân, Quận Tây Hồ, Hà Nội",12863579,_,True,Cần bán,4m,True,"Nhà hàng, khách sạn",Sổ hồng/ Sổ đỏ,True,8m,10,True,---,30,---
https://alonhadat.com.vn/ban-toa-nha-van-phong-mat-pho-dai-co-viet-180-m-7-tang-118-ty-mat-tien-15m-sieu-hiem-12867669.html,"Bán toà nhà văn phòng mặt phố Đại Cồ Việt 180 m 7 tầng 118 tỷ, mặt tiền 15m , siêu hiếm","Bán toà nhà văn phòng mặt phố Đại Cồ Việt, quận Hai Bà Trưng 180m 7 tầng, giá 118 tỷ 
HOA HẬU ĐẸP NHẤT PHỐ - LÔ GÓC - VỈA HÈ ĐÁ BÓNG - Ô TÔ ĐỖ TRƯỚC NHÀ 10 CÁI - THANG MÁY - THANG THOÁT HIỂM - TUYỆT CỦA ĐỈNH 
THIẾT KẾ: Công năng chuẩn toà VP, chủ cẩn thận đã làm PCCC đầy đủ, chủ tâm huyết, làm tỉ mỷ đến từng chi tiết nhỏ, nhà vị trí cực đẹp 1 mặt phố và 1 mặt ngõ, sau nhà thang bộ thoát hiểm sắt cực chắc.
- Vỉa hè  đá bóng để bạt ngàn ô tô.
- Riêng 3 tầng thông sàn cho thuê VP doanh thu gần 200 triệu
- Các tầng còn lại để xe và 6 căn hộ lớn khép kín
- Pháp lý: Sổ đỏ chính chủ",118 tỷ,180 m2,"Đường Đại Cồ Việt, Phường Lê Đại Hành, Quận Hai Bà Trưng, Hà Nội",12867669,_,True,Cần bán,30m,True,Văn phòng,Sổ hồng/ Sổ đỏ,True,15m,7,True,---,6,---
https://alonhadat.com.vn/ban-toa-nha-van-phong-thai-ha-42m-7-tang-32-ty-kinh-doanh-dinh-nhieu-o-to-tranh-12858112.html,"Bán toà nhà văn phòng Thái Hà 42m 7 tầng 32 tỷ,kinh doanh đỉnh, nhiều ô tô tránh","Bán toà nhà văn phòng Thái Hà, quận Đống Đa 42m 7 tầng, giá 32 tỷ 
SIÊU PHẨM MẶT PHỐ SIÊU VIP CỰC HIẾM 
Nhà thiết kế 7 tầng thông sàn có hầm chuẩn văn phòng có thể kết hợp cho thuê hay an sinh đẳng cấp.
Nhà hiện đang cho thuê cả nhà 65 triệu/tháng. Chủ mới có thể cho thuê tiếp hoặc lấy nhà thuận lợi.
Sổ đỏ đẹp vuông đét sẵn sàng giao dịch.",32 tỷ,42 m2,"Phố Thái Hà, Phường Trung Liệt, Quận Đống Đa, Hà Nội",12858112,_,True,Cần bán,15m,True,Văn phòng,Sổ hồng/ Sổ đỏ,True,"6,5m",7,True,---,7,---
https://alonhadat.com.vn/ban-nha-mat-pho-minh-khai-90-m-4-tang-gia-nhinh-26-ty-via-he-da-bong-kinh-doanh-sam-uat-12775235.html,"Bán nhà mặt phố Minh Khai 90 m 4 tầng, giá nhỉnh 26 tỷ, vỉa hè đá bóng, kinh doanh sầm uất","Bán nhà mặt phố Minh Khai, quận Hai Bà trưng 90 m 4 tầng, giá nhỉnh 26 tỷ
KINH DOANH - 2 MẶT THOÁNG MẶT PHỐ -HIẾM NHÀ BÁN - ĐỈNH CỦA ĐỈNH - VỈA HÈ RỘNG- KHU VỰC TRUNG TÂM
+ Mặt phố lô góc kinh doanh vỉa hè đá bóng ô tô đỗ tránh cửa khu vực ăn chơi nghỉ dưỡng dân trí đỉnh cao bậc nhất Hà Nội. 
Gần Bạch Mai, Trương định, Trần đại nghĩa ....
+ Cho thuê tháng 30 triệu tầng 1, dòng tiền tốt.
+ Khu ít nhà bán các nhà mặt phố cùng dẫy đang xây mới toàn biệt thự nguy nga....
+ Thiết kế :  tầng 1: Cửa hàng Kinh doanh + 1 phòng khách bếp +1vs. 
+ Tầng 2,3 ,4 thông phòng",26 tỷ,90 m2,"Đường Minh Khai, Phường Minh Khai, Quận Hai Bà Trưng, Hà Nội",12775235,_,True,Cần bán,40m,True,Nhà mặt tiền,Sổ hồng/ Sổ đỏ,True,"5,3m",4,True,---,4,---
https://alonhadat.com.vn/ban-nha-mat-pho-truong-chinh-quan-thanh-xuan-203m-3-tang-gia-68-ty-12775324.html,"Bán nhà mặt phố Trường Chinh, quận Thanh Xuân 203m 3 tầng, giá 68 tỷ","Bán nhà mặt phố Trường Chinh, quận Thanh Xuân 203m 3tầng, giá 68 tỷ 
NHÀ, ĐẤT VÀNG MẶT PHỐ - MẶT TIỀN QUYỀN LỰC - THÔNG SỐ ĐẸP - 2 MẶT THOÁNG- HIẾM NHÀ BÁN
Vị trí nhà mặt Phố Trường Chinh, khu vực hiếm nhà bán, vỉa hè rộng 7m, kinh doanh mọi loại hình, khu vực đã quy hoạch ổn định, nhà nằm đúng đoạn đẹp nhất phố, giao thông vô cùng thuận tiện, Bệnh Viện Đại Học Y, Bv Bạch Mai, các trường đại học lớn Bách - Kinh - Xây.
Nhà cũ xác định bán vị trí đất
Có thể xây 10 tầng cực đẹp. 
SỔ ĐỎ CẤT KÉT, SẴN SÀNG GIAO DỊCH.",68 tỷ,203 m2,"Đường Trường Chinh, Phường Khương Trung, Quận Thanh Xuân, Hà Nội",12775324,_,True,Cần bán,40m,True,Nhà mặt tiền,Sổ hồng/ Sổ đỏ,True,"7,7m",3,True,---,4,---
https://alonhadat.com.vn/ban-can-ho-penhouse-toa-the-price-hai-phat-2000-m-29-5-ty-dang-cap-hiem-12769982.html,"Bán căn hộ PENHOUSE Toà  THE PRIDE HẢI PHÁT,2000 m  29.5 tỷ, đẳng cấp, hiếm có","VIEW CỰC CHILL – BIỆT THỰ TRÊN MÂY – PENHOUSE KHỦNG NHẤT HÀ NỘI – ĐẲNG CẤP THƯỢNG LƯU - THANG MÁY
Bán căn hộ PENHOUSE Toà THE PRIDE HẢI PHÁT, Hà Đông 2000 m, giá  29.5 tỷ.
- Căn PENHOUSE khủng nhất Hà Nội, đẳng cấp giới thượng lưu. Diện tích sổ gộp 3 căn hộ PENHOUSE tổng là 1000m2 sổ và có 1000m2 sân Vườn trên Mây.
- Chủ nhà là Doanh Nhân Đẳng Cấp, thiết kế để ở và làm việc nhưng giờ có nhu cầu chuyển đổi.
- Thiết các tầng đều có khuôn viên, bể cá Còi, sân vườn Đẳng cấp, Cây cảnh khủng đẳng cấp.
+ Tầng 33: Sảnh Lễ Tân, Khách, Bếp, 4 Ngủ Khép kín, Khuôn viên…
+ Tầng 34: Khách, Phòng Làm việc, Ngủ Master, 4 Ngủ khép kín, Phòng Thờ….
+ Tầng 35: 1000m2 toàn bộ khuôn viên sân vườn cây cảnh khủng của Toà nhà mà chủ nhà đang sử dụng riêng.
+ Sổ đỏ chính chủ giao dịch ngày.","29,5 tỷ",2.000 m2,"Đường Lê Văn Lương, Phường La Khê, Quận Hà Đông, Hà Nội",12769982,_,True,Cần bán,15m,True,Căn hộ chung cư,Sổ hồng/ Sổ đỏ,True,40m,34,True,---,8,---
