url,title,description,price,area,address,Mã tin,Hướng,Phòng ăn,Loại tin,Đường trước nhà,Nhà bếp,Loại BDS,Pháp lý,Sân thượng,Chiều ngang,Số lầu,Chổ để xe hơi,Chiều dài,Số phòng ngủ,Chính chủ
https://alonhadat.com.vn/oto-tai-do-cua-ban-dat-thon-tho-am-lien-ninh-thanh-tri-45m2-chi-2-1-ty--11089299.html,"OTO Tải Đỗ Cửa, Bán Đất thôn Thọ Am, Liên Ninh, Thanh Trì 45m2, chỉ 2.1 tỷ.","+ Bán Đất tại Thôn Thọ Am, xã Liên Ninh, huyện Thanh Trì: 45m2, giá 2.1 tỷ. Có thương lượng mạnh
+ Ngõ OTO tải đỗ cửa, ngõ thông, an ninh tốt.
+ Cách chục đường chính chỉ 50m, OTO dừng đỗ trước Đất thoải mái.
+ Gần mảnh đất có hồ điều hòa, không khí trong lành mát mẻ
+ Sổ đỏ chính chủ, pháp lý rõ ràng.","2,1 tỷ",45 m2,"Đường Thọ Am, Xã Liên Ninh, Huyện Thanh Trì, Hà Nội",11089299,_,---,Cần bán,5m,---,"Đất thổ cư, đất ở",Sổ hồng/ Sổ đỏ,---,"3,5m",---,---,---,---,---
https://alonhadat.com.vn/nong-bong-20m-ra-pho-duong-tu-hiep-thanh-tri-40m2-x-5t-chi-3-75-ty-co-tl-11010920.html,"Nóng Bỏng, 20m ra phố, đường Tứ Hiệp, Thanh Trì 40m2 x 5T, chỉ 3.45 tỷ. Có TL","+ Cần bán nhanh căn nhà tại đường Tứ Hiệp, Thanh Trì: 40m2 x 5 tầng, chỉ 3.45 tỷ. Có thương lượng mạnh luôn.
+ Cách mặt đường Tứ Hiệp chỉ 30m, 100m ra đến QL 1A.
+ Ngay gần Trung tâm thương mại Thanh Trì và bệnh viện Thanh Trì.
+ Nhà 5 tầng mới đẹp lung linh, khách mua chỉ việc xách vali về ở ngay
+ Sổ đỏ chính chủ, pháp lý rõ ràng.
---GIÁ CHỈ 3.75 TỶ---
___Gọi ngay em Giang nhé","3,45 tỷ",40 m2,"Đường Tứ Hiệp, Thị Trấn Văn Điển, Huyện Thanh Trì, Hà Nội",11010920,_,True,Cần bán,4m,True,Nhà trong hẻm,Sổ hồng/ Sổ đỏ,True,"3,8m",5,True,---,4,---
https://alonhadat.com.vn/qua-re-luon-200m-ra-uy-ban-huyen-nha-tu-hiep-46m2-x-5t-chi-3-5-ty-co-tl-10984354.html,"Qúa Rẻ Luôn, 200m ra Ủy Ban Huyện, nhà Tứ Hiệp 46m2 x 5T, chỉ 3.5 tỷ. Có TL","+ Cần bán Gấp căn nhà tại đường Tứ Hiệp, huyện Thanh Trì 46m2 x 5T, chỉ có 3.5 tỷ. Thương lượng mạnh luôn.
+ Tặng toàn bộ nội thất cơ bản cho khách mua.
+ Cách Ủy Ban Huyện, khu trung tâm hành chính công của Huyện Thanh Trì chỉ 200m.
+ Gần nhà có chơ, siêu thị và nhiều trường học các cấp.
+ Nhà xây dựng 5 tầng kiên cố, thiết kế hiện đại. Mỗi tầng 1 phòng ngủ + WC.
+ Sổ đỏ chính chủ, pháp lý rõ ràng.
--- GIÁ CHỈ 3.5 TỶ. vẫn giảm giá tiếp.
__-__ Gọi ngay cho em Giang để xem nhà A/C nhé!","3,5 tỷ",46 m2,"Đường Tứ Hiệp, Thị Trấn Văn Điển, Huyện Thanh Trì, Hà Nội",10984354,_,True,Cần bán,"2,5m",True,Nhà trong hẻm,Sổ hồng/ Sổ đỏ,True,4m,5,---,---,3,---
https://alonhadat.com.vn/ban-nha-duong-cong-voi-ngoc-hoi-55m2-x-5t-chi-3-5-ty-cach-ubnd-300m-11184862.html,"Bán nhà đường Cổng Vôi, Ngọc Hồi 55m2 x 5T, chỉ 3.5 tỷ. cách UBND 300m","+ Bán nhà riêng trong ngõ Cổng Vôi đường Ngọc Hồi: 55m2 x 5 tầng, giá 3.5 tỷ. Có thương lượng mạnh.
+ Cách Ủy ban Nhân Dân Huyện Thanh Trì chỉ 300m.
+ Ngõ Cổng Vôi là ngõ sát cạnh Ủy Ban Huyện Thanh Trì, khu vực mới được làm làm đường đẹp hơn cả mặt phố.
+ Ngõ thông ra chợ văn điển, khu dân trí cao, giá đất tăng phi mã.
+ Nhà Lô góc 2 mặt thoáng, ngõ rộng cách OTO chỉ 40m.
+ Sổ đỏ chính chủ, pháp lý rõ ràng.
***GÍA 3.5 TỶ. CÓ TL","3,5 tỷ",55 m2,"Đường Ngọc Hồi, Thị Trấn Văn Điển, Huyện Thanh Trì, Hà Nội",11184862,_,True,Cần bán,"3,5m",True,Nhà trong hẻm,Sổ hồng/ Sổ đỏ,True,4m,5,---,---,4,---
https://alonhadat.com.vn/ban-dat-thon-dai-lo-ninh-so-thuong-tin-40m2-mt-5m-chi-1-25-ti-co-tl-10268301.html,"Bán Đất Thôn Đại Lộ, Ninh Sở, Thường Tín 40m2, mt 5m, chỉ 1.2 tỉ. Có TL","+ Cần bán gấp mảnh đất tại Thôn Đại Lộ, Xã Ninh Sở, Huyện Thường Tín 40m2, mặt tiền 5m, chỉ 1.2 tỉ. Có thương lượng cho khách mua
+ Nằm ngay gần Đê, đang có dự án quy hoạch đê xây dựng khu du lịch sinh thái ven sông hồng.
+ Đường OTO tải đỗ cổng. Mảnh đất 353m2 phân làm 7 lô nhỏ. Khách mua lô nào chọn lô đấy.
+ Phù hợp cho dân đầu tư sinh lời, tiềm năng tăng giá cao.
+ Sổ đỏ chính chủ, pháp lý rõ ràng.","1,2 tỷ",40 m2,"Đường Liên Thôn, Xã Ninh Sở, Huyện Thường Tín, Hà Nội",10268301,_,---,Cần bán,3m,---,"Đất nền, liền kề, đất dự án",Sổ hồng/ Sổ đỏ,---,5m,---,---,---,---,---
https://alonhadat.com.vn/ban-dat-dai-ang-55m2-mt-4m-oto-tai-vao-san-gia-1-95-ty-bao-sang-ten-12068286.html,"Bán Đất Đại Áng, 55m2, mt 4m, OTO tải vào sân, giá 1.9 tỷ. Bao sang tên","+ Bán Gấp mảnh Đất tại Xã Đại Áng, huyện Thanh Trì: 55m2, mặt tiền 4m, giá 1.9 tỷ. Có thương lượng
+ OTO tải vào tận sân, vài bước ra mặt đường chính, OTO tải tránh nhau có vỉa hè.
+ Gần ngay trường mầm non và khu đô thị Đại Áng đang phát triển từng ngày
+ Sổ đỏ chính chủ, bao sang tên cho khách","1,9 tỷ",55 m2,"Đường Liên Xã, Xã Đại Áng, Huyện Thanh Trì, Hà Nội",12068286,_,---,Cần bán,5m,---,"Đất thổ cư, đất ở",Sổ hồng/ Sổ đỏ,---,---,---,---,---,---,---
https://alonhadat.com.vn/ban-dat-khu-tdc-tu-hiep-30m2-o-to-tranh-via-he-gan-ngo-sy-kien-chi-3-9-ty-co-tl-12052016.html,"Bán đất khu TĐC Tứ Hiệp 30m2, ô tô tránh, vỉa hè, Gần Ngô Sỹ Kiện, chỉ 3.4 tỷ. Có TL","+ Bán gấp mảnh đất khu Tái định cư Tứ Hiệp 30m2, chỉ 3.4 tỷ. Có thương lượng cực mạnh

+ Cách trường tiểu học Ngô Sỹ Kiện 30m, gần Tecco, khu vực thuận tiện kinh doanh.

+ Đường xe tải tránh nhau, có vỉa hè, tiềm năng tăng giá phi mã

+ Xung quanh tập trung nhiều tòa chung cư lớn Tecoo, IEC...và nhiều trường học các cấp

+ Sổ đỏ chính chủ, phân lô vuông vắn","3,4 tỷ",30 m2,"Đường Tứ Hiệp, Xã Tứ Hiệp, Huyện Thanh Trì, Hà Nội",12052016,_,---,Cần bán,10m,---,"Đất thổ cư, đất ở",Sổ hồng/ Sổ đỏ,---,---,---,---,---,---,---
https://alonhadat.com.vn/ban-nha-rieng-duong-tu-hiep-55m2-x-4-tang-gan-tt-thuong-mai-oto-do-cua-12005267.html,"Bán nhà riêng đường Tứ Hiệp 55m2 x 4 tầng, gần TT Thương Mại, OTO đỗ cửa","+ Bán gấp căn nhà tại đường Tứ Hiệp, huyện Thanh Trì: 55m2 x 4 tầng, giá cực rẻ.
+ Vị trí trung tâm, đầy đủ tiện ích, ngay chợ Thị trấn Văn Điển.
+ Gần Trung tâm thương mại và Bệnh viện đa khoa Thanh Trì.
+ OTO đỗ cửa, 15m ra bãi gửi OTO ngày đêm, 80m ra đường chính quốc lộ 1A
+ Nhà chủ tự xây, sổ đỏ chính chủ.","5,85 tỷ",55 m2,"Đường Tứ Hiệp, Thị Trấn Văn Điển, Huyện Thanh Trì, Hà Nội",12005267,_,True,Cần bán,4m,True,Nhà trong hẻm,Sổ hồng/ Sổ đỏ,True,"4,5m",4,True,---,4,---
https://alonhadat.com.vn/ban-dat-khu-dau-gia-tu-hiep-85m2-mat-tien-6m-gia-11-ty-doi-dien-ca-huyen-11995729.html,"Bán Đất Khu Đấu Giá Tứ Hiệp 85m2, mặt tiền 6m, giá 8.5 tỷ. Đối diện CA Huyện","- Bán gấp mảnh đất Khu Đấu Giá Tứ Hiệp: 85m2, mặt tiền 6m, giá 8.5 tỷ. Có thương lượng mạnh.

- Tọa lạc đúng trung tâm sầm uất nhất của Huyện Thanh Trì, khu vực cựt hiếm nhà bán.

- Nằm ngay bên cạnh Tòa chung cư Tecco và IEC, dân trí cao, hưởng chọn mọi tiện ích
- Khu vực tập trung đầy đủ các nhà hàng, siêu thị, trường học các cấp, Công An Huyện Thanh Trì
- Sổ đỏ vuông vắn trước sau như một","8,5 tỷ",85 m2,"Đường Tứ Hiệp, Thị Trấn Văn Điển, Huyện Thanh Trì, Hà Nội",11995729,_,---,Cần bán,10m,---,"Đất thổ cư, đất ở",Sổ hồng/ Sổ đỏ,---,6m,---,True,---,---,---
https://alonhadat.com.vn/ban-dat-mat-duong-tho-am-lien-ninh-50m2-mt-6m-lo-goc-chi-3-7-ty-co-tl-12233452.html,"Bán Đất mặt đường Thọ Am, Liên Ninh 50m2, mt 6m, Lô góc, chỉ 3.7 tỷ. Có TL","+ Cần BÁN GẤP mảnh đất mặt đường Thọ Am, xã Liên Ninh 50m2, mặt tiền 6m, chỉ 3.7 tỷ. Có thương lượng mạnh.
+ Vị trí ngay đầu thôn Thọ Am, đường 2 OTO tránh nhau.
+ Lô góc, mặt tiền rộng vô cùng thuận tiện kinh doanh
+ Khu vực hạ tầng đang phát triển từng ngày, mua để ở hay đầu tư đều rất tiềm năng
+ Sổ đỏ chính chủ, pháp lý rõ ràng","3,7 tỷ",50 m2,"Đường Thọ Am, Xã Liên Ninh, Huyện Thanh Trì, Hà Nội",12233452,_,---,Cần bán,"6,5m",---,"Đất thổ cư, đất ở",Sổ hồng/ Sổ đỏ,---,6m,---,---,---,---,---
https://alonhadat.com.vn/ngo-rong-gan-oto-ban-dat-tho-am-thanh-tri-42m2-chi-1-55-ty-co-tl-12492498.html,"Ngõ Rộng, gần OTO, bán Đất Thọ Am, Thanh Trì 42m2, chỉ 1.55 tỷ. Có TL","+ Bán Đất thôn Thọ Am, Liên Ninh, Thanh Trì 42m2, chỉ 1.55 tỷ. Có thương lượng mạnh.
+ Ngõ rộng, gần bãi để OTO. Gần hồ, tích ích tốt.
+ Sau lưng là hồ điều hòa, ở thích. 
+ Tiềm năng tăng giá cao, đầu tư tích lũy hay sử dụng để ở đều rất OK
+ Sổ đỏ đẹp","1,55 tỷ",42 m2,"Đường Thọ Am, Xã Liên Ninh, Huyện Thanh Trì, Hà Nội",12492498,_,---,Cần bán,3m,---,"Đất thổ cư, đất ở",Sổ hồng/ Sổ đỏ,---,5m,---,---,---,---,---
https://alonhadat.com.vn/ban-dat-tdc-tu-khoat-ngu-hiep-50m2-oto-tranh-via-he-chi-4-6-ty-co-tl-12605076.html,"Bán Đất TĐC Tự Khoát, Ngũ Hiệp 50m2, OTO tránh, Vỉa Hè, chỉ 4.6 tỷ. Có TL","+ Bán gấp mảnh đất khu Tái Định Cư Tự Khoát, Lưu Phái, Ngũ Hiệp Thanh Trì: 50m2, mặt tiền 4.5m, chỉ 4.6 tỷ. Có thương lượng mạnh
+ Đường trước nhà vài OTO tránh nhau, vỉa hè rộng đá bóng...
+ Thuộc phân khuu tái định cư Tự Khoát, ngay sát chợ lưu phái,..
+ Xung quanh đầy đủ siêu thị, chợ, trường học các cấp","4,6 tỷ",50 m2,"Đường Tự Khoát, Xã Ngũ Hiệp, Huyện Thanh Trì, Hà Nội",12605076,_,---,Cần bán,12m,---,"Đất thổ cư, đất ở",Sổ hồng/ Sổ đỏ,---,"4,5m",---,True,---,---,---
https://alonhadat.com.vn/ban-nha-ngoc-hoi-oto-do-cong-35m2-chi-2-5-ty-ve-o-ngay-12773619.html,"Bán nhà Ngọc Hồi, OTO đỗ cổng 35m2, chỉ 2.5 tỷ. Về Ở ngay","+ Bán nhà đường Ngọc Hồi 35m2, về ở ngay, mà chỉ 2.5 tỷ. Có thương lượng mạnh.
+ Vị trí nhà cực đẹp, cách mặt đường Ngọc Hồi chỉ 20m.
+ OTO đỗ cách nhà chỉ 10m thôi.
+ Nhà chắc chắn có đầy đủ công năng sử dụng
+ Gia chủ cần bán gấp, giá dự kiến tốt lắm luôn","2,5 tỷ",35 m2,"Đường Ngọc Hồi, Thị Trấn Văn Điển, Huyện Thanh Trì, Hà Nội",12773619,_,True,Cần bán,3m,True,Nhà trong hẻm,Sổ hồng/ Sổ đỏ,True,---,2,---,---,3,---
https://alonhadat.com.vn/can-ban-gap-nha-rieng-thon-co-dien-40m2-x-5t-lo-goc-gia-3-2-ty-co-tl-12696617.html,"Cần Bán Gấp nhà riêng thôn Cổ Điển 40m2 x 5T, Lô góc, giá 3.2 tỷ. Có TL","+ Bán nhà riêng thôn Cổ Điển 40m2, 5 tầng, mặt tiền 5m, quá đẹp.
+ Lô góc 2 mặt thoáng, ngay gần khu đấu giá tứ hiệp.
+ Ngõ nộng rộng, dân cư văn minh.
+ Gần các chung cư như IEC, Tecoo,.. và nhiều trường học các cấp","3,2 tỷ",40 m2,"Đường Cổ Điển A, Xã Tứ Hiệp, Huyện Thanh Trì, Hà Nội",12696617,_,True,Cần bán,3m,True,Nhà trong hẻm,Sổ hồng/ Sổ đỏ,True,5m,5,True,---,4,---
https://alonhadat.com.vn/cuc-hot-oto-lo-goc-nha-co-dien-gan-iec-40m2-chi-2-65-ty-bao-sang-ten-12739253.html,"Cực HOT, OTO, Lô Góc, nhà Cổ Điển, gần IEC 40m2, chỉ 2.65 tỷ. Bao sang tên","+ Cần bán gấp căn nhà tại thôn Cổ Điển A, xã Tứ Hiệp 40m2, giá quá mềm còn bao sang tên luôn.
+ Ngõ rộng OTO đỗ cửa, cách Chung cư IEC chỉ vài trăm mét,….
+ Thuộc khu vực trung tâm của Thanh Trì với đầy đủ tiện ích, ở sướng luôn
+ Gần Trường cấp 1 Ngô Sỹ Kiện và Chu Văn An
+ Gia chủ cần bán gấp vô cùng thiện trí với khách mua","2,65 tỷ",40 m2,"Đường Cổ Điển A, Xã Tứ Hiệp, Huyện Thanh Trì, Hà Nội",12739253,_,---,Cần bán,"4,5m",---,Nhà trong hẻm,Sổ hồng/ Sổ đỏ,---,---,1,---,---,1,---
https://alonhadat.com.vn/ngay-nga-3-vu-lang-ngu-hiep-ban-nha-72m-cach-pho-20m-chi-3-5-ty--13098381.html,"Ngay Ngã 3 Vũ Lăng – Ngũ Hiệp, Bán nhà 72m, cách phố 20m, chỉ 3.5 tỷ.","+ Bán nhà 1 tầng tại đường Vũ Lăng, Thanh Trì 72m.
+ Cách mặt đường đôi Vũ Lăng chỉ 20m.
+ Ngõ rộng thênh thang, khu vực phát triển tốt.
+ Nằm ngay ngã 3 giao đường Vũ Lăng với Ngũ Hiệp.
+ Nhà 1 tầng, cấp 4 ở ngay được, đầy đủ công năng sử dụng.","3,5 tỷ",72 m2,"Đường Ngũ Hiệp, Xã Ngũ Hiệp, Huyện Thanh Trì, Hà Nội",13098381,_,True,Cần bán,"3,5m",True,Nhà trong hẻm,Sổ hồng/ Sổ đỏ,---,---,1,---,---,1,---
https://alonhadat.com.vn/ban-gap-dat-dau-gia-tu-hiep-thanh-tri-68m-mt-5m-chi-7-ty-co-tl-13094118.html,"Bán Gấp Đất Đấu Giá Tứ Hiệp, Thanh Trì 68m, mt 5m, chỉ 7 tỷ. Có TL","+ Cần bán gấp mảnh đất tại khu Đấu Giá, TĐC Tứ Hiệp, 68m, chỉ có 7 tỷ. 
+ Đường to rộng OTO tải tránh nhau thoải mái luôn
+ Có vỉa hè rộng, để thuận tiện kinh doanh
+ Gần ngày trường tiểu học Chu Văn An, Ngô Sỹ Kiện,…
+ Khu trung tâm của Thanh Trì vô cùng tiềm năng",7 tỷ,68 m2,"Đường Tứ Hiệp, Xã Tứ Hiệp, Huyện Thanh Trì, Hà Nội",13094118,_,---,Cần bán,10m,---,"Đất thổ cư, đất ở",Sổ hồng/ Sổ đỏ,---,---,---,---,---,---,---
https://alonhadat.com.vn/phan-lo-dau-gia-tu-hiep-85m-oto-tranh-via-he-chi-10-ti-ra-loc-manh-13070692.html,"Phân Lô, Đấu Giá Tứ Hiệp 85m, Oto tránh, vỉa hè, chỉ 10 tỉ. ra lộc mạnh","+ Bán Đất Tứ Hiệp, Thanh Trì 85m, mặt tiền 6m, chỉ 10 tỉ. Ra lộc mạnh tay luôn.
+ Vị trí ngay gần Chung cư Tecco Diamond.
+ Gần trường tiểu học Ngô Sỹ Kiện và nhiều trường học các cấp.
+ Đường vài xe tải tránh nhau, chạy vòng quanh, có vỉa hè rộng.
+ Thuận tiện xây nhà, văn phòng, kinh doanh cho thuê đa dạng
***Chi tiết liên hệ",10 tỷ,85 m2,"Đường Tứ Hiệp, Xã Tứ Hiệp, Huyện Thanh Trì, Hà Nội",13070692,_,---,Cần bán,12m,---,"Đất thổ cư, đất ở",Sổ hồng/ Sổ đỏ,---,---,---,True,---,---,---
https://alonhadat.com.vn/phan-lo-oto-tranh-ban-dat-tai-vinh-quynh-80m-mt-5m-chi-4-ty-co-tl-13063493.html,"Phân Lô, OTO tránh, Bán Đất tại Vĩnh Quỳnh 80m, mt 5m, chỉ 4 tỷ. Có TL","+ Bán Đất tại Vĩnh Quỳnh, Thanh Trì 80m2, mt 5m, giá cực đẹp luôn.
+ Vị trí đẹp, thuộc khu phân lô ngay gần QL 1A.
+ Đường OTO tránh nhau trước nhà, đỗ xe tại cửa thoái mái luôn 
+ Cách QL 1A chỉ 100m, hàng xóm toàn cán bộ quân đội về hưu, an sinh tốt",4 tỷ,80 m2,"Đường Vĩnh Quỳnh, Xã Vĩnh Quỳnh, Huyện Thanh Trì, Hà Nội",13063493,_,---,Cần bán,6m,---,"Đất thổ cư, đất ở",Sổ hồng/ Sổ đỏ,---,5m,---,True,---,---,---
https://alonhadat.com.vn/chan-dai-duong-cong-bang-tho-am-40m2-x-4t-chi-2-ti-gia-giam-sau-13108931.html,"Chân Dài đường Cổng Bàng, Thọ Am 40m2 x 4T, chỉ 2 tỉ. giá giảm sâu","+ Bán nhà đường Cổng Bảng, thôn Thọ Am, Liên Ninh: 40m x 4 tầng.
+ Cách mặt đường OTO tránh 50m.
+ Đường cổng bảng chuẩn bị thi công rộng 17m, giá dự kiến tăng mạnh.
+ Cách đường gom cao tốc pháp vân có 1 đoạn thôi.
+ Gần trường tiểu học Tạ Hoàng Cơ.
+ Nhà 5 tầng kiên cố, đẹp đẽ ở ngay",2 tỷ,40 m2,"Đường Thọ Am, Xã Liên Ninh, Huyện Thanh Trì, Hà Nội",13108931,_,True,Cần bán,3m,True,Nhà trong hẻm,Sổ hồng/ Sổ đỏ,True,---,4,---,---,4,---
