url,title,description,price,area,address,Mã tin,Hướng,Phòng ăn,Loại tin,Đường trước nhà,Nhà bếp,Loại BDS,Pháp lý,Sân thượng,Chiều ngang,Số lầu,Chổ để xe hơi,Chiều dài,Số phòng ngủ,Chính chủ
https://alonhadat.com.vn/ban-580m2-dat-vuon-50-nam-sai-son-quoc-oai-gia-hon-1-trieu-m2-13527086.html,"Bán 580m2 đất vườn 50 năm Sài Sơn Quốc Oai, giá hơn 1 triệu/m2","Đất vườn Quốc Oai: 580m2, mặt tiền rộng, bám đường bê tông
Đất nằm vị trí kết nối  giao thông thuận tiện, cách Đại lộ Thăng Long 1.5km, gần các địa điểm du lịch như kdl chùa Thầy, kdl Tuần Châu Sài Sơn, kết nối sang Hoài Đức qua Tỉnh lộ 422 rất thuận tiện
Diện tích 580m2, mặt tiền rộng, cách trục đường nhựa contener tránh chỉ 20m
Ranh giới xây gọn gàng
Rất phù hợp để làm nhà vườn
Sổ đỏ sẵn công chứng","1,8 triệu / m2",580 m2,"Đường Láng Hòa Lạc, Xã Sài Sơn, Huyện Quốc Oai, Hà Nội",13527086,_,---,Cần bán,5m,---,"Đất nông, lâm nghiệp",Sổ hồng/ Sổ đỏ,---,20m,---,---,30m,---,---
https://alonhadat.com.vn/ban-1185m2-sai-son-quoc-oai-giap-khu-dan-cu-13521581.html,"Bán 1185m2 Sài Sơn Quốc Oai, giáp khu dân cư","Vị trí kết nối giao thông thuận tiện: Cách Đại lộ Thăng Long khoảng 2.5 km, cách Tỉnh lộ 422 kết nối sang Hoài Đức chỉ 200m
Đất bám đường bê tông, cách đường DH08 rộng 13m chỉ vài bước chân, liền ngay khu dân cư
Rất phù hợp để làm nhà vườn
Sổ đỏ chính chủ
Giá: 2.2 tỷ","2,3 tỷ",1.185 m2,"Đường Láng Hòa Lạc, Xã Sài Sơn, Huyện Quốc Oai, Hà Nội",13521581,_,---,Cần bán,5m,---,"Đất nông, lâm nghiệp",Sổ hồng/ Sổ đỏ,---,15m,---,---,80m,---,---
https://alonhadat.com.vn/ban-350m2-sai-son-quoc-oai-gan-dai-lo-thang-long-13532213.html,"Bán 350m2  Sài Sơn, Quốc Oai, gần Đại lộ Thăng Long","Sài Sơn: 350m2 mặt tiền 15m, vuông vắn làm nhà vườn cực đẹp
Vị trí kết nối  giao thông rất tốt: Cách Đại lộ Thăng Long khoảng 2km, cách trục đường nhựa xem contener chạy chỉ 200m. kết nối sang Hoài Đức qua Tỉnh lộ 422 cũng rất tiện
Diện tích 350m2, mặt tiền rộng 15m, đường trước đất 5m
Xung quanh có nhiều khu nhà vườn của cư dân Hà thành đang dần được hình thành
Rất  phù hợp để làm khu nha vườn nhỏ xinh hoặc kho xưởng
Sổ đỏ riêng
Giá: 1.5 triệu/m2","1,5 triệu / m2",350 m2,"Đường Láng Hòa Lạc, Xã Sài Sơn, Huyện Quốc Oai, Hà Nội",13532213,_,---,Cần bán,5m,---,"Đất nông, lâm nghiệp",Sổ hồng/ Sổ đỏ,---,15m,---,---,23m,---,---
https://alonhadat.com.vn/ban-265m2-dat-vuon-ngay-khu-dan-cu-sai-son-quoc-oai-13608296.html,"Bán 265m2 đất vườn, ngay khu dân cư Sài Sơn Quốc Oai","Quốc Oai: 265m2 đất vườn ven Đô, ngay khu dân cư, phù hợp làm nhà vườn
Đất nằm vị trí kết nối giao thông rất tốt, cách Đại lộ Thăng Long 2km, Cách Tỉnh lộ 422 kết nối sang Hoài Đức chỉ 100m, khoảng 1km là đến khu du lịch chùa Thầy và Tuần Châu Sài Sơn
Diện tích 265m2, đã xây ranh giới rõ ràng, xung quanh có nhiều nhà vườn và trang trại hiện hữu.
Rất phù hợp để làm nhà vườn hoặc đầu tư lâu dài
Sổ đỏ ẵn công chứng
Giá: 2 triệu/ m2",2 triệu / m2,265 m2,"Đường Láng Hòa Lạc, Xã Sài Sơn, Huyện Quốc Oai, Hà Nội",13608296,_,---,Cần bán,6m,---,"Đất nông, lâm nghiệp",Sổ hồng/ Sổ đỏ,---,10m,---,---,25m,---,---
https://alonhadat.com.vn/ban-1100m2-dat-vuon-ngay-khu-dan-cu-sai-son-quoc-oai-13591132.html,"Bán 1100m2 đất vườn, ngay khu dân cư Sài Sơn Quốc Oai","Quốc Oai: 1100m2 đất vườn ven Đô, ngay khu dân cư, phù hợp làm nhà vườn
Đất nằm vị trí kết nối giao thông rất tốt, cách Đại lộ Thăng Long 2km, Cách Tỉnh lộ 422 kết nối sang Hoài Đức chỉ 300m, đi bộ vài bước chân là ra đến trục đường DH08 rộng 13m hiện đang thi công
Diện tích 1100m2, đã xây tường bao, ranh giới rõ ràng, xung quanh có nhiều nhà vườn và trang trại hiện hữu.
Rất phù hợp để làm nhà vườn hoặc đầu tư lâu dài
Sổ đỏ ẵn công chứng
Giá: hơn 1 triệu/m2",2 tỷ,1.100 m2,"Đường Láng Hòa Lạc, Xã Sài Sơn, Huyện Quốc Oai, Hà Nội",13591132,_,---,Cần bán,5m,---,"Đất nông, lâm nghiệp",Sổ hồng/ Sổ đỏ,---,25m,---,---,40m,---,---
https://alonhadat.com.vn/ban-675m2-sai-son-quoc-oai-mat-duong-nhua-contener-chay-13578622.html,"Bán 675m2 Sài Sơn Quốc Oai, mặt đường nhựa, contener chạy","Đất bám đường nhựa rộng 7m, dạng xe contener chạy thoải mái, xung quanh rất nhiều nhà vườn, kho bãi, xưởng đang hoạt động
Vị trí kết nối giao thông thuận tiện: Cách Đại lộ Thăng Long khoảng 2 km, kết nối đi Quốc lộ 32, Tỉnh lộ 422 sang Hoài Đức rất thuận tiện
Rất phù hợp làm kho bãi, nhà vườn hoặc xưởng sản xuất.
Sổ đỏ chính chủ
Giá: 1.7 tỷ","1,7 tỷ",675 m2,"Đường Láng Hòa Lạc, Xã Sài Sơn, Huyện Quốc Oai, Hà Nội",13578622,_,---,Cần bán,7m,---,"Đất nông, lâm nghiệp",Sổ hồng/ Sổ đỏ,---,11m,---,---,60m,---,---
https://alonhadat.com.vn/ban-1650m2-dat-ven-do-sai-son-quoc-oai-mat-duong-nhua-13580140.html,"Bán 1650m2 đất ven Đô, Sài Sơn Quốc Oai, mặt đường nhựa","Quốc Oai: 160m2, mặt tiền rộng gần 30m, contener chạy thoải mái
Vị trí kết nối giao thông thuận tiện: Cách Đại lộ Thăng Long khoảng 2 km, kết nối đi Quốc lộ 32, Tỉnh lộ 422 sang Hoài Đức rất thuận tiện
Đất nằm trên trục đường nhựa rộng 7m, xe contener chạy thoải mái, xung quanh rất nhiều nhà vườn, kho bãi, xưởng sản xuất đang hoạt động
Rất phù hợp làm kho bãi, nhà vườn hoặc xưởng sản xuất.
Sổ đỏ sẵn công chứng
Giá: 2.x triệu/m2","2,3 triệu / m2",1.650 m2,"Đường Láng Hòa Lạc, Xã Sài Sơn, Huyện Quốc Oai, Hà Nội",13580140,_,---,Cần bán,7m,---,"Đất nông, lâm nghiệp",Sổ hồng/ Sổ đỏ,---,25m,---,---,66m,---,---
https://alonhadat.com.vn/ban-573m2-dat-vuon-sai-son-quoc-oai-gia-chua-day-1-ty-13643549.html,"Bán 573m2 đất vườn, Sài Sơn Quốc Oai, giá chưa đầy 1 tỷ","Đất giáp với khu dân cư, đường trước đất hơn 6m, kết nối giao thông rất thuận tiện, cách Đại lộ Thăng Long chừng 2km, kết nối sang Hoài Đức qua Tỉnh lộ 422 rất thuận
Diện tích đất 573m2, mặt tiền rộng 15m, trên đất đã có vườn cây ăn quả, ranh giới xây gọn gàng
Rất phù hợp để làm nhà vườn hoặc kho xưởng
Sổ đỏ sẵn công chứng
Giá: 970 triệu",970 triệu,573 m2,"Đường Láng Hòa Lạc, Xã Sài Sơn, Huyện Quốc Oai, Hà Nội",13643549,_,---,Cần bán,6m,---,"Đất nông, lâm nghiệp",Sổ hồng/ Sổ đỏ,---,15m,---,---,38m,---,---
https://alonhadat.com.vn/ban-750m2-dat-vuon-ven-do-xung-quanh-la-tho-cu-13628344.html,Bán  750m2 đất vườn ven Đô xung quanh là thổ cư,"Đất tại Sài Sơn , Quốc Oai, cách khu du lịch chùa Thầy và khu Tuần Châu Sài Sơn chừng 1km, cách 3 phút chạy xe là ra đến Đại lộ Thăng Long
Diện tích 750m2 mặt tiền rộng, xung quanh đều là đất thổ cư, đây được coi như khu đất kẹt. có rất nhiều khu nhà vườn đã đi vào hoạt động
Sổ đỏ chính chủ
Giá: 1.5 tỷ","1,5 tỷ",750 m2,"Đường Láng Hòa Lạc, Xã Sài Sơn, Huyện Quốc Oai, Hà Nội",13628344,_,---,Cần bán,5m,---,"Đất nông, lâm nghiệp",Sổ hồng/ Sổ đỏ,---,20m,---,---,38m,---,---
https://alonhadat.com.vn/ban-995m2-trong-quan-the-nha-vuon-nghi-duong-sai-son-quoc-oai-13655944.html,"Bán 995m2 trong quần thể nhà vườn nghỉ dưỡng, Sài Sơn Quốc Oai","Sài Sơn: 995m2 mặt tiền rộng, giáp ngay khu đất đã xin dự án làm nhà vườn, trang trại
Diện tích 995m2, mặt tiền bám đường bê tông rộng, khoảng 100m là ra đến đường DH08 đang thi công rộng 13m, cách Đại lộ Thăng Long 1.5km
Diện tích 995m2, đất nằm trong khu quần thể nhà vườn, ngay cạnh khu đất đã xin được dự án làm trang trại, phát triển du lịch
Sổ đỏ chính chủ
Giá: 2.2 triệu/m2, có thương lượng","2,2 triệu / m2",995 m2,"Đường Láng Hòa Lạc, Xã Sài Sơn, Huyện Quốc Oai, Hà Nội",13655944,_,---,Cần bán,5m,---,"Đất thổ cư, đất ở",Sổ hồng/ Sổ đỏ,---,18m,---,---,55m,---,---
https://alonhadat.com.vn/ban-3000m2-dat-vuon-sai-son-quoc-oai-gia-hon-1-trieu-m2-13690575.html,"Bán 3000m2 đất vườn Sài Sơn Quốc Oai, giá hơn 1 triệu/m2","Quốc Oai: 3000m2 mặt tiền rộng gần 80m, đường trước đất 5m, phù hợp làm nhà vườn
Diện tích 3000m2, mặt tiền rộng gần 80m, xung quanh có nhiều khu nhà vườn đang hoạt động. với diện tích 3000m2 mặt tiền rộng sẽ phù hợp với nhiều mục đích sử dụng khác nhau.
Đất nằm vị trí có kết nối giao thôn tốt, cách Đại lộ Thăng Long chừng 2km, cách 1km là khu du lịch chùa Thầy và khu Tuần Châu Sài Sơn
Sổ đỏ chính chủ
Giá: 1 triệu 300 nghìn/m2","1,3 triệu / m2",3.000 m2,"Đường Láng Hòa Lạc, Xã Sài Sơn, Huyện Quốc Oai, Hà Nội",13690575,_,---,Cần bán,5m,---,"Đất nông, lâm nghiệp",Sổ hồng/ Sổ đỏ,---,80m,---,---,40m,---,---
https://alonhadat.com.vn/ban-540m2-bam-truc-chinh-xe-contener-chay-sai-son-quoc-oai-13686400.html,"Bán 540m2 bám trục chính xe contener chạy, Sài Sơn Quốc Oai","Quốc Oai: 540m2 mặt tiền rộng, phù hợp làm nhà vườn, kho xưởng
Đất nằm bám trục chính, gần khu dân cư, cách Đại lộ hơn 1km, gần khu du lịch chùa Thầy và khu Tuần Châu Sài Sơn
Diện tích 540m2, mặt tiền rộng, xung quanh nhiều nhà vườn và kho xưởng, liền kề lô đất này nhiều hộ gia đình làm nhà sinh sống an cư luôn.
Sổ đỏ chính chủ
Giá: 830 triệu",830 triệu,540 m2,"Đường Láng Hòa Lạc, Xã Sài Sơn, Huyện Quốc Oai, Hà Nội",13686400,_,---,Cần bán,8m,---,"Đất nông, lâm nghiệp",Sổ hồng/ Sổ đỏ,---,14m,---,---,40m,---,---
https://alonhadat.com.vn/ban-khu-trang-trai-nha-vuon-1100m2-sai-son-quoc-oai-13685304.html,Bán khu trang trại nhà vườn 1100m2 Sài Sơn Quốc Oai,"Quốc Oai: 1100m2 cơ sở hạ tầng sẵn ở, giá hơn 3 tỷ
Đất thuộc dạng đất kẹt, nằm trong khu dân cư, cách Đại lộ Thăng Long khoảng 2km, cách khu du lịch chùa Thầy và khu du lịch Tuần Châu Sài Sơn 1km. di chuyển 16km là đến BigC Thăng Long
Diện tích 1100m2, đã xây nhà và hệ thống sân vườn, đầy đủ cơ sở hạ tầng, khách mua chỉ xách vali về ở.
Xung quanh là quần thể nhà vườn của cư dân Hà Thành
Sổ đỏ chính chủ
Giá: 3.5 tỷ","3,5 tỷ",1.100 m2,"Đường Láng Hòa Lạc, Xã Sài Sơn, Huyện Quốc Oai, Hà Nội",13685304,_,---,Cần bán,5m,---,Trang trại,Sổ hồng/ Sổ đỏ,---,20m,---,---,55m,---,---
https://alonhadat.com.vn/ban-400m2-dat-vuon-giap-khu-dan-cu-sai-son-quoc-oai-13680085.html,"Bán 400m2 đất vườn giáp khu dân cư, Sài Sơn Quốc Oai","Quốc Oai: 400m2 mặt tiền rộng, giáp ngay Tỉnh lộ 422, giá dưới 1 tỷ
Đất nằm vị trí cực đẹp, ngay khu dân cư, cách Tỉnh lộ 422 chỉ vài bước chân, cách Đại lộ Thăng Long 2km, kết nối sang Hoài Đức rất thuận tiện.
Diện tích 400m2, đường trước đất 5m, xung quanh có rất  nhiều khu nhà vườn và kho xưởng đang hoạt động
Sổ đỏ chính chủ
Giá: 800 triệu, có thương lượng",800 triệu,400 m2,"Đường Láng Hòa Lạc, Xã Sài Sơn, Huyện Quốc Oai, Hà Nội",13680085,_,---,Cần bán,5m,---,"Đất nông, lâm nghiệp",Sổ hồng/ Sổ đỏ,---,15m,---,---,27m,---,---
https://alonhadat.com.vn/ban-720m2-dat-vuon-lien-ke-tho-cu-sai-son-quoc-oai-gia-2-5-trieu-m2-13695794.html,"Bán 720m2 đất vườn, liền kề thổ cư, Sài Sơn Quốc Oai giá 2.5 triệu/ m2","Quốc Oai: 720m2 đất vuông như  sân bóng, liền kề khu dân cư, ô tô tránh
Đất nằm tronhg khu dân cư, kết nối giao thông thuận tiện, cách Tỉnh lộ 421b chỉ 200m, chỉ 1.5km là ra đến Đại lộ Thăng Long, gần ngay khu du lịch chùa Thầy và khu Tuần Châu Sài Sơn
Diện tích 720m2 vuông vắn như sân bóng, đường trước đất ô tô tránh, liền kề đất thổ cư nên sau này có cơ hội chuyển đổi mục đích sử dụng đất
Sổ đỏ sẵn công chứng
Giá: 2.5 triệu/m2","2,5 triệu / m2",720 m2,"Đường Láng Hòa Lạc, Xã Sài Sơn, Huyện Quốc Oai, Hà Nội",13695794,_,---,Cần bán,5m,---,"Đất nông, lâm nghiệp",Sổ hồng/ Sổ đỏ,---,30m,---,---,25m,---,---
https://alonhadat.com.vn/ban-1400m2-dat-vuon-sai-son-quoc-oai-gia-hon-1-trieu-m2-13693063.html,"Bán 1400m2 đất vườn Sài Sơn Quốc Oai, giá hơn 1 triệu/m2","Quốc Oai: 1400m2 mặt tiền rộng gần 40m, đường trước đất 5m, phù hợp làm nhà vườn
Đất nằm vị trí có kết nối giao thôn tốt, cách Đại lộ Thăng Long chừng 2km, cách 1km là khu du lịch chùa Thầy và khu Tuần Châu Sài Sơn
Diện tích 1400m2, mặt tiền rộng gần 40m, xung quanh có nhiều khu nhà vườn đang hoạt động. rất gần khu dân cư
Sổ đỏ chính chủ
Giá: 1 triệu 350 nghìn/m2, cam kết giá rẻ nhất thị trường đất  vườn khu vực Sài Sơn, Quốc Oai","1,35 triệu / m2",1.400 m2,"Đường Láng Hòa Lạc, Xã Sài Sơn, Huyện Quốc Oai, Hà Nội",13693063,_,---,Cần bán,5m,---,"Đất nông, lâm nghiệp",Sổ hồng/ Sổ đỏ,---,35m,---,---,40m,---,---
https://alonhadat.com.vn/ban-900m2-dat-trong-cay-lau-nam-song-phuong-hoai-duc-13724073.html,"Bán 900m2 đất trồng cây lâu năm, Song Phương – Hoài Đức","Song Phương: 900m2 đất trồng cây lâu năm, mặt tiền  gần 20m, contenrer tránh nhau.
Đất nằm làn 2, cách Đại lộ Thăng Long chưa đầy 150m, cách BigC Thăng Long 10 phút chạy xe.
Diện tích 900m2, mặt tiền gần 20m, xung quanh rất nhiều kho xưởng, văn phòng công ty đang hoạt động. đường trước đất rộng, xe contener ra vào thpoải mái
Đất phù hợp với làm nhà vườn  hoặc kho xưởng.
Sổ đỏ sẵn công chứng
Giá: Thoả thuận","5,7 triệu / m2",900 m2,"Đường Đại lộ Thăng Long, Xã Song Phương, Huyện Hoài Đức, Hà Nội",13724073,_,---,Cần bán,8m,---,"Đất nông, lâm nghiệp",Sổ hồng/ Sổ đỏ,---,20m,---,---,45m,---,---
https://alonhadat.com.vn/mat-pho-o-cho-dua-xa-dan-70m2x6-tang-mat-tien-5-5m-sieu-kinh-doanh-chi-35-ty--9337543.html,"Mặt Phố Ô Chợ Dừa - Xã Đàn 70m2x6 Tầng, Mặt Tiền 5.5m, Siêu Kinh Doanh, Chỉ 30 Tỷ.","Gia đình cần bán gấp nhà mặt phố Ô Chợ Dừa 70m2x6 tầng, mặt tiền 5.5m, giá 30 tỷ.
- Nhà vị trí đắc địa, vỉa hè 7m, ngay ngã 6 Ô Chợ Dừa - Xã Đàn. Kinh doanh, cho thuê văn phòng, phòng khám, spa, nhà hàng, ngân hàng, cà phê cực đỉnh.
- Nhà thiết kế hiện đại, thông sàn, cầu thang + thang máy cuối nhà. Hiện đang cho thuê 120 triệu/tháng.
- Khách mua có thể nối tiếp hợp đồng hoặc tự kinh doanh.
- Sổ đỏ vuông vắn, chính chủ.
- Giá 30 tỷ có thương lượng.
Liên hệ: Em Thuần.
Chuyên nhà mặt phố Hà Nội.",30 tỷ,70 m2,"Đường Ô Chợ Dừa, Phường Ô Chợ Dừa, Quận Đống Đa, Hà Nội",9337543,_,---,Cần bán,40m,---,Nhà mặt tiền,---,---,---,6,---,---,5,---
https://alonhadat.com.vn/ban-nha-mat-pho-hoang-quoc-viet-cau-giay-600m2-10-tang-chi-162-ty--12874740.html,"Bán nhà mặt phố Hoàng Quốc Việt, Cấu Giấy 600m2, 10 tầng, chỉ 162 tỷ.","Cần bán gấp tòa nhà 10 tầng tại phố Hoàng Quốc Việt, quận Cầu Giấy. 
- Diện tích 600m2, 10 tầng, MT 20m, sổ đỏ chính chủ. 
- Giá 162 tỷ có thương lượng. 
- Nhà vị trí đẹp, trung tâm Cầu Giấy, vỉa hè rộng, ô tô dừng đỗ. Gần các phố Nguyễn Văn Huyên, Võ Chí Công, Nguyễn Phong Sắc, Phạm Văn Đồng,... 
- Nhà 9 tầng nổi + 2 tầng hầm thiết kế hiện đại, thông sàn. Phù hợp cho thuê, kinh doanh văn phòng, phòng khám, spa, khách sạn, bệnh viện,... 

Liên hệ: Em Thuần.
Xin cảm ơn.",162 tỷ,600 m2,"Đường Hoàng Quốc Việt, Phường Nghĩa Đô, Quận Cầu Giấy, Hà Nội",12874740,_,---,Cần bán,40m,---,Nhà mặt tiền,---,---,---,10,---,---,10,---
https://alonhadat.com.vn/ban-nha-mat-pho-tay-son-135m2-4-tang-mt-4-2m-kinh-doanh-dinh-chi-22-5-ty--9724093.html,"Bán Nhà Mặt Phố Tây Sơn 135m2, 4 Tầng, MT 4.2m, Kinh Doanh Đỉnh, Chỉ 22.5 Tỷ.","Cần bán gấp nhà mặt phố Tây Sơn, quận Đống Đa 135m2, 4 tầng, mặt tiền 4.2m, 22.5 tỷ.
- Nhà mặt phố vị trí đẹp, đường rộng 40m, vỉa hè rộng thoáng. Gần các phố Thái Hà, Chùa Bộc, Thái Thịnh, Nguyễn Lương Bằng, Ngã Tư Sở,...
- Khu vực trung tâm Đống Đa nhiều trường đại học lớn, chung cư, trung tâm thương mại, tòa nhà văn phòng,...xung quanh dân cư đông đúc, sầm uất. Kinh doanh, cho thuê văn phòng, phòng khám, spa, nhà hàng, ngân hàng, nhà thuốc, thời trang, trang sức,...cực tốt.
- Nhà 4 tầng vuông vắn, chắc chắn, thông thoáng trước sau. Nội thất, tiện nghi đầy đủ.
- Sổ đỏ vuông vắn, chính chủ.
- Giá 22.5 tỷ có thương lượng.
Liên hệ: Em Thuần.
Chuyên nhà mặt phố Hà Nội.","22,5 tỷ",135 m2,"Phố Tây Sơn, Phường Ngã Tư Sở, Quận Đống Đa, Hà Nội",9724093,_,---,Cần bán,40m,---,Nhà mặt tiền,---,---,---,4,---,---,5,---
