url,title,description,price,area,address,Mã tin,Hướng,Phòng ăn,Loại tin,Đường trước nhà,Nhà bếp,Loại BDS,Pháp lý,Sân thượng,Chiều ngang,Số lầu,Chổ để xe hơi,Chiều dài,Số phòng ngủ,Chính chủ
https://alonhadat.com.vn/ban-nha-mat-pho-hoang-quoc-viet-cau-giay-thong-so-dep-55m-mat-tien-5-2m-25-5-ty--13733009.html,"Bán nhà mặt phố Hoàng Quốc Việt, Cầu Giấy, thông số đẹp, 55m, mặt tiền 5.2m, 25.5 tỷ.","- Diện tích 50m, 4 tầng, mặt tiền 5.2m, 25.5 tỷ 
 
- Nhà bán nằm tại vị trí đắc địa, ngay trục đường chính, giao thông thuận tiện, khu vực tấp nập người qua lại, kinh doanh sầm uất. Giao với các tuyến phố như Phạm Văn Đồng, Hoàng Hoa Thám, Võ Chí Công, Bưởi, Xuân Tảo, ...

- Nhà hiện trạng 4 tầng cũ, đang cho thuê kinh doanh.

- Sổ đỏ chính chủ, pháp lý sạch, nở hậu.

- Giá tốt, có thương lượng.

- Miễn MG và TG.","25,5 tỷ",55 m2,"Đường Hoàng Quốc Việt, Phường Nghĩa Đô, Quận Cầu Giấy, Hà Nội",13733009,_,True,Cần bán,1m,True,Nhà mặt tiền,Sổ hồng/ Sổ đỏ,True,0m,4,True,0m,1,---
https://alonhadat.com.vn/ban-nha-6-tang-thong-san-thang-may-mat-pho-thuy-khue-tay-ho-3-mat-thoang-50m-28-ty--13705587.html,"Bán nhà 6 tầng thông sàn thang máy mặt phố Thụy Khuê, Tây Hồ, 3 mặt thoáng, 50m, 28 tỷ.","- Diện tích 50m, 6 tầng, mặt tiền 5.5m, 28 tỷ.

- Nhà bán nằm tại vị trí đắc địa, gần Hồ Tây, giao thông thuận tiện, khu vực nhiều cơ quan văn phòng, kinh doanh sầm uất. Gần các tuyến phố như Hoàng Hoa Thám, Lạc Long Quân, Trích Sài, Nguyễn Đình Thi, Phan Đình Phùng, ...

- Nhà thiết kế 6 tầng thông sàn thang máy, lô góc 3 mặt thoáng, view Hồ Tây thoáng sáng. Nhà hiện đang cho thuê kinh doanh.

- Sổ đỏ vuông đẹp.

- Giá tốt, có thương lượng.

- Miễn MG và TG.",28 tỷ,50 m2,"Đường Thụy Khuê, Phường Thụy Khuê, Quận Tây Hồ, Hà Nội",13705587,_,True,Cần bán,1m,True,Nhà mặt tiền,Sổ hồng/ Sổ đỏ,True,0m,6,True,0m,1,---
https://alonhadat.com.vn/ban-nha-8-tang-thang-may-pho-hoang-quoc-viet-cau-giay-hai-mat-ngo-71m-mt-5-4m-25-ty--13709322.html,"Bán nhà 8 tầng thang máy phố Hoàng Quốc Việt, Cầu Giấy, hai mặt ngõ, 71m, mt 5.4m, 25 tỷ.","- Diện tích 71m, 8 tầng, mặt tiền 5.4m, 25 tỷ.

- Nhà bán nằm tại vị trí đắc địa, ngõ ô tô tránh, vỉa hè, nhà hai mặt ngõ, mặt ngõ sau ô tô sát nhà, khu vực dân trí cao, ở sướng. Gần các tuyến phố như Trần Cung, Xuân Tảo, Nghĩa Đô, Nguyễn Phong Sắc, ..

- Nhà thiết kế 8 tầng thang máy, gara ô tô để 2 chiếc. Chủ ở trên các tầng dưới đang cho thuê kinh doanh.

- Sổ chính chủ, pháp lý chuẩn.

- Giá tốt, có thương lượng.

- Miễn MG và TG.",25 tỷ,71 m2,"Đường Hoàng Quốc Việt, Phường Nghĩa Đô, Quận Cầu Giấy, Hà Nội",13709322,_,True,Cần bán,1m,True,Nhà trong hẻm,Sổ hồng/ Sổ đỏ,True,0m,8,True,0m,1,---
https://alonhadat.com.vn/ban-nha-7-tang-thang-may-pho-doi-can-ba-dinh-ngo-o-to-tranh-no-hau-112m-mt-5-5m--13716195.html,"Bán nhà 7 tầng thang máy phố Đội Cấn, Ba Đình, ngõ ô tô tránh, nở hậu, 112m, mt 5.5m,","- Diện tích 112m, 7 tầng, mặt tiền 5.5m, 24 tỷ.

- Nhà bán nằm tại vị trí đắc địa, ngõ ôtô tránh ba gác, trung tâm Ba Đình, xung quanh bạt ngàn tiện ích, ở sướng. Gần các tuyến phố như Văn Cao, Kim Mã, Hoàng Hoa Thám, Lê Hồng Phong, Ngọc Hà, Liễu Giai, ...

- Nhà mình khổ đất tiêu chuẩn, Gara cất được 3 ô tô, tự xây 7 tầng khung BT, thang máy, thiết kế hợp lý. Có thể vừa ở vừa kinh doanh.

- Chủ là quan chức đã có tuổi do không ở hết nên bán. Bán đi rất tiếc.

- Sổ đỏ nở hậu, pháp lý sạch.

- Giá tốt, có thương lượng.

- Miễn MG và TG.",24 tỷ,112 m2,"Phố Đội cấn, Phường Đội Cấn, Quận Ba Đình, Hà Nội",13716195,_,True,Cần bán,1m,True,Nhà trong hẻm,Sổ hồng/ Sổ đỏ,True,0m,7,True,0m,1,---
https://alonhadat.com.vn/ban-toa-nha-9-tang-thang-may-pho-hoang-hoa-tham-ba-dinh-co-ham-200m-mt-6-5m-45-ty--13635632.html,"Bán tòa nhà 9 tầng thang máy phố Hoàng Hoa Thám, Ba Đình, có hầm, 200m, MT 6.5m, 45 tỷ.","- Diện tích 200m, 9 tầng, mặt tiền 6.5m, 45 tỷ 
 
- Nhà bán tọa lạc tại vị trí đắc điạ, mặt ngõ xe 5 chỗ vào thoải mái, trung tâm quận Ba Đình, khu vực tấp nập người qua lại, kinh doanh sầm uất ngày đêm. Gần các tuyến phố như Ngọc Hà, Phan Đình Phùng, Quán Thánh, Thụy Khuê, Nguyễn Đình Thi, ...

- Tòa thiết kế 9 tầng thang máy, hiện đang cho thuê thu về 250tr/ tháng.

- Chủ chuyển đi nơi khác không quản lí được nên bán .

- Sổ đỏ vuông đẹp, sẵn sàng giao dịch.

- Giá tốt, có thương lượng.

- Miễn MG và TG.",45 tỷ,200 m2,"Đường Hoàng Hoa Thám, Phường Ngọc Hà, Quận Ba Đình, Hà Nội",13635632,_,True,Cần bán,1m,True,Nhà trong hẻm,Sổ hồng/ Sổ đỏ,True,0m,9,True,0m,1,---
https://alonhadat.com.vn/ban-nha-mat-pho-hoang-quoc-viet-cau-giay-gia-hop-ly-vi-tri-dep-210m-mt-7m-79-6-ty-13635757.html,"Bán nhà mặt phố Hoàng Quốc Việt, Cầu Giấy, giá hợp lý, vị trí đẹp, 210m, MT 7m, 79.6 tỷ","- Diên tích 210m, 7 tầng, mặt tiền 7m, 79.6 tỷ.

- Nhà bán nằm tại vị trí đắc địa, ngay trục đường chính, vỉa hè rộng thênh thang, khu vực tấp nập người qua lại, kinh doanh sầm uất ngày đêm. Gần các tuyến phố như Thụy Khuê, Lạc Long Quân, Võ Chí Công, Phạm Văn Đồng, ....

- Nhà thiết kế 7 tầng thang máy, hiện đang cho người quen thuê 130tr/tháng.

- Sổ chính chủ, vuông vắn, nở hậu, sẵn sàng giao dịch.

- Giá hợp lý, có ra lộc.

- Miễn MG và TG.","79,6 tỷ",210 m2,"Đường Hoàng Quốc Việt, Phường Nghĩa Tân, Quận Cầu Giấy, Hà Nội",13635757,_,True,Cần bán,1m,True,Nhà mặt tiền,Sổ hồng/ Sổ đỏ,True,0m,7,True,0m,1,---
https://alonhadat.com.vn/ban-nha-mat-pho-truong-han-sieu-hoan-kiem-vi-tri-dep-115m-mat-tien-4-8m-33-5-ty--13623052.html,"Bán nhà mặt phố Trương Hán Siêu, Hoàn Kiếm, vị trí đẹp, 115m, Mặt Tiền 4.8m, 33.5 tỷ.","- Diện tích 115m, 3 tầng, mặt tiền 4.8m, 33.5 tỷ.
 
- Nhà bán nằm tại vị trí đắc địa, ngay trục đường chính, kinh doanh buôn bán sầm uất. Gần các tuyến phố như Quang Trung, Bà Triệu, Hàm Long, Trần Hưng Đạo, Trần Quốc Toản, ...

- Nhà hiện trạng đang cho thuê kinh doanh.

- Sổ chính chủ, vuông vắn, sẵn sàng giao dịch.

- Giá có ra lộc.

- Miễn MG và TG.","33,5 tỷ",115 m2,"Phố Trương Hán Siêu, Phường Trần Hưng Đạo, Quận Hoàn Kiếm, Hà Nội",13623052,_,True,Cần bán,1m,True,Nhà mặt tiền,Sổ hồng/ Sổ đỏ,True,0m,3,True,0m,1,---
https://alonhadat.com.vn/ban-nha-9-tang-thang-may-pho-ho-tung-mau-cau-giay-doanh-thu-3-ty6-nam-157m-39-ty-13664145.html,"Bán nhà 9 tầng thang máy phố Hồ Tùng Mậu, Cầu Giấy, doanh thu 3 tỷ6/năm, 157m, 39 tỷ","- Diện tích 157m, 9 tầng, mặt tiền 10m, 39 Tỷ.

- Nhà bán nằm tại vị trí đắc địa, nằm sát dưới ga đường sắt trên cao, gần Bến xe Mỹ Đình, lên chút nữa là ra sân bay Nội Bài, khu vực gần các trường đại học, kinh doanh sầm uất. Gần các tuyến phố như Xuân Thủy, Phạm Hùng, Phạm Văn Đồng, Lê Đức Thọ, Nguyễn Cơ Thạch, ...

- Tòa nhà 9 tầng thang máy, dòng tiền 300 triệu/tháng, thu về 3,6 tỷ/năm.

- THIẾT KẾ AN TOÀN: Chung cư được thiết kế ưu việt, NGĂN CÁCH TUYỆT ĐỐI GIỮA CHỖ ĐỂ XE VÀ CẦU THANG THÔNG TẦNG (không bị khói trong trường hợp hỏa hoạn), cógiếng trời lắp sẵn thang thoát hiểm, ngoài ra có đủ các thiết bị chữa cháy từng tầng, có phân hoạch công tơ điện, nước cho từng phòng; Bố trí thêm hệ thống camera từng tầng đảm bảo an ninh tuyệt đối.

- Sổ đỏ chính chủ, pháp lý chuẩn.

- Giá tốt, có thương lượng.

- Miễn MG và TG.",39 tỷ,157 m2,"Đường Hồ Tùng Mậu, Phường Mai Dịch, Quận Cầu Giấy, Hà Nội",13664145,_,True,Cần bán,1m,True,Nhà trong hẻm,Sổ hồng/ Sổ đỏ,True,0m,9,True,0m,1,---
https://alonhadat.com.vn/ban-nha-9-tang-thang-may-pho-tran-thai-tong-cau-giay-doanh-thu-600tr-thang-312m-80-ty-13664170.html,"Bán nhà 9 tầng thang máy phố Trần Thái Tông, Cầu Giấy, doanh thu 600tr/tháng, 312m, 80 tỷ","- Diện tích 312m, 9 tầng, mặt tiền 18m, 79.5 tỷ 

- Nhà bán nằm tại vị trí đắc địa, trung tâm của quận Cầu Giấy, cực gần các trường Đại học, trung tâm giao thương, khu vực tấp nập người qua lại, kinh doanh sầm uất. Gần các tuyến phố như Cầu Giấy, Nguyễn Phong Sắc, Xuân Thủy, Duy Tân, ...

- Tòa nhà thiết kế 9 tầng thang máy, doanh thu 600tr/tháng, thu về 7,2  tỷnăm. Các thiết bị điều hành, an toàn, PCCN, hệ thống phân phối điện, nước, thanh toán phí… được trang bị đầy đủ.

- Sổ đỏ chính chủ, pháp lý chuẩn.

- Giá tốt, có thương lượng.

- Miễn MG và TG.",80 tỷ,312 m2,"Phố Trần Thái Tông, Phường Dịch Vọng Hậu, Quận Cầu Giấy, Hà Nội",13664170,_,True,Cần bán,1m,True,Nhà trong hẻm,Sổ hồng/ Sổ đỏ,True,0m,9,True,0m,1,---
https://alonhadat.com.vn/ban-nha-ngo-gia-tu-hon-6-ty-o-to-tranh-via-he-phan-lo-48m2-5-tang-full-noi-that-13638450.html,Bán Nhà Ngô Gia Tự Hơn 6 tỷ-Ô TÔ TRÁNH-VỈA HÈ-PHÂN LÔ- 48m2-5 TẦNG-Full NỘI THẤT,"Bán Nhà Ngô Gia Tự Hơn 6 tỷ-Ô TÔ TRÁNH-VỈA HÈ-PHÂN LÔ- 48m2-5 TẦNG-Mt 4m Full NỘI THẤT


- Khu vực phân lô đỉnh cao về An Ninh ,dân trí
- Vị trí vô cùng hiếm, giá trị cao
- Nhà 5 tầng, khung cột chắc chắn, chủ tặng toàn bộ nội thất.,
+ Tầng 1: Không gian bếp, vệ sinh, để xe.,
+ Tầng 2: Phòng khách, vệ sinh.,
+ Tầng 3: Phòng ngủ master rộng.,
+ Tầng 4: 2 ngủ, vệ sinh.,
+ Tầng 5: Phòng thờ, sân phơi.,",6 tỷ,48 m2,"Đường Ngô Gia Tự, Phường Đức Giang, Quận Long Biên, Hà Nội",13638450,_,---,Cần bán,8m,---,Nhà mặt tiền,---,---,4m,5,---,12m,4,---
https://alonhadat.com.vn/mua-ban-nha-sai-dong-6-ty-48m2-5-tang-mt4-5m-kinh-doanh-o-to-cuc-hiem-nha-dan-xay-lo-goc-13668180.html,"Mua Bán Nhà Sài Đồng 6 tỷ-48m2-5 tâng,Mt4.5m-KINH DOANH-Ô TÔ-CỰC HIÊM-NHÀ DÂN XÂY-LÔ GOC","Mua Bán Nhà Sài Đồng 6 tỷ-48m2-5 tâng,Mt4.5m-KINH DOANH- Ô TÔ- CỰC HIÊM-NHÀ DÂN XÂY - LÔ GÓC THOÁNG ĐẸP

Vị trí cực đẹp,giao thông thuận tiện ngỏ thông kinh doanh sầm uất
Khu vực Hiến,giá trị dòng tiền ,lãi vốn cao
💵 Thiết kế: ,
+ Nhà dân xây đẹp cẩn thận, thiết kế hợp lý ,
- tầng 1: thông sàn , chủ đang tự kinh doanh.,
- tầng 2: Phòng khách + Bếp + Phòng sinh hoạt chung cả gia đình.,
- tầng 3: phòng 2 ngủ + 2 WC ,
- tầng 4: 1 phòng thờ + (hoặc 1 phòng ngủ 👉 Sau là sân phơi tiểu cảnh .,
- tất Cả các phòng đều có cửa sổ ,
- lô góc thoáng đãng",6 tỷ,48 m2,"Đường Sài Đồng, Phường Sài Đồng, Quận Long Biên, Hà Nội",13668180,_,---,Cần bán,3m,---,Nhà mặt tiền,---,---,"4,5m",4,---,11m,4,---
https://alonhadat.com.vn/mua-ban-co-linh-62m2-4-tang-4-ngu-mat-tien-4m-moi-kinh-koong-chi-4-ty-hon-60tr-m2-13668635.html,"Mua Bán Cổ Linh 62m2- 4 Tầng ,4 Ngủ Mặt tiền 4m- Mới kinh Koong- Chỉ 4 tỷ- hơn 60tr/m2","Mua Bán Nhà Cổ Linh 62m2- 4 Tầng ,4 Ngủ Mặt tiền 4m- Mới kinh Koong- Chỉ 4 tỷ- hơn 60tr/m2-Siêu Rẻ


- Vị trí: Rất đẹp, giao thông thuận tiện ,quốc lộ 5, Cầu Vĩnh Tuy
- Hưởng chọn tiện ích khu vực ( chợ,trường học các cấp,vài bước ra siêu thị eon

- Nhà MỚI TINH 2 thoáng vĩnh viễn xây trên mảnh đất lành nguyên thổ cao ráo SÁNG THOÁNG gồm 4 tầng, ban công & cửa sổ tầng nào cũng có, cầu thang giữa, có cổng & chỗ để xe
- Hướng Đông Nam mát mẻ tuyệt vời, Nhà có tầng thượng rộng tổ chức hoạt động ngoài trời như: sinh nhật, BBQ, uống trà…sướng luôn 
+ T1: Khách, bếp, wc.,
+ T 2,3: Mỗi tầng 2 ngủ + wc. ,
+ T4: 2 sân phơi, chỗ để làm phòng thờ
- Sổ đỏ vuông đẹp nét căng, nở hậu, giao dịch luôn",4 tỷ,62 m2,"Đường Cổ Linh, Phường Long Biên, Quận Long Biên, Hà Nội",13668635,_,---,Cần bán,3m,---,Nhà trong hẻm,---,---,4m,4,---,16m,5,---
https://alonhadat.com.vn/mua-ban-nha-bo-de-hon-6-ty-58m2-5-tang-mt-5-5m-vi-tri-dep-kinh-doanh-o-to-tranh-nha-moi-13673357.html,"Mua Bán Nhà Bồ Đề hơn 6 tỷ-58m2-5 tầng-Mt 5.5m-VỊ TRÍ ĐẸP, KINH DOANH, Ô TÔ TRÁNH, NHÀ MỚI","Mua Bán Nhà Bồ Đề hơn 6 tỷ-58m2-5 tầng-Mt 5.5m-VỊ TRÍ ĐẸP, KINH DOANH, Ô TÔ TRÁNH, NHÀ MỚI, TẶNG FULL NT

- Vị trí: nhà đẹp, ô tô tránh, kinh doanh, không lỗi phong thủy,Giao thông thuận tiện cả 2 cầu chương dương và vỉnh tuy

- Khu vực sầm uất,phát triển và là Lõi của Long Biên vời bạt ngàn tiện ích kèm theo đó là giá trí sống cùng với lãi vốn và dòng tiền ổn định

- Thiết kế chuẩn công năng:,
T1: Gara, phòng làm việc có wc (có thể làm phòng ngủ.,
T2: Khách, bếp,
T3,4: Ngủ Master,
T5: Phòng thờ, tum,
- Sổ đỏ chuẩn",6 tỷ,58 m2,"Phố Bồ Đề, Phường Bồ Đề, Quận Long Biên, Hà Nội",13673357,_,---,Cần bán,6m,---,Nhà mặt tiền,---,---,"5,5m",5,---,11m,3,---
https://alonhadat.com.vn/mua-ban-nha-thach-ban-hon-6-ty-51m2-5-tang-mt-4-6m-o-to-thang-may-cuc-hiem-13673771.html,Mua Bán Nhà THẠCH BÀN hơn 6 tỷ 51m2-5 tầng-Mt 4.6m- Ô TÔ - THANG MÁY- CỰC HIẾM,"Mua Bán Nhà THẠCH BÀN hơn 6 tỷ 51m2-5 tầng-Mt 4.6m- Ô TÔ - THANG MÁY- CỰC HIẾM


- Vị trí lõi thạch Bàn, giao thông thuận tiện tiện ích bạt ngàn
- Khu vực vô cùng giá trị và phát triển, đẳng cấp an sinh, hiêm vô cùng
Tầng 1 khách bếp vs, sân rộng,
Tầng 2,3,4 có 1 vs và 1 ngủ , ban công,
Tầng 5 phòng thờ , phòng kỹ thuật, sân phơi
Sổ đỏ cất két chờ giao dịch",6 tỷ,51 m2,"Đường Thạch Bàn, Phường Thạch Bàn, Quận Long Biên, Hà Nội",13673771,_,---,Cần bán,6m,---,Nhà mặt tiền,---,---,"4,6m",5,---,12m,4,---
https://alonhadat.com.vn/ban-nha-bat-khoi-mat-pho-56m2-mt-5-5m-lo-goc-kinh-doanh-dinh-dan-xay-chi-6-ty-13699041.html,Bán Nhà Bát Khối MẶT PHỐ 56m2-Mt 5.5m-LÔ GÓC-KINH DOANH ĐỈNH-DÂN XÂY-chỉ 6 tỷ,"Bán Nhà Bát Khối MẶT PHỐ 56m2-Mt 5.5m-LÔ GÓC-KINH DOANH ĐỈNH-DÂN XÂY-chỉ 6 tỷ


+ Nhà mặt phố Bát Khối, kinh doanh sầm uất, vỉa hè đá bóng rộng thênh thang,ngõ thông Thạch Bàn, Cổ Linh, gần nhà là trường học, công viên, chợ... ,
+ khu vực Hiếm nhà bán,tiềm năng phát triển vô lượng,( lãi vốn ,dòng tiền cao ngất trời)

+ Nhà lô góc, hình thửa thông số vàng, ba mặt thoáng vĩnh viễn. Bãi gửi xe ô tô cạnh bên.,
+ Nhà dân xây tâm huyết từng viên gạch, 4 tầng thoáng sáng gồm:,
- Tầng 1: Khách, bếp, vệ sinh,
- Tầng 2: 2PN, Vệ sinh,
- Tầng 3: Phòng thờ, PN, vệ sinh,
- Tầng 4: Ban công, 1 phòng làm việc thông.,
✅ Pháp lý: ,
+ Sổ phân lô vuông đẹp trước sau như 1, sổ đỏ cất két, sẵn sàng giao dịch,",6 tỷ,56 m2,"Đường Long Biên, Phường Long Biên, Quận Long Biên, Hà Nội",13699041,_,---,Cần bán,8m,---,Nhà mặt tiền,---,---,"5,5mm",4,---,11m,4,---
https://alonhadat.com.vn/ban-nha-long-bien-61m2-4-ngu-moi-kinh-koong-cach-o-to-tranh-50m-ngo-thong-gia-4-ty-13699107.html,Bán Nhà LOng Biên 61m2-4 NGỦ-MỚI KINH KOONG-CÁCH Ô TÔ TRÁNH 50M-NGÕ THÔNG-già 4 tỷ,"Bán Nhà LOng Biên 61m2-4 NGỦ-MỚI KINH KOONG-CÁCH Ô TÔ TRÁNH 50M-NGÕ THÔNG-già 4 tỷ

Vị trí - Đắc đia  an sinh đỉnh cao hơn 80tr/m2

- Ngõ thông tứ phía, trước nhà ô tô nhỏ đỗ cửa, di chuyển sang phố rất gần. Chỉ mất 5p di chuyển qua trung tâm thành phố. ,
,
- Thiết kế:,
+ Tầng 1: Sân để xe + PK + Bếp + VS. ,
+ Tầng 2: 2 PN + VS Giữa,
+ Tầng 3: 2 PN + VS Giữa,
+ Tầng 4: Sân phơi.,

- Nhà mới hoàn thiện rất đep, chủ mới chỉ việc sách vali về ở

- Sổ đỏ chính chủ",4 tỷ,61 m2,"Đường Long Biên, Phường Long Biên, Quận Long Biên, Hà Nội",13699107,_,---,Cần bán,3m,---,Nhà trong hẻm,---,---,"5,1m",4,---,12m,4,---
https://alonhadat.com.vn/ban-nha-long-bien-58m2-mt-5-2m-lo-goc-2-thoang-o-to-dan-xay-full-noi-that-gia-5-ty-13699927.html,Bán Nhà Long Biên 58m2-Mt 5.2m-LÔ GÓC 2 THOÁNG- Ô TÔ-DÂN XÂY-FULL NỘI THẤT-già 5 tỷ,"Bán Nhà Long Biên 58m2-Mt 5.2m-LÔ GÓC 2 THOÁNG- Ô TÔ-DÂN XÂY-FULL NỘI THẤT-già 5 tỷ


+ Vị trí rất đẹp, ngõ trước nhà ô tô chạy thoải mái, thông các ngả, vài bức ra câu sang phố

+ Khu vực dân trí cao an ninh tốt, giá rẻ nhất long biên
+Nhà 4 tầng lô góc 2 mặt thoáng, xây kiên cố chắc chắn, cực đẹp, nội thất xịn xò.,

- Tầng 1: sân để xe, khách, bếp, WC, sân sau.,
- Tầng 2: 2 phòng ngủ + WC khép kín.,
- Tầng 3: 1 phòng ngủ master hiện đại gồm 1 bể sục và 1 phòng xông hơi.,
- Tầng 4: Phòng thờ sân phơi.,
,
+ Sổ đỏ vuông vắn sẵn sàng giao dịch.,",5 tỷ,58 m2,"Đường Long Biên, Phường Long Biên, Quận Long Biên, Hà Nội",13699927,_,---,Cần bán,3m,---,Nhà trong hẻm,---,---,"5,2m",4,---,11m,4,---
https://alonhadat.com.vn/ban-nha-ngo-gia-tu-biet-thu-gia-8-ty-78m2-mt-7m-lo-goc-oto-tranh-gara-13699966.html,Bán Nhà Ngô Gia Tự BIỆT THỰ già 8 tỷ 78m2-Mt 7m-LÔ GÓC-OTO TRÁNH-GARA,"Bán Nhà Ngô Gia Tự BIỆT THỰ già 8 tỷ 78m2-Mt 7m-LÔ GÓC-ĐƯỜNG OTO TRÁNH-GARA


Biệt Thự dân xây còn đẹp như mới, chủ xác định ở nên được thiết kế và xây dựng rất tâm huyết
- Vị trí đắc địa: ngỏ Ngô Gia Tự thẳng và đẹp, lòng đường oto tránh. Khu vực sầm uất. Đường trước nhà rất rộng, có thể đỗ xe miễn phí ngày đêm

+ Tầng 1: Gara oto, tiểu cảnh, phòng khách, phòng ngủ, wc.
Tầng 2: phòng khách rộng, bếp ăn, phòng ngủ marter, khu tiểu cảnh thưởng trà rất thơ mộng.
Tầng 3: Chia 2 phòng ngủ marter rộng rãi. Cầu thang thiết kế để cuối nhà.

Tầng 4: Phòng thờ, khu để máy giặt và phơi đồ, khu trồng cây để tạo không gian xanh cho căn nhà.",8 tỷ,78 m2,"Đường Ngô Gia Tự, Phường Đức Giang, Quận Long Biên, Hà Nội",13699966,_,---,Cần bán,6m,---,"Biệt thự, nhà liền kề",---,---,7m,4,---,12m,4,---
https://alonhadat.com.vn/ban-nha-thach-ban-65m2-phan-lo-6-tang-dang-cap-thang-may-gara-hon-8-ty-13709509.html,Bán Nhà Thạch Bàn 65m2 PHÂN LÔ-6 TẦNG ĐẲNG CẤP-THANG MÁY-GARA-hơn 8 tỷ,"Bán Nhà Thạch Bàn 65m2 PHÂN LÔ-6 TẦNG ĐẲNG CẤP-THANG MÁY-GARA-hơn 8 tỷ


+ Nhà nằm ở khu vực trung tâm Long Biên phát triển từng ngày từng giờ, khu vực phân lô ô tô vào nhà,giao thông vô cùng thuận tiện
+ Nhà vừa ở, vừa làm kinh doanh văn phòng thì quá lý tưởng

+ Tầng 1: Gara + Bếp + Wc + Khu giếng trời,
+ Tầng 2: PK + sảnh rộng,
+ Tầng 3: 2PN + WC + Ban công,
+ Tầng 4: 2PN + WC + Ban công,
+ Tầng 5: 2 PN + WC + Ban công,
+ Tầng 6: 2 Khu Sân rộng, có cầu thang lên tum nước mái tầng 7.,
+ Nhà có đầy đủ GPXD chuẩn chỉnh, thiết kế trao tay, bao quy hoạch
+ Sổ đỏ hoa hậu vuông đét",8 tỷ,65 m2,"Đường Thạch Bàn, Phường Thạch Bàn, Quận Long Biên, Hà Nội",13709509,_,---,Cần bán,4m,---,Nhà mặt tiền,---,---,"4,5m",5,---,15m,6,---
https://alonhadat.com.vn/ban-nha-pho-hong-tien-48m2-5-tang-mt-5m-o-to-full-noi-that-dep-dan-xay-hon-7-ty-13705369.html,Bán Nhà PHỐ HỒNG TIẾN 48m2-5 tầng- Mt 5m-Ô TÔ- FULL NỘI THẤT ĐẸP-DÂN XÂY-hơn 7 tỷ,"Bán Nhà PHỐ HỒNG TIẾN 48m2-5 tầng- Mt 5m-Ô TÔ- FULL NỘI THẤT ĐẸP-DÂN XÂY-hơn 7 tỷ

- Khu vực hiện nay rất hót , khu vực gần trường quốc tế , uỷ ban - công an phường , chợ trạm y tế .giao thông sang phố chỉ 12 phút
- Vì trí đẹp,hiếm,hót khẳng định giá trị vàng an sinh và lãi vốn
Nhà mới xây thiết kế khá hiện đại chủ tặng hết nội thất

tầng 1 khách bếp vs,
tầng 2.3.4 mỗi tầng 1 ngủ 1 vs,
tầng 5 phòng thờ sân phơi",7 tỷ,48 m2,"Phố Bồ Đề, Phường Bồ Đề, Quận Long Biên, Hà Nội",13705369,_,---,Cần bán,5m,---,Nhà mặt tiền,---,---,5m,5,---,10m,4,---
