url,title,description,price,area,address,Mã tin,Hướng,Phòng ăn,Loại tin,Đường trước nhà,Nhà bếp,Loại BDS,Pháp lý,Sân thượng,Chiều ngang,Số lầu,Chổ để xe hơi,Chiều dài,Số phòng ngủ,Chính chủ,Thuộc dự án
https://alonhadat.com.vn/sieu-pham-don-tet-can-ban-nha-trong-ngo-pho-dang-van-ngu-khu-vuc-trung-tam-an-ninh-tot-13653319.html,"Siêu phẩm đón tết !!! Cần bán nhà trong ngõ phố Đặng Văn Ngữ.Khu vực trung tâm,an ninh tốt","Siêu phẩm đón tết !!! Cần bán nhà trong ngõ phố Đặng Văn Ngữ.Khu vực trung tâm,an ninh tốt,tiện nghi đầy đủ,gần hồ,gần chợ,trường học,bệnh viện...
Chỉ việc vào ở!! Duy nhất 1 căn
Diện tích : 37m2
5 tầng
MẶt tiền :4.2m
Giá : 4.95 tỷ
Để vài xe máy trước nhà thoải mái,chủ xây thiết kế đẹp,tỉ mỉ
Sổ đỏ chính chủ,nở hậu.Chỉ chờ giao dịch","4,95 tỷ",37 m2,"Phố Đặng Văn Ngữ, Phường Phương Liên, Quận Đống Đa, Hà Nội",13653319,_,---,Cần bán,4m,---,Nhà trong hẻm,Sổ hồng/ Sổ đỏ,---,---,5,---,---,3,---,
https://alonhadat.com.vn/o-to-do-cua-ngo-thong-kinh-doanh-dep-nhinh-6-ti-13585440.html,Ô TÔ ĐỖ CỬA  - NGÕ THÔNG - KINH DOANH ĐẸP - NHỈNH 6 TỈ,"Vị trí đẹp: 
- Ô tô đỗ cửa, đường đông dân kinh doanh đỉnh cao vài bước ra phố, gần chợ, trung tâm thương mại
- Nhà mặt ngõ, thông trước sau,mặt tiền siêu đỉnh hàng xóm thân thiện dân trí cao
- Diện tích: 60m2 x 4 tầng,  Sổ đỏ chính chủ, pháp lý sạch.
- Chủ nhà niềm nở, phúc hậu muốn ở khu yên tĩnh hơn nên bán nhà
Miễn môi giới và trung gian..!
Liên hệ Thịnh
(Liên hệ để được tư vấn, xem nhà hoàn toàn miễn phí).
Tôi đang có rất nhiều căn nhà với nhiều phân khúc khác nhau.","6,8 tỷ",60 m2,"220  Đường Hoàng Mai, Phường Mai Động, Quận Hoàng Mai, Hà Nội",13585440,Đông Bắc,True,Cần bán,4m,True,Nhà trong hẻm,Sổ hồng/ Sổ đỏ,True,4m,4,---,---,4,---,
https://alonhadat.com.vn/ban-nha-doi-can-3-buoc-ra-o-to-do-nha-san-o-55m2-gia-6-ty-13529555.html,"Bán nhà Võ Chí Công, 55m2x 3 tầng, giá nhỉnh 5 tỷ","✅ Diện tích 55 m2 x 3 tầng, MT 5.6, Giá 5,3 tỷ
✅ Ngõ theo quy hoạch đường mới sẽ đi ra đường Xuân Tảo.
✅ Vài bước ra đường Xuân Tảo, sát bên là các Trường mầm non Quốc Tế, học viện sinh học và nhiều tiện ích khác.
✅Thiết kế tầng 1 có 2 phòng tách biệt,1 là để xe, cầu thang, 1 là phòng khép kín cho thuê
✅ Chủ nhà là cán bộ viên chức muốn bán sang ở với bố mẹ già tiện trông nom
✅ S.ổ..đ.ỏ chính chủ, pháp lý rõ ràng","5,3 tỷ",55 m2,"Phố Đội cấn, Phường Cống Vị, Quận Ba Đình, Hà Nội",13529555,_,True,Cần bán,3m,True,Nhà trong hẻm,Sổ hồng/ Sổ đỏ,True,"4,5m",4,True,"12,2m",4,---,
https://alonhadat.com.vn/ban-nha-pho-hoang-cau-dong-da-130m-4t-mt5m-12-5-ty-13653280.html,"Bán nhà phố Hoàng Cầu, Đống Đa 130M 4T MT5M 12.5 tỷ","- Bán nhà phố Hoàng Cầu - Đống Đa, vị trí cực đẹp, vài bước chân ra ô tô, giao thông thuận tiện, vài bước chân ra hồ Hoàng Cầu, tiếp giáp 1 số tuyến đường như Ô Chợ Dừa, Yên Lãng, Hào Nam, Thái Hà, Nguyễn Lương Bằng, La Thành..
- Thiết kế cơ bản:
+ Tầng 1: sân rộng để xe, phòng khách, bếp
+ Tầng 2: 2 phòng ngủ + wc
+ Tầng 3: 2 phòng ngủ + wc
+ Tầng 4: phòng thờ, sân phơi
- Sổ đỏ vuông vắn, sẵn sàng giao dịch
- Xem nhà liên hệ Cẩm Nhung (vui lòng gọi trực tiếp)","12,5 tỷ",130 m2,"Phố Hoàng Cầu, Phường Ô Chợ Dừa, Quận Đống Đa, Hà Nội",13653280,_,---,Cần bán,3m,---,Nhà trong hẻm,Sổ hồng/ Sổ đỏ,---,5m,4,---,26m,4,---,
https://alonhadat.com.vn/ban-nha-ngo-o-to-pho-nguyen-van-cu-long-bien-ha-noi-13653252.html,BÁN NHÀ NGÕ Ô TÔ PHỐ NGUYỄN VĂN CỪ LONG BIÊN HÀ NỘI,"Bán nhà mơi ngõ ô tô tránh nguyên văn cừ long biên hà nội
Tổng diện tích 36m2 xây mới 5 tầng mặt tiền 4m khép kín full nội thất.
Tiện ích xung quanh ngập tràn gần quần thể  prever trường cấp 1 và 2 ngọc lâm,trường quốc tế wellspeng cấp 2 bồ đề công viên lớn cách bệnh viện Tâm anh 300m","5,5 tỷ",36 m2,"Đường Nguyễn Văn Cừ, Phường Bồ Đề, Quận Long Biên, Hà Nội",13653252,_,True,Cần bán,3m,True,Nhà trong hẻm,Sổ hồng/ Sổ đỏ,True,4m,5,True,10m,3,---,
https://alonhadat.com.vn/ban-nha-mat-ngo-34-hoang-cau-70m-mt-6m-kinh-doanh-ngo-oto-2-thoang-gia-15-ty-13653195.html,BÁN NHÀ MẶT NGÕ 34 HOÀNG CẦU_70M MT 6M_KINH DOANH_NGÕ OTO_2 THOÁNG_GIÁ 15 TỶ,"- Nhà mặt ngõ to như phố, vị trí cực đẹp, kinh doanh đa dạng, sầm uất.
- Khu phố trung tâm quận, tiện ích xung quanh ngập tràn.
- Thiết kế nhà xây khung cột chắc chắn
    + Tầng 1 : kinh doanh, wc, tầng lửng. 
    + Tầng 2 : hai phòng ngủ + wc .
    + Tầng 3 : hai phòng ngủ + wc. 
    + Tầng 4 : sân phơi + bếp
- Sổ đỏ chính chủ, sẵn sàng giao dịch.
- Liên hệ: Hải Yến, miễn trung gian.",15 tỷ,70 m2,"Phố Hoàng Cầu, Phường Ô Chợ Dừa, Quận Đống Đa, Hà Nội",13653195,_,---,Cần bán,5m,---,Nhà trong hẻm,---,---,---,4,---,---,4,---,
https://alonhadat.com.vn/ban-nha-rieng-pho-hoang-cau-dong-da-dt-32m2-4-tang-mt-3-7m-gia-4-5-ty-13653164.html,"Bán nhà riêng phố Hoàng Cầu, Đống Đa  DT 32m2 * 4 tầng * MT 3,7m . Giá 4,5 tỷ","+ Vị trí: Mặt ngõ 3m, ba gác đua, ô tô gần nhà, trước nhà view thoáng vĩnh viễn
+ Khu vực gần trường học các cấp, gần chợ, siêu thị… gần hồ thoáng mát,
+ Dân trí, an ninh tốt
+ Thiết kế nhà 4 tầng KCBT cực kỳ chắc chắn
- T1: phòng khách, bếp,
- T2,3: 2 phòng ngủ/tầng, vệ sinh giữa,
- T4: phòng thờ, sân phơi,
+ Sổ đỏ chính chủ sẵn sàng giao dịch","4,5 tỷ",32 m2,"Phố Hoàng Cầu, Phường Ô Chợ Dừa, Quận Đống Đa, Hà Nội",13653164,_,---,Cần bán,3m,---,Nhà trong hẻm,---,---,4m,4,---,---,4,---,
https://alonhadat.com.vn/ban-nha-kim-giang-hoang-mai-31m-mt3-1m-nha-dan-xay-thiet-ke-4-tang-gan-pho-13653130.html,"Bán Nhà Kim Giang-Hoàng Mai 31m MT3,1m Nhà dân xây thiết kế 4 tầng gần phố","Bán Nhà Kim Giang-Hoàng Mai 31m MT3,1m Nhà dân xây thiết kế 4 tầng gần phố

NHà thiết kế chắc chắn, nhà cách ngõ ô tô gần

Nhà ngõ thông thoáng tiện ích đầy đủ

Ngõ gần ngay cầu lủ - gần ngã tư sở ngõ thông ra KĐT Đại Kim

Nhà anh chị về chỉ cho mấy thùng sơn là đẹp long lanh

Nhà thiết kế 4 ngủ đủ rộng rãi

Sổ đỏ vuông vắn pháp lý sẵn sàng giao dịch

Mọi Chi tiết liên hệ em Nam để em gửi sổ và tư vấn thêm chọn nhà phù hợp với anh chị nhé","3,45 tỷ",31 m2,"Đường Kim Giang, Phường Đại Kim, Quận Hoàng Mai, Hà Nội",13653130,_,True,Cần bán,2m,True,Nhà trong hẻm,Sổ hồng/ Sổ đỏ,True,"3,1m",4,---,---,4,---,
https://alonhadat.com.vn/ban-san-van-phong-thuong-mai-dich-vu-toa-pcc1-nga-3-ba-la-quan-ha-dong-13653226.html,"Bán sàn văn phòng, thương mại dịch vụ tòa PCC1 ngã 3 Ba La quận Hà Đông","Bán sàn văn phòng, thương mại dịch vụ toà nhà PCC1 ngã 3 Ba La quận Hà Đông

Diện tích chào bán: 139m2, 600m2 
Giá bán dự kiến: 21 triệu/m2
+ Sổ đỏ sử dụng lâu dài, cực hiếm (hầu hết sàn văn phòng sổ đỏ 50 năm).
+ Mặt tiền trải dài, cực thoáng. 
+ Thích hợp sử dụng làm showroom, trung tâm đào tạo, công ty quy mô lớn
+ Lối đi khu văn phòng riêng biệt với khu dân cư.
+ Làm viêc ngoài giờ thoải mái.
+ Hệ thống bảo vệ 24/24, chỗ gửi xe rộng rãi.

Liên hệ tư vấn hỗ trợ mua văn phòng: Em Phương
Xin chân thành cảm ơn!",21 triệu / m2,600 m2,"Đường Ba La, Phường Phú Lương, Quận Hà Đông, Hà Nội",13653226,_,---,Cần bán,---,---,Văn phòng,---,---,---,---,---,---,---,---,
https://alonhadat.com.vn/co-hoi-dau-tu-doc-dao-khi-lai-suat-ngan-hang-giam-13653230.html,CƠ HỘI ĐẦU TƯ ĐỘC ĐÁO KHI LÃI SUẤT NGÂN HÀNG GIẢM,"Thông tin căn hộ:

- Diện tích: 80m2, 2 phòng ngủ, 2 phòng tắm.
- Nội thất cao cấp, thiết kế hiện đại.
- Tầng cao, tạo ra view tuyệt vời về thành phố.

Tiện ích nổi bật:

- Hồ bơi trên tầng thượng với tầm nhìn toàn cảnh.
- Phòng tập gym và spa đẳng cấp.
- An ninh 24/7 và bãi đỗ xe riêng.

Vị trí đắc địa:

- Gần trung tâm mua sắm và giải trí.
- Thuận tiện di chuyển đến các khu vực lân cận.

Giá bán chỉ: 3 tỷ 800 triệu (thương lượng).

Đừng bỏ lỡ cơ hội sống đẳng cấp này! Liên hệ ngay để biết thêm chi tiết và đặt lịch hẹn xem nhà.","3,85 tỷ",80 m2,"Đường Trần Thủ Độ, Xã Tứ Hiệp, Huyện Thanh Trì, Hà Nội",13653230,_,---,Cần bán,---,---,Căn hộ chung cư,---,---,---,9,---,---,3,---,"Nhà ở xã hội IEC Complex Tứ Hiệp (IEC Tứ Hiệp, IEC Residences) (xem chi tiết dự án)"
https://alonhadat.com.vn/minh-khai-54m-4-tang-mat-tien-4m-2-thoang-gan-o-to-gia-chi-hon-5-ty-13458208.html,"Minh Khai 54m 4 tầng, Mặt tiền 4m, 2 thoáng, Gần ô tô, Giá chỉ hơn 5 tỷ","Minh Khai 54m 4 tầng, Mặt tiền 4m, 2 thoáng, Gần ô tô, Giá chỉ hơn 5 tỷ
-Nhà xây dựng 4 tầng khung cột cực kỳ kiên cố
-Mặt tiền 4m
-2 mặt thoáng
-Cách đường ô tô chỉ 12m, đường trước nhà rộng thoáng
-Dân trí cao, an ninh tốt
-Sổ vuông đẹp, mua bán sang tên ngay
-Giá chỉ hơn 5 tỷ một chút
-Xem nhà gọi ngay: Mr. Hiếu",5 tỷ,54 m2,"Đường Minh Khai, Phường Minh Khai, Quận Hai Bà Trưng, Hà Nội",13458208,_,True,Cần bán,"2,5m",True,Nhà trong hẻm,Sổ hồng/ Sổ đỏ,True,4m,4,True,"13,5m",5,---,
https://alonhadat.com.vn/cho-nam-du-36m-4-tang-nha-dep-o-ngay-gia-chi-2-6-ty-13488980.html,"Chợ Nam Dư, 36m 4 tầng, Nhà đẹp, Ở ngay, Giá chỉ 2.6 tỷ","Chợ Nam Dư, 36m 4 tầng, Nhà đẹp, Ở ngay, Giá chỉ 2.6 tỷ
-Nhà xây 4 tầng khung cột kiên cố, thiết kế hiện đại, nhà mới chỉ việc dọn về ở
-Thiết kế cầu thang giữa mỗi tầng 2 phòng ngủ
-Ngõ yên tĩnh và cực kỳ an ninh
-sổ đỏ riêng biệt, công chứng sang tên ngay
-Giá cực rẻ chỉ 2.6 tỷ có thương lượng
-Xem nhà gọi ngay: Mr. Hiếu","2,6 tỷ",36 m2,"Đường Nam Dư, Phường Lĩnh Nam, Quận Hoàng Mai, Hà Nội",13488980,_,True,Cần bán,2m,True,Nhà trong hẻm,Sổ hồng/ Sổ đỏ,True,"3,6m",4,True,10m,5,---,
https://alonhadat.com.vn/dau-linh-nam-52m-4-tang-ngo-rong-nong-15m-ra-o-to-tranh-chi-hon-4-ty-13375887.html,"Đầu Lĩnh Nam 52m 4 tầng, Ngõ rộng - nông, 15m ra ô tô tránh, chỉ hơn 4 tỷ","Đầu Lĩnh Nam 52m 4 tầng, Ngõ rộng - nông, 15m ra ô tô tránh, chỉ hơn 4 tỷ
-Chủ nhà kiến trúc sư tự thiết kế và xây nhà, khung bê tông cốt thép cực kỳ kiên cố
-Diện tích 52m xây dựng 4 tầng, cầu thang giữa, mỗi tầng 2 phòng ngủ
-Mặt tiền 4m
-Ngõ to, trước nhà xe ba gác tránh xe máy, xe máy quay đầu thoải mái
-Vị trí đẹp, cực kỳ nông chỉ 15m ra mặt đường ô tô tránh
-Nhà còn mới, mua nhà dọn đồ vào ở ngay
-Sổ đỏ chính chủ giao dịch ngay, Sổ vuông đẹp, mặt tiền và hậu đều 4m
-Giá chỉ 4.88 tỷ (có bớt nhiệt tình với người mua thiện chí)
-Xem nhà liên hệ: Mr. Hiếu",4 tỷ,52 m2,"Đường Lĩnh Nam, Phường Mai Động, Quận Hoàng Mai, Hà Nội",13375887,_,True,Cần bán,3m,True,Nhà trong hẻm,Sổ hồng/ Sổ đỏ,True,4m,4,True,13m,4,---,
https://alonhadat.com.vn/bo-ra-hon-4-ty-so-huu-ngay-can-ccmn-37m-5-tang-dong-tien-hon-300-trieu-nam-13372556.html,"Hơn 4 tỷ sở hữu ngay căn CCMN 37m 5 tầng, dòng tiền hơn 300 triệu/năm","Hơn 4 tỷ sở hữu ngay căn CCMN 37m 5 tầng, dòng tiền hơn 300 triệu/năm
-Diện tích 37m xây mới 5 tầng khung bê tông cốt thép cực kỳ kiên cố
-Thiết kế 5 phòng cực rộng và thoáng, nội thất Vip, khai thác cho thuê dòng tiền hơn 300 triệu/năm
-Vị trí cưc đắc địa, thuận tiện kết nối đến các trường Đại học Bách Khoa, Kinh Tế Quốc Dân, Xây Dựng, và kết nối đến Bến xe Giáp Bát đi các tỉnh
-Cơ hội cực kỳ hiếm trên thị trường, với tài chính 4 tỷ vẫn có thể sở hữu tòa CCMN và khai thác căn hộ dòng tiền
-Căn nhà cũng hoàn toàn có thể sử dụng cho mục đích ở của hộ gia đình, hoặc kết hợp vừa ở vừa kinh doanh
-Sổ đỏ chính chủ giao dịch ngay
-Xem nhà liên hệ: Mr. Hiếu",4 tỷ,37 m2,"Đường Giải Phóng, Phường Đồng Tâm, Quận Hai Bà Trưng, Hà Nội",13372556,_,True,Cần bán,"2,5m",True,Nhà trong hẻm,Sổ hồng/ Sổ đỏ,True,4m,5,True,9m,5,---,
https://alonhadat.com.vn/15-4-ty-ban-nha-le-van-luong-hoang-ngan-76m-5-tang-phan-lo-o-to-vao-nha-kinh-doanh-10690794.html,15.4 Tỷ Bán nhà Lê Văn Lương Hoàng Ngân 76m 5 tầng phân lô ô tô vào nhà kinh doanh,"15.4 Tỷ Bán nhà Lê Văn Lương Hoàng Ngân 76m 5 tầng phân lô ô tô vào nhà kinh doanh
Bán nhà Láng Hạ - Lê  Văn Lương – Hoàng Ngân Cầu Giấy Hà Nội 76m2 xây 5 tầng, thoáng hai mặt trước và sau, co sắn ô chờ lắp thang máy. Nhà được chủ nhà thuê thiết kế, chủ tự xây dựng khung cột bê tông cốt thép chắc chắn, với hai mặt thoáng trước và thoáng sau, nên các phòng trong nhà tràn ngập ánh sáng khí tươi, vào nhà vô cùng thoáng đãng. Móng nhà kết cấu có thể lên thành 7 tầng có sắn ô chờ lắp đặt thang máy. Nhà đầy đủ tiện ích trường học gần nhà trẻ em đi bộ đi học, Chợ truyền thống cách nhà vài bước chân, siêu thị tạp hóa tiện ích đây đủ, nhà vừa ở vừa kinh doanh buôn bán. Từ Nhà đến trung tâm thành phố rất tiện lợi, đi ô tô  theo trục Hoàng Ngân – lê Văn Lương – Láng Hạ,. Nhà ngay gần Ngã tư sở. Khu vực dân trí cao, an ninh đảm bảo, văn minh. Nội thất đầy đủ tiện nghi Điều hòa nóng lạnh thiết bị vệ sinh, tủ bếp…vv chỉ việc tới ở kinh doanh ngay. Xung quanh nhà là hồ điều hòa không khi mát mẻ trong lành, thuận lới đạp xe đi bộ tập thể dục sáng chiều.
 Bác Chủ Nhà là Cán Bộ lãnh đạo nay nghỉ hưu chuyển vê Khu biệt thự Nghỉ dưỡng 4ha Ba vi vui sống với cây rừng. Các con đều công tác Ngoại Giao ở Sai Gòn – Đà Nẵng. Nên bán nhà này đi ạ. CHủ nhà tâm huyết với ngôi nhà nên tìm người có tâm mua nhà thiện chí tặng lại toàn bộ nội thất chỉ mang những kỷ vật cá nhân đi
Nhược điểm: Nhà chưa lắp đặt thang máy
Sổ đỏ chính chủ vuông đẹp nở hậu sẵn sàng giao dịch.
Giá bán 15.4 tỷ 76m2 nhà  5 tầng phân lô ô tô 7 chỗ vào nhà  đầy đủ tiện nghi ở ngay. Giá  có thương lượng, Liên hệ trước Em Hưng- để được mở cửa xem trong nhà. Hiếm có căn nhà khu vức dân trí cao thuận lợi giao thông. Lưu ý Không tiếp môi giới trung gian. Có hỗ trợ vay ngân hang 70% giá trị. Mong sớm tìm được chủ nhân với ngôi nhà ạ","15,4 tỷ",76 m2,"Phố Hoàng Ngân, Phường Nhân Chính, Quận Thanh Xuân, Hà Nội",10690794,_,---,Cần bán,12m,---,Nhà mặt tiền,Sổ hồng/ Sổ đỏ,---,5m,5,---,15m,6,---,
https://alonhadat.com.vn/16-5-ty-50m-8-tang-thang-may-phan-lo-via-kinh-doanh-oto-vao-nha-ban-nha-hoan-cau-dong-da-12654057.html,16.5 tỷ 50m 8 tầng thang máy phân lô vỉa kinh doanh ôtô vào nhà Bán Nhà Hoàn Cầu ĐỐng Đa,"16.5 tỷ 50m 8 tầng thang máy phân lô vỉa kinh doanh ôtô vào nhà Bán Nhà Hoàn Cầu ĐỐng Đa
 Bán Nhà Hoàn Cầu Đống Đa – Trần Quang Diệu, Nhà 50 m2 xây 8 tầng thang máy nhập khẩu  phân lô vỉa hè ô tô vào nhà Kinh doanh buôn bán nhà mới đẹp. Nhà đỗ được 2 xe 7 chỗ thoải mái thêm ô tô nhỏ + xe máy.
 Vị trí nhà  khu phân lô ô bàn cở đường  vỉa hè đều ô tô tránh,Gần nhà là công viên cây xanh – Hồ điều hòa không khi mát lành, không bị ồn ào khói bụi đô thị, rất thuận lợi tập thể dục chạy bộ đạp xe dạo ven hồ. Khu Vực Hoàn Cầu nổi danh đất nhân kiệt.
Tiện ích: Nhà gần các trường PTTH Hoàn Cầu-  Đại Học Mỹ Thuật – Đại Học Văn Hóa- Học Viện Ngân Hàng – Học viện âm Nhạc Quốc Gia Việt Nam – TRương Song Ngữ..vvv
 Nhà mình cần bán là lô góc nhà rất thoáng sáng, thiết kế hợp lý. Tầng 1 để Gara ô tô kinh doanh buôn bán thông tầng từ tầng 1 đến tầng 4. Từ tầng 5 đến tang 8 có phòng ngủ khép kín + bếp ăn phòng tiếp khách, không gian phòng thờ cúng.Sân thượng tum là sân cây cảnh cfe. Các phòng ngủ đầy đủ nội thất tiện nghi, điều hòa nóng lạnh, thiết bị vế sinh TOTO nhập khẩu – điều hòa Daikin- nội thất với gỗ thịt rất đẹp ạ
 Nhà có giao thông thuận tiện đi lại thuận tiện, ô tô tránh quay đầu thoải mái. Đường trước nhà rộng thông thoáng vỉa hè . Nhà đẹp tiện nghi đầy đủ ở ngay..
Sổ đỏ chính chủ vuông đẹp sẵn sàng giao dịch.
Giá bán 16.5 tỷ có thường lượng nhà 50 m2 nhà 8 tầng thang máy phân lô vỉa hè 2ô tô vào nhà đường trước nhà ô tô tránh quay đầu, Nhà mới đẹp nội thất đầy đủ tiện nghi nhập khẩu nhà đẹp ở ngay
Liên hệ Em Hưng-09-65.343.816- để được mở cửa xem trong nhà. Không tiếp môi giới trung gian.","16,5 tỷ",50 m2,"Phố Hoàng Cầu, Phường Ô Chợ Dừa, Quận Đống Đa, Hà Nội",12654057,_,True,Cần bán,8m,True,Nhà mặt tiền,Sổ hồng/ Sổ đỏ,True,7m,8,True,9m,6,---,
https://alonhadat.com.vn/4-8-ty-35m-5-tang-phan-lo-o-to-no-hau-nha-moi-depban-nha-nga-tu-so-thanh-xuan-11612413.html,4.8 tỷ 35m 5 tầng phân lô ô tô nở hậu Nhà mới đẹpBán Nhà Ngã Tư Sở Thanh Xuân,"4.8 tỷ 35m 5 tầng phân lô ô tô nở hậu Nhà mới đẹpBán Nhà Ngã Tư Sở Thanh Xuân
 Bán Nhà Ngã Tư Sở Thanh Xuân 35 m2 xây 5 Tầng mặt tiền rộng, đường trước nhà ô tô. Nhà mới xây được vài năm khung cột bê tông chắc chắn. Tầng 1 là khách bếp, các tầng trên gồm 3 phòng ngủ khép kín + phòng thờ sân phơi. Nhà có  Vị trí nhà mặt đường ô tô tránh, nhà rất thoáng sáng, thiết kế tỉ mỉ hài hòa kiến trúc với không gian. Thi công cẩn thận khung cột bê tông cốt thép nhà xây rất chắc chắn,. Các phòng ngủ đầy đủ nội thất tiện nghi, điều hòa nóng lạnh, thiết bị vế sinh điện nước hiện đại đầy đủ. Sổ đỏ chính chủ nở hậu
Nhược điểm: không thiết kế ô tô vào nhà ( gần nhà có bãi gửi xe ô tô 24/24)
Sổ đỏ chính chủ vuông đẹp sẵn sàng giao dịch.
Giá bán 4.8 tỷ có thường lượng nhà 35 m2 nhà 5 tầng đường trước nhà ô tô, Nhà mới đẹp nội thất đầy đủ tiện nghi ở ngay
Liên hệ Em Hưng-09-65.343.816- để được mở cửa xem trong nhà. Không tiếp môi giới trung gian.","4,8 tỷ",35 m2,"Phố Khương Hạ Mới, Phường Khương Đình, Quận Thanh Xuân, Hà Nội",11612413,_,---,Cần bán,5m,---,Nhà trong hẻm,Sổ hồng/ Sổ đỏ,---,4m,5,---,10m,4,---,
https://alonhadat.com.vn/12-8-ty-60m-mt-rong-6-tang-thang-may-phan-lo-o-to-vao-nha-kd-ban-nha-nga-tu-so-thanh-xuan-11612047.html,12.8 tỷ 60m MT rộng 6 tầng thang máy phân lô ô tô vào nhà KD Bán Nhà Ngã Tư Sở Thanh Xuân,"12.8 tỷ 60m MT rộng 6 tầng thang máy phân lô ô tô vào nhà KD Bán Nhà Ngã Tư Sở Thanh Xuân
 Bán Nhà Ngã Tư Sở Thanh Xuân 60 m2 xây 6 Tầng thang máy nhập khẩu mặt tiền rộng mặt phố kinh doanh buôn bán. Nhà 6 tầng  xây mới đẹp thang máy nhập khẩu.  Mặt tiền rộng kinh doanh thuận lợi, đường trước nhà ô tô tránh nhau. Nhà mới xây các tầng 1 đến tầng 3 thống sàn đang cho công ty thuê cả nhà làm văn phòng. Ga ra tầng 1 đỗ được 2 xe 7 chỗ thoải mái thêm ô tô nhỏ + xe máy, từ tầng 4 đến tầng 6 là các phòng ngủ khép kín, hoặc để làm phòng làm việc công ty đều thuận lợi. Sân thượng và bếp ăn khu café ngoài trời rất đẹp.  Vị trí nhà mặt phố kinh doanh đường ô tô tránh, nhà rất thoáng sáng, thiết kế tỉ mỉ hài hòa kiến trúc với không gian. Thi công cẩn thận khung cột bê tông cốt thép nhà xây rất chắc chắn, thang máy chạy êm ái. Các phòng ngủ đầy đủ nội thất tiện nghi, điều hòa nóng lạnh, thiết bị vế sinh điện nước hiện đại đầy đủ. Cửa chính 2 lớp ngoài cửa thép cuấn + cửa gỗ đảm bảo an toàn hiện đại thẩm mỹ. 
 Nhà có giao thông thuận tiện đi lại thuận tiện, ô tô tránh quay đầu thoải mái. Đường phố trước nhà rộng rãi mặt tiền nhà siều rông . Nhà đẹp tiện nghi đầy đủ ở ngay.
Sổ đỏ chính chủ vuông đẹp sẵn sàng giao dịch.
Giá bán 12.8 tỷ có thường lượng nhà 60 m2 nhà 6 tầng thang máy phân lô 2 ô tô vào nhà kinh doanh buôn bán, đường trước nhà ô tô tránh quay đầu, Nhà mới đẹp nội thất đầy đủ tiện nghi nhập khẩu nhà đẹp ở ngay
Liên hệ Em Hưng-09-65.343.816- để được mở cửa xem trong nhà. Không tiếp môi giới trung gian.","12,8 tỷ",62 m2,"Phố Hoàng Văn Thái, Phường Khương Đình, Quận Thanh Xuân, Hà Nội",11612047,_,True,Cần bán,16m,True,Nhà mặt tiền,Sổ hồng/ Sổ đỏ,True,"5,2m",6,True,12m,5,---,
https://alonhadat.com.vn/12-5-ty-40m-6-tang-thang-may-ban-nha-thai-ha-hoan-cau-mat-pho-kinh-doanh-oto-tranh-10510874.html,12.5 tỷ 40m 6 tầng thang máy Bán Nhà Thái Hà Hoàn cầu mặt phố kinh doanh ôtô tránh,"12.5 tỷ 40m 6 tầng thang máy Bán Nhà Thái Hà Hoàn cầu mặt phố kinh doanh ôtô tránh
  Bán Nhà phố Hoàn cầu – Thái Hà – Yên Lãng, nhà 40m2 xây 6 tầng Thang Máy mặt phố kinh doanh ô tô vào nhà vỉa hè rộng. Phố Thái Hà Nổi tiếng kinh doanh buôn bán các loại mặt hang, đường trước nhà hai chiêu ô tô, Trục đường Thái Hà – Yên Lãng – Hoàn Cầu giao thông thuận tiện các siêu thị điện máy , cửa hang kinh doanh đầy đủ.
 Nhà mình bán là mặt phố kinh doanh buôn bán, Với thiết kế hiện đại hợp lý để thông tầng thuận tiện kinh doanh, Mỗi tầng 1 phòng rộng + 1wc khép kín còn lại là diện tích hành láng thang bộ + Thang Máy. Nhà mới đẹp long lanh, thuận tiện vừa ở vừa kinh doanh.Tầng 1, Tầng 2 kinh doanh ,từ Tầng 3 đến tầng 6 là phòng khách bếp – phòng ngủ khép kín- Phòng thờ sân phơi. Nhà chủ nhà tự xây dựng rất cẩn thận chắc chắn khung cột bê tông cốt thép chịu lực. Thiết bị vệ sinh nóng lạnh đầy đủ, nội thất tiện nghi đầy đủ. Người mua về ở kinh doanh được luôn ạ
Sổ đỏ chính chủ vuông đẹp nở hậu 5cm sẵn sàng giao dịch.
Giá bán 12.5 tỷ có thường lượng 40m2 nhà  6 tầng thang máy mặt phố kinh doanh Liên hệ Em Hưng-09-65.343.816- để được mở cửa xem trong nhà. Không tiếp môi giới trung gian.","12,5 tỷ",40 m2,"Phố Thái Hà, Phường Láng Hạ, Quận Đống Đa, Hà Nội",10510874,_,True,Cần bán,16m,True,Nhà mặt tiền,Sổ hồng/ Sổ đỏ,True,4m,6,True,10m,4,---,
