https://alonhadat.com.vn/6-5-ty-35m-5-tang-nha-dep-phan-lo-o-to-vao-nha-kd-ban-nha-nga-tu-so-thanh-xuan-12056838.html,6.5 tỷ 35m 5 tầng Nhà đẹp phân lô ô tô vào nhà KD Bán Nhà Ngã Tư Sở Thanh Xuân,"6.5 tỷ 35m 5 tầng Nhà đẹp phân lô ô tô vào nhà KD Bán Nhà Ngã Tư Sở Thanh Xuân
 Bán Nhà Ngã Tư Sở Thanh Xuân 35 m2 xây 5 Tầng Phân lô ô tô vào nhà Đường trước nhà ô tô tránh nhau. Nhà mới xây rất đẹp. Ga ra tầng 1 ô tô + xe máy+ Bếp  từ tầng 2 đến tầng 5 là các phòng khách và phòng ngủ khép kín, sân thượng phòng thờ có nhiều cây cảnh rất đẹp.  Vị trí nhà mặt phố kinh doanh đường ô tô tránh, nhà rất thoáng sáng, thiết kế tỉ mỉ hài hòa kiến trúc với không gian. Thi công cẩn thận khung cột bê tông cốt thép nhà xây rất chắc chắn,. Các phòng ngủ đầy đủ nội thất tiện nghi, điều hòa nóng lạnh, thiết bị vế sinh điện nước hiện đại đầy đủ. Cửa chính 2 lớp ngoài cửa thép cuấn + cửa gỗ đảm bảo an toàn hiện đại thẩm mỹ. 
 Nhà có giao thông thuận tiện đi lại thuận tiện, ô tô tránh quay đầu thoải mái. Đường phố trước nhà rộng rãi mặt tiền nhà siều rông . Nhà đẹp tiện nghi đầy đủ ở ngay.
Sổ đỏ chính chủ vuông đẹp sẵn sàng giao dịch.
Giá bán 6.5 tỷ có thường lượng nhà 35 m2 nhà 5 tầng phân lô  ô tô vào nhà kinh doanh buôn bán, đường trước nhà ô tô tránh quay đầu, Nhà mới đẹp nội thất đầy đủ tiện nghi nhập khẩu nhà đẹp ở ngay
Liên hệ Em Hưng-09-65.343.816- để được mở cửa xem trong nhà. Không tiếp môi giới trung gian.","6,5 tỷ",35 m2,"Phố Hoàng Văn Thái, Phường Khương Đình, Quận Thanh Xuân, Hà Nội",12056838,_,True,Cần bán,8m,True,Nhà mặt tiền,---,True,4m,5,True,9m,4,---,
