url,title,description,price,area,address,Mã tin,Hướng,Phòng ăn,Loại tin,Đường trước nhà,Nhà bếp,Loại BDS,Pháp lý,Sân thượng,Chiều ngang,Số lầu,Chổ để xe hơi,Chiều dài,Số phòng ngủ,Chính chủ
https://alonhadat.com.vn/sieu-vip-nha-tu-dinh-85m-4t-mt5m-no-hau-gara-o-to-vong-quanh-kd-vp-sat-du-an-him-lam--13548650.html,"SIÊU VIP NHÀ TƯ ĐÌNH 85M 4T MT5M, NỞ HẬU, GARA, Ô TÔ VÒNG QUANH, KD VP, SÁT DỰ ÁN HIM LAM.","+ Nằm tại khu phân lô quân đội A38, an ninh đảm bảo tuyệt đối, trước nhà ô tô tránh, gần khu biệt thự Minh Tâm, The Authentic Haseko, chung cư Northern Diamond.
+ 200m tới sân golf Long Biên, cầu Vĩnh Tuy, đón đầu giá trị tương lai.
+ Nhà thiết kế các phòng đều thoáng sáng, có bố trí ô chờ thang máy.
+ Sổ đỏ nở hậu, giao dịch ngay.
+ Liên hệ: E Huyền (Chuyên nhà đất đẹp Long Biên): tư vấn miễn phí, hỗ trợ mọi thủ tục nhanh gọn.","10,3 tỷ",85 m2,"Đường Tư Đình, Phường Long Biên, Quận Long Biên, Hà Nội",13548650,_,---,Cần bán,0m,---,Nhà trong hẻm,---,---,5m,4,---,---,4,---
https://alonhadat.com.vn/nhinh-2-ty-so-huu-nha-loi-pho-ngoc-lam-3-buoc-ra-pho-sat-duong-40m-hong-tien-ngoc-thuy--12840054.html,"NHỈNH 2 TỶ SỞ HỮU NHÀ LÕI PHỐ NGỌC LÂM, 3 BƯỚC RA PHỐ,SÁT ĐƯỜNG 40M HỒNG TIẾN - NGỌC THỤY.","+ Vị trí hiếm nhà bán, trung tâm phố Ngọc Lâm đông dân, kinh doanh sầm uất ngày đêm.
+ Trường học các cấp, chợ, bệnh viện cách nhà 50m, tiện ích bạt ngàn.
+ Nhà thiết kế đầy đủ công năng.
+ Sổ đỏ chính chủ, giao dịch ngay.
+ Liên hệ: E Huyền (Chuyên nhà đất đẹp Long Biên): tư vấn miễn phí, hỗ trợ mọi thủ tục nhanh gọn.","2,4 tỷ",20 m2,"Đường Ngọc Lâm, Phường Ngọc Lâm, Quận Long Biên, Hà Nội",12840054,_,---,Cần bán,0m,---,Nhà trong hẻm,---,---,"3,5m",4,---,---,3,---
https://alonhadat.com.vn/cuc-hot-chi-hon-4-ty-so-huu-nha-ngoc-lam-40m-4t-mt4m-2-thoang-o-to-do-cua-kinh-doanh--13636025.html,"CỰC HOT, CHỈ HƠN 4 TỶ SỞ HỮU NHÀ NGỌC LÂM 40M 4T MT4M, 2 THOÁNG, Ô TÔ ĐỖ CỬA, KINH DOANH.","+ Vị trí hiếm nhà bán, trung tâm phố, tiện ích ngập tràn, nằm trong khu dân cư yên tĩnh, văn minh, dân trí cao, an ninh an toàn tuyệt đối.
+ Nhà cách mặt phố Ngọc Lâm 100m, 200m tới TTTM Mipec, nằm giữa 2 cầu Chương Dương, Long Biên, giao thông thuận tiện. 
+ BVĐK Tâm Anh, Bắc Hà, trường học các cấp chất lượng sát nhà.
+ Sổ đỏ cất két, giao dịch trong 1 nốt nhạc.
+ Liên hệ: E Huyền (Chuyên nhà đất đẹp Long Biên): tư vấn miễn phí, hỗ trợ mọi thủ tục nhanh gọn.","4,5 tỷ",40 m2,"Đường Ngọc Lâm, Phường Ngọc Lâm, Quận Long Biên, Hà Nội",13636025,_,---,Cần bán,0m,---,Nhà trong hẻm,---,---,4m,4,---,---,2,---
https://alonhadat.com.vn/nhat-pham-hong-tien-sieu-xin-so-dang-cap-105m-5t-mt4m-gara-thang-may-khong-gian-xanh--13372321.html,"NHẤT PHẨM HỒNG TIẾN SIÊU XỊN SÒ, ĐẲNG CẤP 105M 5T MT4M, GARA, THANG MÁY, KHÔNG GIAN XANH.","+ Tọa lạc tại con phố VIP nhất nhì quận Long Biên, đa tiện ích cao cấp.
+ Chủ là dân kiến trúc, thiết kế tâm huyết, tỉ mỉ, bố trí nhiều không gian thư giãn, hòa mình vào với thiên nhiên: bể cá KOI, khu vực thưởng trà view đỉnh.
+ Giao với nhiều phố lớn: Nguyễn Văn Cừ, Lâm Hạ, Cổ Linh, Phú Hựu, Ái Mộ…
+ Sổ đỏ cất két, chủ thiện chí.
+ Liên hệ: E Huyền (Chuyên nhà đất đẹp Long Biên): tư vấn miễn phí, hỗ trợ mọi thủ tục nhanh gọn.","23,999 tỷ",105 m2,"Phố Hồng Tiến, Phường Bồ Đề, Quận Long Biên, Hà Nội",13372321,_,---,Cần bán,0m,---,Nhà mặt tiền,---,---,4m,5,---,---,4,---
https://alonhadat.com.vn/dat-vang-tu-dinh-110m-mt7m-mat-tien-quyen-luc-phan-lo-o-to-tranh-thong-cac-nga--13589109.html,"ĐẤT VÀNG TƯ ĐÌNH 110M MT7M, MẶT TIỀN QUYỀN LỰC, PHÂN LÔ, Ô TÔ TRÁNH, THÔNG CÁC NGẢ.","+ Vị trí đất tại khu phân lô quân đội, hàng xóm toàn các tướng tá quân đội văn minh, dân trí, an ninh tuyệt vời.
+ Khu vực hiếm nhà bán, sát khu biệt thự Minh Tâm siêu VIP, ô tô thông tứ phía ra Cổ Linh.
+ 200m tới sân golf Long Biên, AEON Mall, cầu Vĩnh Tuy, trường học các cấp, tiện ích bạt ngàn.
+ Sổ đỏ chính chủ, pháp lý rõ ràng.
+ Liên hệ: E Huyền (Chuyên nhà đất đẹp Long Biên): tư vấn miễn phí, hỗ trợ mọi thủ tục nhanh gọn.","13,5 tỷ",110 m2,"Đường Tư Đình, Phường Long Biên, Quận Long Biên, Hà Nội",13589109,_,---,Cần bán,0m,---,"Đất thổ cư, đất ở",---,---,7m,---,---,---,4,---
https://alonhadat.com.vn/dep-vip-nhat-pho-nguyen-van-cu-no-hau-2-thoang-thang-may-120m-6t-mt5m-gia-mem--12763374.html,"ĐẸP VIP NHẤT PHỐ NGUYỄN VĂN CỪ, NỞ HẬU, 2 THOÁNG, THANG MÁY 120M 6T MT5M, GIÁ MỀM.","+ Thông số vàng, thiết kế thông sàn hiện đại, nội thất nhập khẩu xịn xò.
+ Gần đường 40m Hồng Tiến - Ngọc Thụy, dân cư đông đúc, kinh doanh đỉnh, dòng tiền ổn. Chủ đang cho thuê 100 triệu/tháng.
+ Tiện ích đẳng cấp 5 sao quanh nhà: trường TH, THCS Ái Mộ, THPT Nguyễn Gia Thiều, 100m tới trường quốc tế Wellspring, bệnh viện đa khoa Tâm Anh.
+ Sổ đỏ nở hậu, giao dịch trong 1 nốt nhạc.
+ Liên hệ: E Huyền (Chuyên nhà đất đẹp Long Biên): tư vấn miễn phí, hỗ trợ mọi thủ tục nhanh gọn.","39,9 tỷ",120 m2,"Đường Nguyễn Văn Cừ, Phường Ngọc Lâm, Quận Long Biên, Hà Nội",12763374,_,---,Cần bán,0m,---,Nhà mặt tiền,---,---,5m,6,---,---,4,---
https://alonhadat.com.vn/sieu-pham-3-thoang-no-hau-nguyen-son-65m-3t-mt4m-gara-kinh-doanh-gia-vao-viec-ngay--13033955.html,"SIÊU PHẨM 3 THOÁNG, NỞ HẬU NGUYỄN SƠN 65M 3T MT4M, GARA, KINH DOANH, GIÁ VÀO VIỆC NGAY.","+ Khu vực hiếm nhà bán, xung quanh toàn cán bộ hàng không văn minh, an ninh đảm bảo, kinh doanh đỉnh, nổi tiếng là phố hàng xách tay đẳng cấp.
+ Ô tô thông các ngả, ra vào thuận tiện.
+ Nhà thiết kế siêu thoáng mát, chủ để lại toàn bộ nội thất.
+ Sổ đỏ vuông vắn, cất két chờ giao dịch.
+ Liên hệ: E Huyền (Chuyên nhà đất đẹp Long Biên): tư vấn miễn phí, hỗ trợ mọi thủ tục nhanh gọn.","9,6 tỷ",65 m2,"Đường Nguyễn Sơn, Phường Bồ Đề, Quận Long Biên, Hà Nội",13033955,_,---,Cần bán,0m,---,Nhà trong hẻm,---,---,4m,3,---,---,3,---
https://alonhadat.com.vn/ban-gap-nha-nguyen-van-cu-70m-4t-mt7m-lo-goc-2-mat-o-to-tranh-an-sinh-dinh--13583255.html,"BÁN GẤP NHÀ NGUYỄN VĂN CỪ 70M 4T MT7M, LÔ GÓC, 2 MẶT Ô TÔ TRÁNH, AN SINH ĐỈNH.","+ Vị trí đẹp nhất khu vực, gần cầu Chương Dương, trước nhà 2 ô tô tránh nhau.
+ Quanh nhà tập trung nhiều trường chuẩn quốc gia các cấp: TH, THCS Ái Mộ, THPT Nguyễn Gia Thiều, BVĐK Bắc Hà.
+ Khu vực quy hoạch ổn định, 100m ra đường 40m nối Hồng Tiến - Ngọc Thụy kéo dài, thông các ngả sang Ngọc Lâm.
+ Sổ đỏ vuông đét, giá thương lượng tốt.
+ Liên hệ: E Huyền (Chuyên nhà đất đẹp Long Biên): tư vấn miễn phí, hỗ trợ mọi thủ tục nhanh gọn.","13,999 tỷ",70 m2,"Đường Nguyễn Văn Cừ, Phường Ngọc Lâm, Quận Long Biên, Hà Nội",13583255,_,---,Cần bán,0m,---,Nhà trong hẻm,---,---,7m,4,---,---,4,---
https://alonhadat.com.vn/hon-4-ty-nha-nguyen-van-cu-48m-mt4m-2-thoang-o-to-do-cua-dan-tri-cao-bat-ngan-tien-ich--13315595.html,"HƠN 4 TỶ, NHÀ NGUYỄN VĂN CỪ 48M MT4M,2 THOÁNG,Ô TÔ ĐỖ CỬA, DÂN TRÍ CAO, BẠT NGÀN TIỆN ÍCH.","+ Vị trí siêu hiếm, trường học các cấp quanh nhà: Ái Mộ, Ngọc Lâm, THPT Nguyễn Gia Thiều, 100m ra đường 40m Hồng Tiến - Ngọc Thụy.
+ Ô tô thông sang phố cổ Ngọc Lâm, 5 phút qua cầu sang hồ Hoàn Kiếm.
+ Sổ đỏ cất két, sẵn sàng giao dịch.
+ Liên hệ: E Huyền (Chuyên nhà đất đẹp Long Biên): tư vấn miễn phí, hỗ trợ mọi thủ tục nhanh gọn.","4,85 tỷ",48 m2,"Đường Nguyễn Văn Cừ, Phường Ngọc Lâm, Quận Long Biên, Hà Nội",13315595,_,---,Cần bán,0m,---,Nhà trong hẻm,---,---,4m,4,---,---,2,---
https://alonhadat.com.vn/hoa-hau-khu-vip-ai-mo-60m-7t-mt6m-thong-so-vang-gara-2-o-to-thang-may--13569163.html,"HOA HẬU KHU VIP ÁI MỘ 60M 7T MT6M, THÔNG SỐ VÀNG, GARA 2 Ô TÔ, THANG MÁY.","+ Vị trí đắc địa, trước nhà ô tô tránh, thông sang ngõ 135 Bồ Đề.
+ Gần nhà là công an phường, hồ điều hòa, trường quốc tế WellSpring.
+ Nhà thiết kế hiện đại, sang trọng, chủ tâm huyết trên từng chi tiết, thang máy, nội thất nhập khẩu xịn sò.                                                                                                                          
+ Sổ đỏ nét căng, cất két chờ công chứng.
+ Liên hệ: E Huyền (Chuyên nhà đất đẹp Long Biên): tư vấn miễn phí, hỗ trợ mọi thủ tục nhanh gọn.","17,9 tỷ",60 m2,"Phố Ái Mộ, Phường Bồ Đề, Quận Long Biên, Hà Nội",13569163,_,---,Cần bán,0m,---,Nhà trong hẻm,---,---,6m,7,---,---,3,---
https://alonhadat.com.vn/sieu-hiem-hon-10-ty-so-huu-nha-mat-pho-hong-tien-2-thoang-trung-tam-tien-ich--12718269.html,"SIÊU HIẾM, HƠN 10 TỶ SỞ HỮU NHÀ MẶT PHỐ HỒNG TIẾN, 2 THOÁNG, TRUNG TÂM TIỆN ÍCH.","+ Lõi Bồ Đề, kinh doanh buôn bán sầm uất, an sinh đỉnh.
+ Khu vực đông dân, tập trung nhiều tiện ích quốc tế: BVĐK Tâm Anh, trường quốc tế Wellspring, giao với phố Ngọc Lâm, Nguyễn Văn Cừ, Lâm Hạ, Hoàng Như Tiếp.
+ Sổ đỏ chính chủ, cất két chờ giao dịch.
+ Liên hệ: E Huyền (Chuyên nhà đất đẹp Long Biên):  tư vấn miễn phí, hỗ trợ mọi thủ tục nhanh gọn.","10,999 tỷ",30 m2,"Phố Hồng Tiến, Phường Bồ Đề, Quận Long Biên, Hà Nội",12718269,_,---,Cần bán,0m,---,Nhà mặt tiền,---,---,4m,6,---,---,3,---
https://alonhadat.com.vn/chi-4-x-ty-nha-dan-xay-lo-goc-ngoc-thuy-50m-4t-mt5m-hang-xom-khai-son-hill-truong-phap--13521706.html,"CHỈ 4.X TỶ, NHÀ DÂN XÂY, LÔ GÓC NGỌC THỤY 50M 4T MT5M, HÀNG XÓM KHAI SƠN HILL,TRƯỜNG PHÁP.","+ Cách 10m ra ô tô tránh, vị trí hiếm nhà bán, gần khu học viện hậu cần, 3 bước ra vườn hoa, khu Khai Sơn Hill, trường quốc tế Pháp, UBND phường, công viên Ngọc Thụy mới khánh thành.
+ Khu vực phát triển nhất Ngọc Thụy, thông tứ phía ra khu Gia Thượng, quy hoạch đồng bộ.
+ Nhà thiết kế đầy đủ công năng, lô góc thoáng sáng.
+ Sổ đỏ chính chủ, giao dịch trong 1 nốt nhạc.
+ Liên hệ: E Huyền (Chuyên nhà đất đẹp Long Biên): tư vấn miễn phí, hỗ trợ mọi thủ tục nhanh gọn.","4,28 tỷ",50 m2,"Đường Ngọc Thụy, Phường Ngọc Thụy, Quận Long Biên, Hà Nội",13521706,_,---,Cần bán,0m,---,Nhà trong hẻm,---,---,5m,4,---,---,4,---
https://alonhadat.com.vn/biet-thu-song-lap-dang-cap-thuong-luu-vinhomes-riverside-240m-gia-mem-cho-khach-thien-chi-12466173.html,"BIỆT THỰ SONG LẬP, ĐẲNG CẤP THƯỢNG LƯU VINHOMES RIVERSIDE 240M,GIÁ MỀM CHO KHÁCH THIỆN CHÍ","+ Chủ định cư Mỹ cần bán gấp căn biệt thự tràn đầy vượng khí, mang lại nhiều tài lộc cho gia chủ.
+ Không gian sống đẳng cấp 5 sao, tiện ích quá tuyệt vời, nhà gần khu công viên đẹp đỉnh, vài bước tới TTTM Vincom Long Biên.
+ Biệt thự thiết kế đầy đủ công năng, hệ thống an ninh đảm bảo 24/7, nội thất cao cấp nhập khẩu xịn xò. Chủ tặng lại toàn bộ nội thất cho khách mua.
+ Sổ đỏ đẹp nét, sẵn sàng giao dịch.
+ Liên hệ: E Huyền (Chuyên nhà đất đẹp Long Biên): tư vấn miễn phí, hỗ trợ mọi thủ tục nhanh gọn.",48 tỷ,240 m2,"Đường Anh Đào, Phường Việt Hưng, Quận Long Biên, Hà Nội",12466173,_,---,Cần bán,0m,---,"Biệt thự, nhà liền kề",---,---,10m,4,---,---,4,---
https://alonhadat.com.vn/dep-lung-linh-nha-nguyen-van-cu-65m-5t-mt5m-ngo-thong-lo-goc-no-hau-o-to-vao--13455339.html,"ĐẸP LUNG LINH NHÀ NGUYỄN VĂN CỪ 65M 5T MT5M, NGÕ THÔNG, LÔ GÓC, NỞ HẬU, Ô TÔ VÀO.","+ Chủ dân phố cổ, đại gia nhiều bất động sản, bán đi mua nhà to hơn.
+ Vị trí VIP, đẳng cấp, thông Bồ Đề, Ái Mộ, 5 phút qua cầu sang phố cổ.
+ Nhà có ô chờ thang máy, thiết kế hiện đại, chủ tặng toàn bộ nội thất, khách chỉ việc xách vali về ở.
+ Sổ nở hậu, sẵn sàng giao dịch.
+ Liên hệ: E Huyền (Chuyên nhà đất đẹp Long Biên): tư vấn miễn phí, hỗ trợ mọi thủ tục nhanh gọn.","9,999 tỷ",65 m2,"Đường Nguyễn Văn Cừ, Phường Bồ Đề, Quận Long Biên, Hà Nội",13455339,_,---,Cần bán,0m,---,Nhà trong hẻm,---,---,5m,5,---,---,6,---
https://alonhadat.com.vn/doc-hiem-nha-nguyen-van-cu-100m-mt8-6m-lo-goc-ngo-to-nhu-pho-truoc-nha-4-o-to-tranh--13486992.html,"ĐỘC HIẾM NHÀ NGUYỄN VĂN CỪ 100M MT8.6M, LÔ GÓC, NGÕ TO NHƯ PHỐ, TRƯỚC NHÀ 4 Ô TÔ TRÁNH.","+ Vị trí đứng đầu khu vực quy hoạch đồng bộ, thông số lý tưởng, xung quanh nhà là tổ hợp chung cư cao cấp Premier Berriver, PHC Complex, trường học các cấp.
+ Hàng xóm toàn cán bộ hàng không, thông sang Nguyễn Sơn, Hoàng Như Tiếp, dân cư đông đúc, dân trí cao, an sinh tuyệt vời, kinh doanh buôn bán tấp nập ngày đêm.
+ Khách mua xây tòa nhà văn phòng, chung cư mini, kinh doanh nhà hàng, khách sạn, phân lô đầu tư quá tuyệt vời.
+ Sổ đỏ hoa hậu, sẵn sàng giao dịch.
+ Liên hệ: E Huyền (Chuyên nhà đất đẹp Long Biên): tư vấn miễn phí, hỗ trợ mọi thủ tục nhanh gọn.","24,999 tỷ",100 m2,"Đường Nguyễn Văn Cừ, Phường Bồ Đề, Quận Long Biên, Hà Nội",13486992,_,---,Cần bán,0m,---,Nhà trong hẻm,---,---,"8,6m",1,---,---,2,---
https://alonhadat.com.vn/hiem-lam-nhinh-3-ty-so-huu-nha-moi-koong-trung-tam-pho-co-ngoc-lam-35m-5t-mt5m-ngo-thong--13235775.html,"HIẾM LẮM, NHỈNH 3 TỶ SỞ HỮU NHÀ MỚI KOONG TRUNG TÂM PHỐ CỔ NGỌC LÂM 35M 5T MT5M,NGÕ THÔNG.","+ Nhà mới còn nguyên mùi sơn, nằm tại khu vực phố cổ Ngọc Lâm dân cư đông đúc, kinh doanh buôn bán sầm uất ngày đêm.
+ Ngõ ô tô thông Nguyễn Văn Cừ, giao thông thuận tiện, 5 phút qua cầu sang hồ Hoàn Kiếm.
+ Quanh nhà là công an phường, chợ dân sinh, trường học các cấp, bệnh viện, TTTM Mipec.
+ Sổ đỏ chính chủ, sẵn sàng công chứng.
+ Liên hệ: E Huyền (Chuyên nhà đất đẹp Long Biên): tư vấn miễn phí, hỗ trợ mọi thủ tục nhanh gọn.","3,8 tỷ",35 m2,"Đường Ngọc Lâm, Phường Ngọc Lâm, Quận Long Biên, Hà Nội",13235775,_,---,Cần bán,0m,---,Nhà trong hẻm,---,---,5m,5,---,---,5,---
https://alonhadat.com.vn/sieu-pham-mat-pho-hong-tien-125m-mt6m-2-thoang-thang-may-kd-bat-chap-dong-tien-on--13504204.html,"SIÊU PHẨM MẶT PHỐ HỒNG TIẾN 125M, MT6M, 2 THOÁNG, THANG MÁY, KD BẤT CHẤP, DÒNG TIỀN ỔN.","+ Nằm ở vị trí TOP 1 thuộc phố VIP nhất nhì quận Long Biên, giá rẻ nhất khu vực, vỉa hè rộng, kinh doanh buôn bán sầm uất ngày đêm.
+ An sinh trên cả tuyệt vời: 3 bước ra BVĐK 5 sao Tâm Anh, Bắc Hà, trường liên cấp quốc tế WellSpring, nhiều trường học các cấp quanh nhà.
+ Gần ngã tư Hồng Tiến - Phú Hựu, sau nhà ô tô tránh, giao thông thuận tiện, 5 phút qua cầu sang phố cổ, giao với nhiều phố lớn: Nguyễn Văn Cừ, Ngọc Lâm, Cổ Linh, sắp thông tuyến đường 40m kéo dài nối Hồng Tiến - Ngọc Thụy.
+ Chủ hiện đang cho thuê gần 100 triệu/tháng.
+ Sổ đỏ pháp lý chuẩn, cất két chờ giao dịch.
+ Liên hệ: E Huyền (Chuyên nhà đất đẹp Long Biên): tư vấn miễn phí, hỗ trợ mọi thủ tục nhanh gọn.","39,5 tỷ",125 m2,"Phố Hồng Tiến, Phường Bồ Đề, Quận Long Biên, Hà Nội",13504204,_,---,Cần bán,0m,---,Nhà mặt tiền,---,---,"5,5m",6,---,---,8,---
https://alonhadat.com.vn/nha-loi-gia-thuy-70m-5t-mt4-5m-2-thoang-phan-lo-o-to-tranh-gara-7-cho-dan-tri-cao--13450976.html,"NHÀ LÕI GIA THỤY 70M 5T MT4.5M, 2 THOÁNG, PHÂN LÔ, Ô TÔ TRÁNH, GARA 7 CHỖ, DÂN TRÍ CAO.","+ Khu vực VIP, hiếm nhà bán, trước nhà ô tô tránh, hàng xóm toàn dân quan chức, cán bộ hàng không sinh sống.
+ Tiện ích vô vàn: nhiều trường điểm các cấp của quận tập trung quanh nhà: TH & THCS Gia Thụy, gần khu hàng không Vietnam Airlines.
+ Nhà có thiết kế ô chờ thang máy, chủ bố trí giếng trời rộng thoáng nên phòng nào cũng ngập tràn ánh sáng tự nhiên.
+ Sổ đỏ vuông vắn, pháp lý rõ ràng.
+ Liên hệ: E Huyền (Chuyên nhà đất đẹp Long Biên):  tư vấn miễn phí, hỗ trợ mọi thủ tục nhanh gọn.","12,2 tỷ",70 m2,"Đường Nguyễn Văn Cừ, Phường Gia Thụy, Quận Long Biên, Hà Nội",13450976,_,---,Cần bán,0m,---,Nhà trong hẻm,---,---,"4,5m",5,---,---,4,---
https://alonhadat.com.vn/chi-5-x-ty-nha-trung-tam-nguyen-van-cu-40m-4t-mt4m-o-to-chay-vong-quanh--13448088.html,"CHỈ 5.X TỶ NHÀ TRUNG TÂM NGUYỄN VĂN CỪ 40M 4T MT4M, Ô TÔ CHẠY VÒNG QUANH.","+ Ngõ nông, thông sang phố cổ Ngọc Lâm, gần cầu Chương Dương.
+ Tiện ích bạt ngàn: trường chuẩn quốc gia các cấp: TH & THCS Ái Mộ, THPT Nguyễn Gia Thiều, BVĐK Bắc Hà, TTTM Mipec, chợ ẩm thực Ngọc Lâm…
+ Nhà thiết kế đầy đủ công năng.
+ Sổ đỏ vuông vắn, giá thương lượng sâu.
+ Liên hệ: E Huyền (Chuyên nhà đất đẹp Long Biên): tư vấn miễn phí, hỗ trợ mọi thủ tục nhanh gọn.","5,8 tỷ",40 m2,"Đường Nguyễn Văn Cừ, Phường Ngọc Lâm, Quận Long Biên, Hà Nội",13448088,_,---,Cần bán,0m,---,Nhà trong hẻm,---,---,4m,4,---,---,3,---
https://alonhadat.com.vn/ha-chao-1-7-ty-dat-vang-gia-thuong-no-hau-335m-mt-quyen-luc-dau-tu-phan-lo-cuc-dinh--13472036.html,"HẠ CHÀO 1.7 TỶ, ĐẤT VÀNG GIA THƯỢNG, NỞ HẬU 335M,MT QUYỀN LỰC,ĐẦU TƯ PHÂN LÔ CỰC ĐỈNH.","+ Mảnh đất hiếm còn sót lại tại khu vực VIP nhất của quận Long Biên, xung quanh là trường học các cấp, trường quốc tế Pháp Alexandre Yersin.
+ Hàng xóm Khai Sơn Hill, 3 bước ra công viên Ngọc Thụy, hồ điều hòa mới hoàn thiện.
+ Đất full thổ cư, mặt tiền khủng, nở hậu, chia lô siêu đẹp.
+ Sổ nở hậu, cất két chờ giao dịch.
+ Liên hệ: E Huyền (Chuyên nhà đất đẹp Long Biên): tư vấn miễn phí, hỗ trợ mọi thủ tục nhanh gọn.","23,2 tỷ",335 m2,"Đường Gia Thượng, Phường Ngọc Thụy, Quận Long Biên, Hà Nội",13472036,_,---,Cần bán,0m,---,"Đất thổ cư, đất ở",---,---,21m,---,---,---,---,---
