url,title,description,price,area,address,Mã tin,Hướng,Phòng ăn,Loại tin,Đường trước nhà,Nhà bếp,Loại BDS,Pháp lý,Sân thượng,Chiều ngang,Số lầu,Chổ để xe hơi,Chiều dài,Số phòng ngủ,Chính chủ,Thuộc dự án
https://alonhadat.com.vn/ban-dat-ngo-pho-tran-khat-chan-ngo-ronhj-gan-pho-kinh-doanh-13665389.html,"BÁN ĐẤT NGÕ PHỐ TRẦN KHÁT CHÂN ,NGÕ RÔNHJ GẦN PHỐ KINH DOANH","LÔ GÓC- CÁCH MẶT PHỐ ĐÚNG 15M - MẶT NGÕ KINH DOANH SẦM UẤT - Ô TÔ LÝ THUYẾT - NGÕ THÔNG - SỔ RIÊNG ĐẸP ,TRẦN KHÁT CHÂN DT 30M2,TỪ TẦNG 2 DT 37M2. X 2 TẦNG.GIÁ 3,35 TỶ.

+ Vị trí tuyệt đẹp, cách mặt phố Trần Khát Chân đúng 15m. Ngõ rộng 3m, ô tô lý thuyết.
+ Nhà lô góc, 2 mặt thoáng, mặt ngõ thông, kinh doanh sầm uất.
+ Sổ đỏ riêng .
+ Nhà cũ, bán đất tặng nhà .","3,35 tỷ",30 m2,"Đường Trần Khát Chân, Phường Thanh Nhàn, Quận Hai Bà Trưng, Hà Nội",13665389,_,---,Cần bán,4m,---,"Đất thổ cư, đất ở",---,---,---,2,---,---,2,---,
https://alonhadat.com.vn/lien-ke-do-nghia-mat-pho-yen-lo-kinh-doanh-55m-5t-7-5ty-13694882.html,LIỀN KỀ ĐÔ NGHĨA MẶT PHỐ YÊN LỘ KINH DOANH 55M 5T 7.5TỶ,"Liền kề Đô Nghĩa ô chờ thang máy mặt phố Yên Lộ kinh doanh sầm uất đủ mọi loại hình. Nhà có vị trí đắc địa nằm trên mặt phố Yên Lộ kinh doanh sôi động nhộn nhịp nhất phường Yên Nghĩa, các tiện ích như trường học chợ dân sinh ngay cạnh nhà. Mọi chi tiết xin liên hệ em Trung chuyên nhà đất Yên Nghĩa, hỗ trợ tư vấn pháp lý từ A đến Z và xem nhà đất miễn phí.","7,5 tỷ",55 m2,"Đường Yên Lộ, Phường Yên Nghĩa, Quận Hà Đông, Hà Nội",13694882,_,True,Cần bán,12m,True,Nhà mặt tiền,Sổ hồng/ Sổ đỏ,True,5m,5,True,---,3,---,
https://alonhadat.com.vn/nha-yen-nghia-oto-do-cua-kinh-doanh-40m-4t-3-25ty-13694878.html,NHÀ YÊN NGHĨA ÔTÔ ĐỖ CỬA KINH DOANH 40M 4T 3.25TỶ,"Nhà Yên Nghĩa ô tô đỗ cửa kinh doanh tốt, nhà gia chủ tự xây còn mới thuộc tổ 5,6 trong đê có vị trí rất đẹp ngõ thông thoáng rộng rãi khu dân cư văn minh, các tiện ích như trường học chợ dân sinh đều ở quanh nhà. Mọi chi tiết xin liên hệ em Trung chuyên nhà đất Yên Nghĩa, hỗ trợ tư vấn pháp lý từ A đến Z và xem nhà đất miễn phí.","3,25 tỷ",40 m2,"Đường Yên Lộ, Phường Yên Nghĩa, Quận Hà Đông, Hà Nội",13694878,_,---,Cần bán,5m,---,Nhà trong hẻm,---,---,---,4,---,---,4,---,
https://alonhadat.com.vn/duy-nhat-1-can-n03-t2-ngoai-giao-doan-85m2-4-85-ty-full-nt-13694869.html,"Duy nhất 1 căn N03-T2 Ngoại Giao đoàn 85m2_4.8 tỷ, full NT","LH em Bằng hỗ trơ xem nhà 24 /7.
Bán CH Ngoại Giao Đoàn, N03 - T2, KĐT Ngoại Giao Đoàn, Bắc Từ Liêm Hà Nội.
+ DT: 87m², 2PN & 2WC.
+ Full NT đẹp lung linh, xách vali về ở luôn.
+ Ban công hướng Đông, thông thoáng cả ngày.
+ Khu vực Vip an ninh, tiện ích đẳng cấp, dân trí tuyệt vời.
+ Giá: 4.8 tỷ. Thiện trí bán.
+ Bank hỗ trợ 70%, LS ưu đãi.
LH ngay em Bằng để gặp chủ nhà, hỗ trợ 24 /7
Miễn tiếp môi giới & trung gian.","4,8 tỷ",87 m2,"Đường Xuân Đỉnh, Phường Xuân Tảo, Quận Bắc Từ Liêm, Hà Nội",13694869,_,True,Cần bán,---,True,Căn hộ chung cư,Sổ hồng/ Sổ đỏ,True,---,10,True,---,2,---,Căn hộ chung cư N03 - T2 Ngoại Giao Đoàn (xem chi tiết dự án)
https://alonhadat.com.vn/ban-nha-gan-hoc-vien-tai-chinh-xay-moi-o-luon-42m2-gia-4-ty-13395161.html,Bán nhà gần Học Viện Tài Chính_Xây mới_Ở luôn_42m2_giá 4 tỷ,"Liên hệ: Em Bằng ngay để xem nhà
+ Bán nhà hàng xóm Học Viện Tài Chính. Vị trí rất gần công viên Hòa Bình, bán kính 2km có Đại Học Mỏ Địa Chất, Tài Nguyên & Môi Trường, Ngân hàng, Nội Vụ, cảnh sát, bệnh viện quốc tế Phương Đông, Lotte Tây Hồ. Gần đường lớn Thụy Phương, Hoàng Tăng Bí, Phố Văn Hội, Cổ Nhuế, Phạm Văn Đồng, Trần Cung...
+ Nhà xây mới đầy trang thiết bị 5 tầng, 4 Phòng ngủ, MT 5.5m đậu 10 xe máy.
+ Giá: 4 tỷ (Rẻ hơn thị trường 300 triệu)
+ Có hỗ trợ vay ngân hàng (Bank giản ngân 80% giá trị nhà)
+ Miễn tiếp trung gian & môi giới",4 tỷ,42 m2,"Đường Đức Thắng, Phường Đức Thắng, Quận Bắc Từ Liêm, Hà Nội",13395161,_,True,Cần bán,3m,True,Nhà trong hẻm,Sổ hồng/ Sổ đỏ,True,---,5,True,---,4,---,
https://alonhadat.com.vn/ban-nha-co-nhue-nha-rong-o-suong-40m2-3-85-ty-13394892.html,"Bán nhà Cổ Nhuế nhà rộng ở sướng, 40m2, 3.85 tỷ","+ Bán nhà đường Cổ Nhuế, Trần Cung, Phạm Văn Đồng nhà rộng hiếm có, phòng ngủ rộng thênh thang ở sướng.
+ Nhà mới Koong 5 trầng 40m2, MT 5m. tầng nào cũng có ban công, MT rộng rất thoáng.
+ Đường Cổ Nhuế sôi động nhiều tiện ích rất gần Đại học Mỏ Đại Chất, Học viện Tài Chính, Học Viện Cảnh Sát, Đại học Tài Nguyên & Môi Trường, Bệnh viện quốc tế Phương Đông...
+ Sổ đỏ cất két, sẵn sàng giao dịch
+ Giá 3.85 tỷ (Có thương lượng với khách thiện trí).
+ Miễn tiếp môi giới & Trung gian
LH ngay em Bằng để xem nhà.","3,85 tỷ",40 m2,"Đường Cổ Nhuế, Phường Cổ Nhuế 2, Quận Bắc Từ Liêm, Hà Nội",13394892,_,True,Cần bán,3m,True,Nhà trong hẻm,Sổ hồng/ Sổ đỏ,True,---,5,True,---,3,---,
https://alonhadat.com.vn/ban-nha-lo-goc-vuong-thua-vu-thanh-xuan-40m-6t-mt-5-5-8-ty-ngo-rong-thang-may--13663105.html,"BÁN NHÀ LÔ GÓC VƯƠNG THỪA VŨ THANH XUÂN 40M 6T MT 5.5 8 TỶ, NGÕ RỘNG, THANG MÁY.","Ví trị : 
- Nhà siêu đẹp, ngõ thông tứ phía, thông qua ngõ 211 Khương Trung…
- - Bán kính 2km có nhiều trường học : Trường THCS Nguyễn TrãI, Trường Tiểu Học Nguyễn TrãI, Trường Mầm Non Bé Bồng Bông…
Nhà hiện tạI xây 6 tầng mớI cứng chắc chắn.
- T1 : Bếp + Wc.
- T2 : Phòng khách.
- T3 + 4 : MỗI tầng 1 phòng ngủ master cực rộng.
- T5 : Phòng ngủ + Phòng thờ.
- T6 : Tum + Sân phơi.
Nhà mớI xây chắc chắn, thiết kế bắt mắt, diện tích rông, nộI thất cao cấp, Oto tránh + đỗ ngày đêm. Dân trí cao, an ninh tốt, một nơi hoàn hảo để ở.
Nhà mớI xây chắc chắn, thang máy chạy vù vù, thiết kế bắt mắt, diện tích rông, nộI thất cao cấp. Dân trí cao, an ninh tốt, một nơi hoàn hảo để ở.
Tiện Ích xung quanh có nhiều siêu thị nhỏ lẻ : vinmart, hàng ăn, nhà hàng. Có nhiều khu vui chơi giảI trí và thể thao như : Sân Bóng Đầm Hồng 1 + 2 + 3, Công Viên Cây Xanh Lạc Hồng…
Sổ đỏ vuông vắn, sẵn sàng giao dịch.
LH & Zalo :( Vui lòng điện trực tiếp ).",8 tỷ,40 m2,"Phố Vương Thừa Vũ, Phường Khương Trung, Quận Thanh Xuân, Hà Nội",13663105,_,True,Cần bán,3m,True,Nhà trong hẻm,Sổ hồng/ Sổ đỏ,True,"5,5m",6,True,8m,3,---,
https://alonhadat.com.vn/ban-nha-dat-vang-tran-quang-dieu-50m-7t-mt-4-2-16-5-ty-thang-may-ngo-rong-oto-13594221.html,"BÁN NHÀ DÁT VÀNG TRẦN QUANG DIỆU 50M 7T MT 4.2 16.5 TỶ THANG MÁY, NGÕ RỔNG, OTO","VỊ trí : 
- Nhà mớI cứng, Oto tránh + Oto đỗ cổng, kinh doanh đỉnh.  ngõ rộng, thông tứ phía, thông qua ngõ 30 Trần Quang Diệu, 81 Hoàng Cầu, chưa đầy 1p ra Hồ Đống Đa.
- Bán kính 2km có nhiều trường học : ĐạI Học Thủy LợI, ĐạI Học Công Đoàn, Trường THPT Kim Liên…
Nhà hiện tạI xây 7 tầng chắc chắn.
- T1 : Thông sàn kinh doanh.
- T2 : 2 Phòng ngủ + Wc + Buồng xông hơi đẳng cấp.
- T3 : 2 Phòng ngủ khép kín.
- T4 : 1 Phòng ngủ + Wc + Phòng tắm Master.
- T5 : Phòng khách + Bếp.
- T6 : Phòng Karaoke + 1 Phòng ngủ + Phòng thờ.
- T7 : Tum phơi đồ.
Nhà mớI xây chắc chắn, thiết kế bắt mắt, dát vàng, thang máy, ngõ cực rộng, kinh doanh. An ninh tốt, dân chí cao. Một nơi hoàn hảo để ở + kinh doanh.
Tiện Ích xung quanh bạt ngàn, nhiều siêu thị, nhà hàng, quán ăn nhỏ lẻ. Có nhiều bệnh viện xung quanh như : Bệnh Viện Đống Đa, Bệnh Viện NộI Tiết Trung Ương Cơ Sở TháI Thịnh, Viện Châm Cứu Trung Ương Hà NộI…
Sổ đỏ vuông vắn, sẵn sàng giao dịch.( Vui Lòng Điện Trực Tiếp ) 
cảm ơn đã đọc tin.","16,5 tỷ",50 m2,"Phố Trần Quang Diệu, Phường Ô Chợ Dừa, Quận Đống Đa, Hà Nội",13594221,_,True,Cần bán,5m,True,"Biệt thự, nhà liền kề",Sổ hồng/ Sổ đỏ,True,"4,2m",7,True,"9,8m",6,---,
https://alonhadat.com.vn/ban-nha-cuc-pham-duong-lang-40m-6t-mt6-5-9-5-ty-gara-oto-oto-tranh-thiet-ke-di-13628282.html,"BÁN NHÀ CỰC PHẨM ĐƯỜNG LÁNG 40M 6T MT6.5 9.5 TỶ GARA OTO, OTO TRÁNH, THIẾT KẾ ĐI","Vị trí : 
- Nhà siêu đẹp, oto tránh, ngõ cực rộng.
- Nhà kết nốI giao thông cực kỳ thuận tiện, cách vành đai 2,5 Láng - Võ Chí Công - NộI BàI chỉ hơn 100m 
- Bán kính 2km có nhiều trường học : Trường ĐạI Học Giao Thông Vận TảI, Trường ĐạI Học NgoạI Thương, Trường ĐạI Học Luật Hà NộI, Trường THPT Yên Hòa…
Nhà hiện tạI xây 6 tầng mớI cứng chắc chắn.
- T1 : Gara oto, xe máy + Wc.
- T2 : Phòng khách + Bếp + wc.
- T3+4+5 : mỗI tầng 1 phòng ngủ master cực rộng + wc.
- T6 : Phòng thờ + Sân phơi.
Nhà mớI lô góc xây chắc chắn, thiết kế bắt mắt, kì công, nộI thất cao cấp, Gara oto + oto tránh. Dân trí cao, an ninh tốt. Một nơi hoàn hào để ở.
Tiện Ích xung quanh bạt ngàn, có nhiều siêu thị, quán ăn, nhà hàng nhỏ lẻ, nhiều khu vui chơi giảI trí, thể thao.
Gần nhà có nhiều bệnh viện như : Bệnh Viện Giao Thông Vận TảI, Bệnh Viện Phụ Sản Hà NộI, Viện Huyết Học - Truyền Máu Trung Ương…
Sổ đỏ vuông vắn, sẵn sàng giao dịch.
LH SĐT & Zalo :  ( Vui Lòng Điện Trực Tiếp Qua Số Điện ThoạI ).
Cảm ơn đã đọc tin!","9,5 tỷ",40 m2,"Đường Láng, Phường Láng Thượng, Quận Đống Đa, Hà Nội",13628282,_,True,Cần bán,5m,True,Nhà trong hẻm,Sổ hồng/ Sổ đỏ,True,"6,5m",6,True,7m,3,---,
https://alonhadat.com.vn/ban-nha-gara-o-to-2-mat-ngo-thang-may-pho-thai-ha-12-ty-6-13336883.html,"Bán nhà gara ô tô, 2 mặt ngõ, thang máy Phố Thái Hà, 12 tỷ 6","+> Nhà cần bán nằm vị trí đẹp, 2 mặt ngõ, ô tô vào nhà, thang máy, khu vực nhiều người tìm kiếm hiếm nhà bán.
+> Tiện ích xung quanh không thiếu gì, giao thông thuận tiện.
+> Có thể Kinh doanh VP, Công ty, Spa... hoặc ở điều phù hợp.
+> DT 53m2 x 6tầng, MT 5,2m (5PN)
+> Sổ đỏ vuông đẹp không lỗi PT, pháp lý chuẩn, chủ thiện chí sẵn sàng giao dịch.
Miễn phí toàn bộ dịch vụ xem nhà, hỗ trợ hoàn thành thủ tục mua bán.
==> LH Tuyết Lan để được tư vấn.","12,6 tỷ",53 m2,"Phố Cù Chính Lan, Phường Khương Mai, Quận Thanh Xuân, Hà Nội",13336883,_,True,Cần bán,20m,True,Nhà trong hẻm,Sổ hồng/ Sổ đỏ,True,6m,6,True,9m,6,---,
https://alonhadat.com.vn/ban-can-biet-thu-lien-ke-khu-do-thi-van-phu-90m2-x-5-tang-gara-o-to-noi-that-sang-trong--13694849.html,"Bán Căn Biệt Thự Liền Kề Khu Đô Thị Văn Phú 90m2 x 5 tầng, gara ô tô, nội thất sang trọng.","- Bán Căn Biệt Thự Liền Kề Khu Đô Thị Văn Phú 90m2 x 5 tầng, gara ô tô, nhà mới ở ngay, nội thất sang trọng, giá đầu tư chỉ hơn 12 tỷ

 - LIÊN HỆ E NHƯ , ZALO ĐỂ ĐƯỢC TƯ VẤN VÀ HỖ TRỢ XEM NHÀ 24/7

 - VỊ TRÍ ĐẮC ĐỊA - KHU ĐÔ THỊ VĂN PHÚ , PHÂN LÔ Ô BÀN CỜ - VIEW TRƯỜNG HỌC - Ô TÔ ĐẬU ĐỖ TRƯỚC NHÀ 24/7 - FULL NỘI THẤT SANG TRỌNG - TẦNG CHIA 2 PHÒNG KHÉP KÍN.

 - GIÁ ĐẦU TƯ CHỈ 12,8 TỶ CÓ THƯƠNG LƯỢNG.

 - Gía bao rẻ nhất KĐT Văn Phú , Chủ nhà có nhiều BĐS nên không dùng đến , nay muốn bán đi cho Khách hàng hữu duyên , Chủ muốn bán trước ngày Lễ Nhà Giáo Việt Nam , sau Lễ giá sẽ tăng lên chút xíu , đây là cơ hội vàng cho các nhà đầu tư nhanh tay để sở hữu , cũng như là một món quà dành tặng cho Đại Gia Đình Nhà mình.

 - Thiết kế 5 tầng cơ bản cầu thang giữa tầng chia 2 phòng wc khép kín.

 - Tầng 1: gara ô tô, bếp

 - Tầng 2 + 3 + 4 mỗi tầng 2 phòng vệ sinh khép kín, bể tắm sang chảnh.
 
 - Tầng 5 Phòng Thờ , sân phơi.
 
 - Nhà thiết kế cực kì Đẹp full nội thất khách chỉ việc tới ở.
 
 - Sổ đỏ phân lô vuông vắn trước sau như một , sẵn sàng giao dịch.","12,8 tỷ",90 m2,"Đường Văn Phú, Phường Phú La, Quận Hà Đông, Hà Nội",13694849,_,True,Cần bán,7m,True,"Biệt thự, nhà liền kề",Sổ hồng/ Sổ đỏ,True,"4,5m",5,True,20m,6,---,Khu đô thị mới Văn Phú (xem chi tiết dự án)
https://alonhadat.com.vn/ban-nha-4-tang-cu-loc-dien-tich-so-do-42-4m2-gia-5-1-ty-anh-that-khong-pham-loi-phong-th-13694831.html,"Bán nhà 4 tầng Cự Lộc diện tích sổ đỏ 42,4m2 giá 5,1 tỷ - ảnh thật không phạm lỗi phong th","CAM KẾT CUNG CẤP THÔNG TIN VÀ HÌNH ẢNH CHUẨN TUYỆT ĐỐI
+ Vị trí nhà đẹp, ngõ nông chỉ 40m ra mặt phố Cự Lộc trước nhà ba gác đỗ cửa. Khu rất hiếm nhà bán, trung tâm quận dân trí cao. Tiện ích trường học, các trung tâm thương mại dịch vụ, bệnh viện đều thuận tiện. Đời sống dân trí cao.
- Tầng 1: Phòng khách và bếp.,
- Tầng 2,3: Mỗi tầng 2 ngủ, wc
- Tầng 4: Phòng thờ và sân phơi.,
+ Sổ đỏ vuông như phân lô sẵn sàng giao dịch","5,1 tỷ",43 m2,"Phố Cự Lộc, Phường Nhân Chính, Quận Thanh Xuân, Hà Nội",13694831,_,---,Cần bán,"2,5m",---,"Đất thổ cư, đất ở",Sổ hồng/ Sổ đỏ,---,"4,8m",4,---,"8,9m",4,---,
https://alonhadat.com.vn/ban-gap-dat-gan-cho-thach-ban-co-linh-oto-vao-dat-45m-gia-3-8-ty-dau-tu-tot-13483291.html,"Bán nhà đẹp Ngọc Thuỵ Long Biên, gara oto. Cách phố cổ chỉ 5 phút, DT 60m2, 5 tầng, 5.7 ty","Nhà đẹp Ngọc Thuỵ Long Biên, oto đỗ cửa vào nhà, chỉ 5 phút qua trung tâm. Cách cầu Long Biên 300m. Diện tích 60m², giá: 5.7 tỷ.
+ Nhà thiết kế tân cổ điển, nội thất sang trọng. Bàn ghế sofa xịn. Giường tủ toàn đồ gỗ.
+ Tổng có 6 phòng ngủ rộng, nội thất đầy đủ (toàn đồ gỗ).
+ Gia chủ để lại toàn bộ nội thất trị giá hàng trăm triệu cho chủ mới.
+ Diện tích: 60m², mặt tiền 5m, 5 tầng, có mái tôn trên cùng.
* Giá: 5.7 tỷ (có thương lượng).
+ Vị trí cách cầu Long Biên chỉ 300m, chỉ mất 5 phút sang phố cổ hoa lệ.
+ Đường trước nhà rộng, để ô tô thoải mái.
+ Thiết kế:
Tầng 1: Phong khách, bếp, WC.
Tầng 2: 2 Phòng ngủ rộng + WC.
Tầng 3: 2 Phòng ngủ rộng + WC.
Tầng 4: 2 Phòng ngủ rộng + WC.
Tầng 5: Phòng thờ ốp gỗ sịn sò nhất. Sân phơi rộng.","5,7 tỷ",60 m2,"293 Đường Ngọc Thụy, Phường Ngọc Thụy, Quận Long Biên, Hà Nội",13483291,Tây Nam,True,Cần bán,10m,True,Nhà mặt tiền,Sổ hồng/ Sổ đỏ,True,"4,8m",5,True,13m,6,---,
https://alonhadat.com.vn/chi-hon-3-ty-la-so-huu-ngay-can-nha-lo-goc-87m2-kdt-viet-hung-long-bien-kinh-doanh-tot-13483318.html,"Chỉ hơn 3 tỷ. Là sở hữu ngay căn nhà lô góc 87m2, KĐT Việt Hưng Long Biên, kinh doanh tốt","- Bán căn nhà tại KĐT Việt Hưng, vừa ở vừa kinh doanh tốt, diện tích: 87m², lô góc mặt tiền rộng, giá nhỉnh 3 tỷ.
- Phù hợp làm phòng khám, viện thẩm mỹ, nha khoa... Cửa hàng Cafe, quán ăn sáng... (cho thuê nhanh 15tr/ tháng).
- Căn nhà là lô góc, có 2 cửa, mặt tiền 12m, vừa ở vừa kinh doanh cực tốt.
- Vị trí căn nhà trong khu đô thị việt hưng, có sân rộng oto đỗ 20 chiếc.
- Chỉ 3 bước chân ra tới công viên không khí trong lành, thể dục thể thao thoải mái.
- Cách khu biệt thự chỉ 100m, hưởng trọn không khí trong lành, mát mẻ, thoáng mát, nhiều cây cối.
- Sổ đỏ lâu dài, chính chủ.
Thiết kế: Tổng diện tích sàn 87m², chia 2 nhà rất hợp lý.
+ Gian 1: Thông sàn có gác sép, nhà wc riêng mới toanh. Điều hòa, bình nóng lạnh... Nội thất đầy đủ.
+ Gian 2: Chia 2 phòng, 1 phòng ngủ riêng, wc khép kín, điều hòa nội thất đầy đủ.
* Đặc biệt có 1 kho chứa đồ riêng 20m. Rất thuận tiện dùng để đồ.","3,4 tỷ",87 m2,"123 Đường Thép Mới, Phường Giang Biên, Quận Long Biên, Hà Nội",13483318,Tây Nam,True,Cần bán,15m,True,Căn hộ chung cư,Sổ hồng/ Sổ đỏ,---,12m,1,True,7m,3,---,Khu đô thị mới Việt Hưng (xem chi tiết dự án)
https://alonhadat.com.vn/ban-nha-ngoc-lam-long-bien-gia-2-3-ty-31m2-4-tang-chi-5-phut-qua-trung-tam-ha-noi-13467161.html,"Bán nhà Ngọc Lâm, Long Biên, giá 2.3 tỷ, 31m2, 4 tầng,chỉ 5 phút qua trung tâm Hà Nội","- Vị trí tuyệt vời tại khu vực trung tâm phố phố, với đủ mọi tiện ích sinh hoạt chỉ trong vài bước chân.
- Cách mặt phố Ngọc Lâm chỉ 18m.
- Giao thông vô cùng thuận tiện, chỉ 5 phút qua trung tâm Hà Nội.
- Nhà còn mới có thể về ở luôn không phải sửa chữa gì.
- Đặc biệt nhà gần Trường học các cấp 1,2,3 trong phạm vi vài trăm mét.
- Chỉ ba bước chân ra mặt phố Ngọc Lâm cực kỳ sầm uất buôn bán kinh doanh không thiếu mặt hàng gì.
- Diện tích 31m², nhà 4 tầng, MT: 3.5m, giá: 2,3 tỷ.
- Thiết kế:
Tầng 1: Phòng khách, bếp, wc.
Tầng 2: Phòng ngủ, wc.
Tầng 3: Phòng ngủ, wc.
Tầng 4: Mái tôn, sân phơi.
- Sổ đỏ chính chủ, sẵn sàng giao dịch.
Liên hệ: Mr Hùng.","2,3 tỷ",31 m2,"289 Đường Ngọc Lâm, Phường Ngọc Lâm, Quận Long Biên, Hà Nội",13467161,Đông,True,Cần bán,"3,3m",True,Nhà trong hẻm,Sổ hồng/ Sổ đỏ,True,"3,5m",4,True,"8,6m",3,---,
https://alonhadat.com.vn/can-ban-gap-dat-gan-cho-thach-ban-co-linh-oto-vao-dat-45m2-gia-3-8-ty-gia-dau-tu-13467157.html,"Cần bán gấp đất gần chợ Thạch Bàn - Cổ Linh, oto vào đất, 45m2, giá 3.8 tỷ. Giá đầu tư","Bán gấp đất gần chợ Thạch Bàn - Cổ Linh, oto vào đất, 45m², giá 3.8 tỷ. Đầu tư, xây nhà đều đẹp.

+ Vị trí: Gần Chợ Thạch Bàn - Cổ Linh, ngõ ô tô thông, mặt tiền 3.8m, diện tích 45m².

+ Giá cực hấp dẫn: Chỉ 3,8 tỷ (thương lượng nhẹ).

+ Khu dân trí cao, gần chợ, thuận tiện kinh doanh.

+ Đường trước mặt rộng rãi, ô tô đi lại dễ dàng.

+ Hiện đang có nhà cấp 4 cho thuê.

Liên hệ:Mr Hùng

Để được tư vấn pháp lý & xem chi tiết căn nhà.","3,8 tỷ",45 m2,"293 Đường Thạch Bàn, Phường Thạch Bàn, Quận Long Biên, Hà Nội",13467157,Tây Nam,True,Cần bán,"4,3m",True,"Đất thổ cư, đất ở",Sổ hồng/ Sổ đỏ,True,"3,8m",---,True,---,---,---,
https://alonhadat.com.vn/can-tien-ban-cuc-gap-can-nha-4-tang-voi-gia-2-1-ty-tai-ngoc-lam-long-bien-ha-noi-13554498.html,"Cần tiền bán cực gấp căn nhà 4 tầng với giá 2.1 tỷ, Tại Ngọc Lâm, Long Biên, Hà Nội","cần tiền bán cực gấp căn nhà 4 tầng với giá vô cùng rẻ Tại Ngọc Lâm, Long Biên, Hà Nội.

Cách mặt phố 18m, 3 bước chân ra phố

Giao thông thuận tiện đi các ngả, cách bến xe gia lâm chỉ 300m

200m ra uỷ ban , 4 trườg học các cấp , trạm y tế phường 200m

Đầy đủ các loại tiện ích không thiếu thứ gì.

Diện tích hơn 30m² .đầy đủ công năng.

Giá : 2.1 tỷ

Mặt tiền 3.5m, thiết kế hợp lý . Sách vali về ở luôn","2,1 tỷ",25 m2,"289 Đường Ngọc Lâm, Phường Ngọc Lâm, Quận Long Biên, Hà Nội",13554498,Tây Nam,True,Cần bán,"3,5m",True,Nhà trong hẻm,Sổ hồng/ Sổ đỏ,True,"3,5m",4,---,"7,8m",3,---,
https://alonhadat.com.vn/can-tien-ban-gap-nha-4-tang-vi-tri-lai-xa-kim-chung-hoai-duc-mat-tien-4-5m-gia-chi-12894412.html,"Cần tiền bán gấp Nhà 4 tầng vị trí Lai Xá, Kim Chung, Hoài Đức mặt tiền 4.5m giá chỉ","Cần tiền bán gấp
+ Nhà 4 tầng vị trí Lai Xá, Kim Chung, Hoài Đức
+ Nhà thiết kế đẹp, 50m2 mặt tiền 4.5m, giá 2.2 tỷ
+ Mua để ở hoặc kinh doanh siêu đỉnh.
+ Đường rộng thênh thang, thông tứ phía, ô tô vào nhà.
+ Khu dân trí cao, an ninh tốt, tiện ích không thiếu thứ gì.
+ Sổ đỏ chính chủ, pháp lý sạch, sẵn sàng giao dịch.
Anh/ chị có nhu cầu mua nhà đất liên hệ Bích Phượng (chuyên nhà đất thổ cư) tại huyện Hoài Đức để được tư vấn và xem nhà đất hoàn toàn miễn phí.
Vui lòng liên hệ: Mrs. Bích Phượng: 0912701280","2,2 tỷ",50 m2,"Đường Lai Xá, Xã Kim Chung, Huyện Hoài Đức, Hà Nội",12894412,_,True,Cần bán,"4,5m",True,Nhà trong hẻm,Sổ hồng/ Sổ đỏ,True,"4,5m",4,True,12m,4,---,
https://alonhadat.com.vn/chinh-chu-can-ban-gap-manh-dat-o-khu-lai-xa-dien-tich-60m2-lo-goc-2-mat-thoang-12890944.html,"Cần bán gấp mảnh đất ở khu Lai Xá diện tích 60m2, lô góc, 2 mặt thoáng","Cần bán gấp mảnh đất nằm ở vị trí Lai Xá – trung tâm huyện Hoài Đức
Mảnh đất đẹp tuyệt vời. 60m2, giá 2 tỷ
Mua để ở hoặc kinh doanh siêu đỉnh.
Đường rộng thênh thang, thông tứ phía, ô tô vào nhà.
Khu dân trí cao, an ninh tốt, tiện ích không thiếu thứ gì.
Sổ đỏ chính chủ, pháp lý sạch, sẵn sàng giao dịch.
Anh/ chị có nhu cầu mua nhà đất liên hệ Bích Phượng (chuyên nhà đất thổ cư) tại huyện Hoài Đức để được tư vấn và xem nhà đất hoàn toàn miễn phí.
Vui lòng liên hệ: Mrs. Bích Phượng",2 tỷ,60 m2,"Đường La Tinh, Xã Kim Chung, Huyện Hoài Đức, Hà Nội",12890944,_,---,Cần bán,"4,5m",---,"Đất thổ cư, đất ở",Sổ hồng/ Sổ đỏ,---,5m,---,---,12m,---,---,
https://alonhadat.com.vn/ban-nha-ton-duc-thang-van-chuong-56m-4-tang-5-4-ty-lo-goc-tang-noi-that-anh-that-13381715.html,"BÁN NHÀ TÔN ĐỨC THẮNG- VĂN CHƯƠNG – 56M, 4 TẦNG, 5.4 TỶ- LÔ GÓC – TẶNG NỘI THẤT- ẢNH THẬT","BÁN NHÀ TÔN ĐỨC THẮNG- VĂN CHƯƠNG – 56M, 4 TẦNG, 5.4 TỶ- LÔ GÓC – TẶNG NỘI THẤT- ẢNH THẬT 100%

+ Vị trí đẹp trong ngõ Văn Chương , trung tâm Đống Đa, tiện ích không thiếu gì, lên Ba Đình rất gần, giao thống rất tiện lợi
+ Diện tích 56m, xây 4 tầng, lô góc, tổng 4 phòng ngủ
- Tầng 1: sân cổng, p khách, ăn và p bếp+ wc
- Tầng :2+3: 2 ngủ khép kín + ban công cây cảnh
- Tầng 4: p thờ+ sân phơi rộng, cây cảnh.
- Nhà đầy đủ nội thất, về ở luôn
- Giá bán nhỉnh 5 tỷ 
Liên hệ gặp chủ, anh Minh","5,4 tỷ",56 m2,"Phố Tôn Đức Thắng, Phường Văn Chương, Quận Đống Đa, Hà Nội",13381715,_,---,Cần bán,2m,---,Nhà trong hẻm,Sổ hồng/ Sổ đỏ,---,---,4,---,---,2,---,
