url,title,description,price,area,address,Mã tin,Hướng,Phòng ăn,Loại tin,Đường trước nhà,Nhà bếp,Loại BDS,Pháp lý,Sân thượng,Chiều ngang,Số lầu,Chổ để xe hơi,Chiều dài,Số phòng ngủ,Chính chủ
https://alonhadat.com.vn/hiem-nha-lac-trung-58m-6pn-phan-lo-o-to-kinh-doanh-thang-may-nhap-nhinh-8-ty-13206079.html,"HIẾM NHÀ LẠC TRUNG 58m 6PN PHÂN LÔ, Ô TÔ, KINH DOANH, THANG MÁY NHẬP hơn 8 tỷ","TRUNG TÂM QUẬN - PHÂN LÔ BÀN CỜ - Ô TÔ CHẠY VÒNG QUANH - 5 TẦNG THANG MÁY.

- Lạc Trung - Dt: 58m - 5 tầng - 8,8 tỷ, vỉa hè, dân trí cao, ở ngay
 
+ Nhà nằm trong khu phân lô, vỉa hè hai bên, an ninh đảm bảo tuyệt đối, xung quanh tiện ích ngập tràn.

+ Nhà mới đẹp long lanh, nội thất cao cấp, thiết kế hợp lý. 

+ Nhà có giếng trời rất thoáng, sáng.
- Thiết kế 5 tầng, 6 PN đủ công năng sử dụng cho gia đình nhiều người ở.
- Sổ đỏ cất két sẵn sàng giao dịch ngày.
Alo ngay em Lập chuyên nhà đẹp Hà Nội.","8,8 tỷ",58 m2,"Phố Lạc Trung, Phường Thanh Lương, Quận Hai Bà Trưng, Hà Nội",13206079,_,---,Cần bán,9m,---,Nhà trong hẻm,Sổ hồng/ Sổ đỏ,---,---,5,---,---,6,---
https://alonhadat.com.vn/nha-phan-lo-duong-van-be-64m-mt-5m-o-to-kinh-doanh-nha-o-loc-nhinh-5-ty-13200788.html,"NHÀ PHÂN LÔ DƯƠNG VĂN BÉ 64m MT 5m Ô TÔ, KINH DOANH, NHÀ Ở LỘC 5,85 tỷ","NHÀ PHÂN LÔ - Ô TÔ - DÂN TRÍ CAO - KINH DOANH 

- Dương Văn Bé - Dt: 64m - Mt: 5m - 5,85 tỷ, quá hiếm. 

- Vị trí nhà nằm trong khu phân lô cán bộ Viện 108, dân trí cao an ninh tuyệt đối.  Nhà mình bán hai mặt thoáng trước và sau. Trước nhà ba gác tránh, 20m là ra ô tô tránh. Ngõ thông sang Vĩnh Hưng, Dương Văn Bé, Vĩnh Tuy.. gần chợ, công viên, hồ sinh thái AN SINH cực đỉnh. Xung quanh tiện ích ngập tràn …

- Trước chủ nhà làm ở Viện Kiến Trúc, tự tay thiết kế xây dựng nên khung cột bê tông cực kỳ chắc chắn, chủ mới có nhu cầu xây thêm tầng thoải mái.

- Sổ đỏ chính chủ, giao dịch sẵn sàng 24/7. 
Alo ngay em Lập chuyên nhà đẹp.","5,85 tỷ",64 m2,"Đường Dương Văn Bé, Phường Vĩnh Tuy, Quận Hai Bà Trưng, Hà Nội",13200788,_,---,Cần bán,"3,5m",---,Nhà trong hẻm,Sổ hồng/ Sổ đỏ,---,5m,4,---,---,3,---
https://alonhadat.com.vn/trung-tam-quan-hai-ba-59m-3-mat-thoang-o-to-kinh-doanh-dinh-gia-tot-13199327.html,TRUNG TÂM QUẬN HAI BÀ - 59m  3 MẶT THOÁNG - Ô TÔ -  KINH DOANH ĐỈNH - GIÁ TỐT,"TRUNG TÂM QUẬN HAI BÀ -3 MẶT THOÁNG - Ô TÔ -  KINH DOANH ĐỈNH - GIÁ TỐT - QUY HOẠCH ỔN ĐỊNH

- Bạch Mai - Dt: 59m - Mt: 4.7m - nhỉnh 6 tỷ, quá hiếm, ở ngay.

- Nhà liền kề trường học các cấp, đông vui nhộn nhịp, kinh doanh tốt. Nhà thuộc khu phân lô 3 mặt thoáng, ngõ trước nhà rộng 5m. Khu vực kinh doanh buôn bán sầm uất.
 
- Nhà chủ tự xây vô cùng kiên cố chắc chắn, thiết kế lệch tầng hiện đại, đầy đủ phòng khách, 4 phòng ngủ, phòng thờ, sân phơi, sân vườn cây cảnh.
- Chủ cần bán đi để lo việc gia đình nên rất tiếc với căn nhà tâm huyết này.
 - Sổ đỏ chính chủ cất két, sẵn sàng giao dịch.
Alo ngay em Lập chuyên nhà đẹp Hà Nội.","6,5 tỷ",59 m2,"Phố Bạch Mai, Phường Thanh Nhàn, Quận Hai Bà Trưng, Hà Nội",13199327,_,---,Cần bán,6m,---,Nhà trong hẻm,Sổ hồng/ Sổ đỏ,---,"4,7m",3,---,---,4,---
https://alonhadat.com.vn/ban-nha-tran-khat-chan-30m-3pn-o-to-kinh-doanh-gia-tot-o-ngay-nhinh-2-ty-13199248.html,"BÁN NHÀ TRẦN KHÁT CHÂN 30m 3PN Ô TÔ - KINH DOANH, GIÁ TỐT - Ở NGAY nhỉnh 2 tỷ","NHÀ DÂN XÂY CHẮC CHẮN - Ô TÔ ĐỖ GẦN - ĐẦY ĐỦ CÔNG NĂNG - NGÕ RỘNG - GIÁ ĐẦU TƯ 

- Trần Khất Chân, Nguyễn Khoái - Dt: 30m - Mt: 3.5m - chỉ 2.3 tỷ. Quá hiếm.

+ Nhà dân xây chắc chắn, đầy đủ công năng. Ngõ trước nhà rộng SH quay đầu thoải mái, Ô tô đỗ cách vài bước chân.
+ Xung quanh tiện ích nhiều vô kể, trường học các cấp, bãi gửi xe, đi bộ ra chợ dân sinh ... 
THIẾT KẾ:
+ Tầng 1: Phòng Bếp + Để xe + WC.
+ Tầng lửng: Phòng khách.
+ Tầng 2, 3: 03 phòng ngủ thiết kế lệch tầng + WC.
+ Tầng 4: Phòng thờ + Sân phơi. 
PHÁP LÝ:
+ Sổ đỏ chính chủ, sẵn sàng giao dịch 24/7.
Alo ngay em Lập chuyên nhà đẹp.","2,3 tỷ",30 m2,"Đường Trần Khất Chân,  Phường Yên Sở, Quận Hoàng Mai, Hà Nội",13199248,_,---,Cần bán,2m,---,Nhà trong hẻm,Sổ hồng/ Sổ đỏ,---,"3,5m",4,---,---,3,---
https://alonhadat.com.vn/nha-dep-tran-dai-nghia-dai-la-40m-kinh-doanh-sat-pho-o-to-nhinh-6-ty-13199255.html,"NHÀ ĐẸP TRẦN ĐẠI NGHĨA, ĐẠI LA 40m KINH DOANH, SÁT PHỐ, Ô TÔ nhỉnh 6 tỷ","+ Vị trí ngay gần ngã 4 Trần Đại Nghĩa cắt Đại La, gần nhiều trường đại học lớn, gần bệnh viện và các trung tâm thương mại...
+  Nhà mặt ngõ, kinh doanh, vài bước ra Đại La, Trần Đại Nghĩa, Lê Thanh Nghị. Chủ xây tâm huyết chọn từng bộ cửa đến tủ bếp. 
+ Kết hợp vừa ở, vừa kinh doanh thì tuyệt vời. Nhà xây mới Koong, khách về ở ngay.
- Thiết kế: 
+ Tầng 1: phòng khách, bếp, WC
+ Tầng 2, 3, 4 : mỗi tầng 1 phòng ngủ thoáng, WC.
+ Tầng 5: phòng thờ, sân phơi.
+ Sổ đỏ vuông vắn, giao dịch sẵn sàng 24/7.
Alo ngay em Lập chuyên nhà đẹp.","6,5 tỷ",40 m2,"Phố Trần Đại Nghĩa, Phường Trương Định, Quận Hai Bà Trưng, Hà Nội",13199255,_,---,Cần bán,3m,---,Nhà trong hẻm,Sổ hồng/ Sổ đỏ,---,---,5,---,---,3,---
https://alonhadat.com.vn/35m-5t-nha-minh-khai-o-ngay-sat-pho-o-to-gan-kinh-doanh-chi-3-45-ty-qua-hiem-13199262.html,"35m 5T nhà MINH KHAI, Ở NGAY, SÁT PHỐ, Ô TÔ GẦN, KINH DOANH chỉ 3.45 tỷ QUÁ HIẾM","+ Ngõ trước nhà gần 3m, quay xe thoải mái,cách 20m ra đường oto,150m ra phố Minh Khai, Đại La, Bạch Mai.
+ Gần trung tâm và các trường đại học lớn cũng như các tiện ích đầy đủ ko thiếu gì
+ Khu vực hàng xóm hòa đồng,yên tĩnh, có chỗ vui chơi cho trẻ con,chỗ để xe....
+ Khu vực gần như các ông bố bà mẹ luôn lựa chọn mua nhà cho con cái để đi học Đại Học.
NHÀ THIẾT KẾ 5 TẦNG ĐỦ CÔNG NĂNG CHO 1 GIA ĐÌNH SỬ DỤNG :
Tầng 1 : khách,bếp,để xe
Tầng 2,3,4 : mỗi tầng 1 ngủ rộng + wc
Tầng 5 : thờ,sân phơi.
+ Nhà sổ đỏ chính chủ,giao dịch ngay sẵn sàng. 
ALO ngay em Lập chuyên nhà đẹp Hà Nội.","3,45 tỷ",35 m2,"Đường Minh Khai, Phường Minh Khai, Quận Hai Bà Trưng, Hà Nội",13199262,_,---,Cần bán,"2,5m",---,Nhà trong hẻm,Sổ hồng/ Sổ đỏ,---,---,5,---,---,3,---
https://alonhadat.com.vn/mat-pho-dai-la-60m-5t-kinh-doanh-dinh-via-he-rong-thang-may-o-to-tranh-nhinh-14-ty-13199279.html,"MẶT PHỐ ĐẠI LA 60m 5T KINH DOANH ĐỈNH, VỈA HÈ RỘNG, THANG MÁY, Ô TÔ TRÁNH nhỉnh 14 tỷ","MẶT PHỐ ĐẠI LA - LÔ GÓC 3 MẶT THOÁNG - CÁCH CHỢ MƠ CHỈ VÀI BƯỚC CHÂN - QUY HOẠCH ỔN ĐỊNH

- Đại La - Dt: 60m - Mt: 4.7m - hơn 14 tỷ, quá hiếm. 
 
+ Vị trí nhà đắc địa, nằm ngay sát ngã 3 Đại La - Trần Đại Nghĩa - Lê Thanh Nghị. Gần các trường ĐH lớn : BÁCH - KINH - XÂY. 

+ Nhà bán thuộc mặt phố Đại La, vỉa hè rộng đá bóng. Kinh doanh gì cũng tiện.

+ Nhà hiện trạng 5 tầng thông sàn, cầu thang cuối, mỗi tầng một nhà wc, trước chủ cho thuê cả nhà với hơn 30tr, nhà khung cột bê tông chắc chắn, khách mua về chỉ cần vài thùng sơn là long lanh ngay. Có thể thiết kế thang máy.
+ Sổ đỏ chính chủ đang cất két sẵn sàng giao dịch.
Alo ngay em Lập chuyên nhà đẹp Hà Nội.","14,3 tỷ",60 m2,"Phố Đại La, Phường Trương Định, Quận Hai Bà Trưng, Hà Nội",13199279,_,---,Cần bán,25m,---,Nhà mặt tiền,Sổ hồng/ Sổ đỏ,---,"4,7m",5,---,---,4,---
https://alonhadat.com.vn/hiem-nha-hai-ba-trung-56m-mt-5-4m-lo-goc-3-thoang-o-to-kinh-doanh-o-cho-tm-chi-6-ty-13197834.html,"HIẾM NHÀ HAI BÀ TRƯNG 56m MT 5.4m - LÔ GÓC 3 THOÁNG - Ô TÔ - KINH DOANH, Ô CHỜ TM chỉ 6 tỷ","LÔ GÓC - 3 MẶT THOÁNG - NHÀ CHỦ TỰ XÂY CỰC KỲ CHẤT LƯỢNG - Ô CHỜ THANG MÁY - Ô TÔ NGAY GẦN NHÀ

- Lê Thanh Nghị, Thanh Nhàn - DT: 56m - MT : 5.4m - chỉ 6 tỷ, giá tốt ở ngay.

- Nhà chủ tự xây dựng, vô cùng tâm huyết và LỘC. Nhà mình có thể đi từ nhiều hướng khác nhau, từ phố Lê Thanh Nghị, Bạch Mai, Minh Khai vào.
- Ba bước ra phố, cách ô tô tránh 20m. Trung tâm của sự tiện ích.
- Nhà được thiết kế 5 tầng, tổng 8PN đủ công năng sử dụng.
Sổ đỏ chính chủ, giao dịch sẵn sàng 24/7. 
Alo ngay em Lập chuyên nhà đẹp.",6 tỷ,56 m2,"Phố Lê Thanh Nghị, Phường Thanh Nhàn, Quận Hai Bà Trưng, Hà Nội",13197834,_,---,Cần bán,"2,5m",---,Nhà trong hẻm,Sổ hồng/ Sổ đỏ,---,"5,4m",5,---,---,8,---
https://alonhadat.com.vn/ban-nha-bach-mai-nha-mat-pho-gia-mat-ngo-30m-nhinh-4ty-kinh-doanh-o-to-tranh-13197960.html,"BÁN NHÀ BẠCH MAI - NHÀ MẶT PHỐ GIÁ MẶT NGÕ 30m nhỉnh 4,7 tỷ KINH DOANH, Ô TÔ TRÁNH","TRUNG TÂM QUẬN - NHÀ MẶT PHỐ GIÁ MẶT NGÕ - KINH DOANH, Ô TÔ TRÁNH, MẶT TIỀN QUYỀN LỰC

+ Hai Bà Trưng - Dt: 30m - Mt : 5.6m - nhỉnh 4,7 tỷ, quá hiếm.

- Vị trí nhà là mặt phố, Quy hoạch ổn định, mặt tiền quyền lực, ô tô tránh trước nhà, kinh doanh bất chấp đa ngành nghề. Gần UBND Phường Quỳnh Lôi, Trường THCS Hà Huy Tập, Trường THPT Đoàn Kết Hai Bà Trưng…
- An ninh cực tốt, khu phố văn minh, tiện ích xung quanh ngập tràn, tiềm năng tăng giá lên từng ngày.
- Nhà xây khung cột bê tông chắc chắn, thiết kế đẹp mắt, thông minh và gọn gàng với 02 ngủ rộng đầy đủ công năng sử dụng.
- Sổ đỏ chính chủ, giao dịch sẵn sàng 24/7. 
Alo ngay em Lập chuyên nhà đẹp.","4,75 tỷ",30 m2,"Phố Bạch Mai, Phường Quỳnh Lôi, Quận Hai Bà Trưng, Hà Nội",13197960,_,---,Cần bán,"5,5m",---,Nhà trong hẻm,Sổ hồng/ Sổ đỏ,---,"5,6m",4,---,---,3,---
https://alonhadat.com.vn/nha-phan-lo-dai-la-42m-o-to-vao-nha-kinh-doanh-ngay-dem-lo-goc-3-thoang-hon-6-ty-13197995.html,"NHÀ PHÂN LÔ ĐẠI LA 42m Ô TÔ VÀO NHÀ - KINH DOANH NGÀY ĐÊM - LÔ GÓC 3 THOÁNG hơn 6,5 tỷ","PHÂN LÔ ĐẠI LA - Ô TÔ VÀO NHÀ - KINH DOANH NGÀY ĐÊM - LÔ GÓC 3 THOÁNG

+ Đại La 42m - nhỉnh 6,5 tỷ. Khu vực hiếm nhà bán

- Nhất vị nhì hướng nhà em có cả. Khu văn minh, hàng xóm toàn trí thức - lãnh đạo. Ô tô ra vào nhà thoải mái. 

- Kinh doanh cực đỉnh, ở sướng đất cực lộc vượng gia chủ. Chủ bán đất tặng nhà 3 tầng về ở thêm chục năm thoải mái.

- Nhà nằm giữa các quần thể trường Đại học lớn : Bách Khoa - Xây dựng - Quốc dân. Nhà mình thuộc phố Đại La, liền Phố Lê Thanh Nghị, Bạch Mai, Tạ Quang Bửu. 

- Sổ đỏ vuông đẹp, sẵn sàng giao dịch 24/7. 
Alo ngay em Lập chuyên nhà đẹp.","6,58 tỷ",42 m2,"Phố Đại La, Phường Trương Định, Quận Hai Bà Trưng, Hà Nội",13197995,_,---,Cần bán,"5,5m",---,Nhà trong hẻm,Sổ hồng/ Sổ đỏ,---,"3,6m",3,---,---,3,---
https://alonhadat.com.vn/ban-nha-minh-khai-37m-5t-nha-dan-xay-lo-goc-3-mat-thoang-o-cuc-loc-nhinh-3-ty-13198019.html,BÁN NHÀ MINH KHAI 37M 5T - NHÀ DÂN XÂY - LÔ GÓC 3 MẶT THOÁNG - Ở CỰC LỘC nhỉnh 3 tỷ,"NHÀ DÂN XÂY - LÔ GÓC 3 MẶT THOÁNG VĨNH VIỄN - Ở CỰC LỘC

- Minh Khai - Dt : 37m - Mt : 3.9m - Nhỉnh 3 tỷ. Quá hiếm.

- Nhà mình bán hàng xóm Times City, gần nhiều toà nhà chung cư cao cấp: Imperia Sky Garden, Hoà Bình Green City…, được hưởng trọn tiện ích khu vực, nhau cầu nhà ở cao.

- Khu vực tiện ích không thiếu gì, các trường học các cấp đều đạt chuẩn.

+ Nhà 5 tầng 4 PN rộng thoáng, 3 mặt thoáng vĩnh viễn, hàng xóm thân thiện, an ninh tốt.
- Sổ đỏ chính chủ, giao dịch sẵn sàng 24/7.
Alo ngay em Lập chuyên nhà đẹp.","3,85 tỷ",37 m2,"Đường Minh Khai, Phường Vĩnh Tuy, Quận Hai Bà Trưng, Hà Nội",13198019,_,---,Cần bán,"2,5m",---,Nhà trong hẻm,Sổ hồng/ Sổ đỏ,---,4m,5,---,---,4,---
https://alonhadat.com.vn/nha-dep-dai-la-30m-5t-sat-pho-o-ngay-tang-noi-that-tien-ty-nhinh-3-ty-13198770.html,"NHÀ ĐẸP ĐẠI LA 30m 5T SÁT PHỐ, Ở NGAY, TẶNG NỘI THẤT TIỀN TỶ nhỉnh 3 tỷ","NHÀ ĐẸP TUYỆT VỜI NỘI THẤT SANG XỊN GẦN PHỐ Ô TÔ CÁCH 20M

- Đại La - Dt: 30m - Mt: 3.8m - hơn 3 tỷ, nhà đẹp ở ngay.

- Trung tâm quận Hai Bà Trưng.

- Ngõ to, ô tô cách nhà 20M, cách phố đúng vài bước chân. 

- Xung quanh tiện ích bạt ngàn gần phố, chợ, trường mầm non…. 
- An sinh đỉnh cao.
- Thiết kế nhà 5 tầng 3 ngủ 4 wc. Đầy đủ công năng sử dụng.
- Sổ đỏ chính chủ, giao dịch sẵn sàng.
ALo ngay em Lập chuyên nhà đẹp.","3,82 tỷ",30 m2,"Phố Đại La, Phường Trương Định, Quận Hai Bà Trưng, Hà Nội",13198770,_,---,Cần bán,"2,5m",---,Nhà trong hẻm,Sổ hồng/ Sổ đỏ,---,"3,8m",5,---,---,3,---
https://alonhadat.com.vn/nha-dep-truong-dinh-57m-5pn-sat-pho-o-ngay-dan-xay-nhinh-4-ty-13198736.html,"NHÀ ĐẸP TRƯƠNG ĐỊNH 57m 5PN SÁT PHỐ, Ở NGAY, DÂN XÂY nhỉnh 4 tỷ","NHÀ ĐẸP - HAI MẶT THOÁNG - GIÁ TỐT - SỔ NỞ HẬU

- TRương Định - Dt: 57m - Mt: 4.7m - nhỉnh 4 tỷ, giá tốt - nhà đẹp.

+ Mặt trước và mặt sau cực thoáng sau.

+ Khu vực rất nhiều tiện ích: Bãi đỗ xe ô tô. Trường Cấp 1; Cấp 2. Chợ dân sinh sát nhà. Đại học Bách Khoa, Kinh Tế Quốc Dân, Trường Đại học Xây Dựng, Đại học Y và Bệnh viện Bạch Mai, Đại học Y có tiếng trên Hà Nội vây quanh.

+ Nhà được thiết kế 5 tầng 5PN đủ công năng sử dụng cho hộ gia đình đông người ở. 
+ Sổ đỏ chính chủ, giao dịch sẵn sàng 24/7.
Alo ngay em Lập chuyên nhà đẹp.","4,3 tỷ",57 m2,"Đường Trương Định, Phường Trương Định, Quận Hai Bà Trưng, Hà Nội",13198736,_,---,Cần bán,"2,5m",---,Nhà trong hẻm,Sổ hồng/ Sổ đỏ,---,"4,7m",5,---,---,5,---
https://alonhadat.com.vn/sieu-hiem-nha-pho-bach-mai-45m-6pn-o-to-do-cua-kinh-doanh-nha-dep-o-ngay-nhinh-6-ty-13198721.html,"Siêu hiếm nhà phố Bạch Mai 45m 6PN ô tô đỗ cửa, kinh doanh, nhà đẹp ở ngay nhỉnh 6 tỷ","NHÀ ĐẸP - TRUNG TÂM QUẬN - SÁT PHỐ - Ô TÔ ĐỖ CỬA - CHỦ TỰ XÂY DỰNG

- Bạch Mai - Dt: 45m - Mt: 4.2m - nhỉnh 6 tỷ, giá tốt - ở ngay.

- Nhà nằm ở vị trí nhất đẳng. Ô tô đỗ cửa, trước nhà siêu thoáng.

- Khu vực dân trí cao, an ninh đảm bảo.
- Nhà nằm ngay trung tâm các trường ĐH : BÁCH - KINH - XÂY. Khu vực tập trung nhiều sinh viên, đi lại thuận tiện. Nhu cầu nhà mình ở không hết có thể cho thuê lại các phòng.
- Được thiết kế 5 tầng, 6PN đủ công năng sử dụng cho gia đình đông người ở.

Pháp lý: Sổ đỏ chính chủ, Giao dịch ngay.
Alo ngay em Lập chuyên nhà đẹp.","6,9 tỷ",45 m2,"Phố Bạch Mai, Phường Bạch Mai, Quận Hai Bà Trưng, Hà Nội",13198721,_,---,Cần bán,"3,5m",---,Nhà trong hẻm,Sổ hồng/ Sổ đỏ,---,"4,2m",5,---,---,6,---
https://alonhadat.com.vn/hiem-nha-minh-khai-40m-5pn-dan-xay-lo-goc-sat-pho-nhinh-3-ty-13198586.html,"HIẾM NHÀ MINH KHAI 40m 5PN DÂN XÂY, LÔ GÓC, SÁT PHỐ nhỉnh 3 tỷ","2 MẶT THOÁNG SÁNG + LOGOC + 3 GÁC ĐỖ CỬA + 5 PHÒNG NGỦ XINH

- Minh Khai - Dt: 40m - Mt: 3.6m - hơn 3 tỷ, quá hiếm.

- Nhà vị trí đắc địa. Lô góc 3 2 mặt thoáng. Có thể đi từ nhiều đường vào khác nhau như Hồng Mai, Bạch Mai, Thanh Nhàn, thông sang Minh Khai, nhà cách mặt phố vài chục mét đi lại rất thuận tiện, gần trường tiện chợ, full tiện ích..
- Nhà 4 tầng, 5 ngủ, logoc, thoáng đẹp, phòng nào cũng có cửa sổ, ban công, có cổng để xe, lối đi chung 2 nhà, an sinh đỉnh.
+ Tầng 1: phòng khách rộng, bếp và WC.
 + Tầng 2,3: Mỗi tầng 2 phòng ngủ, wc.
 + Tầng 4 : 1 Phòng thờ, sân phơi và 1 phòng ngủ.
- Chủ bán đi để mua nhà khác to hơn, ở cực lộc. Giá tốt cho người thiện chí mua nhà.
- Sổ đỏ chính chủ và sẵn sàng giao dịch 24/7.
Alo ngay em Lập chuyên nhà đẹp.","3,8 tỷ",40 m2,"Đường Minh Khai, Phường Minh Khai, Quận Hai Bà Trưng, Hà Nội",13198586,_,---,Cần bán,"2,5m",---,Nhà trong hẻm,Sổ hồng/ Sổ đỏ,---,"3,6m",4,---,---,5,---
https://alonhadat.com.vn/ban-nha-thanh-nhan-40m-ngo-thong-kinh-doanh-nha-dan-xay-nhinh-4-ty-13278209.html,"BÁN NHÀ THANH NHÀN 40m NGÕ THÔNG, KINH DOANH,NHÀ DÂN XÂY nhỉnh 4 tỷ","BÁN NHÀ THANH NHÀN 40m NGÕ THÔNG, KINH DOANH,NHÀ DÂN XÂY nhỉnh 4 tỷ

- Nhà nằm trên mặt ngõ thông kinh doanh nhỏ, ngõ thông ra Thanh Nhàn, Minh Khai, Lê Thanh Nghị. Gần Viện Thanh Nhàn - Công Viên Võ Thị Sáu -1km tới Trường Đại Bách Khoa - Xây Dựng - Kinh tế. 
- Thiết kế 4 tầng, 3 ngủ rộng đủ công năng sử dụng cho đại gia đình. 
- Nội thất đẹp, xin sò. Khách mua về ở ngay mà chẳng cần sửa lại gì.
 - Sổ đỏ chính chủ, Nở hậu. Giao dịch sẵn sàng 24/7.
Alo ngay em Lập chuyên nhà đẹp Hà Nội.","4,3 tỷ",40 m2,"Đường Thanh Nhàn, Phường Thanh Nhàn, Quận Hai Bà Trưng, Hà Nội",13278209,_,---,Cần bán,3m,---,Nhà trong hẻm,Sổ hồng/ Sổ đỏ,---,---,4,---,---,3,---
https://alonhadat.com.vn/ban-nha-minh-khai-40m-5t-nha-moi-o-ngay-sat-pho-kinh-doanh-nhinh-4-ty-13262473.html,"BÁN NHÀ MINH KHAI 40m 5t NHÀ MỚI, Ở NGAY, SÁT PHỐ, KINH DOANH","NHÀ ĐÃ ĐẸP LUNG LINH - XÂY MỚI- GẦN PHỐ - YÊN TĨNH - Ở SƯỚNG

Minh Khai - DT:40m - Mt : 4.3m - Hơn 4 tỷ. Quá hiếm, ở ngay.

- Nhà ở vị trí rất gần phố. Tầm chục bước là ra mặt phố Minh Khai, liên phố Bạch Mai, Trương Định, Đại La. Trước nhà rộng thoáng, quay SH thoải mái. 
- Chính chủ nhà tự thiết kế và xây dựng tâm huyết. Có đầy đủ bản vẽ và GPXD. Nhà nằm gần quần thể trường ĐH lớn : BÁCH - KINH - XÂY. Phù hợp mua cho con học hành, thuận tiện di chuyển lên phố. 
*** Thiết kế: 
- Tầng 1: Khách bếp
- Tầng 2,3,4: thông sàn.
- Tầng 5: Phòng thờ + sân phơi
- Sổ đỏ chính chủ, giao dịch sẵn sàng 24/7
Alo ngay em Lập chuyên nhà đẹp Hà Nội.","4,35 tỷ",40 m2,"Đường Minh Khai, Phường Minh Khai, Quận Hai Bà Trưng, Hà Nội",13262473,_,---,Cần bán,3m,---,Nhà trong hẻm,Sổ hồng/ Sổ đỏ,---,"4,3m",5,---,---,3,---
https://alonhadat.com.vn/hiem-nha-minh-khai-66m-5-5m-mt-dien-tich-rong-sat-pho-gia-dau-tu-nhinh-6-ty-13262603.html,"HIẾM NHÀ MINH KHAI 66M 5.5m MT DIỆN TÍCH RỘNG, SÁT PHỐ, GIÁ ĐẦU TƯ 6,8 tỷ","HIẾM NHÀ MINH KHAI 66M 5.5m MT DIỆN TÍCH RỘNG, SÁT PHỐ, GIÁ ĐẦU TƯ

MINH KHAI - Dt: 66m - Mt: 5.5m - 6,8 tỷ, giá đầu tư. Hiếm

- Nhà trong ngõ thẳng đẹp cách mặt phố Minh Khai 25m. Chủ xác định bán đất, nhà đã cũ nhưng còn ở được thoải mái.
- Diện tích rộng, mặt tiền gần 6m không phải nhiều. Khu vực trung tâm của tiện ích. 
- Chủ xác định bán nhanh nên giá vô cùng hợp lý, phù hợp với mua đầu tư xây CCMN, giữ tiền hoặc tích sản. 
Tầng 1: Khách, ngủ, bếp, vệ sinh, cổng phụ có lối đi riêng.
Tầng 2: 2 phòng, phòng rộng có ban công, phòng nhỏ có vệ sinh trong.
Tầng 3: Tum, Sân phơi. 
Sổ đỏ sẵn sàng giao dịch 24/7.","6,8 tỷ",66 m2,"Đường Minh Khai, Phường Minh Khai, Quận Hai Bà Trưng, Hà Nội",13262603,_,---,Cần bán,2m,---,Nhà trong hẻm,Sổ hồng/ Sổ đỏ,---,"5,5m",3,---,---,3,---
https://alonhadat.com.vn/nha-dep-hai-ba-trung-35m-5t-o-to-kinh-doanh-o-ngay-nhinh-5-ty-hiem-13265421.html,"NHÀ ĐẸP HAI BÀ TRƯNG 35M 5T Ô TÔ, KINH DOANH, Ở NGAY nhỉnh 5 tỷ, hiếm","NHÀ ĐẸP MỚI KOONG - Ô TÔ - KINH DOANH - NGÕ TO SÁT PHỐ - TRUNG TÂM TIỆN ÍCH

- KIM NGƯU - Dt: 35m - Mt: 3.8m - Nhỉnh 5 tỷ, NHÀ ĐẸP.
+ Vị trí cực đẹp ngõ rộng ba gác vài bước ra PHỐ Kim Ngưu ô tô.
+ Thiết kế cơ bản 5 tầng 1 phòng đầy đủ công năng sử dụng.
+ Trước nhà siêu thoáng, gần trường học các cấp 1,2,3. Lên phố đi bộ siêu gần. Chủ nhà xây dựng tâm huyết, đầy đủ GPXD.
+ Sổ đỏ vuông vắn, chính chủ sẵn sàng giao dịch.","5,2 tỷ",35 m2,"Phố Kim Ngưu, Phường Thanh Nhàn, Quận Hai Bà Trưng, Hà Nội",13265421,_,---,Cần bán,"3,5m",---,Nhà trong hẻm,Sổ hồng/ Sổ đỏ,---,---,5,---,---,3,---
https://alonhadat.com.vn/ban-nha-minh-khai-35m-5t-o-to-tranh-kinh-doanh-ngo-thong-o-ngay-nhinh-4-ty-13265401.html,"BÁN NHÀ MINH KHAI 35m 5T Ô TÔ TRÁNH, KINH DOANH, NGÕ THÔNG, Ở NGAY nhỉnh 4 tỷ","MINH KHAI, HOÀNG MAI 35M 5T MỚI KOONG, Ô TÔ TRÁNH, KINH DOANH, NGÕ THÔNG

+ Vị trí nhà bán rất đẹp nằm trên mặt ngõ Minh Khai - Gốc Đề thông Hoàng Mai, Mai Động, Hồ Đền Lừ gần tổ hợp chung cư Feliz Home Hoàng Mai.
+ Nhà nằm ở vị trí mặt ngõ, ô tô tránh. Thuận tiện vừa ở, vừa kinh doanh đa dạng.
+ Nhà thiết kế hiện đại xây 5 tầng cầu thang cuối, sau nhà mở cửa sổ rất thoáng mỗi tầng 1 phòng rộng, 1 wc.
+ Sổ đỏ chính chủ, nở hậu sang tên ngay.","4,7 tỷ",35 m2,"Đường Minh Khai, Phường Minh Khai, Quận Hai Bà Trưng, Hà Nội",13265401,_,---,Cần bán,5m,---,Nhà trong hẻm,Sổ hồng/ Sổ đỏ,---,---,5,---,---,3,---
