url,title,description,price,area,address,Mã tin,Hướng,Phòng ăn,Loại tin,Đường trước nhà,Nhà bếp,Loại BDS,Pháp lý,Sân thượng,Chiều ngang,Số lầu,Chổ để xe hơi,Chiều dài,Số phòng ngủ,Chính chủ
https://alonhadat.com.vn/ban-nha-mat-pho-doi-can-doan-dau-pho-dt-40m-tang-2-la-51m-gia-11-9-ty-13576806.html,"Bán nhà mặt phố Đội Cấn đoạn đầu phố DT 40m, tầng 2 là 51m, giá 11.9 tỷ","- Vị trí đầu phố gần ngã ba giao với phố Giang Văn Minh, bảo tàng B52. Đặc biệt phố Đội Cấn đã là phố 2 chiều nên rất thuận tiện cho kinh doanh buôn bán
- DT 38m2, DT tầng 2 là 51m2, MT 3.3m 
- Hiện trạng là nhà 2 tầng hiện đang kinh doanh rất hiệu quả
- Sổ đỏ cá nhân, giá 11.9 tỷ
Chi tiết liên hệ Đinh Tuyên","11,9 tỷ",38 m2,"Phố Đội cấn, Phường Đội Cấn, Quận Ba Đình, Hà Nội",13576806,_,---,Cần bán,10m,---,Nhà mặt tiền,---,---,---,2,---,---,2,---
https://alonhadat.com.vn/ban-dat-lo-goc-ngo-31-xuan-dieu-sau-ho-tay-1-nha-dt-122m2-mt-8-5m-gia-20-ty-12404040.html,"Bán đất lô góc ngõ 31 Xuân Diệu, sâu hồ Tây 1 nhà DT 122m2, MT 8.5m giá 20 tỷ","- Vị trí lô góc 2 mặt thoáng chỉ sau 1 nhà là ra mặt hồ Tây, ngõ rộng, cách ô tô tránh chỉ 5m 
- Khu vực rất nhiều người nước ngoài đang sinh sống
- DT 122m2, MT 8.5m 
- Thích hợp xây căn hộ dịch vụ, an sinh, vừa ở kết hợp cho thuê
- Sổ đỏ chính chủ, giá 20 tỷ có thương lượng
Chi tiết liên hệ Đinh Tuyên",20 tỷ,122 m2,"Đường Xuân Diệu, Phường Quảng An, Quận Tây Hồ, Hà Nội",12404040,_,---,Cần bán,4m,---,"Đất thổ cư, đất ở",---,---,---,---,---,---,---,---
https://alonhadat.com.vn/-hiem-ban-nha-2-mat-pho-tran-nhan-tong-sat-pho-hue-140m2-mat-tien-20m--13478426.html,"[ HIẾM ] BÁN NHÀ 2 MẶT PHỐ TRẦN NHÂN TÔNG SÁT PHỐ HUẾ 140M2, MẶT TIỀN 20M.","[ HIẾM ] BÁN NHÀ 2 MẶT PHỐ TRẦN NHÂN TÔNG SÁT PHỐ HUẾ 140M2, MẶT TIỀN 20M.
Vị trí thuộc vào hàng hiếm có cực khó tìm, kinh doanh buôn bán tấp nập ngày đêm, khu vực dân cư tập trung, dân trí cao, giao thông thuận tiện ra Quang Trung, Trần Bình Trọng, Bà Triệu, Bùi Thị Xuân, gần Công Viên Thống Nhất, Rạp Xiếc Trung Ương.
Nhà diện tích rộng 140m2, mặt tiền 20m nhà 2 mặt phố thửa đất vuông vức, phù hợp mọi mô hình kinh doanh lớn nhỏ.
- Sổ đỏ chính chủ, vuông vức, Chủ cần bán gấp, giá chào cực thiện chí. 
HOTLINE:Hỗ trợ Quý khách.",98 tỷ,140 m2,"Phố Trần Nhân Tông, Phường Bùi Thị Xuân, Quận Hai Bà Trưng, Hà Nội",13478426,_,True,Cần bán,20m,True,Nhà trong hẻm,Sổ hồng/ Sổ đỏ,True,20m,3,True,0m,3,---
https://alonhadat.com.vn/sieu-pham-nha-mat-pho-lo-goc-hai-duong-lon-pho-ton-duc-thang-chi-25-ty-12926832.html,"SIÊU PHẨM NHÀ MẶT PHỐ LO GÓC HAI ĐƯỜNG LỚN, PHỐ TÔN ĐỨC THẮNG CHỈ   25 TỶ","mặt phố Tôn Đức Thắng quận Đống Đa HN
  
MẶT PHỐ KINH DOANH, LÔ GÓC 2 MẶT PHỐ ĐẸP, CHO THUÊ HIỆU SUẤT CAO, CHỦ LÀM NGÂN HÀNG CÓ THỂ HỖ TRỢ KHÁCH VAY. 
+ dt 52m x3t mt 10m chỉ 25 tỷ
- Nhà bán nằm ngay đầu phố Tôn Đức Thắng, lô góc với phố Hồ Giám. 
- Vị trí siêu đẹp, gần Văn Miếu - Quốc Tử Giám, kinh doanh vô địch. 
+ Hiện trạng: nhà 3 tầng, mỗi tầng 1 phòng, cầu thang cuối, chủ đang cho thuê với giá 30 triệu/tháng. Khách mua về có thể tiếp tục cho thuê hoặc đầu tư kinh doanh theo ý muốn. 
+ Sổ đỏ chính chủ, 
 LIÊN HỆ a Kiên",25 tỷ,52 m2,"Phố Tôn Đức Thắng, Phường Hàng Bột, Quận Đống Đa, Hà Nội",12926832,_,True,Cần bán,12m,True,Nhà mặt tiền,Sổ hồng/ Sổ đỏ,True,---,3,True,---,3,---
https://alonhadat.com.vn/-can-ban-nhanh-nha-dep-lo-goc-dan-xay-ngo-thong-2-thoang-oto--13735675.html,+CẦN BÁN NHANH-NHÀ ĐẸP-LÔ GÓC-DÂN XÂY-NGÕ THÔNG-2 THOÁNG-ÔTÔ .,"+CẦN BÁN NHANH-NHÀ ĐẸP-LÔ GÓC-DÂN XÂY-NGÕ THÔNG-2 THOÁNG-ÔTÔ.


+B.Á.N N.H.À-Thượng Thanh-Long Biên-Dt 44m-4T-Chỉ 4.tỷ khách thích,giá nào cũng chơi.

- Vi trí hót,NGÕ RỘNG lô góc,ô tô vào nhà,ở làm VP cho thuê,dòng tiền tốt,sinh lời đỉnh,đầu tư giữ tiền 1,2 năm giá X2,3x.Tiện ích ngập tràn ko thiếu thứ gì,dân trí cao,an ninh cực tốt.

+Nhà 4T:3N+K+Thờ+Bếp+sân Phơi+wc 3.

- Sổ đỏ HOA HẬU sẵn sàng giao dịch.",4 tỷ,44 m2,"38 Đường Thượng Thanh, Phường Thượng Thanh, Quận Long Biên, Hà Nội",13735675,Nam,True,Cần bán,4m,True,Nhà trong hẻm,Sổ hồng/ Sổ đỏ,True,4m,4,---,11m,3,---
https://alonhadat.com.vn/duy-nhat-manh-dat-vang-khu-hoang-cau-dt61m2-gia-10-6ty-mat-tien-dep-10141117.html,DUY NHẤT MẢNH ĐẤT VÀNG KHU HOÀNG CẦU DT61m2 GIÁ 10.6TỶ MẶT TIỀN ĐẸP,"ĐẤT VÀNG DUY NHẤT 1 NHÀ BÁN PHỐ HOÀNG CẦU -TRẦN QUANG DIÊU DT61m2 - KINH DOANH SẦM UẤT
+ Ngõ phân lô hạ tầng đồng bộ đẹp nhất phố HOÀNG CẦU - TRẦN QUANG DIỆU ngõ thẳng tắp sạch sẽ văn minh, đường trước nhà rộng 2 ô tô tránh thoải mái , 
+ Pháp lý rõ ràng, sổ đỏ chính vuông như tờ A4 chủ sẵn sàng giao
+ Nhà 3 tầng cũ chủ xác định bán đất, khu phân lô nên có cả thoáng sau.
+ Vị trí rất đẹp hiếm nhà bán sau quận ủy ĐỐNG ĐA PHỐ HOÀNG CẦU - TRẦN QUANG DIỆU khu trung tâm sầm uất, an ninh tốt, dân trí cao rất phù hợp để an sinh lâu dài. Giao thông thuận tiện ra các phố HÀO NAM, HOÀNG CẦU, THÁI HÀ, Ô CHỢ DỪA, ....
 dịch 
+ Giá bán: 10.6 tỷ CHỦ RẤT CẦN BÁN thương lượng trực tiếp chủ nhà
+ Liên hệ : Gọi ngay Mr.Tuấn chuyên nhà đẹp ĐỐNG ĐA","10,6 tỷ",61 m2,"Phố Hoàng Cầu, Phường Ô Chợ Dừa, Quận Đống Đa, Hà Nội",10141117,_,True,Cần bán,6m,True,Nhà trong hẻm,Sổ hồng/ Sổ đỏ,True,"5,2m",3,True,---,3,---
https://alonhadat.com.vn/can-ban-nhanh-nha-xay-moi-ngo-141-nam-du-dt-40m-mt-5m-ngo-rong-3m-12472095.html,"Cần bán nhanh nhà xây mới ngõ 141 Nam Dư, DT 40m, MT 5m ngõ rộng 3m","- Nhà xây mới tuyệt đẹp, khách mua về ở ngay
- DT 40m2, MT 5m vuông vắn
- Thiết kế mỗi tầng 1 phòng rộng và đẹp
- Ngõ rộng 3m thông các ngả
- Khu trung tâm, đi lại thuận tiện, gần trường, chợ
Sổ đỏ chính chủ, giá 3.7 tỷ có thương lượng
Chi tiết liên hệ Đinh Tuyên","3,7 tỷ",40 m2,"Đường Nam Dư, Phường Lĩnh Nam, Quận Hoàng Mai, Hà Nội",12472095,_,---,Cần bán,3m,---,Nhà trong hẻm,---,---,---,5,---,---,4,---
https://alonhadat.com.vn/-dep-khong-ti-vet-lo-goc-2-mat-ngo-thang-may-kinh-doanh-dinh--13734165.html,+ĐẸP KHÔNG TÌ VẾT-LÔ GÓC-2 MẶT NGÕ-THANG MÁY-KINH DOANH ĐỈNH.,"+ĐẸP KHÔNG TÌ VẾT-LÔ GÓC-2 MẶT NGÕ-THANG MÁY-KINH DOANH ĐỈNH.

+B.Á.N N.H.À-NGÔ GIA TỰ-ĐỨC GIAN-LONG BIÊN-Dt86-5t -11.xTỷ -Còn thương lượng.

-Vi trí đắc địa,lô góc 2 mặt ngõ đều ô tô tránh,làm VP,KD,P.khám,mầm non tư thục..,dòng tiền cực tốt,sinh lời cao.Từ mầm non đến 1,2,3,chợ,khu dân trí cao,an ninh tốt,thuận tiện giao thông đi các ngã.

+Nhà thiết kế cực hiện đại,nội thật xịn xò.5 tầng :1,2 thông sàn 3,4 mỗi tầng 2 ngủ khép kín,5 phòng thờ +sân phơi.

- Sổ đỏ HOA HẬU sẵn sàng giao dịch.",11 tỷ,86 m2,"39 Đường Ngô Gia Tự, Phường Đức Giang, Quận Long Biên, Hà Nội",13734165,Tây Nam,True,Cần bán,6m,True,Nhà trong hẻm,Sổ hồng/ Sổ đỏ,True,"4,5m",5,True,"19,5m",4,---
https://alonhadat.com.vn/hang-hiem-phan-lo-huynh-thuc-khang-dt49m2-thang-may-mat-tien-dep-11914090.html,"HÀNG HIẾM PHÂN LÔ HUỲNH THÚC KHÁNG DT49m2- THANG MÁY, MẶT TIỀN ĐẸP","HÀNG HIẾM KHU PHÂN LÔ PHỐ HUỲNH THÚC KHÁNG THÔNG NGUYÊN HỒNG, NGÕ RỘNG THOÁNG :DT49.5 m2 THANG MÁY NHẬP KHẨU MẶT TIỀN ĐẸP 
+ Vị trí đẹp hiếm nhà bán rất gần phố HUỲNH THÚC KHÁNG THÔNG NGUYÊN HỒNG trước nhà rộng, gần trường TH PHAN HUY CHÚ, an ninh tốt, dân trí cao, tiện ích sống ngập tràn  
+ Nhà 7 tầng THANG MÁY NHẬP KHẨU,thiết kế sang trọng cầu thang cuối, chủ tự xây rất chắc chắn đầy đủ công năng phục vụ gia đình mặt tiền đẹp, 
+ Pháp lý rõ ràng, sổ đỏ chính chủ sổ PHÂN LÔ vuông như tờ A4 sẵn sàng giao dịch
+ Giá bán: 8.85 tỷ thương lượng trực tiếp chủ nhà
+ Liên hệ : Mr.TUẤN PHỐ chuyên nhà phố Đống Đa","8,85 tỷ",49 m2,"Phố Huỳnh Thúc Kháng, Phường Láng Hạ, Quận Đống Đa, Hà Nội",11914090,_,True,Cần bán,5m,True,Nhà trong hẻm,Sổ hồng/ Sổ đỏ,True,"4,1m",7,True,---,4,---
https://alonhadat.com.vn/hang-hiem-pho-nguyen-thi-dinh-5tang-7-8ty-phan-lo-mat-tien-dep-11930615.html,"HÀNG HIẾM PHỐ NGUYỄN THỊ ĐỊNH 5TẦNG 7.8TỶ PHÂN LÔ, MẶT TIỀN ĐẸP","* HÀNG HIẾM NHÀ BÁN PHỐ NGUYỄN THỊ ĐỊNH - HOÀNG NGÂN NHÀ ĐẸP 5 TẦNG KHU PHÂN LÔ, MẶT TIỀN RỘNG -KINH DOANH SẦM UẤT 
+ Khu phân lô hạ tầng đồng bộ ngõ rộng, thông thoáng, sạch sẽ văn minh ÔTÔ đỗ cửa. Khu dân trí cao tiện ích sống ngập tràn, rất phù hợp để an cư lâu dài  
+ Nhà 5T chủ tự xây được vài năm còn rất mới, thiết kế chắc chắn sang trọng. thiết bị vệ sinh nhập khẩu, các phòng ngủ thoáng sáng
+ Pháp lý rõ ràng, sổ đỏ chính chủ, vuông như tờ A4 sẵn sàng giao dịch
+ Giá chào: 7.8 tỷ thương lượng trục tiếp với chủ nhà
+ Liên hệ:  Mr.TUẤN PHỐ chuyên nhà đất Cầu Giấy","7,8 tỷ",38 m2,"Đường Nguyễn Thị Định, Phường Trung Hòa, Quận Cầu Giấy, Hà Nội",11930615,_,True,Cần bán,6m,True,Nhà trong hẻm,Sổ hồng/ Sổ đỏ,True,4m,5,True,---,5,---
https://alonhadat.com.vn/hang-hiem-khu-phan-lo-tran-quang-dieu-dt52m2-kinh-doanh-thang-may-12694748.html,HÀNG HIẾM KHU PHÂN LÔ TRẦN QUANG DIỆU DT52m2- KINH DOANH + THANG MÁY,"CHỦ CẦN TIỀN BÁN GẤP KHU PHÂN LÔ 1 NHÀ RA PHỐ TRẦN QUANG DIỆU - QUẬN ỦY ĐỐNG ĐA, NGÕ RỘNG THOÁNG:DT48m2 THANG MÁY NHẬP KHẨU MẶT TIỀN ĐẸP - KINH DOANH 
+ Vị trí đẹp hiếm nhà bán rất gần PHỐ TRẦN QUANG DIỆU - QUẬN ỦY ĐỐNG ĐA trước nhà rộng Ô TÔ cách vài bước,  an ninh tốt, dân trí cao, tiện ích sống ngập tràn  
+ Nhà 7 tầng THANG MÁY NHẬP KHẨU,thiết kế hiện đại sang trọng, chủ tự xây rất chắc chắn đầy đủ công năng phục vụ gia đình mặt tiền đẹp, 
+ Pháp lý rõ ràng, sổ đỏ chính chủ sổ PHÂN LÔ vuông như tờ A4 sẵn sàng giao dịch
+ Giá bán: 11.3 tỷ thương lượng trực tiếp chủ nhà
+ Liên hệ : Mr.TUẤN PHỐ chuyên nhà đẹp Đống Đa","11,3 tỷ",48 m2,"Phố Trần Quang Diệu, Phường Ô Chợ Dừa, Quận Đống Đa, Hà Nội",12694748,_,True,Cần bán,5m,True,Nhà trong hẻm,Sổ hồng/ Sổ đỏ,True,"4,1m",7,True,---,4,---
https://alonhadat.com.vn/ban-biet-thu-mat-pho-to-ngoc-van-dt-171m-mt-14-8m-gia-70-ty-13310561.html,"Bán biệt thự mặt phố Tô Ngọc Vân DT 171m, MT 14.8m giá 70 tỷ","- Vị trí tuyệt đẹp, khu vực rất nhiều người nước ngoài sinh sống
- Nhà gần hồ Tây, các nhà hàng sang trọng, bar, khách sạn cao cấp dành cho khách quốc tế
- Hiện trạng là biệt thự 4 tầng thiết kế đẹp, hài hòa
- Thích hợp cho an sinh hoặc xây mới tòa văn phòng, khách sạn, căn hộ cao cấp, nahf hàng ...
- Sổ đỏ cá nhân, giá 70 tỷ có thương lượng
Chi tiết liên hệ Đinh Tuyên",70 tỷ,171 m2,"Đường Tô Ngọc Vân, Phường Quảng An, Quận Tây Hồ, Hà Nội",13310561,_,---,Cần bán,12m,---,"Biệt thự, nhà liền kề",---,---,---,4,---,---,6,---
https://alonhadat.com.vn/-cuc-nong-can-ban-gap-can-nha-hang-xom-khai-son-10m-ra-pho--13729737.html,+CỰC NÓNG-CẦN BÁN GẤP-CĂN NHÀ-HÀNG XÓM KHAI SƠN-10M RA PHỐ.,"+CỰC NÓNG-CẦN BÁN GẤP-CĂN NHÀ-HÀNG XÓM KHAI SƠN-10M RA PHỐ.

+B.Á.N N.H.À-Lý Sơn-Thượng Thanh-Long Biên-DT74M-3T-Mt4.5-4.Tỷ -Còn thương lượng.

- Vi trí cực hót,gần trường từ mầm non đến 123,chợ,khu dân trí cao,an ninh tốt,thuận tiện giao thông đi các ngã.

+Nhà thiết kế 3 tầng :Sân,cổng,khách +3n+Bếp+Phòng thờ+Sân Phơi+3WC(hiện đang cho thuê)

- Sổ đỏ HOA HẬU sẵn sàng giao dịch.",4 tỷ,74 m2,"12 Đường Lý Sơn, Phường Thượng Thanh, Quận Long Biên, Hà Nội",13729737,Tây Nam,True,Cần bán,3m,True,Nhà trong hẻm,Sổ hồng/ Sổ đỏ,True,"4,5m",3,---,"16,4m",3,---
https://alonhadat.com.vn/dat-vang-khu-quan-uy-ben-ho-long-gio-dt87m2-gara-mat-tien-rong-9887291.html,ĐẤT VÀNG KHU QUẬN ỦY BÊN HỒ LỘNG GIÓ DT87m2 GARA + MẶT TIỀN RỘNG,"CẦN BÁN GẤP ĐẤT VÀNG KHU HOÀNG CẦU DIỆN TÍCH 87m2 GARA, MẶT TIỀN LỘNG GIÓ KINH DONH SẦM UẤT
+ Vị trí cực kỳ đắc địa bên khu HOÀNG CẦU - QUẬN ỦY ĐỐNG ĐA, ôtô dừng đỗ vào nhà thoải mái.Phù hợp xây tòa nhà sang trong đẳng cấp ở kết hợp văn VP cho thuê, Phòng khám, Siêu thị... Hưởng trọn tiện ích khu trung tâm sầm uất, an ninh tốt, dân trí cao rất tiện lợi cho sinh hoạt hàng ngày
+ Hiện trạng nhà 3 tầng cũ đang cho thuê kinh doanh, chủ xác định bán đất 
+ Giao thông thuận tiện ra các phố HOÀNG CẦU, THÁI HÀ, Ô CHỢ DỪA, LÁNG HẠ, HUỲNH THÚC KHÁNG....
+ Pháp lý rõ ràng, sổ đỏ chính chủ vuông như tò A4 sẵn sàng giao dịch
+ Giá bán: 15.8 tỷ thương lượng trực tiếp chủ nhà
+ Liên hệ : Mr.Tuấn nhà đất Đống Đa","15,8 tỷ",87 m2,"Phố Hoàng Cầu, Phường Ô Chợ Dừa, Quận Đống Đa, Hà Nội",9887291,_,True,Cần bán,6m,True,Nhà trong hẻm,Sổ hồng/ Sổ đỏ,True,"5,1m",3,True,---,4,---
https://alonhadat.com.vn/ban-toa-nha-mat-pho-vong-thi-220m-10-tang-mt-13m-9192539.html,"Bán tòa nha mặt phố Võng Thị 220m, 10 tầng, MT 13m","- Vị trí đắc địa đẹp nhất phố Võng Thị
- DT 220m2, MT 13m vuông vắn
- Hiện trạng là tòa nhà xây mới, khách mua về vận hàng và khai thác tạo dòng tiền ngay
- Thiết kế 10 tầng trong đó có 1 tầng hầm để xe, các tầng còn lại thiết kế mỗi tầng 2 phòng theo mô hình văn phòng cho thuê
- Khu vực có nhiều khách nước ngoài đang sinh sống
- Sổ đỏ chính chủ, giá 65 tỷ
Chi tiết liên hệ Đinh Tuyên",65 tỷ,220 m2,"Phố Võng Thị, Phường Bưởi, Quận Tây Hồ, Hà Nội",9192539,_,---,Cần bán,15m,---,Nhà mặt tiền,---,---,---,10,---,---,17,---
https://alonhadat.com.vn/gap-can-ban-shop-chan-de-hoang-dao-thuy-gia-1-2-thi-truong-so-lau-dai-da-co-khach-thue-12963742.html,GÂP+ cần bán shop chân đế Hoàng Đạo Thúy giá 1/2 thị trường sổ lâu dài - Đã có khách thuê,"àng hiếm duy nhất số lượng có hạn - shophouse Chân đế Hoàng Đạo Thúy - Trung Hòa - Sổ lâu dài.
Shop chân đế Hoàng Đạo Thúy giá 1/2 thị trường, sổ lâu dài.
Giá đang cho thuê thời điểm hiện tại gần 200 triệu/1 tháng DT từ 187m² - 800m². 5 làn đường thênh thang. Đã có KH cho thuê sẵn.
- Diện tích: 255m² -413m2
Mua vào ĐÃ có sẵn dòng tiền luôn còn gì bằng.
Pháp lý đã CÓ sổ LÂU DÀI
Giờ mà có hàng pháp lý ngon giá siêu siêu tốt, cho thuê dòng tiền cao, đều hàng năm, tiềm năng tăng giá x2.3 anh chị k đầu tư, thì đầu tư ở đâu nữa ạ.
Liên hệ ngay em: 
(Ms. Ngọc Ánh)",30 tỷ,255 m2,"Đường Hoàng Đạo Thúy, Phường Trung Hòa, Quận Cầu Giấy, Hà Nội",12963742,_,---,Cần bán,---,---,"Shop, kiot, quán",---,---,---,---,---,---,---,---
https://alonhadat.com.vn/ban-nha-mat-pho-giang-vo-dt-88m-mt-5-5m-gia-chi-24-ty-10550504.html,"Bán nhà mặt phố Giảng Võ DT 88m, MT 5.5m giá chỉ 24 tỷ","- Vị trí đắc địa tọa lạc trên tuyến phố huyết mạch của quận Đống Đa và Ba Đình
- DT sổ đỏ 80m2, thực tế là 88m2, MT 5.5m vuông vắn
- Là nhà 4 tầng cũ nhưng vẫn cho thuê kinh doanh hiệu quả
- Thích hợp xây mới tòa văn phòng, công ty, ở + kinh doanh, cho thuê giữ tiền  ...
- Nhà gần ga tầu trên cao Cát Linh, khách sạn Pulma, bến xe Kim Mã ...
- Sổ đỏ cá nhân sẵn sàng giao dịch, giá 24 tỷ có thương lượng
Chi tiết liên hệ Đinh Tuyên",24 tỷ,88 m2,"Phố Giảng Võ, Phường Cát Linh, Quận Đống Đa, Hà Nội",10550504,_,---,Cần bán,20m,---,Nhà mặt tiền,---,---,---,4,---,---,5,---
https://alonhadat.com.vn/pho-phan-lo-trung-hoa-trung-yen-dt72x5tang-gia-12-6-ty-8845413.html,PHỐ PHÂN LÔ TRUNG HÒA- TRUNG YÊN DT72X5TẦNG GIÁ 12.6 Tỷ,"HÀNG HIẾM TRUNG HÒA - TRUNG YÊN DT: 72m2X5T KD SẦM UẤT - MT 5M
+ Nhà rộng thiết kế sang trọng, hiện đại chủ tự xây gồm 5 tầng khang trang 5 phòng ngủ rộng, chủ để khe thoáng sau nên phòng nào cũng có cửa sổ thoáng mát, công năng sử dụng hợp lý ,
+ Khu phân lô ngõ rộng có vỉa hè 2 bên, thông thoáng, sạch sẽ văn minh ÔTÔ VÀO NHÀ. Giao thông thuận tiện ra các phố lớn : TRUNG HÒA, TRUNG KÍNH, TRẦN KIM XUYẾN, VŨ PHẠM HÀM, TRUNG YÊN,NGUYỄN KHANG..... 
+ Pháp lý rõ ràng, sổ đỏ chính chủ vuông như tờ A4 sẵn sàng giao dịch 
+ Vị trí cực kỳ đẹp PHỐ TRUNG HÒA - TRUNG YÊN, khu phân lô kinh doanh sầm uất,an ninh tốt, dân trí cao rất phù hợp để an cư lâu dài 
+ Giá bán: 12.6 tỷ 
+ Liên hệ : Mr.Tuấn chuyên nhà đất Cầu Giấy","12,6 tỷ",72 m2,"Đường Trung Hòa, Phường Trung Hòa, Quận Cầu Giấy, Hà Nội",8845413,_,True,Cần bán,6m,True,Nhà trong hẻm,Sổ hồng/ Sổ đỏ,True,5m,5,True,---,5,---
https://alonhadat.com.vn/-ban-gap-toa-vp-hang-a-pho-duong-khue-120m2-10t-mt-10m-thong-san-kd--13488284.html,"[ BÁN GẤP ] TÒA VP HẠNG A PHỐ DƯƠNG KHUÊ 120M2, 10T, MT 10M, THÔNG SÀN KD.","[ BÁN GẤP ] TÒA VP HẠNG A PHỐ DƯƠNG KHUÊ 120M2, 10T, MT 10M, THÔNG SÀN KD.
Vị trí siêu đắc địa nhà gần Phố Nguyễn Hoàng, đường Lê Đức Thọ, đường Hồ Tùng Mậu…Vỉa hè rộng ô tô dừng đỗ thoải mái.
Tòa văn phòng thiết kế theo tiêu chuẩn Văn phòng Hạng A, dịch vụ cao cấp, thang máy nhập khẩu, các tầng thông sàn thang máy, chủ hiện đang cho thuê doanh thu 2 tỷ/năm.
- Sổ đỏ chính chủ, vuông vức, GPXD, PCCC đầy đủ. Chủ cần bán gấp, giá chào cực thiện chí. 
HOTLINE:Hỗ trợ Quý khách.","47,8 tỷ",120 m2,"Đường Dương Khuê, Phường Mai Dịch, Quận Cầu Giấy, Hà Nội",13488284,_,True,Cần bán,20m,True,Văn phòng,Sổ hồng/ Sổ đỏ,True,10m,10,True,---,4,---
https://alonhadat.com.vn/so-gui-ngan-hang-chu-can-ban-gap-khach-san-10t-thai-ha-lo-goc-oto-kd-dinh--13532576.html,SỔ GỬI NGÂN HÀNG - CHỦ CẦN BÁN GẤP- KHÁCH SẠN 10T THÁI HÀ - LÔ GÓC- OTO - KD ĐỈNH.,"[ CỰC PHẨM] BÁN KHÁCH SẠN 10 TẦNG PHỐ THÁI HÀ - LÔ GÓC - Ô TÔ - GẦN HỒ.
Vị trí là 1 trong những phố kinh doanh tấp nập suốt ngày đêm nơi kinh doanh bậc nhất quận Đống Đa.  Xung quanh rất nhiều tòa cao ốc văn phòng, khu vực dân cư đông đúc an sinh xã hội cực tốt, dân trí cao, yên tĩnh. Giao thông thuận tiện di chuyển thuận tiện ra các tuyến phố như Thái Thịnh, Tây Sơn, Yên Lãng, Chùa Bộc, Huỳnh Thúc Kháng, Hoàng Cầu, …
- Diện tích 140m2, mặt tiền 8.5m, Lô góc 2 mặt ngõ rộng, Tòa nhà thiết kế 10 tầng bao gồm 46 căn hộ cho thuê, trang bị đầy đủ công năng, nội thất của những tòa KS cao cấp. 
- Sổ đỏ vuông vắn, nở hậu,đã hoàn công trên sổ, sang tên luôn.
HOTLINE:Hỗ trợ Quý khách.","31,7 tỷ",140 m2,"Phố Thái Hà, Phường Trung Liệt, Quận Đống Đa, Hà Nội",13532576,_,True,Cần bán,3m,True,Nhà trong hẻm,Sổ hồng/ Sổ đỏ,True,"8,5m",4,True,0m,2,---
