https://alonhadat.com.vn/phan-lo-pho-thanh-nhan-ngo-thong-o-to-tranh-95m2x4-tang-15-8-ty-nha-dep-o-ngay--13510819.html,"PHÂN LÔ PHỐ THANH NHÀN, NGÕ THÔNG, Ô TÔ TRÁNH, 95m2x4 TẦNG, 15,8 Tỷ. NHÀ ĐẸP Ở NGAY.","PHÂN LÔ PHỐ THANH NHÀN, NGÕ THÔNG, Ô TÔ TRÁNH, 95m2x4 TẦNG, 15,8 Tỷ. NHÀ ĐẸP Ở NGAY.

+ Nằm trong khu phân lô cao cấp đẹp nhất phố Thanh Nhàn, an ninh, dân trí, hàng xóm cực kỳ văn minh, nhiều cây xanh, môi trường sống quá lý tưởng. 

+ Trung tâm quận Hai Bà Trưng, bạt ngàn tiện ích, vài bước ra Bệnh viện Thanh Nhàn, Công viên Võ Thị Sáu, Đại học Bách Khoa, Kinh Tế, Xây Dựng, vài phút di chuyển vào Phố cổ. 

+ Mặt ngõ rộng mênh mông, thông bàn cờ, 3 ô tô tránh nhau, dừng đỗ ngày đêm, mặt tiền rộng hơn 8m, không có căn thứ 2.

+ Gia chủ thuê thiết kế theo lối Biệt thự Pháp cổ, chất lượng cực tốt, tâm huyết từ viên gạch đầu tiên cho đến hoàn thiện. 

+ Toàn bộ đồ gỗ trong nhà như cầu thang, sàn nhà đều là Lim của Nghệ An siêu đắt tiền.

+ Thiết kế tổng thể: 2 mặt thoáng trước sau vĩnh viễn.
- Tầng 1: Sân + Khách + Bếp + Vs + Gara 
- Tầng 2: sảnh chơi, tiếp khách + 2 ngủ master.  
- Tầng 3: 3 ngủ + vs. 
- Tầng 4: phòng thờ. Sân phơi. Sân nướng BBQ.

+ Dt: 95m, 4 tầng, mặt tiền rộng 8,5m.

+ Sổ đỏ chính chủ, giao dicjg ngay.

+ Giá bán 15,8 tỷ có ra lộc.

Quý khách quan tâm vui lòng gọi ngay để được em Hùng Anh (1980) hỗ trợ xem nhà ngay hôm nay.","15,8 tỷ",95 m2,"Đường Thanh Nhàn, Phường Thanh Nhàn, Quận Hai Bà Trưng, Hà Nội",13510819,_,True,Cần bán,9m,True,Nhà trong hẻm,Sổ hồng/ Sổ đỏ,True,"8,5m",4,True,---,5,---
https://alonhadat.com.vn/phan-lo-tran-dai-nghia-lo-goc-ngo-thong-gan-pho-bagac-tranh-36m-5-tang-4-ty-8-o-ng-13525733.html,"PHÂN LÔ TRẦN ĐẠI NGHĨA, LÔ GÓC, NGÕ THÔNG, GẦN PHỐ, BAGAC TRÁNH, 36m, 5 TẦNG, 4 Tỷ 8, Ở NG","PHÂN LÔ TRẦN ĐẠI NGHĨA, LÔ GÓC, NGÕ THÔNG, GẦN PHỐ, BAGAC TRÁNH, 36m, 5 TẦNG, 4 Tỷ 8, Ở NGAY.

+ Vị trí trung tâm Hai Bà Trưng, vài bước chân ra Đại học Bách Khoa, Xây Dựng, Kinh Tế Quốc Dân, Bệnh viện Bạch Mai, Thanh Nhàn. 

+ Nhà lô góc hai mặt thoáng, ngõ thông, 20m ra đường ô tô tránh, trước nhà bagac phóng vèo vèo.

+ Khu vực an ninh tốt, dân trí cao, hàng xóm thân thiện, ở cực sướng, khách mua ở hoặc mua cho đi học Đai học quá đẹp.

+ Nhà xây 5 tầng KCBT chắc chắn, GPXD đầy đủ, thiết kế hiện đại, phù hợp với xu thế và thời thượng, nội thất cao cấp, đắt tiền, tổng 3 ngủ, khách mua về ở ngay.

+ Dt: 36m, nhà 5 tầng, mặt tiền rộng 4m.

+ Sổ vuông đẹp, chính chủ, giao dịch ngay.

+ Giá bán 4,8 tỷ có ra lộc.

Quý khách quan tâm vui lòng gọi ngay để được Mr Hùng Anh (1980) hỗ trợ xem nhà ngay hôm nay.","4,8 tỷ",36 m2,"Phố Trần Đại Nghĩa, Phường Đồng Tâm, Quận Hai Bà Trưng, Hà Nội",13525733,_,True,Cần bán,3m,True,Nhà trong hẻm,Sổ hồng/ Sổ đỏ,True,4m,5,True,---,3,---
https://alonhadat.com.vn/p-l-quan-uy-hoang-mai-2-mat-ngo-thong-via-he-o-to-tranh-thang-may-kinh-doanh-sam-uat--13524624.html,"P/L QUẬN ỦY HOÀNG MAI, 2 MẶT NGÕ THÔNG, VỈA HÈ, Ô TÔ TRÁNH, THANG MÁY, KINH DOANH SẦM UẤT.","P/L QUẬN ỦY HOÀNG MAI, 2 MẶT NGÕ THÔNG, VỈA HÈ, Ô TÔ TRÁNH, THANG MÁY, KINH DOANH SẦM UẤT.

+ Vị trí: Khu phân lô nằm nay sát khu hành chính Quận ủy quận Hoàng Mai, vô vàn tiện ích, rất nhiều khách tìm kiếm mà lại hiếm nhà bán.

+ Mặt ngõ thông bàn cờ, vỉa hè rộng, mặt ngõ thông thoáng, ô tô tải tránh nhau, ô tô dừng đỗ 24/24, kinh doanh sầm uất ngày đêm.

+ Chỉ vài phút ra đường vành đai 3 trên cao là có thể di chuyển đi khắp nơi, 15 phút vào trung tâm Thủ đô, giao thông vô cùng thuận tiện.

+ Nhà xây 8 tầng thang máy, KCBT chắc chắn, GPXD, hệ thống cảnh báo và PCCC đầy đủ, khách mua ở, làm Văn phòng Công ty quá đẹp.

+ Thiết kế hiện đại: Tầng 2 phòng, cầu thang + Wc ở giữa. Nội thất cao cấp đắt tiền gia chủ tặng lại hết cho khách mua, khách chỉ việc thanh toán tiền và dọn Vali về ở.

+ Dt: 90m, nhà 8 tầng, mặt tiền rộng 5m.

+ Sổ đỏ chính chủ, phân lô vuông đẹp, giao dịch ngay.

+ Giá bán 21 tỷ 650 triệu có ra lộc.

Quý khách quan tâm vui lòng gọi ngay để được Mr Hùng Anh (1980) hỗ trợ xem nhà ngay hôm nay.","21,65 tỷ",90 m2,"Phố Bùi Huy Bích, Phường Thịnh Liệt, Quận Hoàng Mai, Hà Nội",13524624,_,True,Cần bán,10m,True,Nhà trong hẻm,Sổ hồng/ Sổ đỏ,True,5m,8,True,---,7,---
https://alonhadat.com.vn/phan-lo-pho-le-van-luong-mat-ngo-thong-o-to-tranh-kinh-doanh-60m-6-tang-13-ty-o-ngay-13531415.html,"PHÂN LÔ PHỐ LÊ VĂN LƯƠNG, MẶT NGÕ THÔNG, Ô TÔ TRÁNH, KINH DOANH. 60m, 6 TẦNG,13 Tỷ, Ở NGAY","PHÂN LÔ PHỐ LÊ VĂN LƯƠNG, MẶT NGÕ THÔNG, Ô TÔ TRÁNH, KINH DOANH. 60m, 6 TẦNG, 13 Tỷ, Ở NGAY.

+ Phố Lê Văn Lương toàn Chung cư cao tầng và Biệt thự dự án, rất hiếm nhà thổ cư bán.

+ Vị trí: Khu phân lô thuộc quận Cầu Giấy, tiếp giáp Thanh Xuân - Đống Đa, an ninh tốt, dân trí cao, vô vàn tiện ích.

+ Mặt ngõ thông thoáng, ô tô tránh nhau, ô tô dừng đỗ ngày đêm, kinh doanh sầm uất. 

+ Nhà xây 6 tầng KCBT chắc chắn, Giấy phép xây dựng đầy đủ, nội thất cao cấp, ban công tùng tầng, sáng thoáng, sang chảnh, khách mua về ở ngay.

+ Thiết kế hiện đại:
- T1: Gara, MB Kinh Doanh, vs.
- T2: Khách, bếp, vs.
- T3,4: Tổng 4 phòng, vs khép kín.
- T5: Phòng thờ, và một phòng ngủ.
- Tầng 6: Tum, sân phơi.

+ Dt: 60m, nhà 6 tầng, mặt tiền rộng 5m.

+ Sổ chính chủ, vuông đẹp, giao dịch ngay.

+ Giá bán 13,2 tỷ có ra lộc.

Quý khách quan tâm vui lòng gọi ngay để được Mr Hùng Anh (1980) hỗ trợ xem nhà ngay hôm nay.","13,2 tỷ",60 m2,"Đường Lê Văn Lương, Phường Trung Hòa, Quận Cầu Giấy, Hà Nội",13531415,_,True,Cần bán,7m,True,Nhà trong hẻm,Sổ hồng/ Sổ đỏ,True,5m,6,True,---,4,---
