https://alonhadat.com.vn/ban-nha-tay-ho-ngay-mp-l-l-quan-via-he-3m-4-oto-tranh-view-ho-tay-60-6-kd-o-suong-10601861.html,"CHÍNH CHỦ NHỜ BÁN PHÂN LÔ TRUNG YÊN 11, Ở, CHO THUÊ, Ô TÔ TRÁNH, VỈA HÈ 5M, 80M2, 17 TỶ","CHÍNH CHỦ NHỜ BÁN PHÂN LÔ TRUNG YÊN, THÔNG TRUNG KÍNH, Ô TÔ TRÁNH, VỈA HÈ 5M, 80M2, 17 TỶ.

Nhà nằm trong khu phân lô bàn cờ Trung Yên, đường thông rộng, vỉa hè 2 bên. Khu vực giao thông thuận lợi kết nối các phố chính lớn của quận Cầu Giấy: Vũ Phạm Hàm, Trần Kim Xuyến, Trung Kính... Nơi đây tập trung chủ yếu các dịch vụ như: Spa, Phòng Khám, Chi Nhánh Văn Phòng, Văn Phòng Đại Diện... Nhu cầu thuê cửa hàng, văn phòng rất lớn. Hiện tại, nhà đang cho thuê mỗi tháng 50 triệu, khách mua về có sẵn dòng tiền hoặc đầu tư tòa nhà 9 tầng 1 hầm mang lại dòng tiền lớn.

SỔ VUÔNG ĐẸP, CHỦ THIỆN CHÍ, PHÁP LÝ SẠCH. LH: TÔI LAM ĐỂ XEM NHÀ MIỄN PHÍ",19 tỷ,80 m2,"Đường Trung Yên 11, Phường Trung Hòa, Quận Cầu Giấy, Hà Nội",10601861,_,---,Cần bán,30m,---,"Biệt thự, nhà liền kề",---,---,"5,6m",6,---,---,4,---,Khu đô thị mới Trung Yên (xem chi tiết dự án)
https://alonhadat.com.vn/ban-chung-cu-mini-dong-da-pho-ton-that-tung-90-6-mt6-16-chcc-h-s-80-tr-nhinh-10-ty-10964934.html,"BÁN CHUNG CƯ MINI ĐỐNG ĐA, PHỐ TÔN THẤT TÙNG, 90*6, MT6, 16 CHCC, H/S 80 TR, NHỈNH 10 TỶ","BÁN CHUNG CƯ MINI ĐỐNG ĐA, PHỐ TÔN THẤT TÙNG, ĐƯỜNG THÔNG, KINH DOANH: HIỆU THUỐC, GIẶT LÀ, 90*6, MT6, 16 CHCC, H/S 80TR /TH

* TÒA NHÀ 6 TẦNG, ĐANG KINH DOANH CĂN HỘ, CẢI TẠO LẠI, H/S CAO.
- Diện tích: 90m2.
- Mặt tiền: 6m.
- Hiện trạng: nhà 6 tầng, đang kinh doanh căn hộ dịch vụ.
- Vị trí: cách phố vài chục mét, đường thông rộng, gần nhiều trường đại học: y, không quân, học viện ngân hàng, nhu cầu ở trọ cao. Nơi tập trung nhiều tòa nhà căn hộ dịch vụ, khách đầu tư mua về dòng tiền ổn định, hoàn vốn trong 5 năm.
- Pháp lý: sổ chính chủ, giao dịch nhanh.
$ Giá niêm yết: NHỈNH 10 tỷ.

* ĐÁNH GIÁ SẢN PHẨM.
- Vị trí trung tâm quận Đống Đa, nơi tập trung nhiều trường đại học, nhu cầu thuê phòng ở rất cao.
- Nhà diện tích rộng mặt tiền lớn, khách mua đầu tư thêm chút có dòng tiền hàng tháng trên 100 triệu.
- Dòng tiền sinh lời hàng tháng cao, hoàn vốn trong thời gian ngăn 5 năm.

Liên hệ: Mr Lam (Fb/Zalo - 24/7) - Miễn trung gian, môi giới. Chỉ tiếp khách có nhu cầu thực, khách xem cho vui hoặc không có quyền quyết xin phép không tương tác.

Chuyên mặt phố Cầu Giấy, Ba Đình, Tây Hồ giá từ 10 tỷ đến 35 tỷ.

Mr Lam - phù thủy mặt phố. Sở hữu thông tin hơn 1000 căn nhà mặt phố, với đủ phân khúc lớn nhỏ từ 10 tỷ cho đến hàng trăm tỷ, vị trí đẹp, tính thanh khoản cao, đáp ứng đầy đủ nhu cầu ở, đầu tư sinh lời của các khách hàng. Hỗ trợ (zalo mobile 24/7). Tìm là có nhờ là được","10,3 tỷ",90 m2,"Phố Tôn Thất Tùng, Phường Phương Mai, Quận Đống Đa, Hà Nội",10964934,_,---,Cần bán,---,---,"Phòng trọ, nhà trọ",---,---,6m,9,---,---,20,---,
