url,title,description,price,area,address,Mã tin,Hướng,Phòng ăn,Loại tin,Đường trước nhà,Nhà bếp,Loại BDS,Pháp lý,Sân thượng,Chiều ngang,Số lầu,Chổ để xe hơi,Chiều dài,Số phòng ngủ,Chính chủ
https://alonhadat.com.vn/toa-nha-cau-giay-thang-may-noi-that-5-sao-dong-tien-cuc-khung-140m2-x-8-tang-chi-28-ty--8749386.html,"TÒA NHÀ CẦU GIẤY, THANG MÁY, NỘI THẤT 5 SAO, DÒNG TIỀN CỰC KHỦNG 140M2 x 8 TẦNG CHỈ 28 TỶ.","- Vị trí: Trung tâm Cầu Giấy quận, gần các Trường ĐH lớn của Hà Nội như ĐH Quốc gia Hà Nội, ĐH Sư Phạm Hà Nội, Học viện Báo chí và Tuyên truyền,... Nhu cầu cho thuê cực cao. 
- Nhà 8 tầng thang máy chạy vèo vèo. Tổng cộng 42 phòng, nội thất full: Quạt trần, tủ lạnh, điều hòa, giường tủ, tủ bếp, bàn trà, sofa, gác xép, máy giặt... Phòng nào cũng có cửa sổ, ô thoáng, giếng trời mát mẻ. Chuẩn 5 sao khách chỉ việc xách VALI đến kinh doanh, thu dòng tiền mỗi tháng 200-220 triệu. 
- Diện tích lên tới 140m2, sổ đỏ chính chủ.
- Giá chỉ có 28 tỷ ( Thương lượng trực tiếp với chủ nhà ). 
- Liên hệ : Mr Giang *97 3210 314 – *92 7060 686 để xem và gặp trực tiếp chủ nhà.",28 tỷ,140 m2,"Đường Cầu Giấy, Phường Dịch Vọng, Quận Cầu Giấy, Hà Nội",8749386,_,True,Cần bán,3m,True,Nhà trong hẻm,Sổ hồng/ Sổ đỏ,True,---,8,---,---,42,---
https://alonhadat.com.vn/nha-mat-pho-xuan-la-tay-ho-mat-tien-11m-via-he-da-bong-kinh-doanh-cuc-vip-chi-105-ty-8891387.html,"NHÀ MẶT PHỐ XUÂN LA, TÂY HỒ, MẶT TIỀN 11M, VỈA HÈ ĐÁ BÓNG, KINH DOANH CỰC VIP CHỈ 105 TỶ","- Vị trí cực đắc địa, gần khu Ngoại Giao Đoàn, Lotte, Ciputra, công viên nước, khu liên cơ, trường học, bệnh viện, rạp chiếu phim ...Tiện ích vô cùng phong phú. Đường trước nhà container đua, vỉa hè đá bóng, kinh doanh tấp nập.
- Hiện trạng là nhà xây cấp 4 đang cho 1 đơn vị nổi tiếng thuê kinh doanh. Mặt tiền rộng phù hợp xây tòa nhà văn phòng, hotel…
- Diện tích lên tới 350m2, sổ nở hậu.
- Giá chỉ 105 tỷ ( Có thương lượng )",105 tỷ,350 m2,"Đường Xuân La, Phường Xuân La, Quận Tây Hồ, Hà Nội",8891387,_,True,Cần bán,18m,True,Nhà mặt tiền,Sổ hồng/ Sổ đỏ,True,---,1,---,---,4,---
https://alonhadat.com.vn/ban-nha-mat-pho-quan-dong-da-vi-tri-cuc-dep-via-he-5m-kinh-doanh-vo-dich-nhinh-39-ty-8933388.html,"BÁN NHÀ MẶT PHỐ QUẬN ĐỐNG ĐA, VỊ TRÍ CỰC ĐẸP, VỈA HÈ 5M, KINH DOANH VÔ ĐỊCH NHỈNH 39 TỶ","- Vị trí cực đẹp, khu vực tiếp giáp quận Hoàn Kiếm, gần sân vận động Hàng Đẫy, Văn miếu Quốc Tử Giám, Lăng Chủ tịch Hồ Chí Minh, Hoàng Thành Thăng Long, Cột cờ Hà Nội, Ga Hà Nội, Ga Trần Quý Cáp.
- Tập trung xung quanh là các Đại sứ quán, văn phòng đại diện nước ngoài, khối văn phòng TW, doanh nghiệp, khách sạn, nhà hàng, các di tích lịch sử, giao thương thuận lợi nhiều trục đường trọng điểm của thủ đô.
- Khách mua có thể xây tòa nhà văn phòng, khách sạn, homestay, Apartment hoặc vừa ở vừa kết hợp tự kinh doanh siêu lợi nhuận.
- Diện tích lên tới 205m2, pháp lý sạch.
- Giá nhỉnh 39 tỷ ( Có thương lượng )",39 tỷ,205 m2,"Phố Nguyễn Khuyến, Phường Văn Miếu, Quận Đống Đa, Hà Nội",8933388,_,True,Cần bán,8m,True,Nhà mặt tiền,Sổ hồng/ Sổ đỏ,True,---,4,---,---,4,---
https://alonhadat.com.vn/sieu-pham-mat-pho-le-trong-tan-via-he-rong-kinh-doanh-sam-uat-170m2-x-10-tang-chi-80-ty--8671067.html,"SIÊU PHẨM MẶT PHỐ LÊ TRỌNG TẤN, VỈA HÈ RỘNG, KINH DOANH SẦM UẤT 170M2 x 10 TẦNG CHỈ 80 TỶ.","- Vị trí cực đẹp, vỉa hè rộng, view cực thoáng. Khu vực trung tâm quận Thanh Xuân, kinh doanh sầm uất ngày đêm.
- Toà nhà thiết kế 1 hầm, 9 nổi, hầm để được nhiều ô tô, xe máy. Toà nhà lắp điều hoà âm trần Daikin, hệ thống PCCC tiêu chuẩn, thang máy nhập khẩu Nhật Bản. Đã có đơn vị hỏi thuê 3 tỷ/năm nhưng chủ không đồng ý để tập trung bán.
- Diện tích lên tới 170m2, sổ đỏ chính chủ.
- Giá chỉ có 80 tỷ ( Thương lượng trực tiếp với chủ nhà ). 
- Liên hệ : Mr Giang *97 3210 314 – *92 7060 686 để xem và gặp trực tiếp chủ nhà.",80 tỷ,170 m2,"Phố Lê Trọng Tấn, Phường Khương Mai, Quận Thanh Xuân, Hà Nội",8671067,_,True,Cần bán,15m,True,Nhà mặt tiền,Sổ hồng/ Sổ đỏ,True,---,10,---,---,6,---
https://alonhadat.com.vn/ban-gap-manh-dat-le-trong-tan-thanh-xuan-mat-tien-12m-kinh-doanh-dinh-180m2-chi-28-ty-8684999.html,"BÁN GẤP MẢNH ĐẤT LÊ TRỌNG TẤN, THANH XUÂN, MẶT TIỀN 12M, KINH DOANH ĐỈNH 180M2 CHỈ 28 TỶ","- Mảnh đất hiếm có của quận Thanh Xuân tại thời điểm này, 2 mặt ngõ ô tô. Xe cộ qua lại tấp nập, thích hợp mọi loại hình kinh doanh.
- Mảnh đất rộng có thể chia 2 bán hoặc xây tòa nhà văn phòng, khách sạn nhà nghỉ.
- Diện tích lên tới 180m2, sổ đỏ chính chủ.
- Giá chỉ có 28 tỷ ( Thương lượng trực tiếp với chủ nhà ). 
- Liên hệ : Mr Giang *97 3210 314 – *92 7060 686 để xem và gặp trực tiếp chủ nhà.",28 tỷ,180 m2,"Phố Lê Trọng Tấn, Phường Khương Mai, Quận Thanh Xuân, Hà Nội",8684999,_,True,Cần bán,9m,True,Nhà trong hẻm,Sổ hồng/ Sổ đỏ,True,---,1,---,---,---,---
https://alonhadat.com.vn/ban-toa-nha-mat-pho-cau-giay-mat-tien-rong-dong-tien-len-toi-5-ty-nam-280m2-chi-165-ty-8961157.html,"BÁN TÒA NHÀ MẶT PHỐ CẦU GIẤY, MẶT TIỀN RỘNG, DÒNG TIỀN LÊN TỚI 5 TỶ/NĂM 280M2 CHỈ 165 TỶ","- Phố Nguyễn Quốc Trị nằm ở trung tâm Quận Cầu Giấy- Hà Nội, đoạn từ ngã ba giao cắt phố Nguyễn Chánh đến đường cạnh ô đất C2- C4 Khu đô Thị Nam Trung Yên. Tiếp giáp với đường Mạc Thái Tổ, Mạc Thái Tông và các tuyến phố Tú Mỡ, Nguyễn Chánh, Dương Đình Nghệ.
- Tòa nhà mới xây 8 tầng chuẩn công năng tòa nhà văn phòng với 1 tầng hầm và 7 tầng nổi thiết kế thông sàn. Hiện đang cho 1 đơn vị nước ngoài thuê 5 tỷ/năm.
- Diện tích lên tới 280m2, sổ vuông vắn.
- Giá chỉ 165 tỷ ( Có thương lượng ) 
- Liên hệ : Mr Giang",165 tỷ,280 m2,"Đường Nguyễn Quốc Trị, Phường Trung Hòa, Quận Cầu Giấy, Hà Nội",8961157,_,True,Cần bán,15m,True,Nhà mặt tiền,Sổ hồng/ Sổ đỏ,True,---,8,---,---,6,---
https://alonhadat.com.vn/ban-nha-mat-pho-trieu-viet-vuong-vi-tri-kim-cuong-kinh-doanh-dinh-cao-450m2-nhinh-200-ty-9303030.html,"BÁN NHÀ MẶT PHỐ TRIỆU VIỆT VƯƠNG, VỊ TRÍ KIM CƯƠNG, KINH DOANH ĐỈNH CAO 450M2 NHỈNH 200 TỶ","- Vị trí siêu đắc địa, nằm cách hồ Hoàn Kiếm 1 km, là địa chỉ cung cấp chỗ nghỉ thanh lịch tại trung tâm thành phố Hà Nội cho khách công tác và khách du lịch.  
- Tòa nhà 12 tầng với tổng cộng 15 căn hộ khép kín, các căn hộ với tầm nhìn phong cảnh toàn thành phố, được trang bị đầy đủ tiện nghi. Nhà bếp đi kèm lò nướng, bếp nấu ăn, lò vi sóng và tủ lạnh. Mỗi căn hộ cũng có phòng tắm riêng với tiện nghi vòi sen, máy giặt, máy sấy, wifi miễn phí.
- Diện tích lên tới 450m2, sổ siêu đẹp.
- Giá nhỉnh 200 tỷ ( Có thương lượng ) 
- Liên hệ : Mr Giang *97 3210 314 – *92 7060 686",200 tỷ,450 m2,"Phố Triệu Việt Vương, Phường Bùi Thị Xuân, Quận Hai Bà Trưng, Hà Nội",9303030,_,True,Cần bán,15m,True,Nhà mặt tiền,Sổ hồng/ Sổ đỏ,True,---,12,---,---,15,---
https://alonhadat.com.vn/ban-nha-pho-tran-dang-ninh-mat-tien-rong-via-he-kinh-doanh-dinh-cao-85m2-nhinh-50-ty--9676619.html,"BÁN NHÀ PHỐ TRẦN ĐĂNG NINH, MẶT TIỀN RỘNG, VỈA HÈ, KINH DOANH ĐỈNH CAO 85M2 NHỈNH 50 TỶ.","- Trần Đăng Ninh là tuyến phố giao thông 2 chiều với 2 làn xe ô tô và xe máy mỗi chiều. Tuyến phố này khá sạch sẽ và mát mẻ, lưu lượng giao thông ở mức trung bình. Xung quanh có nhiều tòa nhà văn phòng, công sở và nhu cầu thuê làm trụ sở văn phòng còn khá lớn.
- Nhà xây mới 7 tầng nổi  + 1 hầm, thiết kế thông sàn phù hợp mọi loại hình kinh doanh. 
- Diện tích lên tới 85m2, sổ vuông đẹp.
- Giá nhỉnh 50 tỷ ( Có thương lượng ) 
- Liên hệ : Mr Giang *97 3210 314 – *92 7060 686",50 tỷ,85 m2,"Phố Trần Đăng Ninh, Phường Dịch Vọng, Quận Cầu Giấy, Hà Nội",9676619,_,True,Cần bán,15m,True,Nhà mặt tiền,Sổ hồng/ Sổ đỏ,True,---,8,---,---,4,---
https://alonhadat.com.vn/biet-thu-nha-vuon-long-bien-kien-truc-co-dien-khong-gian-song-thoang-dang-nhinh-50-ty--9684627.html,"BIỆT THỰ NHÀ VƯỜN LONG BIÊN, KIẾN TRÚC CỔ  ĐIỂN, KHÔNG GIAN SỐNG THOÁNG ĐÃNG NHỈNH 50 TỶ.","- Biệt thự kiến trúc nhà vườn được thiết kế theo phong cách cổ điển. Nhà và nội thất làm bằng gỗ được chủ nhà kỳ công xây dựng bằng cả tâm huyết. Nhà có 2 cổng vào, đường ôtô đi lại thoải mái. Không khí trong lành, thoáng mát và yên tĩnh, view sông Đuống.
- Tiện ích xung quanh phong phú đa dạng, gần trường học các cấp…
- Diện tích lên tới 850m2, sổ đẹp.
- Giá nhỉnh 50 tỷ ( Có thương lượng ) 
- Liên hệ : Mr Giang *97 3210 314 – *92 7060 686",50 tỷ,850 m2,"Đường Ngọc Thụy, Phường Ngọc Thụy, Quận Long Biên, Hà Nội",9684627,_,True,Cần bán,5m,True,Nhà trong hẻm,Sổ hồng/ Sổ đỏ,True,---,2,---,---,6,---
https://alonhadat.com.vn/ban-toa-nha-mat-ho-ba-mau-dong-da-mt-cuc-rong-kinh-doanh-sieu-dinh-160m2-chi-75-ty--12568022.html,"BÁN TÒA NHÀ MẶT HỒ BA MẪU, ĐỐNG ĐA, MT CỰC RỘNG, KINH DOANH SIÊU ĐỈNH 160M2 CHỈ 75 TỶ.","-	Nhà nằm tại vị trí đẹp nhất, sạch nhất hồ Ba Mẫu, 2 mặt thoáng trước sau, vỉa hè đá bóng. View hồ nên ở cực sướng.
-	Tòa nhà văn phòng với 8 tầng nổi, 1 tầng hầm phù hợp mọi loại hình kinh doanh như ngân hàng, spa, trung tâm ….đang cho thuê khai thác 2.5 tỷ/năm.
-	Diện tích lên tới 160m, sổ vuông đẹp.
-	Giá chỉ 75 tỷ ( Thương lượng trực tiếp với chủ nhà )
Liên hệ : Mr Giang *97 3210 314 – *92 7060 686",75 tỷ,160 m2,"Đường Hồ Ba Mẫu, Phường Phương Liên, Quận Đống Đa, Hà Nội",12568022,_,---,Cần bán,15m,---,Nhà mặt tiền,---,---,---,9,---,---,6,---
https://alonhadat.com.vn/ban-nha-hoang-cau-dong-da-thang-may-mt-5m-kinh-doanh-dinh-80m2-chi-30-ty--12611471.html,"BÁN NHÀ HOÀNG CẦU, ĐỐNG ĐA, THANG MÁY, MT 5M, KINH DOANH ĐỈNH 80M2 CHỈ 30 TỶ.","-	Vị trí đẹp tuyệt vời, ngõ rộng hơn mặt phố, ô tô tránh thông các ngả sang Trần Quang Diệu, Nguyễn Lương Bằng, Tây Sơn…cách vài phút là ra đến hồ Hoàng Cầu.
-	Nhà xây mới 7 tầng thang máy, thiết kế dạng văn phòng cho thuê. Đang cho 1 doanh nghiệp thuê dài hạn gần 1 tỷ/năm. 
-	Diện tích lên tới 80m, sổ vuông đẹp.
-	Giá chỉ 30 tỷ ( Thương lượng trực tiếp với chủ nhà )
Liên hệ : Mr Giang *97 3210 314 – *92 7060 686",30 tỷ,80 m2,"Phố Hoàng Cầu, Phường Ô Chợ Dừa, Quận Đống Đa, Hà Nội",12611471,_,---,Cần bán,10m,---,Nhà trong hẻm,---,---,---,7,---,---,4,---
https://alonhadat.com.vn/ban-nha-mat-pho-tran-vy-cau-giay-via-he-rong-mt-8m-kinh-doanh-dinh-150m2-chi-60-ty--12654645.html,"BÁN NHÀ MẶT PHỐ TRẦN VỸ, CẦU GIẤY, VỈA HÈ RỘNG, MT 8M, KINH DOANH ĐỈNH 150M2 CHỈ 60 TỶ.","-	Mặt phố Trần Vỹ đường đôi rộng 40m, container thoải mái đua. Kinh doanh sầm uất, ô tô dừng đỗ thoải mái. Đường Hoàng Quốc Việt kéo dài thi công xong thì giá trị nhà đất khu vực này gia tăng chóng mặt.
-	Nhà xây mới 11 tầng thang máy với 10 tầng nổi, 1 tầng hầm rộng rãi, thiết kế thông sàn phù hợp mọi loại hình kinh doanh. Chủ đang cho thuê gần 1.5 tỷ/năm.
-	Diện tích lên tới 150m, sổ vuông đẹp.
-	Giá chỉ 60 tỷ ( Thương lượng trực tiếp với chủ nhà )
Liên hệ : Mr Giang *97 3210 314 – *92 7060 686",60 tỷ,150 m2,"Đường Trần Vỹ, Phường Mai Dịch, Quận Cầu Giấy, Hà Nội",12654645,_,---,Cần bán,40m,---,Nhà mặt tiền,---,---,---,11,---,---,2,---
https://alonhadat.com.vn/ban-nha-mat-pho-nguyen-truong-to-ba-dinh-mat-tien-rong-kd-sieu-cap-100m2-chi-45-ty-12804815.html,"Bán nhà mặt phố Nguyễn Trường Tộ, Ba Đình, mặt tiền rộng, KD siêu cấp 100m2 chỉ 45 tỷ","-	Vị trí siêu đắc địa mặt phố trung tâm, khu vực kinh doanh buôn bán sầm uất, tập trung rất nhiều khách sạn, nhà hàng lớn thu hút đông khách du lịch nước ngoài ghé thăm, nhà nằm gần ngay Ngã 3 Nguyễn Trường Tộ với Hàng Bún, gần đối diện Trường chuẩn Quốc Gia trung học cơ sở Nguyễn Công Trứ, nhà hiện 2 tầng cũ giá chủ xác định bán đất tặng nhà.
-	Diện tích 100m2, mặt tiền 5m hiện trạng 2 tầng, phù hợp kinh doanh nhà hàng, khách sạn, văn phòng cho thuê…
-	Giá chỉ 45 tỷ ( Thương lượng trực tiếp với chủ nhà )
-	Liên hệ : Mr Giang *97 3210 314 – *92 7060 686",45 tỷ,100 m2,"Phố Nguyễn Trường Tộ, Phường Nguyễn Trung Trực, Quận Ba Đình, Hà Nội",12804815,_,---,Cần bán,10m,---,Nhà mặt tiền,---,---,---,2,---,---,1,---
https://alonhadat.com.vn/ban-nha-mat-pho-cat-linh-dong-da-via-he-da-bong-kinh-doanh-dinh-khung-130m-nhinh-50-ty--12897435.html,"BÁN NHÀ MẶT PHỐ CÁT LINH, ĐỐNG ĐA, VỈA HÈ ĐÁ BÓNG, KINH DOANH KHỦNG 130M NHỈNH 50 TỶ.","-	Nằm ở vị trí đắc địa của phố Cát Linh - tuyến phố có nhiều ngân hàng, doanh nghiệp, công ty hoạt động và các trụ sở ban ngành trung ương. Showroom nội thất và kinh doanh vật liệu xây dựng rất phát triển trên tuyến phố này.
-	Nhà 5 tầng kết cấu BT chắc chắn, hiện đang kinh doanh rất đắt khách, chủ mới mua về cải tạo lắp thêm thang máy.
-	Diện tích lên tới 130m, sổ hoa hậu.
-	Giá nhỉnh 50 tỷ ( Thương lượng trực tiếp với chủ nhà )
Liên hệ : Mr Giang *97 3210 314 – *92 7060 686",50 tỷ,130 m2,"Phố Cát Linh, Phường Cát Linh, Quận Đống Đa, Hà Nội",12897435,_,---,Cần bán,15m,---,Nhà mặt tiền,---,---,---,5,---,---,4,---
https://alonhadat.com.vn/ban-nha-dong-da-lo-goc-7-tang-thang-may-o-to-do-dong-tien-130tr-thang-100m-nhinh-20-ty-13292036.html,"BÁN NHÀ ĐỐNG ĐA, LÔ GÓC, 7 TẦNG THANG MÁY, Ô TÔ ĐỖ, DÒNG TIỀN 130TR/THÁNG 100M NHỈNH 20 TỶ","-	Nằm trong khu phân lô Vip, ô tô chạy vòng quanh. Quanh nhà gần nhiều trường Đại học như: Bách Khoa, Xây Dựng, Kinh tế Quốc dân, nhu cầu thuê trọ của sinh viên và người đi làm rất nhiều, cho thuê được giá.
-	Nhà xây mới 7 tầng với 23 căn hộ khép kín, dòng tiền lên tới 130tr/tháng.
-	Diện tích lên tới 100m, sổ đẹp.
-	Giá nhỉnh 20tỷ ( Thương lượng trực tiếp với chủ nhà )
Liên hệ : Mr Giang *97 3210 314 – *92 7060 686",20 tỷ,100 m2,"Đường Hồ Ba Mẫu, Phường Phương Liên, Quận Đống Đa, Hà Nội",13292036,_,---,Cần bán,4m,---,Nhà trong hẻm,---,---,---,7,---,---,23,---
https://alonhadat.com.vn/ban-nha-mat-pho-hoang-quoc-viet-mat-tien-khung-kinh-doanh-dang-cap-130m2-chi-50-ty--9320819.html,"BÁN NHÀ MẶT PHỐ HOÀNG QUỐC VIỆT, MẶT TIỀN KHỦNG, KINH DOANH ĐẲNG CẤP 130M2 CHỈ 50 TỶ.","- Nằm trên một trong những tuyến đường đẹp của quận Cầu Giấy, vỉa hè siêu rông, nơi tập trung nhiều trụ sở của các ban ngành, các doanh nghiệp lớn nên có thể nói vị trí nơi đây tấc đất tấc vàng.    
- Mặt tiền siêu khủng, chủ mới có thể cải tạo thành tòa nhà văn phòng 7,8 tầng kinh doanh thì quá đẳng cấp. 
- Diện tích lên tới 130m2, sổ vuông đẹp.
- Giá chỉ 50 tỷ ( Có thương lượng )",50 tỷ,130 m2,"Đường Hoàng Quốc Việt, Phường Nghĩa Đô, Quận Cầu Giấy, Hà Nội",9320819,_,True,Cần bán,20m,True,Nhà mặt tiền,Sổ hồng/ Sổ đỏ,True,---,6,---,---,6,---
https://alonhadat.com.vn/ban-toa-nha-mat-pho-nguyen-luong-bang-2-tang-ham-rong-rai-dong-tien-khung-nhinh-250-ty-9182368.html,"BÁN TÒA NHÀ MẶT PHỐ NGUYỄN LƯƠNG BẰNG, 2 TẦNG HẦM RỘNG RÃI, DÒNG TIỀN KHỦNG NHỈNH 250 TỶ","- Nằm ở vị trí kinh doanh đẹp nhất phố Nguyễn Lương Bằng, trung tâm quận Đống Đa. Thuộc trục hướng tâm chính xuyên qua 5 Quận trung tâm Hà Đông – Thanh Xuân – Đống Đa – Ba Đình – Hoàn Kiếm.   
- Tòa nhà với 7 tầng nổi và 2 tầng hầm rộng rãi. Phù hợp cho thuê làm văn phòng, phòng khám, siêu thị…Hiện đang cho thuê 40.000$/tháng.
- Diện tích lên tới 600m2, sổ đỏ chính chủ.
- Giá nhỉnh 250 tỷ ( Có thương lượng ) 
- Liên hệ : Mr Giang *97 3210 314 – *92 7060 686 để xem và gặp trực tiếp chủ nhà.",250 tỷ,600 m2,"Phố Nguyễn Lương Bằng, Phường Ô Chợ Dừa, Quận Đống Đa, Hà Nội",9182368,_,True,Cần bán,15m,True,Nhà mặt tiền,Sổ hồng/ Sổ đỏ,True,---,9,---,---,4,---
https://alonhadat.com.vn/ban-nha-mat-pho-ton-that-thuyet-thong-san-thang-may-kinh-doanh-xin-xo-130m2-nhinh-60-ty-9193454.html,"BÁN NHÀ MẶT PHỐ TÔN THẤT THUYẾT, THÔNG SÀN, THANG MÁY, KINH DOANH XỊN XÒ 130M2 NHỈNH 60 TỶ","- Đường Tôn Thất Thuyết là tuyến đường có nhiều tòa nhà văn phòng, khu chung cư, trụ sở cơ quan chính trị, ngân hàng lớn. Nằm trong khu vực có tốc độ phát triển mạnh, giao thông đi lại rất thuận tiện khi tiếp giáp với một số tuyến đường lớn như; Vành Đai 3, Trần Thái Tông, Duy Tân, Phạm Văn Bạch.
- Tòa nhà với 6 tầng nổi và 1 tầng, thiết kế thông sàn chuẩn tòa nhà văn phòng. Phù hợp cho thuê làm spa, phòng khám, siêu thị…Hiện đang cho thuê 5.000$/tháng.
- Diện tích lên tới 130m2, sổ đỏ vuông như A4.
- Giá nhỉnh 60 tỷ ( Có thương lượng ) 
- Liên hệ : Mr Giang *97 3210 314 – *92 7060 686 để xem và gặp trực tiếp chủ nhà.",60 tỷ,130 m2,"Đường Tôn Thất Thuyết, Phường Dịch Vọng Hậu, Quận Cầu Giấy, Hà Nội",9193454,_,True,Cần bán,20m,True,Nhà mặt tiền,Sổ hồng/ Sổ đỏ,True,---,7,---,---,4,---
https://alonhadat.com.vn/ban-toa-nha-quan-tay-ho-thang-may-o-to-tranh-kinh-doanh-khung-220m2-chi-65-ty--9168850.html,"BÁN TÒA NHÀ QUẬN TÂY HỒ, THANG MÁY, Ô TÔ TRÁNH, KINH DOANH KHỦNG 220M2 CHỈ 65 TỶ.","- Vị trí kinh doanh đắc địa, gần hồ Tây. Giao thông thuận tiện, ô tô tránh thoải mái.  
- Nhà xây mới bao gồm 1 tầng hầm và 8 tầng nổi, thang máy xịn xò, thiết kế thông sàn chuẩn tòa nhà văn phòng. Hiệu suất kinh doanh tốt.
- Diện tích lên tới 220m2, sổ đỏ chính chủ.
- Giá chỉ 65 tỷ ( Có thương lượng ) 
- Liên hệ : Mr Giang *97 3210 314 – *92 7060 686 để xem và gặp trực tiếp chủ nhà.",65 tỷ,220 m2,"Phố Trích Sài, Phường Thụy Khuê, Quận Tây Hồ, Hà Nội",9168850,_,True,Cần bán,6m,True,Nhà mặt tiền,Sổ hồng/ Sổ đỏ,True,---,9,---,---,4,---
https://alonhadat.com.vn/ban-nha-mat-pho-xa-dan-lo-goc-sieu-hiem-sieu-dep-kinh-doanh-dinh-cua-chop-chi-45-ty--9153399.html,"BÁN NHÀ MẶT PHỐ XÃ ĐÀN, LÔ GÓC, SIÊU HIẾM, SIÊU ĐẸP, KINH DOANH ĐỈNH CỦA CHÓP CHỈ 45 TỶ.","- Vị trí siêu đắc địa, lô góc 3 mặt thoáng, vỉa hè đá bóng, kinh doanh sầm uất, ô tô dừng đỗ ngày đêm. 
- Nhà xây 7 tầng, thang máy, cực kỳ đẹp và chắc chắn. Cho thuê kinh doanh cực tố, khoảng 150 triệu/ tháng.
- Diện tích lên tới 75m2, sổ đỏ chính chủ.
- Giá chỉ 45 tỷ ( Có thương lượng ) 
- Liên hệ : Mr Giang *97 3210 314 – *92 7060 686 để xem và gặp trực tiếp chủ nhà.",45 tỷ,75 m2,"Phố Xã Đàn, Phường Nam Đồng, Quận Đống Đa, Hà Nội",9153399,_,True,Cần bán,30m,True,Nhà mặt tiền,Sổ hồng/ Sổ đỏ,True,---,7,---,---,4,---
