url,title,description,price,area,address,Mã tin,Hướng,Phòng ăn,Loại tin,Đường trước nhà,Nhà bếp,Loại BDS,Pháp lý,Sân thượng,Chiều ngang,Số lầu,Chổ để xe hơi,Chiều dài,Số phòng ngủ,Chính chủ
https://alonhadat.com.vn/chinh-chu-can-ban-gap-nha-ngoc-thuy-ngoc-lam-lo-goc-gara-2-o-to-dien-tich-95m2-13717591.html,CHÍNH CHỦ CẦN BÁN GẤP NHÀ NGỌC THỤY - NGỌC LÂM - LÔ GÓC - GARA 2 Ô TÔ - DIỆN TÍCH 95M2,"+ CHÍNH CHỦ CẦN BÁN GẤP NHÀ NGỌC THUỴ - LONG BIÊN - LÔ GÓC - NHÀ ĐẸP - GARA 2 Ô TÔ - HÀNG XÓM KHAI SƠN HILL - CẠNH CÔNG VIÊN - HỒ ĐIỀU HOÀ - SAU QUY HOẠCH GIÁ TRỊ X ĐÔI
+ DT : 95m² x 4 tầng lô góc .
+ Vị trí phía Đông giáp phường Thượng Thanh; phía Tây giáp quận Tây Hồ và quận Ba Đình; phía Nam giáp phường Ngọc Lâm và quận Hoàn Kiếm; phía Bắc có Sông Đuống, bên kia sông Đuống là xã Đông Hội, huyện Đông Anh.
+ Tiện ích Trường học, chợ các cấp, 10 phút sang phố cổ, quá tiện lợi. Cách nhà 15m đã có chỉ giới quy hoạch đang làm nối với đường Hồng Tiến.
- Thửa đất đẹp Mặt tiền rộng 9,5m nên chủ thiết kế gara ô tô riêng.
+ Sổ đỏ vuông vắn .
+ Giá 12 tỷ còn thương lượng.
+ Liên hệ Mai Trang để mở cửa xem nhà",12 tỷ,95 m2,"Đường Nguyễn Văn Cừ, Phường Ngọc Lâm, Quận Long Biên, Hà Nội",13717591,_,---,Cần bán,15m,---,Nhà mặt tiền,---,---,---,4,---,---,5,---
https://alonhadat.com.vn/chinh-chu-can-ban-gap-nha-ngoc-lam-long-bien-hang-xom-khai-son-hiil-98m2-4t-o-to-tranh-gia-13716386.html,CHÍNH CHỦ CẦN BÁN GẤP NHÀ NGỌC LÂM LONG BIÊN HÀNG XÓM KHAI SƠN HIIL 98M2 4T Ô TÔ TRÁNH GIÁ,"+ CHÍNH CHỦ CẦN  BÁN GẤP  NHÀ NGỌC THỤY - LONG BIÊN - 10 PHÚT SANG HỒ HOÀN KIẾM  - HÀNG XÓM  KHU KHAI SƠN HILL -LÔ GÓC- MẶT TIỀN RỘNG - GARA 2 Ô TÔ. TƯƠNG LAI  ĐƯỜNG 17M NGAY CẠNH NHÀ.
+ Vị trí đẹp, kết nối với các tuyến đường như Nguyễn Văn Cừ , 
+ Diện tích 98m2 x 4 tầng lô góc thoáng sáng.
 Hàng xóm khu KHAI SƠN HILL đang trong quá trình hoàn thiện. Tiện ích xung quanh không thiếu gì , gần chợ, công viên hồ điều hòa.
 Thiết kế : 
 - Tầng 1 : Gara + phòng khách + VS
 - Tầng 2 : Bếp + phòng Khách rộng + VS
 - Tầng 3 : 3 PN + VS
 - Tầng 4 : 1 PN + Sân phơi
 Sổ đỏ vuông vắn đang để ngân hàng cho mới. 
Giá 126tr/m2 còn thương lượng.
+ Liên hệ  Mai Trang để xem nhà.","12,4 tỷ",98 m2,"Đường Nguyễn Văn Cừ, Phường Ngọc Lâm, Quận Long Biên, Hà Nội",13716386,_,True,Cần bán,10m,True,Nhà mặt tiền,Sổ hồng/ Sổ đỏ,True,---,4,True,---,5,---
https://alonhadat.com.vn/hiem-nha-hoang-quoc-viet-cau-giay-phan-lo-o-to-2-thoang-60m2-4t-gia-11-5-ty-13712374.html,HIẾM ! NHÀ HOÀNG QUỐC VIỆT CẦU GIẤY  PHÂN LÔ Ô TÔ 2 THOÁNG 60M2 4T GIẤ 11.5 TỶ,"+ BÁN NHÀ HOÀNG QUỐC VIỆT - ĐẶNG THUỲ TRÂM - PHÂN LÔ ÔTÔ TRÁNH - PHỐ VÍP - THOÁNG TRƯỚC SAU - NHÀ 4 TẦNG KIÊN CỐ - Ô CHỜ THANG MÁY.
+ Vị trí khu dân trí cao, an ninh tốt, gần các tuyến phố như Phạm Tuấn Tài, Trần Quốc Hoàn, Nguyễn Phong Sắc, Phan Văn Trường...
+ Diện tích 60m2 x 4 tầng mặt tiền đẹp ,2 thoáng trước sau.
+ Thiết kế 4 tầng kiên cố móng 7 tầng, trước sau đều có sân.
+ Tầng 1 bếp để xe rộng.
+Tầng 2,3,4 mỗi tầng 2 phòng ngủ vệ sinh giữa.
+ Sổ đỏ cất két chờ giao dịch.
+ Giá 11.5 tỷ có thương lượng.
+ Liên hệ E Mai Trang để đi xem nhà.","11,5 tỷ",60 m2,"Phố Đặng Thùy Trâm, Phường Dịch Vọng Hậu, Quận Cầu Giấy, Hà Nội",13712374,_,---,Cần bán,10m,---,Nhà mặt tiền,Sổ hồng/ Sổ đỏ,---,---,4,---,---,5,---
https://alonhadat.com.vn/ban-nha-hoang-quoc-viet-pham-tuan-tai-65m2-6t-thang-may-o-to-tranh-gia-17-ty-13712266.html,BÁN NHÀ HOÀNG QUỐC VIỆT PHẠM TUẤN TÀI 65M2 6T THANG MÁY Ô TÔ TRÁNH GIÁ 17 TỶ,"+ BÁN NHÀ HOÀNG QUỐC VIỆT - THANG MÁY - GARA Ô TÔ - VỈA HÈ - VỪA Ở VỪA KINH DOANH.
Vị trí cách 1 nhà ra phố , thông các tuyến phố như Phạm Tuấn Tài, Đặng Thùy Trâm, Trần Quốc Hoàn, Nguyễn Phong Sắc...
+ Khu vực dân trí cao, tiện ích ngập tràn,1p đi bộ ra sân cầu lông, bóng rổ, xung quanh nhiều trường học, siêu thị văn phòng. Nhà có thể vừa ở vừa kinh doanh hoặc văn phòng.
Thiết kế tầng chia 2 phòng, thang bộ, thang máy, wc giữa.
+Nhà xây mới, thiết kế hiện đại, công năng sử dụng hợp lý, thang máy nhập khẩu.
+Sổ đỏ phân lô, trước sau như một.
+ Giá 17 tỷ có thương lượng sâu cho khách thiện chí.
+ Liên hệ : Mai Trang để đi xem nhà.",17 tỷ,65 m2,"Đường Hoàng Quốc Việt, Phường Dịch Vọng Hậu, Quận Cầu Giấy, Hà Nội",13712266,_,---,Cần bán,15m,---,Nhà mặt tiền,---,---,---,6,---,---,4,---
https://alonhadat.com.vn/ban-dat-tang-nha-le-van-luong-nguy-nhu-kon-tum-lo-goc-via-he-kd-60m2-gia-12-9-ty-13712236.html,"BÁN ĐẤT TẶNG NHÀ LÊ VĂN LƯƠNG ,NGỤY NHƯ KON TUM LÔ GÓC VỈA HÈ KD 60M2 GIÁ 12.9 TỶ","+ CHÍNH CHỦ CẦN TIỀN BÁN GẤP ĐẤT TẶNG NHÀ ĐANG CHO THUÊ KINH DOANH - VỈA HÈ - Ô TÔ TRÁNH - LÔ GÓC.
+ Vị trí đẹp gần các tuyến phố như, Vũ Trọng Phụng, Ngụy Như Kom Tum, Hoàng Minh Giám, Hoàng Đạo Thúy, Nguyễn Tuân...
+ Diện tích: 60m² lô góc , nở hậu, mặt tiền siêu đẹp
+ Khách mua về xây tòa 7 tầng thang máy vừa ở vừa kinh doanh.
+ Sổ đỏ đẹp sẵn giao dịch ngay.
+ Liên hệ Mai Trang để đi xem đất.","12,9 tỷ",60 m2,"Đường Lê Văn Lương, Phường Nhân Chính, Quận Thanh Xuân, Hà Nội",13712236,_,---,Cần bán,20m,---,Nhà mặt tiền,Sổ hồng/ Sổ đỏ,---,---,1,---,---,1,---
https://alonhadat.com.vn/ban-dat-tang-nha-mat-pho-le-duc-tho-nam-tu-liem-via-he-kinh-doanh-220m2-gia-150tr-m2-13712218.html,Bán đất tặng nhà mặt phố Lê Đức Thọ Nam Từ Liêm vỉa hè kinh doanh 220m2 giá 150tr/m2,"+ Chính chủ cần tiền bán gấp đất tặng nhà đang cho thuê kinh doanh phố Lê Đức Thọ giao Lê Quanh Đạo - Hàm Nghi gần sân vận động Mỹ Đình.
+ Diện tích 220m² mặt tiền 7m.
+ Vị trí đẹp, kinh doanh hay làm văn phòng đều đẹp.
+ Sổ đỏ chính chủ sẵn giao dịch luôn.
+ Giá 150tr/m² có thương lượng.
+ Liên hệ mai trang để đi xem đất.",33 tỷ,220 m2,"Đường Lê Đức Thọ, Phường Mỹ Đình 2, Quận Nam Từ Liêm, Hà Nội",13712218,_,---,Cần bán,30m,---,Nhà mặt tiền,---,---,---,1,---,---,4,---
https://alonhadat.com.vn/ban-nha-cau-giay-58m2-6-tang-gan-oto-6-25-ty--13617217.html,"BÁN NHÀ CẦU GIẤY 58M2, 6 TẦNG, GẦN OTO, 6.25 TỶ.","DÂN XÂY - NGÕ THÔNG - 2 MẶT THOÁNG - VÀI BƯỚC RA Ô TÔ TRÁNH.+ Ngõ thông tứ tung, 20M ra ô tô tránh + bãi đỗ ô tô.+ Trước nhà để được nhiều xe thoải mái. Nhiều công năng vừa ở vừa cho thuê rất phù hợp.+ khu trung tâm cầu giấy nhiều tiện ích. Gần Công viên Thủ Lệ, siêu thị LOTTE, bệnh viện, trường học...+ Sổ đỏ, pháp lý minh bạch, giao dịch nhanh.+ Hỗ trợ xem nhà miễn phí.","6,25 tỷ",58 m2,"Đường Cầu Giấy, Phường Yên Hòa, Quận Cầu Giấy, Hà Nội",13617217,_,True,Cần bán,"2,5m",True,Nhà trong hẻm,Sổ hồng/ Sổ đỏ,True,4m,6,True,14m,6,---
https://alonhadat.com.vn/hiem-toa-van-phong-10-tang-thong-san-mat-pho-lon-xuan-thuy-cau-giay-via-he-rong-ham-ro-13685726.html,"HIẾM! Toà văn phòng 10 tầng thông sàn mặt phố lớn Xuân Thủy, Cầu Giấy, vỉa hè rộng, hầm rộ","Cần bán gấp giá giảm cực sâu!

MẶT PHỐ CHÍNH XUÂN THỦY, CẦU GIẤY- VỈA HÈ RỘNG - KINH DOANH BUÔN BÁN SẦM UẤT - GIẤY PHÉP PCCC - GPXD ĐỦ - HIẾM TOÀ BÁN, HẦM RỘNG
Diện tích 100m2
Giá 67 tỷ (Có thương lượng)
- Toà văn văn phòng 10 tầng thông sàn cho thuê, mặt phô quyền lực, pháp lý sạch, sổ hoàn công, hồ sơ thiết kế, giấy phép xây dựng, pccc chữa cháy đầy đủ. 
- Vị trí cực đẹp, gần bên xe Mỹ Đình, sân vận động quốc gia, toà Dolphin palaza, tuyến chính giao thông huyết mạch. 
- Hiện đang cho thuê 200 triệu/ tháng, khách nối tiếp hợp đồng.  
- Pháp lý 1 sổ duy nhất, đã hoàn công.",67 tỷ,100 m2,"Đường Xuân Thủy, Phường Dịch Vọng Hậu, Quận Cầu Giấy, Hà Nội",13685726,_,---,Cần bán,50m,---,Nhà mặt tiền,---,---,7m,10,---,---,9,---
https://alonhadat.com.vn/ban-nha-nghia-tan-cau-giay-60m2-4-tang-oto-vao-nha-9-1-ty--13622165.html,"BÁN NHÀ NGHĨA TÂN CẦU GIẤY, 60M2, 4 TẦNG, OTO VÀO NHÀ, 9.1 TỶ.","PHÂN LÔ - OTO GARA - 2 THOÁNG - TRUNG TÂM - AN NINH TỐT.+ Nhà mặt ngõ rộng ô tô tránh dừng đỗ thỏa mái. + Chủ là quan chức làm trong học viện chính trị quốc gia đã về hưu bán đi để chia cho 2 con. + Nhà xây rất chắc chắn, móng lên 6 tầng thoải mái.
+  Hàng xóm với hoc viện chính trị quốc gia Hồ Chí Minh. Khu vực vip nhất quận Cầu Giấy, ngõ thông khắp nơi.  + Gần các trường mầm non, đại học, đi bộ ra chợ tiện ích cao, công vô cùng tiện ích, khách tìm mua rât nhiều... + Hỗ trợ xem nhà miễn phí.","9,1 tỷ",60 m2,"Đường Nghĩa Tân, Phường Nghĩa Tân, Quận Cầu Giấy, Hà Nội",13622165,_,True,Cần bán,4m,True,Nhà trong hẻm,Sổ hồng/ Sổ đỏ,True,3m,4,True,20m,5,---
https://alonhadat.com.vn/5-tang-6-pn-phan-lo-den-lu-1-hoang-mai-gara-o-to-7-cho-tranh-via-he-2-ben-cay-xanh-k-13685444.html,"5 tầng 6 PN Phân Lô Đền Lừ 1, Hoàng Mai, Gara, Ô tô 7 chỗ tránh, vỉa hè 2 bên, cây xanh, k","cần bán nhà 5 tầng phân lô Đền Lừ 1, Hoàng Mai Gara, Ô tô 7 chỗ tránh, vỉa hè 2 bên, cây xanh, kinh doanh
Diện tích 45m2, 6 phòng ngủ

Khu phân lô ôtô tránh,vỉa hè 2 bên, ôtô 7 chỗ vào nhà thoải mái
Nhà nằm ở vị trí cực đẹp, gần vườn hoa, trường mầm non và sân sinh hoạt cộng đồng, khu vực kinh doanh sầm uất và nhiều tiện ích, tập chung nhiều văn phòng Công ty vừa và nhỏ
Nhà tự xây tâm huyết, thiết kế hợp lý, thông sàn rộng thênh thang,
+ Tầng 1: Kinh Doanh, , gara ôtô, phòng kho nhỏ,
+ Tầng 2,3,4 mỗi tầng 2 phòng,
+ Tầng 5: Phòng thờ, sân phơi
+ Sổ đỏ phân lô, vuông đẹp cất két sẵn sàng giao dịch.,","10,9 tỷ",45 m2,"Đường Đền Lừ 1, Phường Hoàng Văn Thụ, Quận Hoàng Mai, Hà Nội",13685444,_,---,Cần bán,8m,---,"Biệt thự, nhà liền kề",---,---,4m,5,---,---,6,---
https://alonhadat.com.vn/gap-nha-dep-4-tang-lo-goc-2-mat-ngo-o-to-tranh-kim-nguu-tang-full-noi-that-kinh-doanh-n-13682004.html,"Gấp Nhà đẹp 4 tầng lô góc 2 mặt ngõ ô tô tránh Kim Ngưu, tặng full nội thất, kinh doanh, n","bán gấp nhà đẹp THIẾT KẾ KIỂU BIỆT THỰ CHÂU ÂU Kim Ngưu, Hai Bà Trưng, Hà Nội
43m2 4 tầng, mặt tiền 12,6m giá 9 tỷ (có thương lượng)

LÔ GÓC 2 MẶT NGÕ THÔNG Ô TÔ TRÁNH, TẶNG FUN NỘI THẤT  - KINH DOANH - NGÕ THÔNG KHẮP NGẢ 
Đường rộng ô tô đỗ ngày đêm thoải mái , an ninh cực tốt , vỉa hè rộng, thiết bị nội thất hiện đại. Vừa ở vừa kinh doanh văn phòng đều hợp lý 
Thiết kế: 
Tầng 1: Phòng Khách - Vs - Gala 
Tầng 2: Bếp - 1 Ngủ - Vs 
Tầng 3: 2 Ngủ - Vs 
Tầng 4: tum, sân thượng.
- Sổ đỏ chính chủ sẵn sàng giao dịch , sổ đẹp",9 tỷ,43 m2,"Phố Kim Ngưu, Phường Thanh Lương, Quận Hai Bà Trưng, Hà Nội",13682004,_,---,Cần bán,8m,---,Nhà trong hẻm,---,---,"12,6m",4,---,---,4,---
https://alonhadat.com.vn/ban-nha-ngoc-ha-55m2-5-tang-oto-9-8-ty--13621973.html,"BÁN NHÀ NGỌC HÀ, 55M2, 5 TẦNG, OTO, 9.8 TỶ.","NHÀ ĐẸP - GẦN MẶT PHỐ NGỌC HÀ - Ô TÔ ĐỖ CỔNG - GẦN LĂNG BÁC - DÂN TRÍ CAO - AN SINH ĐỈNH.+ Cách mặt phố Ngọc Hà chừng 25-30m, mặt ngõ rộng, ô tô vào khi cần thiết.+ Là ngõ đẹp nhất Ngọc Hà, an ninh, dân trí cao, hàng xóm thân thiện. Ô tô gửi đầu ngõ ở Lăng Bác luôn. + Từ Ngọc Hà giao thông thuận tiện khắp ngả, tiện ra Hồ Tây, tiện lên phố cổ, tiện ra sân bay...nói chung là...ĐẠI TIỆN.

+ Nhà xây khung bê tông cốt thép hơn chục năm, vô cùng chắc chắn.+ Cầu thang thoải rộng dễ đi, có thể cải tạo lắp thang máy gia đình.+ Trước nhà có khoản sân nhỏ để được 6 cái xe máy vô cùng thuận tiện.+ Chủ cần bán chia cho 2 con tự mua nhà riêng chỗ khác.  + Chủ để lại toàn bộ nội thất trừ tivi, tủ lạnh, máy giặt. Nhà đẹp và vượng khí, ấm cúng, giá bán còn thương lượng.","9,8 tỷ",55 m2,"Đường Ngọc Hà, Phường Ngọc Hà, Quận Ba Đình, Hà Nội",13621973,_,True,Cần bán,3m,True,Nhà trong hẻm,Sổ hồng/ Sổ đỏ,True,4m,5,True,14m,4,---
https://alonhadat.com.vn/ban-nha-dao-tan-50m2-5-tang-mat-tien-4m-gan-oto-8-55-ty--13612819.html,"BÁN NHÀ ĐÀO TẤN, 50M2, 5 TẦNG, MẶT TIỀN 4M, GẦN OTO, 8.55 TỶ.","+ Gần oto, nhà cách mặt phố Đào Tấn khoảng 100m.
+ Trung tâm quận Ba Đình, tập trung nhiều Công ty, văn phòng, đặc biệt là khách Nhật Bản ở rất nhiều.
+ Nhiều tiện ích ngập tràn, Công viên Thủ Lệ, siêu thị LOTTE, METROPOLIS, bệnh viện, trường học... 
+ Khu vực cực hiếm nhà bán, thuận lợi di chuyển. 
+ Hỗ trợ xem nhà miễn phí.","8,55 tỷ",50 m2,"Đường Đào Tấn, Phường Cống Vị, Quận Ba Đình, Hà Nội",13612819,_,True,Cần bán,"2,5m",True,Nhà trong hẻm,Sổ hồng/ Sổ đỏ,True,4m,5,True,12m,6,---
https://alonhadat.com.vn/ban-nha-van-cao-50m2-3-tang-oto-mat-tien-4m-7-5-ty--13612763.html,"BÁN NHÀ VĂN CAO, 50M2, 3 TẦNG, OTO, MẶT TIỀN 4M, 7.5 TỶ.","HIẾM BA ĐÌNH - Ô TÔ ĐỖ CỬA - SIÊU PHẨM.+ Vị trí đẹp, thông Hoàng Hoa Thám, ô tô tránh, khu vực vip Ba Đình, dân trí cao, phân lô quân đội.+ Khu trung tâm nhiều tiện ích. trung tâm thương mại LOTTE, METROPOLIS, trường học, bệnh viện...+ Thuận lợi di chuyển nhiều hướng+ Xác định mua đất xây nhà mới đẹp long lanh. + Hỗ trợ xem nhà miễn phí.","7,5 tỷ",50 m2,"Phố Văn Cao, Phường Liễu Giai, Quận Ba Đình, Hà Nội",13612763,_,True,Cần bán,"3,5m",True,Nhà trong hẻm,Sổ hồng/ Sổ đỏ,True,4m,3,True,12m,2,---
https://alonhadat.com.vn/ban-dat-kim-ma-thong-doi-can-va-giang-van-minh-50m2-mat-tien-7-6m-5-5-ty--13585664.html,"BÁN ĐẤT KIM MÃ THÔNG ĐỘI CẤN VÀ GIANG VĂN MINH, 50M2, MẶT TIỀN 7.6M, 5.5 TỶ.","MẢNH ĐẤT CHỦ BỎ QUÊN HƠN CHỤC NĂM THÔNG SỐ ĐẸP - GIỮ ĐẤT CHỜ QUY HOẠCH CÁCH VÀI NHÀ RA PHỐ KIM MÃ - ĐÓN ĐẦU QUY HOẠCH MỞ ĐƯỜNG TRẦN PHÚ KÉO DÀI. -  Trước và sau nhà thoáng.-  Phù hợp xây lên nhà 7 tầng đẹp long lanh trong lõi Ba Đình hoặc mua giữ đất đón đầu quy hoạch mở đường lớn. Mảnh đất còn sót lại ở Ba Đình, thông số đẹp.","5,5 tỷ",50 m2,"Phường Đội Cấn, Quận Ba Đình, Hà Nội",13585664,_,---,Cần bán,"2,5m",---,"Đất thổ cư, đất ở",Sổ hồng/ Sổ đỏ,---,"7,6m",---,---,"6,5m",---,---
https://alonhadat.com.vn/nha-moi-dep-7-tang-hoang-mai-thang-may-o-to-vao-nha-kinh-doanh-tap-nap-thong-san-van-ph-13681667.html,"Nhà mới đẹp 7 Tầng Hoàng Mai, thang máy ô tô vào nhà, Kinh doanh tấp nập, thông sàn văn ph","bán gấp nhà mới đẹp đường Hoàng Mai 7 tầng 60m2, mặt tiền 5m 13 tỷ (Thương lượng)

Vị trí đẹp , nhà mới cứng , nội thất xịn xò , thuận tiện đi lại , khu vực gần trung tâm đền lừ , ngày đêm quán xá tấp lập 
KINH DOANH TẤP NẬP NGÀY ĐÊM - 7 TẦNG THANG MÁY KÍNH KOONG CHẠY- HIẾM  - Ô TÔ VÀO NHÀ - VỊ TRÍ ĐẮC ĐỊA - CHO THUÊ VĂN PHÒNG THÔNG SÀN 
Thiết kế: 
+ Tầng 1 : GaLa - Kinh Doanh - Vs
+ Tầng 2 : Gác Lửng - Phòng Khách
+ Tầng 3 : Thông Sàn - Vs 
+ Tầng 4 : Phòng Ngủ Rộng - Vs 
+ Tầng 5: 2 Phòng Ngủ - 2 Vs Kép Kín 
+ Tầng 6: Bếp - Phòng Khách2 
+Tầng 7 : Phòng Thờ - Sân Phơi - Vườn Cây Cảnh )
Sổ đỏ vuông đẹp, cất két, chờ giao dịch ngay.",13 tỷ,60 m2,"Đường Hoàng Mai, Phường Hoàng Văn Thụ, Quận Hoàng Mai, Hà Nội",13681667,_,---,Cần bán,4m,---,Nhà trong hẻm,---,---,5m,7,---,---,5,---
https://alonhadat.com.vn/ban-nha-nguyen-chi-thanh-112m2-8-tang-mat-tien-6m-45-ty--13568383.html,"BÁN NHÀ NGUYỄN CHÍ THANH, 112M2, 8 TẦNG, MẶT TIỀN 6M, 45 TỶ.","NHÀ MẶT PHỐ KINH DOANH ĐỈNH - CHỦ ĐANG CHO THUÊ - DOANH THU ỔN ĐỊNH - CHỦ THIỆN TRÍ BÁN.
 + Nhà mặt phố Nguyễn Chí Thanh kinh doanh sầm uất.
 + Khu trung tâm nhiều tiện ích, gần Đài truyền hình VTV, trung tâm thương mại Nguyễn Chí Thanh, trường Đại học. Bệnh viện nhi trung ương, Bệnh viện phụ sản, LOTTE, METROPOLIS... 
 + Vị trí quá đẹp, sổ đỏ sẵn sàng giao dịch.
 + Hỗ trợ xem nhà miễn phí.",45 tỷ,112 m2,"Đường Nguyễn Chí Thanh, Quận Đống Đa, Hà Nội",13568383,_,True,Cần bán,4m,True,Nhà trong hẻm,Sổ hồng/ Sổ đỏ,True,6m,8,True,19m,10,---
https://alonhadat.com.vn/hang-hiem-1400m2-dat-mat-duong-doi-cong-ecopark-da-ton-gia-lam-ha-noi-mat-tien-46m-13562825.html,"Hàng hiếm! 1400m2 đất mặt đường đôi cổng Ecopark, Đa Tốn, Gia lâm, Hà Nội mặt tiền 46m","Hàng hiếm! 1400m2 đất mặt đường đôi cổng Ecopark Đa Tốn, Gia lâm, Hà Nội mặt tiền 46m 28 tỷ
Lô đất rất hiếm cho các doanh nghiệp cần diện tích lớn, kho xường, văn phòng đại diện trưng bày sản phẩn, xe container ra vào, dừng đỗ
Chủ đã xin phép + hồ sơ xây dựng 3 tầng/sàn
LH ngay (Hương) xem đất và nhận thêm thông tin",28 tỷ,1.400 m2,"Xã Đa Tốn, Huyện Gia Lâm, Hà Nội",13562825,_,---,Cần bán,50m,---,"Đất thổ cư, đất ở",---,---,46m,---,---,---,---,---
https://alonhadat.com.vn/nha-dep-lo-goc-8-tang-thang-may-minh-khai-kinh-doanh-via-he-thong-san-13624013.html,nhà đẹp - lô góc 8 tầng - thang máy Minh Khai - kinh doanh - vỉa hè - thông sàn,"Nhà hiện trạng xây 8 tầng, thang máy nhập khẩu, thông sàn kinh doanh, vỉa hè, ô tô tránh, đỗ cửa, xây kiên cố chắc chắn.
Diện tích 43m2, mặt tiền 4,2m
Giá 17,5 tỷ (có thương lượng)
Pháp lý: Sổ đỏ chính chủ, sẵn sàng giao dịch.
Tọa lạc trên mặt phố Minh Khai vị trí cực kỳ đắc địa kinh doanh tấp nập ngày đêm mọi loại hình. Giao thông kết nối giáp với các tuyến phố huyết mạch: Kim Ngưu, Lò Đúc, Tam Trinh, Thanh Nhàn... lên phố đi bộ chưa đến 5p, nên đi đâu cũng thuận tiện.","17,5 tỷ",43 m2,"Đường Minh Khai, Phường Minh Khai, Quận Hai Bà Trưng, Hà Nội",13624013,_,---,Cần bán,30m,---,Nhà mặt tiền,---,---,"4,2m",8,---,---,8,---
https://alonhadat.com.vn/ban-nha-van-cao-30m2-5-tang-gan-oto-4-1-ty--13568606.html,"BÁN NHÀ VĂN CAO, 30M2, 5 TẦNG, GẦN OTO, 4.1 TỶ.","NHÀ ĐẸP - 2 MẶT THOÁNG - GẦN Ô TÔ- Vị trí nhà rất gần đường ô tô tránh, gần mặt phố Văn Cao và đặc biệt hơn nữa là gần hồ Tây lộng gió.- Khu vực trung tâm nhiều tiện ích, thuận tiện di chuyển nhiều hướng.- Gần trung tâm thương mại, siêu thị LOTTE, MTROPOLIS, Bệnh viện thu cúc, Bệnh viện nhi trung ương, Bệnh viện phụ sản...- Nhà chủ tự tây xây để ở chắc chắn, sẵn ở luôn hoặc khách mua về có thể tân trang lại cho đẹp long lanh hơn để ở.- sổ đỏ sẵn sàng giao dịch. - Hỗ trợ xem nhà miễn phí.","4,1 tỷ",30 m2,"Phố Văn Cao, Phường Liễu Giai, Quận Ba Đình, Hà Nội",13568606,_,True,Cần bán,"2,5m",True,Nhà trong hẻm,Sổ hồng/ Sổ đỏ,True,3m,5,True,10m,2,---
