https://alonhadat.com.vn/ban-nha-lo-goc-gara-thang-may-thach-ban-58m2-6-tang-mat-tien-4m-gia-chao-7-85-ty--12863074.html,"Bán nhà Lô Góc, Gara, Thang Máy, Thạch Bàn 58m2, 6 tầng, mặt tiền 4.6m, giá chào 6.2tỷ.","Chủ cực mót bán căn đầu tiên giá sẽ cực hấp dẫn đừng quan tâm giá chào.
Chỉ hơn 6 tỷ có ngay 1 căn nhà 58m2, Lô Góc Gara  ô tô, Thang máy nhập khẩu. Cách Aoen Long Biên 1km.
- Vị trí đắc địa ngay cạnh trường THPT Thạch Bàn, khu đô thị Garden CiTy, khu vực cơ sở hạ tầng ổn định phát triển nhanh chóng, Hàng xóm Vinhomes Ocean Park, Aeon Mall Long Biên, trường học cấp 1,2,3…tiện ích Bạt ngàn không gian thoáng đãng Bình yên khu vực ở cực sướng, tiện ích bạt ngàn không thiếu thứ gì…
- Ngõ thẳng tắp ô tô vào nhà thoải mái, vài bước ra Ô tô tránh dừng đỗ ngày đêm, đường vào cây xanh rợp bóng mát được thừa hưởng tiện ích của khu Đô Thị Garden City đường thông thoáng…nằm giữa 2 cầu Vĩnh Tuy và Thanh Trì giao thông cực kì thuận tiện.
- nhà đẹp, mới kính kong chủ đầu tư uy tín hàng đầu, xây nhà cực kì chắc chắn, hiện đại, trẻ trung, hợp xu thế hiện tại, nội thất xin sò đẳng cấp…
- sổ đỏ chính chủ, pháp lý sạch sẵn sành giao dịch ngay.
- CƠ HỘI TỐT NHẤT CHO NGƯỜI ĐẦU TIÊN
- Liên hệ ngay e Vĩnh Để xem trong ngoài và tư vấn khu vực miễn phí.","6,2 tỷ",58 m2,"Đường Thạch Bàn, Phường Thạch Bàn, Quận Long Biên, Hà Nội",12863074,_,True,Cần bán,"4,5m",True,Nhà trong hẻm,Sổ hồng/ Sổ đỏ,True,"4,6m",6,True,---,6,---
