url,title,description,price,area,address,Mã tin,Hướng,Phòng ăn,Loại tin,Đường trước nhà,Nhà bếp,Loại BDS,Pháp lý,Sân thượng,Chiều ngang,Số lầu,Chổ để xe hơi,Chiều dài,Số phòng ngủ,Chính chủ
https://alonhadat.com.vn/ban-gap-nha-tran-cung-o-to-vao-nha-gan-hoang-quoc-viet-noi-that-lung-linh-50m2-4-85-ty-13230402.html,"Bán gấp nhà Trần Cung ô tô vào nhà, gần Hoàng Quốc Việt nội thất lung linh 50m2 - 4,85 tỷ","- Vị trí nhà dân xây chắc chắn ô tô vào nhà, ngõ thông các ngả thông ra KĐT Nam Cường, gần viện E. Chỉ 50m ra ô tô tránh nhau, dừng đỗ. 1 phút ra Hoàng Quốc Việt, Phạm Văn Đồng giao thông vô cùng thuận tiện.
- Diện tích rộng 50m nhà dân xây móng cọc chắc chắn, nói không với nhà xây thương mại, thiết kế hiện đại, đầy đủ công năng cho gia đình 3 thế hệ. Vừa ở vừa kinh doanh nhỏ hay cho thuê hái ra tiền.
- Khu vực dân trí cao, hàng xóm thân thiện, an ninh cực tốt, gần trường Liên cấp Newton, Pascan vô cùng tiện ích. Chủ nhà cần bán gấp để chuyển nhà lớn, giá chốt linh động cho khách thiện chí.
Lh ngay Ms Ngân chuyên nhà đất Trần Cung - Nam Bắc Từ Liêm.","4,85 tỷ",50 m2,"Đường Trần Cung, Phường Cổ Nhuế 1, Quận Bắc Từ Liêm, Hà Nội",13230402,_,---,Cần bán,4m,---,Nhà trong hẻm,---,---,---,4,---,---,4,---
https://alonhadat.com.vn/ban-nha-106-hoang-quoc-viet-phan-lo-can-bo-o-to-vao-nha-2-mat-ngo-o-to-75m-nhinh-13-ty-12764029.html,"Bán nhà 106 Hoàng Quốc Việt phân lô cán bộ, ô tô vào nhà, 2 mặt ngõ ô tô 75m nhỉnh 13 tỷ","-          Vị trí rất đẹp ngõ Vip 106 Hoàng Quốc Việt thông ra Nghĩa Đô, gần trường TH Nghĩa Đô, vài bước  ra mặt phố Hoàng Quốc Việt , giao thông vô cùng thuận tiện.
-          Ngõ phân lô, ô tô vào nhà, đi ra  Hoàng Quốc Việt  đường 6 làn xe ô tô đua rất gần. Khu phân lô, phát triển bậc nhất của Cầu Giấy.
-          Diện tích 75m thiết kế hiện đại, có ô chờ thang máy, dân xây chắc chắn, chắn nói không với nhà xây thương mại, vừa ở vừa kinh doanh văn phòng, spa hái ra tiền.
-          Khu vực phân lô dân trí cao. Chủ nhà cán bộ nhà nước, con cái giỏi giang, ở nhà này chủ mua được nhiều nhà, ở rất có lộc! Giá chốt linh động cho khách thiện chí!
Lh ngay Mrs. Ngân nhà đất Cầu Giấy – Tây Hồ - Nam Bắc Từ Liêm.",13 tỷ,75 m2,"Đường Hoàng Quốc Việt, Phường Nghĩa Đô, Quận Cầu Giấy, Hà Nội",12764029,_,True,Cần bán,7m,True,Nhà trong hẻm,Sổ hồng/ Sổ đỏ,True,6m,5,True,12m,6,---
https://alonhadat.com.vn/nha-dep-co-nhue-thong-ra-kdt-resco-lo-goc-o-to-do-cua-dan-xay-chac-chan-40m-nhinh-3-ty-13679226.html,"Nhà đẹp Cổ Nhuế thông ra KĐT Resco, lô góc, ô tô đỗ cửa, dân xây chắc chắn 40m nhỉnh 3 tỷ","- Vị trí gần bệnh viện Phương Đông, Học viện Tài Chính, ô tô đỗ cửa siêu đẹp, thông ra KĐT Resco, trục Tây Hồ Tây kéo dài chạy qua tương lai rực sáng. Chỉ phút mốt ra Phạm Văn Đồng, Hoàng Quốc Việt, Bộ Công An,....Giao thông vô cùng thuận tiện
- Nhà lô góc thoáng sáng, ô tô đỗ cửa, dân xây chắc chắn, nói không với nhà xây thương mại,  chủ ở rất giữ gìn, thiết kế hiện đại . Nhà đầy đủ công năng cho gia đình 3 thế hệ.
- Chủ nhà thành đạt, hàng xóm thân thiện, an ninh cực tốt, cần bán gấp để chuyển ra mặt phố kinh doanh, giá chốt linh động cho khách thiện chí.
Lh ngay Ms.Ngân để được tư vấn.","3,8 tỷ",40 m2,"Đường Cổ Nhuế, Phường Cổ Nhuế 2, Quận Bắc Từ Liêm, Hà Nội",13679226,_,---,Cần bán,5m,---,Nhà trong hẻm,---,---,---,5,---,---,6,---
https://alonhadat.com.vn/hoang-quoc-viet-lexus-vao-nha-via-he-o-to-tranh-kinh-doanh-vp-spa-50m-8-1-ty-13123580.html,"Hoàng Quốc Việt Lexus vào nhà vỉa hè, ô tô tránh, kinh doanh VP, SPA 50m 8.1 tỷ","- Nhà có vị trí rất đẹp - Hoàng Quốc Việt Vip của Cầu Giấy, gara ô tô, vỉa hè ô tô tránh
- Gần Nguyễn Phong Sắc, Trần Tử Bình, Nghĩa Tân , 3p ra Hồ Tây lộng gió, 3p ra Cầu Giấy và chỉ 15p ra Sân Bay.
- Bán kính siêu gần là công viên, hồ điều hoà, trung tâm thương mại, gần chợ trường các cấp vô cùng tiện ích.
- DT rộng 51m thiết kế hiện đại, ô thang máy sẵn, nội thất nhập khẩu, nhà dân xây chắc, 3 thế hệ ở vẫn vô tư. Nhà đẹp chắc chắn nói không với nhà xây thương mại. Vừa ở vừa kinh doanh văn phòng, spa hái ra tiền.
-  Chủ nhà cán bộ ngân hàng, con cái giỏi giang. Chủ bán gấp chuyển nhà lớn! Giá chốt linh động cho khách thiện chí!
Giá: 8.1 tỷ thương lượng
Lh ngay E. Ngân để được tư vấn và xem nhà miễn phí.","8,1 tỷ",50 m2,"Đường Hoàng Quốc Việt, Phường Nghĩa Đô, Quận Cầu Giấy, Hà Nội",13123580,_,---,Cần bán,6m,---,Nhà trong hẻm,---,---,---,5,---,---,6,---
https://alonhadat.com.vn/ban-nha-ngoc-thuy-long-bien-o-to-do-gan-nha-thiet-ke-dep-gia-nhinh-4-ty-13512002.html,"Bán nhà Ngọc Thụy, Long Biên, ô tô đỗ gần nhà, thiết kế đẹp. Giá nhỉnh 4 tỷ","Bán nhà phố Ngọc Thuy, quận Long Biên, gần chợ Ngọc Thụy, khu đô thị Khai Sơn, hồ điều hòa, công viên tái định cự Ngọc Thụy, hạ tầng đang rất đẹp và đồng bộ, cách 5p ra tới Ngọc Lâm, Nguyễn Văn Cừ, cầu Chương Dương...
- Vị trí: nhà đẹp, thoáng mát, sân cổng chung rộng chỉ 2 nhà thoải mái, k va chạm, trước nhà view sân vườn thoáng, ngõ gần ô tô, tiện đi lại

- Diện tích 35m2, xây 5 tầng chắc chắn, thiết kế đủ công năng, 3 phòng ngủ, 1 tầng 1 phòng khép kín, full nội thất, khách chỉ việc về ở.
- Thực tế xây dựng Tầng 1: 35m; Tầng 2 trở lên 37m nên nhà rất rộng, thoáng.

- Sổ đỏ chính chủ, thiện chí bán nhanh, giá chào 4.3 tỷ có thương lượng
Vui lòng liên hệ để biết thêm thông tin chi tiết","4,3 tỷ",35 m2,"Đường Ngọc Thụy, Phường Ngọc Thụy, Quận Long Biên, Hà Nội",13512002,_,True,Cần bán,"2,5m",True,Nhà trong hẻm,Sổ hồng/ Sổ đỏ,True,5m,5,True,7m,3,---
https://alonhadat.com.vn/ban-gap-nha-co-nhue-ngo-o-to-tranh-o-to-vao-nha-thong-ra-rescot-nho-52m-chi-3-4-ty-12705160.html,"Bán gấp nhà Cổ Nhuế ngõ ô tô tránh, ô tô vào nhà thông ra Resco 52m chỉ 3.4 tỷ","-          Vị trí nhà gần Hoàng Quốc Việt , phố Phạm Văn Đồng thông KĐT Nam Cường, ngõ thông các ngả, vài bước chân ra ô tô tránh nhau, dừng đỗ, kinh doanh sầm uất. Khu vực dân trí cao, gần Hoàng Quốc Việt, gần trường Pascan, Bộ Công An, Metro cũ…ngõ thông có thể ở kết hợp kinh doanh hái ra tiền.
-          Diện tích 48m thiết kế vô cùng hiện đại, thất đẹp lung linh, chỉ xách vali về ở. Đầy đủ công năng cho gia đình nhiều thế hệ.
-          Khu vực dân trí cao, hàng xóm thân thiện, an ninh cực tốt. Chủ nhà thành đạt con cái giỏi giang, bán nhà chuyển nhà to hơn, giá chốt linh động cho khách thiện chí.
Lh ngay Mrs.Ngân chuyên nhà đất Tây Hồ - Cầu Giấy - Nam Bắc Từ Liêm","4,5 tỷ",52 m2,"Đường Cổ Nhuế, Phường Cổ Nhuế 2, Quận Bắc Từ Liêm, Hà Nội",12705160,_,True,Cần bán,5m,True,Nhà trong hẻm,Sổ hồng/ Sổ đỏ,True,4m,4,True,12m,4,---
https://alonhadat.com.vn/ban-nha-nguyen-van-cu-long-bien-ngo-thong-hong-tien-can-goc-gan-o-to-39m2-4-ty-13680151.html,"Bán nhà Nguyễn Văn Cừ, Long Biên, ngõ thông Hồng Tiến, căn góc, gần ô tô, 39m2, 4 tỷ","Nhà mặt ngõ phố Nguyễn Văn Cừ, Long Biên, thông ra Hồng Tiến, Hoàng Như Tiếp, xung quanh nhiều tiện ích, bệnh viện Tâm Anh, trường chợ bạt ngàn
Ngõ thông, ô tô đỗ sát nhà, bãi gửi xe cách 20m
Dt 39m2, căn góc, vuông vắn, giá chào bán nhanh 4 tỷ có TL
Vui lòng liên hệ để biết thêm thông tin chi tiết",4 tỷ,39 m2,"Đường Nguyễn Văn Cừ, Phường Bồ Đề, Quận Long Biên, Hà Nội",13680151,_,---,Cần bán,"2,2m",---,Nhà trong hẻm,Sổ hồng/ Sổ đỏ,---,"3,2m",2,---,---,2,---
https://alonhadat.com.vn/ban-nha-viet-hung-long-bien-o-to-do-cua-thong-cac-nga-kinh-doanh-tot-gia-chao-5-5-ty-13505836.html,"Bán nhà Việt Hưng, Long Biên, ô tô đỗ cửa, thông các ngả, kinh doanh tốt, giá chào 5.5 tỷ","Bán nhà Việt Hưng, Logn Biên, xung quanh đầy đủ tiện ích, gần big C Long Biên, bệnh viện Đức Giang, thông các ngả, khu vực quy hoạch đẹp, ổn định, an sinh xã hội cao, tiềm năng rất đẹp
Diện tích 45m2 xây 5 tầng kiên cố, đường rộng ô tô đỗ cửa, ở sướng, kinh doanh tốt, dân cư đông đúc, văn minh, sạch sẽ
Chủ cần bán gấp để chuyển sang nhà mới, thiện chí giao dịch sớm, chốt nhanh, giá chào 5.5 tỷ có thương lượng, giá chốt bất ngờ
Vui lòng liên hệ để đi xem nhà","5,5 tỷ",45 m2,"Đường Việt Hưng, Phường Việt Hưng, Quận Long Biên, Hà Nội",13505836,_,True,Cần bán,3m,True,Nhà trong hẻm,Sổ hồng/ Sổ đỏ,True,4m,5,True,"11,5m",4,---
https://alonhadat.com.vn/ban-nha-2-tang-hang-xom-mipec-42m2-gia-2-8-ty-13047617.html,"Bán nhà 2 tầng hàng xóm Mipec, 42m2 giá 2.8 tỷ","Nhà phố Ngọc Thụy, ngay sát Mipec Long Biên, đường thông các ngả, tiện ích đầy đủ, hiên tại là nhà 2 tầng, chủ tự xây nên đã tính toán để có thể lên 4.tầng thoải mái, Chủ  mua nhà khác nên cần nhượng lại gấp, để lại toàn bộ nội thất. Mọi thông tin chi tiết xin liên hệ:","2,8 tỷ",42 m2,"Đường Ngọc Thụy, Phường Ngọc Thụy, Quận Long Biên, Hà Nội",13047617,_,True,Cần bán,"2,5m",True,Nhà trong hẻm,Sổ hồng/ Sổ đỏ,True,"4,2m",2,True,10m,2,---
https://alonhadat.com.vn/ban-nha-ngoc-thuy-gan-cho-duong-hong-tien-keo-dai-o-to-do-cua-gia-4-1-ty-13190410.html,"Bán nhà Ngọc Thuy, gần chợ, đường Hồng Tiến Kéo dài, ô tô đỗ cửa, giá 4.1 tỷ","Nhà chính chủ tự xây 4 tầng, 4 ngủ, phòng thờ sân phơi đủ công năng, gần chợ Ngọc Thụy, đường Hồng Tiền kéo dài, khu đô thị Khai Sơn..đầy đủ tiện ích, 5p đến Mipec, cầu Chương Dương, giao thông thuận tiện. Giá bán 4.1 tỷ có thương lượng với người thiện chí.","4,1 tỷ",45 m2,"Đường Ngọc Thụy, Phường Ngọc Thụy, Quận Long Biên, Hà Nội",13190410,_,True,Cần bán,3m,True,Nhà trong hẻm,Sổ hồng/ Sổ đỏ,True,4m,4,True,11m,4,---
https://alonhadat.com.vn/ban-nha-nguyen-son-long-bien-90m2-7-tang-thang-may-kinh-doanh-gia-17-3-ty-13092653.html,"Bán nhà Nguyễn Sơn, Long Biên. 90m2 - 7 tầng thang máy, kinh doanh. Giá 17,3 tỷ","Trung tâm Long Biên, phố Nguyễn Sơn, nhà 90m2 xây 7 tầng thang máy hiện đại, phù hợp mọi loại hình kinh doanh,các tầng đều bố trí thông phòng, cầu thang cuối, sổ đỏ chính chủ đang giữ, sẵn sàng bàn giao luôn và ngay. Giá bán: 17.3 tỷ","17,3 tỷ",90 m2,"Đường Nguyễn Sơn, Phường Ngọc Lâm, Quận Long Biên, Hà Nội",13092653,_,---,Cần bán,9m,---,Nhà trong hẻm,Sổ hồng/ Sổ đỏ,---,"6,5m",7,---,---,6,---
https://alonhadat.com.vn/ban-nha-ngoc-lam-2-tang-full-do-o-ngay-10m-o-to-do-cua-32m2-gia-2-8-ty-13149336.html,"Bán nhà Ngoc Lâm, 2 tầng full đồ, ở ngay, 10m ô tô đỗ cửa .32m2 giá 2.8 tỷ","Hàng hiếm, nhỏ tiền, vô vàn tiện ích, ở ngay, ô tô đỗ cửa, cực kỳ thoáng mát. Bán nhà 2 tầng chủ để lại toàn bộ nội thất, khách vào ở được ngay tại phố Ngọc Lâm, 2 tầng gồm khách bếp, 2 phòng ngủ, không lỗi phong thủy, sổ đỏ sang tên ngay. Giá bán 2.8 tỷ có ra lộc.Thân ái!","2,8 tỷ",32 m2,"Đường Ngọc Lâm, Phường Ngọc Lâm, Quận Long Biên, Hà Nội",13149336,_,---,Cần bán,2m,---,Nhà trong hẻm,Sổ hồng/ Sổ đỏ,---,5m,2,---,"6,5m",2,---
https://alonhadat.com.vn/ban-nha-ngoc-thuy-o-to-do-cua-5-tang-gia-2-7-ty-13473421.html,"Bán nhà Ngọc Thụy, ô tô đỗ cửa, 5 tầng giá 2.9 tỷ","Bán nhà Ngọc Thụy, Long Biên, gần chợ Ngọc Thụy, đô thị Khai Son, xung quanh đầy đủ tiện ích, trường tiểu học Lý Thường Kiệt, 5 phút ra Ngọc Lâm, cầu Chương Dương, Nguyễn Văn Cừ
Nhà 30m2 xây 5 tầng còn mới, thiết kế đẹp, ô tô đõ cửa, giao thông thuận tiện, thông ra phố Gia Thượng
Sổ đỏ chuẩn, chủ cần gấp hạ giá bán nhanh 2.9 tỷ
Vui lòng liên hệ để đi xem nhà","2,7 tỷ",30 m2,"Đường Ngọc Thụy, Phường Ngọc Thụy, Quận Long Biên, Hà Nội",13473421,_,True,Cần bán,3m,True,Nhà trong hẻm,Sổ hồng/ Sổ đỏ,True,4m,5,True,"7,5m",3,---
https://alonhadat.com.vn/ban-nha-ngo-gia-tu-long-bien-20m-ra-duong-o-to-nha-moi-32m2-5-tang-gia-3-55-ty-13498720.html,"Bán nhà Ngô Gia Tự, Long Biên 20m ra đường ô tô, nhà mới 32m2, 5 tầng, giá 3,55 tỷ","NHÀ XÂY CỰC CHẤT LƯợNG - NHÀ ĐẸP - 20 M Ô TÔ - AN SINH TUYỆT VỜI - NGAY GẦN CHỢ VIỆT HƯNG 
Bán nhà Ngô Gia Tự, Long Biên, khu dân cư đông đúc sầm uất, 5p ra Big C Long Biên, chợ dân sinh, bệnh viện Đức Giang, giao thông thuận tiện

Nhà mới xây 5 tầng, diện tích 32m2, thiết kế trẻ trung, thoáng sáng
Tầng 1: Khách + Bếp +vs.
Tầng 2+3+4: 1 phòng ngủ + VS khép kín
Tầng 5: phòng thờ cực rộng và đẹp + Sân Phơi
Sổ đỏ chính chủ, sẵn sàng giao dịch, giá chào 3.55 tỷ có thương lượng
Vui lòng liên hệ để biết thêm thông tin chi tiết","3,55 tỷ",32 m2,"Đường Ngô Gia Tự, Phường Việt Hưng, Quận Long Biên, Hà Nội",13498720,_,True,Cần bán,2m,True,Nhà trong hẻm,Sổ hồng/ Sổ đỏ,True,5m,5,True,"5,5m",3,---
https://alonhadat.com.vn/ban-nha-ngoc-thuy-long-bien-gan-khai-son-o-to-do-cong-5-tang-gia-3-1-ty-13473445.html,"Bán nhà Ngọc Thụy, Long Biên, gần Khai Sơn ô tô đỗ cổng, 5 tầng giá 3.1 tỷ","Ô TÔ ĐỖ CỔNG - NGÕ THÔNG CẠNH TRƯỜNG PHÁP - CHỦ NHIỆT BÁN, GIÁ THƯƠNG LƯỢNG TỐT
+ Vị trí: trung tâm Ngọc Thụy, cạnh Trường quốc tế Việt Pháp, Khai Sơn City, ô tô thông thoải mái, cách đường Gia Thượng 50m, gần chợ Ngọc Thụy, kết nối khu tái định cư Ngọc Thụy, tiện ích đầy đủ

+ Nhà chủ xây năm 2018 hiện tại gia đình đang sử dụng. Thiết kế 5 tầng, tặng nội thất
T1: khách, bếp, wc
T2: Ngủ, wc
T3: Ngủ, wc
T4: Ngủ, wc
T5: Phòng thờ rộng , sân chơi.

+ Sổ đỏ vuông vắn, sẵn sàng giao dịch, giá chào bán nhanh 3.1 tỷ rẻ nhất khu vực
Vui lòng liên hệ để biết thêm thông tin chi tiết","3,1 tỷ",30 m2,"Đường Ngọc Thụy, Phường Ngọc Thụy, Quận Long Biên, Hà Nội",13473445,_,True,Cần bán,1m,True,Nhà trong hẻm,Sổ hồng/ Sổ đỏ,True,"4,5m",5,True,7m,3,---
https://alonhadat.com.vn/sieu-pham-nha-8-tang-pho-ngoc-lam-o-to-tranh-thong-san-thang-may-hien-dai-gia-17-ty-13076918.html,"Siêu phẩm!!! Nhà 8 tầng phố Ngọc Lâm, ô tô tránh, thông sàn, thang máy hiện đại. Giá 17 tỷ","Trung tâm phố cổ Ngọc Lâm, Long Biên kinh doanh sầm uất. Toà nhà 8 tầng thiết kế hiện đại, thông sàn, thang máy chất lượng cao, đường ô tô tránh phù hợp mọi loại hình kinh doanh: văn phòng, nhà hàng, siêu thị, phòng khám, trung tâm ngoại ngữ…",17 tỷ,98 m2,"Đường Ngọc Lâm, Phường Ngọc Lâm, Quận Long Biên, Hà Nội",13076918,_,---,Cần bán,8m,---,Nhà trong hẻm,Sổ hồng/ Sổ đỏ,---,6m,8,---,17m,7,---
https://alonhadat.com.vn/ban-nha-4-tang-ngo-252-ngoc-thuy-lb-ngo-thong-o-to-do-cua-gia-nhinh-4-ty-13055939.html,"Bán nhà 4 tầng ngõ 252 Ngọc Thuỵ, LB ngõ thông ô tô đỗ cửa. Giá nhỉnh 4 tỷ","Căn nhà nằm ngay chợ Ngọc Thuỵ, gần Mipec Long Biên, ẩm thực Ngọc Lâm, ngõ thông ô tô đỗ cửa. Chủ tự xây 4 tầng chắc chắn, đầy đủ công năng gồm có phòng khách, 4 phòng ngủ, wc, phòng thờ, sân phơi, nay có việc chuyển đi bán để lại toàn bộ nội thất, khách chỉ việc xách vali về ở.
Lh xem nhà:","4,1 tỷ",42 m2,"Đường Ngọc Thụy, Phường Ngọc Thụy, Quận Long Biên, Hà Nội",13055939,_,True,Cần bán,3m,True,Nhà trong hẻm,Sổ hồng/ Sổ đỏ,True,"3,9m",4,True,11m,4,---
https://alonhadat.com.vn/ban-nha-ngoc-thuy-long-bien-duong-ly-son-hoc-vien-hau-can-duong-thong-ngo-o-to-tranh--13626162.html,"Bán nhà Ngọc Thụy, Long Biên đường Lý Sơn, học viện Hậu Cần, đường thông, ngõ ô tô tránh,","BÁN NHÀ NGỌC THỤY, LONG BIÊN - ĐƯỜNG Ô TÔ TRÁNH - VUÔNG PHÂN LÔ
Hiện tại trên đất là nhà cấp 4 đang cho thuê, 33m2, MT 4,2m căn góc, đường ô bàn cờ, ngõ thông, ô tô tránh, 1 ngoặt là ra đường Lý Sơn cầu Đông Trù, thông với khu đô thị Khai Sơn, tái định cư Ngọc Thụy, khu vực đáng sống nhất quận Long Biên thời gian tới, 5p ra Ngọc Lâm, Nguyễn Văn Cừ, sang phố cổ
Sổ đỏ vuông vắn, vị trí đẹp, chờ sang tên, giá chào 3.65 tỷ có thương lượng
Vui lòng liên hệ để biết thêm thông tin chi tiết","3,65 tỷ",33 m2,"Đường Lý Sơn, Phường Ngọc Thụy, Quận Long Biên, Hà Nội",13626162,_,True,Cần bán,5m,True,Nhà trong hẻm,Sổ hồng/ Sổ đỏ,True,"4,2m",1,True,8m,1,---
https://alonhadat.com.vn/ban-dat-ngoc-thuy-long-bien-phan-lo-giao-vien-gan-tai-dinh-cu-ngoc-thuy-sat-vuon-hoa--13626020.html,"Bán đất Ngọc Thụy, Long Biên, phân lô giáo viên gần tái định cư Ngọc Thụy, sát vườn hoa,","ĐẤT PHÂN LÔ GIÁO VIÊN NGỌC THỤY, LONG BIÊN
Vị trí vàng, phân lô ô tô tránh, dùng đỗ ngày đêm, hàng xóm tái định cự Ngọc Thụy, gần vườn hoa công viên, sau hợp thành 1 quần thể bao gồm cả khu đô thị Khai Sơn sẽ là 1 nơi đáng sống bậc nhất Long Biên, với hàng loạt khu nhà ở, công viên, cây xanh, bên cạnh được bao quanh bởi dòng sông Đuống thơ mộng, cách 5p ra Ngọc Lâm, Nguyễn Văn Cừ, cầu Chương Dương, hưởng tiện ích 2 bên bờ sông Hồng
Mảnh đất 80m2, MT 4,5m vuông vắn, sổ đỏ chính chủ, sẵn sàng giao dịch. Giá chào nhỉnh 10 tỷ có thương lượng mạnh nếu khách thực sự thiện chí và chốt sớm
Vui lòng liên hệ để biết thêm thông tin chi tiết","10,5 tỷ",80 m2,"Đường Ngọc Thụy, Phường Ngọc Thụy, Quận Long Biên, Hà Nội",13626020,_,---,Cần bán,7m,---,"Đất thổ cư, đất ở",Sổ hồng/ Sổ đỏ,---,"4,5m",---,---,18m,---,---
https://alonhadat.com.vn/ban-dat-tdc-viet-hung-via-he-rong-o-to-tranh-thong-muon-nga-gia-12-ty-13386601.html,"Bán đất TĐC Việt Hưng, vỉa hè rộng, ô tô tránh, thông muôn ngả. Giá 12 tỷ","Bán đất tái định cư Việt Hưng, gần Vinhome, hồ Kim Quan, bệnh viện Đức Giang, trung tâm hành chính Long Biên...tiện ích bạt ngàn, giao thông thuận tiện
Lô đất 75m2, MT 4,5m vỉa hè rộng, đường ô tô tránh, xung quanh trường học, quán xá tấp nập
Pháp lý chuẩn, sổ đỏ sẵn sàng giao dịch, chủ thiện chí, giá chào 12 tỷ có TL trực tiếp",12 tỷ,75 m2,"Đường Mai Chí Thọ, Phường Việt Hưng, Quận Long Biên, Hà Nội",13386601,_,---,Cần bán,12m,---,"Đất thổ cư, đất ở",Sổ hồng/ Sổ đỏ,---,"4,5m",---,---,---,---,---
