https://alonhadat.com.vn/nha-cap-4-o-to-do-cua-vao-nha-no-hau-llq-tay-ho-110m2-mt-4-2m-dau-tu-qua-tot-8-9ty-13697380.html,"Nhà cấp 4, ô tô đỗ cửa, vào nhà, nở hậu, LLQ, Tây Hồ, 110m2, MT 4.2m đầu tư quá tốt 8.9tỷ","Bán đất tặng nhà cấp 4 phố Lạc Long Quân, quận Tây Hồ, thông tin chi tiết:
-	Nhà nằm trong ngõ 175 Lạc Long Quân, rất gần Hồ Tây, ngõ thông ra Võ Chí công, giao thông thuận tiện.
-	Trước nhà ngõ rộng, trải nhựa, ô tô đỗ cửa, vào nhà.
-	Diện tích sổ đỏ 100m2, thực tế trên 110 m2, mặt tiền hơn 4m.
-	Hiện trạng có nhà cấp 4 đang bỏ không.
-	Xác định bán đất tặng nhà. Thích hợp xây tòa nhà căn hộ 7 tầng, thang máy, vừa ở vừa cho thuê thì quá tuyệt vời. Xây nhà rồi được ở nhà đẹp lại có tiền tỷ mỗi năm tha hồ du lịch, nghỉ dưỡng khắp nơi, cuộc sống an nhà, trường thọ.
-	Sổ đẹp nở hậu. Giá bán chỉ 8.9 tỷ, có gia lộc cho khách thiện chí.
-	Liên hệ Nguyễn Cương(U50+), để xem nhà.","8,9 tỷ",110 m2,"Đường Lạc Long Quân, Phường Bưởi, Quận Tây Hồ, Hà Nội",13697380,_,---,Cần bán,5m,---,Nhà trong hẻm,Sổ hồng/ Sổ đỏ,---,"4,2m",1,---,20m,3,---,
