url,title,description,price,area,address,Mã tin,Hướng,Phòng ăn,Loại tin,Đường trước nhà,Nhà bếp,Loại BDS,Pháp lý,Sân thượng,Chiều ngang,Số lầu,Chổ để xe hơi,Chiều dài,Số phòng ngủ,Chính chủ
https://alonhadat.com.vn/ta-quang-buu-hiem-nha-ban-42m2-gan-pho-nha-dep-o-ngay-chi-3-51-ty--7534123.html,"Tạ Quang Bửu, Hiếm Nhà Bán 42m2, Gần Phố, Nhà Đẹp, Ở ngay, chỉ 3.51 tỷ.","* Vị trí: Gần các trường Đại học lớn như ĐH Bách khoa, Kinh tế Quốc dân, ĐH Xây dựng... khu vực nhiều khách tìm kiếm. Chỉ 5p lên phố cổ, xung quanh rất nhiều tiện ích.

* Thiết kế: Nhà 3 tầng, xây chắc chắn, cửa sổ rộng, sáng, thoáng thừa ánh sáng tự nhiên. Đầy đủ công năng sử dụng cho gia đình: Phòng khách, bếp, 3 phòng ngủ...

* Sổ đỏ chính chủ, chủ thiện chí bán, sang tên nhanh.

* LH minh Giang: Tư vấn, xem nhà miễn phí.","3,51 tỷ",42 m2,"Tạ Quang Bửu Phố Tạ Quang Bửu, Phường Bách Khoa, Quận Hai Bà Trưng, Hà Nội",7534123,_,True,Cần bán,3m,True,Nhà trong hẻm,Sổ hồng/ Sổ đỏ,True,"3,5m",3,True,---,3,---
https://alonhadat.com.vn/ban-nha-le-duan-dong-da-31m2-ngo-rong-dep-o-ngay-3-9-ty-13597681.html,"Bán nhà Lê Duẩn Đống Đa, 31m2, Ngõ Rộng, Đẹp Ở Ngay, 3.9 Tỷ","LÊ DUẨN, ĐỐNG ĐA - 31M2 XÂY 5 TẦNG - NGÕ RỘNG BA GÁC - MỚI ĐẸP Ở NGAY - 3.9 TỶ - Gọi Em Dũng để xem nhà

Các con muốn ở chung cư nên chủ nhà cần bán:
- Nhà phố Lê Duẩn, nằm trong ngõ rộng xe ba gác vào tận nhà.
- Diện tích 31m2, xây 5 tầng, 3 phòng ngủ rộng thoáng sáng. Hiện trạng nhà mới đẹp, sẵn nội thất cơ bản.
- Vị trí nhà thuận tiện, quanh nhà đủ mọi tiện ích, 10 phút lái xe tới Hồ Gươm.

GIÁ 3.9 TỶ - Gọi Em Dũng để xem nhà","3,9 tỷ",31 m2,"Đường Lê Duẩn, Phường Trung Phụng, Quận Đống Đa, Hà Nội",13597681,_,True,Cần bán,3m,True,Nhà trong hẻm,Sổ hồng/ Sổ đỏ,True,---,5,True,---,3,---
https://alonhadat.com.vn/hot-nha-thai-ha-37m2-ngo-rong-moi-dep-4-9-ty-13606919.html,"HOT! Nhà Thái Hà, 37m2, Ngõ Rộng, Mới Đẹp, 4.9 Tỷ","PHẢI THẬT NHANH MỚI KỊP!
NHÀ THÁI HÀ - 37M2 XÂY 4 TẦNG - NGÕ RỘNG - MỚI ĐẸP Ở LUÔN - 4.9 TỶ - Gọi Em Dũng để xem nhà.

- Nhà thuộc phố Thái Hà Đống Đa, vị trí đẹp, ngõ rộng thoáng.
- Diện tích 37m2, xây 4 tầng. Thiết kế cầu thang giữa 1 tầng chia 2 phòng, tổng 4 phòng ngủ.
- Sổ đỏ chính chủ, riêng biệt.

GIÁ 4.9 TỶ - Gọi Em Dũng để xem nhà.","4,9 tỷ",37 m2,"Phố Thái Hà, Phường Trung Liệt, Quận Đống Đa, Hà Nội",13606919,_,True,Cần bán,2m,True,Nhà trong hẻm,Sổ hồng/ Sổ đỏ,True,---,4,True,---,4,---
https://alonhadat.com.vn/nha-moi-xa-dan-35m-ngo-to-rong-gan-o-to-hon-4-ty-13626931.html,"Nhà Mới Xã Đàn, 35m, Ngõ To Rộng, Gần Ô Tô, Hơn 4 Tỷ","DUY NHẤT 1 CĂN! - XÃ ĐÀN, ĐỐNG ĐA - 35M2 XÂY 5 TẦNG - NGÕ TO RỘNG, GẦN ĐƯỜNG Ô TÔ TRÁNH - 3 MẶT THOÁNG - 4.2 TỶ - Gọi Em Dũng để xem nhà

- Nhà nằm trên phố Xã Đàn, trục đường chính quận Đống Đa. Ngõ to rộng, đường vào nhà xe ba gác tránh xe máy. Vị trí vài bước ra đường ô tô tránh nhau.
- Diện tích 35m2, xây 5 tầng, 3 phòng ngủ thoáng sáng.
- Nhà xây 1 căn duy nhất, tường riêng móng riêng. Nhà mới giá nhỉnh 4 tỷ ở Đống Đa cực kỳ hiếm, chỉ 1 căn.

GIÁ 4.2 TỶ có thương lượng - Gọi Em Dũng để xem nhà","4,2 tỷ",35 m2,"Phố Xã Đàn, Phường Ô Chợ Dừa, Quận Đống Đa, Hà Nội",13626931,_,True,Cần bán,3m,True,Nhà trong hẻm,Sổ hồng/ Sổ đỏ,True,---,5,True,---,3,---
https://alonhadat.com.vn/ban-nha-hao-nam-35m2-ngo-o-to-tranh-moi-dep-o-ngay-hon-4-ty-13627210.html,"Bán nhà Hào Nam, 35m2, Ngõ Ô Tô Tránh, Mới Đẹp Ở Ngay, Hơn 4 Tỷ","NHÀ HÀO NAM, ĐỐNG ĐA - 35M2 XÂY 4 TẦNG - VÀI BƯỚC RA ĐƯỜNG Ô TÔ TRÁNH - MỚI ĐẸP Ở NGAY - 4.75 TỶ - Gọi Em Dũng để xem nhà

Con trai đi du học không ở cần bán nhà phố Hào Nam, quận Đống Đa.
- Ngõ rộng Ô tô tránh nhau, dừng đỗ cách nhà mình chỉ 20m. Đường trước nhà 4m, xe ba gác quay đầu trước nhà.
- Diện tích 35m2, xây 4 tầng. Nhà xây độc lập chắc chắn, thiết kế 3 phòng ngủ rộng thoáng sáng.
- Sổ đỏ chính chủ, thửa đất vuông vắn.

GIÁ 4.75 TỶ có thương lượng - Gọi Em Dũng để xem nhà","4,75 tỷ",35 m2,"Phố Hào Nam, Phường Cát Linh, Quận Đống Đa, Hà Nội",13627210,_,True,Cần bán,4m,True,Nhà trong hẻm,Sổ hồng/ Sổ đỏ,True,---,4,True,---,3,---
https://alonhadat.com.vn/nha-xa-dan-35m2-ngo-thong-o-to-gan-dep-o-ngay-4-55-ty-13657550.html,"Nhà Xã Đàn, 35m2, Ngõ Thông, Ô Tô Gần, Đẹp Ở Ngay, 4.55 Tỷ","NHÀ XÃ ĐÀN, ĐỐNG ĐA - NGÕ THÔNG RỘNG, GẦN Ô TÔ - 35M2 XÂY 4 TẦNG - MỚI ĐẸP - 4.55 TỶ - Gọi Em Dũng để xem nhà

Cần bán nhà phố Xã Đàn, Đống Đa.
- Vị trí đẹp, ngõ rộng ba gác, ô tô dừng đỗ cách nhà 20m.
- Diện tích 35m2, xây 4 tầng, 3 phòng ngủ rộng thoáng sáng.
- Hiện trạng nhà còn mới, dọn đồ về ở ngay.
- Sổ đỏ riêng biệt, pháp lý rõ ràng.

GIÁ 4.55 TỶ - Gọi Em Dũng để xem nhà","4,55 tỷ",35 m2,"Phố Xã Đàn, Phường Kim Liên, Quận Đống Đa, Hà Nội",13657550,_,True,Cần bán,3m,True,Nhà trong hẻm,Sổ hồng/ Sổ đỏ,True,---,4,True,---,3,---
https://alonhadat.com.vn/nha-de-la-thanh-34m2-ngo-o-to-tranh-moi-dep-4-75-ty-13657434.html,"Nhà Đê La Thành, 34m2, Ngõ Ô Tô Tránh, Mới Đẹp, 4.75 Tỷ","BÁN NHÀ ĐÊ LA THÀNH, HÀO NAM - 34M2 XÂY 4 TẦNG - NGÕ THÔNG, GẦN ĐƯỜNG Ô TÔ - MỚI ĐẸP - 4.75 TỶ - Gọi Em Dũng để xem nhà.

Bán nhà địa chỉ phố Đê La Thành, nằm ngay ngã tư Hào Nam, Ô Chợ Dừa.
- Ngõ Ô Tô Tránh nhau, dừng đỗ cách nhà mình chỉ vài bước chân.
- Đường vào nhà rộng 4m, xe ba gác vào tận cửa nhà.
- Diện tích 34m2, xây 4 tầng, đủ 3 phòng ngủ rộng thoáng mát.
- Sổ đỏ chính chủ.

GIÁ 4.75 TỶ có TL - Gọi Em Dũng để xem nhà.","4,75 tỷ",34 m2,"Đường Đê La Thành, Phường Ô Chợ Dừa, Quận Đống Đa, Hà Nội",13657434,_,True,Cần bán,3m,True,Nhà trong hẻm,Sổ hồng/ Sổ đỏ,True,---,4,True,---,3,---
https://alonhadat.com.vn/nha-pham-ngoc-thach-33m2-ngo-rong-hai-thoang-moi-dep-4-35-ty-13657661.html,"Nhà Phạm Ngọc Thạch, 33m2, Ngõ Rộng, Hai Thoáng, Mới Đẹp, 4.35 Tỷ","SIÊU HIẾM! - NHÀ PHẠM NGỌC THẠCH - 33M2 XÂY 5 TẦNG - NGÕ RỘNG - HAI THOÁNG - MỚI ĐẸP - 4.35 TỶ - Gọi Em Dũng để xem nhà

Bán nhà phố Phạm Ngọc Thạch, Xã Đàn, quận Đống Đa.
- Vị trí lô góc hai mặt thoáng, ngõ rộng xe ba gác tránh xe máy thoải mái.
- Diện tích 33m2 x 5 Tầng, nhà mới xây 1 căn duy nhất. Thiết kế 1 tầng 1 phòng rộng, 3 phòng ngủ.
- Sổ đỏ riêng, pháp lý sạch.

GIÁ 4.35 TỶ - Gọi Em Dũng để xem nhà","4,35 tỷ",33 m2,"Phố Phạm Ngọc Thạch, Phường Kim Liên, Quận Đống Đa, Hà Nội",13657661,_,True,Cần bán,3m,True,Nhà trong hẻm,Sổ hồng/ Sổ đỏ,True,---,5,True,---,3,---
https://alonhadat.com.vn/nha-trung-phung-xa-dan-35m2-ngo-rong-hai-mat-thoang-4-1-ty-13594374.html,"Nhà Trung Phụng Xã Đàn, 35m2, Ngõ Rộng, Hai Mặt Thoáng, 4.1 Tỷ","HIẾM!!! - NHÀ TRUNG PHỤNG, XÃ ĐÀN - 35M2 XÂY 5 TẦNG - NGÕ RỘNG - GẦN ĐƯỜNG - HAI MẶT THOÁNG - 4.1 TỶ - Gọi Em Dũng để xem nhà.

Nhà thuộc phố Trung Phụng, Xã Đàn, quận Đống Đa.
- Vị trí đẹp, lô góc 2 mặt thoáng sáng. Đường ngõ to rộng, trước nhà 3m để xe thoải mái.
- Diện tích 35m2, xây 5 tầng. Thiết kế mỗi tầng một phòng rộng, tổng 3 phòng ngủ. 
- Khu vực ở rất thích, vài bước ra chợ, bãi gửi ô tô...
- Sổ đỏ riêng, pháp lý rõ ràng.

GIÁ 4.1 TỶ - Gọi em Dũng để xem nhà.","4,1 tỷ",35 m2,"Phố Trung Phụng, Phường Trung Phụng, Quận Đống Đa, Hà Nội",13594374,_,True,Cần bán,3m,True,Nhà trong hẻm,Sổ hồng/ Sổ đỏ,True,---,5,True,---,3,---
https://alonhadat.com.vn/nha-nguyen-luong-bang-38m2-ngo-thong-rong-thoang-truoc-sau-4-7-ty-13594417.html,"Nhà Nguyễn Lương Bằng, 38m2, Ngõ Thông Rộng, Thoáng Trước Sau, 4.7 Tỷ","QUÁ NGON! - NHÀ NGUYỄN LƯƠNG BẰNG, ĐỐNG ĐA - 38M XÂY 4 TẦNG - NGÕ THÔNG RỘNG - THOÁNG TRƯỚC SAU - MỚI ĐẸP - 4.7 TỶ - Gọi Em Dũng để xem nhà.

Gia chủ cần bán nhà phố Nguyễn Lương Bằng, Đống Đa.
- Vị trí đẹp, chỉ cách 100m ra mặt phố. Ngõ thông, đường trước nhà rộng thoáng sáng.
- Diện tích 38m2, xây 4 tầng. Nhà còn mới, thoáng trước thoáng sau, 4 phòng ngủ đều có cửa sổ.
- Xung quanh nhà đầy đủ tiện ích: Chợ, Vườn Hoa, Bãi gửi Ô Tô, Bệnh viện Đống Đa, Trạm Xăng...
- Sổ đỏ riêng.

GIÁ 4.7 TỶ - Gọi Em Dũng để xem nhà","4,7 tỷ",38 m2,"Phố Nguyễn Lương Bằng, Phường Nam Đồng, Quận Đống Đa, Hà Nội",13594417,_,True,Cần bán,3m,True,Nhà trong hẻm,Sổ hồng/ Sổ đỏ,True,---,4,True,---,4,---
https://alonhadat.com.vn/nha-ton-duc-thang-35m-ngo-nong-gan-pho-moi-dep-4-4-ty-13590024.html,"Nhà Tôn Đức Thắng, 35m, Ngõ Nông, Gần Phố, Mới Đẹp, 4.4 TỶ","SIÊU HIẾM! -  NHÀ TÔN ĐỨC THẮNG, ĐỐNG ĐA - 35M2 XÂY 5 TẦNG - NGÕ NÔNG, GẦN PHỐ - MỚI 100% - 4.4 TỶ - Gọi Em Dũng để xem nhà.

Nhà thuộc phố Tôn Đức Thắng, quận Đống Đa.
- Ngõ nông, vị trí nhà rất gần đường. Trước nhà rộng thoáng đón ánh sáng tự nhiên.
- Diện tích 35m2, xây 5 tầng. Nhà xây mới, thiết kế 1 tầng 1 phòng rộng.
- Bán kính 500m quanh nhà đầy đủ mọi tiện ích: Chợ Quan Thổ, Trường học các cấp, bãi gửi ô tô...
- Sổ đỏ riêng biệt.

GIÁ 4.4 TỶ - Gọi Em Dũng để xem nhà.","4,4 tỷ",35 m2,"Phố Tôn Đức Thắng, Phường Hàng Bột, Quận Đống Đa, Hà Nội",13590024,_,True,Cần bán,3m,True,Nhà trong hẻm,Sổ hồng/ Sổ đỏ,True,4m,5,True,---,3,---
https://alonhadat.com.vn/ban-nha-xa-dan-33m2-ngo-thong-duong-to-rong-moi-dep-4-2-ty-13589897.html,"Bán Nhà Xã Đàn, 33m2, Ngõ Thông, Đường To Rộng, Mới Đẹp, 4.2 Tỷ","NHÀ XÃ ĐÀN, ĐỐNG ĐA - 33M2 XÂY 5 TẦNG - NGÕ THÔNG - ĐƯỜNG TO RỘNG - MỚI ĐẸP - 4.2 TỶ - Gọi Em Dũng để xem nhà.

Nhà thuộc phố Xã Đàn, quận Đống Đa.
- Vị trí Lô góc cửa sổ thoáng sáng 3 mặt. Ngõ to rộng, đi vài bước ra đường ô tô tránh nhau.
- Diện tích 33m2, xây 5 tầng, mặt tiền rộng 4m. Hiện trạng nhà mới tinh, sẵn nội thất cơ bản, 3 phòng ngủ lớn thông sàn.
- Nằm trong khu vực yên tĩnh, phù hợp để ở lâu dài. Nhà gần Chợ, trường học các cấp, gần công an phường an ninh 10 điểm.
- Sổ đỏ chính chủ, nở hậu. 

GIÁ 4.2 TỶ có thương lượng - Gọi Em Dũng để xem nhà.","4,2 tỷ",33 m2,"Phố Xã Đàn, Phường Kim Liên, Quận Đống Đa, Hà Nội",13589897,_,True,Cần bán,3m,True,Nhà trong hẻm,Sổ hồng/ Sổ đỏ,True,3m,5,True,---,3,---
https://alonhadat.com.vn/sieu-hiem-ban-nha-mat-pho-thai-ha-dong-da-2-mat-thoang-4-tang-kd-gia-7-ty--13623412.html,"SIÊU HIẾM ! BÁN NHÀ  MẶT PHỐ  THÁI  HÀ , ĐỐNG ĐA , 2 MẶT THOÁNG , 4 TẦNG , KD  , GIÁ 7 TỶ.","- Siêu phẩm cực hiếm mặt phố Thái Hà , nhà sở hữu 2 mặt thoáng ,1 mặt phố Thái Hà và 1 mặt ngõ , tọa lạc tại vị trí đẹp , khu vip ,đường rộng , vỉa hè thênh thang ,  kinh doanh mọi hình thức 
-Tọa lạc tại mặt phố Thái Hà . Là tuyến phố có nhịp độ phát triển mạnh, hoạt động kinh doanh buôn bán cực kỳ phát triển. Trên đường có nhiều tòa nhà văn phòng và khu chung cư lớn. Phù hợp vừa ở vừa kinh doanh thời trang , điện tử viễn thông , showroom đại lý ủy quyền ...
- Vị trí đắc địa của quận  Đống Đa , ô tô chạy vòng quanh , đầy đủ các mặt hàng kinh doanh buôn bán từ những mặt hàng đơn giản đến những mặt hàng vip , không thiếu thứ gì,di chuyển thuận lợi sang các phố chính : Tây Sơn , Láng Hạ, Hoàng Cầu , Láng , Huỳnh Thúc Kháng ,..chỉ trong một nốt nhạc.
-Gia đình xây  4 tầng , tầng 1 kinh doanh , các tầng trên 3 ngủ đầy đủ công năng vừa ở vừa kinh doanh . 
Nhà có 2 mặt thoáng trước sau  , 1 mặt phố Thái Hà , mặt sau là ngõ nên rát thoáng mát . Cac phòng đều có cửa sổ và ban công . 
- Nhà sổ đỏ chính chủ , vuông vắn , không quy hoạch , 
- Giá bán  7 tỷ 
- Liên hệ em  Quỳnh Nga  .",7 tỷ,20 m2,"Phố Thái Hà, Phường Trung Liệt, Quận Đống Đa, Hà Nội",13623412,Đông Bắc,---,Cần bán,48m,---,Nhà mặt tiền,Sổ hồng/ Sổ đỏ,---,3m,4,---,"6,5m",3,---
https://alonhadat.com.vn/ban-nha-thai-ha-dong-da-125m-5-tang-mat-tien-8m-gia-15-ty-nha-pho-kinh-doanh-10310402.html,Bán Nhà Thái Hà Đống Đa 125m 5 tầng mặt tiền 8m giá 15 tỷ nhà phố kinh doanh,"Bán Nhà Thái Hà Đống Đa 125m 5 tầng mặt tiền 8m giá 15 tỷ nhà phố kinh doanh
 Chính chủ Bán Nhà Phố Thái Hà Đống Đa Hà Nội, 125m2 nhà xây 5 tầng mặt tiền 8m. kinh doanh Khu phố Thái Hà Đống Đa, thuộc vùng lõi quận Đống Đa, dân trí cáo tiện ích văn minh, Buôn bán sầm uất, Hiện đang vừa ở vừa cho thuê kinh doanh. Chủ nhà cao tuổi muốn bán nhà chia cho các con về quê vui với tuổi già. Quê hai bác là người miền Nam ra Hà nội làm việc công tác nay nghỉ hưu muốn về quê, các con cháu đều công tác làm việc ở Sài Gòn nền cũng ko có nhu cầu nhà ở Hà Nội. Nhà chủ tự xây dựng vô cùng chắc chắn.
 Tầng 1 Gara ô tô, kinh doanh, tầng 2 thông sàn kinh doanh, các tầng trên hiện tại chủ đang cho thuê , chủ giữ lại một tầng trên cung để ở 
Ưu điểm: Nhà phố Thái Hà, kinh doanh. Nhược điểm: Nhà 5 tầng chưa lắp tháng máy.
 Sổ đỏ chính chủ vuông đẹp sẵn sàng giao dịch.
Giá bán 15 tỷ 125m2 nhà  5 tầng nhà đẹp kinh doanh phố Thái Hà. Giá  có thương lượng, Liên hệ Em Hưng-09-65.343.816- để được mở cửa xem trong nhà. Không tiếp môi giới trung gian.",15 tỷ,125 m2,"Phố Thái Hà, Phường Trung Liệt, Quận Đống Đa, Hà Nội",10310402,_,---,Cần bán,12m,---,Nhà mặt tiền,---,---,8m,5,---,15m,8,---
https://alonhadat.com.vn/-8-ty-ban-nha-nga-tu-so-nguyen-trai-cong-moc-giap-nhat-72m-5-tang-phan-lo-kinh-doanh-o-to-11446718.html,.8 tỷ Bán Nhà Ngã Tư Sở Nguyễn Trãi Cống Mộc Giáp Nhất 72m 5 tầng phân lô Kinh Doanh ô tô,"9.8 tỷ Bán Nhà Ngã Tư Sở Nguyễn Trãi Cống Mộc Giáp Nhất 72m 5 tầng phân lô Kinh Doanh ô tô vào Nhà
  Bán Nhà Ngã Tư Sở - Royal City - Nguyễn Trãi – Cống Mộc – Giáp Nhất- Quan Nhân, 72m2 5 tầng nhà phân lô mặt tiền rộng 6m kinh doanh ôtô vào nhà , đường trước nhà rộng rãi ô tô  tránh . Nhà xây dựng chắc chắn thuận tiện vừa ở vừa kinh doanh, tầng kinh doanh, phòng bếp + nhà WC, tầng 2 đến tầng 5 là phòng khách và 3 phòng ngủ khép kín, Thiết bị vệ sinh nóng lạnh đầy đủ, nội thất tiện nghi đầy đủ. Tum phòng thờ sân phơi.
 Nhà có giao thông thuận tiện đi lại thuận tiện, Ngã Tư Sở - Royal City - Nguyễn Trãi – Giáp Nhất- Quan Nhân – Kinh doanh thuận lợi khu vực dân cư đông đúc, sang nhà là khu cung cư hầm để xe ngày đêm- Dân Trí cao văn minh- Hạ tầng Đồng Bộ Đường rộng vỉa hè kinh doanh- Trung tâm thương mại đầy đủ cách nhà vài bước chân –trường học – đường sắt trên cao..vv.
 Chủ nhà là cán bộ đã nghỉ hưu nay bán nhà chia tài sản cho con cái về quê nhà an dưỡng tuổi già
Sổ đỏ chính chủ vuông đẹp sẵn sàng giao dịch.
Giá bán 9.8 tỷ có thường lượng nhà 72m2 nhà  5 tầng  phân lô kinh doanh ô tô vào nhà mặt tiền siều rộng 6m
Liên hệ Em Hưng-09-65.343.816- để được mở cửa xem trong nhà. Không tiếp môi giới trung gian.","9,8 tỷ",72 m2,"Thanh Xuân Hà Nội Đường Nguyễn Trãi, Phường Nhân Chính, Quận Thanh Xuân, Hà Nội",11446718,_,---,Cần bán,12m,---,Nhà mặt tiền,Sổ hồng/ Sổ đỏ,---,6m,5,---,12m,3,---
https://alonhadat.com.vn/chi-2-45ty-x5t-oto-do-cong-moi-dep-ban-nha-phu-luong-ha-dong-lh-24-7--13263268.html,"chỉ 2.45tỷ x5T, OTO Đỗ Cổng, Mới - Đẹp, Bán Nhà Phú Lương Hà Đông,  Lh: (24/7).","+ Chính chủ bán nhà mặt ngõ OTO, Phú Lương, Hà Đông, nhà đẹp, về ở ngay, 100m ra chợ, 300m ra đường QL21B, gần ĐH Đại Nam, gần Trường Mầm Non, C1, C2, C3..đi xe Bus cũng tiện lợi.
+ Nhà 4 tầng x 35m2, thiết kế tinh tế, có 4 Phòng Đẹp, Bếp… thông thoáng, tiện ích đấy đủ. 
+ Sổ đỏ chính chủ, chỉ: 2.45 tỷ.
+ Liên hệ với Sinh Hado – Nhà Đẹp Hà Đông.","2,45 tỷ",35 m2,"Đường Phú Lương, Phường Phú Lương, Quận Hà Đông, Hà Nội",13263268,_,True,Cần bán,5m,True,"Đất thổ cư, đất ở",Sổ hồng/ Sổ đỏ,True,5m,5,True,---,---,---
https://alonhadat.com.vn/ban-biet-thu-nguyen-van-cu-9-7-ty-12568218.html,Bán biệt thự Nguyễn Văn Cừ - 9.7 tỷ,"Gia đình cần bán gấp trong tháng biệt thự Nguyễn Văn Cừ- xe hơi chạy qua nhà. Diện tích 125m2. Phù hợp mọi nhu cầu: mua ở- biệt thự xây chắc chắn chỉ cần sửa theo mong muốn, hoặc mua xây căn hộ cho thuê- vì vị trí quá tốt. 
Trong tháng này khách nào có tiền mặt có thể thương lượng giá tốt.
BBB Group
Phòng mua&bán
Nhận kí gửi bds bán và cho thuê - Nhận tìm nhà theo yêu cầu.","9,7 tỷ",125 m2,"Đường Nguyễn Văn Cừ, Phường Ngọc Lâm, Quận Long Biên, Hà Nội",12568218,_,---,Cần bán,6m,---,"Biệt thự, nhà liền kề",---,---,---,3,---,---,4,---
https://alonhadat.com.vn/ban-nha-mat-pho-quan-nhan-doan-xung-nhat-13218716.html,"Bán nhà mặt phố Quan Nhân, đoạn xung nhất","Giá chỉ 170tr/m2. Bằng nhà hẻm. Nhưng là mặt phố Quan Nhân, diện tích 65m2. Tiện xây 7 tầng cho thuê đa ngành nghề
Nhận kí gửi bất động sản trung tâm quận Đống Đa, Ba Đình, Hoàn Kiếm, Cầu Giấy, Thanh Xuân, HBT, Hoàng Mai ……– mua bán trong ngày
KOLA Agent","10,9 tỷ",65 m2,"Phố Quan Nhân, Phường Nhân Chính, Quận Thanh Xuân, Hà Nội",13218716,_,---,Cần bán,12m,---,Nhà mặt tiền,---,---,---,2,---,---,3,---
https://alonhadat.com.vn/nha-hoang-ngan-so-do-60m-lo-goc-2thoang-ngo-vao-nha-rong-3m-rat-gan-o-to-no-hau-nhe-13672728.html,"Nhà Hoàng Ngân sổ đỏ 60m lô góc 2thoáng, ngõ vào nhà rộng 3m, rất gần ô tô nở hậu nhẹ","Bán nhà Hoàng Ngân lô góc 2 thoáng - Diện tích sổ đỏ 60m x 4 tầng x MT 4,3m
Giá 6,8 tỷ - sổ đỏ nở hậu - ngõ 3m rất gần ô tô
+ Nhà dân xây kiểu nồi đồng cối đá, bê tông cốt thép vô cùng kiên cố.
Thiết kế:,
- T1: sân để xe, phòng khách, bếp, VS,
- T2,3: mỗi tầng 2 phòng, VS giữa,
- T4: Sân phơi, tum,
• Sổ đỏ rất đẹp, nở hậu nhẹ không có lỗi phong thuỷ.","6,8 tỷ",60 m2,"Đường Hoàng Ngân, Phường Nhân Chính, Quận Thanh Xuân, Hà Nội",13672728,_,---,Cần bán,3m,---,Nhà trong hẻm,Sổ hồng/ Sổ đỏ,---,"4,3m",4,---,13m,4,---
https://alonhadat.com.vn/lo-goc-3-mat-thoang-sieu-pham-dong-da-nhinh-8-ty-k134-8138605.html,THÁI HÀ - TOÀ VĂN PHÒNG TRUNG TÂM ĐỐNG ĐA - MỚI ĐẸP LONG LANH - Ô TÔ - GẦN PHỐ - THÔNG SÀN,"THÁI HÀ - TOÀ VĂN PHÒNG TRUNG TÂM ĐỐNG ĐA - MỚI ĐẸP LONG LANH - Ô TÔ - GẦN PHỐ - THÔNG SÀN - THANG MÁY.
+ Vị trí trung tâm Đống Đa, con phố sầm uất bậc nhất Thủ đô, tập trung nhiều văn phòng, ô tô, cách phố 30m.
+ Nhà mới đẹp long lanh, hiện đại, nội thất xịn sò, thông sàn, thang máy, sổ đã hoàn công, đầy đủ PCCC. 
- Kinh doanh văn phòng đỉnh. Chủ hiện để không tiện giao dịch.
+ Sổ đỏ siêu đẹp, nằm sẵn trong két chờ khách.
- Diện tích: 96m, 8 tầng, mặt tiền 6m6.
- Gía: 31ty99.
- Thông tin chính xác, tiết kiệm thời . Giao dịch ngay.
- Liên hệ Hotline Em Khanh để biết thêm chi tiết, tư vấn nồng nhiệt nhất, tận tâm, chuyên nghiệp, miễn phí xem nhà 24/7.

K1",32 tỷ,95 m2,"Phố Thái Hà, Phường Trung Liệt, Quận Đống Đa, Hà Nội",8138605,_,True,Cần bán,6m,True,Nhà trong hẻm,Sổ hồng/ Sổ đỏ,True,"6,6m",8,True,12m,8,---
